A1: Patrocinadores

B1: Motos e Acessórios Honda - Rua Sete de Setembro, 387 - Fone: (15) 3331-6700.

A1: 1 Bateria
A2: Piloto | B2: Pi | C2: Tempo | D2: Voltas | E2: Pi | F2: Tempo | G2: Voltas | H2: Pi | I2: Tempo | J2: Voltas | K2: Pi | L2: Tempo | M2: Voltas | N2: Pi | O2: Tempo | P2: Voltas | Q2: Pi | R2: Tempo | S2: Voltas | T2: Pi | U2: Tempo | V2: Voltas | W2: Pi | X2: Tempo | Y2: Voltas | Z2: Total | AA2: Media | AB2: Record
A3: NETO | B3: 3 | C3: 4.6208 | D3: 35.53 | E3: 5 | F3: 4.8388 | G3: 35.49 | H3: 7 | I3: 4.6208999999999998 | J3: 33.45 | K3: 8 | L3: 4.8254000000000001 | M3: 30.97 | N3: 6 | O3: 4.8411999999999997 | P3: 31.09 | Q3: 4 | R3: 4.8343999999999996 | S3: 35.22 | T3: 2 | U3: 4.8240999999999996 | V3: 36.45 | W3: 1 | X3: 4.8399000000000001 | Y3: 35.31 | Z3: =+Y3+V3+S3+P3+M3+J3+G3+D3 -> 273.51 | AA3: =+(X3+U3+R3+O3+L3+I3+F3+C3)/8 -> 4.7806875 | AB3: =MINA(X3,U3,R3,O3,L3,I3,F3,C3) -> 4.6208
A4: GIOVANNI | B4: 1 | C4: 5.0585000000000004 | D4: 34.21 | E4: 3 | F4: 5.0606999999999998 | G4: 30.26 | H4: 5 | I4: 5.1163999999999996 | J4: 27.63 | K4: 7 | L4: 4.8917999999999999 | M4: 31.29 | N4: 8 | O4: 5.0053000000000001 | P4: 33.61 | Q4: 6 | R4: 5.0430999999999999 | S4: 31.46 | T4: 4 | U4: 4.8296999999999999 | V4: 35.32 | W4: 2 | X4: 4.8255999999999997 | Y4: 34.05 | Z4: =+Y4+V4+S4+P4+M4+J4+G4+D4 -> 257.83 | AA4: =+(X4+U4+R4+O4+L4+I4+F4+C4)/8 -> 4.9788874999999999 | AB4: =MINA(X4,U4,R4,O4,L4,I4,F4,C4) -> 4.8255999999999997
A5: SAPAO | B5: 8 | C5: 5.0597000000000003 | D5: 29.79 | E5: 6 | F5: 5.0571999999999999 | G5: 32.44 | H5: 4 | I5: 4.8268000000000004 | J5: 26.6 | K5: 2 | L5: 4.8391000000000002 | M5: 34.06 | N5: 1 | O5: 4.7845000000000004 | P5: 34.78 | Q5: 3 | R5: 4.6208 | S5: 35.08 | T5: 5 | U5: 4.84 | V5: 31.73 | W5: 7 | X5: 4.7851999999999997 | Y5: 32.21 | Z5: =+Y5+V5+S5+P5+M5+J5+G5+D5 -> 256.69 | AA5: =+(X5+U5+R5+O5+L5+I5+F5+C5)/8 -> 4.8516624999999998 | AB5: =MINA(X5,U5,R5,O5,L5,I5,F5,C5) -> 4.6208
A6: COISA PRETA | B6: 7 | C6: 5.0583999999999998 | D6: 27.26 | E6: 8 | F6: 5.0602 | G6: 25.49 | H6: 6 | I6: 5.0594999999999999 | J6: 30.48 | K6: 4 | L6: 4.8403 | M6: 30.69 | N6: 2 | O6: 4.8945999999999996 | P6: 33.74 | Q6: 1 | R6: 4.8404999999999996 | S6: 32.29 | T6: 3 | U6: 4.9505999999999997 | V6: 34.88 | W6: 5 | X6: 5.1676000000000002 | Y6: 30.29 | Z6: =+Y6+V6+S6+P6+M6+J6+G6+D6 -> 245.12 | AA6: =+(X6+U6+R6+O6+L6+I6+F6+C6)/8 -> 4.9839624999999996 | AB6: =MINA(X6,U6,R6,O6,L6,I6,F6,C6) -> 4.8403
A7: LUIZ FELIPE | B7: 5 | C7: 4.8962000000000003 | D7: 31.34 | E7: 7 | F7: 5.0561999999999996 | G7: 30.7 | H7: 8 | I7: 4.8402000000000003 | J7: 29.62 | K7: 6 | L7: 4.9504000000000001 | M7: 24.29 | N7: 4 | O7: 5.0579000000000001 | P7: 31.26 | Q7: 2 | R7: 4.8414000000000001 | S7: 29.13 | T7: 1 | U7: 5.0057 | V7: 32.49 | W7: 3 | X7: 4.9516 | Y7: 29.76 | Z7: =+Y7+V7+S7+P7+M7+J7+G7+D7 -> 238.59 | AA7: =+(X7+U7+R7+O7+L7+I7+F7+C7)/8 -> 4.9499500000000003 | AB7: =MINA(X7,U7,R7,O7,L7,I7,F7,C7) -> 4.8402000000000003
A8: LUIZ PROPART | B8: 2 | C8: 5.0601000000000003 | D8: 31.23 | E8: 1 | F8: 5.0629999999999997 | G8: 30.42 | H8: 3 | I8: 5.2662000000000004 | J8: 30.51 | K8: 5 | L8: 5.4425999999999997 | M8: 24.07 | N8: 7 | O8: 5.2251000000000003 | P8: 31.19 | Q8: 8 | R8: 5.5007000000000001 | S8: 26.49 | T8: 6 | U8: 5.2801 | V8: 30.2 | W8: 4 | X8: 4.8956 | Y8: 30.55 | Z8: =+Y8+V8+S8+P8+M8+J8+G8+D8 -> 234.66 | AA8: =+(X8+U8+R8+O8+L8+I8+F8+C8)/8 -> 5.2166749999999995 | AB8: =MINA(X8,U8,R8,O8,L8,I8,F8,C8) -> 4.8956
A9: MANE | B9: 4 | C9: 4.6750999999999996 | D9: 34.31 | E9: 2 | F9: 4.7302 | G9: 33.19 | H9: 1 | I9: 4.8392999999999997 | J9: 28.88 | K9: 3 | L9: 4.8406000000000002 | M9: 22.55 | N9: 5 | O9: 4.8404999999999996 | P9: 32.46 | Q9: 7 | R9: 4.1840999999999999 | S9: 25.28 | T9: 8 | U9: 5.0609000000000002 | V9: 22.11 | W9: 6 | X9: 5.0591999999999997 | Y9: 27.44 | Z9: =+Y9+V9+S9+P9+M9+J9+G9+D9 -> 226.22 | AA9: =+(X9+U9+R9+O9+L9+I9+F9+C9)/8 -> 4.7787375000000001 | AB9: =MINA(X9,U9,R9,O9,L9,I9,F9,C9) -> 4.1840999999999999
A10: TONI | B10: 6 | C10: 4.9492000000000003 | D10: 15.59 | E10: 4 | F10: 4.8379000000000003 | G10: 33.46 | H10: 2 | I10: 4.8360000000000003 | J10: 27.34 | K10: 1 | L10: 5.0575999999999999 | M10: 17.29 | N10: 3 | O10: 4.6197999999999997 | P10: 33.45 | Q10: 5 | R10: 4.8411 | S10: 33.26 | T10: 7 | U10: 4.8391000000000002 | V10: 31.52 | W10: 8 | X10: 4.8376000000000001 | Y10: 33.62 | Z10: =+Y10+V10+S10+P10+M10+J10+G10+D10 -> 225.53 | AA10: =+(X10+U10+R10+O10+L10+I10+F10+C10)/8 -> 4.8522874999999992 | AB10: =MINA(X10,U10,R10,O10,L10,I10,F10,C10) -> 4.6197999999999997
A11: 2 Bateria
A12: Piloto | B12: Pi | C12: Tempo | D12: Voltas | E12: Pi | F12: Tempo | G12: Voltas | H12: Pi | I12: Tempo | J12: Voltas | K12: Pi | L12: Tempo | M12: Voltas | N12: Pi | O12: Tempo | P12: Voltas | Q12: Pi | R12: Tempo | S12: Voltas | T12: Pi | U12: Tempo | V12: Voltas | W12: Pi | X12: Tempo | Y12: Voltas | Z12: Total | AA12: Media | AB12: Record
A13: EVANDRO | B13: 4 | C13: 4.6054000000000004 | D13: 36.94 | E13: 2 | F13: 4.6173999999999999 | G13: 35.78 | H13: 1 | I13: 4.6768999999999998 | J13: 34.94 | K13: 3 | L13: 4.6177999999999999 | M13: 35.1 | N13: 5 | O13: 4.8253000000000004 | P13: 32.75 | Q13: 7 | R13: 4.6208999999999998 | S13: 36.07 | T13: 8 | U13: 4.8394000000000004 | V13: 34.76 | W13: 6 | X13: 4.6199000000000003 | Y13: 37.27 | Z13: =+Y13+V13+S13+P13+M13+J13+G13+D13 -> 283.61 | AA13: =+(X13+U13+R13+O13+L13+I13+F13+C13)/8 -> 4.6778750000000002 | AB13: =MINA(X13,U13,R13,O13,L13,I13,F13,C13) -> 4.6054000000000004
A14: ERIC | B14: 5 | C14: 4.7305999999999999 | D14: 34.61 | E14: 7 | F14: 4.7864000000000004 | G14: 34.57 | H14: 8 | I14: 4.8403 | J14: 33.54 | K14: 6 | L14: 4.7835999999999999 | M14: 32.22 | N14: 4 | O14: 4.8385999999999996 | P14: 32.59 | Q14: 2 | R14: 4.84 | S14: 34.45 | T14: 1 | U14: 4.8947000000000003 | V14: 32.54 | W14: 3 | X14: 4.7847 | Y14: 34.89 | Z14: =+Y14+V14+S14+P14+M14+J14+G14+D14 -> 269.41 | AA14: =+(X14+U14+R14+O14+L14+I14+F14+C14)/8 -> 4.8123624999999999 | AB14: =MINA(X14,U14,R14,O14,L14,I14,F14,C14) -> 4.7305999999999999
A15: MARCEL | B15: 2 | C15: 4.8339999999999996 | D15: 31.76 | E15: 1 | F15: 4.9507000000000003 | G15: 32.62 | H15: 3 | I15: 4.6745000000000001 | J15: 35.12 | K15: 5 | L15: 4.8402000000000003 | M15: 34.52 | N15: 7 | O15: 4.8414999999999999 | P15: 28.61 | Q15: 8 | R15: 5.0575000000000001 | S15: 34.09 | T15: 6 | U15: 4.8409000000000004 | V15: 33.21 | W15: 4 | X15: 4.6753999999999998 | Y15: 33.28 | Z15: =+Y15+V15+S15+P15+M15+J15+G15+D15 -> 263.21 | AA15: =+(X15+U15+R15+O15+L15+I15+F15+C15)/8 -> 4.8393374999999992 | AB15: =MINA(X15,U15,R15,O15,L15,I15,F15,C15) -> 4.6745000000000001
A16: RICARDAO | B16: 3 | C16: 4.6719999999999997 | D16: 34.84 | E16: 5 | F16: 4.8958000000000004 | G16: 28.45 | H16: 7 | I16: 4.8975 | J16: 31.62 | K16: 8 | L16: 4.8419999999999996 | M16: 29.7 | N16: 6 | O16: 4.8400999999999996 | P16: 29.17 | Q16: 4 | R16: 4.6200999999999999 | S16: 30.48 | T16: 2 | U16: 4.5228999999999999 | V16: 36.43 | W16: 1 | X16: 4.6776 | Y16: 34.27 | Z16: =+Y16+V16+S16+P16+M16+J16+G16+D16 -> 254.96 | AA16: =+(X16+U16+R16+O16+L16+I16+F16+C16)/8 -> 4.7459999999999996 | AB16: =MINA(X16,U16,R16,O16,L16,I16,F16,C16) -> 4.5228999999999999
A17: JULIO | B17: 8 | C17: 4.8390000000000004 | D17: 30.73 | E17: 6 | F17: 4.6791999999999998 | G17: 29.78 | H17: 4 | I17: 4.8269000000000002 | J17: 30.42 | K17: 2 | L17: 4.6387 | M17: 29.81 | N17: 1 | O17: 4.6201999999999996 | P17: 34.03 | Q17: 3 | R17: 4.6193 | S17: 29.76 | T17: 5 | U17: 4.6211000000000002 | V17: 35.19 | W17: 7 | X17: 4.3997000000000002 | Y17: 33.14 | Z17: =+Y17+V17+S17+P17+M17+J17+G17+D17 -> 252.86 | AA17: =+(X17+U17+R17+O17+L17+I17+F17+C17)/8 -> 4.6555125000000004 | AB17: =MINA(X17,U17,R17,O17,L17,I17,F17,C17) -> 4.3997000000000002
A18: CONRADO | B18: 6 | C18: 4.8395000000000001 | D18: 33.86 | E18: 4 | F18: 4.6896000000000004 | G18: 31.26 | H18: 2 | I18: 4.7294999999999998 | J18: 21.54 | K18: 1 | L18: 4.8395999999999999 | M18: 26.28 | N18: 3 | O18: 4.4542000000000002 | P18: 31.74 | Q18: 5 | R18: 4.6172000000000004 | S18: 31.34 | T18: 7 | U18: 4.5525000000000002 | V18: 33.24 | W18: 8 | X18: 4.6180000000000003 | Y18: 8 | Z18: =+Y18+V18+S18+P18+M18+J18+G18+D18 -> 217.26 | AA18: =+(X18+U18+R18+O18+L18+I18+F18+C18)/8 -> 4.6675125 | AB18: =MINA(X18,U18,R18,O18,L18,I18,F18,C18) -> 4.4542000000000002
A19: RUBAO | B19: 7 | C19: 4.8390000000000004 | D19: 34.27 | E19: 8 | F19: 4.7298999999999998 | G19: 33.22 | H19: 6 | I19: 4.8396999999999997 | J19: 28.63 | K19: 4 | L19: 4.6166 | M19: 34.74 | N19: 2 | O19: 4.8396999999999997 | P19: 31.77 | Q19: 1 | R19: 4.9494999999999996 | S19: 20 | Z19: =+Y19+V19+S19+P19+M19+J19+G19+D19 -> 182.63 | AA19: =+(X19+U19+R19+O19+L19+I19+F19+C19)/6 -> 4.8023999999999996 | AB19: =MINA(X19,U19,R19,O19,L19,I19,F19,C19) -> 4.6166
A20: 3 Bateria
A21: Piloto | B21: Pi | C21: Tempo | D21: Voltas | E21: Pi | F21: Tempo | G21: Voltas | H21: Pi | I21: Tempo | J21: Voltas | K21: Pi | L21: Tempo | M21: Voltas | N21: Pi | O21: Tempo | P21: Voltas | Q21: Pi | R21: Tempo | S21: Voltas | T21: Pi | U21: Tempo | V21: Voltas | W21: Pi | X21: Tempo | Y21: Voltas | Z21: Total | AA21: Media | AB21: Record
A22: MICHEL | B22: 5 | C22: 4.6192000000000002 | D22: 36.51 | E22: 7 | F22: 4.6078000000000001 | G22: 36.16 | H22: 8 | I22: 4.8273999999999999 | J22: 34.72 | K22: 6 | L22: 4.6203000000000003 | M22: 36.25 | N22: 4 | O22: 4.4097 | P22: 36.8 | Q22: 2 | R22: 4.6193 | S22: 37.91 | T22: 1 | U22: 4.8277000000000001 | V22: 35.06 | W22: 3 | X22: 4.6192000000000002 | Y22: 37.07 | Z22: =+Y22+V22+S22+P22+M22+J22+G22+D22 -> 290.48 | AA22: =+(X22+U22+R22+O22+L22+I22+F22+C22)/8 -> 4.6438249999999996 | AB22: =MINA(X22,U22,R22,O22,L22,I22,F22,C22) -> 4.4097
A23: BONGA | B23: 7 | C23: 4.6203000000000003 | D23: 34.87 | E23: 8 | F23: 4.7309999999999999 | G23: 34.65 | H23: 6 | I23: 4.6205999999999996 | J23: 34.21 | K23: 4 | L23: 4.6181000000000001 | M23: 37.75 | N23: 2 | O23: 4.5655000000000001 | P23: 37.29 | Q23: 1 | R23: 4.8394000000000004 | S23: 35.41 | T23: 3 | U23: 4.6067999999999998 | V23: 37.52 | W23: 5 | X23: 4.8277999999999999 | Y23: 34.48 | Z23: =+Y23+V23+S23+P23+M23+J23+G23+D23 -> 286.18 | AA23: =+(X23+U23+R23+O23+L23+I23+F23+C23)/8 -> 4.6786874999999997 | AB23: =MINA(X23,U23,R23,O23,L23,I23,F23,C23) -> 4.5655000000000001
A24: DINHO | B24: 4 | C24: 4.6185 | D24: 33.59 | E24: 2 | F24: 4.62 | G24: 36.26 | H24: 1 | I24: 4.8391999999999999 | J24: 31.19 | K24: 3 | L24: 4.6079999999999997 | M24: 38.4 | N24: 5 | O24: 4.6056999999999997 | P24: 36.21 | Q24: 7 | R24: 4.6201999999999996 | S24: 37.62 | T24: 8 | U24: 4.6086 | V24: 33.06 | W24: 6 | X24: 4.6191000000000004 | Y24: 37.22 | Z24: =+Y24+V24+S24+P24+M24+J24+G24+D24 -> 283.55 | AA24: =+(X24+U24+R24+O24+L24+I24+F24+C24)/8 -> 4.6424124999999989 | AB24: =MINA(X24,U24,R24,O24,L24,I24,F24,C24) -> 4.6056999999999997
A25: ANDERSON | B25: 6 | C25: 4.8952999999999998 | D25: 31.63 | E25: 4 | F25: 4.3997000000000002 | G25: 39.4 | H25: 2 | I25: 4.4555999999999996 | J25: 32.76 | K25: 1 | L25: 4.6195000000000004 | M25: 36.31 | N25: 3 | O25: 4.6192000000000002 | P25: 34.74 | Q25: 5 | R25: 4.6204000000000001 | S25: 37.11 | T25: 7 | U25: 4.6052999999999997 | V25: 35.21 | W25: 8 | X25: 4.6204000000000001 | Y25: 35.32 | Z25: =+Y25+V25+S25+P25+M25+J25+G25+D25 -> 282.48 | AA25: =+(X25+U25+R25+O25+L25+I25+F25+C25)/8 -> 4.604425 | AB25: =MINA(X25,U25,R25,O25,L25,I25,F25,C25) -> 4.3997000000000002
A26: JERA | B26: 3 | C26: 4.6192000000000002 | D26: 33.55 | E26: 5 | F26: 4.6070000000000002 | G26: 31.42 | H26: 7 | I26: 4.6197999999999997 | J26: 30.75 | K26: 8 | L26: 4.6749999999999998 | M26: 36.27 | N26: 6 | O26: 4.8303000000000003 | P26: 33.9 | Q26: 4 | R26: 4.6196000000000002 | S26: 38.45 | T26: 2 | U26: 4.6192000000000002 | V26: 37.03 | W26: 1 | X26: 4.6205999999999996 | Y26: 35.23 | Z26: =+Y26+V26+S26+P26+M26+J26+G26+D26 -> 276.6 | AA26: =+(X26+U26+R26+O26+L26+I26+F26+C26)/8 -> 4.6513374999999995 | AB26: =MINA(X26,U26,R26,O26,L26,I26,F26,C26) -> 4.6070000000000002
A27: RICARDINHO | B27: 8 | C27: 4.6761999999999997 | D27: 32.69 | E27: 6 | F27: 4.6193 | G27: 29.45 | H27: 4 | I27: 4.5204000000000004 | J27: 33.75 | K27: 2 | L27: 4.6189999999999998 | M27: 35.81 | N27: 1 | O27: 4.7194000000000003 | P27: 32.8 | Q27: 3 | R27: 4.6195000000000004 | S27: 35.74 | T27: 5 | U27: 4.6204000000000001 | V27: 32.03 | W27: 7 | X27: 4.8407999999999998 | Y27: 26.88 | Z27: =+Y27+V27+S27+P27+M27+J27+G27+D27 -> 259.15 | AA27: =+(X27+U27+R27+O27+L27+I27+F27+C27)/8 -> 4.6543749999999999 | AB27: =MINA(X27,U27,R27,O27,L27,I27,F27,C27) -> 4.5204000000000004
A28: LISTER | B28: 2 | C28: 4.6050000000000004 | D28: 34.21 | E28: 1 | F28: 4.8395999999999999 | G28: 34.25 | H28: 3 | I28: 4.84 | J28: 31.13 | K28: 5 | L28: 4.8404999999999996 | M28: 32.06 | N28: 7 | O28: 4.8403 | P28: 30.88 | Q28: 8 | R28: 4.8407 | S28: 34.2 | T28: 6 | U28: 4.8494000000000002 | V28: 29.04 | W28: 4 | X28: 4.84 | Y28: 31.51 | Z28: =+Y28+V28+S28+P28+M28+J28+G28+D28 -> 257.28 | AA28: =+(X28+U28+R28+O28+L28+I28+F28+C28)/8 -> 4.8119374999999991 | AB28: =MINA(X28,U28,R28,O28,L28,I28,F28,C28) -> 4.6050000000000004