A1: R$14,99 mussarela, catupiry, buon gustaio, toscanela, calabresa (preço para retirar no balcão) | C1: R$14,99 mussarela, catupiry, buon gustaio, toscanela, calabresa (preço para retirar no balcão)

A1: Bateria 1
A2: Nome | B2: P | C2: Tempo | D2: Vol | E2: P | F2: Tempo | G2: Vol | H2: P | I2: Tempo | J2: Vol | K2: P | L2: Tempo | M2: Vol | N2: P | O2: Tempo | P2: Vol | Q2: P | R2: Tempo | S2: Vol | T2: P | U2: Tempo | V2: Vol | W2: P | X2: Tempo | Y2: Vol | Z2: Total | AA2: Media | AB2: Record
A3: JERA | B3: 1 | C3: 6.05 | D3: 17 | E3: 3 | F3: 5.51 | G3: 25 | H3: 5 | I3: 5.6180000000000003 | J3: 26 | K3: 7 | L3: 5.665 | M3: 28 | N3: 8 | O3: 5.9790000000000001 | P3: 25 | Q3: 6 | R3: 5.61 | S3: 29 | T3: 4 | U3: 5.4610000000000003 | V3: 30 | W3: 2 | X3: 5.5 | Y3: 29 | Z3: 210.40740740740742 | AA3: =+(X3+U3+R3+O3+L3+I3+F3+C3)/8 -> 5.6741249999999992 | AB3: =MINA(X3,U3,R3,O3,L3,I3,F3,C3) -> 5.4610000000000003
A4: MORTADELA | B4: 6 | C4: 6.0490000000000004 | D4: 27 | E4: 4 | F4: 5.6639999999999997 | G4: 23 | H4: 2 | I4: 5.83 | J4: 23 | K4: 1 | L4: 5.7910000000000004 | M4: 26 | N4: 3 | O4: 5.883 | P4: 26 | Q4: 5 | R4: 5.9390000000000001 | S4: 28 | T4: 7 | U4: 5.9939999999999998 | V4: 28 | W4: 8 | X4: 5.94 | Y4: 25 | Z4: 206.42592592592592 | AA4: =+(X4+U4+R4+O4+L4+I4+F4+C4)/8 -> 5.8862500000000004 | AB4: =MINA(X4,U4,R4,O4,L4,I4,F4,C4) -> 5.6639999999999997
A5: ERIC | B5: 8 | C5: 6.1079999999999997 | D5: 19 | E5: 6 | F5: 6.0380000000000003 | G5: 23 | H5: 4 | I5: 5.8849999999999998 | J5: 24 | K5: 2 | L5: 6.06 | M5: 26 | N5: 1 | O5: 5.83 | P5: 20 | Q5: 3 | R5: 5.5549999999999997 | S5: 30 | T5: 5 | U5: 5.7210000000000001 | V5: 26 | W5: 7 | X5: 5.9950000000000001 | Y5: 21 | Z5: 190.07407407407408 | AA5: =+(X5+U5+R5+O5+L5+I5+F5+C5)/8 -> 5.899 | AB5: =MINA(X5,U5,R5,O5,L5,I5,F5,C5) -> 5.5549999999999997
A6: DINHO | B6: 4 | C6: 5.609 | D6: 28 | E6: 2 | F6: 5.6150000000000002 | G6: 28 | H6: 1 | I6: 5.83 | J6: 24 | K6: 3 | L6: 5.593 | M6: 29 | N6: 5 | O6: 5.7910000000000004 | P6: 19 | Q6: 7 | R6: 32.064 | S6: 3 | T6: 8 | U6: 6.05 | V6: 22 | W6: 6 | X6: 5.9390000000000001 | Y6: 11 | Z6: 164 | AA6: =+(X6+U6+R6+O6+L6+I6+F6+C6)/8 -> 9.0613749999999982 | AB6: =MINA(X6,U6,R6,O6,L6,I6,F6,C6) -> 5.593
A7: RUDSON | B7: 2 | C7: 6.1189999999999998 | D7: 22 | E7: 1 | F7: 6.27 | G7: 25 | H7: 3 | I7: 6.1139999999999999 | J7: 23 | K7: 5 | L7: 6.2690000000000001 | M7: 24 | N7: 7 | O7: 6.5030000000000001 | P7: 19 | Q7: 8 | R7: 5.39 | S7: 23 | T7: 6 | U7: 6.2690000000000001 | V7: 5 | Z7: 142 | AA7: =+(X7+U7+R7+O7+L7+I7+F7+C7)/7 -> 6.1334285714285715 | AB7: =MINA(X7,U7,R7,O7,L7,I7,F7,C7) -> 5.39
A8: Bateria 2
A9: Nome | B9: P | C9: Tempo | D9: Vol | E9: P | F9: Tempo | G9: Vol | H9: P | I9: Tempo | J9: Vol | K9: P | L9: Tempo | M9: Vol | N9: P | O9: Tempo | P9: Vol | Q9: P | R9: Tempo | S9: Vol | T9: P | U9: Tempo | V9: Vol | W9: P | X9: Tempo | Y9: Vol | Z9: Total | AA9: Media | AB9: Record
A10: BONGA | B10: 7 | C10: 5.5549999999999997 | D10: 30 | E10: 8 | F10: 5.61 | G10: 27 | H10: 6 | I10: 5.5549999999999997 | J10: 29 | K10: 4 | L10: 5.444 | M10: 31 | N10: 2 | O10: 5.4989999999999997 | P10: 29 | Q10: 1 | R10: 5.609 | S10: 27 | T10: 3 | U10: 5.5549999999999997 | V10: 29 | W10: 5 | X10: 5.5709999999999997 | Y10: 29 | Z10: 231.75925925925927 | AA10: =+(X10+U10+R10+O10+L10+I10+F10+C10)/8 -> 5.5497499999999995 | AB10: =MINA(X10,U10,R10,O10,L10,I10,F10,C10) -> 5.444
A11: RUBAO | B11: 1 | C11: 5.9390000000000001 | D11: 23 | E11: 3 | F11: 5.72 | G11: 27 | H11: 5 | I11: 5.7190000000000003 | J11: 27 | K11: 7 | L11: 5.79 | M11: 28 | N11: 8 | O11: 5.72 | P11: 28 | Q11: 6 | R11: 5.7750000000000004 | S11: 28 | T11: 4 | U11: 5.7709999999999999 | V11: 26 | W11: 2 | X11: 5.8140000000000001 | Y11: 28 | Z11: 215.37037037037038 | AA11: =+(X11+U11+R11+O11+L11+I11+F11+C11)/8 -> 5.7809999999999997 | AB11: =MINA(X11,U11,R11,O11,L11,I11,F11,C11) -> 5.7190000000000003
A12: NETO | B12: 5 | C12: 5.5960000000000001 | D12: 12 | E12: 7 | F12: 5.5549999999999997 | G12: 27 | H12: 8 | I12: 5.72 | J12: 26 | K12: 6 | L12: 5.569 | M12: 24 | N12: 4 | O12: 5.62 | P12: 28 | Q12: 2 | R12: 5.6260000000000003 | S12: 23 | T12: 1 | U12: 5.72 | V12: 26 | W12: 3 | X12: 5.6070000000000002 | Y12: 28 | Z12: 194.68518518518519 | AA12: =+(X12+U12+R12+O12+L12+I12+F12+C12)/8 -> 5.6266250000000007 | AB12: =MINA(X12,U12,R12,O12,L12,I12,F12,C12) -> 5.5549999999999997
A13: GOROI | B13: 3 | C13: 5.9950000000000001 | D13: 19 | E13: 5 | F13: 6.05 | G13: 27 | H13: 7 | I13: 5.9960000000000004 | J13: 28 | K13: 8 | L13: 7.04 | M13: 5 | N13: 6 | O13: 5.94 | P13: 26 | Q13: 4 | R13: 5.71 | S13: 29 | T13: 2 | U13: 5.71 | V13: 26 | W13: 1 | X13: 5.77 | Y13: 27 | Z13: 187.64814814814815 | AA13: =+(X13+U13+R13+O13+L13+I13+F13+C13)/8 -> 6.0263749999999998 | AB13: =MINA(X13,U13,R13,O13,L13,I13,F13,C13) -> 5.71