A1: R$14,99 mussarela, catupiry, buon gustaio, toscanela, calabresa (preço para retirar no balcão) | C1: R$14,99 mussarela, catupiry, buon gustaio, toscanela, calabresa (preço para retirar no balcão)

A1: Pilotos | B1: Pis | C1: Tempo | D1: Vol | E1: Pis | F1: Tempo | G1: Vol | H1: Pis | I1: Tempo | J1: Vol | K1: Pis | L1: Tempo | M1: Vol | N1: Pis | O1: Tempo | P1: Vol | Q1: Pis | R1: Tempo | S1: Vol | T1: Pis | U1: Tempo | V1: Vol | W1: Pis | X1: Tempo | Y1: Vol | Z1: Total | AA1: Media | AB1: Record
A2: KLEBER | B2: 2 | C2: 5.609 | D2: 29 | E2: 1 | F2: 5.7759999999999998 | G2: 29 | H2: 3 | I2: 5.4980000000000002 | J2: 29 | K2: 5 | L2: 5.5419999999999998 | M2: 28 | N2: 7 | O2: 5.5549999999999997 | P2: 28 | Q2: 8 | R2: 5.6150000000000002 | S2: 29 | T2: 6 | U2: 5.4450000000000003 | V2: 27 | W2: 4 | X2: 5.6989999999999998 | Y2: 28 | Z2: 227 | AA2: =+(X2+U2+R2+O2+L2+I2+F2+C2)/8 -> 5.5923749999999997 | AB2: =MINA(X2,U2,R2,O2,L2,I2,F2,C2) -> 5.4450000000000003
A3: JERA | B3: 6 | C3: 5.5519999999999996 | D3: 23 | E3: 4 | F3: 5.39 | G3: 29 | H3: 2 | I3: 5.5 | J3: 31 | K3: 1 | L3: 5.3339999999999996 | M3: 29 | N3: 3 | O3: 5.28 | P3: 31 | Q3: 5 | R3: 5.4450000000000003 | S3: 28 | T3: 7 | U3: 5.3339999999999996 | V3: 25 | W3: 8 | X3: 5.5510000000000002 | Y3: 31 | Z3: 227 | AA3: =+(X3+U3+R3+O3+L3+I3+F3+C3)/8 -> 5.4232500000000003 | AB3: =MINA(X3,U3,R3,O3,L3,I3,F3,C3) -> 5.28
A4: MORTADELA | B4: 1 | C4: 5.9370000000000003 | D4: 25 | E4: 3 | F4: 5.5449999999999999 | G4: 27 | H4: 5 | I4: 5.6619999999999999 | J4: 28 | K4: 7 | L4: 5.6050000000000004 | M4: 30 | N4: 8 | O4: 5.5549999999999997 | P4: 29 | Q4: 6 | R4: 5.5289999999999999 | S4: 26 | T4: 4 | U4: 5.4989999999999997 | V4: 30 | W4: 2 | X4: 5.5 | Y4: 25 | Z4: =+Y4+V4+S4+P4+M4+J4+G4+D4 -> 220 | AA4: =+(X4+U4+R4+O4+L4+I4+F4+C4)/8 -> 5.6040000000000001 | AB4: =MINA(X4,U4,R4,O4,L4,I4,F4,C4) -> 5.4989999999999997
A5: RUBAO | B5: 4 | C5: 5.8920000000000003 | D5: 26 | E5: 2 | F5: 5.774 | G5: 28 | H5: 1 | I5: 5.9379999999999997 | J5: 27 | K5: 3 | L5: 5.7169999999999996 | M5: 29 | N5: 5 | O5: 5.83 | P5: 28 | Q5: 7 | R5: 5.7750000000000004 | S5: 23 | T5: 8 | U5: 5.056 | V5: 24 | W5: 6 | X5: 5.8250000000000002 | Y5: 26 | Z5: =+Y5+V5+S5+P5+M5+J5+G5+D5 -> 211 | AA5: =+(X5+U5+R5+O5+L5+I5+F5+C5)/8 -> 5.7258750000000003 | AB5: =MINA(X5,U5,R5,O5,L5,I5,F5,C5) -> 5.056
A6: MARCEL | B6: 3 | C6: 5.6760000000000002 | D6: 23 | E6: 5 | F6: 5.8280000000000003 | G6: 21 | H6: 7 | I6: 5.61 | J6: 27 | K6: 8 | L6: 5.7149999999999999 | M6: 24 | N6: 6 | O6: 5.5549999999999997 | P6: 29 | Q6: 4 | R6: 5.7190000000000003 | S6: 27 | T6: 2 | U6: 5.6520000000000001 | V6: 28 | W6: 1 | X6: 5.718 | Y6: 27 | Z6: =+Y6+V6+S6+P6+M6+J6+G6+D6 -> 206 | AA6: =+(X6+U6+R6+O6+L6+I6+F6+C6)/8 -> 5.6841250000000008 | AB6: =MINA(X6,U6,R6,O6,L6,I6,F6,C6) -> 5.5549999999999997
A7: MICHEL | B7: 7 | C7: 5.8339999999999996 | D7: 28 | E7: 8 | F7: 5.94 | G7: 28 | H7: 6 | I7: 5.72 | J7: 26 | K7: 4 | L7: 5.774 | M7: 29 | N7: 2 | O7: 5.665 | P7: 30 | Q7: 1 | R7: 5.8840000000000003 | S7: 26 | T7: 3 | U7: 5.7229999999999999 | V7: 9 | Z7: =+Y7+V7+S7+P7+M7+J7+G7+D7 -> 176 | AA7: =+(X7+U7+R7+O7+L7+I7+F7+C7)/7 -> 5.79142857142857 | AB7: =MINA(X7,U7,R7,O7,L7,I7,F7,C7) -> 5.665
A8: RUDSON | B8: 5 | C8: 5.9470000000000001 | D8: 25 | E8: 7 | F8: 6.2670000000000003 | G8: 9 | H8: 8 | I8: 5.94 | J8: 27 | K8: 6 | L8: 6.1070000000000002 | M8: 19 | N8: 4 | O8: 6.0510000000000002 | P8: 24 | Q8: 2 | R8: 6.165 | S8: 18 | T8: 1 | U8: 6.2430000000000003 | V8: 21 | W8: 3 | X8: 5.2210000000000001 | Y8: 20 | Z8: =+Y8+V8+S8+P8+M8+J8+G8+D8 -> 163 | AA8: =+(X8+U8+R8+O8+L8+I8+F8+C8)/8 -> 5.9926250000000003 | AB8: =MINA(X8,U8,R8,O8,L8,I8,F8,C8) -> 5.2210000000000001