B1: COPA PARMA DO INTERIOR | D1: 5º etapa/SJ Racing
A2: 2004 | D2: corrida
A3: POS | B3: PILOTO | C3: EQUIPE | D3: pos/voltas | E3: pontos
A4: 1 | B4: Henrique Rosa | C4: SJ. Racing | D4: 1º / 283,17 | E4: 175
A5: 2 | B5: Anderson diogo (Dinho) | C5: SJ. Racing | D5: 2º / 281,48 | E5: 170
A6: 3 | B6: Ricardo Teixeira | C6: Monza | D6: 3º / 280,52 | E6: 165
A7: 4 | B7: ANDE | C7: SJ. Racing | D7: 4º / 275,50 | E7: 162
A8: 5 | B8: EVANDRO | C8: SJ. Racing | D8: 5º / 274,28 | E8: 159
A9: 6 | B9: LISTER | C9: SJ. Racing | D9: 6º / 274,22 | E9: 156
A10: 7 | B10: Bonga | C10: SJ. Racing | D10: 7º / 271,54 | E10: 153
A11: 8 | B11: RICARDAO | C11: SJ. Racing | D11: 8º / 271,26 | E11: 150
A12: 9 | B12: Gosment (Rubão) | C12: SJ. Racing | D12: 9º / 270,98 | E12: 147
A13: 10 | B13: Marcel | C13: SJ. Racing | D13: 10º / 269,91 | E13: 145
A14: 11 | B14: Kleber Preto | C14: SJ. Racing | D14: 11º / 268,28 | E14: 143
A15: 12 | B15: Marcos Lolata | C15: SJ. Racing | D15: 12º / 267,54 | E15: 141
A16: 13 | B16: JULIO GOSMENT | C16: SJ. Racing | D16: 13º / 264,65 | E16: 139
A17: 14 | B17: Sandro Rosa (Franja) | C17: SJ. Racing | D17: 14º / 263,81 | E17: 137
A18: 15 | B18: Luiz Sergio | C18: Blue king | D18: 15º / 260,65 | E18: 135
A19: 16 | B19: Rubão | C19: Blue king | D19: 16º / 253,19 | E19: 133
A20: 17 | B20: Kal | C20: Blue king | D20: 17º / 250,3 | E20: 131
A21: 18 | B21: Luffe | C21: Monza | D21: 18º / 249,22 | E21: 129
A22: 19 | B22: BETO | C22: SJ. Racing | D22: 19º / 247,28 | E22: 128
A23: 20 | B23: Ado | C23: Blue king | D23: 20º / 246,46 | E23: 127
A24: 21 | B24: CAMELO | C24: SJ. Racing | D24: 21º / 243,17 | E24: 126
A25: 22 | B25: Radar | C25: Stockar | D25: 22º / 242,22 | E25: 125
A26: 23 | B26: Daniel Lombardi | C26: Blue king | D26: 23º / 229,07 | E26: 124
A27: 24 | B27: Felipe João | C27: Stockar | D27: 24º / 225,2 | E27: 123
A28: 25 | B28: Silvio Kuratomi | C28: Blue king | D28: 25º / 210,3 | E28: 122
A29: 26 | B29: Ramos | C29: Monza | D29: 26º / 207,63 | E29: 121
A30: 27 | B30: João Kibon | C30: SJ. Racing | D30: 27º / 165 | E30: 120

A1: 1 Bateria
A2: Piloto | B2: Pi | C2: Tempo | D2: Voltas | E2: Pi | F2: Tempo | G2: Voltas | H2: Pi | I2: Tempo | J2: Voltas | K2: Pi | L2: Tempo | M2: Voltas | N2: Pi | O2: Tempo | P2: Voltas | Q2: Pi | R2: Tempo | S2: Voltas | T2: Pi | U2: Tempo | V2: Voltas | W2: Pi | X2: Tempo | Y2: Voltas | Z2: Total | AA2: Media | AB2: Record
A3: EVANDRO | B3: 3 | C3: 4.7858999999999998 | D3: 36 | E3: 5 | F3: 4.8958000000000004 | G3: 34 | H3: 7 | I3: 4.7851999999999997 | J3: 35 | K3: 8 | L3: 4.8954000000000004 | M3: 34 | N3: 6 | O3: 4.7207999999999997 | P3: 33 | Q3: 4 | R3: 4.5768000000000004 | S3: 32 | T3: 2 | U3: 4.6753 | V3: 35 | W3: 1 | X3: 4.7903000000000002 | Y3: 35.28 | Z3: =+Y3+V3+S3+P3+M3+J3+G3+D3 -> 274.28 | AA3: =+(X3+U3+R3+O3+L3+I3+F3+C3)/8 -> 4.7656874999999994 | AB3: =MINA(X3,U3,R3,O3,L3,I3,F3,C3) -> 4.5768000000000004
A4: LISTER | B4: 4 | C4: 4.7316000000000003 | D4: 35 | E4: 2 | F4: 4.8296999999999999 | G4: 35 | H4: 1 | I4: 4.7858000000000001 | J4: 34 | K4: 3 | L4: 4.7305000000000001 | M4: 32 | N4: 5 | O4: 4.8409000000000004 | P4: 35 | Q4: 7 | R4: 4.7853000000000003 | S4: 34 | T4: 8 | U4: 4.8895 | V4: 35 | W4: 6 | X4: 4.73 | Y4: 34.22 | Z4: =+Y4+V4+S4+P4+M4+J4+G4+D4 -> 274.22 | AA4: =+(X4+U4+R4+O4+L4+I4+F4+C4)/8 -> 4.7904125000000004 | AB4: =MINA(X4,U4,R4,O4,L4,I4,F4,C4) -> 4.73
A5: RICARDAO | B5: 7 | C5: 4.6203000000000003 | D5: 35 | E5: 8 | F5: 4.8399000000000001 | G5: 29 | H5: 6 | I5: 4.6195000000000004 | J5: 36 | K5: 4 | L5: 4.7287999999999997 | M5: 33 | N5: 2 | O5: 4.7807000000000004 | P5: 35 | Q5: 1 | R5: 4.7354000000000003 | S5: 34 | T5: 3 | U5: 4.6307 | V5: 36 | W5: 5 | X5: 4.8407 | Y5: 33.26 | Z5: =+Y5+V5+S5+P5+M5+J5+G5+D5 -> 271.26 | AA5: =+(X5+U5+R5+O5+L5+I5+F5+C5)/8 -> 4.7244999999999999 | AB5: =MINA(X5,U5,R5,O5,L5,I5,F5,C5) -> 4.6195000000000004
A6: JULIO GOSME | B6: 6 | C6: 4.8329000000000004 | D6: 33 | E6: 4 | F6: 4.8394000000000004 | G6: 34 | H6: 2 | I6: 4.7820999999999998 | J6: 31 | K6: 1 | L6: 4.8956 | M6: 32 | N6: 3 | O6: 4.7855999999999996 | P6: 33 | Q6: 5 | R6: 4.7855999999999996 | S6: 34 | T6: 7 | U6: 4.7412999999999998 | V6: 34 | W6: 8 | X6: 4.9412000000000003 | Y6: 33.65 | Z6: =+Y6+V6+S6+P6+M6+J6+G6+D6 -> 264.65 | AA6: =+(X6+U6+R6+O6+L6+I6+F6+C6)/8 -> 4.8254624999999995 | AB6: =MINA(X6,U6,R6,O6,L6,I6,F6,C6) -> 4.7412999999999998
A7: LUFFE | B7: 8 | C7: 4.7826000000000004 | D7: 34 | E7: 6 | F7: 4.6218000000000004 | G7: 34 | H7: 4 | I7: 4.7412000000000001 | J7: 32 | K7: 2 | L7: 4.7918000000000003 | M7: 33 | N7: 1 | O7: 4.8323 | P7: 31 | Q7: 3 | R7: 4.6756000000000002 | S7: 29 | T7: 5 | U7: 5.0838000000000001 | V7: 28 | W7: 7 | X7: 4.8278999999999996 | Y7: 28.22 | Z7: =+Y7+V7+S7+P7+M7+J7+G7+D7 -> 249.22 | AA7: =+(X7+U7+R7+O7+L7+I7+F7+C7)/8 -> 4.7946249999999999 | AB7: =MINA(X7,U7,R7,O7,L7,I7,F7,C7) -> 4.6218000000000004
A8: CAMELO | B8: 2 | C8: 5.0061999999999998 | D8: 34 | E8: 1 | F8: 5.2793999999999999 | G8: 32 | H8: 3 | I8: 5.0590000000000002 | J8: 28 | K8: 5 | L8: 5.4394 | M8: 27 | N8: 7 | O8: 5.335 | P8: 29 | Q8: 8 | R8: 5.2826000000000004 | S8: 31 | T8: 6 | U8: 5.1703999999999999 | V8: 31 | W8: 4 | X8: 5.1722000000000001 | Y8: 31.17 | Z8: =+Y8+V8+S8+P8+M8+J8+G8+D8 -> 243.17 | AA8: =+(X8+U8+R8+O8+L8+I8+F8+C8)/8 -> 5.2180249999999999 | AB8: =MINA(X8,U8,R8,O8,L8,I8,F8,C8) -> 5.0061999999999998
A9: JOAO KIBON | B9: 5 | C9: 4.9492000000000003 | D9: 31 | E9: 7 | F9: 4.8396999999999997 | G9: 33 | H9: 8 | I9: 4.9618000000000002 | J9: 31 | K9: 6 | L9: 4.9621000000000004 | M9: 32 | N9: 4 | O9: 4.9504999999999999 | P9: 33 | Q9: 2 | R9: 5.2112999999999996 | S9: 5 | Z9: =+Y9+V9+S9+P9+M9+J9+G9+D9 -> 165 | AA9: =+(X9+U9+R9+O9+L9+I9+F9+C9)/6 -> 4.9790999999999999 | AB9: =MINA(X9,U9,R9,O9,L9,I9,F9,C9) -> 4.8396999999999997
A10: 2 Bateria
A11: Piloto | B11: Pi | C11: Tempo | D11: Voltas | E11: Pi | F11: Tempo | G11: Voltas | H11: Pi | I11: Tempo | J11: Voltas | K11: Pi | L11: Tempo | M11: Voltas | N11: Pi | O11: Tempo | P11: Voltas | Q11: Pi | R11: Tempo | S11: Voltas | T11: Pi | U11: Tempo | V11: Voltas | W11: Pi | X11: Tempo | Y11: Voltas | Z11: Total | AA11: Media | AB11: Record
A12: ANDERSON | B12: 1 | C12: 4.4554999999999998 | D12: 33 | E12: 3 | F12: 4.5606 | G12: 30 | H12: 5 | I12: 4.5586000000000002 | J12: 38 | K12: 7 | L12: 4.4570999999999996 | M12: 37 | N12: 8 | O12: 4.5101000000000004 | P12: 33 | Q12: 6 | R12: 4.6746999999999996 | S12: 34 | T12: 4 | U12: 4.4002999999999997 | V12: 38 | W12: 2 | X12: 4.3441999999999998 | Y12: 38.48 | Z12: =+Y12+V12+S12+P12+M12+J12+G12+D12 -> 281.48 | AA12: =+(X12+U12+R12+O12+L12+I12+F12+C12)/8 -> 4.4951375000000002 | AB12: =MINA(X12,U12,R12,O12,L12,I12,F12,C12) -> 4.3441999999999998
A13: ANDE | B13: 6 | C13: 4.5660999999999996 | D13: 36 | E13: 4 | F13: 4.5655999999999999 | G13: 33 | H13: 2 | I13: 4.4043999999999999 | J13: 37 | K13: 1 | L13: 4.6143999999999998 | M13: 37 | N13: 3 | O13: 4.3575999999999997 | P13: 36 | Q13: 5 | R13: 4.6208 | S13: 33 | T13: 7 | U13: 4.5913000000000004 | V13: 30 | W13: 8 | X13: 4.6803999999999997 | Y13: 33.5 | Z13: =+Y13+V13+S13+P13+M13+J13+G13+D13 -> 275.5 | AA13: =+(X13+U13+R13+O13+L13+I13+F13+C13)/8 -> 4.5500749999999996 | AB13: =MINA(X13,U13,R13,O13,L13,I13,F13,C13) -> 4.3575999999999997
A14: GOSMENT | B14: 2 | C14: 4.8949999999999996 | D14: 35 | E14: 1 | F14: 4.8409000000000004 | G14: 33 | H14: 3 | I14: 4.8380999999999998 | J14: 35 | K14: 5 | L14: 4.8394000000000004 | M14: 34 | N14: 7 | O14: 4.8954000000000004 | P14: 35 | Q14: 8 | R14: 4.5110000000000001 | S14: 32 | T14: 6 | U14: 4.9490999999999996 | V14: 35 | W14: 4 | X14: 5.0057 | Y14: 31.98 | Z14: =+Y14+V14+S14+P14+M14+J14+G14+D14 -> 270.98 | AA14: =+(X14+U14+R14+O14+L14+I14+F14+C14)/8 -> 4.8468249999999991 | AB14: =MINA(X14,U14,R14,O14,L14,I14,F14,C14) -> 4.5110000000000001
A15: SAPAO | B15: 7 | C15: 4.6142000000000003 | D15: 32 | E15: 8 | F15: 4.6994999999999996 | G15: 33 | H15: 6 | I15: 4.4036999999999997 | J15: 38 | K15: 4 | L15: 4.4531999999999998 | M15: 38 | N15: 2 | O15: 4.4006999999999996 | P15: 38 | Q15: 1 | R15: 4.6265000000000001 | S15: 15 | T15: 3 | U15: 4.4584999999999999 | V15: 38 | W15: 5 | X15: 4.5076999999999998 | Y15: 36.28 | Z15: =+Y15+V15+S15+P15+M15+J15+G15+D15 -> 268.28 | AA15: =+(X15+U15+R15+O15+L15+I15+F15+C15)/8 -> 4.5205000000000002 | AB15: =MINA(X15,U15,R15,O15,L15,I15,F15,C15) -> 4.4006999999999996
A16: LOLATA | B16: 8 | C16: 4.8402000000000003 | D16: 32 | E16: 6 | F16: 4.7003000000000004 | G16: 35 | H16: 4 | I16: 4.6242000000000001 | J16: 35 | K16: 2 | L16: 4.6771000000000003 | M16: 34 | N16: 1 | O16: 4.9465000000000003 | P16: 28 | Q16: 3 | R16: 4.6757999999999997 | S16: 36 | T16: 5 | U16: 4.8345000000000002 | V16: 31 | W16: 7 | X16: 4.7061999999999999 | Y16: 36.54 | Z16: =+Y16+V16+S16+P16+M16+J16+G16+D16 -> 267.54 | AA16: =+(X16+U16+R16+O16+L16+I16+F16+C16)/8 -> 4.7506000000000004 | AB16: =MINA(X16,U16,R16,O16,L16,I16,F16,C16) -> 4.6242000000000001
A17: FRANJA | B17: 5 | C17: 4.9503000000000004 | D17: 31 | E17: 7 | F17: 4.7854999999999999 | G17: 30 | H17: 8 | I17: 4.8428000000000004 | J17: 34 | K17: 6 | L17: 4.8403 | M17: 35 | N17: 4 | O17: 4.8956999999999997 | P17: 29 | Q17: 2 | R17: 4.7849000000000004 | S17: 34 | T17: 1 | U17: 4.7362000000000002 | V17: 35 | W17: 3 | X17: 4.6753 | Y17: 35.81 | Z17: =+Y17+V17+S17+P17+M17+J17+G17+D17 -> 263.81 | AA17: =+(X17+U17+R17+O17+L17+I17+F17+C17)/8 -> 4.8138750000000003 | AB17: =MINA(X17,U17,R17,O17,L17,I17,F17,C17) -> 4.6753
A18: BETO | B18: 4 | C18: 4.9684999999999997 | D18: 31 | E18: 2 | F18: 5.0152999999999999 | G18: 28 | H18: 1 | I18: 4.9432999999999998 | J18: 30 | K18: 3 | L18: 4.7877999999999998 | M18: 35 | N18: 5 | O18: 5.1253000000000002 | P18: 31 | Q18: 7 | R18: 4.8826999999999998 | S18: 32 | T18: 8 | U18: 5.0598000000000001 | V18: 27 | W18: 6 | X18: 4.8945999999999996 | Y18: 33.28 | Z18: =+Y18+V18+S18+P18+M18+J18+G18+D18 -> 247.28 | AA18: =+(X18+U18+R18+O18+L18+I18+F18+C18)/8 -> 4.9596624999999994 | AB18: =MINA(X18,U18,R18,O18,L18,I18,F18,C18) -> 4.7877999999999998
A19: 3 Bateria
A20: Piloto | B20: Pi | C20: Tempo | D20: Voltas | E20: Pi | F20: Tempo | G20: Voltas | H20: Pi | I20: Tempo | J20: Voltas | K20: Pi | L20: Tempo | M20: Voltas | N20: Pi | O20: Tempo | P20: Voltas | Q20: Pi | R20: Tempo | S20: Voltas | T20: Pi | U20: Tempo | V20: Voltas | W20: Pi | X20: Tempo | Y20: Voltas | Z20: Total | AA20: Media | AB20: Record
A21: HENRIQUE | B21: 3 | C21: 4.6208999999999998 | D21: 37 | E21: 5 | F21: 4.6195000000000004 | G21: 35 | H21: 7 | I21: 4.6200999999999999 | J21: 34 | K21: 8 | L21: 4.8407999999999998 | M21: 32 | N21: 6 | O21: 4.6200999999999999 | P21: 36 | Q21: 4 | R21: 4.8207000000000004 | S21: 37 | T21: 2 | U21: 4.4001999999999999 | V21: 37 | W21: 1 | X21: 4.5991999999999997 | Y21: 35.17 | Z21: =+Y21+V21+S21+P21+M21+J21+G21+D21 -> 283.17 | AA21: =+(X21+U21+R21+O21+L21+I21+F21+C21)/8 -> 4.6426875000000001 | AB21: =MINA(X21,U21,R21,O21,L21,I21,F21,C21) -> 4.4001999999999999
A22: MARCEL | B22: 4 | C22: 4.8211000000000004 | D22: 37 | E22: 2 | F22: 4.8220999999999998 | G22: 32 | H22: 1 | I22: 5.0407000000000002 | J22: 32 | K22: 3 | L22: 4.7850000000000001 | M22: 32 | N22: 5 | O22: 5.0503999999999998 | P22: 33 | Q22: 7 | R22: 4.8207000000000004 | S22: 36 | T22: 8 | U22: 4.8406000000000002 | V22: 33 | W22: 6 | X22: 4.8391999999999999 | Y22: 34.91 | Z22: =+Y22+V22+S22+P22+M22+J22+G22+D22 -> 269.91 | AA22: =+(X22+U22+R22+O22+L22+I22+F22+C22)/8 -> 4.8774750000000004 | AB22: =MINA(X22,U22,R22,O22,L22,I22,F22,C22) -> 4.7850000000000001
A23: RUBAO | B23: 6 | C23: 4.8396999999999997 | D23: 33 | E23: 4 | F23: 5.0606999999999998 | G23: 30 | H23: 2 | I23: 4.8391999999999999 | J23: 34 | K23: 1 | L23: 5.0406000000000004 | M23: 30 | N23: 3 | O23: 4.8391999999999999 | P23: 32 | Q23: 5 | R23: 5.0605000000000002 | S23: 32 | T23: 7 | U23: 4.8407999999999998 | V23: 31 | W23: 8 | X23: 5.0603999999999996 | Y23: 31.19 | Z23: =+Y23+V23+S23+P23+M23+J23+G23+D23 -> 253.19 | AA23: =+(X23+U23+R23+O23+L23+I23+F23+C23)/8 -> 4.9476374999999999 | AB23: =MINA(X23,U23,R23,O23,L23,I23,F23,C23) -> 4.8391999999999999
A24: ADO | B24: 2 | C24: 4.8312999999999997 | D24: 34 | E24: 1 | F24: 4.8391999999999999 | G24: 30 | H24: 3 | I24: 4.8395999999999999 | J24: 32 | K24: 5 | L24: 5.0606 | M24: 29 | N24: 7 | O24: 4.8372999999999999 | P24: 32 | Q24: 8 | R24: 5.0603999999999996 | S24: 30 | T24: 6 | U24: 4.8407999999999998 | V24: 28 | W24: 4 | X24: 4.8409000000000004 | Y24: 31.46 | Z24: =+Y24+V24+S24+P24+M24+J24+G24+D24 -> 246.46 | AA24: =+(X24+U24+R24+O24+L24+I24+F24+C24)/8 -> 4.8937625000000002 | AB24: =MINA(X24,U24,R24,O24,L24,I24,F24,C24) -> 4.8312999999999997
A25: LOMBARDI | B25: 1 | C25: 5.0595999999999997 | D25: 29 | E25: 3 | F25: 4.8406000000000002 | G25: 31 | H25: 5 | I25: 5.2603999999999997 | J25: 29 | K25: 7 | L25: 5.5004 | M25: 24 | N25: 8 | O25: 5.4992000000000001 | P25: 27 | Q25: 6 | R25: 5.0603999999999996 | S25: 30 | T25: 4 | U25: 4.8415999999999997 | V25: 30 | W25: 2 | X25: 5.2797000000000001 | Y25: 29.07 | Z25: =+Y25+V25+S25+P25+M25+J25+G25+D25 -> 229.07 | AA25: =+(X25+U25+R25+O25+L25+I25+F25+C25)/8 -> 5.1677374999999994 | AB25: =MINA(X25,U25,R25,O25,L25,I25,F25,C25) -> 4.8406000000000002
A26: DR. SILVIO | B26: 5 | C26: 5.4995000000000003 | D26: 29 | E26: 7 | F26: 5.0608000000000004 | G26: 16 | H26: 8 | I26: 5.0401999999999996 | J26: 30 | K26: 6 | L26: 4.5941999999999998 | M26: 26 | N26: 4 | O26: 5.26 | P26: 27 | Q26: 2 | R26: 4.1780999999999997 | S26: 29 | T26: 1 | U26: 5.2790999999999997 | V26: 25 | W26: 3 | X26: 5.2801 | Y26: 28.3 | Z26: =+Y26+V26+S26+P26+M26+J26+G26+D26 -> 210.3 | AA26: =+(X26+U26+R26+O26+L26+I26+F26+C26)/8 -> 5.024 | AB26: =MINA(X26,U26,R26,O26,L26,I26,F26,C26) -> 4.1780999999999997
A27: RAMOS | B27: 7 | C27: 5.0583999999999998 | D27: 29 | E27: 8 | F27: 5.5011000000000001 | G27: 25 | H27: 6 | I27: 5.2797999999999998 | J27: 28 | K27: 4 | L27: 5.9405000000000001 | M27: 24 | N27: 2 | O27: 5.5010000000000003 | P27: 26 | Q27: 1 | R27: 5.5019 | S27: 24 | T27: 3 | U27: 5.2817999999999996 | V27: 24 | W27: 5 | X27: 5.2801999999999998 | Y27: 27.63 | Z27: =+Y27+V27+S27+P27+M27+J27+G27+D27 -> 207.63 | AA27: =+(X27+U27+R27+O27+L27+I27+F27+C27)/8 -> 5.4180875000000004 | AB27: =MINA(X27,U27,R27,O27,L27,I27,F27,C27) -> 5.0583999999999998
A28: 4 Bateria
A29: Piloto | B29: Pi | C29: Tempo | D29: Voltas | E29: Pi | F29: Tempo | G29: Voltas | H29: Pi | I29: Tempo | J29: Voltas | K29: Pi | L29: Tempo | M29: Voltas | N29: Pi | O29: Tempo | P29: Voltas | Q29: Pi | R29: Tempo | S29: Voltas | T29: Pi | U29: Tempo | V29: Voltas | W29: Pi | X29: Tempo | Y29: Voltas | Z29: Total | AA29: Media | AB29: Record
A30: RICARDINHO | B30: 5 | C30: 4.6199000000000003 | D30: 34 | E30: 7 | F30: 4.6032999999999999 | G30: 36 | H30: 8 | I30: 4.6201999999999996 | J30: 34 | K30: 6 | L30: 4.6200999999999999 | M30: 36 | N30: 4 | O30: 4.6189999999999998 | P30: 35 | Q30: 2 | R30: 4.4002999999999997 | S30: 37 | T30: 1 | U30: 4.6195000000000004 | V30: 34 | W30: 3 | X30: 4.6018999999999997 | Y30: 34.52 | Z30: =+Y30+V30+S30+P30+M30+J30+G30+D30 -> 280.52 | AA30: =+(X30+U30+R30+O30+L30+I30+F30+C30)/8 -> 4.588025 | AB30: =MINA(X30,U30,R30,O30,L30,I30,F30,C30) -> 4.4002999999999997
A31: BONGA | B31: 3 | C31: 4.8308999999999997 | D31: 35 | E31: 5 | F31: 4.8201000000000001 | G31: 34 | H31: 7 | I31: 4.8404999999999996 | J31: 35 | K31: 8 | L31: 4.8395999999999999 | M31: 28 | N31: 6 | O31: 4.8391999999999999 | P31: 34 | Q31: 4 | R31: 4.8391000000000002 | S31: 36 | T31: 2 | U31: 4.6218000000000004 | V31: 36 | W31: 1 | X31: 4.8960999999999997 | Y31: 33.54 | Z31: =+Y31+V31+S31+P31+M31+J31+G31+D31 -> 271.54 | AA31: =+(X31+U31+R31+O31+L31+I31+F31+C31)/8 -> 4.8159124999999996 | AB31: =MINA(X31,U31,R31,O31,L31,I31,F31,C31) -> 4.6218000000000004
A32: LUIZ SERGIO | B32: 6 | C32: 4.6757999999999997 | D32: 33 | E32: 4 | F32: 4.8395999999999999 | G32: 33 | H32: 2 | I32: 4.8395999999999999 | J32: 34 | K32: 1 | L32: 4.8419999999999996 | M32: 32 | N32: 3 | O32: 4.6002999999999998 | P32: 35 | Q32: 5 | R32: 4.8403999999999998 | S32: 31 | T32: 7 | U32: 4.8392999999999997 | V32: 33 | W32: 8 | X32: 5.2781000000000002 | Y32: 29.65 | Z32: =+Y32+V32+S32+P32+M32+J32+G32+D32 -> 260.65 | AA32: =+(X32+U32+R32+O32+L32+I32+F32+C32)/8 -> 4.8443874999999998 | AB32: =MINA(X32,U32,R32,O32,L32,I32,F32,C32) -> 4.6002999999999998
A33: KAL | B33: 4 | C33: 4.6191000000000004 | D33: 33 | E33: 2 | F33: 4.8396999999999997 | G33: 33 | H33: 1 | I33: 5.0403000000000002 | J33: 33 | K33: 3 | L33: 4.6007999999999996 | M33: 34 | N33: 5 | O33: 4.8403999999999998 | P33: 28 | Q33: 7 | R33: 4.8391999999999999 | S33: 32 | T33: 8 | U33: 5.0425000000000004 | V33: 31 | W33: 6 | X33: 4.8407999999999998 | Y33: 26.3 | Z33: =+Y33+V33+S33+P33+M33+J33+G33+D33 -> 250.3 | AA33: =+(X33+U33+R33+O33+L33+I33+F33+C33)/8 -> 4.8328500000000005 | AB33: =MINA(X33,U33,R33,O33,L33,I33,F33,C33) -> 4.6007999999999996
A34: RADAR | B34: 8 | C34: 5.0590000000000002 | D34: 32 | E34: 6 | F34: 5.0587999999999997 | G34: 30 | H34: 4 | I34: 5.0598000000000001 | J34: 29 | K34: 2 | L34: 4.8399000000000001 | M34: 31 | N34: 1 | O34: 4.8410000000000002 | P34: 31 | Q34: 3 | R34: 4.8395999999999999 | S34: 30 | T34: 5 | U34: 5.0590999999999999 | V34: 31 | W34: 7 | X34: 4.8409000000000004 | Y34: 28.22 | Z34: =+Y34+V34+S34+P34+M34+J34+G34+D34 -> 242.22 | AA34: =+(X34+U34+R34+O34+L34+I34+F34+C34)/8 -> 4.9497624999999994 | AB34: =MINA(X34,U34,R34,O34,L34,I34,F34,C34) -> 4.8395999999999999
A35: FELIPE JOAO | B35: 2 | C35: 5.2605000000000004 | D35: 30 | E35: 1 | F35: 5.2790999999999997 | G35: 29 | H35: 3 | I35: 4.84 | J35: 31 | K35: 5 | L35: 5.2805 | M35: 24 | N35: 7 | O35: 5.2603999999999997 | P35: 28 | Q35: 8 | R35: 5.28 | S35: 26 | T35: 6 | U35: 5.0601000000000003 | V35: 29 | W35: 4 | X35: 4.8396999999999997 | Y35: 28.2 | Z35: =+Y35+V35+S35+P35+M35+J35+G35+D35 -> 225.2 | AA35: =+(X35+U35+R35+O35+L35+I35+F35+C35)/8 -> 5.1375374999999996 | AB35: =MINA(X35,U35,R35,O35,L35,I35,F35,C35) -> 4.8396999999999997