A1: R$14,99 mussarela, catupiry, buon gustaio, toscanela, calabresa (preço para retirar no balcão) | C1: R$14,99 mussarela, catupiry, buon gustaio, toscanela, calabresa (preço para retirar no balcão)

A1: Pos | B1: Piloto | C1: Total
A2: 1 | B2: DINHO | C2: 337.01620000000003
A3: 2 | B3: BONGA | C3: 331.01080000000002
A4: =+A3+1 -> 3 | B4: MANO | C4: 309.08100000000002
A5: =+A4+1 -> 4 | B5: GOROI | C5: 299.0324
A6: =+A5+1 -> 5 | B6: EVANDRO | C6: 297.09179999999998
A7: =+A6+1 -> 6 | B7: LISTER | C7: 296.06479999999999
A8: =+A7+1 -> 7 | B8: ERIC | C8: 291.22140000000002
A9: =+A8+1 -> 8 | B9: JERA | C9: 288.22680000000003
A10: =+A9+1 -> 9 | B10: JUNINHO | C10: 286.22140000000002
A11: =+A10+1 -> 10 | B11: SANDRO | C11: 273.05399999999997
A12: =+A11+1 -> 11 | B12: MARQUINHO | C12: 270.21600000000001
A13: =+A12+1 -> 12 | B13: RICARDO | C13: 227.24299999999999
A14: =+A13+1 -> 13 | B14: BOTELHO | C14: 181