A1: Patrocinadores

B1: Motos e Acessórios Honda - Rua Sete de Setembro, 387 - Fone: (15) 3331-6700.

A1: 1 Bateria
A2: Piloto | B2: Pi | C2: Tempo | D2: Vol | E2: Pi | F2: Tempo | G2: Vol | H2: Pi | I2: Tempo | J2: Vol | K2: Pi | L2: Tempo | M2: Vol | N2: Pi | O2: Tempo | P2: Vol | Q2: Pi | R2: Tempo | S2: Vol | T2: Pi | U2: Tempo | V2: Vol | W2: Pi | X2: Tempo | Y2: Vol | Z2: Total | AA2: Media | AB2: Record
A3: CONRADO | B3: 6 | C3: 4.6365999999999996 | D3: 37.06 | E3: 4 | F3: 4.6201999999999996 | G3: 37.21 | H3: 2 | I3: 4.8249000000000004 | J3: 36.22 | K3: 1 | L3: 4.8228 | M3: 33.21 | N3: 3 | O3: 4.6205999999999996 | P3: 36.48 | Q3: 5 | R3: 4.8574000000000002 | S3: 34.35 | T3: 7 | U3: 4.7313000000000001 | V3: 36.73 | W3: 8 | X3: 4.8221999999999996 | Y3: 34.86 | Z3: =+Y3+V3+S3+P3+M3+J3+G3+D3 -> 286.12 | AA3: =+(X3+U3+R3+O3+L3+I3+F3+C3)/8 -> 4.742 | AB3: =MINA(X3,U3,R3,O3,L3,I3,F3,C3) -> 4.6201999999999996
A4: LISTER | B4: 5 | C4: 4.8247999999999998 | D4: 30.98 | E4: 7 | F4: 4.6207000000000003 | G4: 34.81 | H4: 8 | I4: 4.6191000000000004 | J4: 36.6 | K4: 6 | L4: 4.6205999999999996 | M4: 27.67 | N4: 4 | O4: 4.6090999999999998 | P4: 36.45 | Q4: 2 | R4: 4.6170999999999998 | S4: 33.64 | T4: 1 | U4: 5.06 | V4: 30.46 | W4: 3 | X4: 4.6196999999999999 | Y4: 36.27 | Z4: =+Y4+V4+S4+P4+M4+J4+G4+D4 -> 266.88 | AA4: =+(X4+U4+R4+O4+L4+I4+F4+C4)/8 -> 4.6988874999999997 | AB4: =MINA(X4,U4,R4,O4,L4,I4,F4,C4) -> 4.6090999999999998
A5: MANE | B5: 2 | C5: 4.8395999999999999 | D5: 31.78 | E5: 1 | F5: 4.6193 | G5: 34.82 | H5: 3 | I5: 4.8232999999999997 | J5: 35.34 | K5: 5 | L5: 5.0518000000000001 | M5: 26.36 | N5: 7 | O5: 4.8403 | P5: 30.74 | Q5: 8 | R5: 4.6760000000000002 | S5: 36.13 | T5: 6 | U5: 4.62 | V5: 36.05 | W5: 4 | X5: 4.6200999999999999 | Y5: 35.22 | Z5: =+Y5+V5+S5+P5+M5+J5+G5+D5 -> 266.44 | AA5: =+(X5+U5+R5+O5+L5+I5+F5+C5)/8 -> 4.7612999999999994 | AB5: =MINA(X5,U5,R5,O5,L5,I5,F5,C5) -> 4.6193
A6: RICARDAO | B6: 8 | C6: 4.8017000000000003 | D6: 32.88 | E6: 6 | F6: 4.8250999999999999 | G6: 28.11 | H6: 4 | I6: 4.6208 | J6: 35.2 | K6: 2 | L6: 4.73 | M6: 34.51 | N6: 1 | O6: 4.8403 | P6: 35.6 | Q6: 3 | R6: 4.6205999999999996 | S6: 33.51 | T6: 5 | U6: 4.6196000000000002 | V6: 30.36 | W6: 7 | X6: 4.8255999999999997 | Y6: 36.25 | Z6: =+Y6+V6+S6+P6+M6+J6+G6+D6 -> 266.42 | AA6: =+(X6+U6+R6+O6+L6+I6+F6+C6)/8 -> 4.7354625000000006 | AB6: =MINA(X6,U6,R6,O6,L6,I6,F6,C6) -> 4.6196000000000002
A7: RUDSON | B7: 3 | C7: 4.8384 | D7: 34.24 | E7: 5 | F7: 4.0704000000000002 | G7: 31.15 | H7: 7 | I7: 4.8239000000000001 | J7: 35.62 | K7: 8 | L7: 5.0060000000000002 | M7: 31.69 | N7: 6 | O7: 4.84 | P7: 21.62 | Q7: 4 | R7: 4.6203000000000003 | S7: 35.52 | T7: 2 | U7: 4.7854000000000001 | V7: 34.03 | W7: 1 | X7: 4.8392999999999997 | Y7: 33.92 | Z7: =+Y7+V7+S7+P7+M7+J7+G7+D7 -> 257.79 | AA7: =+(X7+U7+R7+O7+L7+I7+F7+C7)/8 -> 4.7279625000000003 | AB7: =MINA(X7,U7,R7,O7,L7,I7,F7,C7) -> 4.0704000000000002
A8: LUIZ FELIPE | B8: 1 | C8: 4.8399000000000001 | D8: 27.29 | E8: 3 | F8: 4.8400999999999996 | G8: 26.24 | H8: 5 | I8: 4.8331 | J8: 27.22 | K8: 7 | L8: 4.8403 | M8: 25.47 | N8: 8 | O8: 4.9050000000000002 | P8: 29.46 | Q8: 6 | R8: 4.8400999999999996 | S8: 24.8 | T8: 4 | U8: 4.6191000000000004 | V8: 31.44 | W8: 2 | X8: 4.8396999999999997 | Y8: 30.63 | Z8: =+Y8+V8+S8+P8+M8+J8+G8+D8 -> 222.55 | AA8: =+(X8+U8+R8+O8+L8+I8+F8+C8)/8 -> 4.8196624999999997 | AB8: =MINA(X8,U8,R8,O8,L8,I8,F8,C8) -> 4.6191000000000004
A9: 2 Bateria
A10: Piloto | B10: Pi | C10: Tempo | D10: Vol | E10: Pi | F10: Tempo | G10: Vol | H10: Pi | I10: Tempo | J10: Vol | K10: Pi | L10: Tempo | M10: Vol | N10: Pi | O10: Tempo | P10: Vol | Q10: Pi | R10: Tempo | S10: Vol | T10: Pi | U10: Tempo | V10: Vol | W10: Pi | X10: Tempo | Y10: Vol | Z10: Total | AA10: Media | AB10: Record
A11: MICHEL | B11: 4 | C11: 4.3852000000000002 | D11: 39.8 | E11: 2 | F11: 4.2907000000000002 | G11: 39.24 | H11: 1 | I11: 4.3993000000000002 | J11: 38.36 | K11: 3 | L11: 4.3977000000000004 | M11: 37.56 | N11: 5 | O11: 4.6185999999999998 | P11: 37.1 | Q11: 7 | R11: 4.3993000000000002 | S11: 38.5 | T11: 8 | U11: 4.4015000000000004 | V11: 38.42 | W11: 6 | X11: 4.6185999999999998 | Y11: 38.46 | Z11: =+Y11+V11+S11+P11+M11+J11+G11+D11 -> 307.44 | AA11: =+(X11+U11+R11+O11+L11+I11+F11+C11)/8 -> 4.4388624999999999 | AB11: =MINA(X11,U11,R11,O11,L11,I11,F11,C11) -> 4.2907000000000002
A12: BONGA | B12: 7 | C12: 4.5091999999999999 | D12: 37.51 | E12: 8 | F12: 4.6196999999999999 | G12: 35.65 | H12: 6 | I12: 4.3990999999999998 | J12: 39.04 | K12: 4 | L12: 4.3971999999999998 | M12: 39.27 | N12: 2 | O12: 4.3986000000000001 | P12: 39.85 | Q12: 1 | R12: 4.5107999999999997 | S12: 37.03 | T12: 3 | U12: 4.3981000000000003 | V12: 39.27 | W12: 5 | X12: 4.6178999999999997 | Y12: 38.26 | Z12: =+Y12+V12+S12+P12+M12+J12+G12+D12 -> 305.88 | AA12: =+(X12+U12+R12+O12+L12+I12+F12+C12)/8 -> 4.481325 | AB12: =MINA(X12,U12,R12,O12,L12,I12,F12,C12) -> 4.3971999999999998
A13: TETA | B13: 3 | C13: 4.6085000000000003 | D13: 38.68 | E13: 5 | F13: 4.62 | G13: 38.07 | H13: 7 | I13: 4.6189 | J13: 38.46 | K13: 8 | L13: 4.5105000000000004 | M13: 38.56 | N13: 6 | O13: 4.6189 | P13: 37.61 | Q13: 4 | R13: 4.5105000000000004 | S13: 37.08 | T13: 2 | U13: 4.3985000000000003 | V13: 38.38 | W13: 1 | X13: 4.6109 | Y13: 37.45 | Z13: =+Y13+V13+S13+P13+M13+J13+G13+D13 -> 304.29 | AA13: =+(X13+U13+R13+O13+L13+I13+F13+C13)/8 -> 4.5620875000000005 | AB13: =MINA(X13,U13,R13,O13,L13,I13,F13,C13) -> 4.3985000000000003
A14: DINHO | B14: 2 | C14: 4.5105000000000004 | D14: 38.22 | E14: 1 | F14: 4.5003000000000002 | G14: 33.26 | H14: 3 | I14: 4.5109000000000004 | J14: 38.23 | K14: 5 | L14: 4.6191000000000004 | M14: 36.74 | N14: 7 | O14: 4.6200999999999999 | P14: 33.06 | Q14: 8 | R14: 4.6195000000000004 | S14: 34.35 | T14: 6 | U14: 4.6098999999999997 | V14: 34.46 | W14: 4 | X14: 4.4002999999999997 | Y14: 39.22 | Z14: =+Y14+V14+S14+P14+M14+J14+G14+D14 -> 287.54 | AA14: =+(X14+U14+R14+O14+L14+I14+F14+C14)/8 -> 4.5488249999999999 | AB14: =MINA(X14,U14,R14,O14,L14,I14,F14,C14) -> 4.4002999999999997
A15: ERIC | B15: 6 | C15: 4.6203000000000003 | D15: 36.1 | E15: 4 | F15: 4.6201999999999996 | G15: 36.45 | H15: 2 | I15: 4.6177999999999999 | J15: 36.27 | K15: 1 | L15: 4.6208 | M15: 33.07 | N15: 3 | O15: 4.8270999999999997 | P15: 33.35 | Q15: 5 | R15: 4.6760999999999999 | S15: 35.09 | T15: 7 | U15: 4.6174999999999997 | V15: 35.41 | W15: 8 | X15: 4.6196999999999999 | Y15: 35.27 | Z15: =+Y15+V15+S15+P15+M15+J15+G15+D15 -> 281.01 | AA15: =+(X15+U15+R15+O15+L15+I15+F15+C15)/8 -> 4.6524374999999996 | AB15: =MINA(X15,U15,R15,O15,L15,I15,F15,C15) -> 4.6174999999999997