A1: Patrocinadores

B1: Motos e Acessórios Honda - Rua Sete de Setembro, 387 - Fone: (15) 3331-6700. | C1: Rua Olavo Bilac, 254 - Vila Santana

A1: Bateria 1
A2: Nome | B2: P | C2: Tempo | D2: Vol | E2: P | F2: Tempo | G2: Vol | H2: P | I2: Tempo | J2: Vol | K2: P | L2: Tempo | M2: Vol | N2: P | O2: Tempo | P2: Vol | Q2: P | R2: Tempo | S2: Vol | T2: P | U2: Tempo | V2: Vol | W2: P | X2: Tempo | Y2: Vol | Z2: Total | AA2: Media | AB2: Record
A3: MARCEL | B3: 1 | C3: 5.28 | D3: 30 | E3: 3 | F3: 5.27 | G3: 29 | H3: 5 | I3: 5.3479999999999999 | J3: 28 | K3: 7 | L3: 5.28 | M3: 30 | N3: 8 | O3: 5.2789999999999999 | P3: 31 | Q3: 6 | R3: 5.2779999999999996 | S3: 30 | T3: 4 | U3: 5.2779999999999996 | V3: 29 | W3: 2 | X3: 5.335 | Y3: 30 | Z3: 237.12962962962962 | AA3: =+(X3+U3+R3+O3+L3+I3+F3+C3)/8 -> 5.2934999999999999 | AB3: =MINA(X3,U3,R3,O3,L3,I3,F3,C3) -> 5.27
A4: RICARDO | B4: 2 | C4: 5.4969999999999999 | D4: 28 | E4: 1 | F4: 5.5590000000000002 | G4: 25 | H4: 3 | I4: 5.4989999999999997 | J4: 27 | K4: 5 | L4: 5.5 | M4: 28 | N4: 7 | O4: 5.4989999999999997 | P4: 29 | Q4: 8 | R4: 5.4989999999999997 | S4: 25 | T4: 6 | U4: 5.7190000000000003 | V4: 27 | W4: 4 | X4: 5.72 | Y4: 25 | Z4: 215.37037037037038 | AA4: =+(X4+U4+R4+O4+L4+I4+F4+C4)/8 -> 5.5614999999999997 | AB4: =MINA(X4,U4,R4,O4,L4,I4,F4,C4) -> 5.4969999999999999
A5: GUSTAVO | B5: 4 | C5: 5.9409999999999998 | D5: 26 | E5: 2 | F5: 5.9390000000000001 | G5: 28 | H5: 1 | I5: 5.8949999999999996 | J5: 23 | K5: 3 | L5: 5.9950000000000001 | M5: 26 | N5: 5 | O5: 6.1589999999999998 | P5: 26 | Q5: 7 | R5: 6.1589999999999998 | S5: 24 | T5: 8 | U5: 6.2140000000000004 | V5: 27 | W5: 6 | X5: 5.94 | Y5: 26 | Z5: 207.87037037037038 | AA5: =+(X5+U5+R5+O5+L5+I5+F5+C5)/8 -> 6.0302499999999997 | AB5: =MINA(X5,U5,R5,O5,L5,I5,F5,C5) -> 5.8949999999999996
A6: FLAVIO | B6: 7 | C6: 5.94 | D6: 22 | E6: 8 | F6: 6.2149999999999999 | G6: 21 | H6: 6 | I6: 6.15 | J6: 25 | K6: 4 | L6: 5.9370000000000003 | M6: 25 | N6: 2 | O6: 5.94 | P6: 26 | Q6: 1 | R6: 6.16 | S6: 25 | T6: 3 | U6: 5.94 | V6: 25 | W6: 5 | X6: 5.9870000000000001 | Y6: 21 | Z6: 190.88888888888889 | AA6: =+(X6+U6+R6+O6+L6+I6+F6+C6)/8 -> 6.0336250000000007 | AB6: =MINA(X6,U6,R6,O6,L6,I6,F6,C6) -> 5.9370000000000003
A7: BOLA | B7: 8 | C7: 5.7169999999999996 | D7: 27 | E7: 6 | F7: 5.5119999999999996 | G7: 26 | H7: 4 | I7: 5.5 | J7: 25 | K7: 2 | L7: 6.16 | M7: 18 | N7: 1 | O7: 5.94 | P7: 12 | Q7: 3 | R7: 5.72 | S7: 27 | T7: 5 | U7: 5.5010000000000003 | V7: 26 | W7: 7 | X7: 5.5549999999999997 | Y7: 26 | Z7: 187.31481481481481 | AA7: =+(X7+U7+R7+O7+L7+I7+F7+C7)/8 -> 5.7006249999999996 | AB7: =MINA(X7,U7,R7,O7,L7,I7,F7,C7) -> 5.5
A8: CARECA | B8: 3 | C8: 6.1609999999999996 | D8: 25 | E8: 5 | F8: 4.4009999999999998 | G8: 21 | H8: 7 | I8: 6.3789999999999996 | J8: 22 | K8: 8 | L8: 4.51 | M8: 21 | N8: 6 | O8: 6.3780000000000001 | P8: 24 | Q8: 4 | R8: 6.5990000000000002 | S8: 19 | T8: 2 | U8: 6.1550000000000002 | V8: 25 | W8: 1 | X8: 6.2160000000000002 | Y8: 25 | Z8: 183.07407407407408 | AA8: =+(X8+U8+R8+O8+L8+I8+F8+C8)/8 -> 5.849874999999999 | AB8: =MINA(X8,U8,R8,O8,L8,I8,F8,C8) -> 4.4009999999999998
A9: M VINICIUS | B9: 6 | C9: 5.508 | D9: 23 | E9: 4 | F9: 5.9950000000000001 | G9: 24 | H9: 2 | I9: 5.94 | J9: 23 | K9: 1 | L9: 5.9390000000000001 | M9: 20 | N9: 3 | O9: 6.1580000000000004 | P9: 23 | Q9: 5 | R9: 6.49 | S9: 23 | T9: 7 | U9: 5.9390000000000001 | V9: 22 | W9: 8 | X9: 5.94 | Y9: 22 | Z9: 180.66666666666666 | AA9: =+(X9+U9+R9+O9+L9+I9+F9+C9)/8 -> 5.9886249999999999 | AB9: =MINA(X9,U9,R9,O9,L9,I9,F9,C9) -> 5.508
A10: LUIZ FELIPE | B10: 5 | C10: 6.16 | D10: 17 | E10: 7 | F10: 6.38 | G10: 18 | H10: 8 | I10: 6.5990000000000002 | J10: 17 | K10: 6 | L10: 6.375 | M10: 19 | N10: 4 | O10: 6.16 | P10: 20 | Q10: 2 | R10: 6.1589999999999998 | S10: 24 | T10: 1 | U10: 6.1589999999999998 | V10: 23 | W10: 3 | X10: 5.9950000000000001 | Y10: 18 | Z10: 157.14814814814815 | AA10: =+(X10+U10+R10+O10+L10+I10+F10+C10)/8 -> 6.2483750000000011 | AB10: =MINA(X10,U10,R10,O10,L10,I10,F10,C10) -> 5.9950000000000001
A11: Bateria 2
A12: Nome | B12: P | C12: Tempo | D12: Vol | E12: P | F12: Tempo | G12: Vol | H12: P | I12: Tempo | J12: Vol | K12: P | L12: Tempo | M12: Vol | N12: P | O12: Tempo | P12: Vol | Q12: P | R12: Tempo | S12: Vol | T12: P | U12: Tempo | V12: Vol | W12: P | X12: Tempo | Y12: Vol | Z12: Total | AA12: Media | AB12: Record
A13: JULIO | B13: 3 | C13: 5.5 | D13: 29 | E13: 5 | F13: 5.4960000000000004 | G13: 29 | H13: 7 | I13: 5.28 | J13: 31 | K13: 8 | L13: 5.4980000000000002 | M13: 24 | N13: 6 | O13: 5.2809999999999997 | P13: 26 | Q13: 4 | R13: 5.5 | S13: 30 | T13: 2 | U13: 5.28 | V13: 29 | W13: 1 | X13: 5.4020000000000001 | Y13: 29 | Z13: 227.92592592592592 | AA13: =+(X13+U13+R13+O13+L13+I13+F13+C13)/8 -> 5.4046250000000002 | AB13: =MINA(X13,U13,R13,O13,L13,I13,F13,C13) -> 5.28
A14: EVANDRO | B14: 2 | C14: 5.718 | D14: 25 | E14: 1 | F14: 5.71 | G14: 27 | H14: 3 | I14: 5.4989999999999997 | J14: 28 | K14: 5 | L14: 5.72 | M14: 28 | N14: 7 | O14: 5.94 | P14: 26 | Q14: 8 | R14: 5.72 | S14: 29 | T14: 6 | U14: 5.9359999999999999 | V14: 24 | W14: 4 | X14: 5.7190000000000003 | Y14: 29 | Z14: 217.09259259259258 | AA14: =+(X14+U14+R14+O14+L14+I14+F14+C14)/8 -> 5.7452500000000004 | AB14: =MINA(X14,U14,R14,O14,L14,I14,F14,C14) -> 5.4989999999999997
A15: MARCOS JO | B15: 6 | C15: 6.1589999999999998 | D15: 25 | E15: 4 | F15: 5.9930000000000003 | G15: 22 | H15: 2 | I15: 5.9359999999999999 | J15: 26 | K15: 1 | L15: 5.9390000000000001 | M15: 26 | N15: 3 | O15: 5.94 | P15: 23 | Q15: 5 | R15: 5.72 | S15: 26 | T15: 7 | U15: 5.9379999999999997 | V15: 26 | W15: 8 | X15: 5.7210000000000001 | Y15: 26 | Z15: 200.2037037037037 | AA15: =+(X15+U15+R15+O15+L15+I15+F15+C15)/8 -> 5.9182500000000005 | AB15: =MINA(X15,U15,R15,O15,L15,I15,F15,C15) -> 5.72
A16: DANIEL | B16: 7 | C16: 6.3710000000000004 | D16: 23 | E16: 8 | F16: 5.94 | G16: 24 | H16: 6 | I16: 5.94 | J16: 23 | K16: 4 | L16: 5.72 | M16: 25 | N16: 2 | O16: 5.9370000000000003 | P16: 26 | Q16: 1 | R16: 5.94 | S16: 25 | T16: 3 | U16: 5.7220000000000004 | V16: 25 | W16: 5 | X16: 5.94 | Y16: 22 | Z16: 194.85185185185185 | AA16: =+(X16+U16+R16+O16+L16+I16+F16+C16)/8 -> 5.9387499999999998 | AB16: =MINA(X16,U16,R16,O16,L16,I16,F16,C16) -> 5.72
A17: NETO | B17: 8 | C17: 5.51 | D17: 24 | E17: 6 | F17: 5.5049999999999999 | G17: 26 | H17: 4 | I17: 5.72 | J17: 21 | K17: 2 | L17: 5.4980000000000002 | M17: 19 | N17: 1 | O17: 5.5010000000000003 | P17: 24 | Q17: 3 | R17: 5.5 | S17: 29 | T17: 5 | U17: 5.4989999999999997 | V17: 25 | W17: 7 | X17: 5.4980000000000002 | Y17: 23 | Z17: 192.14814814814815 | AA17: =+(X17+U17+R17+O17+L17+I17+F17+C17)/8 -> 5.5288750000000002 | AB17: =MINA(X17,U17,R17,O17,L17,I17,F17,C17) -> 5.4980000000000002
A18: CASSIO | B18: 1 | C18: 6.38 | D18: 23 | E18: 3 | F18: 5.9950000000000001 | G18: 21 | H18: 5 | I18: 5.9359999999999999 | J18: 26 | K18: 7 | L18: 6.1070000000000002 | M18: 21 | N18: 8 | O18: 5.94 | P18: 24 | Q18: 6 | R18: 5.9390000000000001 | S18: 24 | T18: 4 | U18: 6.1589999999999998 | V18: 25 | W18: 2 | X18: 6.05 | Y18: 26 | Z18: 191.88888888888889 | AA18: =+(X18+U18+R18+O18+L18+I18+F18+C18)/8 -> 6.06325 | AB18: =MINA(X18,U18,R18,O18,L18,I18,F18,C18) -> 5.9359999999999999
A19: RODRIGO | B19: 5 | C19: 6.1630000000000003 | D19: 24 | E19: 7 | F19: 5.9939999999999998 | G19: 25 | H19: 8 | I19: 6.27 | J19: 11 | K19: 6 | L19: 5.9960000000000004 | M19: 25 | N19: 4 | O19: 5.8289999999999997 | P19: 25 | Q19: 2 | R19: 5.6790000000000003 | S19: 28 | T19: 1 | U19: 5.9939999999999998 | V19: 24 | W19: 3 | X19: 5.72 | Y19: 26 | Z19: 188.66666666666666 | AA19: =+(X19+U19+R19+O19+L19+I19+F19+C19)/8 -> 5.9556250000000004 | AB19: =MINA(X19,U19,R19,O19,L19,I19,F19,C19) -> 5.6790000000000003
A20: SANDRO ITU | B20: 4 | C20: 5.83 | D20: 25 | E20: 2 | F20: 5.72 | G20: 26 | H20: 1 | I20: 5.9390000000000001 | J20: 25 | K20: 3 | L20: 5.718 | M20: 24 | N20: 5 | O20: 5.7240000000000002 | P20: 22 | Q20: 7 | R20: 5.7759999999999998 | S20: 17 | T20: 8 | U20: 5.8289999999999997 | V20: 12 | W20: 6 | X20: 5.94 | Y20: 21 | Z20: 172.27777777777777 | AA20: =+(X20+U20+R20+O20+L20+I20+F20+C20)/8 -> 5.8094999999999999 | AB20: =MINA(X20,U20,R20,O20,L20,I20,F20,C20) -> 5.718
A21: Bateria 3
A22: Nome | B22: P | C22: Tempo | D22: Vol | E22: P | F22: Tempo | G22: Vol | H22: P | I22: Tempo | J22: Vol | K22: P | L22: Tempo | M22: Vol | N22: P | O22: Tempo | P22: Vol | Q22: P | R22: Tempo | S22: Vol | T22: P | U22: Tempo | V22: Vol | W22: P | X22: Tempo | Y22: Vol | Z22: Total | AA22: Media | AB22: Record
A23: JERA | B23: 1 | C23: 5.3339999999999996 | D23: 24 | E23: 3 | F23: 5.28 | G23: 30 | H23: 5 | I23: 5.2789999999999999 | J23: 28 | K23: 7 | L23: 5.3289999999999997 | M23: 28 | N23: 8 | O23: 5.2830000000000004 | P23: 23 | Q23: 6 | R23: 5.2789999999999999 | S23: 31 | T23: 4 | U23: 5.2770000000000001 | V23: 32 | W23: 2 | X23: 5.06 | Y23: 33 | Z23: 231.27777777777777 | AA23: =+(X23+U23+R23+O23+L23+I23+F23+C23)/8 -> 5.2651249999999994 | AB23: =MINA(X23,U23,R23,O23,L23,I23,F23,C23) -> 5.06
A24: GOROI | B24: 8 | C24: 5.5 | D24: 24 | E24: 6 | F24: 5.5549999999999997 | G24: 28 | H24: 4 | I24: 5.5 | J24: 29 | K24: 2 | L24: 5.39 | M24: 30 | N24: 1 | O24: 5.5 | P24: 26 | Q24: 3 | R24: 5.4989999999999997 | S24: 30 | T24: 5 | U24: 5.72 | V24: 26 | W24: 7 | X24: 5.72 | Y24: 26 | Z24: 219.46296296296296 | AA24: =+(X24+U24+R24+O24+L24+I24+F24+C24)/8 -> 5.548 | AB24: =MINA(X24,U24,R24,O24,L24,I24,F24,C24) -> 5.39
A25: FERNANDO | B25: 3 | C25: 5.72 | D25: 27 | E25: 5 | F25: 5.5 | G25: 29 | H25: 7 | I25: 5.72 | J25: 26 | K25: 8 | L25: 5.5 | M25: 27 | N25: 6 | O25: 5.5 | P25: 26 | Q25: 4 | R25: 5.5 | S25: 26 | T25: 2 | U25: 5.4969999999999999 | V25: 29 | W25: 1 | X25: 5.5 | Y25: 29 | Z25: 219.09259259259258 | AA25: =+(X25+U25+R25+O25+L25+I25+F25+C25)/8 -> 5.5546249999999997 | AB25: =MINA(X25,U25,R25,O25,L25,I25,F25,C25) -> 5.4969999999999999
A26: PACHECO | B26: 5 | C26: 6.16 | D26: 24 | E26: 7 | F26: 5.94 | G26: 27 | H26: 8 | I26: 5.94 | J26: 21 | K26: 6 | L26: 5.72 | M26: 26 | N26: 4 | O26: 5.7149999999999999 | P26: 28 | Q26: 2 | R26: 5.7169999999999996 | S26: 26 | T26: 1 | U26: 5.7119999999999997 | V26: 29 | W26: 3 | X26: 5.7169999999999996 | Y26: 29 | Z26: 213.05555555555554 | AA26: =+(X26+U26+R26+O26+L26+I26+F26+C26)/8 -> 5.8276249999999994 | AB26: =MINA(X26,U26,R26,O26,L26,I26,F26,C26) -> 5.7119999999999997
A27: GERONIMO | B27: 4 | C27: 5.7190000000000003 | D27: 25 | E27: 2 | F27: 5.7210000000000001 | G27: 25 | H27: 1 | I27: 5.72 | J27: 26 | K27: 3 | L27: 5.7190000000000003 | M27: 28 | N27: 5 | O27: 5.94 | P27: 25 | Q27: 7 | R27: 5.94 | S27: 26 | T27: 8 | U27: 5.83 | V27: 27 | W27: 6 | X27: 5.8849999999999998 | Y27: 27 | Z27: 212.81481481481481 | AA27: =+(X27+U27+R27+O27+L27+I27+F27+C27)/8 -> 5.8092500000000014 | AB27: =MINA(X27,U27,R27,O27,L27,I27,F27,C27) -> 5.7190000000000003
A28: GABRIEL | B28: 7 | C28: 5.7190000000000003 | D28: 21 | E28: 8 | F28: 5.7190000000000003 | G28: 26 | H28: 6 | I28: 5.7190000000000003 | J28: 28 | K28: 4 | L28: 5.5970000000000004 | M28: 27 | N28: 2 | O28: 5.718 | P28: 25 | Q28: 1 | R28: 5.61 | S28: 25 | T28: 3 | U28: 5.5 | V28: 29 | W28: 5 | X28: 5.7130000000000001 | Y28: 26 | Z28: 207.44444444444446 | AA28: =+(X28+U28+R28+O28+L28+I28+F28+C28)/8 -> 5.6618750000000002 | AB28: =MINA(X28,U28,R28,O28,L28,I28,F28,C28) -> 5.5
A29: MANE | B29: 2 | C29: 5.28 | D29: 24 | E29: 1 | F29: 5.72 | G29: 28 | H29: 3 | I29: 5.61 | J29: 26 | K29: 5 | L29: 5.9950000000000001 | M29: 23 | N29: 7 | O29: 5.94 | P29: 23 | Q29: 8 | R29: 5.9349999999999996 | S29: 25 | T29: 6 | U29: 5.7220000000000004 | V29: 23 | W29: 4 | X29: 5.665 | Y29: 28 | Z29: 201.87037037037038 | AA29: =+(X29+U29+R29+O29+L29+I29+F29+C29)/8 -> 5.7333750000000006 | AB29: =MINA(X29,U29,R29,O29,L29,I29,F29,C29) -> 5.28
A30: Bateria 4
A31: Nome | B31: P | C31: Tempo | D31: Vol | E31: P | F31: Tempo | G31: Vol | H31: P | I31: Tempo | J31: Vol | K31: P | L31: Tempo | M31: Vol | N31: P | O31: Tempo | P31: Vol | Q31: P | R31: Tempo | S31: Vol | T31: P | U31: Tempo | V31: Vol | W31: P | X31: Tempo | Y31: Vol | Z31: Total | AA31: Media | AB31: Record
A32: RUBAO | B32: 3 | C32: 5.28 | D32: 29 | E32: 5 | F32: 5.28 | G32: 28 | H32: 7 | I32: 5.444 | J32: 29 | K32: 8 | L32: 5.4939999999999998 | M32: 28 | N32: 6 | O32: 5.391 | P32: 30 | Q32: 4 | R32: 5.3879999999999999 | S32: 31 | T32: 2 | U32: 5.335 | V32: 29 | W32: 1 | X32: 5.4969999999999999 | Y32: 29 | Z32: 235.05555555555554 | AA32: =+(X32+U32+R32+O32+L32+I32+F32+C32)/8 -> 5.3886250000000002 | AB32: =MINA(X32,U32,R32,O32,L32,I32,F32,C32) -> 5.28
A33: JOAO KIBON | B33: 5 | C33: 5.4989999999999997 | D33: 28 | E33: 7 | F33: 5.39 | G33: 30 | H33: 8 | I33: 5.5 | J33: 30 | K33: 6 | L33: 5.383 | M33: 30 | N33: 4 | O33: 5.39 | P33: 30 | Q33: 2 | R33: 5.4939999999999998 | S33: 29 | T33: 1 | U33: 5.61 | V33: 26 | W33: 3 | X33: 5.4989999999999997 | Y33: 30 | Z33: 234.37037037037038 | AA33: =+(X33+U33+R33+O33+L33+I33+F33+C33)/8 -> 5.4706250000000001 | AB33: =MINA(X33,U33,R33,O33,L33,I33,F33,C33) -> 5.383
A34: BONGA | B34: 7 | C34: 5.5 | D34: 28 | E34: 8 | F34: 5.28 | G34: 27 | H34: 6 | I34: 5.5 | J34: 30 | K34: 4 | L34: 5.28 | M34: 31 | N34: 2 | O34: 5.4950000000000001 | P34: 30 | Q34: 1 | R34: 5.4989999999999997 | S34: 29 | T34: 3 | U34: 4.4 | V34: 28 | W34: 5 | X34: 5.5 | Y34: 29 | Z34: 232.83333333333334 | AA34: =+(X34+U34+R34+O34+L34+I34+F34+C34)/8 -> 5.3067500000000001 | AB34: =MINA(X34,U34,R34,O34,L34,I34,F34,C34) -> 4.4
A35: ERUNDA | B35: 4 | C35: 5.5 | D35: 28 | E35: 2 | F35: 5.5 | G35: 29 | H35: 1 | I35: 5.72 | J35: 27 | K35: 3 | L35: 5.4989999999999997 | M35: 30 | N35: 5 | O35: 5.61 | P35: 27 | Q35: 7 | R35: 5.5 | S35: 29 | T35: 8 | U35: 5.72 | V35: 27 | W35: 6 | X35: 5.72 | Y35: 24 | Z35: 222.87037037037038 | AA35: =+(X35+U35+R35+O35+L35+I35+F35+C35)/8 -> 5.5961249999999998 | AB35: =MINA(X35,U35,R35,O35,L35,I35,F35,C35) -> 5.4989999999999997
A36: JAPAO | B36: 8 | C36: 5.9379999999999997 | D36: 25 | E36: 6 | F36: 6.16 | G36: 23 | H36: 4 | I36: 5.72 | J36: 28 | K36: 2 | L36: 5.7190000000000003 | M36: 28 | N36: 1 | O36: 5.6639999999999997 | P36: 29 | Q36: 3 | R36: 5.49 | S36: 29 | T36: 5 | U36: 5.7190000000000003 | V36: 24 | W36: 7 | X36: 5.6070000000000002 | Y36: 29 | Z36: 216.85185185185185 | AA36: =+(X36+U36+R36+O36+L36+I36+F36+C36)/8 -> 5.7521250000000013 | AB36: =MINA(X36,U36,R36,O36,L36,I36,F36,C36) -> 5.49
A37: RUDSON | B37: 2 | C37: 5.5 | D37: 27 | E37: 1 | F37: 5.9329999999999998 | G37: 27 | H37: 3 | I37: 5.7130000000000001 | J37: 27 | K37: 5 | L37: 5.9390000000000001 | M37: 25 | N37: 7 | O37: 5.94 | P37: 24 | Q37: 8 | R37: 5.9390000000000001 | S37: 24 | T37: 6 | U37: 6.1589999999999998 | V37: 23 | W37: 4 | X37: 5.72 | Y37: 26 | Z37: 204.88888888888889 | AA37: =+(X37+U37+R37+O37+L37+I37+F37+C37)/8 -> 5.8553749999999996 | AB37: =MINA(X37,U37,R37,O37,L37,I37,F37,C37) -> 5.5
A38: RACHID | B38: 6 | C38: 5.5549999999999997 | D38: 19 | E38: 4 | F38: 5.72 | G38: 22 | H38: 2 | I38: 5.7140000000000004 | J38: 13 | K38: 1 | L38: 5.7190000000000003 | M38: 26 | N38: 3 | O38: 5.5 | P38: 25 | Q38: 5 | R38: 5.72 | S38: 26 | T38: 7 | U38: 5.72 | V38: 24 | W38: 8 | X38: 5.7190000000000003 | Y38: 26 | Z38: 182.7962962962963 | AA38: =+(X38+U38+R38+O38+L38+I38+F38+C38)/8 -> 5.6708749999999997 | AB38: =MINA(X38,U38,R38,O38,L38,I38,F38,C38) -> 5.5
A39: Bateria 5
A40: Nome | B40: P | C40: Tempo | D40: Vol | E40: P | F40: Tempo | G40: Vol | H40: P | I40: Tempo | J40: Vol | K40: P | L40: Tempo | M40: Vol | N40: P | O40: Tempo | P40: Vol | Q40: P | R40: Tempo | S40: Vol | T40: P | U40: Tempo | V40: Vol | W40: P | X40: Tempo | Y40: Vol | Z40: Total | AA40: Media | AB40: Record
A41: MICHEL | B41: 1 | C41: 5.06 | D41: 31 | E41: 3 | F41: 5.06 | G41: 32 | H41: 5 | I41: 5.2789999999999999 | J41: 31 | K41: 7 | L41: 5.28 | M41: 29 | N41: 8 | O41: 5.2770000000000001 | P41: 31 | Q41: 6 | R41: 5.27 | S41: 31 | T41: 4 | U41: 5.2789999999999999 | V41: 31 | W41: 2 | X41: 5.28 | Y41: 27 | Z41: 245.64814814814815 | AA41: =+(X41+U41+R41+O41+L41+I41+F41+C41)/8 -> 5.2231249999999996 | AB41: =MINA(X41,U41,R41,O41,L41,I41,F41,C41) -> 5.06
A42: ANGELAO | B42: 5 | C42: 5.2770000000000001 | D42: 29 | E42: 7 | F42: 5.28 | G42: 30 | H42: 8 | I42: 4.4 | J42: 30 | K42: 6 | L42: 5.2770000000000001 | M42: 31 | N42: 4 | O42: 5.06 | P42: 31 | Q42: 2 | R42: 5.2770000000000001 | S42: 30 | T42: 1 | U42: 5.2779999999999996 | V42: 28 | W42: 3 | X42: 5.2770000000000001 | Y42: 29 | Z42: 240.90740740740742 | AA42: =+(X42+U42+R42+O42+L42+I42+F42+C42)/8 -> 5.1407500000000006 | AB42: =MINA(X42,U42,R42,O42,L42,I42,F42,C42) -> 4.4
A43: ANDERSON | B43: 6 | C43: 5.28 | D43: 29 | E43: 4 | F43: 5.2789999999999999 | G43: 28 | H43: 2 | I43: 5.06 | J43: 30 | K43: 1 | L43: 5.2789999999999999 | M43: 31 | N43: 3 | O43: 5.0590000000000002 | P43: 33 | Q43: 5 | R43: 5.2770000000000001 | S43: 32 | T43: 7 | U43: 5.2789999999999999 | V43: 28 | W43: 8 | X43: 5.28 | Y43: 29 | Z43: 240.7962962962963 | AA43: =+(X43+U43+R43+O43+L43+I43+F43+C43)/8 -> 5.2241250000000008 | AB43: =MINA(X43,U43,R43,O43,L43,I43,F43,C43) -> 5.0590000000000002
A44: ERIC | B44: 4 | C44: 5.4969999999999999 | D44: 27 | E44: 2 | F44: 5.28 | G44: 29 | H44: 1 | I44: 5.5 | J44: 29 | K44: 3 | L44: 5.2750000000000004 | M44: 30 | N44: 5 | O44: 5.28 | P44: 31 | Q44: 7 | R44: 5.28 | S44: 28 | T44: 8 | U44: 5.5 | V44: 28 | W44: 6 | X44: 5.28 | Y44: 29 | Z44: 232.0185185185185 | AA44: =+(X44+U44+R44+O44+L44+I44+F44+C44)/8 -> 5.3615000000000004 | AB44: =MINA(X44,U44,R44,O44,L44,I44,F44,C44) -> 5.2750000000000004
A45: GIOVANNI | B45: 3 | C45: 5.4989999999999997 | D45: 29 | E45: 5 | F45: 5.72 | G45: 27 | H45: 7 | I45: 5.7190000000000003 | J45: 27 | K45: 8 | L45: 5.5 | M45: 28 | N45: 6 | O45: 5.5 | P45: 29 | Q45: 4 | R45: 5.72 | S45: 28 | T45: 2 | U45: 5.5 | V45: 30 | W45: 1 | X45: 5.5 | Y45: 28 | Z45: 227.77777777777777 | AA45: =+(X45+U45+R45+O45+L45+I45+F45+C45)/8 -> 5.5822500000000002 | AB45: =MINA(X45,U45,R45,O45,L45,I45,F45,C45) -> 5.4989999999999997
A46: DINHO | B46: 8 | C46: 5.4989999999999997 | D46: 28 | E46: 6 | F46: 5.5 | G46: 25 | H46: 4 | I46: 5.28 | J46: 30 | K46: 2 | L46: 5.4989999999999997 | M46: 24 | N46: 1 | O46: 5.5 | P46: 30 | Q46: 3 | R46: 5.5 | S46: 28 | T46: 5 | U46: 5.7190000000000003 | V46: 27 | W46: 7 | X46: 5.7190000000000003 | Y46: 27 | Z46: 219.4814814814815 | AA46: =+(X46+U46+R46+O46+L46+I46+F46+C46)/8 -> 5.5270000000000001 | AB46: =MINA(X46,U46,R46,O46,L46,I46,F46,C46) -> 5.28
A47: KLEBER | B47: 2 | C47: 5.27 | D47: 30 | E47: 1 | F47: 5.28 | G47: 30 | H47: 3 | I47: 5.28 | J47: 28 | K47: 5 | L47: 5.4989999999999997 | M47: 30 | N47: 7 | O47: 5.5 | P47: 30 | Q47: 8 | R47: 5.7169999999999996 | S47: 24 | T47: 6 | U47: 5.7190000000000003 | V47: 25 | Z47: 197 | AA47: =+(X47+U47+R47+O47+L47+I47+F47+C47)/7 -> 5.4664285714285716 | AB47: =MINA(X47,U47,R47,O47,L47,I47,F47,C47) -> 5.27