A1: Patrocinadores

B1: Motos e Acessórios Honda - Rua Sete de Setembro, 387 - Fone: (15) 3331-6700. | C1: Rua Olavo Bilac, 254 - Vila Santana

B1: PILOTO | C1: Total
A2: 1 | B2: MICHEL | C2: 245.64814814814815
A3: =+A2+1 -> 2 | B3: ANGELAO | C3: 240.90740740740742
A4: =+A3+1 -> 3 | B4: ANDERSON | C4: 240.7962962962963
A5: =+A4+1 -> 4 | B5: MARCEL | C5: 237.12962962962962
A6: =+A5+1 -> 5 | B6: RUBAO | C6: 235.05555555555554
A7: =+A6+1 -> 6 | B7: JOAO KIBON | C7: 234.37037037037038
A8: =+A7+1 -> 7 | B8: BONGA | C8: 232.83333333333334
A9: =+A8+1 -> 8 | B9: ERIC | C9: 232.0185185185185
A10: =+A9+1 -> 9 | B10: JERA | C10: 231.27777777777777
A11: =+A10+1 -> 10 | B11: JULIO | C11: 227.92592592592592
A12: =+A11+1 -> 11 | B12: GIOVANNI | C12: 227.77777777777777
A13: =+A12+1 -> 12 | B13: ERUNDA | C13: 222.87037037037038
A14: =+A13+1 -> 13 | B14: DINHO | C14: 219.4814814814815
A15: =+A14+1 -> 14 | B15: GOROI | C15: 219.46296296296296
A16: =+A15+1 -> 15 | B16: FERNANDO | C16: 219.09259259259258
A17: =+A16+1 -> 16 | B17: EVANDRO | C17: 217.09259259259258
A18: =+A17+1 -> 17 | B18: JAPAO | C18: 216.85185185185185
A19: =+A18+1 -> 18 | B19: RICARDO | C19: 215.37037037037038
A20: =+A19+1 -> 19 | B20: PACHECO | C20: 213.05555555555554
A21: =+A20+1 -> 20 | B21: GERONIMO | C21: 212.81481481481481
A22: =+A21+1 -> 21 | B22: GUSTAVO | C22: 207.87037037037038
A23: =+A22+1 -> 22 | B23: GABRIEL | C23: 207.44444444444446
A24: =+A23+1 -> 23 | B24: RUDSON | C24: 204.88888888888889
A25: =+A24+1 -> 24 | B25: MANE | C25: 201.87037037037038
A26: =+A25+1 -> 25 | B26: MARCOS J | C26: 200.2037037037037
A27: =+A26+1 -> 26 | B27: KLEBER | C27: 197
A28: =+A27+1 -> 27 | B28: DANIEL | C28: 194.85185185185185
A29: =+A28+1 -> 28 | B29: NETO | C29: 192.14814814814815
A30: =+A29+1 -> 29 | B30: CASSIO | C30: 191.88888888888889
A31: =+A30+1 -> 30 | B31: FLAVIO | C31: 190.88888888888889
A32: =+A31+1 -> 31 | B32: RODRIGO | C32: 188.66666666666666
A33: =+A32+1 -> 32 | B33: BOLA | C33: 187.31481481481481
A34: =+A33+1 -> 33 | B34: TOMAZ | C34: 183.07407407407408
A35: =+A34+1 -> 34 | B35: RACHID | C35: 182.7962962962963
A36: =+A35+1 -> 35 | B36: M VINICIUS | C36: 180.66666666666666
A37: =+A36+1 -> 36 | B37: SANDRO ITU | C37: 172.27777777777777
A38: =+A37+1 -> 37 | B38: LUIZ FELIPE | C38: 157.14814814814815