A1: 1 Bateria
A2: Piloto | B2: Pi | C2: Tempo | D2: Vol | E2: Pi | F2: Tempo | G2: Vol | H2: Pi | I2: Tempo | J2: Vol | K2: Pi | L2: Tempo | M2: Vol | N2: Pi | O2: Tempo | P2: Vol | Q2: Pi | R2: Tempo | S2: Vol | T2: Pi | U2: Tempo | V2: Vol | W2: Pi | X2: Tempo | Y2: Vol | Z2: Total | AA2: Media | AB2: Record
A3: NICEU | B3: 2 | C3: 5.0597000000000003 | D3: 32 | E3: 1 | F3: 5.2807000000000004 | G3: 31 | H3: 3 | I3: 4.9512999999999998 | J3: 31 | K3: 5 | L3: 5.1151999999999997 | M3: 24 | N3: 7 | O3: 5.2794999999999996 | P3: 32 | Q3: 8 | R3: 5.3368000000000002 | S3: 23 | T3: 6 | U3: 5.3891 | V3: 30 | W3: 4 | X3: 5.1158000000000001 | Y3: 31.43 | Z3: =+Y3+V3+S3+P3+M3+J3+G3+D3 -> 234.43 | AA3: =+(X3+U3+R3+O3+L3+I3+F3+C3)/8 -> 5.1910124999999994 | AB3: =MINA(X3,U3,R3,O3,L3,I3,F3,C3) -> 4.9512999999999998
A4: CARLA | B4: 1 | C4: 5.9394 | D4: 24 | E4: 3 | F4: 5.2625999999999999 | G4: 28 | H4: 5 | I4: 5.4984999999999999 | J4: 29 | K4: 7 | L4: 5.3269000000000002 | M4: 29 | N4: 8 | O4: 5.1962000000000002 | P4: 27 | Q4: 6 | R4: 5.5003000000000002 | S4: 27 | T4: 4 | U4: 5.2805999999999997 | V4: 28 | W4: 2 | X4: 5.2805999999999997 | Y4: 29.48 | Z4: =+Y4+V4+S4+P4+M4+J4+G4+D4 -> 221.48 | AA4: =+(X4+U4+R4+O4+L4+I4+F4+C4)/8 -> 5.4106375 | AB4: =MINA(X4,U4,R4,O4,L4,I4,F4,C4) -> 5.1962000000000002
A5: CLEVERSON | B5: 4 | C5: 5.2610999999999999 | D5: 30 | E5: 2 | F5: 5.2805 | G5: 28 | H5: 1 | I5: 5.4945000000000004 | J5: 20 | K5: 3 | L5: 5.5002000000000004 | M5: 23 | N5: 5 | O5: 5.2804000000000002 | P5: 29 | Q5: 7 | R5: 5.4813000000000001 | S5: 27 | T5: 8 | U5: 5.2321 | V5: 30 | W5: 6 | X5: 5.117 | Y5: 33.28 | Z5: =+Y5+V5+S5+P5+M5+J5+G5+D5 -> 220.28 | AA5: =+(X5+U5+R5+O5+L5+I5+F5+C5)/8 -> 5.3308874999999993 | AB5: =MINA(X5,U5,R5,O5,L5,I5,F5,C5) -> 5.117
A6: RAMOS | B6: 3 | C6: 5.2805 | D6: 29 | E6: 5 | F6: 5.3356000000000003 | G6: 28 | H6: 7 | I6: 5.4835000000000003 | J6: 29 | K6: 8 | L6: 5.9212999999999996 | M6: 19 | N6: 6 | O6: 5.2622 | P6: 31 | Q6: 4 | R6: 5.2794999999999996 | S6: 24 | T6: 2 | U6: 5.0609999999999999 | V6: 28 | W6: 1 | X6: 5.2935999999999996 | Y6: 27.72 | Z6: =+Y6+V6+S6+P6+M6+J6+G6+D6 -> 215.72 | AA6: =+(X6+U6+R6+O6+L6+I6+F6+C6)/8 -> 5.3646499999999993 | AB6: =MINA(X6,U6,R6,O6,L6,I6,F6,C6) -> 5.0609999999999999
A7: EDGAR | B7: 7 | C7: 5.5015000000000001 | D7: 29 | E7: 8 | F7: 5.4451999999999998 | G7: 28 | H7: 6 | I7: 5.5004999999999997 | J7: 27 | K7: 4 | L7: 5.7754000000000003 | M7: 26 | N7: 2 | O7: 5.9215 | P7: 22 | Q7: 1 | R7: 5.7202000000000002 | S7: 27 | T7: 3 | U7: 5.5003000000000002 | V7: 27 | W7: 5 | X7: 5.7192999999999996 | Y7: 28.48 | Z7: =+Y7+V7+S7+P7+M7+J7+G7+D7 -> 214.48 | AA7: =+(X7+U7+R7+O7+L7+I7+F7+C7)/8 -> 5.6354875 | AB7: =MINA(X7,U7,R7,O7,L7,I7,F7,C7) -> 5.4451999999999998
A8: CORINGA | B8: 8 | C8: 5.5004 | D8: 19 | E8: 6 | F8: 5.4993999999999996 | G8: 25 | H8: 4 | I8: 5.4989999999999997 | J8: 24 | K8: 2 | L8: 5.7209000000000003 | M8: 21 | N8: 1 | O8: 5.7161999999999997 | P8: 23 | Q8: 3 | R8: 5.4992999999999999 | S8: 23 | T8: 5 | U8: 5.5003000000000002 | V8: 28 | W8: 7 | X8: 5.2933000000000003 | Y8: 26.26 | Z8: =+Y8+V8+S8+P8+M8+J8+G8+D8 -> 189.26 | AA8: =+(X8+U8+R8+O8+L8+I8+F8+C8)/8 -> 5.5286000000000008 | AB8: =MINA(X8,U8,R8,O8,L8,I8,F8,C8) -> 5.2933000000000003
A9: JONNY | B9: 5 | C9: 5.5007999999999999 | D9: 22 | E9: 7 | F9: 5.72 | G9: 26 | H9: 8 | I9: 5.5007999999999999 | J9: 19 | K9: 6 | L9: 5.5000999999999998 | M9: 21 | N9: 4 | O9: 5.5936000000000003 | P9: 24 | Q9: 2 | R9: 5.5008999999999997 | S9: 20 | T9: 1 | U9: 5.9394 | V9: 23 | W9: 3 | X9: 5.2786 | Y9: 26.81 | Z9: =+Y9+V9+S9+P9+M9+J9+G9+D9 -> 181.81 | AA9: =+(X9+U9+R9+O9+L9+I9+F9+C9)/8 -> 5.5667749999999998 | AB9: =MINA(X9,U9,R9,O9,L9,I9,F9,C9) -> 5.2786
A10: 2 Bateria
A11: Piloto | B11: Pi | C11: Tempo | D11: Vol | E11: Pi | F11: Tempo | G11: Vol | H11: Pi | I11: Tempo | J11: Vol | K11: Pi | L11: Tempo | M11: Vol | N11: Pi | O11: Tempo | P11: Vol | Q11: Pi | R11: Tempo | S11: Vol | T11: Pi | U11: Tempo | V11: Vol | W11: Pi | X11: Tempo | Y11: Vol | Z11: Total | AA11: Media | AB11: Record
A12: EVRANDRO | B12: 2 | C12: 4.5994000000000002 | D12: 35 | E12: 1 | F12: 4.6195000000000004 | G12: 37 | H12: 3 | I12: 4.5115999999999996 | J12: 37 | K12: 5 | L12: 4.6208 | M12: 35 | N12: 7 | O12: 4.8376999999999999 | P12: 35 | Q12: 8 | R12: 4.6207000000000003 | S12: 35 | T12: 6 | U12: 4.6367000000000003 | V12: 37 | W12: 4 | X12: 4.6199000000000003 | Y12: 35.07 | Z12: =+Y12+V12+S12+P12+M12+J12+G12+D12 -> 286.07 | AA12: =+(X12+U12+R12+O12+L12+I12+F12+C12)/8 -> 4.6332875000000007 | AB12: =MINA(X12,U12,R12,O12,L12,I12,F12,C12) -> 4.5115999999999996
A13: RUDSON | B13: 4 | C13: 4.4565000000000001 | D13: 34 | E13: 2 | F13: 4.62 | G13: 32 | H13: 1 | I13: 5.0408999999999997 | J13: 29 | K13: 3 | L13: 4.6204000000000001 | M13: 35 | N13: 5 | O13: 4.8265000000000002 | P13: 32 | Q13: 7 | R13: 4.8391000000000002 | S13: 32 | T13: 8 | U13: 4.7858000000000001 | V13: 32 | W13: 6 | X13: 4.8532000000000002 | Y13: 35.26 | Z13: =+Y13+V13+S13+P13+M13+J13+G13+D13 -> 261.26 | AA13: =+(X13+U13+R13+O13+L13+I13+F13+C13)/8 -> 4.7553000000000001 | AB13: =MINA(X13,U13,R13,O13,L13,I13,F13,C13) -> 4.4565000000000001
A14: BARIZON | B14: 3 | C14: 4.6744000000000003 | D14: 32 | E14: 5 | F14: 4.7305000000000001 | G14: 32 | H14: 7 | I14: 4.6207000000000003 | J14: 32 | K14: 8 | L14: 4.8400999999999996 | M14: 28 | N14: 6 | O14: 4.6749999999999998 | P14: 31 | Q14: 4 | R14: 4.6208999999999998 | S14: 31 | T14: 2 | U14: 4.6207000000000003 | V14: 32 | W14: 1 | X14: 4.6215000000000002 | Y14: 31.7 | Z14: =+Y14+V14+S14+P14+M14+J14+G14+D14 -> 249.7 | AA14: =+(X14+U14+R14+O14+L14+I14+F14+C14)/8 -> 4.6754749999999996 | AB14: =MINA(X14,U14,R14,O14,L14,I14,F14,C14) -> 4.6207000000000003
A15: RODRIGO | B15: 1 | C15: 5.0602 | D15: 31 | E15: 3 | F15: 5.0476000000000001 | G15: 32 | H15: 5 | I15: 5.3341000000000003 | J15: 28 | K15: 7 | L15: 5.0048000000000004 | M15: 31 | N15: 8 | O15: 5.0438000000000001 | P15: 29 | Q15: 6 | R15: 5.2224000000000004 | S15: 28 | T15: 4 | U15: 5.0296000000000003 | V15: 29 | W15: 2 | X15: 4.8426 | Y15: 31.74 | Z15: =+Y15+V15+S15+P15+M15+J15+G15+D15 -> 239.74 | AA15: =+(X15+U15+R15+O15+L15+I15+F15+C15)/8 -> 5.0731375000000005 | AB15: =MINA(X15,U15,R15,O15,L15,I15,F15,C15) -> 4.8426
A16: TONINHO | B16: 6 | C16: 5.7267999999999999 | D16: 26 | E16: 4 | F16: 5.0427999999999997 | G16: 31 | H16: 2 | I16: 5.0594000000000001 | J16: 30 | K16: 1 | L16: 5.4966999999999997 | M16: 27 | N16: 3 | O16: 4.9512 | P16: 33 | Q16: 5 | R16: 5.0602 | S16: 31 | T16: 7 | U16: 5.0800999999999998 | V16: 31 | W16: 8 | X16: 5.1154000000000002 | Y16: 30.43 | Z16: =+Y16+V16+S16+P16+M16+J16+G16+D16 -> 239.43 | AA16: =+(X16+U16+R16+O16+L16+I16+F16+C16)/8 -> 5.1915749999999994 | AB16: =MINA(X16,U16,R16,O16,L16,I16,F16,C16) -> 4.9512
A17: GLUB | B17: 8 | C17: 5.2808000000000002 | D17: 28 | E17: 6 | F17: 5.2801 | G17: 32 | H17: 4 | I17: 5.2798999999999996 | J17: 26 | K17: 2 | L17: 5.2262000000000004 | M17: 31 | N17: 1 | O17: 5.5007000000000001 | P17: 28 | Q17: 3 | R17: 5.2554999999999996 | S17: 30 | T17: 5 | U17: 5.4470000000000001 | V17: 30 | W17: 7 | X17: 5.2805 | Y17: 29.46 | Z17: =+Y17+V17+S17+P17+M17+J17+G17+D17 -> 234.46 | AA17: =+(X17+U17+R17+O17+L17+I17+F17+C17)/8 -> 5.318837499999999 | AB17: =MINA(X17,U17,R17,O17,L17,I17,F17,C17) -> 5.2262000000000004
A18: RUBAO | B18: 5 | C18: 5.0595999999999997 | D18: 34 | E18: 7 | F18: 4.8403 | G18: 29 | H18: 8 | I18: 4.9503000000000004 | J18: 10 | K18: 6 | L18: 4.8399000000000001 | M18: 33 | N18: 4 | O18: 4.8394000000000004 | P18: 35 | Q18: 2 | R18: 4.8954000000000004 | S18: 26 | T18: 1 | U18: 5.0602 | V18: 22 | W18: 3 | X18: 5.0437000000000003 | Y18: 30.07 | Z18: =+Y18+V18+S18+P18+M18+J18+G18+D18 -> 219.07 | AA18: =+(X18+U18+R18+O18+L18+I18+F18+C18)/8 -> 4.9411000000000005 | AB18: =MINA(X18,U18,R18,O18,L18,I18,F18,C18) -> 4.8394000000000004
A19: 3 Bateria
A20: Piloto | B20: Pi | C20: Tempo | D20: Vol | E20: Pi | F20: Tempo | G20: Vol | H20: Pi | I20: Tempo | J20: Vol | K20: Pi | L20: Tempo | M20: Vol | N20: Pi | O20: Tempo | P20: Vol | Q20: Pi | R20: Tempo | S20: Vol | T20: Pi | U20: Tempo | V20: Vol | W20: Pi | X20: Tempo | Y20: Vol | Z20: Total | AA20: Media | AB20: Record
A21: DINHO | B21: 2 | C21: 4.3438999999999997 | D21: 39 | E21: 1 | F21: 4.444 | G21: 37 | H21: 3 | I21: 4.3990999999999998 | J21: 38 | K21: 5 | L21: 4.4001000000000001 | M21: 36 | N21: 7 | O21: 4.5209999999999999 | P21: 37 | Q21: 8 | R21: 4.4 | S21: 37 | T21: 6 | U21: 4.2900999999999998 | V21: 37 | W21: 4 | X21: 4.1806999999999999 | Y21: 37.72 | Z21: =+Y21+V21+S21+P21+M21+J21+G21+D21 -> 298.72 | AA21: =+(X21+U21+R21+O21+L21+I21+F21+C21)/8 -> 4.3723624999999995 | AB21: =MINA(X21,U21,R21,O21,L21,I21,F21,C21) -> 4.1806999999999999
A22: BONGA | B22: 7 | C22: 4.6150000000000002 | D22: 38 | E22: 8 | F22: 4.7285000000000004 | G22: 36 | H22: 6 | I22: 4.5103 | J22: 37 | K22: 4 | L22: 4.3975999999999997 | M22: 35 | N22: 2 | O22: 4.4006999999999996 | P22: 38 | Q22: 1 | R22: 4.6181999999999999 | S22: 36 | T22: 3 | U22: 4.3640999999999996 | V22: 36 | W22: 5 | X22: 4.6020000000000003 | Y22: 36.59 | Z22: =+Y22+V22+S22+P22+M22+J22+G22+D22 -> 292.59 | AA22: =+(X22+U22+R22+O22+L22+I22+F22+C22)/8 -> 4.5295500000000004 | AB22: =MINA(X22,U22,R22,O22,L22,I22,F22,C22) -> 4.3640999999999996
A23: JERA | B23: 4 | C23: 4.4016999999999999 | D23: 38 | E23: 2 | F23: 4.4 | G23: 35 | H23: 1 | I23: 4.4542999999999999 | J23: 38 | K23: 3 | L23: 4.3459000000000003 | M23: 36 | N23: 5 | O23: 4.5106000000000002 | P23: 37 | Q23: 7 | R23: 4.4375999999999998 | S23: 37 | T23: 8 | U23: 4.6201999999999996 | V23: 37 | W23: 6 | X23: 4.5103999999999997 | Y23: 31.09 | Z23: =+Y23+V23+S23+P23+M23+J23+G23+D23 -> 289.09 | AA23: =+(X23+U23+R23+O23+L23+I23+F23+C23)/8 -> 4.4600875000000002 | AB23: =MINA(X23,U23,R23,O23,L23,I23,F23,C23) -> 4.3459000000000003
A24: LISTER | B24: 5 | C24: 4.62 | D24: 36 | E24: 7 | F24: 4.5266999999999999 | G24: 37 | H24: 8 | I24: 4.6755000000000004 | J24: 36 | K24: 6 | L24: 4.6165000000000003 | M24: 34 | N24: 4 | O24: 4.4569000000000001 | P24: 38 | Q24: 2 | R24: 4.6165000000000003 | S24: 36 | T24: 1 | U24: 4.5643000000000002 | V24: 36 | W24: 3 | X24: 4.6166 | Y24: 35.72 | Z24: =+Y24+V24+S24+P24+M24+J24+G24+D24 -> 288.72 | AA24: =+(X24+U24+R24+O24+L24+I24+F24+C24)/8 -> 4.5866249999999997 | AB24: =MINA(X24,U24,R24,O24,L24,I24,F24,C24) -> 4.4569000000000001
A25: KLEBER | B25: 1 | C25: 4.5206 | D25: 35 | E25: 3 | F25: 4.4006999999999996 | G25: 31 | H25: 5 | I25: 4.7356999999999996 | J25: 28 | K25: 7 | L25: 4.6757 | M25: 36 | N25: 8 | O25: 4.8273999999999999 | P25: 32 | Q25: 6 | R25: 4.5965999999999996 | S25: 35 | T25: 4 | U25: 4.5095000000000001 | V25: 36 | W25: 2 | X25: 4.3971 | Y25: 26.3 | Z25: =+Y25+V25+S25+P25+M25+J25+G25+D25 -> 259.3 | AA25: =+(X25+U25+R25+O25+L25+I25+F25+C25)/8 -> 4.5829124999999999 | AB25: =MINA(X25,U25,R25,O25,L25,I25,F25,C25) -> 4.3971
A26: TETA | B26: 3 | C26: 4.4551999999999996 | D26: 34 | E26: 5 | F26: 3.9584000000000001 | G26: 34 | H26: 7 | I26: 4.6195000000000004 | J26: 32 | K26: 8 | L26: 4.5654000000000003 | M26: 34 | N26: 6 | O26: 4.6085000000000003 | P26: 37 | Q26: 4 | R26: 4.8411 | S26: 12 | T26: 2 | U26: 4.3411999999999997 | V26: 34 | W26: 1 | X26: 4.6626000000000003 | Y26: 27.07 | Z26: =+Y26+V26+S26+P26+M26+J26+G26+D26 -> 244.07 | AA26: =+(X26+U26+R26+O26+L26+I26+F26+C26)/8 -> 4.5064875000000004 | AB26: =MINA(X26,U26,R26,O26,L26,I26,F26,C26) -> 3.9584000000000001

A1: Pos | B1: Piloto | C1: Total
A2: 1 | B2: DINHO | C2: 298.72
A3: =+A2+1 -> 2 | B3: BONGA | C3: 292.59
A4: =+A3+1 -> 3 | B4: JERA | C4: 289.09
A5: =+A4+1 -> 4 | B5: LISTER | C5: 288.72
A6: =+A5+1 -> 5 | B6: EVRANDRO | C6: 286.07
A7: =+A6+1 -> 6 | B7: RUDSON | C7: 261.26
A8: =+A7+1 -> 7 | B8: KLEBER | C8: 259.3
A9: =+A8+1 -> 8 | B9: BARIZON | C9: 249.7
A10: =+A9+1 -> 9 | B10: TETA | C10: 244.07
A11: =+A10+1 -> 10 | B11: RODRIGO | C11: 239.74
A12: =+A11+1 -> 11 | B12: TONINHO | C12: 239.43
A13: =+A12+1 -> 12 | B13: GLUB | C13: 234.46
A14: =+A13+1 -> 13 | B14: NICEU | C14: 234.43
A15: =+A14+1 -> 14 | B15: CARLA | C15: 221.48
A16: =+A15+1 -> 15 | B16: CLEVERSON | C16: 220.28
A17: =+A16+1 -> 16 | B17: RUBAO | C17: 219.07
A18: =+A17+1 -> 17 | B18: RAMOS | C18: 215.72
A19: =+A18+1 -> 18 | B19: EDGAR | C19: 214.48
A20: =+A19+1 -> 19 | B20: CORINGA | C20: 189.26
A21: =+A20+1 -> 20 | B21: JONNY | C21: 181.81