A1: Pilotos | B1: Voltas | D1: Pilotos | E1: Pontos
A2: ANDERSON | B2: 263.10638297872339 | D2: ANDERSON | E2: 65
A3: ANGELAO | B3: 261.08510638297872 | D3: ANGELAO | E3: 60
A4: DINHO | B4: 260.91489361702128 | D4: DINHO | E4: 55
A5: MARCEL | B5: 259.68085106382978 | D5: MARCEL | E5: 50
A6: MICHEL | B6: 259.468085106383 | D6: MICHEL | E6: 45
A7: JUNINHO | B7: 258.93617021276594 | D7: JUNINHO | E7: 40
A8: KLEBER | B8: 257.87234042553189 | D8: KLEBER | E8: 36
A9: BONGA | B9: 254.02127659574469 | D9: BONGA | E9: 32
A10: JULIO | B10: 253.85106382978722 | D10: JULIO | E10: 28
A11: CAVERNA | B11: 247.68085106382978 | D11: CAVERNA | E11: 24
A12: ERUNDA | B12: 245.17021276595744 | D12: ERUNDA | E12: 20
A13: GIOVANNI | B13: 243.21276595744681 | D13: GIOVANNI | E13: 17
A14: RUBENS | B14: 236.61702127659575 | D14: RUBENS | E14: 14
A15: CAVANHA | B15: 235.2340425531915 | D15: CAVANHA | E15: 11
A16: GODOI | B16: 229.19148936170214 | D16: GODOI | E16: 8
A17: GABRIEL | B17: 224.17021276595744 | D17: GABRIEL | E17: 5

A1: Bateria 1
A2: Nome | B2: P | C2: Tempo | D2: Vol | E2: P | F2: Tempo | G2: Vol | H2: P | I2: Tempo | J2: Vol | K2: P | L2: Tempo | M2: Vol | N2: P | O2: Tempo | P2: Vol | Q2: P | R2: Tempo | S2: Vol | T2: P | U2: Tempo | V2: Vol | W2: P | X2: Tempo | Y2: Vol | Z2: Total | AA2: Media | AB2: Record
A3: JULIO | B3: 8 | C3: 5.06 | D3: 33 | E3: 6 | F3: 5.0590000000000002 | G3: 32 | H3: 4 | I3: 5.226 | J3: 31 | K3: 2 | L3: 5.2779999999999996 | M3: 30 | N3: 1 | O3: 5.5 | P3: 29 | Q3: 3 | R3: 5.28 | S3: 33 | T3: 5 | U3: 5.06 | V3: 32 | W3: 7 | X3: 4.9370000000000003 | Y3: 32 | Z3: 253.85106382978722 | AA3: =+(X3+U3+R3+O3+L3+I3+F3+C3)/8 -> 5.1749999999999998 | AB3: =MINA(X3,U3,R3,O3,L3,I3,F3,C3) -> 4.9370000000000003
A4: CAVERNA | B4: 6 | C4: 5.06 | D4: 33 | E4: 4 | F4: 5.2779999999999996 | G4: 30 | H4: 2 | I4: 5.28 | J4: 32 | K4: 1 | L4: 5.3920000000000003 | M4: 31 | N4: 3 | O4: 5.17 | P4: 30 | Q4: 5 | R4: 5.2789999999999999 | S4: 31 | T4: 7 | U4: 5.0609999999999999 | V4: 30 | W4: 8 | X4: 5.2249999999999996 | Y4: 29 | Z4: 247.68085106382978 | AA4: =+(X4+U4+R4+O4+L4+I4+F4+C4)/8 -> 5.2181249999999997 | AB4: =MINA(X4,U4,R4,O4,L4,I4,F4,C4) -> 5.06
A5: ERUNDA | B5: 4 | C5: 5.2789999999999999 | D5: 30 | E5: 2 | F5: 5.2779999999999996 | G5: 32 | H5: 1 | I5: 5.28 | J5: 31 | K5: 3 | L5: 5.28 | M5: 32 | N5: 5 | O5: 5.17 | P5: 30 | Q5: 7 | R5: 5.2679999999999998 | S5: 31 | T5: 8 | U5: 5.28 | V5: 32 | W5: 6 | X5: 5.28 | Y5: 26 | Z5: 245.17021276595744 | AA5: =+(X5+U5+R5+O5+L5+I5+F5+C5)/8 -> 5.2643750000000002 | AB5: =MINA(X5,U5,R5,O5,L5,I5,F5,C5) -> 5.17
A6: GIOVANNI | B6: 2 | C6: 5.4969999999999999 | D6: 29 | E6: 1 | F6: 5.5 | G6: 30 | H6: 3 | I6: 5.2789999999999999 | J6: 32 | K6: 5 | L6: 5.28 | M6: 30 | N6: 7 | O6: 5.17 | P6: 29 | Q6: 8 | R6: 5.2770000000000001 | S6: 32 | T6: 6 | U6: 5.2670000000000003 | V6: 31 | W6: 4 | X6: 5.4359999999999999 | Y6: 30 | Z6: 243.21276595744681 | AA6: =+(X6+U6+R6+O6+L6+I6+F6+C6)/8 -> 5.3382500000000004 | AB6: =MINA(X6,U6,R6,O6,L6,I6,F6,C6) -> 5.17
A7: RUBAO | B7: 1 | C7: 5.5030000000000001 | D7: 28 | E7: 3 | F7: 5.4989999999999997 | G7: 28 | H7: 5 | I7: 5.4989999999999997 | J7: 26 | K7: 7 | L7: 5.28 | M7: 30 | N7: 8 | O7: 5.069 | P7: 32 | Q7: 6 | R7: 5.28 | S7: 31 | T7: 4 | U7: 5.28 | V7: 30 | W7: 2 | X7: 5.335 | Y7: 31 | Z7: 236.61702127659575 | AA7: =+(X7+U7+R7+O7+L7+I7+F7+C7)/8 -> 5.3431249999999997 | AB7: =MINA(X7,U7,R7,O7,L7,I7,F7,C7) -> 5.069
A8: KVANHA | B8: 5 | C8: 5.28 | D8: 31 | E8: 7 | F8: 5.4989999999999997 | G8: 30 | H8: 8 | I8: 5.28 | J8: 29 | K8: 6 | L8: 5.17 | M8: 32 | N8: 4 | O8: 5.17 | P8: 30 | Q8: 2 | R8: 5.2750000000000004 | S8: 31 | T8: 1 | U8: 5.2779999999999996 | V8: 29 | W8: 3 | X8: 5.17 | Y8: 21 | Z8: 235.2340425531915 | AA8: =+(X8+U8+R8+O8+L8+I8+F8+C8)/8 -> 5.2652500000000009 | AB8: =MINA(X8,U8,R8,O8,L8,I8,F8,C8) -> 5.17
A9: GODOY | B9: 7 | C9: 5.0590000000000002 | D9: 32 | E9: 8 | F9: 5.056 | G9: 30 | H9: 6 | I9: 5.0590000000000002 | J9: 32 | K9: 4 | L9: 5.28 | M9: 31 | N9: 2 | O9: 5.28 | P9: 30 | Q9: 1 | R9: 5.2839999999999998 | S9: 27 | T9: 3 | U9: 5.17 | V9: 20 | W9: 5 | X9: 5.1710000000000003 | Y9: 26 | Z9: 229.19148936170214 | AA9: =+(X9+U9+R9+O9+L9+I9+F9+C9)/8 -> 5.1698750000000002 | AB9: =MINA(X9,U9,R9,O9,L9,I9,F9,C9) -> 5.056
A10: GABRIEL | B10: 3 | C10: 5.27 | D10: 19 | E10: 5 | F10: 5.2789999999999999 | G10: 28 | H10: 7 | I10: 5.06 | J10: 26 | K10: 8 | L10: 5.1580000000000004 | M10: 31 | N10: 6 | O10: 5.17 | P10: 30 | Q10: 4 | R10: 5.2789999999999999 | S10: 30 | T10: 2 | U10: 5.2770000000000001 | V10: 31 | W10: 1 | X10: 5.28 | Y10: 29 | Z10: 224.17021276595744 | AA10: =+(X10+U10+R10+O10+L10+I10+F10+C10)/8 -> 5.2216249999999995 | AB10: =MINA(X10,U10,R10,O10,L10,I10,F10,C10) -> 5.06
A11: Bateria 2
A12: Nome | B12: P | C12: Tempo | D12: Vol | E12: P | F12: Tempo | G12: Vol | H12: P | I12: Tempo | J12: Vol | K12: P | L12: Tempo | M12: Vol | N12: P | O12: Tempo | P12: Vol | Q12: P | R12: Tempo | S12: Vol | T12: P | U12: Tempo | V12: Vol | W12: P | X12: Tempo | Y12: Vol | Z12: Total | AA12: Media | AB12: Record
A13: ANDERSON | B13: 8 | C13: 4.9509999999999996 | D13: 34 | E13: 6 | F13: 5.06 | G13: 33 | H13: 4 | I13: 5.0590000000000002 | J13: 33 | K13: 2 | L13: 5.1150000000000002 | M13: 33 | N13: 1 | O13: 5.2229999999999999 | P13: 31 | Q13: 3 | R13: 5.17 | S13: 33 | T13: 5 | U13: 5.048 | V13: 33 | W13: 7 | X13: 5.1150000000000002 | Y13: 33 | Z13: 263.10638297872339 | AA13: =+(X13+U13+R13+O13+L13+I13+F13+C13)/8 -> 5.092625 | AB13: =MINA(X13,U13,R13,O13,L13,I13,F13,C13) -> 4.9509999999999996
A14: ANGELAO | B14: 3 | C14: 5.0060000000000002 | D14: 32 | E14: 5 | F14: 5.06 | G14: 30 | H14: 7 | I14: 4.9509999999999996 | J14: 34 | K14: 8 | L14: 4.8949999999999996 | M14: 33 | N14: 6 | O14: 5.0549999999999997 | P14: 34 | Q14: 4 | R14: 5.0519999999999996 | S14: 33 | T14: 2 | U14: 5.1139999999999999 | V14: 33 | W14: 1 | X14: 5.2789999999999999 | Y14: 32 | Z14: 261.08510638297872 | AA14: =+(X14+U14+R14+O14+L14+I14+F14+C14)/8 -> 5.0514999999999999 | AB14: =MINA(X14,U14,R14,O14,L14,I14,F14,C14) -> 4.8949999999999996
A15: DINHO | B15: 4 | C15: 5.06 | D15: 32 | E15: 2 | F15: 5.17 | G15: 31 | H15: 1 | I15: 5.2789999999999999 | J15: 32 | K15: 3 | L15: 5.06 | M15: 33 | N15: 5 | O15: 5.0629999999999997 | P15: 31 | Q15: 7 | R15: 5.0590000000000002 | S15: 33 | T15: 8 | U15: 5.0510000000000002 | V15: 33 | W15: 6 | X15: 5.0590000000000002 | Y15: 33 | Z15: 260.91489361702128 | AA15: =+(X15+U15+R15+O15+L15+I15+F15+C15)/8 -> 5.1001250000000002 | AB15: =MINA(X15,U15,R15,O15,L15,I15,F15,C15) -> 5.0510000000000002
A16: MARCEL | B16: 7 | C16: 4.95 | D16: 34 | E16: 8 | F16: 5.0590000000000002 | G16: 33 | H16: 6 | I16: 5.06 | J16: 33 | K16: 4 | L16: 5.0629999999999997 | M16: 33 | N16: 2 | O16: 5.2220000000000004 | P16: 32 | Q16: 1 | R16: 5.3879999999999999 | S16: 31 | T16: 3 | U16: 5.2779999999999996 | V16: 32 | W16: 5 | X16: 5.0590000000000002 | Y16: 30 | Z16: 259.68085106382978 | AA16: =+(X16+U16+R16+O16+L16+I16+F16+C16)/8 -> 5.1348750000000001 | AB16: =MINA(X16,U16,R16,O16,L16,I16,F16,C16) -> 4.95
A17: MICHEL | B17: 1 | C17: 5.39 | D17: 30 | E17: 3 | F17: 5.07 | G17: 33 | H17: 5 | I17: 5.1150000000000002 | J17: 32 | K17: 7 | L17: 4.6769999999999996 | M17: 34 | N17: 8 | O17: 4.95 | P17: 33 | Q17: 6 | R17: 5.0590000000000002 | S17: 32 | T17: 4 | U17: 5.056 | V17: 33 | W17: 2 | X17: 5.17 | Y17: 32 | Z17: 259.468085106383 | AA17: =+(X17+U17+R17+O17+L17+I17+F17+C17)/8 -> 5.0608750000000002 | AB17: =MINA(X17,U17,R17,O17,L17,I17,F17,C17) -> 4.6769999999999996
A18: JUNIHNO | B18: 6 | C18: 4.95 | D18: 33 | E18: 4 | F18: 5.1150000000000002 | G18: 32 | H18: 2 | I18: 5.28 | J18: 31 | K18: 1 | L18: 5.4450000000000003 | M18: 31 | N18: 3 | O18: 5.2370000000000001 | P18: 32 | Q18: 5 | R18: 5.0579999999999998 | S18: 33 | T18: 7 | U18: 5.056 | V18: 34 | W18: 8 | X18: 5.0049999999999999 | Y18: 31 | Z18: 258.93617021276594 | AA18: =+(X18+U18+R18+O18+L18+I18+F18+C18)/8 -> 5.143250000000001 | AB18: =MINA(X18,U18,R18,O18,L18,I18,F18,C18) -> 4.95
A19: KLEBER | B19: 5 | C19: 5.06 | D19: 30 | E19: 7 | F19: 5.06 | G19: 33 | H19: 8 | I19: 5.0149999999999997 | J19: 32 | K19: 6 | L19: 5.06 | M19: 32 | N19: 4 | O19: 5.1130000000000004 | P19: 33 | Q19: 2 | R19: 5.0629999999999997 | S19: 32 | T19: 1 | U19: 5.27 | V19: 31 | W19: 3 | X19: 5.06 | Y19: 32 | Z19: 257.87234042553189 | AA19: =+(X19+U19+R19+O19+L19+I19+F19+C19)/8 -> 5.0876250000000001 | AB19: =MINA(X19,U19,R19,O19,L19,I19,F19,C19) -> 5.0149999999999997
A20: BONGA | B20: 2 | C20: 5.2270000000000003 | D20: 28 | E20: 1 | F20: 5.3789999999999996 | G20: 30 | H20: 3 | I20: 5.28 | J20: 33 | K20: 5 | L20: 5.1139999999999999 | M20: 32 | N20: 7 | O20: 5.0590000000000002 | P20: 32 | Q20: 8 | R20: 5.0609999999999999 | S20: 33 | T20: 6 | U20: 5.06 | V20: 32 | W20: 4 | X20: 5.06 | Y20: 32 | Z20: 254.02127659574469 | AA20: =+(X20+U20+R20+O20+L20+I20+F20+C20)/8 -> 5.1550000000000002 | AB20: =MINA(X20,U20,R20,O20,L20,I20,F20,C20) -> 5.0590000000000002