A1: Pilotos | B1: Pts 2º | C1: Voltas
A2: JUNINHO | B2: 65 | C2: 264.10638297872339
A3: DINHO | B3: 60 | C3: 261.29787234042556
A4: ANGELAO | B4: 55 | C4: 260.08510638297872
A5: MARCEL | B5: 50 | C5: 259.25531914893617
A6: ERUNDA | B6: 45 | C6: 256.78723404255317
A7: MICHEL | B7: 40 | C7: 256.21276595744683
A8: ANDERSON | B8: 36 | C8: 253.87234042553192
A9: JULIO | B9: 32 | C9: 252.04255319148936
A10: RUBENS | B10: 28 | C10: 251.40425531914894
A11: KLEBER | B11: 24 | C11: 249.25531914893617
A12: GODOI | B12: 20 | C12: 246.27659574468086
A13: GIOVANNI | B13: 17 | C13: 242.51063829787233
A14: CAVERNA | B14: 14 | C14: 237.04255319148936
A15: GABRIEL | B15: 11 | C15: 222.12765957446808
A16: BONGA | B16: 8 | C16: 205
A17: CAVANHA | B17: 0 | C17: 0

A1: Bateria 1
A2: Nome | B2: P | C2: Tempo | D2: Vol | E2: P | F2: Tempo | G2: Vol | H2: P | I2: Tempo | J2: Vol | K2: P | L2: Tempo | M2: Vol | N2: P | O2: Tempo | P2: Vol | Q2: P | R2: Tempo | S2: Vol | T2: P | U2: Tempo | V2: Vol | W2: P | X2: Tempo | Y2: Vol | Z2: Total | AA2: Media | AB2: Record
A3: MARCEL | B3: 5 | C3: 5.0590000000000002 | D3: 33 | E3: 7 | F3: 4.84 | G3: 33 | H3: 8 | I3: 4.95 | J3: 33 | K3: 6 | L3: 5.0049999999999999 | M3: 34 | N3: 4 | O3: 5.0590000000000002 | P3: 34 | Q3: 2 | R3: 5.17 | S3: 31 | T3: 1 | U3: 5.335 | V3: 28 | W3: 3 | X3: 5.06 | Y3: 33 | Z3: 259.25531914893617 | AA3: =+(X3+U3+R3+O3+L3+I3+F3+C3)/8 -> 5.0597499999999993 | AB3: =MINA(X3,U3,R3,O3,L3,I3,F3,C3) -> 4.84
A4: ERUNDA | B4: 1 | C4: 5.5 | D4: 29 | E4: 3 | F4: 5.17 | G4: 31 | H4: 5 | I4: 5.06 | J4: 32 | K4: 7 | L4: 4.8949999999999996 | M4: 32 | N4: 8 | O4: 5.0590000000000002 | P4: 34 | Q4: 6 | R4: 5.0049999999999999 | S4: 32 | T4: 4 | U4: 5.0030000000000001 | V4: 33 | W4: 2 | X4: 4.95 | Y4: 33 | Z4: 256.78723404255317 | AA4: =+(X4+U4+R4+O4+L4+I4+F4+C4)/8 -> 5.0802499999999995 | AB4: =MINA(X4,U4,R4,O4,L4,I4,F4,C4) -> 4.8949999999999996
A5: RUBAO | B5: 2 | C5: 5.5 | D5: 30 | E5: 1 | F5: 5.72 | G5: 29 | H5: 3 | I5: 5.335 | J5: 31 | K5: 5 | L5: 5.1710000000000003 | M5: 32 | N5: 7 | O5: 5.0590000000000002 | P5: 32 | Q5: 8 | R5: 5.06 | S5: 33 | T5: 6 | U5: 5.17 | V5: 32 | W5: 4 | X5: 5.28 | Y5: 32 | Z5: 251.40425531914894 | AA5: =+(X5+U5+R5+O5+L5+I5+F5+C5)/8 -> 5.2868750000000002 | AB5: =MINA(X5,U5,R5,O5,L5,I5,F5,C5) -> 5.0590000000000002
A6: GIOVANNI | B6: 4 | C6: 5.28 | D6: 31 | E6: 2 | F6: 5.4950000000000001 | G6: 28 | H6: 1 | I6: 5.4989999999999997 | J6: 29 | K6: 3 | L6: 5.2789999999999999 | M6: 31 | N6: 5 | O6: 5.2789999999999999 | P6: 30 | Q6: 7 | R6: 5.2249999999999996 | S6: 30 | T6: 8 | U6: 5.1150000000000002 | V6: 30 | W6: 6 | X6: 5.28 | Y6: 32 | Z6: 242.51063829787233 | AA6: =+(X6+U6+R6+O6+L6+I6+F6+C6)/8 -> 5.3064999999999998 | AB6: =MINA(X6,U6,R6,O6,L6,I6,F6,C6) -> 5.1150000000000002
A7: CAVERNA | B7: 8 | C7: 5.5 | D7: 28 | E7: 6 | F7: 5.28 | G7: 29 | H7: 4 | I7: 5.3920000000000003 | J7: 28 | K7: 2 | L7: 5.28 | M7: 29 | N7: 1 | O7: 5.4989999999999997 | P7: 27 | Q7: 3 | R7: 5.2789999999999999 | S7: 30 | T7: 5 | U7: 5.0709999999999997 | V7: 32 | W7: 7 | X7: 5.0049999999999999 | Y7: 33 | Z7: 237.04255319148936 | AA7: =+(X7+U7+R7+O7+L7+I7+F7+C7)/8 -> 5.2882499999999997 | AB7: =MINA(X7,U7,R7,O7,L7,I7,F7,C7) -> 5.0049999999999999
A8: GABRIEL | B8: 3 | C8: 5.2809999999999997 | D8: 28 | E8: 5 | F8: 5.28 | G8: 29 | H8: 7 | I8: 5.28 | J8: 28 | K8: 8 | L8: 5.1159999999999997 | M8: 30 | N8: 6 | O8: 5.28 | P8: 27 | Q8: 4 | R8: 5.5010000000000003 | S8: 27 | T8: 2 | U8: 5.5549999999999997 | V8: 27 | W8: 1 | X8: 5.5549999999999997 | Y8: 25 | Z8: 222.12765957446808 | AA8: =+(X8+U8+R8+O8+L8+I8+F8+C8)/8 -> 5.3559999999999999 | AB8: =MINA(X8,U8,R8,O8,L8,I8,F8,C8) -> 5.1159999999999997
A9: BONGA | B9: 7 | C9: 5.06 | D9: 32 | E9: 8 | F9: 5.06 | G9: 31 | H9: 6 | I9: 5.06 | J9: 32 | K9: 4 | L9: 5.0519999999999996 | M9: 32 | N9: 2 | O9: 5.1150000000000002 | P9: 31 | Q9: 1 | R9: 5.2789999999999999 | S9: 31 | T9: 3 | U9: 5.2249999999999996 | V9: 14 | W9: 5 | X9: 5.72 | Y9: 2 | Z9: 205 | AA9: =+(X9+U9+R9+O9+L9+I9+F9+C9)/8 -> 5.1963749999999997 | AB9: =MINA(X9,U9,R9,O9,L9,I9,F9,C9) -> 5.0519999999999996
A10: Bateria 2
A11: Nome | B11: P | C11: Tempo | D11: Vol | E11: P | F11: Tempo | G11: Vol | H11: P | I11: Tempo | J11: Vol | K11: P | L11: Tempo | M11: Vol | N11: P | O11: Tempo | P11: Vol | Q11: P | R11: Tempo | S11: Vol | T11: P | U11: Tempo | V11: Vol | W11: P | X11: Tempo | Y11: Vol | Z11: Total | AA11: Media | AB11: Record
A12: JUNIHNO | B12: 7 | C12: 4.8390000000000004 | D12: 34 | E12: 8 | F12: 4.8380000000000001 | G12: 34 | H12: 6 | I12: 4.84 | J12: 33 | K12: 4 | L12: 5.06 | M12: 32 | N12: 2 | O12: 5.2789999999999999 | P12: 32 | Q12: 1 | R12: 5.28 | S12: 31 | T12: 3 | U12: 5.06 | V12: 32 | W12: 5 | X12: 4.84 | Y12: 34 | Z12: 264.10638297872339 | AA12: =+(X12+U12+R12+O12+L12+I12+F12+C12)/8 -> 5.0044999999999993 | AB12: =MINA(X12,U12,R12,O12,L12,I12,F12,C12) -> 4.8380000000000001
A13: DINHO | B13: 4 | C13: 5.06 | D13: 30 | E13: 2 | F13: 5.0590000000000002 | G13: 33 | H13: 1 | I13: 5.2789999999999999 | J13: 31 | K13: 3 | L13: 5.0590000000000002 | M13: 32 | N13: 5 | O13: 4.84 | P13: 33 | Q13: 7 | R13: 4.84 | S13: 35 | T13: 8 | U13: 4.8390000000000004 | V13: 33 | W13: 6 | X13: 4.84 | Y13: 33 | Z13: 261.29787234042556 | AA13: =+(X13+U13+R13+O13+L13+I13+F13+C13)/8 -> 4.9770000000000003 | AB13: =MINA(X13,U13,R13,O13,L13,I13,F13,C13) -> 4.8390000000000004
A14: ANGELAO | B14: 3 | C14: 5.0570000000000004 | D14: 32 | E14: 5 | F14: 4.8949999999999996 | G14: 34 | H14: 7 | I14: 5.0510000000000002 | J14: 32 | K14: 8 | L14: 4.84 | M14: 33 | N14: 6 | O14: 5.0590000000000002 | P14: 34 | Q14: 4 | R14: 5.0590000000000002 | S14: 34 | T14: 2 | U14: 5.2789999999999999 | V14: 31 | W14: 1 | X14: 5.5 | Y14: 30 | Z14: 260.08510638297872 | AA14: =+(X14+U14+R14+O14+L14+I14+F14+C14)/8 -> 5.0925000000000002 | AB14: =MINA(X14,U14,R14,O14,L14,I14,F14,C14) -> 4.84
A15: MICHEL | B15: 1 | C15: 5.2789999999999999 | D15: 28 | E15: 3 | F15: 5.06 | G15: 32 | H15: 5 | I15: 4.8849999999999998 | J15: 30 | K15: 7 | L15: 4.84 | M15: 34 | N15: 8 | O15: 4.62 | P15: 34 | Q15: 6 | R15: 4.84 | S15: 35 | T15: 4 | U15: 5.0590000000000002 | V15: 31 | W15: 2 | X15: 5.06 | Y15: 32 | Z15: 256.21276595744683 | AA15: =+(X15+U15+R15+O15+L15+I15+F15+C15)/8 -> 4.9553750000000001 | AB15: =MINA(X15,U15,R15,O15,L15,I15,F15,C15) -> 4.62
A16: ANDERSON | B16: 8 | C16: 4.8360000000000003 | D16: 34 | E16: 6 | F16: 4.8959999999999999 | G16: 34 | H16: 4 | I16: 4.8949999999999996 | J16: 34 | K16: 2 | L16: 5.0049999999999999 | M16: 32 | N16: 1 | O16: 5.06 | P16: 19 | Q16: 3 | R16: 4.84 | S16: 33 | T16: 5 | U16: 5.06 | V16: 32 | W16: 7 | X16: 4.8390000000000004 | Y16: 34 | Z16: 253.87234042553192 | AA16: =+(X16+U16+R16+O16+L16+I16+F16+C16)/8 -> 4.9288749999999997 | AB16: =MINA(X16,U16,R16,O16,L16,I16,F16,C16) -> 4.8360000000000003
A17: JULIO | B17: 6 | C17: 5.0510000000000002 | D17: 31 | E17: 4 | F17: 5.0590000000000002 | G17: 33 | H17: 2 | I17: 5.06 | J17: 31 | K17: 1 | L17: 5.4989999999999997 | M17: 28 | N17: 3 | O17: 5.27 | P17: 31 | Q17: 5 | R17: 5.06 | S17: 31 | T17: 7 | U17: 5.0590000000000002 | V17: 32 | W17: 8 | X17: 5.06 | Y17: 33 | Z17: 252.04255319148936 | AA17: =+(X17+U17+R17+O17+L17+I17+F17+C17)/8 -> 5.1397499999999994 | AB17: =MINA(X17,U17,R17,O17,L17,I17,F17,C17) -> 5.0510000000000002
A18: KLEBER | B18: 2 | C18: 5.0590000000000002 | D18: 31 | E18: 1 | F18: 5.28 | G18: 29 | H18: 3 | I18: 5.05 | J18: 34 | K18: 5 | L18: 5.06 | M18: 33 | N18: 7 | O18: 5.06 | P18: 30 | Q18: 8 | R18: 5.28 | S18: 28 | T18: 6 | U18: 5.0590000000000002 | V18: 33 | W18: 4 | X18: 5.06 | Y18: 30 | Z18: 249.25531914893617 | AA18: =+(X18+U18+R18+O18+L18+I18+F18+C18)/8 -> 5.1134999999999993 | AB18: =MINA(X18,U18,R18,O18,L18,I18,F18,C18) -> 5.05
A19: GODOY | B19: 5 | C19: 4.84 | D19: 31 | E19: 7 | F19: 4.8410000000000002 | G19: 34 | H19: 8 | I19: 4.8949999999999996 | J19: 32 | K19: 6 | L19: 5.0110000000000001 | M19: 31 | N19: 4 | O19: 5.0590000000000002 | P19: 31 | Q19: 2 | R19: 5.06 | S19: 33 | T19: 1 | U19: 5.28 | V19: 26 | W19: 3 | X19: 5.0609999999999999 | Y19: 25 | Z19: 246.27659574468086 | AA19: =+(X19+U19+R19+O19+L19+I19+F19+C19)/8 -> 5.0058749999999996 | AB19: =MINA(X19,U19,R19,O19,L19,I19,F19,C19) -> 4.84