A1: Nome | B1: P | C1: M.VOL | D1: B1 | E1: P | F1: M.VOL | G1: B2 | H1: P | I1: M.VOL | J1: B3 | K1: P | L1: M.VOL | M1: B4 | N1: P | O1: M.VOL | P1: B5 | Q1: P | R1: M.VOL | S1: B6 | T1: P | U1: M.VOL | V1: B7 | W1: P | X1: M.VOL | Y1: B8 | Z1: TOTAL | AA1: MEDIA
A2: ANDERSON | B2: 5 | C2: 4.5640000000000001 | D2: 32 | E2: 7 | F2: 4.66 | G2: 29 | H2: 8 | I2: 4.3470000000000004 | J2: 34 | K2: 6 | L2: 4.2409999999999997 | M2: 33 | N2: 4 | O2: 5.3339999999999996 | P2: 32 | Q2: 2 | R2: 5.3339999999999996 | S2: 32 | T2: 1 | U2: 5.4450000000000003 | V2: 27 | W2: 3 | X2: 5.3890000000000002 | Y2: 31 | Z2: 250.93600000000001 | AA2: =+(X2+U2+R2+O2+L2+I2+F2+C2)/8 -> 4.91425
A3: GABRIEL | B3: 6 | C3: 4.7249999999999996 | D3: 30 | E3: 4 | F3: 4.6760000000000002 | G3: 31 | H3: 2 | I3: 4.399 | J3: 31 | K3: 1 | L3: 4.2350000000000003 | M3: 30 | N3: 3 | O3: 5.5 | P3: 29 | Q3: 5 | R3: 5.444 | S3: 29 | T3: 7 | U3: 5.3360000000000003 | V3: 31 | W3: 8 | X3: 5.2809999999999997 | Y3: 30 | Z3: 241.27699999999999 | AA3: =+(X3+U3+R3+O3+L3+I3+F3+C3)/8 -> 4.9495000000000005
A4: MANE | B4: 1 | C4: 5.2249999999999996 | D4: 28 | E4: 3 | F4: 5.0590000000000002 | G4: 29 | H4: 5 | I4: 4.9279999999999999 | J4: 31 | K4: 7 | L4: 4.2889999999999997 | M4: 31 | N4: 8 | O4: 5.335 | P4: 30 | Q4: 6 | R4: 5.4989999999999997 | S4: 29 | T4: 4 | U4: 5.5 | V4: 28 | W4: 2 | X4: 5.609 | Y4: 26 | Z4: 232.149 | AA4: =+(X4+U4+R4+O4+L4+I4+F4+C4)/8 -> 5.1805000000000003
A5: JAPAO | B5: 8 | C5: 5.3890000000000002 | D5: 26 | E5: 6 | F5: 5.17 | G5: 26 | H5: 4 | I5: 4.8769999999999998 | J5: 23 | K5: 2 | L5: 4.577 | M5: 29 | N5: 1 | O5: 6.2140000000000004 | P5: 27 | Q5: 3 | R5: 6.1050000000000004 | S5: 27 | T5: 5 | U5: 5.7210000000000001 | V5: 29 | W5: 7 | X5: 5.72 | Y5: 27 | Z5: 214.61699999999999 | AA5: =+(X5+U5+R5+O5+L5+I5+F5+C5)/8 -> 5.4716250000000004
A6: RODRIGUINHO | B6: 2 | C6: 5.06 | D6: 26 | E6: 1 | F6: 5.28 | G6: 22 | H6: 3 | I6: 5.06 | J6: 27 | K6: 5 | L6: 4.5650000000000004 | M6: 27 | N6: 7 | O6: 5.5 | P6: 27 | Q6: 8 | R6: 5.39 | S6: 28 | T6: 6 | U6: 5.3890000000000002 | V6: 26 | W6: 4 | X6: 5.6109999999999998 | Y6: 26 | Z6: 209.17 | AA6: =+(X6+U6+R6+O6+L6+I6+F6+C6)/8 -> 5.2318749999999996
A7: ROBERTO | B7: 3 | C7: 5.726 | D7: 23 | E7: 5 | F7: 6.2709999999999999 | G7: 21 | H7: 7 | I7: 5.8769999999999998 | J7: 22 | K7: 8 | L7: 5.5540000000000003 | M7: 24 | N7: 6 | O7: 6.5449999999999999 | P7: 24 | Q7: 4 | R7: 6.2140000000000004 | S7: 25 | T7: 2 | U7: 6.5439999999999996 | V7: 23 | W7: 1 | X7: 6.49 | Y7: 23 | Z7: 185.149 | AA7: =+(X7+U7+R7+O7+L7+I7+F7+C7)/8 -> 6.1526250000000005
A8: CAVANHA | B8: 4 | C8: 4.95 | D8: 31 | E8: 2 | F8: 5.0049999999999999 | G8: 30 | H8: 1 | I8: 5.0389999999999997 | J8: 17 | K8: 3 | L8: 4.51 | M8: 32 | N8: 5 | O8: 5.4450000000000003 | P8: 30 | Q8: 7 | R8: 5.7160000000000002 | S8: 16 | T8: 8 | U8: 5.94 | V8: 24 | W8: 6 | X8: 5.6079999999999997 | Y8: 29 | Z8: 179.83 | AA8: =+(X8+U8+R8+O8+L8+I8+F8+C8)/8 -> 5.276625000000001