A1: Nome | B1: P | C1: M.VOL | D1: B1 | E1: P | F1: M.VOL | G1: B2 | H1: P | I1: M.VOL | J1: B3 | K1: P | L1: M.VOL | M1: B4 | N1: P | O1: M.VOL | P1: B5 | Q1: P | R1: M.VOL | S1: B6 | T1: P | U1: M.VOL | V1: B7 | W1: P | X1: M.VOL | Y1: B8 | Z1: TOTAL | AA1: MEDIA
A2: JUNINHO | B2: 1 | C2: 5.5549999999999997 | D2: 31 | E2: 3 | F2: 5.39 | G2: 31 | H2: 5 | I2: 5.2779999999999996 | J2: 31 | K2: 7 | L2: 5.0579999999999998 | M2: 30 | N2: 8 | O2: 4.3460000000000001 | P2: 36 | Q2: 6 | R2: 5.0590000000000002 | S2: 32 | T2: 4 | U2: 5.1130000000000004 | V2: 32 | W2: 2 | X2: 4.8959999999999999 | Y2: 31 | Z2: 254.97900000000001 | AA2: =+(X2+U2+R2+O2+L2+I2+F2+C2)/8 -> 5.086875
A3: KLEBER | B3: 4 | C3: 5.444 | D3: 30 | E3: 2 | F3: 5.3929999999999998 | G3: 28 | H3: 1 | I3: 5.5 | J3: 30 | K3: 3 | L3: 5.3339999999999996 | M3: 32 | N3: 5 | O3: 4.95 | P3: 32 | Q3: 7 | R3: 5.0049999999999999 | S3: 31 | T3: 8 | U3: 4.95 | V3: 32 | W3: 6 | X3: 4.6079999999999997 | Y3: 33 | Z3: 248.87200000000001 | AA3: =+(X3+U3+R3+O3+L3+I3+F3+C3)/8 -> 5.1479999999999997
A4: ERIC | B4: 3 | C4: 5.609 | D4: 29 | E4: 5 | F4: 5.335 | G4: 30 | H4: 7 | I4: 5.444 | J4: 25 | K4: 8 | L4: 5.3890000000000002 | M4: 30 | N4: 6 | O4: 5.1159999999999997 | P4: 31 | Q4: 4 | R4: 5.17 | S4: 32 | T4: 2 | U4: 5.3339999999999996 | V4: 30 | W4: 1 | X4: 4.8949999999999996 | Y4: 30 | Z4: 237.87200000000001 | AA4: =+(X4+U4+R4+O4+L4+I4+F4+C4)/8 -> 5.2865000000000002
A5: RUDSON | B5: 5 | C5: 5.726 | D5: 27 | E5: 7 | F5: 5.72 | G5: 27 | H5: 8 | I5: 5.7729999999999997 | J5: 27 | K5: 6 | L5: 5.609 | M5: 29 | N5: 4 | O5: 5.39 | P5: 31 | Q5: 2 | R5: 5.391 | S5: 29 | T5: 1 | U5: 5.4459999999999997 | V5: 29 | W5: 3 | X5: 5.1689999999999996 | Y5: 30 | Z5: 229.66 | AA5: =+(X5+U5+R5+O5+L5+I5+F5+C5)/8 -> 5.5280000000000005
A6: PICA PAU | B6: 7 | C6: 5.7190000000000003 | D6: 28 | E6: 8 | F6: 5.72 | G6: 29 | H6: 6 | I6: 5.7759999999999998 | J6: 27 | K6: 4 | L6: 5.8849999999999998 | M6: 28 | N6: 2 | O6: 5.7160000000000002 | P6: 28 | Q6: 1 | R6: 5.94 | S6: 28 | T6: 3 | U6: 5.4450000000000003 | V6: 30 | W6: 5 | X6: 5.3339999999999996 | Y6: 27 | Z6: 225.63800000000001 | AA6: =+(X6+U6+R6+O6+L6+I6+F6+C6)/8 -> 5.6918749999999996
A7: SANDRO | B7: 2 | C7: 6.3810000000000002 | D7: 20 | E7: 1 | F7: 6.4429999999999996 | G7: 22 | H7: 3 | I7: 6.16 | J7: 24 | K7: 5 | L7: 6.2690000000000001 | M7: 26 | N7: 7 | O7: 6.16 | P7: 25 | Q7: 8 | R7: 6.09 | S7: 25 | T7: 6 | U7: 5.774 | V7: 25 | W7: 4 | X7: 5.8849999999999998 | Y7: 26 | Z7: 193.23400000000001 | AA7: =+(X7+U7+R7+O7+L7+I7+F7+C7)/8 -> 6.145249999999999
A8: XANEL | B8: 8 | C8: 5.4989999999999997 | D8: 28 | E8: 6 | F8: 5.5549999999999997 | G8: 25 | H8: 4 | I8: 5.7750000000000004 | J8: 20 | K8: 2 | L8: 5.992 | M8: 21 | N8: 1 | O8: 6.0490000000000004 | P8: 18 | Q8: 3 | R8: 5.5549999999999997 | S8: 18 | T8: 5 | U8: 5.335 | V8: 26 | W8: 7 | X8: 4.8330000000000002 | Y8: 28 | Z8: 184.191 | AA8: =+(X8+U8+R8+O8+L8+I8+F8+C8)/8 -> 5.5741250000000004
A9: M.VINICIUS | B9: 6 | C9: 6.327 | D9: 24 | E9: 4 | F9: 6.4939999999999998 | G9: 24 | H9: 2 | I9: 6.2149999999999999 | J9: 19 | K9: 1 | L9: 6.5449999999999999 | M9: 18 | N9: 3 | O9: 6.5449999999999999 | P9: 20 | Q9: 5 | R9: 6.3250000000000002 | S9: 25 | T9: 7 | U9: 6.2149999999999999 | V9: 25 | W9: 8 | X9: 5.8849999999999998 | Y9: 25 | Z9: 180.53200000000001 | AA9: =+(X9+U9+R9+O9+L9+I9+F9+C9)/8 -> 6.3188750000000002