A1: Nome | B1: P | C1: M.VOL | D1: B1 | E1: P | F1: M.VOL | G1: B2 | H1: P | I1: M.VOL | J1: B3 | K1: P | L1: M.VOL | M1: B4 | N1: P | O1: M.VOL | P1: B5 | Q1: P | R1: M.VOL | S1: B6 | T1: P | U1: M.VOL | V1: B7 | W1: P | X1: M.VOL | Y1: B8 | Z1: TOTAL | AA1: MEDIA
A2: importado | B2: 8 | C2: 5.0049999999999999 | D2: 31 | E2: 6 | F2: 5.1689999999999996 | G2: 32 | H2: 4 | I2: 5.2249999999999996 | J2: 32 | K2: 2 | L2: 5.2789999999999999 | M2: 31 | N2: 1 | O2: 5.444 | P2: 30 | Q2: 3 | R2: 5.3380000000000001 | S2: 28 | T2: 5 | U2: 5.2779999999999996 | V2: 32 | W2: 7 | X2: 5.1689999999999996 | Y2: 31 | Z2: 247.809 | AA2: =+(X2+U2+R2+O2+L2+I2+F2+C2)/8 -> 5.2383749999999996
A3: erunda | B3: 4 | C3: 5.718 | D3: 29 | E3: 2 | F3: 5.4619999999999997 | G3: 31 | H3: 1 | I3: 5.77 | J3: 29 | K3: 3 | L3: 5.3419999999999996 | M3: 32 | N3: 5 | O3: 5.3339999999999996 | P3: 32 | Q3: 7 | R3: 5.2229999999999999 | S3: 32 | T3: 8 | U3: 5.2240000000000002 | V3: 31 | W3: 6 | X3: 5.28 | Y3: 30 | Z3: 246.53200000000001 | AA3: =+(X3+U3+R3+O3+L3+I3+F3+C3)/8 -> 5.4191250000000011
A4: marquinho | B4: 7 | C4: 5.3890000000000002 | D4: 28 | E4: 8 | F4: 5.3890000000000002 | G4: 30 | H4: 6 | I4: 5.2789999999999999 | J4: 31 | K4: 4 | L4: 5.4450000000000003 | M4: 31 | N4: 2 | O4: 5.3940000000000001 | P4: 31 | Q4: 1 | R4: 5.7190000000000003 | S4: 26 | T4: 3 | U4: 4.2889999999999997 | V4: 32 | W4: 5 | X4: 5.3360000000000003 | Y4: 31 | Z4: 240.17 | AA4: =+(X4+U4+R4+O4+L4+I4+F4+C4)/8 -> 5.28
A5: kibon | B5: 1 | C5: 5.7750000000000004 | D5: 28 | E5: 3 | F5: 5.6050000000000004 | G5: 30 | H5: 5 | I5: 4.29 | J5: 30 | K5: 7 | L5: 5.4450000000000003 | M5: 31 | N5: 8 | O5: 5.4560000000000004 | P5: 27 | Q5: 6 | R5: 5.5659999999999998 | S5: 29 | T5: 4 | U5: 5.5 | V5: 30 | W5: 2 | X5: 5.5549999999999997 | Y5: 29 | Z5: 234.04300000000001 | AA5: =+(X5+U5+R5+O5+L5+I5+F5+C5)/8 -> 5.399
A6: caverna | B6: 5 | C6: 5.6639999999999997 | D6: 28 | E6: 7 | F6: 5.5010000000000003 | G6: 27 | H6: 8 | I6: 5.5549999999999997 | J6: 27 | K6: 6 | L6: 5.4429999999999996 | M6: 31 | N6: 4 | O6: 5.4450000000000003 | P6: 31 | Q6: 2 | R6: 5.56 | S6: 29 | T6: 1 | U6: 5.7249999999999996 | V6: 27 | W6: 3 | X6: 5.4980000000000002 | Y6: 29 | Z6: 229.23400000000001 | AA6: =+(X6+U6+R6+O6+L6+I6+F6+C6)/8 -> 5.5488749999999998
A7: rubenes | B7: 6 | C7: 5.4459999999999997 | D7: 27 | E7: 4 | F7: 5.5010000000000003 | G7: 30 | H7: 2 | I7: 5.556 | J7: 31 | K7: 1 | L7: 5.8289999999999997 | M7: 27 | N7: 3 | O7: 5.5 | P7: 30 | Q7: 5 | R7: 5.4969999999999999 | S7: 25 | T7: 7 | U7: 5.5 | V7: 29 | W7: 8 | X7: 5.3929999999999998 | Y7: 30 | Z7: 229.511 | AA7: =+(X7+U7+R7+O7+L7+I7+F7+C7)/8 -> 5.5277499999999993
A8: jeronimo | B8: 3 | C8: 5.9939999999999998 | D8: 23 | E8: 5 | F8: 5.94 | G8: 20 | H8: 7 | I8: 5.9390000000000001 | J8: 25 | K8: 8 | L8: 5.2240000000000002 | M8: 24 | N8: 6 | O8: 5.83 | P8: 25 | Q8: 4 | R8: 5.8849999999999998 | S8: 26 | T8: 2 | U8: 6.05 | V8: 23 | W8: 1 | X8: 5.8849999999999998 | Y8: 23 | Z8: 189.298 | AA8: =+(X8+U8+R8+O8+L8+I8+F8+C8)/8 -> 5.843375