A1: Nome | B1: P | C1: M.VOL | D1: B1 | E1: P | F1: M.VOL | G1: B2 | H1: P | I1: M.VOL | J1: B3 | K1: P | L1: M.VOL | M1: B4 | N1: P | O1: M.VOL | P1: B5 | Q1: P | R1: M.VOL | S1: B6 | T1: P | U1: M.VOL | V1: B7 | W1: P | X1: M.VOL | Y1: B8 | Z1: TOTAL | AA1: MEDIA
A2: BONGA | B2: 5 | C2: 5.3890000000000002 | D2: 31 | E2: 7 | F2: 5.2789999999999999 | G2: 31 | H2: 8 | I2: 5.2249999999999996 | J2: 31 | K2: 6 | L2: 5.3339999999999996 | M2: 31 | N2: 4 | O2: 5.3339999999999996 | P2: 30 | Q2: 2 | R2: 5.4459999999999997 | S2: 30 | T2: 1 | U2: 5.6109999999999998 | V2: 29 | W2: 3 | X2: 5.4450000000000003 | Y2: 30 | Z2: 243.10599999999999 | AA2: =+(X2+U2+R2+O2+L2+I2+F2+C2)/8 -> 5.3828750000000012
A3: CONRADO | B3: 7 | C3: 5.39 | D3: 31 | E3: 8 | F3: 5.39 | G3: 28 | H3: 6 | I3: 5.5 | J3: 28 | K3: 4 | L3: 5.4450000000000003 | M3: 28 | N3: 2 | O3: 5.508 | P3: 30 | Q3: 1 | R3: 5.665 | S3: 29 | T3: 3 | U3: 5.5540000000000003 | V3: 28 | W3: 5 | X3: 5.5 | Y3: 29 | Z3: 231.04300000000001 | AA3: =+(X3+U3+R3+O3+L3+I3+F3+C3)/8 -> 5.4939999999999998
A4: MARCEL | B4: 4 | C4: 5.28 | D4: 24 | E4: 2 | F4: 5.3879999999999999 | G4: 30 | H4: 1 | I4: 5.6639999999999997 | J4: 28 | K4: 3 | L4: 5.3890000000000002 | M4: 29 | N4: 5 | O4: 4.2350000000000003 | P4: 29 | Q4: 7 | R4: 5.2779999999999996 | S4: 31 | T4: 8 | U4: 5.3339999999999996 | V4: 28 | W4: 6 | X4: 5.335 | Y4: 30 | Z4: 229.83 | AA4: =+(X4+U4+R4+O4+L4+I4+F4+C4)/8 -> 5.2378749999999998
A5: SIMONE | B5: 1 | C5: 5.8310000000000004 | D5: 25 | E5: 3 | F5: 5.7750000000000004 | G5: 28 | H5: 5 | I5: 5.6719999999999997 | J5: 26 | K5: 7 | L5: 5.6639999999999997 | M5: 29 | N5: 8 | O5: 5.5549999999999997 | P5: 28 | Q5: 6 | R5: 5.5540000000000003 | S5: 29 | T5: 4 | U5: 5.7750000000000004 | V5: 27 | W5: 2 | X5: 5.774 | Y5: 27 | Z5: 219.489 | AA5: =+(X5+U5+R5+O5+L5+I5+F5+C5)/8 -> 5.7
A6: RICARDO | B6: 2 | C6: 5.7750000000000004 | D6: 28 | E6: 1 | F6: 5.8879999999999999 | G6: 29 | H6: 3 | I6: 5.7919999999999998 | J6: 28 | K6: 5 | L6: 5.7750000000000004 | M6: 28 | N6: 7 | O6: 5.6660000000000004 | P6: 29 | Q6: 8 | R6: 5.718 | S6: 25 | T6: 6 | U6: 5.8310000000000004 | V6: 26 | W6: 4 | X6: 5.83 | Y6: 26 | Z6: 219.191 | AA6: =+(X6+U6+R6+O6+L6+I6+F6+C6)/8 -> 5.7843749999999998
A7: M.JOSE | B7: 8 | C7: 5.9950000000000001 | D7: 27 | E7: 6 | F7: 5.9390000000000001 | G7: 25 | H7: 4 | I7: 6.1050000000000004 | J7: 27 | K7: 2 | L7: 5.9989999999999997 | M7: 27 | N7: 1 | O7: 6.1040000000000001 | P7: 24 | Q7: 3 | R7: 6.048 | S7: 25 | T7: 5 | U7: 6.0490000000000004 | V7: 26 | W7: 7 | X7: 5.9370000000000003 | Y7: 26 | Z7: 207.17 | AA7: =+(X7+U7+R7+O7+L7+I7+F7+C7)/8 -> 6.0219999999999994
A8: GERONIMO | B8: 6 | C8: 5.8860000000000001 | D8: 26 | E8: 4 | F8: 5.734 | G8: 26 | H8: 2 | I8: 5.9379999999999997 | J8: 28 | K8: 1 | L8: 5.9939999999999998 | M8: 26 | N8: 3 | O8: 5.9939999999999998 | P8: 27 | Q8: 5 | R8: 5.8289999999999997 | S8: 26 | T8: 7 | U8: 5.8259999999999996 | V8: 24 | W8: 8 | X8: 5.9930000000000003 | Y8: 23 | Z8: 206.04300000000001 | AA8: =+(X8+U8+R8+O8+L8+I8+F8+C8)/8 -> 5.8992500000000003
A9: DANIEL | B9: 3 | C9: 6.2149999999999999 | D9: 22 | E9: 5 | F9: 6.3259999999999996 | G9: 22 | H9: 7 | I9: 6.49 | J9: 21 | K9: 8 | L9: 6.3780000000000001 | M9: 18 | N9: 6 | O9: 6.6550000000000002 | P9: 17 | Q9: 4 | R9: 6.601 | S9: 23 | T9: 2 | U9: 6.4349999999999996 | V9: 21 | W9: 1 | X9: 6.8179999999999996 | Y9: 21 | Z9: 165.17 | AA9: =+(X9+U9+R9+O9+L9+I9+F9+C9)/8 -> 6.4897500000000008