A1: Nome | B1: P | C1: M.VOL | D1: B1 | E1: P | F1: M.VOL | G1: B2 | H1: P | I1: M.VOL | J1: B3 | K1: P | L1: M.VOL | M1: B4 | N1: P | O1: M.VOL | P1: B5 | Q1: P | R1: M.VOL | S1: B6 | T1: P | U1: M.VOL | V1: B7 | W1: P | X1: M.VOL | Y1: B8 | Z1: TOTAL | AA1: MEDIA
A2: MICHEL | B2: 4 | C2: 5.444 | D2: 31 | E2: 2 | F2: 5.17 | G2: 32 | H2: 1 | I2: 5.3330000000000002 | J2: 32 | K2: 3 | L2: 5.1150000000000002 | M2: 33 | N2: 5 | O2: 5.2249999999999996 | P2: 32 | Q2: 7 | R2: 5.1150000000000002 | S2: 33 | T2: 8 | U2: 5.0590000000000002 | V2: 34 | W2: 6 | X2: 5.06 | Y2: 33 | Z2: 260.34 | AA2: =+(X2+U2+R2+O2+L2+I2+F2+C2)/8 -> 5.1901250000000001
A3: HENRIQUE | B3: 2 | C3: 5.5529999999999999 | D3: 31 | E3: 1 | F3: 5.444 | G3: 28 | H3: 3 | I3: 5.3339999999999996 | J3: 33 | K3: 5 | L3: 5.2809999999999997 | M3: 31 | N3: 7 | O3: 5.335 | P3: 31 | Q3: 8 | R3: 5.2759999999999998 | S3: 33 | T3: 6 | U3: 5.335 | V3: 30 | W3: 4 | X3: 5.3339999999999996 | Y3: 31 | Z3: 248.89400000000001 | AA3: =+(X3+U3+R3+O3+L3+I3+F3+C3)/8 -> 5.3614999999999995
A4: JULIO G | B4: 5 | C4: 5.39 | D4: 32 | E4: 7 | F4: 5.2789999999999999 | G4: 32 | H4: 8 | I4: 5.335 | J4: 31 | K4: 6 | L4: 5.335 | M4: 30 | N4: 4 | O4: 5.4459999999999997 | P4: 31 | Q4: 2 | R4: 5.6059999999999999 | S4: 30 | T4: 1 | U4: 5.6180000000000003 | V4: 31 | W4: 3 | X4: 5.39 | Y4: 31 | Z4: 248.36199999999999 | AA4: =+(X4+U4+R4+O4+L4+I4+F4+C4)/8 -> 5.4248750000000001
A5: GIOVANI | B5: 7 | C5: 5.3890000000000002 | D5: 31 | E5: 8 | F5: 5.2249999999999996 | G5: 32 | H5: 6 | I5: 5.335 | J5: 30 | K5: 4 | L5: 5.3890000000000002 | M5: 31 | N5: 2 | O5: 5.444 | P5: 30 | Q5: 1 | R5: 5.5549999999999997 | S5: 31 | T5: 3 | U5: 5.5 | V5: 31 | W5: 5 | X5: 5.444 | Y5: 31 | Z5: 248 | AA5: =+(X5+U5+R5+O5+L5+I5+F5+C5)/8 -> 5.4101249999999999
A6: GODOI | B6: 3 | C6: 5.665 | D6: 31 | E6: 5 | F6: 5.28 | G6: 29 | H6: 7 | I6: 5.3330000000000002 | J6: 31 | K6: 8 | L6: 5.2809999999999997 | M6: 30 | N6: 6 | O6: 5.3810000000000002 | P6: 24 | Q6: 4 | R6: 5.6109999999999998 | S6: 29 | T6: 2 | U6: 5.3890000000000002 | V6: 31 | W6: 1 | X6: 5.61 | Y6: 29 | Z6: 234.27699999999999 | AA6: =+(X6+U6+R6+O6+L6+I6+F6+C6)/8 -> 5.4437499999999996
A7: POWER | B7: 1 | C7: 6.16 | D7: 26 | E7: 3 | F7: 5.7190000000000003 | G7: 30 | H7: 5 | I7: 5.7190000000000003 | J7: 29 | K7: 7 | L7: 5.7190000000000003 | M7: 30 | N7: 8 | O7: 5.61 | P7: 29 | Q7: 6 | R7: 5.774 | S7: 30 | T7: 4 | U7: 5.72 | V7: 29 | W7: 2 | X7: 5.8289999999999997 | Y7: 29 | Z7: 232.851 | AA7: =+(X7+U7+R7+O7+L7+I7+F7+C7)/8 -> 5.78125
A8: DANILO | B8: 8 | C8: 6.1040000000000001 | D8: 27 | E8: 6 | F8: 5.9950000000000001 | G8: 29 | H8: 4 | I8: 6.27 | J8: 26 | K8: 2 | L8: 6.3250000000000002 | M8: 26 | N8: 1 | O8: 6.3860000000000001 | P8: 25 | Q8: 3 | R8: 6.1420000000000003 | S8: 27 | T8: 5 | U8: 6.1059999999999999 | V8: 27 | W8: 7 | X8: 6.048 | Y8: 28 | Z8: 215.87200000000001 | AA8: =+(X8+U8+R8+O8+L8+I8+F8+C8)/8 -> 6.1719999999999997