A1: Nome | B1: P | C1: M.VOL | D1: B1 | E1: P | F1: M.VOL | G1: B2 | H1: P | I1: M.VOL | J1: B3 | K1: P | L1: M.VOL | M1: B4 | N1: P | O1: M.VOL | P1: B5 | Q1: P | R1: M.VOL | S1: B6 | T1: P | U1: M.VOL | V1: B7 | W1: P | X1: M.VOL | Y1: B8 | Z1: TOTAL | AA1: MEDIA
A2: DINHO | B2: 3 | C2: 5.335 | D2: 32 | E2: 5 | F2: 5.3339999999999996 | G2: 31 | H2: 7 | I2: 5.2789999999999999 | J2: 31 | K2: 8 | L2: 5.1710000000000003 | M2: 33 | N2: 6 | O2: 5.2229999999999999 | P2: 32 | Q2: 4 | R2: 5.1150000000000002 | S2: 32 | T2: 2 | U2: 5.4450000000000003 | V2: 30 | W2: 1 | X2: 5.5 | Y2: 29 | Z2: 250.66 | AA2: =+(X2+U2+R2+O2+L2+I2+F2+C2)/8 -> 5.3002500000000001
A3: JEISON | B3: 1 | C3: 5.8289999999999997 | D3: 27 | E3: 3 | F3: 5.609 | G3: 30 | H3: 5 | I3: 5.4450000000000003 | J3: 30 | K3: 7 | L3: 5.444 | M3: 31 | N3: 8 | O3: 5.4450000000000003 | P3: 29 | Q3: 6 | R3: 5.335 | S3: 30 | T3: 4 | U3: 5.665 | V3: 28 | W3: 2 | X3: 5.6109999999999998 | Y3: 27 | Z3: 232.46799999999999 | AA3: =+(X3+U3+R3+O3+L3+I3+F3+C3)/8 -> 5.5478750000000003
A4: WELLIGNITON | B4: 4 | C4: 5.609 | D4: 30 | E4: 2 | F4: 5.61 | G4: 30 | H4: 1 | I4: 5.7759999999999998 | J4: 28 | K4: 3 | L4: 5.6639999999999997 | M4: 28 | N4: 5 | O4: 5.609 | P4: 28 | Q4: 7 | R4: 5.5609999999999999 | S4: 28 | T4: 8 | U4: 5.6660000000000004 | V4: 29 | W4: 6 | X4: 5.61 | Y4: 28 | Z4: 229.06399999999999 | AA4: =+(X4+U4+R4+O4+L4+I4+F4+C4)/8 -> 5.6381249999999996
A5: NETO | B5: 8 | C5: 5.72 | D5: 27 | E5: 6 | F5: 5.5549999999999997 | G5: 29 | H5: 4 | I5: 5.6109999999999998 | J5: 29 | K5: 2 | L5: 5.61 | M5: 30 | N5: 1 | O5: 5.72 | P5: 28 | Q5: 3 | R5: 5.5549999999999997 | S5: 28 | T5: 5 | U5: 5.609 | V5: 28 | W5: 7 | X5: 5.609 | Y5: 28 | Z5: 227.38300000000001 | AA5: =+(X5+U5+R5+O5+L5+I5+F5+C5)/8 -> 5.6236249999999997
A6: ANGELAO | B6: 5 | C6: 5.28 | D6: 20 | E6: 7 | F6: 5.3369999999999997 | G6: 24 | H6: 8 | I6: 5.28 | J6: 30 | K6: 6 | L6: 5.28 | M6: 30 | N6: 4 | O6: 5.226 | P6: 31 | Q6: 2 | R6: 5.335 | S6: 24 | T6: 1 | U6: 5.5 | V6: 29 | W6: 3 | X6: 5.3890000000000002 | Y6: 30 | Z6: 218.27699999999999 | AA6: =+(X6+U6+R6+O6+L6+I6+F6+C6)/8 -> 5.3283749999999994
A7: XUBAKA | B7: 2 | C7: 5.94 | D7: 26 | E7: 1 | F7: 6.05 | G7: 25 | H7: 3 | I7: 5.9379999999999997 | J7: 26 | K7: 5 | L7: 5.9950000000000001 | M7: 25 | N7: 7 | O7: 5.94 | P7: 26 | Q7: 8 | R7: 6.16 | S7: 23 | T7: 6 | U7: 6.2149999999999999 | V7: 24 | W7: 4 | X7: 6.16 | Y7: 24 | Z7: 199.53200000000001 | AA7: =+(X7+U7+R7+O7+L7+I7+F7+C7)/8 -> 6.0497499999999995
A8: MARINHO | B8: 7 | C8: 5.8860000000000001 | D8: 26 | E8: 8 | F8: 6.1050000000000004 | G8: 27 | H8: 6 | I8: 6.1040000000000001 | J8: 25 | K8: 4 | L8: 6.4359999999999999 | M8: 24 | N8: 2 | O8: 6.16 | P8: 22 | Q8: 1 | R8: 6.4349999999999996 | S8: 18 | T8: 3 | U8: 6.2210000000000001 | V8: 23 | W8: 5 | X8: 6.0490000000000004 | Y8: 23 | Z8: 188.21299999999999 | AA8: =+(X8+U8+R8+O8+L8+I8+F8+C8)/8 -> 6.174500000000001