A1: BATERIA 1
A2: PILOTOS | B2: P | C2: TEMPO | D2: V | E2: P | F2: TEMPO | G2: V | H2: P | I2: TEMPO | J2: V | K2: P | L2: TEMPO | M2: V | N2: P | O2: TEMPO | P2: V | Q2: P | R2: TEMPO | S2: V | T2: P | U2: TEMPO | V2: V | W2: P | X2: TEMPO | Y2: V | Z2: TOTAL | AA2: MEDIA
A3: JUNINHO | B3: 7 | C3: 5.1710000000000003 | D3: 31 | E3: 8 | F3: 5.2220000000000004 | G3: 32 | H3: 6 | I3: 5.2220000000000004 | J3: 32 | K3: 4 | L3: 5.3890000000000002 | M3: 27 | N3: 2 | O3: 5.2249999999999996 | P3: 30 | Q3: 1 | R3: 5.6159999999999997 | S3: 29 | T3: 3 | U3: 5.3879999999999999 | V3: 32 | W3: 5 | X3: 5.1769999999999996 | Y3: 31 | Z3: 244.87234042553192 | AA3: =+(X3+U3+R3+O3+L3+I3+F3+C3)/8 -> 5.3012499999999996
A4: NETO | B4: 3 | C4: 5.5549999999999997 | D4: 30 | E4: 5 | F4: 5.0389999999999997 | G4: 29 | H4: 7 | I4: 5.4459999999999997 | J4: 30 | K4: 8 | L4: 5.4450000000000003 | M4: 29 | N4: 6 | O4: 5.391 | P4: 31 | Q4: 4 | R4: 5.556 | S4: 20 | T4: 2 | U4: 5.61 | V4: 30 | W4: 1 | X4: 5.6639999999999997 | Y4: 28 | Z4: 227.08510638297872 | AA4: =+(X4+U4+R4+O4+L4+I4+F4+C4)/8 -> 5.4632500000000004
A5: XUBAKA | B5: 2 | C5: 5.6630000000000003 | D5: 29 | E5: 1 | F5: 5.774 | G5: 28 | H5: 3 | I5: 5.718 | J5: 28 | K5: 5 | L5: 5.6639999999999997 | M5: 28 | N5: 7 | O5: 5.4989999999999997 | P5: 30 | Q5: 8 | R5: 5.5529999999999999 | S5: 28 | T5: 6 | U5: 5.5529999999999999 | V5: 21 | W5: 4 | X5: 5.61 | Y5: 27 | Z5: 219.21276595744681 | AA5: =+(X5+U5+R5+O5+L5+I5+F5+C5)/8 -> 5.629249999999999
A6: ROBERTO | B6: 8 | C6: 5.8280000000000003 | D6: 27 | E6: 6 | F6: 5.8849999999999998 | G6: 26 | H6: 4 | I6: 5.8860000000000001 | J6: 24 | K6: 2 | L6: 5.9429999999999996 | M6: 28 | N6: 1 | O6: 5.8860000000000001 | P6: 27 | Q6: 3 | R6: 5.7190000000000003 | S6: 27 | T6: 5 | U6: 5.9950000000000001 | V6: 23 | W6: 7 | X6: 5.83 | Y6: 26 | Z6: 208.27659574468086 | AA6: =+(X6+U6+R6+O6+L6+I6+F6+C6)/8 -> 5.8715000000000002
A7: M.JOSE | B7: 5 | C7: 5.7759999999999998 | D7: 27 | E7: 7 | F7: 5.8449999999999998 | G7: 24 | H7: 8 | I7: 6.0510000000000002 | J7: 25 | K7: 6 | L7: 5.94 | M7: 25 | N7: 4 | O7: 5.9409999999999998 | P7: 23 | Q7: 2 | R7: 6.21 | S7: 21 | T7: 1 | U7: 6.4340000000000002 | V7: 19 | W7: 3 | X7: 6.383 | Y7: 24 | Z7: 188.06382978723406 | AA7: =+(X7+U7+R7+O7+L7+I7+F7+C7)/8 -> 6.0724999999999998
A8: SIMONE | B8: 6 | C8: 5.5549999999999997 | D8: 26 | E8: 4 | F8: 5.9539999999999997 | G8: 25 | H8: 2 | I8: 6.0529999999999999 | J8: 24 | K8: 1 | L8: 6.1589999999999998 | M8: 24 | N8: 3 | O8: 5.7729999999999997 | P8: 25 | Q8: 5 | R8: 5.7220000000000004 | S8: 24 | T8: 7 | U8: 5.7169999999999996 | V8: 18 | W8: 8 | X8: 5.718 | Y8: 21 | Z8: 187.85106382978722 | AA8: =+(X8+U8+R8+O8+L8+I8+F8+C8)/8 -> 5.8313749999999995
A9: M.VINICIUS | B9: 4 | C9: 6.1070000000000002 | D9: 23 | E9: 2 | F9: 6.0519999999999996 | G9: 24 | H9: 1 | I9: 6.3769999999999998 | J9: 18 | K9: 3 | L9: 6.056 | M9: 20 | N9: 5 | O9: 6.1040000000000001 | P9: 26 | Q9: 7 | R9: 5.8289999999999997 | S9: 23 | T9: 8 | U9: 5.7759999999999998 | V9: 26 | W9: 6 | X9: 6.1580000000000004 | Y9: 22 | Z9: 182.63829787234042 | AA9: =+(X9+U9+R9+O9+L9+I9+F9+C9)/8 -> 6.0573750000000004
A10: SANDRO ITU | B10: 1 | C10: 5.8860000000000001 | D10: 14 | E10: 3 | F10: 5.0259999999999998 | G10: 14 | H10: 5 | I10: 5.718 | J10: 28 | K10: 7 | L10: 5.8920000000000003 | M10: 16 | N10: 8 | O10: 5.72 | P10: 27 | Q10: 6 | R10: 5.83 | S10: 27 | T10: 4 | U10: 5.7220000000000004 | V10: 26 | W10: 2 | X10: 5.8369999999999997 | Y10: 29 | Z10: 181.10638297872342 | AA10: =+(X10+U10+R10+O10+L10+I10+F10+C10)/8 -> 5.7038750000000009
A12: BATERIA 2
A13: Pilotos | B13: Pis | C13: Tempo | D13: Vol | E13: Pis | F13: Tempo | G13: Vol | H13: Pis | I13: Tempo | J13: Vol | K13: Pis | L13: Tempo | M13: Vol | N13: Pis | O13: Tempo | P13: Vol | Q13: Pis | R13: Tempo | S13: Vol | T13: Pis | U13: Tempo | V13: Vol | W13: Pis | X13: Tempo | Y13: Vol | Z13: Total | AA13: Media
A14: JAPAO | B14: 6 | C14: 5.556 | D14: 27 | E14: 4 | F14: 5.7190000000000003 | G14: 26 | H14: 2 | I14: 5.718 | J14: 26 | K14: 1 | L14: 5.8780000000000001 | M14: 23 | N14: 3 | O14: 5.5570000000000004 | P14: 29 | Q14: 5 | R14: 5.5030000000000001 | S14: 28 | T14: 7 | U14: 5.5 | V14: 28 | W14: 8 | X14: 5.61 | Y14: 26 | Z14: 213.63829787234042 | AA14: =+(X14+U14+R14+O14+L14+I14+F14+C14)/8 -> 5.6301250000000005
A15: DANIEL | B15: 4 | C15: 6.07 | D15: 25 | E15: 2 | F15: 6.1040000000000001 | G15: 21 | H15: 1 | I15: 6.2610000000000001 | J15: 25 | K15: 3 | L15: 6.33 | M15: 22 | N15: 5 | O15: 5.9390000000000001 | P15: 27 | Q15: 7 | R15: 5.8840000000000003 | S15: 26 | T15: 8 | U15: 5.9930000000000003 | V15: 24 | W15: 6 | X15: 5.83 | Y15: 27 | Z15: 197.31914893617022 | AA15: =+(X15+U15+R15+O15+L15+I15+F15+C15)/8 -> 6.0513750000000002
A16: NETO ROSA | B16: 7 | C16: 5.61 | D16: 26 | E16: 8 | F16: 5.72 | G16: 20 | H16: 6 | I16: 5.665 | J16: 27 | K16: 4 | L16: 5.8840000000000003 | M16: 25 | N16: 2 | O16: 5.7130000000000001 | P16: 27 | Q16: 1 | R16: 5.8319999999999999 | S16: 22 | T16: 3 | U16: 5.5529999999999999 | V16: 29 | W16: 5 | X16: 5.8239999999999998 | Y16: 16 | Z16: 192.12765957446808 | AA16: =+(X16+U16+R16+O16+L16+I16+F16+C16)/8 -> 5.7251250000000002
A17: GELEIA | B17: 8 | C17: 5.7750000000000004 | D17: 23 | E17: 6 | F17: 5.8289999999999997 | G17: 24 | H17: 4 | I17: 5.8840000000000003 | J17: 27 | K17: 2 | L17: 5.8310000000000004 | M17: 23 | N17: 1 | O17: 5.8860000000000001 | P17: 25 | Q17: 3 | R17: 5.94 | S17: 19 | T17: 5 | U17: 5.883 | V17: 21 | W17: 7 | X17: 5.7190000000000003 | Y17: 22 | Z17: 184.63829787234042 | AA17: =+(X17+U17+R17+O17+L17+I17+F17+C17)/8 -> 5.843375
A18: RACHID | B18: 2 | C18: 5.5010000000000003 | D18: 25 | E18: 1 | F18: 5.7850000000000001 | G18: 19 | H18: 3 | I18: 5.61 | J18: 28 | K18: 5 | L18: 6.0019999999999998 | M18: 21 | N18: 7 | O18: 5.94 | P18: 24 | Q18: 8 | R18: 6.1609999999999996 | S18: 21 | T18: 6 | U18: 6.4829999999999997 | V18: 14 | W18: 4 | X18: 5.5460000000000003 | Y18: 26 | Z18: 178.31914893617022 | AA18: =+(X18+U18+R18+O18+L18+I18+F18+C18)/8 -> 5.8784999999999998
A19: MURILO | B19: 5 | C19: 6.2160000000000002 | D19: 24 | E19: 7 | F19: 6.2720000000000002 | G19: 20 | H19: 8 | I19: 6.2670000000000003 | J19: 22 | K19: 6 | L19: 6.0990000000000002 | M19: 24 | N19: 4 | O19: 6.4880000000000004 | P19: 21 | Q19: 2 | R19: 6.7080000000000002 | S19: 13 | T19: 1 | U19: 6.5449999999999999 | V19: 21 | W19: 3 | X19: 6.2149999999999999 | Y19: 25 | Z19: 170.04255319148936 | AA19: =+(X19+U19+R19+O19+L19+I19+F19+C19)/8 -> 6.3512500000000003
A20: LUIS FELIPE | B20: 3 | C20: 6.1079999999999997 | D20: 18 | E20: 5 | F20: 6.4889999999999999 | G20: 16 | H20: 7 | I20: 6.702 | J20: 18 | K20: 8 | L20: 6.5449999999999999 | M20: 15 | N20: 6 | O20: 6.3819999999999997 | P20: 18 | Q20: 4 | R20: 6.5419999999999998 | S20: 16 | T20: 2 | U20: 6.6550000000000002 | V20: 11 | W20: 1 | X20: 11.551 | Y20: 9 | Z20: 121.82978723404256 | AA20: =+(X20+U20+R20+O20+L20+I20+F20+C20)/8 -> 7.1217499999999987
A23: BATERIA 3
A24: PILOTOS | B24: P | C24: TEMPO | D24: V | E24: P | F24: TEMPO | G24: V | H24: P | I24: TEMPO | J24: V | K24: P | L24: TEMPO | M24: V | N24: P | O24: TEMPO | P24: V | Q24: P | R24: TEMPO | S24: V | T24: P | U24: TEMPO | V24: V | W24: P | X24: TEMPO | Y24: V | Z24: TOTAL | AA24: MEDIA
A25: MARQUINHO | B25: 3 | C25: 5.3310000000000004 | D25: 30 | E25: 5 | F25: 5.33 | G25: 30 | H25: 7 | I25: 5.3339999999999996 | J25: 32 | K25: 8 | L25: 5.3330000000000002 | M25: 31 | N25: 6 | O25: 5.1680000000000001 | P25: 31 | Q25: 4 | R25: 5.39 | S25: 32 | T25: 2 | U25: 5.2249999999999996 | V25: 28 | W25: 1 | X25: 5.61 | Y25: 29 | Z25: 243.40425531914894 | AA25: =+(X25+U25+R25+O25+L25+I25+F25+C25)/8 -> 5.3401250000000005
A26: ERIC | B26: 2 | C26: 5.5 | D26: 30 | E26: 1 | F26: 5.5549999999999997 | G26: 28 | H26: 3 | I26: 4.95 | J26: 31 | K26: 5 | L26: 5.3879999999999999 | M26: 30 | N26: 7 | O26: 5.274 | P26: 31 | Q26: 8 | R26: 5.28 | S26: 31 | T26: 6 | U26: 5.3369999999999997 | V26: 29 | W26: 4 | X26: 5.3280000000000003 | Y26: 31 | Z26: 241.12765957446808 | AA26: =+(X26+U26+R26+O26+L26+I26+F26+C26)/8 -> 5.3264999999999993
A27: GIOVANNI | B27: 6 | C27: 5.3330000000000002 | D27: 29 | E27: 4 | F27: 5.335 | G27: 27 | H27: 2 | I27: 5.548 | J27: 30 | K27: 1 | L27: 5.56 | M27: 30 | N27: 3 | O27: 5.3330000000000002 | P27: 31 | Q27: 5 | R27: 5.3369999999999997 | S27: 28 | T27: 7 | U27: 5.1719999999999997 | V27: 30 | W27: 8 | X27: 5.2229999999999999 | Y27: 32 | Z27: 237.06382978723406 | AA27: =+(X27+U27+R27+O27+L27+I27+F27+C27)/8 -> 5.3551249999999992
A28: ERUNDA | B28: 5 | C28: 5.335 | D28: 31 | E28: 7 | F28: 5.28 | G28: 28 | H28: 8 | I28: 5.117 | J28: 32 | K28: 6 | L28: 5.39 | M28: 30 | N28: 4 | O28: 5.39 | P28: 31 | Q28: 2 | R28: 5.4509999999999996 | S28: 30 | T28: 1 | U28: 5.5519999999999996 | V28: 18 | W28: 3 | X28: 5.4450000000000003 | Y28: 30 | Z28: 231 | AA28: =+(X28+U28+R28+O28+L28+I28+F28+C28)/8 -> 5.37
A29: CONRADO | B29: 1 | C29: 5.72 | D29: 27 | E29: 3 | F29: 5.5 | G29: 28 | H29: 5 | I29: 5.4450000000000003 | J29: 28 | K29: 7 | L29: 5.28 | M29: 30 | N29: 8 | O29: 5.4450000000000003 | P29: 30 | Q29: 6 | R29: 5.3920000000000003 | S29: 27 | T29: 4 | U29: 5.4429999999999996 | V29: 30 | W29: 2 | X29: 5.6040000000000001 | Y29: 28 | Z29: 228.63829787234042 | AA29: =+(X29+U29+R29+O29+L29+I29+F29+C29)/8 -> 5.4786250000000001
A30: RICARDO | B30: 8 | C30: 5.5 | D30: 29 | E30: 6 | F30: 5.5529999999999999 | G30: 23 | H30: 4 | I30: 5.5 | J30: 29 | K30: 2 | L30: 5.5529999999999999 | M30: 27 | N30: 1 | O30: 5.7750000000000004 | P30: 29 | Q30: 3 | R30: 5.5 | S30: 27 | T30: 5 | U30: 5.5529999999999999 | V30: 30 | W30: 7 | X30: 5.39 | Y30: 32 | Z30: 226.48936170212767 | AA30: =+(X30+U30+R30+O30+L30+I30+F30+C30)/8 -> 5.5404999999999998
A31: GOROI | B31: 4 | C31: 5.5 | D31: 27 | E31: 2 | F31: 6.492 | G31: 5 | H31: 1 | I31: 5.7729999999999997 | J31: 27 | K31: 3 | L31: 5.3920000000000003 | M31: 30 | N31: 5 | O31: 5.2270000000000003 | P31: 31 | Q31: 7 | R31: 5.2850000000000001 | S31: 31 | T31: 8 | U31: 5.4429999999999996 | V31: 29 | W31: 6 | X31: 5.28 | Y31: 31 | Z31: 211.65957446808511 | AA31: =+(X31+U31+R31+O31+L31+I31+F31+C31)/8 -> 5.5489999999999995
A32: RUDSON | B32: 7 | C32: 5.67 | D32: 28 | E32: 8 | F32: 5.66 | G32: 24 | H32: 6 | I32: 5.6029999999999998 | J32: 29 | K32: 4 | L32: 5.6660000000000004 | M32: 28 | N32: 2 | O32: 5.83 | P32: 19 | Q32: 1 | R32: 5.9969999999999999 | S32: 24 | T32: 3 | U32: 5.72 | V32: 30 | W32: 5 | X32: 5.72 | Y32: 28 | Z32: 211.723404255319 | AA32: =+(X32+U32+R32+O32+L32+I32+F32+C32)/8 -> 5.73325
A34: BATERIA 4
A35: PILOTOS | B35: P | C35: TEMPO | D35: V | E35: P | F35: TEMPO | G35: V | H35: P | I35: TEMPO | J35: V | K35: P | L35: TEMPO | M35: V | N35: P | O35: TEMPO | P35: V | Q35: P | R35: TEMPO | S35: V | T35: P | U35: TEMPO | V35: V | W35: P | X35: TEMPO | Y35: V | Z35: TOTAL | AA35: MEDIA
A36: BONGA | B36: 8 | C36: 5.17 | D36: 30 | E36: 6 | F36: 4.6749999999999998 | G36: 28 | H36: 4 | I36: 5.17 | J36: 33 | K36: 2 | L36: 5.2270000000000003 | M36: 31 | N36: 1 | O36: 5.3280000000000003 | P36: 31 | Q36: 3 | R36: 5.2229999999999999 | S36: 30 | T36: 5 | U36: 5.117 | V36: 32 | W36: 7 | X36: 5.17 | Y36: 30 | Z36: 246.82978723404301 | AA36: =+(X36+U36+R36+O36+L36+I36+F36+C36)/8 -> 5.1349999999999998
A37: ANGELAO | B37: 2 | C37: 5.4390000000000001 | D37: 26 | E37: 1 | F37: 5.1150000000000002 | G37: 31 | H37: 3 | I37: 5.2889999999999997 | J37: 32 | K37: 5 | L37: 5.1660000000000004 | M37: 32 | N37: 7 | O37: 5.1680000000000001 | P37: 32 | Q37: 8 | R37: 5.2229999999999999 | S37: 30 | T37: 6 | U37: 5.1130000000000004 | V37: 29 | W37: 4 | X37: 5.335 | Y37: 24 | Z37: 236.25531914893617 | AA37: =+(X37+U37+R37+O37+L37+I37+F37+C37)/8 -> 5.2309999999999999
A38: GABRIEL | B38: 7 | C38: 5.1719999999999997 | D38: 30 | E38: 8 | F38: 4.6749999999999998 | G38: 32 | H38: 6 | I38: 5.1219999999999999 | J38: 32 | K38: 4 | L38: 5.2779999999999996 | M38: 29 | N38: 2 | O38: 5.3179999999999996 | P38: 31 | Q38: 1 | R38: 5.5590000000000002 | S38: 20 | T38: 3 | U38: 5.2789999999999999 | V38: 31 | W38: 5 | X38: 5.3879999999999999 | Y38: 28 | Z38: 233.57446808510639 | AA38: =+(X38+U38+R38+O38+L38+I38+F38+C38)/8 -> 5.2238749999999987
A39: RUBENS | B39: 4 | C39: 5.6079999999999997 | D39: 28 | E39: 2 | F39: 5.5 | G39: 29 | H39: 1 | I39: 5.665 | J39: 29 | K39: 3 | L39: 5.3419999999999996 | M39: 30 | N39: 5 | O39: 5.335 | P39: 32 | Q39: 7 | R39: 5.4450000000000003 | S39: 27 | T39: 8 | U39: 5.29 | V39: 32 | W39: 6 | X39: 5.2770000000000001 | Y39: 25 | Z39: 232.72340425531914 | AA39: =+(X39+U39+R39+O39+L39+I39+F39+C39)/8 -> 5.4327499999999995
A40: POWER | B40: 5 | C40: 5.5529999999999999 | D40: 25 | E40: 7 | F40: 5.5549999999999997 | G40: 28 | H40: 8 | I40: 5.665 | J40: 25 | K40: 6 | L40: 5.4980000000000002 | M40: 29 | N40: 4 | O40: 5.2869999999999999 | P40: 31 | Q40: 2 | R40: 5.5 | S40: 29 | T40: 1 | U40: 5.8280000000000003 | V40: 26 | W40: 3 | X40: 5.5529999999999999 | Y40: 30 | Z40: 223.82978723404256 | AA40: =+(X40+U40+R40+O40+L40+I40+F40+C40)/8 -> 5.554875
A41: JERONIMO | B41: 1 | C41: 5.3920000000000003 | D41: 26 | E41: 3 | F41: 4.62 | G41: 29 | H41: 5 | I41: 5.2229999999999999 | J41: 30 | K41: 7 | L41: 5.202 | M41: 31 | N41: 8 | O41: 5.1660000000000004 | P41: 32 | Q41: 6 | R41: 5.2679999999999998 | S41: 28 | T41: 4 | U41: 5.4980000000000002 | V41: 22 | W41: 2 | X41: 5.5279999999999996 | Y41: 22 | Z41: 220.25531914893617 | AA41: =+(X41+U41+R41+O41+L41+I41+F41+C41)/8 -> 5.2371249999999998
A42: JULIO | B42: 6 | C42: 5.4429999999999996 | D42: 29 | E42: 4 | F42: 5.3849999999999998 | G42: 30 | H42: 2 | I42: 5.444 | J42: 31 | K42: 1 | L42: 5.5010000000000003 | M42: 28 | N42: 3 | O42: 5.28 | P42: 32 | Q42: 5 | R42: 5.39 | S42: 28 | T42: 7 | U42: 5.577 | V42: 5 | W42: 8 | X42: 5.1619999999999999 | Y42: 31 | Z42: 214.78723404255319 | AA42: =+(X42+U42+R42+O42+L42+I42+F42+C42)/8 -> 5.3977500000000003
A43: MANE | B43: 3 | C43: 5.4450000000000003 | D43: 25 | E43: 5 | F43: 4.73 | G43: 30 | H43: 7 | I43: 5.2809999999999997 | J43: 29 | K43: 8 | L43: 5.28 | M43: 29 | N43: 6 | O43: 5.2789999999999999 | P43: 30 | Q43: 4 | R43: 5.3540000000000001 | S43: 18 | T43: 2 | U43: 5.3369999999999997 | V43: 30 | W43: 1 | X43: 5.9409999999999998 | Y43: 11 | Z43: 202.06382978723406 | AA43: =+(X43+U43+R43+O43+L43+I43+F43+C43)/8 -> 5.3308749999999998
A46: BATERIA 5

A1: PILOTOS | B1: P | C1: TEMPO | D1: V | E1: P | F1: TEMPO | G1: V | H1: P | I1: TEMPO | J1: V | K1: P | L1: TEMPO | M1: V | N1: P | O1: TEMPO | P1: V | Q1: P | R1: TEMPO | S1: V | T1: P | U1: TEMPO | V1: V | W1: P | X1: TEMPO | Y1: V | Z1: TOTAL | AA1: MEDIA
A2: IMPORTADO | B2: 1 | C2: 5.2880000000000003 | D2: 31 | E2: 3 | F2: 5.0590000000000002 | G2: 34 | H2: 5 | I2: 5.0039999999999996 | J2: 32 | K2: 7 | L2: 5.0030000000000001 | M2: 33 | N2: 8 | O2: 4.95 | P2: 33 | Q2: 6 | R2: 4.9480000000000004 | S2: 34 | T2: 4 | U2: 5.0030000000000001 | V2: 33 | W2: 2 | X2: 5.1189999999999998 | Y2: 33 | Z2: 263.59574468085106 | AA2: =+(X2+U2+R2+O2+L2+I2+F2+C2)/8 -> 5.0467499999999994
A3: ANDERSON | B3: 8 | C3: 5.0030000000000001 | D3: 34 | E3: 6 | F3: 5.0039999999999996 | G3: 33 | H3: 4 | I3: 5.0620000000000003 | J3: 33 | K3: 2 | L3: 5.1150000000000002 | M3: 33 | N3: 1 | O3: 5.2789999999999999 | P3: 32 | Q3: 3 | R3: 5.0590000000000002 | S3: 32 | T3: 5 | U3: 5.0590000000000002 | V3: 33 | W3: 7 | X3: 5.0579999999999998 | Y3: 33 | Z3: 263.17021276595744 | AA3: =+(X3+U3+R3+O3+L3+I3+F3+C3)/8 -> 5.0798750000000004
A4: CAVERNA | B4: 3 | C4: 5.28 | D4: 31 | E4: 5 | F4: 5.2229999999999999 | G4: 33 | H4: 7 | I4: 5.0039999999999996 | J4: 33 | K4: 8 | L4: 5.0039999999999996 | M4: 33 | N4: 6 | O4: 5.1459999999999999 | P4: 32 | Q4: 4 | R4: 5.1710000000000003 | S4: 33 | T4: 2 | U4: 5.17 | V4: 32 | W4: 1 | X4: 5.4429999999999996 | Y4: 32 | Z4: 259.08510638297872 | AA4: =+(X4+U4+R4+O4+L4+I4+F4+C4)/8 -> 5.1801249999999994
A5: DINHO | B5: 6 | C5: 5.26 | D5: 31 | E5: 4 | F5: 5.1769999999999996 | G5: 33 | H5: 2 | I5: 5.28 | J5: 31 | K5: 1 | L5: 5.4450000000000003 | M5: 31 | N5: 3 | O5: 5.2240000000000002 | P5: 33 | Q5: 5 | R5: 5.2229999999999999 | S5: 30 | T5: 7 | U5: 5.2249999999999996 | V5: 33 | W5: 8 | X5: 5.2249999999999996 | Y5: 32 | Z5: 254.44680851063831 | AA5: =+(X5+U5+R5+O5+L5+I5+F5+C5)/8 -> 5.2573749999999997
A6: MICHEL | B6: 5 | C6: 5.1139999999999999 | D6: 31 | E6: 7 | F6: 4.95 | G6: 32 | H6: 8 | I6: 4.9509999999999996 | J6: 28 | K6: 6 | L6: 5.0609999999999999 | M6: 32 | N6: 4 | O6: 5.1680000000000001 | P6: 31 | Q6: 2 | R6: 5.1760000000000002 | S6: 32 | T6: 1 | U6: 5.1719999999999997 | V6: 33 | W6: 3 | X6: 5.17 | Y6: 32 | Z6: 252.85106382978699 | AA6: =+(X6+U6+R6+O6+L6+I6+F6+C6)/8 -> 5.0952500000000001
A7: MARCEL | B7: 4 | C7: 5.2809999999999997 | D7: 31 | E7: 2 | F7: 5.3330000000000002 | G7: 31 | H7: 1 | I7: 5.17 | J7: 30 | K7: 3 | L7: 5.28 | M7: 28 | N7: 5 | O7: 5.2229999999999999 | P7: 29 | Q7: 7 | R7: 5.2229999999999999 | S7: 32 | T7: 8 | U7: 5.1219999999999999 | V7: 33 | W7: 6 | X7: 5.2240000000000002 | Y7: 31 | Z7: 245.48936170212767 | AA7: =+(X7+U7+R7+O7+L7+I7+F7+C7)/8 -> 5.2319999999999993
A8: CAVANHA | B8: 2 | C8: 5.4429999999999996 | D8: 28 | E8: 1 | F8: 5.5540000000000003 | G8: 30 | H8: 3 | I8: 5.3369999999999997 | J8: 32 | K8: 5 | L8: 5.3890000000000002 | M8: 32 | N8: 7 | O8: 5.3310000000000004 | P8: 29 | Q8: 8 | R8: 5.4450000000000003 | S8: 29 | T8: 6 | U8: 5.3339999999999996 | V8: 31 | W8: 4 | X8: 5.39 | Y8: 30 | Z8: 242.29787234042601 | AA8: =+(X8+U8+R8+O8+L8+I8+F8+C8)/8 -> 5.4028749999999999
A9: KLEBER | B9: 7 | C9: 5.2779999999999996 | D9: 31 | E9: 8 | F9: 5.1219999999999999 | G9: 33 | H9: 6 | I9: 5.2789999999999999 | J9: 31 | K9: 4 | L9: 5.2779999999999996 | M9: 32 | N9: 2 | O9: 5.391 | P9: 30 | Q9: 1 | R9: 5.6070000000000002 | S9: 16 | T9: 3 | U9: 5.1719999999999997 | V9: 7 | W9: 5 | X9: 5.3890000000000002 | Y9: 30 | Z9: 210.61702127659575 | AA9: =+(X9+U9+R9+O9+L9+I9+F9+C9)/8 -> 5.3144999999999998