A1: Bateria 1
A2: Nome | B2: P | C2: M.VOL | D2: B1 | E2: P | F2: M.VOL | G2: B2 | H2: P | I2: M.VOL | J2: B3 | K2: P | L2: M.VOL | M2: B4 | N2: P | O2: M.VOL | P2: B5 | Q2: P | R2: M.VOL | S2: B6 | T2: P | U2: M.VOL | V2: B7 | W2: P | X2: M.VOL | Y2: B8 | Z2: TOTAL | AA2: MEDIA
A3: MARCEL | B3: 4 | C3: 5.8280000000000003 | D3: 29 | E3: 2 | F3: 5.7750000000000004 | G3: 29 | H3: 1 | I3: 5.8840000000000003 | J3: 27 | K3: 3 | L3: 5.8289999999999997 | M3: 29 | N3: 5 | O3: 5.7750000000000004 | P3: 29 | Q3: 7 | R3: 5.665 | S3: 30 | T3: 8 | U3: 5.5629999999999997 | V3: 30 | W3: 6 | X3: 5.665 | Y3: 28 | Z3: 231.87234042553192 | AA3: =+(X3+U3+R3+O3+L3+I3+F3+C3)/8 -> 5.7480000000000002
A4: JUNINHO | B4: 7 | C4: 5.8840000000000003 | D4: 28 | E4: 8 | F4: 5.7190000000000003 | G4: 30 | H4: 6 | I4: 5.883 | J4: 29 | K4: 4 | L4: 5.883 | M4: 28 | N4: 2 | O4: 5.9379999999999997 | P4: 26 | Q4: 1 | R4: 6.05 | S4: 28 | T4: 3 | U4: 5.8310000000000004 | V4: 29 | W4: 5 | X4: 5.665 | Y4: 29 | Z4: 227.34042553191489 | AA4: =+(X4+U4+R4+O4+L4+I4+F4+C4)/8 -> 5.8566250000000002
A5: ERIC | B5: 6 | C5: 5.8840000000000003 | D5: 27 | E5: 4 | F5: 5.94 | G5: 29 | H5: 2 | I5: 5.9340000000000002 | J5: 27 | K5: 1 | L5: 5.9939999999999998 | M5: 27 | N5: 3 | O5: 5.9379999999999997 | P5: 28 | Q5: 5 | R5: 5.8849999999999998 | S5: 27 | T5: 7 | U5: 5.883 | V5: 27 | W5: 8 | X5: 5.8860000000000001 | Y5: 28 | Z5: 220.63829787234042 | AA5: =+(X5+U5+R5+O5+L5+I5+F5+C5)/8 -> 5.9179999999999993
A6: RICARDO | B6: 2 | C6: 5.8289999999999997 | D6: 29 | E6: 1 | F6: 5.8849999999999998 | G6: 28 | H6: 3 | I6: 5.8289999999999997 | J6: 27 | K6: 5 | L6: 5.883 | M6: 27 | N6: 7 | O6: 5.774 | P6: 27 | Q6: 8 | R6: 5.8780000000000001 | S6: 28 | T6: 6 | U6: 5.9950000000000001 | V6: 24 | W6: 4 | X6: 5.9930000000000003 | Y6: 27 | Z6: 217.82978723404256 | AA6: =+(X6+U6+R6+O6+L6+I6+F6+C6)/8 -> 5.8832499999999994
A7: GIOVANNI | B7: 5 | C7: 5.8840000000000003 | D7: 28 | E7: 7 | F7: 5.774 | G7: 28 | H7: 8 | I7: 5.8869999999999996 | J7: 28 | K7: 6 | L7: 6.05 | M7: 28 | N7: 4 | O7: 5.9939999999999998 | P7: 21 | Q7: 2 | R7: 6.2149999999999999 | S7: 25 | T7: 1 | U7: 6.3259999999999996 | V7: 23 | W7: 3 | X7: 6.2140000000000004 | Y7: 28 | Z7: 209.27659574468086 | AA7: =+(X7+U7+R7+O7+L7+I7+F7+C7)/8 -> 6.0430000000000001
A8: XUBAKA | B8: 1 | C8: 6.4349999999999996 | D8: 24 | E8: 3 | F8: 6.3860000000000001 | G8: 25 | H8: 5 | I8: 6.2140000000000004 | J8: 27 | K8: 7 | L8: 6.1539999999999999 | M8: 28 | N8: 8 | O8: 6.21 | P8: 25 | Q8: 6 | R8: 6.1449999999999996 | S8: 26 | T8: 4 | U8: 6.2690000000000001 | V8: 25 | W8: 2 | X8: 6.3780000000000001 | Y8: 25 | Z8: 205.85106382978722 | AA8: =+(X8+U8+R8+O8+L8+I8+F8+C8)/8 -> 6.2738750000000012
A9: MORA | B9: 8 | C9: 5.9950000000000001 | D9: 26 | E9: 6 | F9: 6.048 | G9: 27 | H9: 4 | I9: 6.2690000000000001 | J9: 25 | K9: 2 | L9: 6.38 | M9: 23 | N9: 1 | O9: 6.4359999999999999 | P9: 23 | Q9: 3 | R9: 6.2720000000000002 | S9: 26 | T9: 5 | U9: 6.1580000000000004 | V9: 25 | W9: 7 | X9: 5.9939999999999998 | Y9: 26 | Z9: 201.65957446808511 | AA9: =+(X9+U9+R9+O9+L9+I9+F9+C9)/8 -> 6.194
A11: Bateria 2
A12: Nome | B12: P | C12: M.VOL | D12: B1 | E12: P | F12: M.VOL | G12: B2 | H12: P | I12: M.VOL | J12: B3 | K12: P | L12: M.VOL | M12: B4 | N12: P | O12: M.VOL | P12: B5 | Q12: P | R12: M.VOL | S12: B6 | T12: P | U12: M.VOL | V12: B7 | W12: P | X12: M.VOL | Y12: B8 | Z12: TOTAL | AA12: MEDIA
A13: DINHO | B13: 4 | C13: 4.0119999999999996 | D13: 29 | E13: 2 | F13: 5.8289999999999997 | G13: 28 | H13: 1 | I13: 5.83 | J13: 27 | K13: 3 | L13: 5.7210000000000001 | M13: 29 | N13: 5 | O13: 5.6639999999999997 | P13: 29 | Q13: 7 | R13: 5.774 | S13: 30 | T13: 8 | U13: 5.5549999999999997 | V13: 30 | W13: 6 | X13: 5.7190000000000003 | Y13: 28 | Z13: 230.63829787234042 | AA13: =+(X13+U13+R13+O13+L13+I13+F13+C13)/8 -> 5.5130000000000008
A14: RUBENS | B14: 6 | C14: 5.9390000000000001 | D14: 27 | E14: 4 | F14: 5.9390000000000001 | G14: 27 | H14: 2 | I14: 6.0510000000000002 | J14: 27 | K14: 1 | L14: 6.2679999999999998 | M14: 25 | N14: 3 | O14: 5.718 | P14: 29 | Q14: 5 | R14: 5.665 | S14: 29 | T14: 7 | U14: 5.5609999999999999 | V14: 30 | W14: 8 | X14: 5.609 | Y14: 29 | Z14: 223.29787234042553 | AA14: =+(X14+U14+R14+O14+L14+I14+F14+C14)/8 -> 5.84375
A15: ERUNDA | B15: 2 | C15: 5.83 | D15: 25 | E15: 1 | F15: 6.1589999999999998 | G15: 26 | H15: 3 | I15: 6.0010000000000003 | J15: 27 | K15: 5 | L15: 5.8280000000000003 | M15: 27 | N15: 7 | O15: 5.6639999999999997 | P15: 30 | Q15: 8 | R15: 5.7220000000000004 | S15: 29 | T15: 6 | U15: 5.7750000000000004 | V15: 29 | W15: 4 | X15: 5.8330000000000002 | Y15: 27 | Z15: 220.51063829787233 | AA15: =+(X15+U15+R15+O15+L15+I15+F15+C15)/8 -> 5.8514999999999997
A16: JOAO KIBOM | B16: 1 | C16: 6.6550000000000002 | D16: 18 | E16: 3 | F16: 6.1580000000000004 | G16: 26 | H16: 5 | I16: 6.2690000000000001 | J16: 26 | K16: 7 | L16: 6.38 | M16: 25 | N16: 8 | O16: 6.23 | P16: 27 | Q16: 6 | R16: 6.2149999999999999 | S16: 26 | T16: 4 | U16: 5.9379999999999997 | V16: 27 | W16: 2 | X16: 6.1040000000000001 | Y16: 25 | Z16: 200.82978723404256 | AA16: =+(X16+U16+R16+O16+L16+I16+F16+C16)/8 -> 6.2436249999999998
A17: DANILO | B17: 8 | C17: 6.2149999999999999 | D17: 25 | E17: 6 | F17: 6.4370000000000003 | G17: 25 | H17: 4 | I17: 6.6529999999999996 | J17: 25 | K17: 2 | L17: 6.71 | M17: 23 | N17: 1 | O17: 6.8179999999999996 | P17: 23 | Q17: 3 | R17: 6.7050000000000001 | S17: 26 | T17: 5 | U17: 6.6020000000000003 | V17: 25 | W17: 7 | X17: 6.4279999999999999 | Y17: 26 | Z17: 198.91489361702128 | AA17: =+(X17+U17+R17+O17+L17+I17+F17+C17)/8 -> 6.5709999999999997
A18: SANDRO ITU | B18: 7 | C18: 6.6040000000000001 | D18: 14 | E18: 8 | F18: 6.327 | G18: 25 | H18: 6 | I18: 6.38 | J18: 26 | K18: 4 | L18: 6.6529999999999996 | M18: 23 | N18: 2 | O18: 6.3250000000000002 | P18: 25 | Q18: 1 | R18: 6.7160000000000002 | S18: 22 | T18: 3 | U18: 6.4340000000000002 | V18: 26 | W18: 5 | X18: 6.3780000000000001 | Y18: 26 | Z18: 187.21276595744681 | AA18: =+(X18+U18+R18+O18+L18+I18+F18+C18)/8 -> 6.477125
A19: DANIEL | B19: 5 | C19: 6.6 | D19: 21 | E19: 7 | F19: 6.4889999999999999 | G19: 21 | H19: 8 | I19: 6.5990000000000002 | J19: 20 | K19: 6 | L19: 6.5990000000000002 | M19: 21 | N19: 4 | O19: 6.6559999999999997 | P19: 24 | Q19: 2 | R19: 6.5449999999999999 | S19: 25 | T19: 1 | U19: 6.49 | V19: 23 | W19: 3 | X19: 6.55 | Y19: 22 | Z19: 177.19148936170214 | AA19: =+(X19+U19+R19+O19+L19+I19+F19+C19)/8 -> 6.5660000000000007
A21: Bateria 3
A22: Nome | B22: P | C22: M.VOL | D22: B1 | E22: P | F22: M.VOL | G22: B2 | H22: P | I22: M.VOL | J22: B3 | K22: P | L22: M.VOL | M22: B4 | N22: P | O22: M.VOL | P22: B5 | Q22: P | R22: M.VOL | S22: B6 | T22: P | U22: M.VOL | V22: B7 | W22: P | X22: M.VOL | Y22: B8 | Z22: TOTAL | AA22: MEDIA
A23: MICHEL | B23: 4 | C23: 5.61 | D23: 29 | E23: 2 | F23: 5.8280000000000003 | G23: 27 | H23: 1 | I23: 5.8840000000000003 | J23: 26 | K23: 3 | L23: 5.7759999999999998 | M23: 29 | N23: 5 | O23: 4.0110000000000001 | P23: 29 | Q23: 7 | R23: 5.4989999999999997 | S23: 30 | T23: 8 | U23: 5.444 | V23: 31 | W23: 6 | X23: 5.4459999999999997 | Y23: 29 | Z23: 230.55319148936169 | AA23: =+(X23+U23+R23+O23+L23+I23+F23+C23)/8 -> 5.4372500000000006
A24: JULIO | B24: 5 | C24: 5.8289999999999997 | D24: 26 | E24: 7 | F24: 5.8280000000000003 | G24: 28 | H24: 8 | I24: 5.774 | J24: 28 | K24: 6 | L24: 5.8360000000000003 | M24: 28 | N24: 4 | O24: 5.6639999999999997 | P24: 30 | Q24: 2 | R24: 5.7770000000000001 | S24: 28 | T24: 1 | U24: 6.1040000000000001 | V24: 26 | W24: 3 | X24: 5.72 | Y24: 28 | Z24: 222.06382978723406 | AA24: =+(X24+U24+R24+O24+L24+I24+F24+C24)/8 -> 5.8165000000000004
A25: CONRADO | B25: 2 | C25: 5.891 | D25: 21 | E25: 1 | F25: 6.0490000000000004 | G25: 28 | H25: 3 | I25: 5.774 | J25: 29 | K25: 5 | L25: 5.94 | M25: 26 | N25: 7 | O25: 5.827 | P25: 28 | Q25: 8 | R25: 5.8289999999999997 | S25: 29 | T25: 6 | U25: 5.8289999999999997 | V25: 29 | W25: 4 | X25: 5.9390000000000001 | Y25: 28 | Z25: 218.27659574468086 | AA25: =+(X25+U25+R25+O25+L25+I25+F25+C25)/8 -> 5.8847499999999995
A26: MARQUINHO | B26: 6 | C26: 5.9409999999999998 | D26: 21 | E26: 4 | F26: 5.9379999999999997 | G26: 29 | H26: 2 | I26: 6.05 | J26: 27 | K26: 1 | L26: 6.4889999999999999 | M26: 25 | N26: 3 | O26: 5.9950000000000001 | P26: 27 | Q26: 5 | R26: 6.048 | S26: 28 | T26: 7 | U26: 5.9939999999999998 | V26: 28 | W26: 8 | X26: 5.609 | Y26: 29 | Z26: 214.85106382978722 | AA26: =+(X26+U26+R26+O26+L26+I26+F26+C26)/8 -> 6.0080000000000009
A27: GERONIMO | B27: 7 | C27: 6.2149999999999999 | D27: 26 | E27: 8 | F27: 6.2119999999999997 | G27: 27 | H27: 6 | I27: 6.2149999999999999 | J27: 27 | K27: 4 | L27: 6.1020000000000003 | M27: 26 | N27: 2 | O27: 6.2679999999999998 | P27: 27 | Q27: 1 | R27: 6.4429999999999996 | S27: 26 | T27: 3 | U27: 6.0549999999999997 | V27: 26 | W27: 5 | X27: 6.27 | Y27: 27 | Z27: 212.51063829787233 | AA27: =+(X27+U27+R27+O27+L27+I27+F27+C27)/8 -> 6.2225000000000001
A28: SIMONE | B28: 3 | C28: 6.218 | D28: 24 | E28: 5 | F28: 6.2160000000000002 | G28: 19 | H28: 7 | I28: 5.883 | J28: 26 | K28: 8 | L28: 5.9420000000000002 | M28: 24 | N28: 6 | O28: 5.9509999999999996 | P28: 25 | Q28: 4 | R28: 6.1040000000000001 | S28: 24 | T28: 2 | U28: 6.3239999999999998 | V28: 26 | W28: 1 | X28: 6.4359999999999999 | Y28: 24 | Z28: 192.63829787234042 | AA28: =+(X28+U28+R28+O28+L28+I28+F28+C28)/8 -> 6.1342499999999998
A29: ROBERTO | B29: 1 | C29: 6.5430000000000001 | D29: 19 | E29: 3 | F29: 6.5439999999999996 | G29: 23 | H29: 5 | I29: 6.3730000000000002 | J29: 21 | K29: 7 | L29: 6.2160000000000002 | M29: 22 | N29: 8 | O29: 6.2690000000000001 | P29: 25 | Q29: 6 | R29: 6.27 | S29: 24 | T29: 4 | U29: 6.3239999999999998 | V29: 23 | W29: 2 | X29: 6.1589999999999998 | Y29: 25 | Z29: 182.78723404255319 | AA29: =+(X29+U29+R29+O29+L29+I29+F29+C29)/8 -> 6.3372499999999992
A31: Bateria 4
A32: Nome | B32: P | C32: M.VOL | D32: B1 | E32: P | F32: M.VOL | G32: B2 | H32: P | I32: M.VOL | J32: B3 | K32: P | L32: M.VOL | M32: B4 | N32: P | O32: M.VOL | P32: B5 | Q32: P | R32: M.VOL | S32: B6 | T32: P | U32: M.VOL | V32: B7 | W32: P | X32: M.VOL | Y32: B8 | Z32: TOTAL | AA32: MEDIA
A33: ANDERSON | B33: 5 | C33: 5.6 | D33: 28 | E33: 7 | F33: 5.4960000000000004 | G33: 28 | H33: 8 | I33: 5.4450000000000003 | J33: 30 | K33: 6 | L33: 5.5549999999999997 | M33: 29 | N33: 4 | O33: 5.6639999999999997 | P33: 30 | Q33: 2 | R33: 5.609 | S33: 28 | T33: 1 | U33: 5.7190000000000003 | V33: 26 | W33: 3 | X33: 5.61 | Y33: 30 | Z33: 229 | AA33: =+(X33+U33+R33+O33+L33+I33+F33+C33)/8 -> 5.5872500000000009
A34: IMPORTADO | B34: 4 | C34: 5.72 | D34: 28 | E34: 2 | F34: 5.8289999999999997 | G34: 29 | H34: 1 | I34: 6.0030000000000001 | J34: 28 | K34: 3 | L34: 5.7750000000000004 | M34: 30 | N34: 5 | O34: 5.7770000000000001 | P34: 29 | Q34: 7 | R34: 5.6669999999999998 | S34: 26 | T34: 8 | U34: 5.6550000000000002 | V34: 29 | W34: 6 | X34: 5.6639999999999997 | Y34: 30 | Z34: 229.14893617021278 | AA34: =+(X34+U34+R34+O34+L34+I34+F34+C34)/8 -> 5.7612500000000004
A35: CAVANHA | B35: 6 | C35: 5.8280000000000003 | D35: 28 | E35: 4 | F35: 5.8289999999999997 | G35: 29 | H35: 2 | I35: 5.8319999999999999 | J35: 29 | K35: 1 | L35: 5.9390000000000001 | M35: 28 | N35: 3 | O35: 5.72 | P35: 29 | Q35: 5 | R35: 5.8840000000000003 | S35: 28 | T35: 7 | U35: 5.782 | V35: 28 | W35: 8 | X35: 5.774 | Y35: 28 | Z35: 227.80851063829786 | AA35: =+(X35+U35+R35+O35+L35+I35+F35+C35)/8 -> 5.8235000000000001
A36: CAVERNA | B36: 1 | C36: 6.1040000000000001 | D36: 27 | E36: 3 | F36: 5.8849999999999998 | G36: 29 | H36: 5 | I36: 5.83 | J36: 28 | K36: 7 | L36: 5.7190000000000003 | M36: 29 | N36: 8 | O36: 5.6539999999999999 | P36: 30 | Q36: 6 | R36: 5.7190000000000003 | S36: 29 | T36: 4 | U36: 5.83 | V36: 27 | W36: 2 | X36: 5.8849999999999998 | Y36: 27 | Z36: 226.10638297872342 | AA36: =+(X36+U36+R36+O36+L36+I36+F36+C36)/8 -> 5.8282499999999997
A37: ANGELAO | B37: 7 | C37: 5.4989999999999997 | D37: 27 | E37: 8 | F37: 5.5010000000000003 | G37: 28 | H37: 6 | I37: 5.6639999999999997 | J37: 27 | K37: 4 | L37: 5.61 | M37: 30 | N37: 2 | O37: 5.61 | P37: 30 | Q37: 1 | R37: 5.609 | S37: 25 | T37: 3 | U37: 5.61 | V37: 26 | W37: 5 | X37: 5.609 | Y37: 28 | Z37: 221.51063829787233 | AA37: =+(X37+U37+R37+O37+L37+I37+F37+C37)/8 -> 5.5890000000000004
A38: RUDSON | B38: 8 | C38: 6.1559999999999997 | D38: 25 | E38: 6 | F38: 6.0510000000000002 | G38: 24 | H38: 4 | I38: 6.2690000000000001 | J38: 27 | K38: 2 | L38: 6.05 | M38: 28 | N38: 1 | O38: 6.1050000000000004 | P38: 27 | Q38: 3 | R38: 6.2089999999999996 | S38: 25 | T38: 5 | U38: 6.05 | V38: 26 | W38: 7 | X38: 5.9379999999999997 | Y38: 28 | Z38: 210.34042553191489 | AA38: =+(X38+U38+R38+O38+L38+I38+F38+C38)/8 -> 6.1035000000000004
A39: M.VINICIUS | B39: 2 | C39: 6.71 | D39: 24 | E39: 1 | F39: 4.0140000000000002 | G39: 23 | H39: 3 | I39: 6.819 | J39: 24 | K39: 5 | L39: 6.71 | M39: 22 | N39: 7 | O39: 6.4349999999999996 | P39: 24 | Q39: 8 | R39: 6.8220000000000001 | S39: 23 | T39: 6 | U39: 6.601 | V39: 24 | W39: 4 | X39: 6.82 | Y39: 22 | Z39: 186.63829787234042 | AA39: =+(X39+U39+R39+O39+L39+I39+F39+C39)/8 -> 6.3663750000000006
A41: Bateria 5
A42: Nome | B42: P | C42: M.VOL | D42: B1 | E42: P | F42: M.VOL | G42: B2 | H42: P | I42: M.VOL | J42: B3 | K42: P | L42: M.VOL | M42: B4 | N42: P | O42: M.VOL | P42: B5 | Q42: P | R42: M.VOL | S42: B6 | T42: P | U42: M.VOL | V42: B7 | W42: P | X42: M.VOL | Y42: B8 | Z42: TOTAL | AA42: MEDIA
A43: HENRIQUE | B43: 2 | C43: 5.83 | D43: 29 | E43: 1 | F43: 6.0490000000000004 | G43: 28 | H43: 3 | I43: 5.83 | J43: 29 | K43: 5 | L43: 5.8730000000000002 | M43: 28 | N43: 7 | O43: 5.774 | P43: 29 | Q43: 8 | R43: 5.72 | S43: 29 | T43: 6 | U43: 5.8310000000000004 | V43: 29 | W43: 4 | X43: 5.8280000000000003 | Y43: 28 | Z43: 229.34042553191489 | AA43: =+(X43+U43+R43+O43+L43+I43+F43+C43)/8 -> 5.8418749999999999
A44: BONGA | B44: 6 | C44: 5.7210000000000001 | D44: 28 | E44: 4 | F44: 5.8289999999999997 | G44: 29 | H44: 2 | I44: 5.7729999999999997 | J44: 28 | K44: 1 | L44: 5.9960000000000004 | M44: 27 | N44: 3 | O44: 5.9950000000000001 | P44: 27 | Q44: 5 | R44: 5.6639999999999997 | S44: 29 | T44: 7 | U44: 5.774 | V44: 28 | W44: 8 | X44: 5.6660000000000004 | Y44: 28 | Z44: 224.65957446808511 | AA44: =+(X44+U44+R44+O44+L44+I44+F44+C44)/8 -> 5.802249999999999
A45: JERA | B45: 3 | C45: 5.8310000000000004 | D45: 27 | E45: 5 | F45: 5.8840000000000003 | G45: 28 | H45: 7 | I45: 5.7750000000000004 | J45: 29 | K45: 8 | L45: 5.7750000000000004 | M45: 29 | N45: 6 | O45: 5.8789999999999996 | P45: 29 | Q45: 4 | R45: 5.774 | S45: 29 | T45: 2 | U45: 5.8410000000000002 | V45: 27 | W45: 1 | X45: 5.8849999999999998 | Y45: 26 | Z45: 224.80851063829786 | AA45: =+(X45+U45+R45+O45+L45+I45+F45+C45)/8 -> 5.8304999999999998
A46: POWER | B46: 8 | C46: 5.8310000000000004 | D46: 28 | E46: 6 | F46: 5.8810000000000002 | G46: 29 | H46: 4 | I46: 5.7210000000000001 | J46: 28 | K46: 2 | L46: 5.7880000000000003 | M46: 27 | N46: 1 | O46: 5.8840000000000003 | P46: 28 | Q46: 3 | R46: 5.72 | S46: 28 | T46: 5 | U46: 5.8310000000000004 | V46: 29 | W46: 7 | X46: 5.774 | Y46: 27 | Z46: 224.34042553191489 | AA46: =+(X46+U46+R46+O46+L46+I46+F46+C46)/8 -> 5.80375
A47: PACHECO | B47: 1 | C47: 6.0490000000000004 | D47: 28 | E47: 3 | F47: 5.883 | G47: 27 | H47: 5 | I47: 6.05 | J47: 27 | K47: 7 | L47: 5.9950000000000001 | M47: 28 | N47: 8 | O47: 6.1589999999999998 | P47: 27 | Q47: 6 | R47: 6.2169999999999996 | S47: 25 | T47: 4 | U47: 5.8840000000000003 | V47: 27 | W47: 2 | X47: 6.0510000000000002 | Y47: 27 | Z47: 216.78723404255319 | AA47: =+(X47+U47+R47+O47+L47+I47+F47+C47)/8 -> 6.0360000000000005
A48: WELLIGNITON | B48: 4 | C48: 6.2160000000000002 | D48: 26 | E48: 2 | F48: 6.2080000000000002 | G48: 28 | H48: 1 | I48: 6.3319999999999999 | J48: 26 | K48: 3 | L48: 6.1059999999999999 | M48: 28 | N48: 5 | O48: 6.0449999999999999 | P48: 25 | Q48: 7 | R48: 6.2140000000000004 | S48: 25 | T48: 8 | U48: 6.1580000000000004 | V48: 27 | W48: 6 | X48: 6.1040000000000001 | Y48: 27 | Z48: 212.12765957446808 | AA48: =+(X48+U48+R48+O48+L48+I48+F48+C48)/8 -> 6.1728750000000003
A49: WALDIR | B49: 7 | C49: 6.4349999999999996 | D49: 21 | E49: 8 | F49: 6.27 | G49: 25 | H49: 6 | I49: 6.3230000000000004 | J49: 26 | K49: 4 | L49: 6.3789999999999996 | M49: 23 | N49: 2 | O49: 6.38 | P49: 25 | Q49: 1 | R49: 6.7089999999999996 | S49: 22 | T49: 3 | U49: 6.4349999999999996 | V49: 23 | W49: 5 | X49: 6.16 | Y49: 22 | Z49: 187.89361702127658 | AA49: =+(X49+U49+R49+O49+L49+I49+F49+C49)/8 -> 6.3863749999999992
A51: Bateria 6
A52: Nome | B52: P | C52: M.VOL | D52: B1 | E52: P | F52: M.VOL | G52: B2 | H52: P | I52: M.VOL | J52: B3 | K52: P | L52: M.VOL | M52: B4 | N52: P | O52: M.VOL | P52: B5 | Q52: P | R52: M.VOL | S52: B6 | T52: P | U52: M.VOL | V52: B7 | W52: P | X52: M.VOL | Y52: B8 | Z52: TOTAL | AA52: MEDIA
A53: KLEBER | B53: 4 | C53: 5.7750000000000004 | D53: 28 | E53: 2 | F53: 5.8849999999999998 | G53: 28 | H53: 1 | I53: 5.9379999999999997 | J53: 28 | K53: 3 | L53: 5.7750000000000004 | M53: 28 | N53: 5 | O53: 5.8280000000000003 | P53: 28 | Q53: 7 | R53: 5.718 | S53: 30 | T53: 8 | U53: 5.6630000000000003 | V53: 30 | W53: 6 | X53: 5.718 | Y53: 29 | Z53: 229.65957446808511 | AA53: =+(X53+U53+R53+O53+L53+I53+F53+C53)/8 -> 5.7874999999999996
A54: GABRIEL | B54: 8 | C54: 5.72 | D54: 25 | E54: 6 | F54: 5.8280000000000003 | G54: 28 | H54: 4 | I54: 5.6630000000000003 | J54: 29 | K54: 2 | L54: 5.83 | M54: 27 | N54: 1 | O54: 4.01 | P54: 27 | Q54: 3 | R54: 5.7750000000000004 | S54: 27 | T54: 5 | U54: 4.0129999999999999 | V54: 30 | W54: 7 | X54: 5.61 | Y54: 29 | Z54: 222.63829787234042 | AA54: =+(X54+U54+R54+O54+L54+I54+F54+C54)/8 -> 5.3061249999999998
A55: GODOI | B55: 3 | C55: 5.6630000000000003 | D55: 26 | E55: 5 | F55: 5.6120000000000001 | G55: 28 | H55: 7 | I55: 5.6669999999999998 | J55: 26 | K55: 8 | L55: 5.61 | M55: 28 | N55: 6 | O55: 5.61 | P55: 30 | Q55: 4 | R55: 5.718 | S55: 28 | T55: 2 | U55: 5.7729999999999997 | V55: 29 | W55: 1 | X55: 5.94 | Y55: 26 | Z55: 221.17021276595744 | AA55: =+(X55+U55+R55+O55+L55+I55+F55+C55)/8 -> 5.6991250000000004
A56: MANE | B56: 2 | C56: 5.8230000000000004 | D56: 27 | E56: 1 | F56: 5.883 | G56: 27 | H56: 3 | I56: 5.7809999999999997 | J56: 28 | K56: 5 | L56: 5.77 | M56: 27 | N56: 7 | O56: 5.718 | P56: 28 | Q56: 8 | R56: 5.7750000000000004 | S56: 29 | T56: 6 | U56: 5.7750000000000004 | V56: 27 | W56: 4 | X56: 5.7770000000000001 | Y56: 28 | Z56: 221.7659574468085 | AA56: =+(X56+U56+R56+O56+L56+I56+F56+C56)/8 -> 5.78775
A57: M.JOSE | B57: 7 | C57: 6.7629999999999999 | D57: 23 | E57: 8 | F57: 6.27 | G57: 22 | H57: 6 | I57: 6.6550000000000002 | J57: 21 | K57: 4 | L57: 6.6550000000000002 | M57: 22 | N57: 2 | O57: 6.49 | P57: 22 | Q57: 1 | R57: 6.4349999999999996 | S57: 25 | T57: 3 | U57: 6.2679999999999998 | V57: 25 | W57: 5 | X57: 6.38 | Y57: 23 | Z57: 183.2340425531915 | AA57: =+(X57+U57+R57+O57+L57+I57+F57+C57)/8 -> 6.4895000000000005
A58: NETO | B58: 5 | C58: 6.16 | D58: 22 | E58: 7 | F58: 5.9969999999999999 | G58: 24 | H58: 8 | I58: 6.3179999999999996 | J58: 19 | K58: 6 | L58: 6.27 | M58: 23 | N58: 4 | O58: 6.3250000000000002 | P58: 22 | Q58: 2 | R58: 6.38 | S58: 23 | T58: 1 | U58: 6.2149999999999999 | V58: 23 | W58: 3 | X58: 6.16 | Y58: 23 | Z58: 179.19148936170214 | AA58: =+(X58+U58+R58+O58+L58+I58+F58+C58)/8 -> 6.2281250000000004