A1: Nome | B1: P | C1: M.VOL | D1: B1 | E1: P | F1: M.VOL | G1: B2 | H1: P | I1: M.VOL | J1: B3 | K1: P | L1: M.VOL | M1: B4 | N1: P | O1: M.VOL | P1: B5 | Q1: P | R1: M.VOL | S1: B6 | T1: P | U1: M.VOL | V1: B7 | W1: P | X1: M.VOL | Y1: B8 | Z1: TOTAL | AA1: MEDIA
A2: SIMONE | B2: 5 | C2: 5.165 | D2: 50 | E2: 7 | F2: 5.06 | G2: 52 | H2: 8 | I2: 5.1550000000000002 | J2: 51 | K2: 6 | L2: 4.891 | M2: 50 | N2: 4 | O2: 5.4989999999999997 | P2: 50 | Q2: 2 | R2: 5.4450000000000003 | S2: 44 | T2: 1 | U2: 5.5540000000000003 | V2: 47 | W2: 3 | X2: 5.4459999999999997 | Y2: 50 | Z2: =+Y2+V2+S2+P2+M2+J2+G2+D2 -> 394 | AA2: =(+X2+U2+R2+O2+L2+I2+F2+C2)/8 -> 5.2768750000000004
A3: MARRIETE | B3: 2 | C3: 5.5540000000000003 | D3: 47 | E3: 1 | F3: 5.6609999999999996 | G3: 47 | H3: 3 | I3: 5.335 | J3: 49 | K3: 5 | L3: 5.2140000000000004 | M3: 48 | N3: 7 | O3: 5.17 | P3: 50 | Q3: 8 | R3: 5.17 | S3: 44 | T3: 6 | U3: 5.2249999999999996 | V3: 42 | W3: 4 | X3: 5.2809999999999997 | Y3: 51 | Z3: =+Y3+V3+S3+P3+M3+J3+G3+D3 -> 378 | AA3: =(+X3+U3+R3+O3+L3+I3+F3+C3)/8 -> 5.3262499999999999
A4: ADRIANA | B4: 6 | C4: 5.5 | D4: 44 | E4: 4 | F4: 4.7859999999999996 | G4: 42 | H4: 2 | I4: 5.7190000000000003 | J4: 49 | K4: 1 | L4: 5.7750000000000004 | M4: 47 | N4: 3 | O4: 5.7190000000000003 | P4: 46 | Q4: 5 | R4: 5.3339999999999996 | S4: 48 | T4: 7 | U4: 5.2240000000000002 | V4: 51 | W4: 8 | X4: 5.444 | Y4: 47 | Z4: =+Y4+V4+S4+P4+M4+J4+G4+D4 -> 374 | AA4: =(+X4+U4+R4+O4+L4+I4+F4+C4)/8 -> 5.4376250000000006
A5: FABIANA | B5: 4 | C5: 5.5620000000000003 | D5: 43 | E5: 2 | F5: 5.6710000000000003 | G5: 45 | H5: 1 | I5: 5.5549999999999997 | J5: 45 | K5: 3 | L5: 5.5 | M5: 46 | N5: 5 | O5: 5.2249999999999996 | P5: 47 | Q5: 7 | R5: 5.2240000000000002 | S5: 45 | T5: 8 | U5: 5.39 | V5: 46 | W5: 6 | X5: 5.2240000000000002 | Y5: 51 | Z5: =+Y5+V5+S5+P5+M5+J5+G5+D5 -> 368 | AA5: =(+X5+U5+R5+O5+L5+I5+F5+C5)/8 -> 5.4188749999999999
A6: PATRICIA | B6: 3 | C6: 5.39 | D6: 29 | E6: 5 | F6: 5.1150000000000002 | G6: 49 | H6: 7 | I6: 4.8959999999999999 | J6: 51 | K6: 8 | L6: 4.8949999999999996 | M6: 42 | N6: 6 | O6: 5.0529999999999999 | P6: 48 | Q6: 4 | R6: 5.4390000000000001 | S6: 44 | T6: 2 | U6: 5.39 | V6: 47 | W6: 1 | X6: 5.1059999999999999 | Y6: 51 | Z6: =+Y6+V6+S6+P6+M6+J6+G6+D6 -> 361 | AA6: =(+X6+U6+R6+O6+L6+I6+F6+C6)/8 -> 5.1604999999999999
A7: ANA | B7: 8 | C7: 5.665 | D7: 42 | E7: 6 | F7: 5.83 | G7: 43 | H7: 4 | I7: 5.94 | J7: 34 | K7: 2 | L7: 5.9089999999999998 | M7: 42 | N7: 1 | O7: 5.8849999999999998 | P7: 42 | Q7: 3 | R7: 5.7750000000000004 | S7: 43 | T7: 5 | U7: 5.7210000000000001 | V7: 40 | W7: 7 | X7: 5.6109999999999998 | Y7: 30 | Z7: =+Y7+V7+S7+P7+M7+J7+G7+D7 -> 316 | AA7: =(+X7+U7+R7+O7+L7+I7+F7+C7)/8 -> 5.7919999999999989
A8: ELIZANGELA | B8: 1 | C8: 6.3789999999999996 | D8: 31 | E8: 3 | F8: 6.05 | G8: 40 | H8: 5 | I8: 5.61 | J8: 43 | K8: 7 | L8: 5.335 | M8: 37 | N8: 8 | O8: 5.5549999999999997 | P8: 39 | Q8: 6 | R8: 5.8789999999999996 | S8: 36 | T8: 4 | U8: 6.05 | V8: 41 | W8: 2 | X8: 5.9960000000000004 | Y8: 37 | Z8: =+Y8+V8+S8+P8+M8+J8+G8+D8 -> 304 | AA8: =(+X8+U8+R8+O8+L8+I8+F8+C8)/8 -> 5.856749999999999
A9: BETH | B9: 7 | C9: 6.3860000000000001 | D9: 40 | E9: 8 | F9: 5.8840000000000003 | G9: 34 | H9: 6 | I9: 6.0670000000000002 | J9: 32 | K9: 4 | L9: 6.49 | M9: 35 | N9: 2 | O9: 6.3789999999999996 | P9: 36 | Q9: 1 | R9: 6.375 | S9: 36 | T9: 3 | U9: 6.2709999999999999 | V9: 36 | W9: 5 | X9: 6.2709999999999999 | Y9: 40 | Z9: =+Y9+V9+S9+P9+M9+J9+G9+D9 -> 289 | AA9: =(+X9+U9+R9+O9+L9+I9+F9+C9)/8 -> 6.2653750000000006