A1: Corrida

A1: Pos | B1: Nome | C1: TOTAL
A2: 1 | B2: MICHEL | C2: 260.34
A3: =+A2+1 -> 2 | B3: JUNINHO | C3: 254.97900000000001
A4: =+A3+1 -> 3 | B4: ANDERSON | C4: 250.93600000000001
A5: =+A4+1 -> 4 | B5: DINHO | C5: 250.66
A6: =+A5+1 -> 5 | B6: HENRIQUE | C6: 248.89400000000001
A7: =+A6+1 -> 6 | B7: KLEBER | C7: 248.87200000000001
A8: =+A7+1 -> 7 | B8: JULIO G | C8: 248.36199999999999
A9: =+A8+1 -> 8 | B9: GIOVANI | C9: 248
A10: =+A9+1 -> 9 | B10: importado | C10: 247.809
A11: =+A10+1 -> 10 | B11: erunda | C11: 246.53200000000001
A12: =+A11+1 -> 11 | B12: BONGA | C12: 243.10599999999999
A13: =+A12+1 -> 12 | B13: GABRIEL | C13: 241.27699999999999
A14: =+A13+1 -> 13 | B14: marquinho | C14: 240.17
A15: =+A14+1 -> 14 | B15: ERIC | C15: 237.87200000000001
A16: =+A15+1 -> 15 | B16: GODOI | C16: 234.27699999999999
A17: =+A16+1 -> 16 | B17: kibon | C17: 234.04300000000001
A18: =+A17+1 -> 17 | B18: POWER | C18: 232.851
A19: =+A18+1 -> 18 | B19: JEISON | C19: 232.46799999999999
A20: =+A19+1 -> 19 | B20: MANE | C20: 232.149
A21: =+A20+1 -> 20 | B21: CONRADO | C21: 231.04300000000001
A22: =+A21+1 -> 21 | B22: MARCEL | C22: 229.83
A23: =+A22+1 -> 22 | B23: RUDSON | C23: 229.66
A24: =+A23+1 -> 23 | B24: rubenes | C24: 229.511
A25: =+A24+1 -> 24 | B25: caverna | C25: 229.23400000000001
A26: =+A25+1 -> 25 | B26: WELLIGNITON | C26: 229.06399999999999
A27: =+A26+1 -> 26 | B27: NETO | C27: 227.38300000000001
A28: =+A27+1 -> 27 | B28: PICA PAU | C28: 225.63800000000001
A29: =+A28+1 -> 28 | B29: SIMONE | C29: 219.489
A30: =+A29+1 -> 29 | B30: RICARDO | C30: 219.191
A31: =+A30+1 -> 30 | B31: ANGELAO | C31: 218.27699999999999
A32: =+A31+1 -> 31 | B32: DANILO | C32: 215.87200000000001
A33: =+A32+1 -> 32 | B33: JAPAO | C33: 214.61699999999999
A34: =+A33+1 -> 33 | B34: RODRIGUINHO | C34: 209.17
A35: =+A34+1 -> 34 | B35: M.JOSE | C35: 207.17
A36: =+A35+1 -> 35 | B36: GERONIMO | C36: 206.04300000000001
A37: =+A36+1 -> 36 | B37: XUBAKA | C37: 199.53200000000001
A38: =+A37+1 -> 37 | B38: SANDRO | C38: 193.23400000000001
A39: =+A38+1 -> 38 | B39: jeronimo | C39: 189.298
A40: =+A39+1 -> 39 | B40: MARINHO | C40: 188.21299999999999
A41: =+A40+1 -> 40 | B41: ROBERTO | C41: 185.149
A42: =+A41+1 -> 41 | B42: XANEL | C42: 184.191
A43: =+A42+1 -> 42 | B43: M.VINICIUS | C43: 180.53200000000001
A44: =+A43+1 -> 43 | B44: CAVANHA | C44: 179.83
A45: =+A44+1 -> 44 | B45: DANIEL | C45: 165.17