A1: Pos | B1: Piloto | C1: Total
A2: 1 | B2: MICHEL | C2: 239.74468085106383
A3: =+A2+1 -> 2 | B3: IMPORTADO | C3: 239.19148936170214
A4: =+A3+1 -> 3 | B4: ANDERSON | C4: 238.63829787234042
A5: =+A4+1 -> 4 | B5: KLEBER | C5: 232.7659574468085
A6: =+A5+1 -> 5 | B6: DINHO | C6: 230.78723404255319
A7: =+A6+1 -> 6 | B7: RICARDO | C7: 229.80851063829786
A8: =+A7+1 -> 7 | B8: ERUNDA | C8: 229.29787234042553
A9: =+A8+1 -> 8 | B9: ANGELAO | C9: 225.82978723404256
A10: =+A9+1 -> 9 | B10: MARCEL | C10: 224.68085106382978
A11: =+A10+1 -> 10 | B11: JERONIMO | C11: 222.7659574468085
A12: =+A11+1 -> 11 | B12: JULIO | C12: 222.17021276595744
A13: =+A12+1 -> 12 | B13: JAPAO | C13: 221.38297872340425
A14: =+A13+1 -> 13 | B14: MANE | C14: 219.91489361702128
A15: =+A14+1 -> 14 | B15: CAVANHA | C15: 218.85106382978722
A16: =+A15+1 -> 15 | B16: POWER | C16: 218.61702127659575
A17: =+A16+1 -> 16 | B17: RUBENS | C17: 218.42553191489361
A18: =+A17+1 -> 17 | B18: CAVERNA | C18: 217.82978723404256
A19: =+A18+1 -> 18 | B19: ERIC | C19: 216.74468085106383
A20: =+A19+1 -> 19 | B20: BONGA | C20: 214.65957446808511
A21: =+A20+1 -> 20 | B21: NETO | C21: 211.19148936170214
A22: =+A21+1 -> 21 | B22: GERONIMO | C22: 209.65957446808511
A23: =+A22+1 -> 22 | B23: MARQUINHO | C23: 207.89361702127658
A24: =+A23+1 -> 23 | B24: SANDRO ITU | C24: 206.14893617021278
A25: =+A24+1 -> 24 | B25: RUDSON | C25: 202.78723404255319
A26: =+A25+1 -> 25 | B26: GIOVANNI | C26: 199.31914893617022
A27: =+A26+1 -> 26 | B27: XUBAKA | C27: 192.31914893617022
A28: =+A27+1 -> 27 | B28: CONRADO | C28: 174.21276595744681
A29: =+A28+1 -> 28 | B29: DANIEL | C29: 166.2340425531915
A30: =+A29+1 -> 29 | B30: FLAVIO | C30: 166.21276595744681
A31: =+A30+1 -> 30 | B31: LUIZ FELIPE | C31: 126.55319148936171
A32: =+A31+1 -> 31 | B32: GODOI | C32: 125