A1: Corrida

A1: POS | B1: NOME | C1: PONTOS
A2: 1 | B2: ANDERSON | C2: 243.191
A3: =+A2+1 -> 2 | B3: DINHO | C3: 237.745
A4: =+A3+1 -> 3 | B4: MARQUINHO | C4: 237.298
A5: =+A4+1 -> 4 | B5: BONGA | C5: 231.12799999999999
A6: =+A5+1 -> 5 | B6: JUNINHO | C6: 230.702
A7: =+A6+1 -> 6 | B7: IMPORTADO | C7: 225.511
A8: =+A7+1 -> 7 | B8: JULIO | C8: 224.78700000000001
A9: =+A8+1 -> 8 | B9: CAVANHA | C9: 224.10599999999999
A10: =+A9+1 -> 9 | B10: MICHEL | C10: 223.23400000000001
A11: =+A10+1 -> 10 | B11: ERUNDA | C11: 220.76599999999999
A12: =+A11+1 -> 11 | B12: RUBENS | C12: 219.447
A13: =+A12+1 -> 12 | B13: ALEX | C13: 218.83
A14: =+A13+1 -> 13 | B14: HENRIQUE | C14: 218.38300000000001
A15: =+A14+1 -> 14 | B15: WELLIGNITON | C15: 216.68100000000001
A16: =+A15+1 -> 15 | B16: MANE | C16: 215.23400000000001
A17: =+A16+1 -> 16 | B17: KLEBER | C17: 215.191
A18: =+A17+1 -> 17 | B18: ANGELAO | C18: 213.851
A19: =+A18+1 -> 18 | B19: CAVERNA | C19: 213.27600000000001
A20: =+A19+1 -> 19 | B20: GABRIEL | C20: 211.12799999999999
A21: =+A20+1 -> 20 | B21: GIOVANNI | C21: 210.83
A22: =+A21+1 -> 21 | B22: DANILO | C22: 209.17
A23: =+A22+1 -> 22 | B23: RICARDO | C23: 208.23400000000001
A24: =+A23+1 -> 23 | B24: RUDSON | C24: 204.23400000000001
A25: =+A24+1 -> 24 | B25: JAPAO | C25: 203.89400000000001
A26: =+A25+1 -> 25 | B26: XUBAKA | C26: 203.83
A27: =+A26+1 -> 26 | B27: KIBOM | C27: 202.57400000000001
A28: =+A27+1 -> 27 | B28: MARINHO | C28: 202.553
A29: =+A28+1 -> 28 | B29: ERIC | C29: 201.65899999999999
A30: =+A29+1 -> 29 | B30: JEISON | C30: 198.298
A31: =+A30+1 -> 30 | B31: PACHECO | C31: 197.91499999999999
A32: =+A31+1 -> 31 | B32: RODRIGUINHO | C32: 195.12799999999999
A33: =+A32+1 -> 32 | B33: JERONIMO | C33: 193.31899999999999
A34: =+A33+1 -> 33 | B34: GODOI | C34: 192.06399999999999
A35: =+A34+1 -> 34 | B35: POWER | C35: 191.149
A36: =+A35+1 -> 35 | B36: MORA | C36: 188.31899999999999
A37: =+A36+1 -> 36 | B37: SIMONE | C37: 185.04300000000001
A38: =+A37+1 -> 37 | B38: NETO | C38: 185.04300000000001
A39: =+A38+1 -> 38 | B39: M. JOSE | C39: 180.61699999999999
A40: =+A39+1 -> 39 | B40: CACO | C40: 177.65899999999999
A41: =+A40+1 -> 40 | B41: CONRADO | C41: 169.745
A42: =+A41+1 -> 41 | B42: DANIEL | C42: 159.46799999999999
A43: =+A42+1 -> 42 | B43: M.VINICIUS | C43: 146.68100000000001
A44: =+A43+1 -> 43 | B44: CAIO | C44: 141.27600000000001