A1: POS | B1: Pilotos | C1: 1 Etapa | D1: 2 Etapa | E1: 3 Etapa | F1: 4 Etapa | G1: 5 Etapa | H1: 6 Etapa | I1: Total
A2: 1 | B2: BONGA | C2: 65 | D2: 55 | E2: 40 | F2: 60 | G2: 55 | H2: 60 | I2: =SUM(C2:H2) -> 335
A3: 2 | B3: MICHEL | C3: 0 | D3: 65 | E3: 55 | F3: 60 | G3: 65 | H3: 65 | I3: =SUM(C3:H3) -> 310
A4: 3 | B4: POWER | C4: 60 | D4: 40 | E4: 45 | F4: 55 | G4: 60 | H4: 50 | I4: =SUM(C4:H4) -> 310
A5: 4 | B5: KLEBER | C5: 40 | D5: 60 | E5: 60 | F5: 45 | G5: 45 | H5: 55 | I5: =SUM(C5:H5) -> 305
A6: 5 | B6: NETO | C6: 50 | D6: 45 | E6: 30 | F6: 36 | G6: 50 | H6: 45 | I6: =SUM(C6:H6) -> 256
A7: 6 | B7: RICARDO | C7: 36 | D7: 28 | E7: 36 | F7: 32 | G7: 0 | H7: 0 | I7: =SUM(C7:H7) -> 132
A8: 7 | B8: RUDSON | C8: 32 | D8: 24 | E8: 24 | F8: 0 | G8: 0 | H8: 40 | I8: =SUM(C8:H8) -> 120
A9: 8 | B9: DINHO | C9: 0 | D9: 0 | E9: 50 | F9: 50 | G9: 0 | H9: 0 | I9: =SUM(C9:H9) -> 100
A10: 9 | B10: RUBAO | C10: 55 | D10: 36 | E10: 0 | F10: 0 | G10: 0 | H10: 0 | I10: =SUM(C10:H10) -> 91
A11: 10 | B11: JULIO | C11: 45 | D11: 32 | E11: 0 | F11: 0 | G11: 0 | H11: 0 | I11: =SUM(C11:H11) -> 77
A12: 11 | B12: GIOVANNI | C12: 24 | D12: 0 | E12: 0 | F12: 40 | G12: 0 | H12: 0 | I12: =SUM(C12:H12) -> 64
A13: 12 | B13: ERUNDA | C13: 0 | D13: 0 | E13: 0 | F13: 0 | G13: 40 | H13: 0 | I13: =SUM(C13:H13) -> 40
A14: 13 | B14: ANGELAO | C14: 0 | D14: 0 | E14: 0 | F14: 0 | G14: 0 | H14: 36 | I14: =SUM(C14:H14) -> 36
A15: 14 | B15: EVANDRO | C15: 28 | D15: 0 | E15: 0 | F15: 0 | G15: 0 | H15: 0 | I15: =SUM(C15:H15) -> 28
A16: 15 | B16: JERONIMO | C16: 0 | D16: 0 | E16: 28 | F16: 0 | G16: 0 | H16: 0 | I16: =SUM(C16:H16) -> 28
A17: 16 | B17: CAVERNA | C17: 0 | D17: 20 | E17: 0 | F17: 0 | G17: 0 | H17: 0 | I17: =SUM(C17:H17) -> 20