A1: Nome | B1: Pi | C1: Tempo | D1: Vol | E1: Pi | F1: Tempo | G1: Vol | H1: Pi | I1: Tempo | J1: Vol | K1: Pi | L1: Tempo | M1: Vol | N1: Pi | O1: Tempo | P1: Vol | Q1: Pi | R1: Tempo | S1: Vol | T1: Pi | U1: Tempo | V1: Vol | W1: Pi | X1: Tempo | Y1: Vol | Z1: Total | AA1: Media | AB1: Record
A2: ERUNDA | B2: 6 | C2: 4.3470000000000004 | D2: 25 | E2: 4 | F2: 4.343 | G2: 21 | H2: 2 | I2: 4.3440000000000003 | J2: 25 | K2: 1 | L2: 4.4530000000000003 | M2: 25 | N2: 3 | O2: 4.2949999999999999 | P2: 25 | Q2: 5 | R2: 4.2910000000000004 | S2: 25 | T2: 7 | U2: 4.1749999999999998 | V2: 23 | W2: 8 | X2: 4.2370000000000001 | Y2: 26 | Z2: =+Y2+V2+S2+P2+M2+J2+G2+D2 -> 195 | AA2: =+(X2+U2+R2+O2+L2+I2+F2+C2)/8 -> 4.3106249999999999 | AB2: =MINA(X2,U2,R2,O2,L2,I2,F2,C2) -> 4.1749999999999998
A3: RICARDO | B3: 2 | C3: 4.2910000000000004 | D3: 23 | E3: 1 | F3: 4.29 | G3: 22 | H3: 3 | I3: 4.1269999999999998 | J3: 25 | K3: 5 | L3: 4.1219999999999999 | M3: 27 | N3: 7 | O3: 3.96 | P3: 25 | Q3: 8 | R3: 3.907 | S3: 21 | T3: 6 | U3: 4.0739999999999998 | V3: 26 | W3: 4 | X3: 4.2910000000000004 | Y3: 24 | Z3: =+Y3+V3+S3+P3+M3+J3+G3+D3 -> 193 | AA3: =+(X3+U3+R3+O3+L3+I3+F3+C3)/8 -> 4.1327499999999997 | AB3: =MINA(X3,U3,R3,O3,L3,I3,F3,C3) -> 3.907
A4: BONGA | B4: 1 | C4: 4.4009999999999998 | D4: 25 | E4: 3 | F4: 4.4080000000000004 | G4: 20 | H4: 5 | I4: 4.2329999999999997 | J4: 25 | K4: 7 | L4: 4.0339999999999998 | M4: 26 | N4: 8 | O4: 4.1779999999999999 | P4: 25 | Q4: 6 | R4: 4.1779999999999999 | S4: 25 | T4: 4 | U4: 4.0149999999999997 | V4: 24 | W4: 2 | X4: 4.234 | Y4: 22 | Z4: 193 | AA4: =+(X4+U4+R4+O4+L4+I4+F4+C4)/8 -> 4.2101249999999997 | AB4: =MINA(X4,U4,R4,O4,L4,I4,F4,C4) -> 4.0149999999999997
A5: POWER | B5: 5 | C5: 4.29 | D5: 26 | E5: 7 | F5: 4.2350000000000003 | G5: 20 | H5: 8 | I5: 4.29 | J5: 22 | K5: 6 | L5: 4.1929999999999996 | M5: 27 | N5: 4 | O5: 4.07 | P5: 26 | Q5: 2 | R5: 4.1340000000000003 | S5: 21 | T5: 1 | U5: 4.1820000000000004 | V5: 23 | W5: 3 | X5: 4.2359999999999998 | Y5: 25 | Z5: 191 | AA5: =+(X5+U5+R5+O5+L5+I5+F5+C5)/8 -> 4.2037500000000003 | AB5: =MINA(X5,U5,R5,O5,L5,I5,F5,C5) -> 4.07
A6: GODOI | B6: 7 | C6: 4.1779999999999999 | D6: 24 | E6: 8 | F6: 4.1269999999999998 | G6: 23 | H6: 6 | I6: 4.07 | J6: 24 | K6: 4 | L6: 4.36 | M6: 23 | N6: 2 | O6: 4.242 | P6: 24 | Q6: 1 | R6: 4.3540000000000001 | S6: 22 | T6: 3 | U6: 4.181 | V6: 24 | W6: 5 | X6: 4.0149999999999997 | Y6: 25 | Z6: 190 | AA6: =+(X6+U6+R6+O6+L6+I6+F6+C6)/8 -> 4.1908750000000001 | AB6: =MINA(X6,U6,R6,O6,L6,I6,F6,C6) -> 4.0149999999999997
A7: MICHEL | B7: 4 | C7: 4.4 | D7: 21 | E7: 2 | F7: 4.2939999999999996 | G7: 22 | H7: 1 | I7: 4.3310000000000004 | J7: 25 | K7: 3 | L7: 4.3280000000000003 | M7: 26 | N7: 5 | O7: 4.2370000000000001 | P7: 25 | Q7: 7 | R7: 4.07 | S7: 23 | T7: 8 | U7: 4.117 | V7: 22 | W7: 6 | X7: 4.125 | Y7: 24 | Z7: =+Y7+V7+S7+P7+M7+J7+G7+D7 -> 188 | AA7: =+(X7+U7+R7+O7+L7+I7+F7+C7)/8 -> 4.2377500000000001 | AB7: =MINA(X7,U7,R7,O7,L7,I7,F7,C7) -> 4.07
A8: JERONIMO | B8: 8 | C8: 4.18 | D8: 24 | E8: 6 | F8: 4.1269999999999998 | G8: 20 | H8: 4 | I8: 4.07 | J8: 24 | K8: 2 | L8: 4.2880000000000003 | M8: 23 | N8: 1 | O8: 4.29 | P8: 24 | Q8: 3 | R8: 4.016 | S8: 23 | T8: 5 | U8: 4.125 | V8: 24 | W8: 7 | X8: 4.0149999999999997 | Y8: 21 | Z8: =+Y8+V8+S8+P8+M8+J8+G8+D8 -> 183 | AA8: =+(X8+U8+R8+O8+L8+I8+F8+C8)/8 -> 4.1388750000000005 | AB8: =MINA(X8,U8,R8,O8,L8,I8,F8,C8) -> 4.0149999999999997
A9: KLEBER | B9: 3 | C9: 4.335 | D9: 19 | E9: 5 | F9: 4.51 | G9: 15 | H9: 7 | I9: 4.1779999999999999 | J9: 25 | K9: 8 | L9: 4.29 | M9: 23 | N9: 6 | O9: 4.29 | P9: 25 | Q9: 4 | R9: 4.3449999999999998 | S9: 18 | T9: 2 | U9: 4.51 | V9: 20 | W9: 1 | X9: 4.3979999999999997 | Y9: 21 | Z9: =+Y9+V9+S9+P9+M9+J9+G9+D9 -> 166 | AA9: =+(X9+U9+R9+O9+L9+I9+F9+C9)/8 -> 4.3570000000000002 | AB9: =MINA(X9,U9,R9,O9,L9,I9,F9,C9) -> 4.1779999999999999