A1: Pos | B1: Nome | C1: Total
A2: 1 | B2: ANDERSON | C2: 261.08510638297872
A3: =+A2+1 -> 2 | B3: KLEBER | C3: 255.89361702127658
A4: =+A3+1 -> 3 | B4: GOROI | C4: 254.85106382978722
A5: =+A4+1 -> 4 | B5: MARCEL | C5: 252.21276595744681
A6: =+A5+1 -> 5 | B6: MICHEL | C6: 250.85106382978722
A7: =+A6+1 -> 6 | B7: BONGA | C7: 248.85106382978722
A8: =+A7+1 -> 7 | B8: JUNINHO | C8: 247.65957446808511
A9: =+A8+1 -> 8 | B9: RUBENS | C9: 243.63829787234042
A10: =+A9+1 -> 9 | B10: ANGELAO | C10: 243.29787234042553
A11: =+A10+1 -> 10 | B11: JULIO | C11: 243.21276595744681
A12: =+A11+1 -> 11 | B12: ERUNDA | C12: 242.2340425531915
A13: =+A12+1 -> 12 | B13: KVANHA | C13: 241.91489361702128
A14: =+A13+1 -> 13 | B14: JERONIMO | C14: 241.14893617021278
A15: =+A14+1 -> 14 | B15: MANE | C15: 237.34042553191489
A16: =+A15+1 -> 15 | B16: POWER | C16: 237.12765957446808
A17: =+A16+1 -> 16 | B17: GABRIEL | C17: 237.10638297872342
A18: =+A17+1 -> 17 | B18: DINHO | C18: 236.06382978723406
A19: =+A18+1 -> 18 | B19: JAPAO | C19: 231.61702127659575
A20: =+A19+1 -> 19 | B20: GIOVANNI | C20: 226.97872340425531
A21: =+A20+1 -> 20 | B21: RICARDO | C21: 224.80851063829786
A22: =+A21+1 -> 21 | B22: CONRADO | C22: 217.85106382978722
A23: =+A22+1 -> 22 | B23: ERIC | C23: 213.06382978723406
A24: =+A23+1 -> 23 | B24: CAVERNA | C24: 209.19148936170214
A25: =+A24+1 -> 24 | B25: GERONIMO | C25: 208.36170212765958
A26: =+A25+1 -> 25 | B26: RUDSON | C26: 207.74468085106383
A27: =+A26+1 -> 26 | B27: M.JOSE | C27: 201.36170212765958
A28: =+A27+1 -> 27 | B28: FLAVIO | C28: 199.38297872340425
A29: =+A28+1 -> 28 | B29: NETO | C29: 194.7659574468085
A30: =+A29+1 -> 29 | B30: EVANDRO | C30: 192.46808510638297
A31: =+A30+1 -> 30 | B31: CLAYTON | C31: 189.7659574468085
A32: =+A31+1 -> 31 | B32: LUIZ FELIPE | C32: 170.57446808510639
A33: =+A32+1 -> 32 | B33: M. VINICIUS | C33: 163.27659574468086
A34: =+A33+1 -> 33 | B34: MANO | C34: 159.25531914893617
A35: =+A34+1 -> 34 | B35: CID GOSME | C35: 153.2340425531915
A36: =+A35+1 -> 35 | B36: MURILO | C36: 115.19148936170212