A1: POS | B1: PILOTO | C1: PONTOS
A2: 1 | B2: KLEBER | C2: 255.63829787234042
A3: =+A2+1 -> 2 | B3: MICHEL | C3: 253.17021276595744
A4: =+A3+1 -> 3 | B4: DINHO | C4: 250.06382978723406
A5: =+A4+1 -> 4 | B5: ERUNDA | C5: 243.85106382978722
A6: =+A5+1 -> 5 | B6: CAVANHA | C6: 242.19148936170214
A7: =+A6+1 -> 6 | B7: JUNINHO | C7: 239.29787234042553
A8: =+A7+1 -> 7 | B8: MARCEL | C8: 238.65957446808511
A9: =+A8+1 -> 8 | B9: ANDERSON | C9: 236.87234042553192
A10: =+A9+1 -> 9 | B10: JERONIMO | C10: 234.78723404255319
A11: =+A10+1 -> 10 | B11: GODOI | C11: 232.25531914893617
A12: =+A11+1 -> 11 | B12: GABRIEL | C12: 232.10638297872342
A13: =+A12+1 -> 12 | B13: POWER | C13: 231.59574468085106
A14: =+A13+1 -> 13 | B14: RUBENS | C14: 230.25531914893617
A15: =+A14+1 -> 14 | B15: CAVERNA | C15: 230.04255319148936
A16: =+A15+1 -> 15 | B16: BONGA | C16: 229.70212765957447
A17: =+A16+1 -> 16 | B17: ERIC | C17: 224.87234042553192
A18: =+A17+1 -> 17 | B18: JAPAO | C18: 224.27659574468086
A19: =+A18+1 -> 18 | B19: GIOVANNI | C19: 223.80851063829786
A20: =+A19+1 -> 19 | B20: NETO | C20: 222.65957446808511
A21: =+A20+1 -> 20 | B21: SANDRO ITU | C21: 218.68085106382978
A22: =+A21+1 -> 21 | B22: ANGELAO | C22: 215.61702127659575
A23: =+A22+1 -> 22 | B23: RICARDO | C23: 215.12765957446808
A24: =+A23+1 -> 23 | B24: MANE | C24: 215.06382978723406
A25: =+A24+1 -> 24 | B25: RUDSON | C25: 210.40425531914894
A26: =+A25+1 -> 25 | B26: JULIO | C26: 205.04255319148936
A27: =+A26+1 -> 26 | B27: MARCOS JOSE | C27: 199.63829787234042
A28: =+A27+1 -> 27 | B28: EVANDRO | C28: 191.87234042553192
A29: =+A28+1 -> 28 | B29: FLAVIO | C29: 183.25531914893617
A30: =+A29+1 -> 29 | B30: DANIEL | C30: 179.68085106382978