A1: Corrida

B1: 3 ETAPA
A2: Pos | B2: Nome | C2: PONTOS
A3: 1 | B3: IMPORTADO | C3: 244.17
A4: =+A3+1 -> 2 | B4: ANDERSON | C4: 242.45
A5: =+A4+1 -> 3 | B5: MICHEL | C5: 239.11
A6: =+A5+1 -> 4 | B6: DINHO | C6: 236.62
A7: =+A6+1 -> 5 | B7: MARCEL | C7: 231.77
A8: =+A7+1 -> 6 | B8: KLEBER | C8: 227.64
A9: =+A8+1 -> 7 | B9: ERUNDA | C9: 226.74
A10: =+A9+1 -> 8 | B10: CAVANHA | C10: 225.7
A11: =+A10+1 -> 9 | B11: JULIO | C11: 225.19
A12: =+A11+1 -> 10 | B12: WELLIGINITON | C12: 223.3
A13: =+A12+1 -> 11 | B13: BONGA | C13: 222.85
A14: =+A13+1 -> 12 | B14: JUNINHO | C14: 222.83
A15: =+A14+1 -> 13 | B15: CAVERNA | C15: 219.4
A16: =+A15+1 -> 14 | B16: JAPAO | C16: 218.66
A17: =+A16+1 -> 15 | B17: GODOI | C17: 218.09
A18: =+A17+1 -> 16 | B18: JEISON | C18: 217.53
A19: =+A18+1 -> 17 | B19: RICARDO | C19: 216.66
A20: =+A19+1 -> 18 | B20: RUDSON | C20: 215.23
A21: =+A20+1 -> 19 | B21: ALEX | C21: 212.72
A22: =+A21+1 -> 20 | B22: ANGELAO | C22: 212.28
A23: =+A22+1 -> 21 | B23: RUBENS | C23: 211.85
A24: =+A23+1 -> 22 | B24: GABRIEL | C24: 211.4
A25: =+A24+1 -> 23 | B25: GEOVANNI | C25: 208.64
A26: =+A25+1 -> 24 | B26: XUBAKA | C26: 202.6
A27: =+A26+1 -> 25 | B27: CONRADO | C27: 202.47
A28: =+A27+1 -> 26 | B28: ERIC | C28: 200.19
A29: =+A28+1 -> 27 | B29: MARQUINHO | C29: 195.32
A30: =+A29+1 -> 28 | B30: CAIO | C30: 192.11
A31: =+A30+1 -> 29 | B31: MANE | C31: 191.38
A32: =+A31+1 -> 30 | B32: DANILO | C32: 190.23
A33: =+A32+1 -> 31 | B33: NETO | C33: 189.17
A34: =+A33+1 -> 32 | B34: M.JOSE | C34: 188.28
A35: =+A34+1 -> 33 | B35: SANDRO | C35: 186.83
A36: =+A35+1 -> 34 | B36: JERONIMO | C36: 185.87
A37: =+A36+1 -> 35 | B37: ROBRIGUINHO | C37: 182.53
A38: =+A37+1 -> 36 | B38: PACHECO | C38: 178.26
A39: =+A38+1 -> 37 | B39: MARINHO | C39: 176.85
A40: =+A39+1 -> 38 | B40: RODRIGO | C40: 175.87
A41: =+A40+1 -> 39 | B41: DANIEL | C41: 171.28
A42: =+A41+1 -> 40 | B42: M.VINICIUS | C42: 168.28
A43: =+A42+1 -> 41 | B43: TIRSO | C43: 163.21

B1: RECORD GERAL
A3: PISTA | B3: TEMPO | C3: NOME
A4: 1 | B4: DINHO | C4: 5.2670000000000003
A5: 2 | B5: IMPORTADO | C5: 5.282
A6: 3 | B6: ANDERSON | C6: 5.0110000000000001
A7: 4 | B7: DINHO | C7: 5.0220000000000002
A8: 5 | B8: MICHEL | C8: 5.0170000000000003
A9: 6 | B9: MICHEL | C9: 5.0049999999999999
A10: 7 | B10: IMPORTADO | C10: 5.194
A11: 8 | B11: IMPORTADO | C11: 4.8230000000000004