A1: Nome | B1: P | C1: Tempo | D1: Vol | E1: P | F1: Tempo | G1: Vol | H1: P | I1: Tempo | J1: Vol | K1: P | L1: Tempo | M1: Vol | N1: P | O1: Tempo | P1: Vol | Q1: P | R1: Tempo | S1: Vol | T1: P | U1: Tempo | V1: Vol | W1: P | X1: Tempo | Y1: Vol | Z1: Total | AA1: Media | AB1: Record
A2: MICHEL | B2: 3 | C2: 5.5 | D2: 29 | E2: 5 | F2: 5.4989999999999997 | G2: 29 | H2: 7 | I2: 5.5 | J2: 31 | K2: 8 | L2: 5.4989999999999997 | M2: 30 | N2: 6 | O2: 5.4989999999999997 | P2: 31 | Q2: 4 | R2: 5.4989999999999997 | S2: 30 | T2: 2 | U2: 5.4989999999999997 | V2: 29 | W2: 1 | X2: 5.72 | Y2: 29 | Z2: 239 | AA2: =+(X2+U2+R2+O2+L2+I2+F2+C2)/8 -> 5.5268750000000004 | AB2: =MINA(X2,U2,R2,O2,L2,I2,F2,C2) -> 5.4989999999999997
A3: BONGA | B3: 6 | C3: 5.5 | D3: 29 | E3: 4 | F3: 5.5 | G3: 26 | H3: 2 | I3: 5.5 | J3: 29 | K3: 1 | L3: 5.7190000000000003 | M3: 26 | N3: 3 | O3: 5.5 | P3: 29 | Q3: 5 | R3: 5.5 | S3: 30 | T3: 7 | U3: 5.5 | V3: 30 | W3: 8 | X3: 5.335 | Y3: 31 | Z3: 231 | AA3: =+(X3+U3+R3+O3+L3+I3+F3+C3)/8 -> 5.5067500000000003 | AB3: =MINA(X3,U3,R3,O3,L3,I3,F3,C3) -> 5.335
A4: KLEBER | B4: 5 | C4: 5.5 | D4: 28 | E4: 7 | F4: 5.4989999999999997 | G4: 31 | H4: 8 | I4: 5.5 | J4: 30 | K4: 6 | L4: 5.5 | M4: 28 | N4: 4 | O4: 5.72 | P4: 30 | Q4: 2 | R4: 5.72 | S4: 30 | T4: 1 | U4: 5.9390000000000001 | V4: 24 | W4: 3 | X4: 5.7190000000000003 | Y4: 29 | Z4: 230 | AA4: =+(X4+U4+R4+O4+L4+I4+F4+C4)/8 -> 5.6371250000000002 | AB4: =MINA(X4,U4,R4,O4,L4,I4,F4,C4) -> 5.4989999999999997
A5: POWER | B5: 7 | C5: 5.5 | D5: 28 | E5: 8 | F5: 5.5 | G5: 29 | H5: 6 | I5: 5.7190000000000003 | J5: 28 | K5: 4 | L5: 5.5 | M5: 30 | N5: 2 | O5: 5.72 | P5: 28 | Q5: 1 | R5: 5.71 | S5: 30 | T5: 3 | U5: 5.5010000000000003 | V5: 27 | W5: 5 | X5: 5.72 | Y5: 28 | Z5: 228 | AA5: =+(X5+U5+R5+O5+L5+I5+F5+C5)/8 -> 5.6087499999999997 | AB5: =MINA(X5,U5,R5,O5,L5,I5,F5,C5) -> 5.5
A6: NETO | B6: 2 | C6: 5.7190000000000003 | D6: 26 | E6: 1 | F6: 5.72 | G6: 25 | H6: 3 | I6: 5.5 | J6: 25 | K6: 5 | L6: 5.72 | M6: 27 | N6: 7 | O6: 5.5 | P6: 28 | Q6: 8 | R6: 5.71 | S6: 26 | T6: 6 | U6: 5.5 | V6: 29 | W6: 4 | X6: 5.72 | Y6: 27 | Z6: 213 | AA6: =+(X6+U6+R6+O6+L6+I6+F6+C6)/8 -> 5.6361249999999998 | AB6: =MINA(X6,U6,R6,O6,L6,I6,F6,C6) -> 5.5
A7: RUDSON | B7: 4 | C7: 6.16 | D7: 25 | E7: 2 | F7: 6.3789999999999996 | G7: 23 | H7: 1 | I7: 6.1589999999999998 | J7: 26 | K7: 3 | L7: 5.94 | M7: 26 | N7: 5 | O7: 5.94 | P7: 26 | Q7: 7 | R7: 5.94 | S7: 25 | T7: 8 | U7: 6.16 | V7: 22 | W7: 6 | X7: 5.94 | Y7: 24 | Z7: 197 | AA7: =+(X7+U7+R7+O7+L7+I7+F7+C7)/8 -> 6.0772500000000012 | AB7: =MINA(X7,U7,R7,O7,L7,I7,F7,C7) -> 5.94
A8: ANGELAO | B8: 1 | C8: 5.7190000000000003 | D8: 25 | E8: 3 | F8: 5.28 | G8: 23 | H8: 5 | I8: 5.4989999999999997 | J8: 24 | K8: 7 | L8: 5.7190000000000003 | M8: 9 | N8: 8 | O8: 5.5 | P8: 27 | Q8: 6 | R8: 5.72 | S8: 29 | T8: 4 | U8: 5.7190000000000003 | V8: 25 | W8: 2 | X8: 5.72 | Y8: 29 | Z8: 191 | AA8: =+(X8+U8+R8+O8+L8+I8+F8+C8)/8 -> 5.6095000000000006 | AB8: =MINA(X8,U8,R8,O8,L8,I8,F8,C8) -> 5.28