A1: Piloto | B1: P | C1: Tempo | D1: Vo | E1: P | F1: Tempo | G1: Vo | H1: P | I1: Tempo | J1: Vo | K1: P | L1: Tempo | M1: Vo | N1: P | O1: Tempo | P1: Vo | Q1: P | R1: Tempo | S1: Vo | T1: P | U1: Tempo | V1: Vo | W1: P | X1: Tempo | Y1: Vo | Z1: total
A2: MICHEL | B2: 6 | C2: 5.4989999999999997 | D2: 30 | E2: 4 | F2: 5.6109999999999998 | G2: 27 | H2: 2 | I2: 5.6639999999999997 | J2: 29 | K2: 1 | L2: 5.774 | M2: 28 | N2: 3 | O2: 5.5540000000000003 | P2: 31 | Q2: 5 | R2: 5.61 | S2: 29 | T2: 7 | U2: 5.3879999999999999 | V2: 30 | W2: 8 | X2: 5.5 | Y2: 29 | Z2: =+Y2+V2+S2+P2+M2+J2+G2+D2 -> 233
A3: IMPORTADO | B3: 4 | C3: 5.5970000000000004 | D3: 30 | E3: 2 | F3: 5.65 | G3: 28 | H3: 1 | I3: 5.9390000000000001 | J3: 28 | K3: 3 | L3: 5.234 | M3: 28 | N3: 5 | O3: 5.556 | P3: 28 | Q3: 7 | R3: 5.609 | S3: 31 | T3: 8 | U3: 5.5 | V3: 30 | W3: 6 | X3: 5.5549999999999997 | Y3: 29 | Z3: =+Y3+V3+S3+P3+M3+J3+G3+D3 -> 232
A4: BONGA | B4: 8 | C4: 5.6630000000000003 | D4: 30 | E4: 6 | F4: 5.665 | G4: 30 | H4: 4 | I4: 5.6639999999999997 | J4: 28 | K4: 2 | L4: 5.6760000000000002 | M4: 27 | N4: 1 | O4: 5.7750000000000004 | P4: 29 | Q4: 3 | R4: 5.6630000000000003 | S4: 29 | T4: 5 | U4: 5.5549999999999997 | V4: 29 | W4: 7 | X4: 5.5510000000000002 | Y4: 30 | Z4: =+Y4+V4+S4+P4+M4+J4+G4+D4 -> 232
A5: ANGELAO | B5: 7 | C5: 5.391 | D5: 28 | E5: 8 | F5: 5.5529999999999999 | G5: 29 | H5: 6 | I5: 5.5540000000000003 | J5: 29 | K5: 4 | L5: 5.61 | M5: 29 | N5: 2 | O5: 5.7210000000000001 | P5: 30 | Q5: 1 | R5: 5.7750000000000004 | S5: 28 | T5: 3 | U5: 5.5 | V5: 29 | W5: 5 | X5: 5.4989999999999997 | Y5: 25 | Z5: =+Y5+V5+S5+P5+M5+J5+G5+D5 -> 227
A6: KLEBER | B6: 2 | C6: 5.718 | D6: 29 | E6: 1 | F6: 5.6660000000000004 | G6: 29 | H6: 3 | I6: 5.5540000000000003 | J6: 30 | K6: 5 | L6: 5.665 | M6: 23 | N6: 7 | O6: 5.6660000000000004 | P6: 28 | Q6: 8 | R6: 5.6079999999999997 | S6: 30 | T6: 6 | U6: 5.5529999999999999 | V6: 28 | W6: 4 | X6: 5.609 | Y6: 30 | Z6: =+Y6+V6+S6+P6+M6+J6+G6+D6 -> 227
A7: RUBAO | B7: 3 | C7: 5.8860000000000001 | D7: 28 | E7: 5 | F7: 5.7279999999999998 | G7: 29 | H7: 7 | I7: 5.7770000000000001 | J7: 27 | K7: 8 | L7: 5.83 | M7: 27 | N7: 6 | O7: 5.83 | P7: 29 | Q7: 4 | R7: 5.8849999999999998 | S7: 28 | T7: 2 | U7: 5.9950000000000001 | V7: 26 | W7: 1 | X7: 6.069 | Y7: 28 | Z7: =+Y7+V7+S7+P7+M7+J7+G7+D7 -> 222
A8: JULIO | B8: 5 | C8: 5.6639999999999997 | D8: 27 | E8: 7 | F8: 5.5570000000000004 | G8: 29 | H8: 8 | I8: 5.7729999999999997 | J8: 27 | K8: 6 | L8: 5.72 | M8: 28 | N8: 4 | O8: 5.8280000000000003 | P8: 28 | Q8: 2 | R8: 5.8860000000000001 | S8: 27 | T8: 1 | U8: 5.931 | V8: 28 | W8: 3 | X8: 5.72 | Y8: 26 | Z8: =+Y8+V8+S8+P8+M8+J8+G8+D8 -> 220
A9: POWER | B9: 1 | C9: 6.0490000000000004 | D9: 27 | E9: 3 | F9: 5.9939999999999998 | G9: 26 | H9: 5 | I9: 6.2140000000000004 | J9: 20 | K9: 7 | L9: 6.0940000000000003 | M9: 26 | N9: 8 | O9: 6.16 | P9: 27 | Q9: 6 | R9: 6.1059999999999999 | S9: 25 | T9: 4 | U9: 5.9930000000000003 | V9: 26 | W9: 2 | X9: 5.94 | Y9: 28 | Z9: =+Y9+V9+S9+P9+M9+J9+G9+D9 -> 205