A1: Nome | B1: P | C1: Tempo | D1: Vol | E1: P | F1: Tempo | G1: Vol | H1: P | I1: Tempo | J1: Vol | K1: P | L1: Tempo | M1: Vol | N1: P | O1: Tempo | P1: Vol | Q1: P | R1: Tempo | S1: Vol | T1: P | U1: Tempo | V1: Vol | W1: P | X1: Tempo | Y1: Vol | Z1: Total | AA1: Media | AB1: Record
A2: MICHEL | B2: 6 | C2: 5.2789999999999999 | D2: 32 | E2: 4 | F2: 5.39 | G2: 29 | H2: 2 | I2: 5.4960000000000004 | J2: 30 | K2: 1 | L2: 5.72 | M2: 26 | N2: 3 | O2: 5.4450000000000003 | P2: 31 | Q2: 5 | R2: 5.2779999999999996 | S2: 30 | T2: 7 | U2: 5.335 | V2: 31 | W2: 8 | X2: 5.282 | Y2: 30 | Z2: 239 | AA2: =+(X2+U2+R2+O2+L2+I2+F2+C2)/8 -> 5.4031250000000002 | AB2: =MINA(X2,U2,R2,O2,L2,I2,F2,C2) -> 5.2779999999999996
A3: POWER | B3: 5 | C3: 5.5 | D3: 29 | E3: 7 | F3: 5.5 | G3: 29 | H3: 8 | I3: 5.5 | J3: 29 | K3: 6 | L3: 5.5 | M3: 27 | N3: 4 | O3: 5.5 | P3: 30 | Q3: 2 | R3: 5.4989999999999997 | S3: 30 | T3: 1 | U3: 5.7190000000000003 | V3: 28 | W3: 3 | X3: 5.4989999999999997 | Y3: 30 | Z3: 232 | AA3: =+(X3+U3+R3+O3+L3+I3+F3+C3)/8 -> 5.5271249999999998 | AB3: =MINA(X3,U3,R3,O3,L3,I3,F3,C3) -> 5.4989999999999997
A4: BONGA | B4: 3 | C4: 5.5 | D4: 29 | E4: 5 | F4: 5.4989999999999997 | G4: 30 | H4: 7 | I4: 5.4989999999999997 | J4: 30 | K4: 8 | L4: 5.5 | M4: 30 | N4: 6 | O4: 5.4989999999999997 | P4: 30 | Q4: 4 | R4: 5.5 | S4: 27 | T4: 2 | U4: 5.5 | V4: 28 | W4: 1 | X4: 5.94 | Y4: 26 | Z4: 230 | AA4: =+(X4+U4+R4+O4+L4+I4+F4+C4)/8 -> 5.5546250000000006 | AB4: =MINA(X4,U4,R4,O4,L4,I4,F4,C4) -> 5.4989999999999997
A5: NETO | B5: 2 | C5: 5.4950000000000001 | D5: 30 | E5: 1 | F5: 5.72 | G5: 26 | H5: 3 | I5: 5.5 | J5: 29 | K5: 5 | L5: 5.5 | M5: 28 | N5: 7 | O5: 5.4989999999999997 | P5: 26 | Q5: 8 | R5: 5.72 | S5: 25 | T5: 6 | U5: 5.7190000000000003 | V5: 28 | W5: 4 | X5: 5.718 | Y5: 29 | Z5: 221 | AA5: =+(X5+U5+R5+O5+L5+I5+F5+C5)/8 -> 5.6088749999999994 | AB5: =MINA(X5,U5,R5,O5,L5,I5,F5,C5) -> 5.4950000000000001
A6: KLEBER | B6: 4 | C6: 5.4989999999999997 | D6: 30 | E6: 2 | F6: 5.72 | G6: 27 | H6: 1 | I6: 5.9379999999999997 | J6: 27 | K6: 3 | L6: 5.72 | M6: 28 | N6: 5 | O6: 5.4989999999999997 | P6: 28 | Q6: 7 | R6: 5.718 | S6: 25 | T6: 8 | U6: 5.72 | V6: 23 | W6: 6 | X6: 4.4 | Y6: 25 | Z6: 213 | AA6: =+(X6+U6+R6+O6+L6+I6+F6+C6)/8 -> 5.5267499999999998 | AB6: =MINA(X6,U6,R6,O6,L6,I6,F6,C6) -> 4.4
A7: ERUNDA | B7: 7 | C7: 5.72 | D7: 28 | E7: 8 | F7: 5.72 | G7: 26 | H7: 6 | I7: 5.9390000000000001 | J7: 24 | K7: 4 | L7: 5.61 | M7: 24 | N7: 2 | O7: 5.72 | P7: 25 | Q7: 1 | R7: 6.16 | S7: 23 | T7: 3 | U7: 5.72 | V7: 21 | W7: 5 | X7: 5.94 | Y7: 17 | Z7: 188 | AA7: =+(X7+U7+R7+O7+L7+I7+F7+C7)/8 -> 5.8161249999999995 | AB7: =MINA(X7,U7,R7,O7,L7,I7,F7,C7) -> 5.61