A1: Pilotos | B1: P | C1: Tempo | D1: Vol | E1: P | F1: Tempo | G1: Vol | H1: P | I1: Tempo | J1: Vol | K1: P | L1: Tempo | M1: Vol | N1: P | O1: Tempo | P1: Vol | Q1: P | R1: Tempo | S1: Vol | T1: P | U1: Tempo | V1: Vol | W1: P | X1: Tempo | Y1: Vol | Z1: Total | AA1: Media | AB1: Record
A2: MICHEL | B2: 6 | C2: 5.391 | D2: 31 | E2: 4 | F2: 5.4450000000000003 | G2: 31 | H2: 2 | I2: 5.49 | J2: 29 | K2: 1 | L2: 5.5549999999999997 | M2: 27 | N2: 3 | O2: 5.39 | P2: 30 | Q2: 5 | R2: 5.4349999999999996 | S2: 30 | T2: 7 | U2: 5.39 | V2: 30 | W2: 8 | X2: 5.39 | Y2: 29 | Z2: 237 | AA2: =+(X2+U2+R2+O2+L2+I2+F2+C2)/8 -> 5.4357499999999996 | AB2: =MINA(X2,U2,R2,O2,L2,I2,F2,C2) -> 5.39
A3: KLEBER | B3: 7 | C3: 5.3890000000000002 | D3: 29 | E3: 8 | F3: 5.4980000000000002 | G3: 29 | H3: 6 | I3: 5.5549999999999997 | J3: 30 | K3: 4 | L3: 5.444 | M3: 26 | N3: 2 | O3: 5.5549999999999997 | P3: 28 | Q3: 1 | R3: 5.609 | S3: 30 | T3: 3 | U3: 5.5549999999999997 | V3: 29 | W3: 5 | X3: 5.4450000000000003 | Y3: 31 | Z3: 232 | AA3: =+(X3+U3+R3+O3+L3+I3+F3+C3)/8 -> 5.5062499999999996 | AB3: =MINA(X3,U3,R3,O3,L3,I3,F3,C3) -> 5.3890000000000002
A4: BONGA | B4: 8 | C4: 5.39 | D4: 31 | E4: 6 | F4: 5.6630000000000003 | G4: 29 | H4: 4 | I4: 5.6079999999999997 | J4: 29 | K4: 2 | L4: 5.4969999999999999 | M4: 29 | N4: 1 | O4: 5.7190000000000003 | P4: 28 | Q4: 3 | R4: 5.6109999999999998 | S4: 29 | T4: 5 | U4: 5.5990000000000002 | V4: 27 | W4: 7 | X4: 5.6050000000000004 | Y4: 27 | Z4: 229 | AA4: =+(X4+U4+R4+O4+L4+I4+F4+C4)/8 -> 5.5865000000000009 | AB4: =MINA(X4,U4,R4,O4,L4,I4,F4,C4) -> 5.39
A5: IMPORTADO | B5: 1 | C5: 5.6639999999999997 | D5: 27 | E5: 3 | F5: 5.4429999999999996 | G5: 31 | H5: 5 | I5: 5.4980000000000002 | J5: 26 | K5: 7 | L5: 5.3879999999999999 | M5: 29 | N5: 8 | O5: 5.3890000000000002 | P5: 29 | Q5: 6 | R5: 5.4480000000000004 | S5: 27 | T5: 4 | U5: 5.5 | V5: 28 | W5: 2 | X5: 5.4980000000000002 | Y5: 30 | Z5: 227 | AA5: =+(X5+U5+R5+O5+L5+I5+F5+C5)/8 -> 5.4784999999999995 | AB5: =MINA(X5,U5,R5,O5,L5,I5,F5,C5) -> 5.3879999999999999
A6: NETO | B6: 3 | C6: 5.117 | D6: 23 | E6: 5 | F6: 5.5 | G6: 28 | H6: 7 | I6: 5.61 | J6: 28 | K6: 8 | L6: 5.6660000000000004 | M6: 26 | N6: 6 | O6: 5.665 | P6: 27 | Q6: 4 | R6: 5.883 | S6: 27 | T6: 2 | U6: 5.774 | V6: 27 | W6: 1 | X6: 5.9960000000000004 | Y6: 27 | Z6: 213 | AA6: =+(X6+U6+R6+O6+L6+I6+F6+C6)/8 -> 5.6513749999999998 | AB6: =MINA(X6,U6,R6,O6,L6,I6,F6,C6) -> 5.117
A7: POWER | B7: 5 | C7: 5.7729999999999997 | D7: 24 | E7: 7 | F7: 5.766 | G7: 29 | H7: 8 | I7: 5.7210000000000001 | J7: 25 | K7: 6 | L7: 5.83 | M7: 23 | N7: 4 | O7: 5.774 | P7: 27 | Q7: 2 | R7: 5.7750000000000004 | S7: 29 | T7: 1 | U7: 5.8319999999999999 | V7: 25 | W7: 3 | X7: 5.6630000000000003 | Y7: 29 | Z7: 211 | AA7: =+(X7+U7+R7+O7+L7+I7+F7+C7)/8 -> 5.76675 | AB7: =MINA(X7,U7,R7,O7,L7,I7,F7,C7) -> 5.6630000000000003
A8: RUBAO | B8: 2 | C8: 5.883 | D8: 22 | E8: 1 | F8: 5.8849999999999998 | G8: 27 | H8: 3 | I8: 5.8840000000000003 | J8: 27 | K8: 5 | L8: 5.9950000000000001 | M8: 27 | N8: 7 | O8: 5.8849999999999998 | P8: 27 | Q8: 8 | R8: 6.0069999999999997 | S8: 27 | T8: 6 | U8: 6.1580000000000004 | V8: 25 | W8: 4 | X8: 6.0389999999999997 | Y8: 26 | Z8: 208 | AA8: =+(X8+U8+R8+O8+L8+I8+F8+C8)/8 -> 5.9670000000000005 | AB8: =MINA(X8,U8,R8,O8,L8,I8,F8,C8) -> 5.883
A9: JULIO | B9: 4 | C9: 5.72 | D9: 27 | E9: 2 | F9: 5.7290000000000001 | G9: 27 | H9: 1 | I9: 5.8289999999999997 | J9: 25 | K9: 3 | L9: 5.4989999999999997 | M9: 27 | N9: 5 | O9: 5.6980000000000004 | P9: 25 | Q9: 7 | R9: 5.6109999999999998 | S9: 22 | T9: 8 | U9: 5.83 | V9: 24 | W9: 6 | X9: 5.835 | Y9: 22 | Z9: 199 | AA9: =+(X9+U9+R9+O9+L9+I9+F9+C9)/8 -> 5.7188749999999997 | AB9: =MINA(X9,U9,R9,O9,L9,I9,F9,C9) -> 5.4989999999999997