A1: PILOTOS | B1: P | C1: TEMPO | D1: V | E1: P | F1: TEMPO | G1: V | H1: P | I1: TEMPO | J1: V | K1: P | L1: TEMPO | M1: V | N1: P | O1: TEMPO | P1: V | Q1: P | R1: TEMPO | S1: V | T1: P | U1: TEMPO | V1: V | W1: P | X1: TEMPO | Y1: V | Z1: TOTAL | AA1: MEDIA
A2: KLEBER | B2: 2 | C2: 5.8849999999999998 | D2: 28 | E2: 1 | F2: 6.2130000000000001 | G2: 20 | H2: 3 | I2: 5.7750000000000004 | J2: 28 | K2: 5 | L2: 5.72 | M2: 29 | N2: 7 | O2: 5.7759999999999998 | P2: 29 | Q2: 8 | R2: 5.6230000000000002 | S2: 28 | T2: 6 | U2: 5.6660000000000004 | V2: 27 | W2: 4 | X2: 5.9379999999999997 | Y2: 27 | Z2: 216.72340425531914 | AA2: =+(X2+U2+R2+O2+L2+I2+F2+C2)/8 -> 5.8244999999999996
A3: IMPORTADO | B3: 8 | C3: 5.6630000000000003 | D3: 27 | E3: 6 | F3: 5.7190000000000003 | G3: 29 | H3: 4 | I3: 5.7690000000000001 | J3: 28 | K3: 2 | L3: 5.6660000000000004 | M3: 27 | N3: 1 | O3: 6.16 | P3: 20 | Q3: 3 | R3: 5.83 | S3: 29 | T3: 5 | U3: 5.83 | V3: 29 | W3: 7 | X3: 5.7729999999999997 | Y3: 27 | Z3: 216.74468085106383 | AA3: =+(X3+U3+R3+O3+L3+I3+F3+C3)/8 -> 5.8012499999999996
A4: GIOVANNI | B4: 5 | C4: 5.72 | D4: 22 | E4: 7 | F4: 5.7750000000000004 | G4: 29 | H4: 8 | I4: 5.7750000000000004 | J4: 27 | K4: 6 | L4: 5.7919999999999998 | M4: 29 | N4: 4 | O4: 5.8840000000000003 | P4: 28 | Q4: 2 | R4: 5.8840000000000003 | S4: 28 | T4: 1 | U4: 6.1520000000000001 | V4: 27 | W4: 3 | X4: 5.8179999999999996 | Y4: 25 | Z4: 215.17021276595744 | AA4: =+(X4+U4+R4+O4+L4+I4+F4+C4)/8 -> 5.85
A5: cONRADO | B5: 6 | C5: 5.944 | D5: 27 | E5: 4 | F5: 5.9409999999999998 | G5: 25 | H5: 2 | I5: 6.1040000000000001 | J5: 27 | K5: 1 | L5: 6.1719999999999997 | M5: 25 | N5: 3 | O5: 6.4329999999999998 | P5: 24 | Q5: 5 | R5: 5.8289999999999997 | S5: 28 | T5: 7 | U5: 5.8840000000000003 | V5: 28 | W5: 8 | X5: 5.944 | Y5: 27 | Z5: 211 | AA5: =+(X5+U5+R5+O5+L5+I5+F5+C5)/8 -> 6.0313750000000006
A6: POWER | B6: 3 | C6: 5.9950000000000001 | D6: 27 | E6: 5 | F6: 6.1059999999999999 | G6: 28 | H6: 7 | I6: 6.1050000000000004 | J6: 27 | K6: 8 | L6: 6.1029999999999998 | M6: 28 | N6: 6 | O6: 6.05 | P6: 27 | Q6: 4 | R6: 5.7750000000000004 | S6: 28 | T6: 2 | U6: 6.05 | V6: 26 | W6: 1 | X6: 6.1609999999999996 | Y6: 18 | Z6: 209.78723404255319 | AA6: =+(X6+U6+R6+O6+L6+I6+F6+C6)/8 -> 6.0431249999999999
A7: RUBENS | B7: 4 | C7: 5.6340000000000003 | D7: 29 | E7: 2 | F7: 5.8840000000000003 | G7: 16 | H7: 1 | I7: 5.9950000000000001 | J7: 25 | K7: 3 | L7: 5.7629999999999999 | M7: 28 | N7: 5 | O7: 5.8310000000000004 | P7: 27 | Q7: 7 | R7: 5.8840000000000003 | S7: 29 | T7: 8 | U7: 5.7190000000000003 | V7: 28 | W7: 6 | X7: 5.83 | Y7: 27 | Z7: 209.61702127659575 | AA7: =+(X7+U7+R7+O7+L7+I7+F7+C7)/8 -> 5.8174999999999999
A8: NETO | B8: 7 | C8: 5.7869999999999999 | D8: 26 | E8: 8 | F8: 5.7220000000000004 | G8: 26 | H8: 6 | I8: 5.8289999999999997 | J8: 27 | K8: 4 | L8: 5.7190000000000003 | M8: 26 | N8: 2 | O8: 5.8289999999999997 | P8: 26 | Q8: 1 | R8: 5.8869999999999996 | S8: 21 | T8: 3 | U8: 5.8310000000000004 | V8: 26 | W8: 5 | X8: 5.8849999999999998 | Y8: 23 | Z8: 201.87234042553192 | AA8: =+(X8+U8+R8+O8+L8+I8+F8+C8)/8 -> 5.8111250000000005
A9: ERUNDA | B9: 1 | C9: 6.7089999999999996 | D9: 18 | E9: 3 | F9: 5.9939999999999998 | G9: 28 | H9: 5 | I9: 5.875 | J9: 24 | K9: 7 | L9: 5.8869999999999996 | M9: 28 | N9: 8 | O9: 5.8849999999999998 | P9: 27 | Q9: 6 | R9: 6.1040000000000001 | S9: 21 | T9: 4 | U9: 6.1059999999999999 | V9: 27 | W9: 2 | X9: 6.2149999999999999 | Y9: 24 | Z9: 197.19148936170214 | AA9: =+(X9+U9+R9+O9+L9+I9+F9+C9)/8 -> 6.0968749999999998