A1: Nome | B1: P | C1: Tempo | D1: Vol | E1: P | F1: Tempo | G1: Vol | H1: P | I1: Tempo | J1: Vol | K1: P | L1: Tempo | M1: Vol | N1: P | O1: Tempo | P1: Vol | Q1: P | R1: Tempo | S1: Vol | T1: P | U1: Tempo | V1: Vol | W1: P | X1: Tempo | Y1: Vol | Z1: Total | AA1: Media | AB1: Record
A2: MICHEL | B2: 7 | C2: 5.4950000000000001 | D2: 29 | E2: 8 | F2: 5.2789999999999999 | G2: 31 | H2: 6 | I2: 5.49 | J2: 29 | K2: 4 | L2: 5.71 | M2: 23 | N2: 2 | O2: 5.5540000000000003 | P2: 27 | Q2: 1 | R2: 5.5 | S2: 29 | T2: 3 | U2: 5.5 | V2: 31 | W2: 5 | X2: 5.5 | Y2: 30 | Z2: 229.78 | AA2: =+(X2+U2+R2+O2+L2+I2+F2+C2)/8 -> 5.5034999999999998 | AB2: =MINA(X2,U2,R2,O2,L2,I2,F2,C2) -> 5.2789999999999999
A3: BONGA | B3: 5 | C3: 5.7130000000000001 | D3: 28 | E3: 7 | F3: 5.72 | G3: 28 | H3: 8 | I3: 5.7190000000000003 | J3: 29 | K3: 6 | L3: 5.72 | M3: 28 | N3: 4 | O3: 5.72 | P3: 28 | Q3: 2 | R3: 5.61 | S3: 28 | T3: 1 | U3: 5.94 | V3: 28 | W3: 3 | X3: 5.7190000000000003 | Y3: 26 | Z3: 223.19 | AA3: =+(X3+U3+R3+O3+L3+I3+F3+C3)/8 -> 5.7326249999999996 | AB3: =MINA(X3,U3,R3,O3,L3,I3,F3,C3) -> 5.61
A4: POWER | B4: 3 | C4: 5.5 | D4: 29 | E4: 5 | F4: 5.7190000000000003 | G4: 30 | H4: 7 | I4: 5.7130000000000001 | J4: 28 | K4: 8 | L4: 5.7190000000000003 | M4: 27 | N4: 6 | O4: 5.7190000000000003 | P4: 30 | Q4: 4 | R4: 5.72 | S4: 29 | T4: 2 | U4: 5.72 | V4: 28 | W4: 1 | X4: 5.9390000000000001 | Y4: 17 | Z4: 218.8 | AA4: =+(X4+U4+R4+O4+L4+I4+F4+C4)/8 -> 5.7186250000000003 | AB4: =MINA(X4,U4,R4,O4,L4,I4,F4,C4) -> 5.5
A5: DINHO | B5: 2 | C5: 5.72 | D5: 26 | E5: 1 | F5: 5.94 | G5: 23 | H5: 3 | I5: 5.72 | J5: 26 | K5: 5 | L5: 5.7190000000000003 | M5: 25 | N5: 7 | O5: 5.72 | P5: 29 | Q5: 8 | R5: 5.61 | S5: 28 | T5: 6 | U5: 5.5549999999999997 | V5: 29 | W5: 4 | X5: 5.5 | Y5: 28 | Z5: 214.78 | AA5: =+(X5+U5+R5+O5+L5+I5+F5+C5)/8 -> 5.6854999999999993 | AB5: =MINA(X5,U5,R5,O5,L5,I5,F5,C5) -> 5.5
A6: KLEBER | B6: 8 | C6: 5.4989999999999997 | D6: 24 | E6: 6 | F6: 5.5 | G6: 30 | H6: 4 | I6: 5.72 | J6: 26 | K6: 2 | L6: 5.7190000000000003 | M6: 25 | N6: 1 | O6: 5.9340000000000002 | P6: 26 | Q6: 3 | R6: 5.72 | S6: 27 | T6: 5 | U6: 5.5 | V6: 29 | W6: 7 | X6: 5.7130000000000001 | Y6: 26 | Z6: 213.36 | AA6: =+(X6+U6+R6+O6+L6+I6+F6+C6)/8 -> 5.663125 | AB6: =MINA(X6,U6,R6,O6,L6,I6,F6,C6) -> 5.4989999999999997
A7: GIOVANI | B7: 1 | C7: 5.94 | D7: 26 | E7: 3 | F7: 5.72 | G7: 25 | H7: 5 | I7: 5.5 | J7: 28 | K7: 7 | L7: 5.5 | M7: 26 | N7: 8 | O7: 5.72 | P7: 29 | Q7: 6 | R7: 5.72 | S7: 28 | T7: 4 | U7: 5.72 | V7: 25 | W7: 2 | X7: 5.7750000000000004 | Y7: 25 | Z7: 212.85 | AA7: =+(X7+U7+R7+O7+L7+I7+F7+C7)/8 -> 5.6993749999999999 | AB7: =MINA(X7,U7,R7,O7,L7,I7,F7,C7) -> 5.5
A8: NETO | B8: 6 | C8: 5.5 | D8: 26 | E8: 4 | F8: 6.3789999999999996 | G8: 14 | H8: 2 | I8: 6.38 | J8: 15 | K8: 1 | L8: 6.1589999999999998 | M8: 22 | N8: 3 | O8: 5.72 | P8: 28 | Q8: 5 | R8: 5.774 | S8: 28 | T8: 7 | U8: 5.72 | V8: 29 | W8: 8 | X8: 5.72 | Y8: 25 | Z8: 187.83 | AA8: =+(X8+U8+R8+O8+L8+I8+F8+C8)/8 -> 5.9189999999999996 | AB8: =MINA(X8,U8,R8,O8,L8,I8,F8,C8) -> 5.5
A9: RICARDO | B9: 4 | C9: 5.94 | D9: 20 | E9: 2 | F9: 5.72 | G9: 25 | H9: 1 | I9: 6.16 | J9: 22 | K9: 3 | L9: 6.16 | M9: 17 | N9: 5 | O9: 5.7750000000000004 | P9: 27 | Q9: 7 | R9: 5.9390000000000001 | S9: 23 | T9: 8 | U9: 5.9390000000000001 | V9: 24 | W9: 6 | X9: 6.1529999999999996 | Y9: 23 | Z9: 181.83 | AA9: =+(X9+U9+R9+O9+L9+I9+F9+C9)/8 -> 5.9732499999999993 | AB9: =MINA(X9,U9,R9,O9,L9,I9,F9,C9) -> 5.72