A1: Pilotos | B1: P | C1: Tem | D1: Vo | E1: P | F1: Tem | G1: Vo | H1: P | I1: Tem | J1: Vo | K1: P | L1: Tem | M1: Vo | N1: P | O1: Tem | P1: Vo | Q1: P | R1: Tem | S1: Vo | T1: P | U1: Tem | V1: Vo | W1: P | X1: Tem | Y1: Vo | Z1: Total | AA1: Media | AB1: Record
A2: BONGA | B2: 1 | C2: 5.8289999999999997 | D2: 27 | E2: 3 | F2: 5.609 | G2: 29 | H2: 5 | I2: 5.6079999999999997 | J2: 27 | K2: 7 | L2: 5.3280000000000003 | M2: 30 | N2: 8 | O2: 5.5549999999999997 | P2: 30 | Q2: 6 | R2: 5.6669999999999998 | S2: 27 | T2: 4 | U2: 5.7190000000000003 | V2: 28 | W2: 2 | X2: 5.72 | Y2: 27 | Z2: =+Y2+V2+S2+P2+M2+J2+G2+D2 -> 225 | AA2: =+(X2+U2+R2+O2+L2+I2+F2+C2)/8 -> 5.6293749999999996 | AB2: =MINA(X2,U2,R2,O2,L2,I2,F2,C2) -> 5.3280000000000003
A3: POWER | B3: 3 | C3: 5.7759999999999998 | D3: 26 | E3: 5 | F3: 5.6180000000000003 | G3: 30 | H3: 7 | I3: 5.8280000000000003 | J3: 26 | K3: 8 | L3: 5.6639999999999997 | M3: 30 | N3: 6 | O3: 5.774 | P3: 28 | Q3: 4 | R3: 5.774 | S3: 23 | T3: 2 | U3: 5.83 | V3: 28 | W3: 1 | X3: 5.89 | Y3: 25 | Z3: =+Y3+V3+S3+P3+M3+J3+G3+D3 -> 216 | AA3: =+(X3+U3+R3+O3+L3+I3+F3+C3)/8 -> 5.7692500000000013 | AB3: =MINA(X3,U3,R3,O3,L3,I3,F3,C3) -> 5.6180000000000003
A4: RUBAO | B4: 7 | C4: 5.7750000000000004 | D4: 26 | E4: 8 | F4: 5.8280000000000003 | G4: 29 | H4: 6 | I4: 5.8710000000000004 | J4: 24 | K4: 4 | L4: 5.8330000000000002 | M4: 25 | N4: 2 | O4: 5.88 | P4: 24 | Q4: 1 | R4: 6.1040000000000001 | S4: 26 | T4: 3 | U4: 5.9930000000000003 | V4: 25 | W4: 5 | X4: 5.83 | Y4: 26 | Z4: =+Y4+V4+S4+P4+M4+J4+G4+D4 -> 205 | AA4: =+(X4+U4+R4+O4+L4+I4+F4+C4)/8 -> 5.8892500000000005 | AB4: =MINA(X4,U4,R4,O4,L4,I4,F4,C4) -> 5.7750000000000004
A5: NETO | B5: 4 | C5: 5.774 | D5: 25 | E5: 2 | F5: 5.61 | G5: 27 | H5: 1 | I5: 5.883 | J5: 26 | K5: 3 | L5: 5.7190000000000003 | M5: 24 | N5: 5 | O5: 5.5519999999999996 | P5: 25 | Q5: 7 | R5: 5.5540000000000003 | S5: 25 | T5: 8 | U5: 5.556 | V5: 24 | W5: 6 | X5: 5.5019999999999998 | Y5: 23 | Z5: =+Y5+V5+S5+P5+M5+J5+G5+D5 -> 199 | AA5: =+(X5+U5+R5+O5+L5+I5+F5+C5)/8 -> 5.6437499999999998 | AB5: =MINA(X5,U5,R5,O5,L5,I5,F5,C5) -> 5.5019999999999998
A6: JULIO | B6: 5 | C6: 5.94 | D6: 26 | E6: 7 | F6: 5.774 | G6: 29 | H6: 8 | I6: 5.8869999999999996 | J6: 28 | K6: 6 | L6: 5.94 | M6: 7 | N6: 4 | O6: 6.0030000000000001 | P6: 26 | Q6: 2 | R6: 6.1550000000000002 | S6: 24 | T6: 1 | U6: 6.05 | V6: 27 | W6: 3 | X6: 5.8040000000000003 | Y6: 29 | Z6: =+Y6+V6+S6+P6+M6+J6+G6+D6 -> 196 | AA6: =+(X6+U6+R6+O6+L6+I6+F6+C6)/8 -> 5.9441249999999997 | AB6: =MINA(X6,U6,R6,O6,L6,I6,F6,C6) -> 5.774
A7: KLEBER | B7: 8 | C7: 5.61 | D7: 26 | E7: 6 | F7: 5.6230000000000002 | G7: 28 | H7: 4 | I7: 5.8280000000000003 | J7: 21 | K7: 2 | L7: 5.7750000000000004 | M7: 27 | N7: 1 | O7: 6.04 | P7: 19 | Q7: 3 | R7: 5.7729999999999997 | S7: 27 | T7: 5 | U7: 5.8280000000000003 | V7: 25 | W7: 7 | X7: 5.7190000000000003 | Y7: 23 | Z7: =+Y7+V7+S7+P7+M7+J7+G7+D7 -> 196 | AA7: =+(X7+U7+R7+O7+L7+I7+F7+C7)/8 -> 5.7744999999999997 | AB7: =MINA(X7,U7,R7,O7,L7,I7,F7,C7) -> 5.61
A8: RICARDO | B8: 2 | C8: 5.61 | D8: 27 | E8: 1 | F8: 5.8849999999999998 | G8: 22 | H8: 3 | I8: 5.7190000000000003 | J8: 23 | K8: 5 | L8: 5.9930000000000003 | M8: 22 | N8: 7 | O8: 5.8280000000000003 | P8: 21 | Q8: 8 | R8: 5.83 | S8: 25 | T8: 6 | U8: 5.8289999999999997 | V8: 25 | W8: 4 | X8: 5.7729999999999997 | Y8: 25 | Z8: =+Y8+V8+S8+P8+M8+J8+G8+D8 -> 190 | AA8: =+(X8+U8+R8+O8+L8+I8+F8+C8)/8 -> 5.8083749999999998 | AB8: =MINA(X8,U8,R8,O8,L8,I8,F8,C8) -> 5.61
A9: RUDSON | B9: 6 | C9: 6.4370000000000003 | D9: 15 | E9: 4 | F9: 6.1820000000000004 | G9: 19 | H9: 2 | I9: 6.2130000000000001 | J9: 21 | K9: 1 | L9: 6.7089999999999996 | M9: 21 | N9: 3 | O9: 6.7649999999999997 | P9: 19 | Q9: 5 | R9: 5.9390000000000001 | S9: 24 | T9: 7 | U9: 6.1050000000000004 | V9: 23 | W9: 8 | X9: 6.1609999999999996 | Y9: 25 | Z9: =+Y9+V9+S9+P9+M9+J9+G9+D9 -> 167 | AA9: =+(X9+U9+R9+O9+L9+I9+F9+C9)/8 -> 6.3138749999999995 | AB9: =MINA(X9,U9,R9,O9,L9,I9,F9,C9) -> 5.9390000000000001