A1: Nome | B1: P | C1: Tempo | D1: Vol | E1: P | F1: Tempo | G1: Vol | H1: P | I1: Tempo | J1: Vol | K1: P | L1: Tempo | M1: Vol | N1: P | O1: Tempo | P1: Vol | Q1: P | R1: Tempo | S1: Vol | T1: P | U1: Tempo | V1: Vol | W1: P | X1: Tempo | Y1: Vol | Z1: Total | AA1: Media
A2: IMPORTADO | B2: 5 | C2: 5.335 | D2: 20 | E2: 7 | F2: 5.4450000000000003 | G2: 19 | H2: 8 | I2: 4.2229999999999999 | J2: 20 | K2: 6 | L2: 5.5 | M2: 18 | N2: 4 | O2: 5.4989999999999997 | P2: 20 | Q2: 2 | R2: 5.5 | S2: 20 | T2: 1 | U2: 5.72 | V2: 19 | W2: 3 | X2: 5.39 | Y2: 19 | Z2: 156 | AA2: =+(X2+U2+R2+O2+L2+I2+F2+C2)/8 -> 5.3265000000000002
A3: KLEBER | B3: 3 | C3: 5.718 | D3: 18 | E3: 5 | F3: 5.72 | G3: 19 | H3: 7 | I3: 5.5 | J3: 20 | K3: 8 | L3: 5.5549999999999997 | M3: 19 | N3: 6 | O3: 4.9359999999999999 | P3: 20 | Q3: 4 | R3: 5.7169999999999996 | S3: 20 | T3: 2 | U3: 5.5030000000000001 | V3: 17 | W3: 1 | X3: 5.72 | Y3: 18 | Z3: 151.78723404255319 | AA3: =+(X3+U3+R3+O3+L3+I3+F3+C3)/8 -> 5.546125
A4: MICHEL | B4: 6 | C4: 5.4450000000000003 | D4: 20 | E4: 4 | F4: 5.5049999999999999 | G4: 19 | H4: 2 | I4: 5.5 | J4: 17 | K4: 1 | L4: 5.431 | M4: 15 | N4: 3 | O4: 4.9359999999999999 | P4: 21 | Q4: 5 | R4: 5.5 | S4: 20 | T4: 7 | U4: 5.5 | V4: 19 | W4: 8 | X4: 5.2759999999999998 | Y4: 19 | Z4: 150.85106382978722 | AA4: =+(X4+U4+R4+O4+L4+I4+F4+C4)/8 -> 5.3866250000000004
A5: DINHO | B5: 4 | C5: 5.7160000000000002 | D5: 19 | E5: 2 | F5: 5.7750000000000004 | G5: 16 | H5: 1 | I5: 4.0019999999999998 | J5: 18 | K5: 3 | L5: 5.431 | M5: 19 | N5: 5 | O5: 4.9359999999999999 | P5: 20 | Q5: 7 | R5: 5.7190000000000003 | S5: 19 | T5: 8 | U5: 5.4989999999999997 | V5: 19 | W5: 6 | X5: 5.61 | Y5: 19 | Z5: 149.17021276595744 | AA5: =+(X5+U5+R5+O5+L5+I5+F5+C5)/8 -> 5.3360000000000003
A6: POWER | B6: 1 | C6: 5.94 | D6: 16 | E6: 3 | F6: 5.72 | G6: 18 | H6: 5 | I6: 5.0359999999999996 | J6: 19 | K6: 7 | L6: 4.9909999999999997 | M6: 20 | N6: 8 | O6: 5.7190000000000003 | P6: 19 | Q6: 6 | R6: 5.61 | S6: 19 | T6: 4 | U6: 5.5 | V6: 20 | W6: 2 | X6: 5.72 | Y6: 15 | Z6: 146.80851063829786 | AA6: =+(X6+U6+R6+O6+L6+I6+F6+C6)/8 -> 5.5294999999999996
A7: BONGA | B7: 8 | C7: 5.83 | D7: 18 | E7: 6 | F7: 5.72 | G7: 19 | H7: 4 | I7: 5.5540000000000003 | J7: 19 | K7: 2 | L7: 5.2110000000000003 | M7: 17 | N7: 1 | O7: 5.72 | P7: 10 | Q7: 3 | R7: 5.5549999999999997 | S7: 20 | T7: 5 | U7: 5.5 | V7: 19 | W7: 7 | X7: 5.5 | Y7: 19 | Z7: 141.27659574468086 | AA7: =+(X7+U7+R7+O7+L7+I7+F7+C7)/8 -> 5.5737500000000004
A8: RICARDO | B8: 2 | C8: 5.8849999999999998 | D8: 16 | E8: 1 | F8: 6.1589999999999998 | G8: 16 | H8: 3 | I8: 4.4829999999999997 | J8: 18 | K8: 5 | L8: 6.149 | M8: 16 | N8: 7 | O8: 5.9390000000000001 | P8: 18 | Q8: 8 | R8: 5.94 | S8: 18 | T8: 6 | U8: 5.94 | V8: 17 | W8: 4 | X8: 6.16 | Y8: 15 | Z8: 135.80851063829786 | AA8: =+(X8+U8+R8+O8+L8+I8+F8+C8)/8 -> 5.8318750000000001
A9: NETO | B9: 7 | C9: 5.5990000000000002 | D9: 14 | E9: 8 | F9: 5.9390000000000001 | G9: 14 | H9: 6 | I9: 4.2229999999999999 | J9: 19 | K9: 4 | L9: 6.16 | M9: 15 | N9: 2 | O9: 5.7089999999999996 | P9: 17 | Q9: 1 | R9: 6.27 | S9: 16 | T9: 3 | U9: 5.9950000000000001 | V9: 16 | W9: 5 | X9: 5.9939999999999998 | Y9: 18 | Z9: 130.53191489361703 | AA9: =+(X9+U9+R9+O9+L9+I9+F9+C9)/8 -> 5.7361249999999995