A1: Nome | B1: P | C1: Tem | D1: Vol | E1: P | F1: Tem | G1: Vol | H1: P | I1: Tem | J1: Vol | K1: P | L1: Tem | M1: Vol | N1: P | O1: Tem | P1: Vol | Q1: P | R1: Tem | S1: Vol | T1: P | U1: Tem | V1: Vol | W1: P | X1: Tem | Y1: Vol | Z1: Total | AA1: Media
A2: Imp / Cav | B2: 4 | C2: 4.992 | D2: 205 | E2: 2 | F2: 5.0549999999999997 | G2: 202 | H2: 1 | I2: 5.2140000000000004 | J2: 205 | K2: 3 | L2: 5.0449999999999999 | M2: 211 | N2: 5 | O2: 4.7380000000000004 | P2: 206 | Q2: 7 | R2: 4.883 | S2: 216 | T2: 8 | U2: 4.9930000000000003 | V2: 203 | W2: 6 | X2: 4.8579999999999997 | Y2: 210 | Z2: =+Y2+V2+S2+P2+M2+J2+G2+D2 -> 1658 | AA2: 4.9722499999999989
A3: Jun / Xuba | B3: 7 | C3: 4.9829999999999997 | D3: 208 | E3: 8 | F3: 3.198 | G3: 203 | H3: 6 | I3: 4.7 | J3: 196 | K3: 4 | L3: 4.98 | M3: 203 | N3: 2 | O3: 5.19 | P3: 202 | Q3: 1 | R3: 5.0739999999999998 | S3: 193 | T3: 3 | U3: 5.1319999999999997 | V3: 191 | W3: 5 | X3: 5.2 | Y3: 196 | Z3: =+Y3+V3+S3+P3+M3+J3+G3+D3 -> 1592 | AA3: 4.8071249999999992
A4: Gosment | B4: 1 | C4: 4.9119999999999999 | D4: 188 | E4: 3 | F4: 4.9580000000000002 | G4: 202 | H4: 5 | I4: 5.0119999999999996 | J4: 202 | K4: 7 | L4: 4.7329999999999997 | M4: 193 | N4: 8 | O4: 5.1749999999999998 | P4: 191 | Q4: 6 | R4: 5.2030000000000003 | S4: 199 | T4: 4 | U4: 5.3019999999999996 | V4: 190 | W4: 2 | X4: 5.6429999999999998 | Y4: 178 | Z4: =+Y4+V4+S4+P4+M4+J4+G4+D4 -> 1543 | AA4: 5.1172500000000003
A5: Veia Loca | B5: 5 | C5: 5.4379999999999997 | D5: 162 | E5: 7 | F5: 5.3890000000000002 | G5: 192 | H5: 8 | I5: 5.2350000000000003 | J5: 199 | K5: 6 | L5: 5.3840000000000003 | M5: 192 | N5: 4 | O5: 5.3410000000000002 | P5: 190 | Q5: 2 | R5: 5.3440000000000003 | S5: 190 | T5: 1 | U5: 5.4669999999999996 | V5: 176 | W5: 3 | X5: 5.6920000000000002 | Y5: 160 | Z5: =+Y5+V5+S5+P5+M5+J5+G5+D5 -> 1461 | AA5: 5.4112499999999999
A6: Mane/Neto | B6: 2 | C6: 5.8529999999999998 | D6: 137 | E6: 1 | F6: 5.83 | G6: 132 | H6: 3 | I6: 5.6120000000000001 | J6: 180 | K6: 5 | L6: 5.6150000000000002 | M6: 166 | N6: 7 | O6: 5.8620000000000001 | P6: 86 | Q6: 8 | R6: 5.5250000000000004 | S6: 145 | T6: 6 | U6: 5.6020000000000003 | V6: 158 | W6: 4 | X6: 5.5259999999999998 | Y6: 167 | Z6: =+Y6+V6+S6+P6+M6+J6+G6+D6 -> 1171 | AA6: 5.6781249999999996