A1: Pilotos | B1: Voltas | C1: Metros
A2: ANDE / ANGE | B2: 21 | C2: 31
A3: BONG / JERA | B3: 20 | C3: 18
A4: MARQ / HENR | B4: 20 | C4: 17
A5: IMPO / CAVA | B5: 20 | C5: 8
A6: VEIA LOCA | B6: 20 | C6: 4
A7: JUNI / XUBA | B7: 18 | C7: 22
A8: MICH / MARC | B8: 18 | C8: 16
A9: GOSMENT | B9: 11 | C9: 39

A1: Nome | B1: P | C1: M.VOL | D1: B1 | E1: P | F1: M.VOL | G1: B2 | H1: P | I1: M.VOL | J1: B3 | K1: P | L1: M.VOL | M1: B4 | N1: P | O1: M.VOL | P1: B5 | Q1: P | R1: M.VOL | S1: B6 | T1: P | U1: M.VOL | V1: B7 | W1: P | X1: M.VOL | Y1: B8 | Z1: TOTAL | AA1: MEDIA
A2: IMPO / CAVA | B2: 5 | C2: 5.0579999999999998 | D2: 209 | E2: 7 | F2: 5.0620000000000003 | G2: 216 | H2: 8 | I2: 5.0039999999999996 | J2: 211 | K2: 6 | L2: 4.9489999999999998 | M2: 212 | N2: 4 | O2: 4.8949999999999996 | P2: 206 | Q2: 2 | R2: 5.28 | S2: 199 | T2: 1 | U2: 5.3879999999999999 | V2: 187 | W2: 3 | X2: 5.1790000000000003 | Y2: 209 | Z2: =+Y2+V2+S2+P2+M2+J2+G2+D2 -> 1649 | AA2: =+(X2+U2+R2+O2+L2+I2+F2+C2)/8 -> 5.1018749999999997
A3: MICH / MARC | B3: 2 | C3: 5.17 | D3: 188 | E3: 1 | F3: 5.335 | G3: 192 | H3: 3 | I3: 5.33 | J3: 205 | K3: 5 | L3: 4.6189999999999998 | M3: 204 | N3: 7 | O3: 5.2240000000000002 | P3: 189 | Q3: 8 | R3: 5.0049999999999999 | S3: 195 | T3: 6 | U3: 5.3250000000000002 | V3: 219 | W3: 4 | X3: 5.1130000000000004 | Y3: 200 | Z3: =+Y3+V3+S3+P3+M3+J3+G3+D3 -> 1592 | AA3: =+(X3+U3+R3+O3+L3+I3+F3+C3)/8 -> 5.1401250000000003
A4: BONG / JERA | B4: 1 | C4: 5.1719999999999997 | D4: 192 | E4: 3 | F4: 5.1719999999999997 | G4: 202 | H4: 5 | I4: 5.32 | J4: 205 | K4: 7 | L4: 5.3319999999999999 | M4: 201 | N4: 8 | O4: 5.2249999999999996 | P4: 201 | Q4: 6 | R4: 5.22 | S4: 192 | T4: 4 | U4: 5.17 | V4: 191 | W4: 2 | X4: 5.2229999999999999 | Y4: 190 | Z4: =+Y4+V4+S4+P4+M4+J4+G4+D4 -> 1574 | AA4: =+(X4+U4+R4+O4+L4+I4+F4+C4)/8 -> 5.2292499999999995
A5: ANDE / ANGE | B5: 4 | C5: 5.0579999999999998 | D5: 205 | E5: 2 | F5: 5.1680000000000001 | G5: 169 | H5: 1 | I5: 5.17 | J5: 199 | K5: 3 | L5: 5.1130000000000004 | M5: 203 | N5: 5 | O5: 5.0579999999999998 | P5: 201 | Q5: 7 | R5: 5.1150000000000002 | S5: 188 | T5: 8 | U5: 5.1150000000000002 | V5: 190 | W5: 6 | X5: 5.1130000000000004 | Y5: 205 | Z5: =+Y5+V5+S5+P5+M5+J5+G5+D5 -> 1560 | AA5: =+(X5+U5+R5+O5+L5+I5+F5+C5)/8 -> 5.1137499999999996
A6: VEIA LOCA | B6: 7 | C6: 5.44 | D6: 192 | E6: 8 | F6: 5.4429999999999996 | G6: 199 | H6: 6 | I6: 5.17 | J6: 190 | K6: 4 | L6: 5.2809999999999997 | M6: 198 | N6: 2 | O6: 5.3879999999999999 | P6: 198 | Q6: 1 | R6: 5.2789999999999999 | S6: 176 | T6: 3 | U6: 5.3760000000000003 | V6: 204 | W6: 5 | X6: 5.2779999999999996 | Y6: 199 | Z6: =+Y6+V6+S6+P6+M6+J6+G6+D6 -> 1556 | AA6: =+(X6+U6+R6+O6+L6+I6+F6+C6)/8 -> 5.3318750000000001
A7: GOSMENT | B7: 3 | C7: 5.39 | D7: 182 | E7: 5 | F7: 5.17 | G7: 210 | H7: 7 | I7: 4.6280000000000001 | J7: 210 | K7: 8 | L7: 5.17 | M7: 212 | N7: 6 | O7: 5.2149999999999999 | P7: 100 | Q7: 4 | R7: 5.2270000000000003 | S7: 205 | T7: 2 | U7: 5.39 | V7: 204 | W7: 1 | X7: 5.335 | Y7: 189 | Z7: =+Y7+V7+S7+P7+M7+J7+G7+D7 -> 1512 | AA7: =+(X7+U7+R7+O7+L7+I7+F7+C7)/8 -> 5.1906249999999998
A8: JUNI / XUBA | B8: 8 | C8: 5.33 | D8: 200 | E8: 6 | F8: 5.0579999999999998 | G8: 197 | H8: 4 | I8: 5.3330000000000002 | J8: 185 | K8: 2 | L8: 5.508 | M8: 180 | N8: 1 | O8: 5.8150000000000004 | P8: 166 | Q8: 3 | R8: 5.0590000000000002 | S8: 182 | T8: 5 | U8: 5.0990000000000002 | V8: 179 | W8: 7 | X8: 5.1130000000000004 | Y8: 195 | Z8: =+Y8+V8+S8+P8+M8+J8+G8+D8 -> 1484 | AA8: =+(X8+U8+R8+O8+L8+I8+F8+C8)/8 -> 5.2893749999999997
A9: MARQ / HENR | B9: 6 | C9: 5.0030000000000001 | D9: 205 | E9: 4 | F9: 4.73 | G9: 181 | H9: 2 | I9: 5.3890000000000002 | J9: 176 | K9: 1 | L9: 5.343 | M9: 178 | N9: 3 | O9: 5.17 | P9: 176 | Q9: 5 | R9: 4.6189999999999998 | S9: 169 | T9: 7 | U9: 5.2009999999999996 | V9: 201 | W9: 8 | X9: 5.1849999999999996 | Y9: 192 | Z9: =+Y9+V9+S9+P9+M9+J9+G9+D9 -> 1478 | AA9: =+(X9+U9+R9+O9+L9+I9+F9+C9)/8 -> 5.08

A1: Nome | B1: P | C1: M.VOL
A2: ANDE / ANGE | B2: 1 | C2: 5.17
A3: ANDE / ANGE | B3: 2 | C3: 5.1680000000000001
A4: JUNI / XUBA | B4: 3 | C4: 5.0590000000000002
A5: MARQ / HENR | B5: 4 | C5: 4.73
A6: MICH / MARC - MARQ ; HENR | B6: 5 | C6: 4.6189999999999998
A7: IMPO / CAVA | B7: 6 | C7: 4.9489999999999998
A8: GOSMENT | B8: 7 | C8: 4.6280000000000001
A9: IMPO / CAVA | B9: 8 | C9: 5.0039999999999996