A1: PILOTOS | B1: P | C1: TEMPO | D1: V | E1: P | F1: TEMPO | G1: V | H1: P | I1: TEMPO | J1: V | K1: P | L1: TEMPO | M1: V | N1: P | O1: TEMPO | P1: V | Q1: P | R1: TEMPO | S1: V | T1: P | U1: TEMPO | V1: V | W1: P | X1: TEMPO | Y1: V | Z1: TOTAL | AA1: MEDIA
A2: MARCEL MICHEL | B2: 7 | C2: 4.8380000000000001 | D2: 340 | E2: 8 | F2: 4.73 | G2: 340 | H2: 6 | I2: 4.74 | J2: 338 | K2: 4 | L2: 4.843 | M2: 312 | N2: 2 | O2: 5.1130000000000004 | P2: 308 | Q2: 1 | R2: 5.2779999999999996 | S2: 291 | T2: 3 | U2: 4.9779999999999998 | V2: 326 | W2: 5 | X2: 4.7869999999999999 | Y2: 308 | Z2: =+Y2+V2+S2+P2+M2+J2+G2+D2 -> 2563 | AA2: =+(X2+U2+R2+O2+L2+I2+F2+C2)/8 -> 4.9133749999999994
A3: EQUIPISTOLA | B3: 3 | C3: 5.06 | D3: 310 | E3: 5 | F3: 3.5219999999999998 | G3: 299 | H3: 7 | I3: 4.9 | J3: 330 | K3: 8 | L3: 4.5650000000000004 | M3: 329 | N3: 6 | O3: 5.0069999999999997 | P3: 301 | Q3: 4 | R3: 5.17 | S3: 310 | T3: 2 | U3: 5.0069999999999997 | V3: 306 | W3: 1 | X3: 5.0620000000000003 | Y3: 268 | Z3: =+Y3+V3+S3+P3+M3+J3+G3+D3 -> 2453 | AA3: =+(X3+U3+R3+O3+L3+I3+F3+C3)/8 -> 4.7866249999999999
A4: VEIA PINGUCA | B4: 1 | C4: 5.28 | D4: 292 | E4: 3 | F4: 5.2229999999999999 | G4: 315 | H4: 5 | I4: 4.8949999999999996 | J4: 317 | K4: 7 | L4: 4.6749999999999998 | M4: 304 | N4: 8 | O4: 4.5119999999999996 | P4: 272 | Q4: 6 | R4: 5.2240000000000002 | S4: 304 | T4: 4 | U4: 4.8330000000000002 | V4: 315 | W4: 2 | X4: 4.95 | Y4: 313 | Z4: =+Y4+V4+S4+P4+M4+J4+G4+D4 -> 2432 | AA4: =+(X4+U4+R4+O4+L4+I4+F4+C4)/8 -> 4.9490000000000007
A5: JERA ERUNDA | B5: 5 | C5: 5.1710000000000003 | D5: 293 | E5: 7 | F5: 4.95 | G5: 311 | H5: 8 | I5: 4.74 | J5: 322 | K5: 6 | L5: 4.74 | M5: 329 | N5: 4 | O5: 5.0620000000000003 | P5: 292 | Q5: 2 | R5: 5.17 | S5: 275 | T5: 1 | U5: 5.3879999999999999 | V5: 290 | W5: 3 | X5: 5.06 | Y5: 298 | Z5: =+Y5+V5+S5+P5+M5+J5+G5+D5 -> 2410 | AA5: =+(X5+U5+R5+O5+L5+I5+F5+C5)/8 -> 5.0351250000000007
A6: GOSMENT | B6: 2 | C6: 5.1710000000000003 | D6: 310 | E6: 1 | F6: 5.39 | G6: 263 | H6: 3 | I6: 4.9790000000000001 | J6: 313 | K6: 5 | L6: 4.5650000000000004 | M6: 330 | N6: 7 | O6: 5.0049999999999999 | P6: 306 | Q6: 8 | R6: 5.1150000000000002 | S6: 306 | T6: 6 | U6: 5.1150000000000002 | V6: 309 | W6: 4 | X6: 5.06 | Y6: 265 | Z6: =+Y6+V6+S6+P6+M6+J6+G6+D6 -> 2402 | AA6: =+(X6+U6+R6+O6+L6+I6+F6+C6)/8 -> 5.05
A7: VEIA JURUBEB | B7: 4 | C7: 5.2229999999999999 | D7: 296 | E7: 2 | F7: 5.1150000000000002 | G7: 290 | H7: 1 | I7: 5.2889999999999997 | J7: 278 | K7: 3 | L7: 4.63 | M7: 243 | N7: 5 | O7: 5.2229999999999999 | P7: 293 | Q7: 7 | R7: 5.3330000000000002 | S7: 285 | T7: 8 | U7: 5.39 | V7: 259 | W7: 6 | X7: 5.1580000000000004 | Y7: 268 | Z7: =+Y7+V7+S7+P7+M7+J7+G7+D7 -> 2212 | AA7: =+(X7+U7+R7+O7+L7+I7+F7+C7)/8 -> 5.1701249999999996
A8: JOAO RICARDO | B8: 8 | C8: 5.2789999999999999 | D8: 299 | E8: 6 | F8: 5.2789999999999999 | G8: 277 | H8: 4 | I8: 5.2240000000000002 | J8: 292 | K8: 2 | L8: 4.8579999999999997 | M8: 290 | N8: 1 | O8: 5.4429999999999996 | P8: 231 | Q8: 3 | R8: 5.38 | S8: 237 | T8: 5 | U8: 4.74 | V8: 270 | W8: 7 | X8: 5.17 | Y8: 288 | Z8: =+Y8+V8+S8+P8+M8+J8+G8+D8 -> 2184 | AA8: =+(X8+U8+R8+O8+L8+I8+F8+C8)/8 -> 5.1716249999999988
A9: MANE GABRIEL | B9: 6 | C9: 5.1289999999999996 | D9: 287 | E9: 4 | F9: 5.2240000000000002 | G9: 243 | H9: 2 | I9: 4.9240000000000004 | J9: 212 | K9: 1 | L9: 4.9649999999999999 | M9: 216 | N9: 3 | O9: 5.3879999999999999 | P9: 277 | Q9: 5 | R9: 5.3449999999999998 | S9: 284 | T9: 7 | U9: 5.28 | V9: 276 | W9: 8 | X9: 5.27 | Y9: 264 | Z9: =+Y9+V9+S9+P9+M9+J9+G9+D9 -> 2059 | AA9: =+(X9+U9+R9+O9+L9+I9+F9+C9)/8 -> 5.1906249999999998