A1: Pilotos | B1: Pista | C1: M.Vol | D1: Vol | E1: Pista | F1: M.Vol | G1: Vol | H1: Pista | I1: M.Vol | J1: Vol | K1: Pista | L1: M.Vol | M1: Vol | N1: Pista | O1: M.Vol | P1: Vol | Q1: Pista | R1: M.Vol | S1: Vol | T1: Pista | U1: M.Vol | V1: Vol | W1: Pista | X1: M.Vol | Y1: Vol | Z1: TOTAL
A2: ANGE / ANDE | B2: 4 | C2: 5.4859999999999998 | D2: 162 | E2: 2 | F2: 5.4859999999999998 | G2: 175 | H2: 1 | I2: 5.3390000000000004 | J2: 169 | K2: 3 | L2: 5.2140000000000004 | M2: 192 | N2: 5 | O2: 5.4859999999999998 | P2: 190 | Q2: 7 | R2: 4.7389999999999999 | S2: 196 | T2: 8 | U2: 4.6829999999999998 | V2: 196 | W2: 6 | X2: 4.73 | Y2: 196 | Z2: =+Y2+V2+S2+P2+M2+J2+G2+D2 -> 1476
A3: BONG /JERA | B3: 6 | C3: 5.1319999999999997 | D3: 186 | E3: 4 | F3: 5.2069999999999999 | G3: 182 | H3: 2 | I3: 5.3849999999999998 | J3: 181 | K3: 1 | L3: 5.3869999999999996 | M3: 180 | N3: 3 | O3: 5.29 | P3: 181 | Q3: 5 | R3: 4.9619999999999997 | S3: 177 | T3: 7 | U3: 5.0750000000000002 | V3: 199 | W3: 8 | X3: 4.9779999999999998 | Y3: 181 | Z3: =+Y3+V3+S3+P3+M3+J3+G3+D3 -> 1467
A4: MARC /MICH | B4: 7 | C4: 5.1740000000000004 | D4: 185 | E4: 8 | F4: 5.0839999999999996 | G4: 195 | H4: 6 | I4: 5.4859999999999998 | J4: 192 | K4: 4 | L4: 5.1660000000000004 | M4: 160 | N4: 2 | O4: 5.524 | P4: 135 | Q4: 1 | R4: 5.2560000000000002 | S4: 171 | T4: 3 | U4: 5.1520000000000001 | V4: 195 | W4: 5 | X4: 4.9669999999999996 | Y4: 174 | Z4: =+Y4+V4+S4+P4+M4+J4+G4+D4 -> 1407
A5: MARQ / HENR | B5: 8 | C5: 5.14 | D5: 193 | E5: 6 | F5: 5.1580000000000004 | G5: 176 | H5: 4 | I5: 5.2590000000000003 | J5: 160 | K5: 2 | L5: 5.4859999999999998 | M5: 144 | N5: 1 | O5: 5.3070000000000004 | P5: 184 | Q5: 3 | R5: 5.1769999999999996 | S5: 185 | T5: 5 | U5: 5.2320000000000002 | V5: 177 | W5: 7 | X5: 5.1449999999999996 | Y5: 182 | Z5: =+Y5+V5+S5+P5+M5+J5+G5+D5 -> 1401
A6: JEIS/ ALEX | B6: 5 | C6: 5.3869999999999996 | D6: 169 | E6: 7 | F6: 5.4859999999999998 | G6: 143 | H6: 8 | I6: 5.4859999999999998 | J6: 155 | K6: 6 | L6: 5.4130000000000003 | M6: 174 | N6: 4 | O6: 5.3579999999999997 | P6: 162 | Q6: 2 | R6: 5.4859999999999998 | S6: 162 | T6: 1 | U6: 5.4859999999999998 | V6: 160 | W6: 3 | X6: 5.5519999999999996 | Y6: 167 | Z6: =+Y6+V6+S6+P6+M6+J6+G6+D6 -> 1292
A7: DINH / ERUN | B7: 1 | C7: 5.4859999999999998 | D7: 172 | E7: 3 | F7: 5.383 | G7: 147 | H7: 5 | I7: 5.4189999999999996 | J7: 126 | K7: 7 | L7: 5.6909999999999998 | M7: 181 | N7: 8 | O7: 5.4859999999999998 | P7: 168 | Q7: 6 | R7: 5.5270000000000001 | S7: 156 | T7: 4 | U7: 5.109 | V7: 169 | W7: 2 | X7: 5.3959999999999999 | Y7: 166 | Z7: =+Y7+V7+S7+P7+M7+J7+G7+D7 -> 1285
A8: NETO /JAPA | B8: 3 | C8: 5.6449999999999996 | D8: 161 | E8: 5 | F8: 5.5609999999999999 | G8: 154 | H8: 7 | I8: 5.5750000000000002 | J8: 159 | K8: 8 | L8: 5.4859999999999998 | M8: 166 | N8: 6 | O8: 5.4669999999999996 | P8: 167 | Q8: 4 | R8: 5.8150000000000004 | S8: 159 | T8: 2 | U8: 5.6050000000000004 | V8: 165 | W8: 1 | X8: 5.4850000000000003 | Y8: 139 | Z8: =+Y8+V8+S8+P8+M8+J8+G8+D8 -> 1270
A9: MORA /JUNI | B9: 2 | C9: 5.4820000000000002 | D9: 148 | E9: 1 | F9: 5.593 | G9: 124 | H9: 3 | I9: 5.4029999999999996 | J9: 134 | K9: 5 | L9: 5.0940000000000003 | M9: 159 | N9: 7 | O9: 5.1230000000000002 | P9: 152 | Q9: 8 | R9: 4.7190000000000003 | S9: 183 | T9: 6 | U9: 5.1040000000000001 | V9: 130 | W9: 4 | X9: 5.2089999999999996 | Y9: 125 | Z9: =+Y9+V9+S9+P9+M9+J9+G9+D9 -> 1155