A1: Bateria 1
A2: Nome | B2: P | C2: Tempo | D2: Vol | E2: P | F2: Tempo | G2: Vol | H2: P | I2: Tempo | J2: Vol | K2: P | L2: Tempo | M2: Vol | N2: P | O2: Tempo | P2: Vol | Q2: P | R2: Tempo | S2: Vol | T2: P | U2: Tempo | V2: Vol | W2: P | X2: Tempo | Y2: Vol | Z2: Total | AA2: Media | AB2: Record
A3: JUNINHO | B3: 7 | C3: 5.0590000000000002 | D3: 30 | E3: 8 | F3: 5.06 | G3: 33 | H3: 6 | I3: 5.06 | J3: 28 | K3: 4 | L3: 5.335 | M3: 31 | N3: 2 | O3: 5.391 | P3: 30 | Q3: 1 | R3: 5.5 | S3: 29 | T3: 3 | U3: 5.28 | V3: 29 | W3: 5 | X3: 5.4989999999999997 | Y3: 29 | Z3: 239.29787234042553 | AA3: =+(X3+U3+R3+O3+L3+I3+F3+C3)/8 -> 5.2730000000000006 | AB3: =MINA(X3,U3,R3,O3,L3,I3,F3,C3) -> 5.0590000000000002
A4: GODOI | B4: 5 | C4: 5.28 | D4: 29 | E4: 7 | F4: 5.17 | G4: 30 | H4: 8 | I4: 5.17 | J4: 27 | K4: 6 | L4: 5.2789999999999999 | M4: 29 | N4: 4 | O4: 5.4980000000000002 | P4: 30 | Q4: 2 | R4: 5.28 | S4: 29 | T4: 1 | U4: 5.2789999999999999 | V4: 29 | W4: 3 | X4: 5.28 | Y4: 29 | Z4: 232.25531914893617 | AA4: =+(X4+U4+R4+O4+L4+I4+F4+C4)/8 -> 5.2795000000000005 | AB4: =MINA(X4,U4,R4,O4,L4,I4,F4,C4) -> 5.17
A5: GABRIEL | B5: 2 | C5: 5.28 | D5: 30 | E5: 1 | F5: 5.61 | G5: 27 | H5: 3 | I5: 5.28 | J5: 30 | K5: 5 | L5: 5.2809999999999997 | M5: 29 | N5: 7 | O5: 5.39 | P5: 25 | Q5: 8 | R5: 5.4489999999999998 | S5: 32 | T5: 6 | U5: 5.28 | V5: 30 | W5: 4 | X5: 5.39 | Y5: 29 | Z5: 232.10638297872342 | AA5: =+(X5+U5+R5+O5+L5+I5+F5+C5)/8 -> 5.37 | AB5: =MINA(X5,U5,R5,O5,L5,I5,F5,C5) -> 5.28
A6: GIOVANNI | B6: 6 | C6: 5.5 | D6: 30 | E6: 4 | F6: 5.391 | G6: 28 | H6: 2 | I6: 5.5 | J6: 29 | K6: 1 | L6: 5.72 | M6: 22 | N6: 3 | O6: 5.61 | P6: 29 | Q6: 5 | R6: 5.5 | S6: 29 | T6: 7 | U6: 5.28 | V6: 30 | W6: 8 | X6: 5.5 | Y6: 26 | Z6: 223.80851063829786 | AA6: =+(X6+U6+R6+O6+L6+I6+F6+C6)/8 -> 5.5001249999999997 | AB6: =MINA(X6,U6,R6,O6,L6,I6,F6,C6) -> 5.28
A7: MARCOS JOSE | B7: 1 | C7: 6.05 | D7: 19 | E7: 3 | F7: 5.94 | G7: 25 | H7: 5 | I7: 5.9390000000000001 | J7: 26 | K7: 7 | L7: 5.7750000000000004 | M7: 26 | N7: 8 | O7: 5.665 | P7: 26 | Q7: 6 | R7: 5.83 | S7: 26 | T7: 4 | U7: 6.1050000000000004 | V7: 24 | W7: 2 | X7: 5.9390000000000001 | Y7: 26 | Z7: 199.63829787234042 | AA7: =+(X7+U7+R7+O7+L7+I7+F7+C7)/8 -> 5.9053749999999994 | AB7: =MINA(X7,U7,R7,O7,L7,I7,F7,C7) -> 5.665
A8: EVANDRO | B8: 3 | C8: 5.94 | D8: 25 | E8: 5 | F8: 5.9950000000000001 | G8: 20 | H8: 7 | I8: 5.7190000000000003 | J8: 23 | K8: 8 | L8: 5.72 | M8: 29 | N8: 6 | O8: 5.7210000000000001 | P8: 27 | Q8: 4 | R8: 5.9359999999999999 | S8: 25 | T8: 2 | U8: 5.94 | V8: 19 | W8: 1 | X8: 6.6 | Y8: 23 | Z8: 191.87234042553192 | AA8: =+(X8+U8+R8+O8+L8+I8+F8+C8)/8 -> 5.9463749999999989 | AB8: =MINA(X8,U8,R8,O8,L8,I8,F8,C8) -> 5.7190000000000003
A9: FLAVIO | B9: 8 | C9: 5.9939999999999998 | D9: 24 | E9: 6 | F9: 6.2130000000000001 | G9: 26 | H9: 4 | I9: 6.2149999999999999 | J9: 24 | K9: 2 | L9: 6.38 | M9: 23 | N9: 1 | O9: 6.6 | P9: 22 | Q9: 3 | R9: 6.1059999999999999 | S9: 24 | T9: 5 | U9: 6.3810000000000002 | V9: 19 | W9: 7 | X9: 6.1479999999999997 | Y9: 21 | Z9: 183.25531914893617 | AA9: =+(X9+U9+R9+O9+L9+I9+F9+C9)/8 -> 6.2546249999999999 | AB9: =MINA(X9,U9,R9,O9,L9,I9,F9,C9) -> 5.9939999999999998
A10: DANIEL | B10: 4 | C10: 6.1580000000000004 | D10: 27 | E10: 2 | F10: 6.2149999999999999 | G10: 23 | H10: 1 | I10: 6.1589999999999998 | J10: 21 | K10: 3 | L10: 6.38 | M10: 13 | N10: 5 | O10: 6.1589999999999998 | P10: 20 | Q10: 7 | R10: 6.16 | S10: 26 | T10: 8 | U10: 6.16 | V10: 25 | W10: 6 | X10: 5.9930000000000003 | Y10: 24 | Z10: 179.68085106382978 | AA10: =+(X10+U10+R10+O10+L10+I10+F10+C10)/8 -> 6.173 | AB10: =MINA(X10,U10,R10,O10,L10,I10,F10,C10) -> 5.9930000000000003
A12: Bateria 2
A13: Nome | B13: P | C13: Tempo | D13: Vol | E13: P | F13: Tempo | G13: Vol | H13: P | I13: Tempo | J13: Vol | K13: P | L13: Tempo | M13: Vol | N13: P | O13: Tempo | P13: Vol | Q13: P | R13: Tempo | S13: Vol | T13: P | U13: Tempo | V13: Vol | W13: P | X13: Tempo | Y13: Vol | Z13: Total | AA13: Media | AB13: Record
A14: KVANHA | B14: 4 | C14: 5.444 | D14: 31 | E14: 2 | F14: 5.282 | G14: 28 | H14: 1 | I14: 5.5549999999999997 | J14: 29 | K14: 3 | L14: 5.3339999999999996 | M14: 31 | N14: 5 | O14: 5.5010000000000003 | P14: 30 | Q14: 7 | R14: 5.4960000000000004 | S14: 31 | T14: 8 | U14: 5.4969999999999999 | V14: 31 | W14: 6 | X14: 5.39 | Y14: 31 | Z14: 242.19148936170214 | AA14: =+(X14+U14+R14+O14+L14+I14+F14+C14)/8 -> 5.4373750000000012 | AB14: =MINA(X14,U14,R14,O14,L14,I14,F14,C14) -> 5.282
A15: CAVERNA | B15: 5 | C15: 5.9390000000000001 | D15: 29 | E15: 7 | F15: 5.4989999999999997 | G15: 30 | H15: 8 | I15: 5.718 | J15: 28 | K15: 6 | L15: 5.6120000000000001 | M15: 26 | N15: 4 | O15: 5.4980000000000002 | P15: 30 | Q15: 2 | R15: 5.5 | S15: 28 | T15: 1 | U15: 5.7190000000000003 | V15: 29 | W15: 3 | X15: 5.5 | Y15: 30 | Z15: 230.04255319148936 | AA15: =+(X15+U15+R15+O15+L15+I15+F15+C15)/8 -> 5.6231249999999999 | AB15: =MINA(X15,U15,R15,O15,L15,I15,F15,C15) -> 5.4980000000000002
A16: BONGA | B16: 3 | C16: 5.5 | D16: 28 | E16: 5 | F16: 5.28 | G16: 31 | H16: 7 | I16: 5.282 | J16: 29 | K16: 8 | L16: 5.4969999999999999 | M16: 31 | N16: 6 | O16: 5.3879999999999999 | P16: 30 | Q16: 4 | R16: 5.4989999999999997 | S16: 26 | T16: 2 | U16: 5.5 | V16: 29 | W16: 1 | X16: 5.5 | Y16: 25 | Z16: 229.70212765957447 | AA16: =+(X16+U16+R16+O16+L16+I16+F16+C16)/8 -> 5.4307499999999997 | AB16: =MINA(X16,U16,R16,O16,L16,I16,F16,C16) -> 5.28
A17: ERIC | B17: 7 | C17: 5.5549999999999997 | D17: 28 | E17: 8 | F17: 5.718 | G17: 30 | H17: 6 | I17: 5.7149999999999999 | J17: 28 | K17: 4 | L17: 5.7190000000000003 | M17: 29 | N17: 2 | O17: 5.5570000000000004 | P17: 30 | Q17: 1 | R17: 5.7190000000000003 | S17: 22 | T17: 3 | U17: 5.72 | V17: 29 | W17: 5 | X17: 5.718 | Y17: 28 | Z17: 224.87234042553192 | AA17: =+(X17+U17+R17+O17+L17+I17+F17+C17)/8 -> 5.6776249999999999 | AB17: =MINA(X17,U17,R17,O17,L17,I17,F17,C17) -> 5.5549999999999997
A18: NETO | B18: 8 | C18: 5.5019999999999998 | D18: 23 | E18: 6 | F18: 5.6109999999999998 | G18: 29 | H18: 4 | I18: 5.7140000000000004 | J18: 27 | K18: 2 | L18: 5.72 | M18: 29 | N18: 1 | O18: 5.9379999999999997 | P18: 26 | Q18: 3 | R18: 5.5549999999999997 | S18: 30 | T18: 5 | U18: 5.5549999999999997 | V18: 29 | W18: 7 | X18: 5.4980000000000002 | Y18: 28 | Z18: 222.65957446808511 | AA18: =+(X18+U18+R18+O18+L18+I18+F18+C18)/8 -> 5.6366249999999996 | AB18: =MINA(X18,U18,R18,O18,L18,I18,F18,C18) -> 5.4980000000000002
A19: SANDRO ITU | B19: 1 | C19: 5.9950000000000001 | D19: 27 | E19: 3 | F19: 5.72 | G19: 26 | H19: 5 | I19: 5.7190000000000003 | J19: 27 | K19: 7 | L19: 5.6109999999999998 | M19: 29 | N19: 8 | O19: 5.5549999999999997 | P19: 29 | Q19: 6 | R19: 5.718 | S19: 29 | T19: 4 | U19: 5.7729999999999997 | V19: 26 | W19: 2 | X19: 5.8289999999999997 | Y19: 25 | Z19: 218.68085106382978 | AA19: =+(X19+U19+R19+O19+L19+I19+F19+C19)/8 -> 5.74 | AB19: =MINA(X19,U19,R19,O19,L19,I19,F19,C19) -> 5.5549999999999997
A20: RUDSON | B20: 6 | C20: 5.8310000000000004 | D20: 27 | E20: 4 | F20: 5.7750000000000004 | G20: 28 | H20: 2 | I20: 5.83 | J20: 27 | K20: 1 | L20: 5.7750000000000004 | M20: 24 | N20: 3 | O20: 5.83 | P20: 28 | Q20: 5 | R20: 5.28 | S20: 27 | T20: 7 | U20: 5.72 | V20: 28 | W20: 8 | X20: 5.7220000000000004 | Y20: 21 | Z20: 210.40425531914894 | AA20: =+(X20+U20+R20+O20+L20+I20+F20+C20)/8 -> 5.7203749999999998 | AB20: =MINA(X20,U20,R20,O20,L20,I20,F20,C20) -> 5.28
A22: Bateria 3
A23: Nome | B23: P | C23: Tempo | D23: Vol | E23: P | F23: Tempo | G23: Vol | H23: P | I23: Tempo | J23: Vol | K23: P | L23: Tempo | M23: Vol | N23: P | O23: Tempo | P23: Vol | Q23: P | R23: Tempo | S23: Vol | T23: P | U23: Tempo | V23: Vol | W23: P | X23: Tempo | Y23: Vol | Z23: Total | AA23: Media | AB23: Record
A24: MARCEL | B24: 6 | C24: 5.2789999999999999 | D24: 32 | E24: 4 | F24: 5.335 | G24: 26 | H24: 2 | I24: 5.28 | J24: 28 | K24: 1 | L24: 5.5 | M24: 29 | N24: 3 | O24: 5.4020000000000001 | P24: 31 | Q24: 5 | R24: 5.3339999999999996 | S24: 27 | T24: 7 | U24: 5.2789999999999999 | V24: 32 | W24: 8 | X24: 5.1580000000000004 | Y24: 33 | Z24: 238.65957446808511 | AA24: =+(X24+U24+R24+O24+L24+I24+F24+C24)/8 -> 5.3208750000000009 | AB24: =MINA(X24,U24,R24,O24,L24,I24,F24,C24) -> 5.1580000000000004
A25: JERA | B25: 1 | C25: 5.5549999999999997 | D25: 28 | E25: 3 | F25: 5.4450000000000003 | G25: 26 | H25: 5 | I25: 5.39 | J25: 31 | K25: 7 | L25: 5.3330000000000002 | M25: 30 | N25: 8 | O25: 5.2690000000000001 | P25: 28 | Q25: 6 | R25: 5.28 | S25: 28 | T25: 4 | U25: 5.06 | V25: 32 | W25: 2 | X25: 5.2249999999999996 | Y25: 30 | Z25: 234.78723404255319 | AA25: =+(X25+U25+R25+O25+L25+I25+F25+C25)/8 -> 5.3196250000000003 | AB25: =MINA(X25,U25,R25,O25,L25,I25,F25,C25) -> 5.06
A26: POWER | B26: 5 | C26: 5.5 | D26: 30 | E26: 7 | F26: 5.5 | G26: 29 | H26: 8 | I26: 5.5 | J26: 28 | K26: 6 | L26: 5.5 | M26: 30 | N26: 4 | O26: 5.4450000000000003 | P26: 27 | Q26: 2 | R26: 5.4450000000000003 | S26: 30 | T26: 1 | U26: 5.5990000000000002 | V26: 28 | W26: 3 | X26: 5.4950000000000001 | Y26: 29 | Z26: 231.59574468085106 | AA26: =+(X26+U26+R26+O26+L26+I26+F26+C26)/8 -> 5.4980000000000002 | AB26: =MINA(X26,U26,R26,O26,L26,I26,F26,C26) -> 5.4450000000000003
A27: RUBENS | B27: 4 | C27: 5.6079999999999997 | D27: 29 | E27: 2 | F27: 5.5540000000000003 | G27: 29 | H27: 1 | I27: 5.72 | J27: 28 | K27: 3 | L27: 5.61 | M27: 30 | N27: 5 | O27: 5.7190000000000003 | P27: 27 | Q27: 7 | R27: 5.4459999999999997 | S27: 29 | T27: 8 | U27: 5.5 | V27: 29 | W27: 6 | X27: 5.61 | Y27: 29 | Z27: 230.25531914893617 | AA27: =+(X27+U27+R27+O27+L27+I27+F27+C27)/8 -> 5.5958749999999995 | AB27: =MINA(X27,U27,R27,O27,L27,I27,F27,C27) -> 5.4459999999999997
A28: JAPAO | B28: 2 | C28: 5.4450000000000003 | D28: 28 | E28: 1 | F28: 5.718 | G28: 28 | H28: 3 | I28: 5.4980000000000002 | J28: 28 | K28: 5 | L28: 5.4450000000000003 | M28: 27 | N28: 7 | O28: 5.5 | P28: 29 | Q28: 8 | R28: 5.4989999999999997 | S28: 29 | T28: 6 | U28: 5.72 | V28: 29 | W28: 4 | X28: 5.5529999999999999 | Y28: 26 | Z28: 224.27659574468086 | AA28: =+(X28+U28+R28+O28+L28+I28+F28+C28)/8 -> 5.5472499999999991 | AB28: =MINA(X28,U28,R28,O28,L28,I28,F28,C28) -> 5.4450000000000003
A29: MANE | B29: 3 | C29: 5.5529999999999999 | D29: 26 | E29: 5 | F29: 5.5 | G29: 26 | H29: 7 | I29: 5.3890000000000002 | J29: 27 | K29: 8 | L29: 5.39 | M29: 24 | N29: 6 | O29: 5.4459999999999997 | P29: 27 | Q29: 4 | R29: 5.5 | S29: 27 | T29: 2 | U29: 5.335 | V29: 29 | W29: 1 | X29: 5.5 | Y29: 28 | Z29: 215.06382978723406 | AA29: =+(X29+U29+R29+O29+L29+I29+F29+C29)/8 -> 5.4516249999999999 | AB29: =MINA(X29,U29,R29,O29,L29,I29,F29,C29) -> 5.335
A30: JULIO | B30: 8 | C30: 5.61 | D30: 28 | E30: 6 | F30: 5.72 | G30: 27 | H30: 4 | I30: 5.9390000000000001 | J30: 21 | K30: 2 | L30: 5.5549999999999997 | M30: 26 | N30: 1 | O30: 6.16 | P30: 23 | Q30: 3 | R30: 5.7750000000000004 | S30: 24 | T30: 5 | U30: 5.665 | V30: 28 | W30: 7 | X30: 5.6639999999999997 | Y30: 27 | Z30: 205.04255319148936 | AA30: =+(X30+U30+R30+O30+L30+I30+F30+C30)/8 -> 5.7609999999999992 | AB30: =MINA(X30,U30,R30,O30,L30,I30,F30,C30) -> 5.5549999999999997
A32: Bateria 4
A33: Nome | B33: P | C33: Tempo | D33: Vol | E33: P | F33: Tempo | G33: Vol | H33: P | I33: Tempo | J33: Vol | K33: P | L33: Tempo | M33: Vol | N33: P | O33: Tempo | P33: Vol | Q33: P | R33: Tempo | S33: Vol | T33: P | U33: Tempo | V33: Vol | W33: P | X33: Tempo | Y33: Vol | Z33: Total | AA33: Media | AB33: Record
A34: KLEBER | B34: 4 | C34: 5.1139999999999999 | D34: 32 | E34: 2 | F34: 5.06 | G34: 32 | H34: 1 | I34: 5.28 | J34: 30 | K34: 3 | L34: 5.0590000000000002 | M34: 32 | N34: 5 | O34: 5.2789999999999999 | P34: 33 | Q34: 7 | R34: 5.06 | S34: 32 | T34: 8 | U34: 5.0579999999999998 | V34: 31 | W34: 6 | X34: 5.0590000000000002 | Y34: 33 | Z34: 255.63829787234042 | AA34: =+(X34+U34+R34+O34+L34+I34+F34+C34)/8 -> 5.1211250000000001 | AB34: =MINA(X34,U34,R34,O34,L34,I34,F34,C34) -> 5.0579999999999998
A35: MICHEL | B35: 6 | C35: 5.06 | D35: 32 | E35: 4 | F35: 5.2779999999999996 | G35: 32 | H35: 2 | I35: 5.2789999999999999 | J35: 30 | K35: 1 | L35: 5.5 | M35: 31 | N35: 3 | O35: 5.28 | P35: 29 | Q35: 5 | R35: 5.06 | S35: 33 | T35: 7 | U35: 5.06 | V35: 33 | W35: 8 | X35: 5.0590000000000002 | Y35: 33 | Z35: 253.17021276595744 | AA35: =+(X35+U35+R35+O35+L35+I35+F35+C35)/8 -> 5.1970000000000001 | AB35: =MINA(X35,U35,R35,O35,L35,I35,F35,C35) -> 5.0590000000000002
A36: DINHO | B36: 7 | C36: 5.2779999999999996 | D36: 32 | E36: 8 | F36: 5.28 | G36: 30 | H36: 6 | I36: 5.28 | J36: 29 | K36: 4 | L36: 5.17 | M36: 32 | N36: 2 | O36: 5.28 | P36: 31 | Q36: 1 | R36: 5.4969999999999999 | S36: 32 | T36: 3 | U36: 5.1150000000000002 | V36: 32 | W36: 5 | X36: 5.2789999999999999 | Y36: 31 | Z36: 250.06382978723406 | AA36: =+(X36+U36+R36+O36+L36+I36+F36+C36)/8 -> 5.2723750000000003 | AB36: =MINA(X36,U36,R36,O36,L36,I36,F36,C36) -> 5.1150000000000002
A37: ERUNDA | B37: 5 | C37: 5.2809999999999997 | D37: 31 | E37: 7 | F37: 5.2779999999999996 | G37: 30 | H37: 8 | I37: 5.28 | J37: 31 | K37: 6 | L37: 5.2789999999999999 | M37: 31 | N37: 4 | O37: 5.28 | P37: 31 | Q37: 2 | R37: 5.5 | S37: 31 | T37: 1 | U37: 5.4969999999999999 | V37: 28 | W37: 3 | X37: 5.2759999999999998 | Y37: 30 | Z37: 243.85106382978722 | AA37: =+(X37+U37+R37+O37+L37+I37+F37+C37)/8 -> 5.3338749999999999 | AB37: =MINA(X37,U37,R37,O37,L37,I37,F37,C37) -> 5.2759999999999998
A38: ANDERSON | B38: 8 | C38: 5.06 | D38: 33 | E38: 6 | F38: 5.0590000000000002 | G38: 32 | H38: 4 | I38: 5.17 | J38: 31 | K38: 2 | L38: 5.06 | M38: 15 | N38: 1 | O38: 5.28 | P38: 29 | Q38: 3 | R38: 5.0590000000000002 | S38: 32 | T38: 5 | U38: 5.2679999999999998 | V38: 32 | W38: 7 | X38: 5.06 | Y38: 32 | Z38: 236.87234042553192 | AA38: =+(X38+U38+R38+O38+L38+I38+F38+C38)/8 -> 5.1269999999999998 | AB38: =MINA(X38,U38,R38,O38,L38,I38,F38,C38) -> 5.0590000000000002
A39: ANGELAO | B39: 3 | C39: 5.5 | D39: 27 | E39: 5 | F39: 5.4989999999999997 | G39: 28 | H39: 7 | I39: 5.28 | J39: 29 | K39: 8 | L39: 5.2789999999999999 | M39: 29 | N39: 6 | O39: 5.27 | P39: 28 | Q39: 4 | R39: 5.2789999999999999 | S39: 29 | T39: 2 | U39: 5.4989999999999997 | V39: 26 | W39: 1 | X39: 5.72 | Y39: 19 | Z39: 215.61702127659575 | AA39: =+(X39+U39+R39+O39+L39+I39+F39+C39)/8 -> 5.4157500000000001 | AB39: =MINA(X39,U39,R39,O39,L39,I39,F39,C39) -> 5.27
A40: RICARDO | B40: 2 | C40: 5.8849999999999998 | D40: 23 | E40: 1 | F40: 5.7190000000000003 | G40: 26 | H40: 3 | I40: 5.5 | J40: 27 | K40: 5 | L40: 5.5 | M40: 27 | N40: 7 | O40: 5.72 | P40: 25 | Q40: 8 | R40: 5.5 | S40: 30 | T40: 6 | U40: 5.2809999999999997 | V40: 28 | W40: 4 | X40: 5.5 | Y40: 29 | Z40: 215.12765957446808 | AA40: =+(X40+U40+R40+O40+L40+I40+F40+C40)/8 -> 5.5756249999999996 | AB40: =MINA(X40,U40,R40,O40,L40,I40,F40,C40) -> 5.2809999999999997