A1: Bateria 1
A2: Nome | B2: P | C2: Tempo | D2: Vol | E2: P | F2: Tempo | G2: Vol | H2: P | I2: Tempo | J2: Vol | K2: P | L2: Tempo | M2: Vol | N2: P | O2: Tempo | P2: Vol | Q2: P | R2: Tempo | S2: Vol | T2: P | U2: Tempo | V2: Vol | W2: P | X2: Tempo | Y2: Vol | Z2: Total | AA2: Media | AB2: Record
A3: GERONIMO | B3: 7 | C3: 5.9390000000000001 | D3: 26 | E3: 8 | F3: 6.05 | G3: 26 | H3: 6 | I3: 6.05 | J3: 27 | K3: 4 | L3: 6.0419999999999998 | M3: 25 | N3: 2 | O3: 6.27 | P3: 27 | Q3: 1 | R3: 6.4349999999999996 | S3: 24 | T3: 3 | U3: 6.2149999999999999 | V3: 27 | W3: 5 | X3: 6.05 | Y3: 26 | Z3: 208.36170212765958 | AA3: =+(X3+U3+R3+O3+L3+I3+F3+C3)/8 -> 6.1313749999999994 | AB3: =MINA(X3,U3,R3,O3,L3,I3,F3,C3) -> 5.9390000000000001
A4: CLAYTON | B4: 5 | C4: 3.52 | D4: 25 | E4: 7 | F4: 6.2149999999999999 | G4: 23 | H4: 8 | I4: 6.27 | J4: 22 | K4: 6 | L4: 5.9950000000000001 | M4: 25 | N4: 4 | O4: 6.2149999999999999 | P4: 24 | Q4: 2 | R4: 6.5 | S4: 22 | T4: 1 | U4: 6.82 | V4: 23 | W4: 3 | X4: 6.3819999999999997 | Y4: 25 | Z4: 189.7659574468085 | AA4: =+(X4+U4+R4+O4+L4+I4+F4+C4)/8 -> 5.9896250000000011 | AB4: =MINA(X4,U4,R4,O4,L4,I4,F4,C4) -> 3.52
A5: LUIZ FELIPE | B5: 6 | C5: 6.27 | D5: 18 | E5: 4 | F5: 6.774 | G5: 24 | H5: 2 | I5: 6.7640000000000002 | J5: 10 | K5: 1 | L5: 6.4349999999999996 | M5: 21 | N5: 3 | O5: 6.16 | P5: 26 | Q5: 5 | R5: 5.83 | S5: 24 | T5: 7 | U5: 5.9950000000000001 | V5: 25 | W5: 8 | X5: 6.0490000000000004 | Y5: 22 | Z5: 170.57446808510639 | AA5: =+(X5+U5+R5+O5+L5+I5+F5+C5)/8 -> 6.2846250000000001 | AB5: =MINA(X5,U5,R5,O5,L5,I5,F5,C5) -> 5.83
A6: M. VINICIUS | B6: 1 | C6: 6.16 | D6: 22 | E6: 3 | F6: 5.61 | G6: 18 | H6: 5 | I6: 5.9409999999999998 | J6: 23 | K6: 7 | L6: 6.05 | M6: 9 | N6: 8 | O6: 6.1050000000000004 | P6: 24 | Q6: 6 | R6: 5.93 | S6: 23 | T6: 4 | U6: 5.83 | V6: 23 | W6: 2 | X6: 6.05 | Y6: 21 | Z6: 163.27659574468086 | AA6: =+(X6+U6+R6+O6+L6+I6+F6+C6)/8 -> 5.9595000000000002 | AB6: =MINA(X6,U6,R6,O6,L6,I6,F6,C6) -> 5.61
A7: MANO | B7: 4 | C7: 6.875 | D7: 14 | E7: 2 | F7: 6.6550000000000002 | G7: 17 | H7: 1 | I7: 7.26 | J7: 14 | K7: 3 | L7: 6.38 | M7: 24 | N7: 5 | O7: 6.1050000000000004 | P7: 21 | Q7: 7 | R7: 5.9939999999999998 | S7: 21 | T7: 8 | U7: 5.9950000000000001 | V7: 23 | W7: 6 | X7: 5.72 | Y7: 25 | Z7: 159.25531914893617 | AA7: =+(X7+U7+R7+O7+L7+I7+F7+C7)/8 -> 6.3730000000000002 | AB7: =MINA(X7,U7,R7,O7,L7,I7,F7,C7) -> 5.72
A8: CID GOSME | B8: 3 | C8: 7.55 | D8: 20 | E8: 5 | F8: 7.2050000000000001 | G8: 21 | H8: 7 | I8: 7.7 | J8: 18 | K8: 8 | L8: 7.48 | M8: 20 | N8: 6 | O8: 7.27 | P8: 20 | Q8: 4 | R8: 7.976 | S8: 18 | T8: 2 | U8: 8.0310000000000006 | V8: 17 | W8: 1 | X8: 7.7 | Y8: 19 | Z8: 153.2340425531915 | AA8: =+(X8+U8+R8+O8+L8+I8+F8+C8)/8 -> 7.6139999999999999 | AB8: =MINA(X8,U8,R8,O8,L8,I8,F8,C8) -> 7.2050000000000001
A9: MURILO | B9: 2 | C9: 7.37 | D9: 6 | E9: 1 | F9: 6.93 | G9: 16 | H9: 3 | I9: 7.48 | J9: 12 | K9: 5 | L9: 6.6 | M9: 20 | N9: 7 | O9: 6.4459999999999997 | P9: 20 | Q9: 8 | R9: 7.04 | S9: 17 | T9: 6 | U9: 7.6449999999999996 | V9: 19 | W9: 4 | X9: 8.36 | Y9: 5 | Z9: 115.19148936170212 | AA9: =+(X9+U9+R9+O9+L9+I9+F9+C9)/8 -> 7.2338749999999994 | AB9: =MINA(X9,U9,R9,O9,L9,I9,F9,C9) -> 6.4459999999999997
A11: Bateria 2
A12: Nome | B12: P | C12: Tempo | D12: Vol | E12: P | F12: Tempo | G12: Vol | H12: P | I12: Tempo | J12: Vol | K12: P | L12: Tempo | M12: Vol | N12: P | O12: Tempo | P12: Vol | Q12: P | R12: Tempo | S12: Vol | T12: P | U12: Tempo | V12: Vol | W12: P | X12: Tempo | Y12: Vol | Z12: Total | AA12: Media | AB12: Record
A13: JUNINHO | B13: 6 | C13: 5.1150000000000002 | D13: 27 | E13: 4 | F13: 5.17 | G13: 31 | H13: 2 | I13: 5.2789999999999999 | J13: 29 | K13: 1 | L13: 5.4989999999999997 | M13: 30 | N13: 3 | O13: 5.28 | P13: 31 | Q13: 5 | R13: 5.06 | S13: 33 | T13: 7 | U13: 4.9489999999999998 | V13: 32 | W13: 8 | X13: 5.0039999999999996 | Y13: 32 | Z13: 247.65957446808511 | AA13: =+(X13+U13+R13+O13+L13+I13+F13+C13)/8 -> 5.1695000000000002 | AB13: =MINA(X13,U13,R13,O13,L13,I13,F13,C13) -> 4.9489999999999998
A14: JULIO | B14: 8 | C14: 5.2789999999999999 | D14: 31 | E14: 6 | F14: 5.39 | G14: 30 | H14: 4 | I14: 5.2889999999999997 | J14: 31 | K14: 2 | L14: 5.5 | M14: 28 | N14: 1 | O14: 5.6669999999999998 | P14: 29 | Q14: 3 | R14: 5.4560000000000004 | S14: 30 | T14: 5 | U14: 5.28 | V14: 32 | W14: 7 | X14: 4.95 | Y14: 32 | Z14: 243.21276595744681 | AA14: =+(X14+U14+R14+O14+L14+I14+F14+C14)/8 -> 5.3513750000000009 | AB14: =MINA(X14,U14,R14,O14,L14,I14,F14,C14) -> 4.95
A15: CONRADO | B15: 3 | C15: 5.72 | D15: 25 | E15: 5 | F15: 5.5549999999999997 | G15: 28 | H15: 7 | I15: 5.29 | J15: 30 | K15: 8 | L15: 5.4989999999999997 | M15: 27 | N15: 6 | O15: 5.4450000000000003 | P15: 29 | Q15: 4 | R15: 5.5010000000000003 | S15: 27 | T15: 2 | U15: 5.39 | V15: 24 | W15: 1 | X15: 5.72 | Y15: 27 | Z15: 217.85106382978722 | AA15: =+(X15+U15+R15+O15+L15+I15+F15+C15)/8 -> 5.5149999999999997 | AB15: =MINA(X15,U15,R15,O15,L15,I15,F15,C15) -> 5.29
A16: RUDSON | B16: 5 | C16: 5.665 | D16: 22 | E16: 7 | F16: 5.5549999999999997 | G16: 26 | H16: 8 | I16: 5.72 | J16: 22 | K16: 6 | L16: 5.774 | M16: 29 | N16: 4 | O16: 5.94 | P16: 26 | Q16: 2 | R16: 5.72 | S16: 30 | T16: 1 | U16: 5.7190000000000003 | V16: 28 | W16: 3 | X16: 5.7750000000000004 | Y16: 22 | Z16: 207.74468085106383 | AA16: =+(X16+U16+R16+O16+L16+I16+F16+C16)/8 -> 5.7335000000000003 | AB16: =MINA(X16,U16,R16,O16,L16,I16,F16,C16) -> 5.5549999999999997
A17: M.JOSE | B17: 1 | C17: 6.16 | D17: 25 | E17: 3 | F17: 5.9950000000000001 | G17: 23 | H17: 5 | I17: 5.94 | J17: 26 | K17: 7 | L17: 5.94 | M17: 26 | N17: 8 | O17: 5.72 | P17: 26 | Q17: 6 | R17: 5.9379999999999997 | S17: 25 | T17: 4 | U17: 5.8840000000000003 | V17: 24 | W17: 2 | X17: 5.9950000000000001 | Y17: 26 | Z17: 201.36170212765958 | AA17: =+(X17+U17+R17+O17+L17+I17+F17+C17)/8 -> 5.9465000000000003 | AB17: =MINA(X17,U17,R17,O17,L17,I17,F17,C17) -> 5.72
A18: FLAVIO | B18: 4 | C18: 5.774 | D18: 26 | E18: 2 | F18: 5.83 | G18: 25 | H18: 1 | I18: 4.62 | J18: 27 | K18: 3 | L18: 5.72 | M18: 25 | N18: 5 | O18: 5.7859999999999996 | P18: 25 | Q18: 7 | R18: 6.16 | S18: 24 | T18: 8 | U18: 5.9379999999999997 | V18: 24 | W18: 6 | X18: 5.95 | Y18: 22 | Z18: 199.38297872340425 | AA18: =+(X18+U18+R18+O18+L18+I18+F18+C18)/8 -> 5.7222499999999998 | AB18: =MINA(X18,U18,R18,O18,L18,I18,F18,C18) -> 4.62
A19: EVANDRO | B19: 7 | C19: 6.05 | D19: 24 | E19: 8 | F19: 5.9950000000000001 | G19: 28 | H19: 6 | I19: 6.05 | J19: 24 | K19: 4 | L19: 6.6 | M19: 23 | N19: 2 | O19: 6.4349999999999996 | P19: 23 | Q19: 1 | R19: 6.5890000000000004 | S19: 19 | T19: 3 | U19: 5.83 | V19: 24 | W19: 5 | X19: 5.72 | Y19: 27 | Z19: 192.46808510638297 | AA19: =+(X19+U19+R19+O19+L19+I19+F19+C19)/8 -> 6.1586249999999989 | AB19: =MINA(X19,U19,R19,O19,L19,I19,F19,C19) -> 5.72
A21: Bateria 3
A22: Nome | B22: P | C22: Tempo | D22: Vol | E22: P | F22: Tempo | G22: Vol | H22: P | I22: Tempo | J22: Vol | K22: P | L22: Tempo | M22: Vol | N22: P | O22: Tempo | P22: Vol | Q22: P | R22: Tempo | S22: Vol | T22: P | U22: Tempo | V22: Vol | W22: P | X22: Tempo | Y22: Vol | Z22: Total | AA22: Media | AB22: Record
A23: ANGELAO | B23: 3 | C23: 5.2770000000000001 | D23: 31 | E23: 5 | F23: 5.2779999999999996 | G23: 32 | H23: 7 | I23: 5.0590000000000002 | J23: 31 | K23: 8 | L23: 5.17 | M23: 31 | N23: 6 | O23: 5.28 | P23: 31 | Q23: 4 | R23: 5.16 | S23: 31 | T23: 2 | U23: 5.28 | V23: 30 | W23: 1 | X23: 5.72 | Y23: 26 | Z23: 243.29787234042553 | AA23: =+(X23+U23+R23+O23+L23+I23+F23+C23)/8 -> 5.2780000000000005 | AB23: =MINA(X23,U23,R23,O23,L23,I23,F23,C23) -> 5.0590000000000002
A24: MANE | B24: 8 | C24: 5.0609999999999999 | D24: 28 | E24: 6 | F24: 5.2789999999999999 | G24: 28 | H24: 4 | I24: 5.2789999999999999 | J24: 30 | K24: 2 | L24: 5.18 | M24: 29 | N24: 1 | O24: 5.2789999999999999 | P24: 28 | Q24: 3 | R24: 5.28 | S24: 31 | T24: 5 | U24: 5.28 | V24: 30 | W24: 7 | X24: 5.28 | Y24: 30 | Z24: 237.34042553191489 | AA24: =+(X24+U24+R24+O24+L24+I24+F24+C24)/8 -> 5.2397499999999999 | AB24: =MINA(X24,U24,R24,O24,L24,I24,F24,C24) -> 5.0609999999999999
A25: JAPAO | B25: 2 | C25: 5.7190000000000003 | D25: 27 | E25: 1 | F25: 5.72 | G25: 27 | H25: 3 | I25: 5.5 | J25: 29 | K25: 5 | L25: 5.39 | M25: 30 | N25: 7 | O25: 5.5 | P25: 29 | Q25: 8 | R25: 5.4989999999999997 | S25: 30 | T25: 6 | U25: 5.5549999999999997 | V25: 30 | W25: 4 | X25: 5.61 | Y25: 26 | Z25: 231.61702127659575 | AA25: =+(X25+U25+R25+O25+L25+I25+F25+C25)/8 -> 5.5616250000000003 | AB25: =MINA(X25,U25,R25,O25,L25,I25,F25,C25) -> 5.39
A26: GIOVANNI | B26: 5 | C26: 5.5 | D26: 28 | E26: 7 | F26: 5.2779999999999996 | G26: 28 | H26: 8 | I26: 5.28 | J26: 30 | K26: 6 | L26: 5.4450000000000003 | M26: 28 | N26: 4 | O26: 5.5549999999999997 | P26: 28 | Q26: 2 | R26: 5.61 | S26: 29 | T26: 1 | U26: 5.7190000000000003 | V26: 27 | W26: 3 | X26: 5.5 | Y26: 28 | Z26: 226.97872340425531 | AA26: =+(X26+U26+R26+O26+L26+I26+F26+C26)/8 -> 5.4858750000000001 | AB26: =MINA(X26,U26,R26,O26,L26,I26,F26,C26) -> 5.2779999999999996
A27: RICARDO | B27: 1 | C27: 5.72 | D27: 28 | E27: 3 | F27: 5.5 | G27: 31 | H27: 5 | I27: 5.17 | J27: 30 | K27: 7 | L27: 5.39 | M27: 25 | N27: 8 | O27: 5.49 | P27: 30 | Q27: 6 | R27: 5.5 | S27: 30 | T27: 4 | U27: 5.4989999999999997 | V27: 29 | W27: 2 | X27: 5.4989999999999997 | Y27: 21 | Z27: 224.80851063829786 | AA27: =+(X27+U27+R27+O27+L27+I27+F27+C27)/8 -> 5.4710000000000001 | AB27: =MINA(X27,U27,R27,O27,L27,I27,F27,C27) -> 5.17
A28: ERIC | B28: 4 | C28: 5.5 | D28: 26 | E28: 2 | F28: 5.5 | G28: 29 | H28: 1 | I28: 5.71 | J28: 28 | K28: 3 | L28: 5.39 | M28: 30 | N28: 5 | O28: 5.5 | P28: 13 | Q28: 7 | R28: 5.2789999999999999 | S28: 27 | T28: 8 | U28: 5.1150000000000002 | V28: 31 | W28: 6 | X28: 5.3360000000000003 | Y28: 28 | Z28: 213.06382978723406 | AA28: =+(X28+U28+R28+O28+L28+I28+F28+C28)/8 -> 5.4162499999999998 | AB28: =MINA(X28,U28,R28,O28,L28,I28,F28,C28) -> 5.1150000000000002
A29: NETO | B29: 7 | C29: 5.7229999999999999 | D29: 22 | E29: 8 | F29: 5.7210000000000001 | G29: 23 | H29: 6 | I29: 5.72 | J29: 28 | K29: 4 | L29: 5.8849999999999998 | M29: 19 | N29: 2 | O29: 5.718 | P29: 24 | Q29: 1 | R29: 5.9390000000000001 | S29: 24 | T29: 3 | U29: 5.72 | V29: 27 | W29: 5 | X29: 5.94 | Y29: 26 | Z29: 194.7659574468085 | AA29: =+(X29+U29+R29+O29+L29+I29+F29+C29)/8 -> 5.79575 | AB29: =MINA(X29,U29,R29,O29,L29,I29,F29,C29) -> 5.718
A31: Bateria 4
A32: Nome | B32: P | C32: Tempo | D32: Vol | E32: P | F32: Tempo | G32: Vol | H32: P | I32: Tempo | J32: Vol | K32: P | L32: Tempo | M32: Vol | N32: P | O32: Tempo | P32: Vol | Q32: P | R32: Tempo | S32: Vol | T32: P | U32: Tempo | V32: Vol | W32: P | X32: Tempo | Y32: Vol | Z32: Total | AA32: Media | AB32: Record
A33: GOROI | B33: 8 | C33: 5.1150000000000002 | D33: 31 | E33: 6 | F33: 5.07 | G33: 33 | H33: 4 | I33: 5.1150000000000002 | J33: 31 | K33: 2 | L33: 5.28 | M33: 30 | N33: 1 | O33: 5.28 | P33: 31 | Q33: 3 | R33: 5.06 | S33: 32 | T33: 5 | U33: 4.95 | V33: 34 | W33: 7 | X33: 4.84 | Y33: 32 | Z33: 254.85106382978722 | AA33: =+(X33+U33+R33+O33+L33+I33+F33+C33)/8 -> 5.0887500000000001 | AB33: =MINA(X33,U33,R33,O33,L33,I33,F33,C33) -> 4.84
A34: BONGA | B34: 3 | C34: 5.39 | D34: 30 | E34: 5 | F34: 5.17 | G34: 31 | H34: 7 | I34: 5.2249999999999996 | J34: 32 | K34: 8 | L34: 5.1150000000000002 | M34: 30 | N34: 6 | O34: 5.28 | P34: 31 | Q34: 4 | R34: 5.1150000000000002 | S34: 32 | T34: 2 | U34: 5.28 | V34: 30 | W34: 1 | X34: 5.28 | Y34: 31 | Z34: 248.85106382978722 | AA34: =+(X34+U34+R34+O34+L34+I34+F34+C34)/8 -> 5.2318749999999996 | AB34: =MINA(X34,U34,R34,O34,L34,I34,F34,C34) -> 5.1150000000000002
A35: RUBENS | B35: 6 | C35: 5.27 | D35: 30 | E35: 4 | F35: 5.28 | G35: 29 | H35: 2 | I35: 5.5 | J35: 30 | K35: 1 | L35: 5.7210000000000001 | M35: 28 | N35: 3 | O35: 5.2789999999999999 | P35: 32 | Q35: 5 | R35: 5.1150000000000002 | S35: 31 | T35: 7 | U35: 5.1710000000000003 | V35: 32 | W35: 8 | X35: 5.1150000000000002 | Y35: 31 | Z35: 243.63829787234042 | AA35: =+(X35+U35+R35+O35+L35+I35+F35+C35)/8 -> 5.3063749999999992 | AB35: =MINA(X35,U35,R35,O35,L35,I35,F35,C35) -> 5.1150000000000002
A36: JERONIMO | B36: 1 | C36: 5.28 | D36: 30 | E36: 3 | F36: 5.06 | G36: 30 | H36: 5 | I36: 5.1710000000000003 | J36: 31 | K36: 7 | L36: 5.2249999999999996 | M36: 31 | N36: 8 | O36: 5.2789999999999999 | P36: 32 | Q36: 6 | R36: 5.1150000000000002 | S36: 31 | T36: 4 | U36: 5.06 | V36: 30 | W36: 2 | X36: 5.28 | Y36: 26 | Z36: 241.14893617021278 | AA36: =+(X36+U36+R36+O36+L36+I36+F36+C36)/8 -> 5.1837499999999999 | AB36: =MINA(X36,U36,R36,O36,L36,I36,F36,C36) -> 5.06
A37: POWER | B37: 4 | C37: 5.391 | D37: 31 | E37: 2 | F37: 5.28 | G37: 29 | H37: 1 | I37: 5.4450000000000003 | J37: 30 | K37: 3 | L37: 5.28 | M37: 31 | N37: 5 | O37: 5.39 | P37: 28 | Q37: 7 | R37: 5.3890000000000002 | S37: 28 | T37: 8 | U37: 5.28 | V37: 31 | W37: 6 | X37: 5.28 | Y37: 29 | Z37: 237.12765957446808 | AA37: =+(X37+U37+R37+O37+L37+I37+F37+C37)/8 -> 5.3418749999999999 | AB37: =MINA(X37,U37,R37,O37,L37,I37,F37,C37) -> 5.28
A38: GABRIEL | B38: 5 | C38: 5.28 | D38: 28 | E38: 7 | F38: 5.4450000000000003 | G38: 31 | H38: 8 | I38: 5.444 | J38: 29 | K38: 6 | L38: 5.5 | M38: 30 | N38: 4 | O38: 5.5 | P38: 30 | Q38: 2 | R38: 5.2809999999999997 | S38: 30 | T38: 1 | U38: 5.5 | V38: 28 | W38: 3 | X38: 5.28 | Y38: 31 | Z38: 237.10638297872342 | AA38: =+(X38+U38+R38+O38+L38+I38+F38+C38)/8 -> 5.4037499999999996 | AB38: =MINA(X38,U38,R38,O38,L38,I38,F38,C38) -> 5.28
A39: CAVERNA | B39: 2 | C39: 5.4980000000000002 | D39: 29 | E39: 1 | F39: 5.61 | G39: 28 | H39: 3 | I39: 5.4450000000000003 | J39: 30 | K39: 5 | L39: 5.5010000000000003 | M39: 28 | N39: 7 | O39: 5.5 | P39: 28 | Q39: 8 | R39: 6.05 | S39: 12 | T39: 6 | U39: 6.06 | V39: 27 | W39: 4 | X39: 5.94 | Y39: 27 | Z39: 209.19148936170214 | AA39: =+(X39+U39+R39+O39+L39+I39+F39+C39)/8 -> 5.7004999999999999 | AB39: =MINA(X39,U39,R39,O39,L39,I39,F39,C39) -> 5.4450000000000003
A41: Bateria 5
A42: Nome | B42: P | C42: Tempo | D42: Vol | E42: P | F42: Tempo | G42: Vol | H42: P | I42: Tempo | J42: Vol | K42: P | L42: Tempo | M42: Vol | N42: P | O42: Tempo | P42: Vol | Q42: P | R42: Tempo | S42: Vol | T42: P | U42: Tempo | V42: Vol | W42: P | X42: Tempo | Y42: Vol | Z42: Total | AA42: Media | AB42: Record
A43: ANDERSON | B43: 3 | C43: 4.95 | D43: 32 | E43: 5 | F43: 4.95 | G43: 33 | H43: 7 | I43: 4.8949999999999996 | J43: 33 | K43: 8 | L43: 4.73 | M43: 35 | N43: 6 | O43: 5.0049999999999999 | P43: 32 | Q43: 4 | R43: 5.1150000000000002 | S43: 32 | T43: 2 | U43: 5.28 | V43: 32 | W43: 1 | X43: 5.61 | Y43: 31 | Z43: 261.08510638297872 | AA43: =+(X43+U43+R43+O43+L43+I43+F43+C43)/8 -> 5.0668749999999996 | AB43: =MINA(X43,U43,R43,O43,L43,I43,F43,C43) -> 4.73
A44: KLEBER | B44: 5 | C44: 5.28 | D44: 32 | E44: 7 | F44: 5.0060000000000002 | G44: 33 | H44: 8 | I44: 5.06 | J44: 31 | K44: 6 | L44: 4.73 | M44: 34 | N44: 4 | O44: 5.2249999999999996 | P44: 32 | Q44: 2 | R44: 5.28 | S44: 31 | T44: 1 | U44: 5.39 | V44: 30 | W44: 3 | X44: 5.2249999999999996 | Y44: 32 | Z44: 255.89361702127658 | AA44: =+(X44+U44+R44+O44+L44+I44+F44+C44)/8 -> 5.1494999999999997 | AB44: =MINA(X44,U44,R44,O44,L44,I44,F44,C44) -> 4.73
A45: MARCEL | B45: 7 | C45: 5.06 | D45: 33 | E45: 8 | F45: 5.06 | G45: 34 | H45: 6 | I45: 5.06 | J45: 31 | K45: 4 | L45: 4.95 | M45: 32 | N45: 2 | O45: 5.39 | P45: 30 | Q45: 1 | R45: 5.49 | S45: 30 | T45: 3 | U45: 5.28 | V45: 32 | W45: 5 | X45: 5.2789999999999999 | Y45: 30 | Z45: 252.21276595744681 | AA45: =+(X45+U45+R45+O45+L45+I45+F45+C45)/8 -> 5.1961250000000003 | AB45: =MINA(X45,U45,R45,O45,L45,I45,F45,C45) -> 4.95
A46: MICHEL | B46: 6 | C46: 4.8949999999999996 | D46: 33 | E46: 4 | F46: 5.06 | G46: 32 | H46: 2 | I46: 4.9050000000000002 | J46: 32 | K46: 1 | L46: 4.95 | M46: 29 | N46: 3 | O46: 5.0590000000000002 | P46: 31 | Q46: 5 | R46: 5.06 | S46: 32 | T46: 7 | U46: 5.05 | V46: 30 | W46: 8 | X46: 5.0579999999999998 | Y46: 31 | Z46: 250.85106382978722 | AA46: =+(X46+U46+R46+O46+L46+I46+F46+C46)/8 -> 5.0046250000000008 | AB46: =MINA(X46,U46,R46,O46,L46,I46,F46,C46) -> 4.8949999999999996
A47: ERUNDA | B47: 4 | C47: 5.2789999999999999 | D47: 29 | E47: 2 | F47: 5.2789999999999999 | G47: 32 | H47: 1 | I47: 5.335 | J47: 28 | K47: 3 | L47: 5.06 | M47: 31 | N47: 5 | O47: 5.2789999999999999 | P47: 31 | Q47: 7 | R47: 5.28 | S47: 31 | T47: 8 | U47: 5.28 | V47: 28 | W47: 6 | X47: 5.2789999999999999 | Y47: 31 | Z47: 242.2340425531915 | AA47: =+(X47+U47+R47+O47+L47+I47+F47+C47)/8 -> 5.2588749999999997 | AB47: =MINA(X47,U47,R47,O47,L47,I47,F47,C47) -> 5.06
A48: KVANHA | B48: 2 | C48: 5.4450000000000003 | D48: 30 | E48: 1 | F48: 5.5 | G48: 30 | H48: 3 | I48: 5.06 | J48: 32 | K48: 5 | L48: 4.95 | M48: 30 | N48: 7 | O48: 5.4450000000000003 | P48: 29 | Q48: 8 | R48: 5.5 | S48: 30 | T48: 6 | U48: 5.5 | V48: 29 | W48: 4 | X48: 5.2779999999999996 | Y48: 31 | Z48: 241.91489361702128 | AA48: =+(X48+U48+R48+O48+L48+I48+F48+C48)/8 -> 5.3347499999999997 | AB48: =MINA(X48,U48,R48,O48,L48,I48,F48,C48) -> 4.95
A49: DINHO | B49: 8 | C49: 5.06 | D49: 31 | E49: 6 | F49: 5.0590000000000002 | G49: 30 | H49: 4 | I49: 5.1150000000000002 | J49: 27 | K49: 2 | L49: 4.8949999999999996 | M49: 31 | N49: 1 | O49: 5.5 | P49: 26 | Q49: 3 | R49: 5.2779999999999996 | S49: 31 | T49: 5 | U49: 5.28 | V49: 28 | W49: 7 | X49: 5.2789999999999999 | Y49: 31 | Z49: 236.06382978723406 | AA49: =+(X49+U49+R49+O49+L49+I49+F49+C49)/8 -> 5.1832500000000001 | AB49: =MINA(X49,U49,R49,O49,L49,I49,F49,C49) -> 4.8949999999999996