B1: CENCO ODONTOLOGIA SOB A PESSOA DO DR. MARCIO GODOI.

A1: Pos | B1: Pilotos | C1: Pts 1º | D1: Pts 2º | E1: Total | F1: Vlts 1º | G1: Vlts 2º | H1: Total
A2: 1 | B2: DINHO | C2: 55 | D2: 60 | E2: =+D2+C2 -> 115 | F2: 261.29787234042556 | G2: 260.91489361702128 | H2: =+G2+F2 -> 522.21276595744689
A3: =+A2+1 -> 2 | B3: ANGELAO | C3: 60 | D3: 55 | E3: =+D3+C3 -> 115 | F3: 260.08510638297872 | G3: 261.08510638297872 | H3: =+G3+F3 -> 521.17021276595744
A4: =+A3+1 -> 3 | B4: JUNINHO | C4: 40 | D4: 65 | E4: =+D4+C4 -> 105 | F4: 264.10638297872339 | G4: 258.93617021276594 | H4: =+G4+F4 -> 523.04255319148933
A5: =+A4+1 -> 4 | B5: ANDERSON | C5: 65 | D5: 36 | E5: =+D5+C5 -> 101 | F5: 253.87234042553192 | G5: 263.10638297872339 | H5: =+G5+F5 -> 516.97872340425533
A6: =+A5+1 -> 5 | B6: MARCEL | C6: 50 | D6: 50 | E6: =+D6+C6 -> 100 | F6: 259.25531914893617 | G6: 259.68085106382978 | H6: =+G6+F6 -> 518.936170212766
A7: =+A6+1 -> 6 | B7: MICHEL | C7: 45 | D7: 40 | E7: =+D7+C7 -> 85 | F7: 256.21276595744683 | G7: 259.468085106383 | H7: =+G7+F7 -> 515.68085106382978
A8: =+A7+1 -> 7 | B8: ERUNDA | C8: 20 | D8: 45 | E8: =+D8+C8 -> 65 | F8: 256.78723404255317 | G8: 245.17021276595744 | H8: =+G8+F8 -> 501.95744680851061
A9: =+A8+1 -> 8 | B9: KLEBER | C9: 36 | D9: 24 | E9: =+D9+C9 -> 60 | F9: 249.25531914893617 | G9: 257.87234042553189 | H9: =+G9+F9 -> 507.12765957446805
A10: =+A9+1 -> 9 | B10: JULIO | C10: 28 | D10: 32 | E10: =+D10+C10 -> 60 | F10: 252.04255319148936 | G10: 253.85106382978722 | H10: =+G10+F10 -> 505.89361702127655
A11: =+A10+1 -> 10 | B11: RUBENS | C11: 14 | D11: 28 | E11: =+D11+C11 -> 42 | F11: 251.40425531914894 | G11: 236.61702127659575 | H11: =+G11+F11 -> 488.02127659574467
A12: =+A11+1 -> 11 | B12: BONGA | C12: 32 | D12: 8 | E12: =+D12+C12 -> 40 | F12: 205 | G12: 254.02127659574469 | H12: =+G12+F12 -> 459.02127659574467
A13: =+A12+1 -> 12 | B13: CAVERNA | C13: 24 | D13: 14 | E13: =+D13+C13 -> 38 | F13: 237.04255319148936 | G13: 247.68085106382978 | H13: =+G13+F13 -> 484.72340425531911
A14: =+A13+1 -> 13 | B14: GIOVANNI | C14: 17 | D14: 17 | E14: =+D14+C14 -> 34 | F14: 242.51063829787233 | G14: 243.21276595744681 | H14: =+G14+F14 -> 485.72340425531911
A15: =+A14+1 -> 14 | B15: GODOI | C15: 8 | D15: 20 | E15: =+D15+C15 -> 28 | F15: 246.27659574468086 | G15: 229.19148936170214 | H15: =+G15+F15 -> 475.468085106383
A16: =+A15+1 -> 15 | B16: GABRIEL | C16: 5 | D16: 11 | E16: =+D16+C16 -> 16 | F16: 222.12765957446808 | G16: 224.17021276595744 | H16: =+G16+F16 -> 446.29787234042556
A17: =+A16+1 -> 16 | B17: CAVANHA | C17: 11 | D17: 0 | E17: =+D17+C17 -> 11 | F17: 0 | G17: 235.2340425531915 | H17: =+G17+F17 -> 235.2340425531915