A1: Nome | B1: P | C1: M.VOL | D1: B1 | E1: P | F1: M.VOL | G1: B2 | H1: P | I1: M.VOL | J1: B3 | K1: P | L1: M.VOL | M1: B4 | N1: P | O1: M.VOL | P1: B5 | Q1: P | R1: M.VOL | S1: B6 | T1: P | U1: M.VOL | V1: B7 | W1: P | X1: M.VOL | Y1: B8 | Z1: TOTAL | AA1: MEDIA
A2: SAI DA FRENT | B2: 4 | C2: 4.95 | D2: 638 | E2: 2 | F2: 5.2789999999999999 | G2: 621 | H2: 1 | I2: 5.1779999999999999 | J2: 593 | K2: 3 | L2: 5.1139999999999999 | M2: 622 | N2: 5 | O2: 5.39 | P2: 590 | Q2: 7 | R2: 5.1870000000000003 | S2: 628 | T2: 8 | U2: 5.2210000000000001 | V2: 629 | W2: 6 | X2: 5.1150000000000002 | Y2: 568 | Z2: =+Y2+V2+S2+P2+M2+J2+G2+D2 -> 4889 | AA2: =+(X2+U2+R2+O2+L2+I2+F2+C2)/8 -> 5.1792500000000006
A3: EQUIPISTOLA | B3: 7 | C3: 4.8959999999999999 | D3: 614 | E3: 8 | F3: 5.0439999999999996 | G3: 618 | H3: 6 | I3: 5.06 | J3: 610 | K3: 4 | L3: 5.2249999999999996 | M3: 614 | N3: 2 | O3: 5.2859999999999996 | P3: 589 | Q3: 1 | R3: 5.39 | S3: 557 | T3: 3 | U3: 5.3869999999999996 | V3: 598 | W3: 5 | X3: 5.1689999999999996 | Y3: 607 | Z3: =+Y3+V3+S3+P3+M3+J3+G3+D3 -> 4807 | AA3: =+(X3+U3+R3+O3+L3+I3+F3+C3)/8 -> 5.1821250000000001
A4: MORTADELA | B4: 3 | C4: 5.0590000000000002 | D4: 581 | E4: 5 | F4: 5.06 | G4: 586 | H4: 7 | I4: 5.1150000000000002 | J4: 593 | K4: 8 | L4: 5.0609999999999999 | M4: 615 | N4: 6 | O4: 5.2960000000000003 | P4: 605 | Q4: 4 | R4: 5.1760000000000002 | S4: 579 | T4: 2 | U4: 5.2359999999999998 | V4: 575 | W4: 1 | X4: 5.39 | Y4: 534 | Z4: =+Y4+V4+S4+P4+M4+J4+G4+D4 -> 4668 | AA4: =+(X4+U4+R4+O4+L4+I4+F4+C4)/8 -> 5.1741250000000001
A5: VEIA LOCA | B5: 6 | C5: 5.335 | D5: 575 | E5: 4 | F5: 5.2960000000000003 | G5: 572 | H5: 2 | I5: 5.3319999999999999 | J5: 550 | K5: 1 | L5: 5.39 | M5: 557 | N5: 3 | O5: 5.4450000000000003 | P5: 569 | Q5: 5 | R5: 5.335 | S5: 569 | T5: 7 | U5: 5.1689999999999996 | V5: 580 | W5: 8 | X5: 5.335 | Y5: 563 | Z5: =+Y5+V5+S5+P5+M5+J5+G5+D5 -> 4535 | AA5: =+(X5+U5+R5+O5+L5+I5+F5+C5)/8 -> 5.3296250000000001
A6: HOT HEAD | B6: 5 | C6: 4.5650000000000004 | D6: 565 | E6: 7 | F6: 5.17 | G6: 554 | H6: 8 | I6: 5.2809999999999997 | J6: 546 | K6: 6 | L6: 5.17 | M6: 588 | N6: 4 | O6: 5.1760000000000002 | P6: 584 | Q6: 2 | R6: 5.3959999999999999 | S6: 548 | T6: 1 | U6: 5.4980000000000002 | V6: 537 | W6: 3 | X6: 5.3259999999999996 | Y6: 555 | Z6: =+Y6+V6+S6+P6+M6+J6+G6+D6 -> 4477 | AA6: =+(X6+U6+R6+O6+L6+I6+F6+C6)/8 -> 5.1977500000000001
A7: GOSMENT | B7: 8 | C7: 5.1710000000000003 | D7: 565 | E7: 6 | F7: 5.1689999999999996 | G7: 553 | H7: 4 | I7: 5.2759999999999998 | J7: 530 | K7: 2 | L7: 5.3890000000000002 | M7: 493 | N7: 1 | O7: 5.6079999999999997 | P7: 510 | Q7: 3 | R7: 5.2240000000000002 | S7: 585 | T7: 5 | U7: 5.2249999999999996 | V7: 565 | W7: 7 | X7: 5.1139999999999999 | Y7: 581 | Z7: =+Y7+V7+S7+P7+M7+J7+G7+D7 -> 4382 | AA7: =+(X7+U7+R7+O7+L7+I7+F7+C7)/8 -> 5.2719999999999994
A8: ATRASADOS | B8: 1 | C8: 5.444 | D8: 443 | E8: 3 | F8: 5.2240000000000002 | G8: 568 | H8: 5 | I8: 5.4450000000000003 | J8: 522 | K8: 7 | L8: 5.4349999999999996 | M8: 562 | N8: 8 | O8: 5.226 | P8: 587 | Q8: 6 | R8: 5.335 | S8: 530 | T8: 4 | U8: 5.1150000000000002 | V8: 571 | W8: 2 | X8: 4.5090000000000003 | Y8: 456 | Z8: =+Y8+V8+S8+P8+M8+J8+G8+D8 -> 4239 | AA8: =+(X8+U8+R8+O8+L8+I8+F8+C8)/8 -> 5.2166250000000005
A9: RACHID S | B9: 2 | C9: 5.4459999999999997 | D9: 530 | E9: 1 | F9: 6.1580000000000004 | G9: 449 | H9: 3 | I9: 5.8789999999999996 | J9: 495 | K9: 5 | L9: 5.1319999999999997 | M9: 493 | N9: 7 | O9: 5.72 | P9: 469 | Q9: 8 | R9: 5.774 | S9: 391 | T9: 6 | U9: 5.9870000000000001 | V9: 470 | W9: 4 | X9: 5.8780000000000001 | Y9: 500 | Z9: =+Y9+V9+S9+P9+M9+J9+G9+D9 -> 3797 | AA9: =+(X9+U9+R9+O9+L9+I9+F9+C9)/8 -> 5.7467499999999996