A1: Bateria 1
A2: Piloto | B2: P | C2: Tempo | D2: Vol | E2: P | F2: Tempo | G2: Vol | H2: P | I2: Tempo | J2: Vol | K2: P | L2: Tempo | M2: Vol | N2: P | O2: Tempo | P2: Vol | Q2: P | R2: Tempo | S2: Vol | T2: P | U2: Tempo | V2: Vol | W2: P | X2: Tempo | Y2: Vol | Z2: Total | AA2: Media | AB2: Record
A3: KLEBER | B3: 7 | C3: 5.5549999999999997 | D3: 28 | E3: 8 | F3: 5.4989999999999997 | G3: 29 | H3: 6 | I3: 5.5 | J3: 30 | K3: 4 | L3: 5.5549999999999997 | M3: 29 | N3: 2 | O3: 5.4980000000000002 | P3: 30 | Q3: 1 | R3: 5.72 | S3: 27 | T3: 3 | U3: 5.6079999999999997 | V3: 29 | W3: 5 | X3: 4.9509999999999996 | Y3: 30 | Z3: 232.7659574468085 | AA3: =+(X3+U3+R3+O3+L3+I3+F3+C3)/8 -> 5.4857500000000003 | AB3: =MINA(X3,U3,R3,O3,L3,I3,F3,C3) -> 4.9509999999999996
A4: MANE | B4: 1 | C4: 5.9390000000000001 | D4: 24 | E4: 3 | F4: 5.61 | G4: 28 | H4: 5 | I4: 5.6589999999999998 | J4: 27 | K4: 7 | L4: 5.5490000000000004 | M4: 28 | N4: 8 | O4: 5.39 | P4: 29 | Q4: 6 | R4: 4.7320000000000002 | S4: 29 | T4: 4 | U4: 5.6079999999999997 | V4: 28 | W4: 2 | X4: 5.173 | Y4: 26 | Z4: 219.91489361702128 | AA4: =+(X4+U4+R4+O4+L4+I4+F4+C4)/8 -> 5.4574999999999996 | AB4: =MINA(X4,U4,R4,O4,L4,I4,F4,C4) -> 4.7320000000000002
A5: SANDRO ITU | B5: 6 | C5: 5.8280000000000003 | D5: 27 | E5: 4 | F5: 5.883 | G5: 26 | H5: 2 | I5: 6.05 | J5: 23 | K5: 1 | L5: 6.3239999999999998 | M5: 25 | N5: 3 | O5: 6.1040000000000001 | P5: 25 | Q5: 5 | R5: 5.17 | S5: 27 | T5: 7 | U5: 5.8840000000000003 | V5: 25 | W5: 8 | X5: 5.8840000000000003 | Y5: 28 | Z5: 206.14893617021278 | AA5: =+(X5+U5+R5+O5+L5+I5+F5+C5)/8 -> 5.8908750000000003 | AB5: =MINA(X5,U5,R5,O5,L5,I5,F5,C5) -> 5.17
A6: XUBAKA | B6: 3 | C6: 6.3239999999999998 | D6: 24 | E6: 5 | F6: 6.048 | G6: 23 | H6: 7 | I6: 6.048 | J6: 26 | K6: 8 | L6: 6.1050000000000004 | M6: 22 | N6: 6 | O6: 6.1580000000000004 | P6: 24 | Q6: 4 | R6: 6.0519999999999996 | S6: 24 | T6: 2 | U6: 5.9960000000000004 | V6: 26 | W6: 1 | X6: 6.16 | Y6: 23 | Z6: 192.31914893617022 | AA6: =+(X6+U6+R6+O6+L6+I6+F6+C6)/8 -> 6.1113749999999998 | AB6: =MINA(X6,U6,R6,O6,L6,I6,F6,C6) -> 5.9960000000000004
A7: DANIEL | B7: 2 | C7: 7.04 | D7: 20 | E7: 1 | F7: 6.875 | G7: 21 | H7: 3 | I7: 6.5439999999999996 | J7: 22 | K7: 5 | L7: 6.4889999999999999 | M7: 20 | N7: 7 | O7: 6.5430000000000001 | P7: 22 | Q7: 8 | R7: 6.5439999999999996 | S7: 16 | T7: 6 | U7: 6.6559999999999997 | V7: 23 | W7: 4 | X7: 6.7670000000000003 | Y7: 22 | Z7: 166.2340425531915 | AA7: =+(X7+U7+R7+O7+L7+I7+F7+C7)/8 -> 6.6822499999999989 | AB7: =MINA(X7,U7,R7,O7,L7,I7,F7,C7) -> 6.4889999999999999
A8: FLAVIO | B8: 8 | C8: 6.71 | D8: 18 | E8: 6 | F8: 6.49 | G8: 19 | H8: 4 | I8: 6.4889999999999999 | J8: 20 | K8: 2 | L8: 6.4470000000000001 | M8: 24 | N8: 1 | O8: 6.5990000000000002 | P8: 20 | Q8: 3 | R8: 6.3239999999999998 | S8: 24 | T8: 5 | U8: 6.5460000000000003 | V8: 19 | W8: 7 | X8: 6.2690000000000001 | Y8: 22 | Z8: 166.21276595744681 | AA8: =+(X8+U8+R8+O8+L8+I8+F8+C8)/8 -> 6.4842500000000003 | AB8: =MINA(X8,U8,R8,O8,L8,I8,F8,C8) -> 6.2690000000000001
A9: LUIZ FELIPE | B9: 4 | C9: 6.3819999999999997 | D9: 16 | E9: 2 | F9: 9.24 | G9: 7 | H9: 1 | I9: 6.6 | J9: 15 | K9: 3 | L9: 6.6559999999999997 | M9: 17 | N9: 5 | O9: 6.5460000000000003 | P9: 16 | Q9: 7 | R9: 6.4850000000000003 | S9: 19 | T9: 8 | U9: 6.4349999999999996 | V9: 17 | W9: 6 | X9: 6.5990000000000002 | Y9: 19 | Z9: 126.55319148936171 | AA9: =+(X9+U9+R9+O9+L9+I9+F9+C9)/8 -> 6.8678749999999997 | AB9: =MINA(X9,U9,R9,O9,L9,I9,F9,C9) -> 6.3819999999999997
A11: Bateria 2
A12: Piloto | B12: P | C12: Tempo | D12: Vol | E12: P | F12: Tempo | G12: Vol | H12: P | I12: Tempo | J12: Vol | K12: P | L12: Tempo | M12: Vol | N12: P | O12: Tempo | P12: Vol | Q12: P | R12: Tempo | S12: Vol | T12: P | U12: Tempo | V12: Vol | W12: P | X12: Tempo | Y12: Vol | Z12: Total | AA12: Media | AB12: Record
A13: RICARDO | B13: 2 | C13: 5.7720000000000002 | D13: 29 | E13: 1 | F13: 5.7770000000000001 | G13: 29 | H13: 3 | I13: 5.6120000000000001 | J13: 29 | K13: 5 | L13: 5.718 | M13: 29 | N13: 7 | O13: 5.6639999999999997 | P13: 28 | Q13: 8 | R13: 5.609 | S13: 29 | T13: 6 | U13: 5.61 | V13: 28 | W13: 4 | X13: 5.7619999999999996 | Y13: 28 | Z13: 229.80851063829786 | AA13: =+(X13+U13+R13+O13+L13+I13+F13+C13)/8 -> 5.6905000000000001 | AB13: =MINA(X13,U13,R13,O13,L13,I13,F13,C13) -> 5.609
A14: JERONIMO | B14: 1 | C14: 5.6660000000000004 | D14: 28 | E14: 3 | F14: 5.7190000000000003 | G14: 27 | H14: 5 | I14: 5.5540000000000003 | J14: 29 | K14: 7 | L14: 5.2270000000000003 | M14: 29 | N14: 8 | O14: 5.5060000000000002 | P14: 29 | Q14: 6 | R14: 5.34 | S14: 29 | T14: 4 | U14: 5.556 | V14: 26 | W14: 2 | X14: 5.6109999999999998 | Y14: 25 | Z14: 222.7659574468085 | AA14: =+(X14+U14+R14+O14+L14+I14+F14+C14)/8 -> 5.5223750000000003 | AB14: =MINA(X14,U14,R14,O14,L14,I14,F14,C14) -> 5.2270000000000003
A15: JULIO | B15: 8 | C15: 5.7220000000000004 | D15: 28 | E15: 6 | F15: 5.55 | G15: 31 | H15: 4 | I15: 5.8280000000000003 | J15: 22 | K15: 2 | L15: 5.718 | M15: 26 | N15: 1 | O15: 5.8849999999999998 | P15: 26 | Q15: 3 | R15: 5.5609999999999999 | S15: 28 | T15: 5 | U15: 5.5540000000000003 | V15: 30 | W15: 7 | X15: 5.4889999999999999 | Y15: 31 | Z15: 222.17021276595744 | AA15: =+(X15+U15+R15+O15+L15+I15+F15+C15)/8 -> 5.6633749999999994 | AB15: =MINA(X15,U15,R15,O15,L15,I15,F15,C15) -> 5.4889999999999999
A16: JAPAO | B16: 3 | C16: 5.83 | D16: 28 | E16: 5 | F16: 5.7770000000000001 | G16: 28 | H16: 7 | I16: 5.2240000000000002 | J16: 29 | K16: 8 | L16: 6.05 | M16: 27 | N16: 6 | O16: 5.9379999999999997 | P16: 28 | Q16: 4 | R16: 5.9089999999999998 | S16: 27 | T16: 2 | U16: 5.9390000000000001 | V16: 27 | W16: 1 | X16: 5.9939999999999998 | Y16: 27 | Z16: 221.38297872340425 | AA16: =+(X16+U16+R16+O16+L16+I16+F16+C16)/8 -> 5.8326250000000002 | AB16: =MINA(X16,U16,R16,O16,L16,I16,F16,C16) -> 5.2240000000000002
A17: CAVANHA | B17: 4 | C17: 5.7190000000000003 | D17: 27 | E17: 2 | F17: 5.774 | G17: 29 | H17: 1 | I17: 5.8860000000000001 | J17: 27 | K17: 3 | L17: 5.83 | M17: 23 | N17: 5 | O17: 5.7759999999999998 | P17: 28 | Q17: 7 | R17: 5.7750000000000004 | S17: 28 | T17: 8 | U17: 5.9390000000000001 | V17: 27 | W17: 6 | X17: 5.72 | Y17: 29 | Z17: 218.85106382978722 | AA17: =+(X17+U17+R17+O17+L17+I17+F17+C17)/8 -> 5.8023750000000005 | AB17: =MINA(X17,U17,R17,O17,L17,I17,F17,C17) -> 5.7190000000000003
A18: GERONIMO | B18: 6 | C18: 6.0490000000000004 | D18: 25 | E18: 4 | F18: 5.9969999999999999 | G18: 26 | H18: 2 | I18: 6.2149999999999999 | J18: 25 | K18: 1 | L18: 6.38 | M18: 25 | N18: 3 | O18: 6.27 | P18: 27 | Q18: 5 | R18: 6.05 | S18: 26 | T18: 7 | U18: 5.9969999999999999 | V18: 28 | W18: 8 | X18: 6.1050000000000004 | Y18: 27 | Z18: 209.65957446808511 | AA18: =+(X18+U18+R18+O18+L18+I18+F18+C18)/8 -> 6.1328749999999994 | AB18: =MINA(X18,U18,R18,O18,L18,I18,F18,C18) -> 5.9969999999999999
A19: RUDSON | B19: 7 | C19: 6.2720000000000002 | D19: 27 | E19: 8 | F19: 6.2149999999999999 | G19: 26 | H19: 6 | I19: 5.7759999999999998 | J19: 28 | K19: 4 | L19: 6.234 | M19: 26 | N19: 2 | O19: 6.2679999999999998 | P19: 24 | Q19: 1 | R19: 6.3789999999999996 | S19: 18 | T19: 3 | U19: 5.9930000000000003 | V19: 26 | W19: 5 | X19: 5.9939999999999998 | Y19: 27 | Z19: 202.78723404255319 | AA19: =+(X19+U19+R19+O19+L19+I19+F19+C19)/8 -> 6.1413750000000009 | AB19: =MINA(X19,U19,R19,O19,L19,I19,F19,C19) -> 5.7759999999999998
A20: GODOI | B20: 5 | C20: 5.8319999999999999 | D20: 27 | E20: 7 | F20: 5.5490000000000004 | G20: 29 | H20: 8 | I20: 5.55 | J20: 30 | K20: 6 | L20: 5.5549999999999997 | M20: 22 | N20: 4 | O20: 5.5990000000000002 | P20: 17 | Z20: 125 | AA20: =+(O20+L20+I20+F20+C20)/5 -> 5.617 | AB20: =MINA(X20,U20,R20,O20,L20,I20,F20,C20) -> 5.5490000000000004
A22: Bateria 3
A23: Piloto | B23: P | C23: Tempo | D23: Vol | E23: P | F23: Tempo | G23: Vol | H23: P | I23: Tempo | J23: Vol | K23: P | L23: Tempo | M23: Vol | N23: P | O23: Tempo | P23: Vol | Q23: P | R23: Tempo | S23: Vol | T23: P | U23: Tempo | V23: Vol | W23: P | X23: Tempo | Y23: Vol | Z23: Total | AA23: Media | AB23: Record
A24: ERUNDA | B24: 5 | C24: 5.61 | D24: 28 | E24: 7 | F24: 5.6180000000000003 | G24: 29 | H24: 8 | I24: 5.72 | J24: 28 | K24: 6 | L24: 5.6669999999999998 | M24: 30 | N24: 4 | O24: 5.17 | P24: 28 | Q24: 2 | R24: 5.6109999999999998 | S24: 30 | T24: 1 | U24: 5.6630000000000003 | V24: 27 | W24: 3 | X24: 5.6630000000000003 | Y24: 29 | Z24: 229.29787234042553 | AA24: =+(X24+U24+R24+O24+L24+I24+F24+C24)/8 -> 5.5902500000000002 | AB24: =MINA(X24,U24,R24,O24,L24,I24,F24,C24) -> 5.17
A25: ANGELAO | B25: 8 | C25: 5.718 | D25: 27 | E25: 6 | F25: 5.5 | G25: 30 | H25: 4 | I25: 5.609 | J25: 29 | K25: 2 | L25: 5.665 | M25: 28 | N25: 1 | O25: 5.9329999999999998 | P25: 27 | Q25: 3 | R25: 5.61 | S25: 30 | T25: 5 | U25: 5.718 | V25: 26 | W25: 7 | X25: 5.3920000000000003 | Y25: 28 | Z25: 225.82978723404256 | AA25: =+(X25+U25+R25+O25+L25+I25+F25+C25)/8 -> 5.6431250000000004 | AB25: =MINA(X25,U25,R25,O25,L25,I25,F25,C25) -> 5.3920000000000003
A26: POWER | B26: 3 | C26: 5.7750000000000004 | D26: 26 | E26: 5 | F26: 5.5549999999999997 | G26: 29 | H26: 7 | I26: 5.6639999999999997 | J26: 27 | K26: 8 | L26: 5.7729999999999997 | M26: 26 | N26: 6 | O26: 5.335 | P26: 29 | Q26: 4 | R26: 5.6630000000000003 | S26: 28 | T26: 2 | U26: 5.7770000000000001 | V26: 27 | W26: 1 | X26: 6.05 | Y26: 26 | Z26: 218.61702127659575 | AA26: =+(X26+U26+R26+O26+L26+I26+F26+C26)/8 -> 5.6989999999999998 | AB26: =MINA(X26,U26,R26,O26,L26,I26,F26,C26) -> 5.335
A27: RUBENS | B27: 6 | C27: 5.7729999999999997 | D27: 29 | E27: 4 | F27: 5.718 | G27: 27 | H27: 2 | I27: 5.8319999999999999 | J27: 29 | K27: 1 | L27: 5.8849999999999998 | M27: 28 | N27: 3 | O27: 5.718 | P27: 29 | Q27: 5 | R27: 5.7750000000000004 | S27: 22 | T27: 7 | U27: 5.6669999999999998 | V27: 26 | W27: 8 | X27: 5.6630000000000003 | Y27: 28 | Z27: 218.42553191489361 | AA27: =+(X27+U27+R27+O27+L27+I27+F27+C27)/8 -> 5.753874999999999 | AB27: =MINA(X27,U27,R27,O27,L27,I27,F27,C27) -> 5.6630000000000003
A28: ERIC | B28: 4 | C28: 5.8849999999999998 | D28: 26 | E28: 2 | F28: 5.7750000000000004 | G28: 27 | H28: 1 | I28: 5.9950000000000001 | J28: 28 | K28: 3 | L28: 5.835 | M28: 27 | N28: 5 | O28: 5.8250000000000002 | P28: 28 | Q28: 7 | R28: 5.6639999999999997 | S28: 28 | T28: 8 | U28: 5.6660000000000004 | V28: 25 | W28: 6 | X28: 5.7750000000000004 | Y28: 27 | Z28: 216.74468085106383 | AA28: =+(X28+U28+R28+O28+L28+I28+F28+C28)/8 -> 5.8025000000000002 | AB28: =MINA(X28,U28,R28,O28,L28,I28,F28,C28) -> 5.6639999999999997
A29: NETO | B29: 1 | C29: 6.05 | D29: 24 | E29: 3 | F29: 5.8849999999999998 | G29: 28 | H29: 5 | I29: 5.718 | J29: 28 | K29: 7 | L29: 5.72 | M29: 25 | N29: 8 | O29: 5.72 | P29: 28 | Q29: 6 | R29: 5.609 | S29: 22 | T29: 4 | U29: 5.883 | V29: 27 | W29: 2 | X29: 5.7350000000000003 | Y29: 29 | Z29: 211.19148936170214 | AA29: =+(X29+U29+R29+O29+L29+I29+F29+C29)/8 -> 5.79 | AB29: =MINA(X29,U29,R29,O29,L29,I29,F29,C29) -> 5.609
A30: GIOVANNI | B30: 2 | C30: 5.9379999999999997 | D30: 25 | E30: 1 | F30: 6.0979999999999999 | G30: 21 | H30: 3 | I30: 5.79 | J30: 23 | K30: 5 | L30: 5.94 | M30: 24 | N30: 7 | O30: 5.4450000000000003 | P30: 25 | Q30: 8 | R30: 5.665 | S30: 26 | T30: 6 | U30: 5.883 | V30: 27 | W30: 4 | X30: 5.7750000000000004 | Y30: 28 | Z30: 199.31914893617022 | AA30: =+(X30+U30+R30+O30+L30+I30+F30+C30)/8 -> 5.8167500000000008 | AB30: =MINA(X30,U30,R30,O30,L30,I30,F30,C30) -> 5.4450000000000003
A31: CONRADO | B31: 7 | C31: 6.2690000000000001 | D31: 24 | E31: 8 | F31: 6.1050000000000004 | G31: 17 | H31: 6 | I31: 6.3760000000000003 | J31: 25 | K31: 4 | L31: 6.2679999999999998 | M31: 25 | N31: 2 | O31: 5.665 | P31: 25 | Q31: 1 | R31: 6.3230000000000004 | S31: 20 | T31: 3 | U31: 6.27 | V31: 22 | W31: 5 | X31: 6.492 | Y31: 16 | Z31: 174.21276595744681 | AA31: =+(X31+U31+R31+O31+L31+I31+F31+C31)/8 -> 6.2209999999999992 | AB31: =MINA(X31,U31,R31,O31,L31,I31,F31,C31) -> 5.665
A33: Bateria 4
A34: Piloto | B34: P | C34: Tempo | D34: Vol | E34: P | F34: Tempo | G34: Vol | H34: P | I34: Tempo | J34: Vol | K34: P | L34: Tempo | M34: Vol | N34: P | O34: Tempo | P34: Vol | Q34: P | R34: Tempo | S34: Vol | T34: P | U34: Tempo | V34: Vol | W34: P | X34: Tempo | Y34: Vol | Z34: Total | AA34: Media | AB34: Record
A35: MICHEL | B35: 6 | C35: 5.5030000000000001 | D35: 30 | E35: 4 | F35: 5.5529999999999999 | G35: 30 | H35: 2 | I35: 5.61 | J35: 30 | K35: 1 | L35: 5.6619999999999999 | M35: 28 | N35: 3 | O35: 5.4989999999999997 | P35: 31 | Q35: 5 | R35: 5.5549999999999997 | S35: 31 | T35: 7 | U35: 5.3879999999999999 | V35: 28 | W35: 8 | X35: 5.444 | Y35: 31 | Z35: 239.74468085106383 | AA35: =+(X35+U35+R35+O35+L35+I35+F35+C35)/8 -> 5.5267499999999998 | AB35: =MINA(X35,U35,R35,O35,L35,I35,F35,C35) -> 5.3879999999999999
A36: IMPORTADO | B36: 1 | C36: 5.72 | D36: 27 | E36: 3 | F36: 5.55 | G36: 31 | H36: 5 | I36: 5.4980000000000002 | J36: 30 | K36: 7 | L36: 4.7869999999999999 | M36: 32 | N36: 8 | O36: 5.391 | P36: 30 | Q36: 6 | R36: 5.3970000000000002 | S36: 30 | T36: 4 | U36: 5.5640000000000001 | V36: 30 | W36: 2 | X36: 5.6310000000000002 | Y36: 29 | Z36: 239.19148936170214 | AA36: =+(X36+U36+R36+O36+L36+I36+F36+C36)/8 -> 5.4422499999999987 | AB36: =MINA(X36,U36,R36,O36,L36,I36,F36,C36) -> 4.7869999999999999
A37: ANDERSON | B37: 8 | C37: 5.3970000000000002 | D37: 30 | E37: 6 | F37: 5.4459999999999997 | G37: 31 | H37: 4 | I37: 5.6079999999999997 | J37: 31 | K37: 2 | L37: 5.6660000000000004 | M37: 29 | N37: 1 | O37: 5.665 | P37: 30 | Q37: 3 | R37: 5.766 | S37: 29 | T37: 5 | U37: 5.6230000000000002 | V37: 28 | W37: 7 | X37: 5.6079999999999997 | Y37: 30 | Z37: 238.63829787234042 | AA37: =+(X37+U37+R37+O37+L37+I37+F37+C37)/8 -> 5.5973749999999995 | AB37: =MINA(X37,U37,R37,O37,L37,I37,F37,C37) -> 5.3970000000000002
A38: DINHO | B38: 3 | C38: 5.6660000000000004 | D38: 27 | E38: 5 | F38: 5.6630000000000003 | G38: 30 | H38: 7 | I38: 5.72 | J38: 29 | K38: 8 | L38: 5.6639999999999997 | M38: 30 | N38: 6 | O38: 5.665 | P38: 29 | Q38: 4 | R38: 5.665 | S38: 28 | T38: 2 | U38: 5.39 | V38: 29 | W38: 1 | X38: 5.7290000000000001 | Y38: 28 | Z38: 230.78723404255319 | AA38: =+(X38+U38+R38+O38+L38+I38+F38+C38)/8 -> 5.645249999999999 | AB38: =MINA(X38,U38,R38,O38,L38,I38,F38,C38) -> 5.39
A39: MARCEL | B39: 5 | C39: 5.5549999999999997 | D39: 28 | E39: 7 | F39: 5.5720000000000001 | G39: 29 | H39: 8 | I39: 5.61 | J39: 29 | K39: 6 | L39: 5.6180000000000003 | M39: 28 | N39: 4 | O39: 5.7210000000000001 | P39: 29 | Q39: 2 | R39: 5.7720000000000002 | S39: 27 | T39: 1 | U39: 5.9950000000000001 | V39: 27 | W39: 3 | X39: 5.819 | Y39: 27 | Z39: 224.68085106382978 | AA39: =+(X39+U39+R39+O39+L39+I39+F39+C39)/8 -> 5.7077499999999999 | AB39: =MINA(X39,U39,R39,O39,L39,I39,F39,C39) -> 5.5549999999999997
A40: CAVERNA | B40: 4 | C40: 5.7910000000000004 | D40: 28 | E40: 2 | F40: 5.7210000000000001 | G40: 27 | H40: 1 | I40: 6.1020000000000003 | J40: 19 | K40: 3 | L40: 5.7880000000000003 | M40: 29 | N40: 5 | O40: 5.7770000000000001 | P40: 27 | Q40: 7 | R40: 5.6079999999999997 | S40: 31 | T40: 8 | U40: 5.665 | V40: 28 | W40: 6 | X40: 5.61 | Y40: 28 | Z40: 217.82978723404256 | AA40: =+(X40+U40+R40+O40+L40+I40+F40+C40)/8 -> 5.7577499999999997 | AB40: =MINA(X40,U40,R40,O40,L40,I40,F40,C40) -> 5.6079999999999997
A41: BONGA | B41: 2 | C41: 5.8929999999999998 | D41: 26 | E41: 1 | F41: 5.883 | G41: 28 | H41: 3 | I41: 5.83 | J41: 26 | K41: 5 | L41: 5.7729999999999997 | M41: 28 | N41: 7 | O41: 5.9429999999999996 | P41: 25 | Q41: 8 | R41: 5.8860000000000001 | S41: 28 | T41: 6 | U41: 5.9950000000000001 | V41: 27 | W41: 4 | X41: 5.8310000000000004 | Y41: 26 | Z41: 214.65957446808511 | AA41: =+(X41+U41+R41+O41+L41+I41+F41+C41)/8 -> 5.8792500000000008 | AB41: =MINA(X41,U41,R41,O41,L41,I41,F41,C41) -> 5.7729999999999997
A42: MARQUINHO | B42: 7 | C42: 5.931 | D42: 23 | E42: 8 | F42: 5.5620000000000003 | G42: 30 | H42: 6 | I42: 5.61 | J42: 28 | K42: 4 | L42: 5.6639999999999997 | M42: 28 | N42: 2 | O42: 5.83 | P42: 26 | Q42: 1 | R42: 6.2720000000000002 | S42: 20 | T42: 3 | U42: 5.9939999999999998 | V42: 24 | W42: 5 | X42: 5.8280000000000003 | Y42: 27 | Z42: 207.89361702127658 | AA42: =+(X42+U42+R42+O42+L42+I42+F42+C42)/8 -> 5.8363749999999994 | AB42: =MINA(X42,U42,R42,O42,L42,I42,F42,C42) -> 5.5620000000000003