A1: Nome | B1: P | C1: Tempo | D1: Vol | E1: P | F1: Tempo | G1: Vol | H1: P | I1: Tempo | J1: Vol | K1: P | L1: Tempo | M1: Vol | N1: P | O1: Tempo | P1: Vol | Q1: P | R1: Tempo | S1: Vol | T1: P | U1: Tempo | V1: Vol | W1: P | X1: Tempo | Y1: Vol | Z1: Total | AA1: Media | AB1: Record
A2: MARC / MICH | B2: 6 | C2: 5.28 | D2: 42 | E2: 4 | F2: 5.39 | G2: 46 | H2: 2 | I2: 5.39 | J2: 48 | K2: 1 | L2: 5.6109999999999998 | M2: 44 | N2: 3 | O2: 5.335 | P2: 49 | Q2: 5 | R2: 5.5 | S2: 39 | T2: 7 | U2: 5.2149999999999999 | V2: 48 | W2: 8 | X2: 5.28 | Y2: 45 | Z2: 361 | AA2: =+(X2+U2+R2+O2+L2+I2+F2+C2)/8 -> 5.3751250000000006 | AB2: =MINA(X2,U2,R2,O2,L2,I2,F2,C2) -> 5.2149999999999999
A3: KLEB / DINHO | B3: 3 | C3: 5.28 | D3: 42 | E3: 5 | F3: 5.3330000000000002 | G3: 43 | H3: 7 | I3: 5.3810000000000002 | J3: 47 | K3: 8 | L3: 5.4989999999999997 | M3: 47 | N3: 6 | O3: 5.3339999999999996 | P3: 48 | Q3: 4 | R3: 5.5 | S3: 38 | T3: 2 | U3: 5.28 | V3: 40 | W3: 1 | X3: 5.5 | Y3: 39 | Z3: 345 | AA3: =+(X3+U3+R3+O3+L3+I3+F3+C3)/8 -> 5.3883749999999999 | AB3: =MINA(X3,U3,R3,O3,L3,I3,F3,C3) -> 5.28
A4: ERIC / GIOV | B4: 7 | C4: 5.5 | D4: 38 | E4: 8 | F4: 5.125 | G4: 44 | H4: 6 | I4: 5.39 | J4: 45 | K4: 4 | L4: 5.5 | M4: 44 | N4: 2 | O4: 5.4980000000000002 | P4: 47 | Q4: 1 | R4: 4.62 | S4: 35 | T4: 3 | U4: 5.06 | V4: 44 | W4: 5 | X4: 5.28 | Y4: 46 | Z4: 343 | AA4: =+(X4+U4+R4+O4+L4+I4+F4+C4)/8 -> 5.2466249999999999 | AB4: =MINA(X4,U4,R4,O4,L4,I4,F4,C4) -> 4.62
A5: ANDE / ANGEL | B5: 8 | C5: 5.28 | D5: 44 | E5: 6 | F5: 5.3330000000000002 | G5: 44 | H5: 4 | I5: 5.27 | J5: 48 | K5: 2 | L5: 5.335 | M5: 50 | N5: 1 | O5: 5.28 | P5: 49 | Q5: 3 | R5: 5.28 | S5: 28 | T5: 5 | U5: 5.06 | V5: 34 | W5: 7 | X5: 4.9530000000000003 | Y5: 43 | Z5: 340 | AA5: =+(X5+U5+R5+O5+L5+I5+F5+C5)/8 -> 5.2238750000000005 | AB5: =MINA(X5,U5,R5,O5,L5,I5,F5,C5) -> 4.9530000000000003
A6: RICA / GOROI | B6: 5 | C6: 5.72 | D6: 34 | E6: 7 | F6: 5.72 | G6: 38 | H6: 8 | I6: 5.665 | J6: 42 | K6: 6 | L6: 5.93 | M6: 43 | N6: 4 | O6: 5.72 | P6: 46 | Q6: 2 | R6: 5.72 | S6: 33 | T6: 1 | U6: 5.72 | V6: 45 | W6: 3 | X6: 5.93 | Y6: 42 | Z6: 323 | AA6: =+(X6+U6+R6+O6+L6+I6+F6+C6)/8 -> 5.765625 | AB6: =MINA(X6,U6,R6,O6,L6,I6,F6,C6) -> 5.665
A7: RACHIDS | B7: 1 | C7: 6.5460000000000003 | D7: 35 | E7: 3 | F7: 6.3810000000000002 | G7: 40 | H7: 5 | I7: 6.7089999999999996 | J7: 40 | K7: 7 | L7: 6.49 | M7: 32 | N7: 8 | O7: 6.6 | P7: 37 | Q7: 6 | R7: 4.62 | S7: 41 | T7: 4 | U7: 6.6 | V7: 35 | W7: 2 | X7: 6.38 | Y7: 36 | Z7: 297 | AA7: =+(X7+U7+R7+O7+L7+I7+F7+C7)/8 -> 6.2907500000000001 | AB7: =MINA(X7,U7,R7,O7,L7,I7,F7,C7) -> 4.62
A8: BONG / JUN | B8: 2 | C8: 6.1589999999999998 | D8: 19 | E8: 1 | F8: 5.5549999999999997 | G8: 33 | H8: 3 | I8: 5.62 | J8: 36 | K8: 5 | L8: 5.335 | M8: 43 | N8: 7 | O8: 5.4989999999999997 | P8: 44 | Q8: 8 | R8: 5.1150000000000002 | S8: 41 | T8: 6 | U8: 5.7210000000000001 | V8: 43 | W8: 4 | X8: 5.4980000000000002 | Y8: 35 | Z8: 294 | AA8: =+(X8+U8+R8+O8+L8+I8+F8+C8)/8 -> 5.5627500000000003 | AB8: =MINA(X8,U8,R8,O8,L8,I8,F8,C8) -> 5.1150000000000002
A9: GERA / CONR | B9: 4 | C9: 6.3120000000000003 | D9: 34 | E9: 2 | F9: 4.5640000000000001 | G9: 34 | H9: 1 | I9: 6.38 | J9: 39 | K9: 3 | L9: 6.82 | M9: 33 | N9: 5 | O9: 6.3789999999999996 | P9: 43 | Q9: 7 | R9: 6.82 | S9: 31 | T9: 8 | U9: 6.6 | V9: 33 | W9: 6 | X9: 6.6 | Y9: 37 | Z9: 284 | AA9: =+(X9+U9+R9+O9+L9+I9+F9+C9)/8 -> 6.3093750000000002 | AB9: =MINA(X9,U9,R9,O9,L9,I9,F9,C9) -> 4.5640000000000001