A1: Nome | B1: P | C1: M.VOL | D1: B1 | E1: P | F1: M.VOL | G1: B2 | H1: P | I1: M.VOL | J1: B3 | K1: P | L1: M.VOL | M1: B4 | N1: P | O1: M.VOL | P1: B5 | Q1: P | R1: M.VOL | S1: B6 | T1: P | U1: M.VOL | V1: B7 | W1: P | X1: M.VOL | Y1: B8 | Z1: TOTAL | AA1: MEDIA
A2: ALEX | B2: 2 | C2: 5.835 | D2: 25 | E2: 1 | F2: 6.2919999999999998 | G2: 25 | H2: 3 | I2: 5.91 | J2: 28 | K2: 5 | L2: 6.0990000000000002 | M2: 26 | N2: 7 | O2: 6.2 | P2: 27 | Q2: 8 | R2: 5.968 | S2: 27 | T2: 6 | U2: 5.944 | V2: 27 | W2: 4 | X2: 5.9640000000000004 | Y2: 27 | Z2: 212.72 | AA2: =+(X2+U2+R2+O2+L2+I2+F2+C2)/8 -> 6.0265000000000004
A3: GABRIEL | B3: 5 | C3: 5.8769999999999998 | D3: 26 | E3: 7 | F3: 5.9240000000000004 | G3: 26 | H3: 8 | I3: 5.9020000000000001 | J3: 27 | K3: 6 | L3: 5.782 | M3: 27 | N3: 4 | O3: 5.7670000000000003 | P3: 28 | Q3: 2 | R3: 5.9290000000000003 | S3: 26 | T3: 1 | U3: 6.423 | V3: 24 | W3: 3 | X3: 5.9850000000000003 | Y3: 27 | Z3: 211.4 | AA3: =+(X3+U3+R3+O3+L3+I3+F3+C3)/8 -> 5.9486250000000007
A4: CONRADO | B4: 7 | C4: 6.2910000000000004 | D4: 24 | E4: 8 | F4: 6.2149999999999999 | G4: 28 | H4: 6 | I4: 5.9909999999999997 | J4: 26 | K4: 4 | L4: 6.0679999999999996 | M4: 26 | N4: 2 | O4: 6.3440000000000003 | P4: 24 | Q4: 1 | R4: 6.3339999999999996 | S4: 23 | T4: 3 | U4: 6.1550000000000002 | V4: 25 | W4: 5 | X4: 6.0339999999999998 | Y4: 26 | Z4: 202.47 | AA4: =+(X4+U4+R4+O4+L4+I4+F4+C4)/8 -> 6.1790000000000003
A5: XUBAKA | B5: 4 | C5: 6.0350000000000001 | D5: 18 | E5: 2 | F5: 6.1689999999999996 | G5: 27 | H5: 1 | I5: 6.2290000000000001 | J5: 25 | K5: 3 | L5: 6.2080000000000002 | M5: 27 | N5: 5 | O5: 5.83 | P5: 27 | Q5: 7 | R5: 6.0419999999999998 | S5: 25 | T5: 8 | U5: 6.226 | V5: 25 | W5: 6 | X5: 6.069 | Y5: 28 | Z5: 202.6 | AA5: =+(X5+U5+R5+O5+L5+I5+F5+C5)/8 -> 6.1009999999999991
A6: SANDRO | B6: 6 | C6: 6.3639999999999999 | D6: 24 | E6: 4 | F6: 6.3579999999999997 | G6: 26 | H6: 2 | I6: 6.4359999999999999 | J6: 24 | K6: 1 | L6: 6.6180000000000003 | M6: 23 | N6: 3 | O6: 6.4850000000000003 | P6: 24 | Q6: 5 | R6: 6.4580000000000002 | S6: 24 | T6: 7 | U6: 6.4980000000000002 | V6: 20 | W6: 8 | X6: 6.4450000000000003 | Y6: 21 | Z6: 186.83 | AA6: =+(X6+U6+R6+O6+L6+I6+F6+C6)/8 -> 6.4577499999999999
A7: JERONIMO | B7: 3 | C7: 6.0960000000000001 | D7: 25 | E7: 5 | F7: 6.069 | G7: 24 | H7: 7 | I7: 6.1740000000000004 | J7: 22 | K7: 8 | L7: 5.9690000000000003 | M7: 24 | N7: 6 | O7: 6.0659999999999998 | P7: 24 | Q7: 4 | R7: 5.9539999999999997 | S7: 22 | T7: 2 | U7: 6.125 | V7: 22 | W7: 1 | X7: 6.2110000000000003 | Y7: 22 | Z7: 185.87 | AA7: =+(X7+U7+R7+O7+L7+I7+F7+C7)/8 -> 6.0830000000000002
A8: RODRIGO | B8: 1 | C8: 6.25 | D8: 20 | E8: 3 | F8: 5.8360000000000003 | G8: 23 | H8: 5 | I8: 3.2959999999999998 | J8: 27 | K8: 7 | L8: 6.26 | M8: 22 | N8: 8 | O8: 6.4320000000000004 | P8: 14 | Q8: 6 | R8: 6.1950000000000003 | S8: 20 | T8: 4 | U8: 5.8650000000000002 | V8: 24 | W8: 2 | X8: 6.0780000000000003 | Y8: 25 | Z8: 175.87 | AA8: =+(X8+U8+R8+O8+L8+I8+F8+C8)/8 -> 5.7764999999999995

A1: PISTA | B1: TEMPO | C1: NOME
A2: 1 | B2: 6.2290000000000001 | C2: XUBAKA
A3: 2 | B3: 5.835 | C3: ALEX
A4: 3 | B4: 5.8360000000000003 | C4: RODRIGO
A5: 4 | B5: 5.7670000000000003 | C5: GABRIEL
A6: 5 | B6: 5.83 | C6: XUBAKA
A7: 6 | B7: 5.782 | C7: GABRIEL
A8: 7 | B8: 5.9240000000000004 | C8: GABRIEL
A9: 8 | B9: 5.9020000000000001 | C9: GABRIEL