A1: Nome | B1: P | C1: M.VOL | D1: B1 | E1: P | F1: M.VOL | G1: B2 | H1: P | I1: M.VOL | J1: B3 | K1: P | L1: M.VOL | M1: B4 | N1: P | O1: M.VOL | P1: B5 | Q1: P | R1: M.VOL | S1: B6 | T1: P | U1: M.VOL | V1: B7 | W1: P | X1: M.VOL | Y1: B8 | Z1: TOTAL | AA1: MEDIA
A2: ERUNDA | B2: 3 | C2: 5.4569999999999999 | D2: 28 | E2: 5 | F2: 5.3310000000000004 | G2: 25 | H2: 7 | I2: 5.3449999999999998 | J2: 30 | K2: 8 | L2: 5.3659999999999997 | M2: 29 | N2: 6 | O2: 5.5060000000000002 | P2: 27 | Q2: 4 | R2: 5.258 | S2: 30 | T2: 2 | U2: 5.3140000000000001 | V2: 29 | W2: 1 | X2: 5.6749999999999998 | Y2: 28 | Z2: 226.74 | AA2: =+(X2+U2+R2+O2+L2+I2+F2+C2)/8 -> 5.4065000000000003
A3: BONGA | B3: 1 | C3: 6.2510000000000003 | D3: 23 | E3: 3 | F3: 5.5780000000000003 | G3: 27 | H3: 5 | I3: 5.3029999999999999 | J3: 29 | K3: 7 | L3: 5.7290000000000001 | M3: 28 | N3: 8 | O3: 5.657 | P3: 28 | Q3: 6 | R3: 5.6479999999999997 | S3: 30 | T3: 4 | U3: 5.7220000000000004 | V3: 29 | W3: 2 | X3: 5.8140000000000001 | Y3: 28 | Z3: 222.85 | AA3: =+(X3+U3+R3+O3+L3+I3+F3+C3)/8 -> 5.7127499999999998
A4: RUDSON | B4: 7 | C4: 5.7590000000000003 | D4: 26 | E4: 8 | F4: 5.3719999999999999 | G4: 27 | H4: 6 | I4: 5.51 | J4: 27 | K4: 4 | L4: 5.806 | M4: 27 | N4: 2 | O4: 6.0209999999999999 | P4: 24 | Q4: 1 | R4: 5.8479999999999999 | S4: 27 | T4: 3 | U4: 5.6050000000000004 | V4: 29 | W4: 5 | X4: 5.7640000000000002 | Y4: 28 | Z4: 215.23 | AA4: =+(X4+U4+R4+O4+L4+I4+F4+C4)/8 -> 5.7106250000000003
A5: ANGELAO | B5: 5 | C5: 5.5430000000000001 | D5: 25 | E5: 7 | F5: 5.1950000000000003 | G5: 26 | H5: 8 | I5: 5.1150000000000002 | J5: 29 | K5: 6 | L5: 3.0169999999999999 | M5: 27 | N5: 4 | O5: 5.6159999999999997 | P5: 26 | Q5: 2 | R5: 5.4470000000000001 | S5: 25 | T5: 1 | U5: 5.7110000000000003 | V5: 27 | W5: 3 | X5: 5.3849999999999998 | Y5: 27 | Z5: 212.28 | AA5: =+(X5+U5+R5+O5+L5+I5+F5+C5)/8 -> 5.1286249999999995
A6: NETO | B6: 4 | C6: 5.7220000000000004 | D6: 25 | E6: 2 | F6: 5.72 | G6: 9 | H6: 1 | I6: 5.9269999999999996 | J6: 25 | K6: 3 | L6: 5.5 | M6: 27 | N6: 5 | O6: 5.6120000000000001 | P6: 26 | Q6: 7 | R6: 5.7240000000000002 | S6: 25 | T6: 8 | U6: 5.8049999999999997 | V6: 26 | W6: 6 | X6: 5.6989999999999998 | Y6: 26 | Z6: 189.17 | AA6: =+(X6+U6+R6+O6+L6+I6+F6+C6)/8 -> 5.7136250000000004
A7: PACHECO | B7: 2 | C7: 6.8730000000000002 | D7: 21 | E7: 1 | F7: 5.7619999999999996 | G7: 22 | H7: 3 | I7: 6.3559999999999999 | J7: 23 | K7: 5 | L7: 6.4359999999999999 | M7: 20 | N7: 7 | O7: 6.2690000000000001 | P7: 21 | Q7: 8 | R7: 6.5149999999999997 | S7: 22 | T7: 6 | U7: 6.5 | V7: 24 | W7: 4 | X7: 3.3380000000000001 | Y7: 25 | Z7: 178.26 | AA7: =+(X7+U7+R7+O7+L7+I7+F7+C7)/8 -> 6.0061249999999999
A8: TIRSO | B8: 6 | C8: 6.6580000000000004 | D8: 16 | E8: 4 | F8: 6.694 | G8: 19 | H8: 2 | I8: 6.9409999999999998 | J8: 19 | K8: 1 | L8: 6.9390000000000001 | M8: 20 | N8: 3 | O8: 6.5430000000000001 | P8: 22 | Q8: 5 | R8: 6.7430000000000003 | S8: 21 | T8: 7 | U8: 6.3120000000000003 | V8: 22 | W8: 8 | X8: 6.173 | Y8: 24 | Z8: 163.21 | AA8: =+(X8+U8+R8+O8+L8+I8+F8+C8)/8 -> 6.6253750000000009

C1: BATERIA 4
A3: PISTA | B3: TEMPO | C3: NOME
A4: 1 | B4: 5.6749999999999998 | C4: ERUNDA
A5: 2 | B5: 5.3140000000000001 | C5: ERUNDA
A6: 3 | B6: 5.3849999999999998 | C6: ANGELAO
A7: 4 | B7: 5.258 | C7: ERUNDA
A8: 5 | B8: 5.3029999999999999 | C8: BONGA
A9: 6 | B9: 5.5060000000000002 | C9: ERUNDA
A10: 7 | B10: 5.1950000000000003 | C10: ANGELAO
A11: 8 | B11: 5.1150000000000002 | C11: ANGELAO