A1: Nome | B1: P | C1: M.VOL | D1: B1 | E1: P | F1: M.VOL | G1: B2 | H1: P | I1: M.VOL | J1: B3 | K1: P | L1: M.VOL | M1: B4 | N1: P | O1: M.VOL | P1: B5 | Q1: P | R1: M.VOL | S1: B6 | T1: P | U1: M.VOL | V1: B7 | W1: P | X1: M.VOL | Y1: B8 | Z1: TOTAL | AA1: MEDIA
A2: MICHEL | B2: 5 | C2: 5.0170000000000003 | D2: 28 | E2: 7 | F2: 5.3239999999999998 | G2: 31 | H2: 8 | I2: 5.1710000000000003 | J2: 30 | K2: 6 | L2: 5.0049999999999999 | M2: 32 | N2: 4 | O2: 5.4279999999999999 | P2: 30 | Q2: 2 | R2: 5.6509999999999998 | S2: 29 | T2: 1 | U2: 5.7619999999999996 | V2: 29 | W2: 3 | X2: 5.3550000000000004 | Y2: 30 | Z2: 239.11 | AA2: =+(X2+U2+R2+O2+L2+I2+F2+C2)/8 -> 5.3391250000000001
A3: KLEBER | B3: 6 | C3: 5.5449999999999999 | D3: 28 | E3: 4 | F3: 5.8540000000000001 | G3: 29 | H3: 2 | I3: 5.7949999999999999 | J3: 27 | K3: 1 | L3: 5.7489999999999997 | M3: 29 | N3: 3 | O3: 5.5519999999999996 | P3: 29 | Q3: 5 | R3: 5.7549999999999999 | S3: 26 | T3: 7 | U3: 5.3259999999999996 | V3: 29 | W3: 8 | X3: 5.3769999999999998 | Y3: 30 | Z3: 227.64 | AA3: =+(X3+U3+R3+O3+L3+I3+F3+C3)/8 -> 5.6191249999999995
A4: JEISON | B4: 2 | C4: 5.6609999999999996 | D4: 27 | E4: 1 | F4: 6.1390000000000002 | G4: 27 | H4: 3 | I4: 5.7249999999999996 | J4: 27 | K4: 5 | L4: 5.9740000000000002 | M4: 24 | N4: 7 | O4: 5.87 | P4: 28 | Q4: 8 | R4: 5.9329999999999998 | S4: 27 | T4: 6 | U4: 5.7770000000000001 | V4: 29 | W4: 4 | X4: 5.8680000000000003 | Y4: 28 | Z4: 217.53 | AA4: =+(X4+U4+R4+O4+L4+I4+F4+C4)/8 -> 5.8683750000000003
A5: RICARDO | B5: 3 | C5: 5.7709999999999999 | D5: 26 | E5: 5 | F5: 5.742 | G5: 27 | H5: 7 | I5: 5.7149999999999999 | J5: 29 | K5: 8 | L5: 5.5949999999999998 | M5: 28 | N5: 6 | O5: 5.7110000000000003 | P5: 26 | Q5: 4 | R5: 5.8630000000000004 | S5: 28 | T5: 2 | U5: 5.8079999999999998 | V5: 26 | W5: 1 | X5: 6.2409999999999997 | Y5: 26 | Z5: 216.66 | AA5: =+(X5+U5+R5+O5+L5+I5+F5+C5)/8 -> 5.8057499999999989
A6: MARQUINHO | B6: 4 | C6: 5.5469999999999997 | D6: 28 | E6: 2 | F6: 5.6459999999999999 | G6: 26 | H6: 1 | I6: 5.9969999999999999 | J6: 13 | K6: 3 | L6: 6.2110000000000003 | M6: 23 | N6: 5 | O6: 5.8840000000000003 | P6: 22 | Q6: 7 | R6: 5.6829999999999998 | S6: 28 | T6: 8 | U6: 5.7770000000000001 | V6: 29 | W6: 6 | X6: 5.8730000000000002 | Y6: 26 | Z6: 195.32 | AA6: =+(X6+U6+R6+O6+L6+I6+F6+C6)/8 -> 5.8272499999999994
A7: CAIO | B7: 7 | C7: 5.9729999999999999 | D7: 22 | E7: 8 | F7: 5.6550000000000002 | G7: 22 | H7: 6 | I7: 5.86 | J7: 25 | K7: 4 | L7: 5.8819999999999997 | M7: 25 | N7: 2 | O7: 6.0279999999999996 | P7: 24 | Q7: 1 | R7: 5.9859999999999998 | S7: 25 | T7: 3 | U7: 5.9569999999999999 | V7: 24 | W7: 5 | X7: 5.9950000000000001 | Y7: 25 | Z7: 192.11 | AA7: =+(X7+U7+R7+O7+L7+I7+F7+C7)/8 -> 5.9169999999999998

C1: BATERIA 6
A3: PISTA | B3: TEMPO | C3: NOME
A4: 1 | B4: 5.7489999999999997 | C4: KLEBER
A5: 2 | B5: 5.6459999999999999 | C5: MARQUINHO
A6: 3 | B6: 5.3550000000000004 | C6: MICHEL
A7: 4 | B7: 5.4279999999999999 | C7: MICHEL
A8: 5 | B8: 5.0170000000000003 | C8: MICHEL
A9: 6 | B9: 5.0049999999999999 | C9: MICHEL
A10: 7 | B10: 5.3239999999999998 | C10: MICHEL
A11: 8 | B11: 5.1710000000000003 | C11: MICHEL