A1: Nome | B1: P | C1: M.VOL | D1: B1 | E1: P | F1: M.VOL | G1: B2 | H1: P | I1: M.VOL | J1: B3 | K1: P | L1: M.VOL | M1: B4 | N1: P | O1: M.VOL | P1: B5 | Q1: P | R1: M.VOL | S1: B6 | T1: P | U1: M.VOL | V1: B7 | W1: P | X1: M.VOL | Y1: B8 | Z1: TOTAL | AA1: MEDIA
A2: IMPORTADO | B2: 8 | C2: 4.8230000000000004 | D2: 32 | E2: 6 | F2: 5.2949999999999999 | G2: 31 | H2: 4 | I2: 5.37 | J2: 31 | K2: 2 | L2: 5.282 | M2: 30 | N2: 1 | O2: 5.7990000000000004 | P2: 28 | Q2: 3 | R2: 5.4169999999999998 | S2: 29 | T2: 5 | U2: 5.2960000000000003 | V2: 31 | W2: 7 | X2: 5.194 | Y2: 32 | Z2: 244.17 | AA2: =+(X2+U2+R2+O2+L2+I2+F2+C2)/8 -> 5.3094999999999999
A3: ANDERSON | B3: 4 | C3: 5.2869999999999999 | D3: 32 | E3: 2 | F3: 5.4320000000000004 | G3: 29 | H3: 1 | I3: 5.6059999999999999 | J3: 30 | K3: 3 | L3: 5.0110000000000001 | M3: 30 | N3: 5 | O3: 5.4989999999999997 | P3: 30 | Q3: 7 | R3: 5.4480000000000004 | S3: 30 | T3: 8 | U3: 5.33 | V3: 30 | W3: 6 | X3: 5.3079999999999998 | Y3: 31 | Z3: 242.45 | AA3: =+(X3+U3+R3+O3+L3+I3+F3+C3)/8 -> 5.3651249999999999
A4: JULIO | B4: 5 | C4: 5.6980000000000004 | D4: 29 | E4: 7 | F4: 5.5910000000000002 | G4: 28 | H4: 8 | I4: 5.71 | J4: 29 | K4: 6 | L4: 5.7679999999999998 | M4: 29 | N4: 4 | O4: 5.7889999999999997 | P4: 29 | Q4: 2 | R4: 5.968 | S4: 27 | T4: 1 | U4: 6.048 | V4: 26 | W4: 3 | X4: 5.8620000000000001 | Y4: 28 | Z4: 225.19 | AA4: =+(X4+U4+R4+O4+L4+I4+F4+C4)/8 -> 5.8042500000000006
A5: WELLIGINITON | B5: 7 | C5: 5.758 | D5: 28 | E5: 8 | F5: 5.6349999999999998 | G5: 28 | H5: 6 | I5: 5.7750000000000004 | J5: 28 | K5: 4 | L5: 5.7969999999999997 | M5: 27 | N5: 2 | O5: 5.7450000000000001 | P5: 27 | Q5: 1 | R5: 5.9809999999999999 | S5: 27 | T5: 3 | U5: 5.8339999999999996 | V5: 29 | W5: 5 | X5: 5.8 | Y5: 29 | Z5: 223.3 | AA5: =+(X5+U5+R5+O5+L5+I5+F5+C5)/8 -> 5.7906250000000004
A6: GODOI | B6: 3 | C6: 5.6420000000000003 | D6: 28 | E6: 5 | F6: 5.3730000000000002 | G6: 27 | H6: 7 | I6: 5.3550000000000004 | J6: 28 | K6: 8 | L6: 5.4749999999999996 | M6: 29 | N6: 6 | O6: 5.4720000000000004 | P6: 29 | Q6: 4 | R6: 5.3319999999999999 | S6: 25 | T6: 2 | U6: 5.5449999999999999 | V6: 29 | W6: 1 | X6: 6.1680000000000001 | Y6: 23 | Z6: 218.09 | AA6: =+(X6+U6+R6+O6+L6+I6+F6+C6)/8 -> 5.5452500000000011
A7: GEOVANNI | B7: 2 | C7: 6.1509999999999998 | D7: 20 | E7: 1 | F7: 6.11 | G7: 26 | H7: 3 | I7: 5.8869999999999996 | J7: 27 | K7: 5 | L7: 5.8250000000000002 | M7: 28 | N7: 7 | O7: 5.8609999999999998 | P7: 27 | Q7: 8 | R7: 5.6920000000000002 | S7: 27 | T7: 6 | U7: 5.891 | V7: 27 | W7: 4 | X7: 6.0330000000000004 | Y7: 26 | Z7: 208.64 | AA7: =+(X7+U7+R7+O7+L7+I7+F7+C7)/8 -> 5.9312500000000004
A8: DANIEL | B8: 1 | C8: 7.0789999999999997 | D8: 22 | E8: 3 | F8: 6.9029999999999996 | G8: 23 | H8: 5 | I8: 7.0780000000000003 | J8: 22 | K8: 7 | L8: 7.1680000000000001 | M8: 20 | N8: 8 | O8: 6.9669999999999996 | P8: 19 | Q8: 6 | R8: 6.742 | S8: 21 | T8: 4 | U8: 7.1840000000000002 | V8: 21 | W8: 2 | X8: 7.0970000000000004 | Y8: 23 | Z8: 171.28 | AA8: =+(X8+U8+R8+O8+L8+I8+F8+C8)/8 -> 7.0272500000000004

C1: BATERIA 5
A3: PISTA | B3: TEMPO | C3: NOME
A4: 1 | B4: 5.6059999999999999 | C4: ANDERSON
A5: 2 | B5: 5.282 | C5: IMPORTADO
A6: 3 | B6: 5.0110000000000001 | C6: ANDERSON
A7: 4 | B7: 5.2869999999999999 | C7: ANDERSON
A8: 5 | B8: 5.2960000000000003 | C8: IMPORTADO
A9: 6 | B9: 5.2949999999999999 | C9: IMPORTADO
A10: 7 | B10: 5.194 | C10: IMPORTADO
A11: 8 | B11: 4.8230000000000004 | C11: IMPORTADO