A1: Nome | B1: P | C1: M.VOL | D1: B1 | E1: P | F1: M.VOL | G1: B2 | H1: P | I1: M.VOL | J1: B3 | K1: P | L1: M.VOL | M1: B4 | N1: P | O1: M.VOL | P1: B5 | Q1: P | R1: M.VOL | S1: B6 | T1: P | U1: M.VOL | V1: B7 | W1: P | X1: M.VOL | Y1: B8 | Z1: TOTAL | AA1: MEDIA
A2: MARCEL | B2: 6 | C2: 5.4050000000000002 | D2: 28 | E2: 4 | F2: 5.3769999999999998 | G2: 30 | H2: 2 | I2: 5.4009999999999998 | J2: 27 | K2: 1 | L2: 5.8380000000000001 | M2: 28 | N2: 3 | O2: 5.5119999999999996 | P2: 31 | Q2: 5 | R2: 5.4950000000000001 | S2: 29 | T2: 7 | U2: 5.5540000000000003 | V2: 29 | W2: 8 | X2: 5.0750000000000002 | Y2: 29 | Z2: 231.77 | AA2: =+(X2+U2+R2+O2+L2+I2+F2+C2)/8 -> 5.4571250000000004
A3: JUNINHO | B3: 7 | C3: 5.5730000000000004 | D3: 26 | E3: 8 | F3: 5.3150000000000004 | G3: 29 | H3: 6 | I3: 5.609 | J3: 29 | K3: 4 | L3: 5.6210000000000004 | M3: 29 | N3: 2 | O3: 5.5679999999999996 | P3: 29 | Q3: 1 | R3: 6.0039999999999996 | S3: 25 | T3: 3 | U3: 5.7750000000000004 | V3: 28 | W3: 5 | X3: 5.8079999999999998 | Y3: 27 | Z3: 222.83 | AA3: =+(X3+U3+R3+O3+L3+I3+F3+C3)/8 -> 5.6591250000000004
A4: CAVERNA | B4: 5 | C4: 5.68 | D4: 29 | E4: 7 | F4: 5.5830000000000002 | G4: 30 | H4: 8 | I4: 5.5650000000000004 | J4: 29 | K4: 6 | L4: 5.65 | M4: 28 | N4: 4 | O4: 5.6340000000000003 | P4: 29 | Q4: 2 | R4: 6.2450000000000001 | S4: 24 | T4: 1 | U4: 6.4180000000000001 | V4: 25 | W4: 3 | X4: 5.71 | Y4: 25 | Z4: 219.4 | AA4: =+(X4+U4+R4+O4+L4+I4+F4+C4)/8 -> 5.8106249999999999
A5: JAPAO | B5: 8 | C5: 5.8120000000000003 | D5: 27 | E5: 6 | F5: 5.7 | G5: 28 | H5: 4 | I5: 5.9480000000000004 | J5: 25 | K5: 2 | L5: 5.9829999999999997 | M5: 26 | N5: 1 | O5: 6.0439999999999996 | P5: 26 | Q5: 3 | R5: 5.9950000000000001 | S5: 29 | T5: 5 | U5: 5.5990000000000002 | V5: 29 | W5: 7 | X5: 5.7 | Y5: 28 | Z5: 218.66 | AA5: =+(X5+U5+R5+O5+L5+I5+F5+C5)/8 -> 5.8476250000000007
A6: RUBENS | B6: 4 | C6: 5.6970000000000001 | D6: 27 | E6: 2 | F6: 5.6989999999999998 | G6: 26 | H6: 1 | I6: 6.06 | J6: 25 | K6: 3 | L6: 5.8390000000000004 | M6: 27 | N6: 5 | O6: 5.7160000000000002 | P6: 26 | Q6: 7 | R6: 5.9139999999999997 | S6: 27 | T6: 8 | U6: 5.718 | V6: 27 | W6: 6 | X6: 5.91 | Y6: 26 | Z6: 211.85 | AA6: =+(X6+U6+R6+O6+L6+I6+F6+C6)/8 -> 5.8191250000000005
A7: M.JOSE | B7: 3 | C7: 6.4610000000000003 | D7: 24 | E7: 5 | F7: 6.3550000000000004 | G7: 24 | H7: 7 | I7: 6.5 | J7: 23 | K7: 8 | L7: 6.407 | M7: 23 | N7: 6 | O7: 6.3869999999999996 | P7: 25 | Q7: 4 | R7: 6.5090000000000003 | S7: 22 | T7: 2 | U7: 6.2210000000000001 | V7: 25 | W7: 1 | X7: 6.58 | Y7: 22 | Z7: 188.28 | AA7: =+(X7+U7+R7+O7+L7+I7+F7+C7)/8 -> 6.4275000000000002
A8: ROBRIGUINHO | B8: 2 | C8: 6.0449999999999999 | D8: 24 | E8: 1 | F8: 6.242 | G8: 19 | H8: 3 | I8: 6.5880000000000001 | J8: 22 | K8: 5 | L8: 6.149 | M8: 22 | N8: 7 | O8: 6.3380000000000001 | P8: 22 | Q8: 8 | R8: 6.0759999999999996 | S8: 22 | T8: 6 | U8: 6.23 | V8: 27 | W8: 4 | X8: 6.1989999999999998 | Y8: 24 | Z8: 182.53 | AA8: =+(X8+U8+R8+O8+L8+I8+F8+C8)/8 -> 6.2333749999999997

C1: BATERIA 2
A3: PISTA | B3: TEMPO | C3: NOME
A4: 1 | B4: 5.8380000000000001 | C4: MARCEL
A5: 2 | B5: 5.4009999999999998 | C5: MARCEL
A6: 3 | B6: 5.5119999999999996 | C6: MARCEL
A7: 4 | B7: 5.3769999999999998 | C7: MARCEL
A8: 5 | B8: 5.4950000000000001 | C8: MARCEL
A9: 6 | B9: 5.4050000000000002 | C9: MARCEL
A10: 7 | B10: 5.5540000000000003 | C10: MARCEL
A11: 8 | B11: 5.0750000000000002 | C11: MARCEL