A1: Nome | B1: P | C1: M.VOL | D1: B1 | E1: P | F1: M.VOL | G1: B2 | H1: P | I1: M.VOL | J1: B3 | K1: P | L1: M.VOL | M1: B4 | N1: P | O1: M.VOL | P1: B5 | Q1: P | R1: M.VOL | S1: B6 | T1: P | U1: M.VOL | V1: B7 | W1: P | X1: M.VOL | Y1: B8 | Z1: TOTAL | AA1: MEDIA
A2: DINHO | B2: 2 | C2: 5.4859999999999998 | D2: 28 | E2: 1 | F2: 5.2670000000000003 | G2: 29 | H2: 3 | I2: 5.5279999999999996 | J2: 30 | K2: 5 | L2: 5.6360000000000001 | M2: 30 | N2: 7 | O2: 5.6589999999999998 | P2: 29 | Q2: 8 | R2: 5.6509999999999998 | S2: 30 | T2: 6 | U2: 5.548 | V2: 29 | W2: 4 | X2: 5.0220000000000002 | Y2: 31 | Z2: 236.62 | AA2: =+(X2+U2+R2+O2+L2+I2+F2+C2)/8 -> 5.4746249999999996
A3: CAVANHA | B3: 4 | C3: 5.17 | D3: 31 | E3: 2 | F3: 5.5419999999999998 | G3: 27 | H3: 1 | I3: 5.77 | J3: 29 | K3: 3 | L3: 5.2859999999999996 | M3: 28 | N3: 5 | O3: 5.23 | P3: 28 | Q3: 7 | R3: 5.5949999999999998 | S3: 28 | T3: 8 | U3: 5.7939999999999996 | V3: 28 | W3: 6 | X3: 5.8739999999999997 | Y3: 26 | Z3: 225.7 | AA3: =+(X3+U3+R3+O3+L3+I3+F3+C3)/8 -> 5.5326249999999995
A4: ERIC | B4: 3 | C4: 5.9459999999999997 | D4: 25 | E4: 5 | F4: 6.1950000000000003 | G4: 18 | H4: 7 | I4: 6.1849999999999996 | J4: 26 | K4: 8 | L4: 6.16 | M4: 25 | N4: 6 | O4: 6.0129999999999999 | P4: 27 | Q4: 4 | R4: 6.0309999999999997 | S4: 27 | T4: 2 | U4: 6.0010000000000003 | V4: 27 | W4: 1 | X4: 6.327 | Y4: 25 | Z4: 200.19 | AA4: =+(X4+U4+R4+O4+L4+I4+F4+C4)/8 -> 6.1072499999999996
A5: MANE | B5: 1 | C5: 6.0069999999999997 | D5: 24 | E5: 3 | F5: 6.0739999999999998 | G5: 25 | H5: 5 | I5: 6.1029999999999998 | J5: 25 | K5: 7 | L5: 6.1859999999999999 | M5: 25 | N5: 8 | O5: 5.9939999999999998 | P5: 25 | Q5: 6 | R5: 6.0309999999999997 | S5: 19 | T5: 4 | U5: 6.2679999999999998 | V5: 23 | W5: 2 | X5: 6.3319999999999999 | Y5: 25 | Z5: 191.38 | AA5: =+(X5+U5+R5+O5+L5+I5+F5+C5)/8 -> 6.1243749999999997
A6: DANILO | B6: 7 | C6: 6.7850000000000001 | D6: 20 | E6: 8 | F6: 6.7149999999999999 | G6: 23 | H6: 6 | I6: 6.5590000000000002 | J6: 24 | K6: 4 | L6: 5.883 | M6: 26 | N6: 2 | O6: 6.48 | P6: 22 | Q6: 1 | R6: 6.7130000000000001 | S6: 23 | T6: 3 | U6: 6.367 | V6: 26 | W6: 5 | X6: 6.298 | Y6: 26 | Z6: 190.23 | AA6: =+(X6+U6+R6+O6+L6+I6+F6+C6)/8 -> 6.4749999999999996
A7: MARINHO | B7: 8 | C7: 3.6059999999999999 | D7: 25 | E7: 6 | F7: 6.44 | G7: 26 | H7: 4 | I7: 6.7519999999999998 | J7: 23 | K7: 2 | L7: 6.6310000000000002 | M7: 23 | N7: 1 | O7: 7.06 | P7: 19 | Q7: 3 | R7: 6.7060000000000004 | S7: 24 | T7: 5 | U7: 6.5179999999999998 | V7: 22 | W7: 7 | X7: 6.7309999999999999 | Y7: 14 | Z7: 176.85 | AA7: =+(X7+U7+R7+O7+L7+I7+F7+C7)/8 -> 6.3055000000000003
A8: M.VINICIUS | B8: 5 | C8: 6.4649999999999999 | D8: 23 | E8: 7 | F8: 6.5650000000000004 | G8: 22 | H8: 8 | I8: 6.4829999999999997 | J8: 23 | K8: 6 | L8: 6.5259999999999998 | M8: 22 | N8: 4 | O8: 6.6749999999999998 | P8: 19 | Q8: 2 | R8: 6.4409999999999998 | S8: 22 | T8: 1 | U8: 6.5449999999999999 | V8: 24 | W8: 3 | X8: 6.6120000000000001 | Y8: 13 | Z8: 168.28 | AA8: =+(X8+U8+R8+O8+L8+I8+F8+C8)/8 -> 6.5389999999999997

C1: BATERIA 3
A3: PISTA | B3: TEMPO | C3: NOME
A4: 1 | B4: 5.2670000000000003 | C4: DINHO
A5: 2 | B5: 5.4859999999999998 | C5: DINHO
A6: 3 | B6: 5.2859999999999996 | C6: CAVANHA
A7: 4 | B7: 5.0220000000000002 | C7: DINHO
A8: 5 | B8: 5.23 | C8: CAVANHA
A9: 6 | B9: 5.548 | C9: DINHO
A10: 7 | B10: 5.5949999999999998 | C10: CAVANHA
A11: 8 | B11: 5.6509999999999998 | C11: DINHO