A1: Nome | B1: Total
A2: GODOI | B2: 132.63829787234042
A3: JUNINHO | B3: 130.12765957446808
A4: RUBAO | B4: 127.34042553191489
A5: SANDRÃO | B5: 126.93617021276596
A6: DINHO | B6: 126.12765957446808
A7: RICARDO | B7: 125.12765957446808
A8: EVANDRO | B8: 124.65957446808511
A9: BONGA | B9: 124.12765957446808
A10: ERIK | B10: 121.14893617021276
A11: MARQUINHO | B11: 120
A12: KLEBER | B12: 118.34042553191489
A13: SANDRO ITU | B13: 116.63829787234043
A14: NETO | B14: 116.44680851063829
A15: JULIO | B15: 116.17021276595744
A16: CONRADO | B16: 115.78723404255319
A17: JAPAO | B17: 114.14893617021276
A18: RACHID | B18: 113.31914893617021
A19: JOAO | B19: 112.31914893617021
A20: GERONIMO | B20: 109.76595744680851
A21: LIUIZ FELIPE | B21: 107.76595744680851
A22: MARQUES | B22: 104
A23: HRNRIQUE | B23: 104
A24: GIOVANNI | B24: 98.787234042553195
A25: JERA | B25: 96.61702127659575

A1: 1 Bateria
A2: Nome | B2: P | C2: Tempo | D2: Vol | E2: P | F2: Tempo | G2: Vol | H2: P | I2: Tempo | J2: Vol | K2: P | L2: Tempo | M2: Vol | N2: P | O2: Tempo | P2: Vol | Q2: P | R2: Tempo | S2: Vol | T2: P | U2: Tempo | V2: Vol | W2: P | X2: Tempo | Y2: Vol | Z2: Total | AA2: Media | AB2: Record
A3: GODOI | B3: 4 | C3: 6.4349999999999996 | D3: 15 | E3: 2 | F3: 5.1150000000000002 | G3: 17 | H3: 1 | I3: 6.6550000000000002 | J3: 15 | K3: 3 | L3: 6.16 | M3: 15 | N3: 5 | O3: 6.38 | P3: 17 | Q3: 7 | R3: 5.9950000000000001 | S3: 17 | T3: 8 | U3: 5.94 | V3: 18 | W3: 6 | X3: 5.94 | Y3: 18 | Z3: 132.63829787234042 | AA3: =+(X3+U3+R3+O3+L3+I3+F3+C3)/8 -> 6.0774999999999997 | AB3: =MINA(X3,U3,R3,O3,L3,I3,F3,C3) -> 5.1150000000000002
A4: RUBAO | B4: 2 | C4: 7.26 | D4: 13 | E4: 1 | F4: 6.875 | G4: 15 | H4: 3 | I4: 6.49 | J4: 16 | K4: 5 | L4: 6.2690000000000001 | M4: 17 | N4: 7 | O4: 6.16 | P4: 16 | Q4: 8 | R4: 5.6639999999999997 | S4: 17 | T4: 6 | U4: 6.05 | V4: 15 | W4: 4 | X4: 6.16 | Y4: 17 | Z4: 127.34042553191489 | AA4: =+(X4+U4+R4+O4+L4+I4+F4+C4)/8 -> 6.3660000000000005 | AB4: =MINA(X4,U4,R4,O4,L4,I4,F4,C4) -> 5.6639999999999997
A5: RICARDO | B5: 6 | C5: 6.6550000000000002 | D5: 16 | E5: 4 | F5: 6.38 | G5: 16 | H5: 2 | I5: 6.27 | J5: 15 | K5: 1 | L5: 6.6550000000000002 | M5: 16 | N5: 3 | O5: 6.665 | P5: 15 | Q5: 5 | R5: 6.4349999999999996 | S5: 15 | T5: 7 | U5: 6.38 | V5: 17 | W5: 8 | X5: 6.38 | Y5: 15 | Z5: 125.12765957446808 | AA5: =+(X5+U5+R5+O5+L5+I5+F5+C5)/8 -> 6.4775 | AB5: =MINA(X5,U5,R5,O5,L5,I5,F5,C5) -> 6.27
A6: ERIK | B6: 5 | C6: 7.04 | D6: 12 | E6: 7 | F6: 6.3250000000000002 | G6: 15 | H6: 8 | I6: 6.2149999999999999 | J6: 17 | K6: 6 | L6: 6.2149999999999999 | M6: 15 | N6: 4 | O6: 6.1050000000000004 | P6: 15 | Q6: 2 | R6: 6.27 | S6: 15 | T6: 1 | U6: 6.38 | V6: 14 | W6: 3 | X6: 5.72 | Y6: 17 | Z6: 121.14893617021276 | AA6: =+(X6+U6+R6+O6+L6+I6+F6+C6)/8 -> 6.2837500000000004 | AB6: =MINA(X6,U6,R6,O6,L6,I6,F6,C6) -> 5.72
A7: JULIO | B7: 8 | C7: 6.4349999999999996 | D7: 15 | E7: 6 | F7: 7.04 | G7: 12 | H7: 4 | I7: 6.6 | J7: 14 | K7: 2 | L7: 6.38 | M7: 15 | N7: 1 | O7: 6.6 | P7: 14 | Q7: 3 | R7: 6.38 | S7: 16 | T7: 5 | U7: 6.49 | V7: 16 | W7: 7 | X7: 6.38 | Y7: 14 | Z7: 116.17021276595744 | AA7: =+(X7+U7+R7+O7+L7+I7+F7+C7)/8 -> 6.538125 | AB7: =MINA(X7,U7,R7,O7,L7,I7,F7,C7) -> 6.38
A8: RACHID | B8: 3 | C8: 6.82 | D8: 14 | E8: 5 | F8: 6.82 | G8: 14 | H8: 7 | I8: 7.04 | J8: 12 | K8: 8 | L8: 6.82 | M8: 14 | N8: 6 | O8: 6.6 | P8: 14 | Q8: 4 | R8: 6.6550000000000002 | S8: 15 | T8: 2 | U8: 6.82 | V8: 15 | W8: 1 | X8: 6.6 | Y8: 15 | Z8: 113.31914893617021 | AA8: =+(X8+U8+R8+O8+L8+I8+F8+C8)/8 -> 6.7718749999999996 | AB8: =MINA(X8,U8,R8,O8,L8,I8,F8,C8) -> 6.6
A9: MARQUES | B9: 7 | C9: 6.38 | D9: 15 | E9: 8 | F9: 6.38 | G9: 15 | H9: 6 | I9: 6.16 | J9: 15 | K9: 4 | L9: 6.3250000000000002 | M9: 14 | N9: 2 | O9: 6.6550000000000002 | P9: 14 | Q9: 1 | R9: 6.3250000000000002 | S9: 11 | T9: 3 | U9: 6.44 | V9: 5 | W9: 5 | X9: 6.16 | Y9: 14 | Z9: 104 | AA9: =+(X9+U9+R9+O9+L9+I9+F9+C9)/8 -> 6.3531250000000004 | AB9: =MINA(X9,U9,R9,O9,L9,I9,F9,C9) -> 6.16
A10: JERA | B10: 1 | C10: 6.6 | D10: 11 | E10: 3 | F10: 6.4349999999999996 | G10: 12 | H10: 5 | I10: 7.14 | J10: 11 | K10: 7 | L10: 6.38 | M10: 13 | N10: 8 | O10: 6.875 | P10: 10 | Q10: 6 | R10: 6.7649999999999997 | S10: 13 | T10: 4 | U10: 6.71 | V10: 11 | W10: 2 | X10: 6.875 | Y10: 14 | Z10: 96.61702127659575 | AA10: =+(X10+U10+R10+O10+L10+I10+F10+C10)/8 -> 6.7225000000000001 | AB10: =MINA(X10,U10,R10,O10,L10,I10,F10,C10) -> 6.38
A11: 2 Bateria
A12: Nome | B12: P | C12: Tempo | D12: Vol | E12: P | F12: Tempo | G12: Vol | H12: P | I12: Tempo | J12: Vol | K12: P | L12: Tempo | M12: Vol | N12: P | O12: Tempo | P12: Vol | Q12: P | R12: Tempo | S12: Vol | T12: P | U12: Tempo | V12: Vol | W12: P | X12: Tempo | Y12: Vol | Z12: Total | AA12: Media | AB12: Record
A13: JUNINHO | B13: 1 | C13: 6.6550000000000002 | D13: 15 | E13: 3 | F13: 5.9950000000000001 | G13: 17 | H13: 5 | I13: 6.1050000000000004 | J13: 15 | K13: 7 | L13: 5.9950000000000001 | M13: 15 | N13: 8 | O13: 5.5 | P13: 17 | Q13: 6 | R13: 5.94 | S13: 18 | T13: 4 | U13: 6.38 | V13: 15 | W13: 2 | X13: 5.72 | Y13: 17 | Z13: 130.12765957446808 | AA13: =+(X13+U13+R13+O13+L13+I13+F13+C13)/8 -> 6.0362499999999999 | AB13: =MINA(X13,U13,R13,O13,L13,I13,F13,C13) -> 5.5
A14: EVANDRO | B14: 4 | C14: 6.93 | D14: 14 | E14: 2 | F14: 7.04 | G14: 15 | H14: 1 | I14: 6.6 | J14: 14 | K14: 3 | L14: 6.38 | M14: 16 | N14: 5 | O14: 6.38 | P14: 16 | Q14: 7 | R14: 6.27 | S14: 15 | T14: 8 | U14: 5.94 | V14: 17 | W14: 6 | X14: 5.9950000000000001 | Y14: 17 | Z14: 124.65957446808511 | AA14: =+(X14+U14+R14+O14+L14+I14+F14+C14)/8 -> 6.4418749999999996 | AB14: =MINA(X14,U14,R14,O14,L14,I14,F14,C14) -> 5.94
A15: BONGA | B15: 2 | C15: 6.71 | D15: 15 | E15: 1 | F15: 6.2149999999999999 | G15: 15 | H15: 3 | I15: 6.38 | J15: 15 | K15: 5 | L15: 6.6550000000000002 | M15: 13 | N15: 7 | O15: 6.27 | P15: 16 | Q15: 8 | R15: 6.16 | S15: 15 | T15: 6 | U15: 6.05 | V15: 18 | W15: 4 | X15: 6.16 | Y15: 16 | Z15: 124.12765957446808 | AA15: =+(X15+U15+R15+O15+L15+I15+F15+C15)/8 -> 6.3250000000000002 | AB15: =MINA(X15,U15,R15,O15,L15,I15,F15,C15) -> 6.05
A16: SANDRO | B16: 8 | C16: 6.875 | D16: 13 | E16: 6 | F16: 6.82 | G16: 15 | H16: 4 | I16: 6.38 | J16: 15 | K16: 2 | L16: 7.26 | M16: 11 | N16: 1 | O16: 6.6 | P16: 13 | Q16: 3 | R16: 6.38 | S16: 15 | T16: 5 | U16: 6.38 | V16: 17 | W16: 7 | X16: 6.2149999999999999 | Y16: 17 | Z16: 116.63829787234043 | AA16: =+(X16+U16+R16+O16+L16+I16+F16+C16)/8 -> 6.6137499999999996 | AB16: =MINA(X16,U16,R16,O16,L16,I16,F16,C16) -> 6.2149999999999999
A17: NETO | B17: 5 | C17: 7.37 | D17: 10 | E17: 7 | F17: 6.38 | G17: 15 | H17: 8 | I17: 6.38 | J17: 16 | K17: 6 | L17: 6.875 | M17: 13 | N17: 4 | O17: 6.71 | P17: 15 | Q17: 2 | R17: 6.82 | S17: 14 | T17: 1 | U17: 6.82 | V17: 16 | W17: 3 | X17: 6.2149999999999999 | Y17: 17 | Z17: 116.44680851063829 | AA17: =+(X17+U17+R17+O17+L17+I17+F17+C17)/8 -> 6.69625 | AB17: =MINA(X17,U17,R17,O17,L17,I17,F17,C17) -> 6.2149999999999999
A18: JAPAO | B18: 6 | C18: 7.15 | D18: 13 | E18: 4 | F18: 7.1 | G18: 13 | H18: 2 | I18: 6.9850000000000003 | J18: 14 | K18: 1 | L18: 7.04 | M18: 14 | N18: 3 | O18: 6.6 | P18: 15 | Q18: 5 | R18: 6.6550000000000002 | S18: 14 | T18: 7 | U18: 7.04 | V18: 13 | W18: 8 | X18: 6.38 | Y18: 17 | Z18: 114.14893617021276 | AA18: =+(X18+U18+R18+O18+L18+I18+F18+C18)/8 -> 6.8687500000000004 | AB18: =MINA(X18,U18,R18,O18,L18,I18,F18,C18) -> 6.38
A19: LIUIZ FELIPE | B19: 3 | C19: 7.3150000000000004 | D19: 11 | E19: 5 | F19: 6.82 | G19: 15 | H19: 7 | I19: 6.38 | J19: 14 | K19: 8 | L19: 7.26 | M19: 11 | N19: 6 | O19: 6.6550000000000002 | P19: 15 | Q19: 4 | R19: 6.38 | S19: 14 | T19: 2 | U19: 6.38 | V19: 13 | W19: 1 | X19: 6.4349999999999996 | Y19: 13 | Z19: 107.76595744680851 | AA19: =+(X19+U19+R19+O19+L19+I19+F19+C19)/8 -> 6.703125 | AB19: =MINA(X19,U19,R19,O19,L19,I19,F19,C19) -> 6.38
A20: GIOVANNI | B20: 7 | C20: 7.7549999999999999 | D20: 12 | E20: 8 | F20: 7.15 | G20: 14 | H20: 6 | I20: 7.7 | J20: 4 | K20: 4 | L20: 6.49 | M20: 11 | N20: 2 | O20: 6.71 | P20: 15 | Q20: 1 | R20: 6.7649999999999997 | S20: 13 | T20: 3 | U20: 6.4349999999999996 | V20: 15 | W20: 5 | X20: 6.82 | Y20: 14 | Z20: 98.787234042553195 | AA20: =+(X20+U20+R20+O20+L20+I20+F20+C20)/8 -> 6.9781250000000004 | AB20: =MINA(X20,U20,R20,O20,L20,I20,F20,C20) -> 6.4349999999999996
A21: 3 Bateria
A22: Nome | B22: P | C22: Tempo | D22: Vol | E22: P | F22: Tempo | G22: Vol | H22: P | I22: Tempo | J22: Vol | K22: P | L22: Tempo | M22: Vol | N22: P | O22: Tempo | P22: Vol | Q22: P | R22: Tempo | S22: Vol | T22: P | U22: Tempo | V22: Vol | W22: P | X22: Tempo | Y22: Vol | Z22: Total | AA22: Media | AB22: Record
A23: SANDRﾁO | B23: 8 | C23: 5.9950000000000001 | D23: 15 | E23: 6 | F23: 6.16 | G23: 16 | H23: 4 | I23: 6.2149999999999999 | J23: 7 | K23: 2 | L23: 5.83 | M23: 17 | N23: 1 | O23: 5.83 | P23: 17 | Q23: 3 | R23: 5.61 | S23: 17 | T23: 5 | U23: 5.8849999999999998 | V23: 18 | W23: 7 | X23: 5.5 | Y23: 16 | Z23: 126.93617021276596 | AA23: =+(X23+U23+R23+O23+L23+I23+F23+C23)/8 -> 5.8781249999999998 | AB23: =MINA(X23,U23,R23,O23,L23,I23,F23,C23) -> 5.5
A24: DINHO | B24: 2 | C24: 6.875 | D24: 7 | E24: 1 | F24: 6.16 | G24: 15 | H24: 3 | I24: 5.7850000000000001 | J24: 15 | K24: 5 | L24: 6.05 | M24: 17 | N24: 7 | O24: 5.61 | P24: 18 | Q24: 8 | R24: 5.4450000000000003 | S24: 18 | T24: 6 | U24: 5.5 | V24: 17 | W24: 4 | X24: 4.51 | Y24: 18 | Z24: 126.12765957446808 | AA24: =+(X24+U24+R24+O24+L24+I24+F24+C24)/8 -> 5.7418750000000003 | AB24: =MINA(X24,U24,R24,O24,L24,I24,F24,C24) -> 4.51
A25: MARQUINHO | B25: 7 | C25: 7.15 | D25: 15 | E25: 8 | F25: 6.7649999999999997 | G25: 15 | H25: 6 | I25: 6.82 | J25: 16 | K25: 4 | L25: 6.38 | M25: 16 | N25: 2 | O25: 6.875 | P25: 12 | Q25: 1 | R25: 6.6 | S25: 15 | T25: 3 | U25: 6.5449999999999999 | V25: 15 | W25: 5 | X25: 6.2149999999999999 | Y25: 14 | Z25: 120 | AA25: =+(X25+U25+R25+O25+L25+I25+F25+C25)/8 -> 6.6687500000000002 | AB25: =MINA(X25,U25,R25,O25,L25,I25,F25,C25) -> 6.2149999999999999
A26: KLEBER | B26: 5 | C26: 6.4349999999999996 | D26: 14 | E26: 7 | F26: 6.2149999999999999 | G26: 14 | H26: 8 | I26: 5.94 | J26: 15 | K26: 6 | L26: 6.0549999999999997 | M26: 18 | N26: 4 | O26: 6.27 | P26: 13 | Q26: 2 | R26: 7.0949999999999998 | S26: 13 | T26: 1 | U26: 7.0949999999999998 | V26: 14 | W26: 3 | X26: 6.05 | Y26: 17 | Z26: 118.34042553191489 | AA26: =+(X26+U26+R26+O26+L26+I26+F26+C26)/8 -> 6.3943750000000001 | AB26: =MINA(X26,U26,R26,O26,L26,I26,F26,C26) -> 5.94
A27: CONRADO | B27: 1 | C27: 7.04 | D27: 12 | E27: 3 | F27: 6.7089999999999996 | G27: 16 | H27: 5 | I27: 6.82 | J27: 14 | K27: 7 | L27: 6.6 | M27: 16 | N27: 8 | O27: 6.38 | P27: 14 | Q27: 6 | R27: 6.5449999999999999 | S27: 15 | T27: 4 | U27: 6.71 | V27: 14 | W27: 2 | X27: 6.2149999999999999 | Y27: 14 | Z27: 115.78723404255319 | AA27: =+(X27+U27+R27+O27+L27+I27+F27+C27)/8 -> 6.6273749999999998 | AB27: =MINA(X27,U27,R27,O27,L27,I27,F27,C27) -> 6.2149999999999999
A28: JOAO | B28: 3 | C28: 7.3150000000000004 | D28: 13 | E28: 5 | F28: 7.0949999999999998 | G28: 13 | H28: 7 | I28: 6.6550000000000002 | J28: 15 | K28: 8 | L28: 6.49 | M28: 14 | N28: 6 | O28: 6.4349999999999996 | P28: 14 | Q28: 4 | R28: 7.0949999999999998 | S28: 13 | T28: 2 | U28: 6.71 | V28: 15 | W28: 1 | X28: 6.7649999999999997 | Y28: 14 | Z28: 112.31914893617021 | AA28: =+(X28+U28+R28+O28+L28+I28+F28+C28)/8 -> 6.82 | AB28: =MINA(X28,U28,R28,O28,L28,I28,F28,C28) -> 6.4349999999999996
A29: GERONIMO | B29: 4 | C29: 7.26 | D29: 13 | E29: 2 | F29: 7.3650000000000002 | G29: 13 | H29: 1 | I29: 7.26 | J29: 14 | K29: 3 | L29: 6.71 | M29: 13 | N29: 5 | O29: 6.875 | P29: 13 | Q29: 7 | R29: 6.6550000000000002 | S29: 12 | T29: 8 | U29: 6.3250000000000002 | V29: 16 | W29: 6 | X29: 6.2149999999999999 | Y29: 15 | Z29: 109.76595744680851 | AA29: =+(X29+U29+R29+O29+L29+I29+F29+C29)/8 -> 6.8331249999999999 | AB29: =MINA(X29,U29,R29,O29,L29,I29,F29,C29) -> 6.2149999999999999
A30: HRNRIQUE | B30: 6 | C30: 6.82 | D30: 13 | E30: 4 | F30: 6.2149999999999999 | G30: 15 | H30: 2 | I30: 6.7649999999999997 | J30: 10 | K30: 1 | L30: 6.27 | M30: 16 | N30: 3 | O30: 6.27 | P30: 11 | Q30: 5 | R30: 6.71 | S30: 11 | T30: 7 | U30: 6.16 | V30: 14 | W30: 8 | X30: 6.05 | Y30: 15 | Z30: 104 | AA30: =+(X30+U30+R30+O30+L30+I30+F30+C30)/8 -> 6.4074999999999998 | AB30: =MINA(X30,U30,R30,O30,L30,I30,F30,C30) -> 6.05