A1: PILOTOS | B1: P | C1: TEMPO | D1: V | E1: P | F1: TEMPO | G1: V | H1: P | I1: TEMPO | J1: V | K1: P | L1: TEMPO | M1: V | N1: P | O1: TEMPO | P1: V | Q1: P | R1: TEMPO | S1: V | T1: P | U1: TEMPO | V1: V | W1: P | X1: TEMPO | Y1: V | Z1: TOTAL | AA1: MEDIA
A2: MICHEL | B2: 4 | C2: 4.3360000000000003 | D2: 57 | E2: 2 | F2: 4.2919999999999998 | G2: 61 | H2: 1 | I2: 4.4 | J2: 56 | K2: 3 | L2: 4.29 | M2: 61 | N2: 5 | O2: 4.2359999999999998 | P2: 65 | Q2: 7 | R2: 4.181 | S2: 55 | T2: 8 | U2: 4.3330000000000002 | V2: 61 | W2: 6 | X2: 4.4550000000000001 | Y2: 61 | Z2: 477.40425531914894 | AA2: =+(X2+U2+R2+O2+L2+I2+F2+C2)/8 -> 4.3153750000000004
A3: MARCEL | B3: 6 | C3: 4.6760000000000002 | D3: 55 | E3: 4 | F3: 4.8419999999999996 | G3: 58 | H3: 2 | I3: 4.8940000000000001 | J3: 56 | K3: 1 | L3: 4.8929999999999998 | M3: 55 | N3: 3 | O3: 4.8970000000000002 | P3: 55 | Q3: 5 | R3: 4.8390000000000004 | S3: 47 | T3: 7 | U3: 4.673 | V3: 57 | W3: 8 | X3: 4.62 | Y3: 57 | Z3: 440.57446808510639 | AA3: =+(X3+U3+R3+O3+L3+I3+F3+C3)/8 -> 4.7917500000000004
A4: MARQUINHO | B4: 8 | C4: 4.8929999999999998 | D4: 55 | E4: 6 | F4: 4.4119999999999999 | G4: 40 | H4: 4 | I4: 4.7309999999999999 | J4: 57 | K4: 2 | L4: 4.8179999999999996 | M4: 59 | N4: 1 | O4: 5.0010000000000003 | P4: 57 | Q4: 3 | R4: 4.6749999999999998 | S4: 56 | T4: 5 | U4: 4.7830000000000004 | V4: 53 | W4: 7 | X4: 4.4020000000000001 | Y4: 60 | Z4: 437.44680851063828 | AA4: =+(X4+U4+R4+O4+L4+I4+F4+C4)/8 -> 4.7143750000000004
A5: ANGELAO | B5: 5 | C5: 4.3920000000000003 | D5: 55 | E5: 7 | F5: 4.29 | G5: 44 | H5: 8 | I5: 4.4530000000000003 | J5: 55 | K5: 6 | L5: 4.3449999999999998 | M5: 59 | N5: 4 | O5: 4.4020000000000001 | P5: 54 | Q5: 2 | R5: 4.4550000000000001 | S5: 54 | T5: 1 | U5: 4.5629999999999997 | V5: 53 | W5: 3 | X5: 4.0149999999999997 | Y5: 62 | Z5: 436.14893617021278 | AA5: =+(X5+U5+R5+O5+L5+I5+F5+C5)/8 -> 4.3643749999999999
A6: GOROI | B6: 2 | C6: 4.4550000000000001 | D6: 32 | E6: 1 | F6: 4.5650000000000004 | G6: 51 | H6: 3 | I6: 4.4539999999999997 | J6: 57 | K6: 5 | L6: 4.4 | M6: 55 | N6: 7 | O6: 4.2869999999999999 | P6: 58 | Q6: 8 | R6: 4.2350000000000003 | S6: 56 | T6: 6 | U6: 4.2350000000000003 | V6: 59 | W6: 4 | X6: 4.343 | Y6: 62 | Z6: 430.87234042553189 | AA6: =+(X6+U6+R6+O6+L6+I6+F6+C6)/8 -> 4.3717500000000005
A7: KLEBER | B7: 7 | C7: 4.5670000000000002 | D7: 47 | E7: 8 | F7: 4.61 | G7: 59 | H7: 6 | I7: 4.6189999999999998 | J7: 55 | K7: 4 | L7: 4.6749999999999998 | M7: 55 | N7: 2 | O7: 4.7320000000000002 | P7: 51 | Q7: 1 | R7: 5.0039999999999996 | S7: 53 | T7: 3 | U7: 4.7839999999999998 | V7: 44 | W7: 5 | X7: 4.6180000000000003 | Y7: 57 | Z7: 422.31914893617022 | AA7: =+(X7+U7+R7+O7+L7+I7+F7+C7)/8 -> 4.7011250000000002
A8: IMPORTADO | B8: 1 | C8: 4.7229999999999999 | D8: 51 | E8: 3 | F8: 4.6219999999999999 | G8: 54 | H8: 5 | I8: 4.73 | J8: 47 | K8: 7 | L8: 4.8970000000000002 | M8: 34 | N8: 8 | O8: 4.7850000000000001 | P8: 51 | Q8: 6 | R8: 4.8929999999999998 | S8: 47 | T8: 4 | U8: 4.8390000000000004 | V8: 51 | W8: 2 | X8: 4.782 | Y8: 50 | Z8: 385.42553191489361 | AA8: =+(X8+U8+R8+O8+L8+I8+F8+C8)/8 -> 4.7838750000000001
A9: NETO | B9: 3 | C9: 5.2229999999999999 | D9: 40 | E9: 5 | F9: 5.0620000000000003 | G9: 47 | H9: 7 | I9: 5.1150000000000002 | J9: 47 | K9: 8 | L9: 5.1130000000000004 | M9: 39 | N9: 6 | O9: 5.1130000000000004 | P9: 48 | Q9: 4 | R9: 5.125 | S9: 49 | T9: 2 | U9: 5.28 | V9: 42 | W9: 1 | X9: 5.17 | Y9: 45 | Z9: 358.10638297872339 | AA9: =+(X9+U9+R9+O9+L9+I9+F9+C9)/8 -> 5.1501249999999992

A1: PILOTOS | B1: P | C1: TEMPO | D1: V | E1: P | F1: TEMPO | G1: V | H1: P | I1: TEMPO | J1: V | K1: P | L1: TEMPO | M1: V | N1: P | O1: TEMPO | P1: V | Q1: P | R1: TEMPO | S1: V | T1: P | U1: TEMPO | V1: V | W1: P | X1: TEMPO | Y1: V | Z1: TOTAL | AA1: MEDIA
A2: BONGA | B2: 7 | C2: 5 | D2: 50 | E2: 8 | F2: 4.6749999999999998 | G2: 59 | H2: 6 | I2: 4.6189999999999998 | J2: 58 | K2: 4 | L2: 4.68 | M2: 57 | N2: 2 | O2: 4.6749999999999998 | P2: 54 | Q2: 1 | R2: 4.83 | S2: 55 | T2: 3 | U2: 4.7190000000000003 | V2: 57 | W2: 5 | X2: 4.6749999999999998 | Y2: 59 | Z2: 450.44680851063828 | AA2: =+(X2+U2+R2+O2+L2+I2+F2+C2)/8 -> 4.7341249999999997
A3: ERUNDA | B3: 5 | C3: 4.7850000000000001 | D3: 56 | E3: 7 | F3: 4.7839999999999998 | G3: 58 | H3: 8 | I3: 4.7830000000000004 | J3: 58 | K3: 6 | L3: 4.7830000000000004 | M3: 56 | N3: 4 | O3: 4.8949999999999996 | P3: 55 | Q3: 2 | R3: 5.0069999999999997 | S3: 55 | T3: 1 | U3: 5.0069999999999997 | V3: 56 | W3: 3 | X3: 4.8949999999999996 | Y3: 51 | Z3: 445.80851063829789 | AA3: =+(X3+U3+R3+O3+L3+I3+F3+C3)/8 -> 4.8673750000000009
A4: JUNINHO | B4: 4 | C4: 4.6740000000000004 | D4: 57 | E4: 2 | F4: 4.73 | G4: 55 | H4: 1 | I4: 5.06 | J4: 46 | K4: 3 | L4: 4.84 | M4: 56 | N4: 5 | O4: 4.84 | P4: 49 | Q4: 7 | R4: 4.7939999999999996 | S4: 53 | T4: 8 | U4: 4.7220000000000004 | V4: 59 | W4: 6 | X4: 4.8390000000000004 | Y4: 56 | Z4: 432.51063829787233 | AA4: =+(X4+U4+R4+O4+L4+I4+F4+C4)/8 -> 4.8123750000000003
A5: MANE | B5: 3 | C5: 5.1150000000000002 | D5: 53 | E5: 5 | F5: 5.0030000000000001 | G5: 52 | H5: 7 | I5: 4.8949999999999996 | J5: 53 | K5: 8 | L5: 5.0030000000000001 | M5: 49 | N5: 6 | O5: 5.06 | P5: 48 | Q5: 4 | R5: 5.17 | S5: 51 | T5: 2 | U5: 4.0170000000000003 | V5: 52 | W5: 1 | X5: 5.3339999999999996 | Y5: 49 | Z5: 408.7659574468085 | AA5: =+(X5+U5+R5+O5+L5+I5+F5+C5)/8 -> 4.9496250000000002
A6: JULIO | B6: 8 | C6: 4.9480000000000004 | D6: 50 | E6: 6 | F6: 4.8319999999999999 | G6: 55 | H6: 4 | I6: 4.8959999999999999 | J6: 54 | K6: 2 | L6: 5.0039999999999996 | M6: 50 | N6: 1 | O6: 5.2240000000000002 | P6: 50 | Q6: 3 | R6: 4.9480000000000004 | S6: 54 | T6: 5 | U6: 4.8280000000000003 | V6: 56 | W6: 7 | X6: 4.7309999999999999 | Y6: 36 | Z6: 405.85106382978722 | AA6: =+(X6+U6+R6+O6+L6+I6+F6+C6)/8 -> 4.9263750000000002
A7: SANDRAO | B7: 1 | C7: 5.1680000000000001 | D7: 44 | E7: 3 | F7: 4.9359999999999999 | G7: 52 | H7: 5 | I7: 4.9480000000000004 | J7: 43 | K7: 7 | L7: 4.8949999999999996 | M7: 52 | N7: 8 | O7: 4.84 | P7: 52 | Q7: 6 | R7: 4.95 | S7: 53 | T7: 4 | U7: 4.8419999999999996 | V7: 55 | W7: 2 | X7: 4.9489999999999998 | Y7: 52 | Z7: 403.29787234042556 | AA7: =+(X7+U7+R7+O7+L7+I7+F7+C7)/8 -> 4.9409999999999998
A8: SIMONE | B8: 6 | C8: 4.8970000000000002 | D8: 47 | E8: 4 | F8: 5.1689999999999996 | G8: 47 | H8: 2 | I8: 5.1680000000000001 | J8: 47 | K8: 1 | L8: 5.282 | M8: 46 | N8: 3 | O8: 5.28 | P8: 37 | Q8: 5 | R8: 4.0149999999999997 | S8: 45 | T8: 7 | U8: 4.8380000000000001 | V8: 52 | W8: 8 | X8: 4.8380000000000001 | Y8: 52 | Z8: 373.2340425531915 | AA8: =+(X8+U8+R8+O8+L8+I8+F8+C8)/8 -> 4.9358749999999993
A9: SANDRO | B9: 2 | C9: 5.3879999999999999 | D9: 44 | E9: 1 | F9: 5.4429999999999996 | G9: 48 | H9: 3 | I9: 5.17 | J9: 39 | K9: 5 | L9: 5.2229999999999999 | M9: 48 | N9: 7 | O9: 4.9489999999999998 | P9: 46 | Q9: 8 | R9: 4.95 | S9: 50 | T9: 6 | U9: 5.1130000000000004 | V9: 50 | W9: 4 | X9: 5.1159999999999997 | Y9: 45 | Z9: 370.59574468085106 | AA9: =+(X9+U9+R9+O9+L9+I9+F9+C9)/8 -> 5.1689999999999996

A1: PILOTOS | B1: P | C1: TEMPO | D1: V | E1: P | F1: TEMPO | G1: V | H1: P | I1: TEMPO | J1: V | K1: P | L1: TEMPO | M1: V | N1: P | O1: TEMPO | P1: V | Q1: P | R1: TEMPO | S1: V | T1: P | U1: TEMPO | V1: V | W1: P | X1: TEMPO | Y1: V | Z1: TOTAL | AA1: MEDIA
A2: MICHEL | B2: 4 | C2: 4.5650000000000004 | D2: 36 | E2: 2 | F2: 4.508 | G2: 38 | H2: 1 | I2: 4.5579999999999998 | J2: 36 | K2: 3 | L2: 4.508 | M2: 36 | N2: 5 | O2: 4.4 | P2: 37 | Q2: 7 | R2: 4.29 | S2: 39 | T2: 8 | U2: 4.0170000000000003 | V2: 35 | W2: 6 | X2: 4.0149999999999997 | Y2: 40 | Z2: 297 | AA2: =+(X2+U2+R2+O2+L2+I2+F2+C2)/8 -> 4.3576249999999996
A3: GOROI | B3: 2 | C3: 4.452 | D3: 34 | E3: 1 | F3: 4.5670000000000002 | G3: 35 | H3: 3 | I3: 4.343 | J3: 37 | K3: 5 | L3: 4.508 | M3: 34 | N3: 7 | O3: 4.18 | P3: 36 | Q3: 8 | R3: 4.18 | S3: 38 | T3: 6 | U3: 4.0170000000000003 | V3: 36 | W3: 4 | X3: 4.125 | Y3: 39 | Z3: 289 | AA3: =+(X3+U3+R3+O3+L3+I3+F3+C3)/8 -> 4.2965
A4: ANGELAO | B4: 6 | C4: 4.4550000000000001 | D4: 34 | E4: 4 | F4: 4.4619999999999997 | G4: 36 | H4: 2 | I4: 4.29 | J4: 36 | K4: 1 | L4: 4.5650000000000004 | M4: 33 | N4: 3 | O4: 4.5110000000000001 | P4: 38 | Q4: 5 | R4: 4.3449999999999998 | S4: 37 | T4: 7 | U4: 4.18 | V4: 34 | W4: 8 | X4: 4.282 | Y4: 37 | Z4: 285 | AA4: =+(X4+U4+R4+O4+L4+I4+F4+C4)/8 -> 4.3862500000000004
A5: ERUNDA | B5: 5 | C5: 4.7290000000000001 | D5: 34 | E5: 7 | F5: 4.7830000000000004 | G5: 34 | H5: 8 | I5: 4.7830000000000004 | J5: 35 | K5: 6 | L5: 4.7839999999999998 | M5: 32 | N5: 4 | O5: 4.7850000000000001 | P5: 34 | Q5: 2 | R5: 4.7850000000000001 | S5: 35 | T5: 1 | U5: 4.8949999999999996 | V5: 34 | W5: 3 | X5: 4.84 | Y5: 31 | Z5: 269 | AA5: =+(X5+U5+R5+O5+L5+I5+F5+C5)/8 -> 4.798
A6: MARQUINHO | B6: 8 | C6: 4.8940000000000001 | D6: 33 | E6: 6 | F6: 5.0049999999999999 | G6: 32 | H6: 4 | I6: 4.7830000000000004 | J6: 34 | K6: 2 | L6: 4.7850000000000001 | M6: 32 | N6: 1 | O6: 5.1130000000000004 | P6: 32 | Q6: 3 | R6: 4.7839999999999998 | S6: 35 | T6: 5 | U6: 4.73 | V6: 32 | W6: 7 | X6: 4.7279999999999998 | Y6: 35 | Z6: 265 | AA6: =+(X6+U6+R6+O6+L6+I6+F6+C6)/8 -> 4.8527500000000003
A7: KLEBER | B7: 1 | C7: 4.9480000000000004 | D7: 33 | E7: 3 | F7: 4.782 | G7: 35 | H7: 5 | I7: 4.673 | J7: 31 | K7: 7 | L7: 4.51 | M7: 33 | N7: 8 | O7: 4.0149999999999997 | P7: 36 | Q7: 6 | R7: 4.7839999999999998 | S7: 32 | T7: 4 | U7: 4.73 | V7: 32 | W7: 2 | X7: 4.8380000000000001 | Y7: 30 | Z7: 262 | AA7: =+(X7+U7+R7+O7+L7+I7+F7+C7)/8 -> 4.66
A8: JUNINHO | B8: 3 | C8: 4.7850000000000001 | D8: 33 | E8: 5 | F8: 4.0170000000000003 | G8: 36 | H8: 7 | I8: 4.673 | J8: 35 | K8: 8 | L8: 4.18 | M8: 35 | N8: 6 | O8: 4.73 | P8: 35 | Q8: 4 | R8: 4.7850000000000001 | S8: 8 | Z8: 182 | AA8: =+(X8+U8+R8+O8+L8+I8+F8+C8)/8 -> 3.3962500000000002
A9: BONGA | B9: 7 | C9: 4.673 | D9: 32 | E9: 8 | F9: 4.84 | G9: 21 | H9: 6 | I9: 5.3339999999999996 | J9: 5 | K9: 4 | L9: 4.8419999999999996 | M9: 8 | Z9: 66 | AA9: =+(X9+U9+R9+O9+L9+I9+F9+C9)/8 -> 2.461125