A1: 1º Bateria
A2: Nome | B2: P | C2: M.VOL | D2: B1 | E2: P | F2: M.VOL | G2: B2 | H2: P | I2: M.VOL | J2: B3 | K2: P | L2: M.VOL | M2: B4 | N2: P | O2: M.VOL | P2: B5 | Q2: P | R2: M.VOL | S2: B6 | T2: P | U2: M.VOL | V2: B7 | W2: P | X2: M.VOL | Y2: B8 | Z2: TOTAL | AA2: MEDIA
A3: DINHO | B3: 4 | C3: 4.8390000000000004 | D3: 58 | E3: 2 | F3: 4.8949999999999996 | G3: 58 | H3: 1 | I3: 5.0060000000000002 | J3: 53 | K3: 3 | L3: 4.8940000000000001 | M3: 55 | N3: 5 | O3: 4.84 | P3: 54 | Q3: 7 | R3: 4.7850000000000001 | S3: 53 | T3: 8 | U3: 4.7839999999999998 | V3: 52 | W3: 6 | X3: 4.62 | Y3: 52 | Z3: =+Y3+V3+S3+P3+M3+J3+G3+D3 -> 435 | AA3: =+(X3+U3+R3+O3+L3+I3+F3+C3)/8 -> 4.8328749999999996
A4: BONGA | B4: 1 | C4: 5.1139999999999999 | D4: 54 | E4: 3 | F4: 4.8929999999999998 | G4: 56 | H4: 5 | I4: 5.0019999999999998 | J4: 56 | K4: 7 | L4: 5.0039999999999996 | M4: 52 | N4: 8 | O4: 4.9489999999999998 | P4: 55 | Q4: 6 | R4: 4.84 | S4: 54 | T4: 4 | U4: 4.8390000000000004 | V4: 52 | W4: 2 | X4: 4.5659999999999998 | Y4: 52 | Z4: =+Y4+V4+S4+P4+M4+J4+G4+D4 -> 431 | AA4: =+(X4+U4+R4+O4+L4+I4+F4+C4)/8 -> 4.9008749999999992
A5: RUBENS | B5: 2 | C5: 5.0609999999999999 | D5: 53 | E5: 1 | F5: 5.28 | G5: 51 | H5: 3 | I5: 5.06 | J5: 55 | K5: 5 | L5: 4.8929999999999998 | M5: 54 | N5: 7 | O5: 5.0060000000000002 | P5: 56 | Q5: 8 | R5: 5.1689999999999996 | S5: 51 | T5: 6 | U5: 4.8949999999999996 | V5: 51 | W5: 4 | X5: 5.0039999999999996 | Y5: 49 | Z5: =+Y5+V5+S5+P5+M5+J5+G5+D5 -> 420 | AA5: =+(X5+U5+R5+O5+L5+I5+F5+C5)/8 -> 5.0459999999999994
A6: KLEBER | B6: 5 | C6: 5.1710000000000003 | D6: 52 | E6: 7 | F6: 5.0030000000000001 | G6: 54 | H6: 8 | I6: 5.0030000000000001 | J6: 52 | K6: 6 | L6: 5.0030000000000001 | M6: 54 | N6: 4 | O6: 4.9509999999999996 | P6: 50 | Q6: 2 | R6: 5.0049999999999999 | S6: 41 | T6: 1 | U6: 4.8949999999999996 | V6: 46 | W6: 3 | X6: 4.51 | Y6: 46 | Z6: =+Y6+V6+S6+P6+M6+J6+G6+D6 -> 395 | AA6: =+(X6+U6+R6+O6+L6+I6+F6+C6)/8 -> 4.9426250000000005
A7: NETO | B7: 8 | C7: 5.28 | D7: 47 | E7: 6 | F7: 5.1189999999999998 | G7: 46 | H7: 4 | I7: 5.06 | J7: 49 | K7: 2 | L7: 5.1150000000000002 | M7: 51 | N7: 1 | O7: 5.2229999999999999 | P7: 45 | Q7: 3 | R7: 5.1130000000000004 | S7: 49 | T7: 5 | U7: 4.8410000000000002 | V7: 46 | W7: 7 | X7: 4.95 | Y7: 46 | Z7: =+Y7+V7+S7+P7+M7+J7+G7+D7 -> 379 | AA7: =+(X7+U7+R7+O7+L7+I7+F7+C7)/8 -> 5.0876249999999992
A8: ERIC | B8: 3 | C8: 5.0620000000000003 | D8: 51 | E8: 5 | F8: 5.0609999999999999 | G8: 48 | H8: 7 | I8: 5.0590000000000002 | J8: 51 | K8: 8 | L8: 5.2249999999999996 | M8: 46 | N8: 6 | O8: 5.1710000000000003 | P8: 48 | Q8: 4 | R8: 5.1139999999999999 | S8: 23 | T8: 2 | U8: 4.9489999999999998 | V8: 46 | W8: 1 | X8: 5.1130000000000004 | Y8: 37 | Z8: =+Y8+V8+S8+P8+M8+J8+G8+D8 -> 350 | AA8: =+(X8+U8+R8+O8+L8+I8+F8+C8)/8 -> 5.0942500000000006
A9: BOLA | B9: 7 | C9: 5.718 | D9: 47 | E9: 8 | F9: 5.4980000000000002 | G9: 45 | H9: 6 | I9: 5.444 | J9: 49 | K9: 4 | L9: 5.5 | M9: 46 | N9: 2 | O9: 5.7210000000000001 | P9: 42 | Q9: 1 | R9: 3.3010000000000002 | S9: 30 | T9: 3 | U9: 5.5529999999999999 | V9: 44 | W9: 5 | X9: 5.3360000000000003 | Y9: 44 | Z9: =+Y9+V9+S9+P9+M9+J9+G9+D9 -> 347 | AA9: =+(X9+U9+R9+O9+L9+I9+F9+C9)/8 -> 5.2588749999999997
A10: BOMBA | B10: 6 | C10: 4.9480000000000004 | D10: 52 | E10: 4 | F10: 5.2770000000000001 | G10: 20 | H10: 2 | I10: 5.0590000000000002 | J10: 51 | K10: 1 | L10: 5.0609999999999999 | M10: 49 | N10: 3 | O10: 5.117 | P10: 48 | Q10: 5 | R10: 5.1139999999999999 | S10: 39 | T10: 7 | U10: 5.06 | V10: 46 | W10: 8 | X10: 5.226 | Y10: 35 | Z10: =+Y10+V10+S10+P10+M10+J10+G10+D10 -> 340 | AA10: =+(X10+U10+R10+O10+L10+I10+F10+C10)/8 -> 5.1077500000000002
A12: 2º Bateria
A13: Nome | B13: P | C13: M.VOL | D13: B1 | E13: P | F13: M.VOL | G13: B2 | H13: P | I13: M.VOL | J13: B3 | K13: P | L13: M.VOL | M13: B4 | N13: P | O13: M.VOL | P13: B5 | Q13: P | R13: M.VOL | S13: B6 | T13: P | U13: M.VOL | V13: B7 | W13: P | X13: M.VOL | Y13: B8 | Z13: TOTAL | AA13: MEDIA
A14: MARQUINHO | B14: 6 | C14: 4.7839999999999998 | D14: 57 | E14: 4 | F14: 4.8410000000000002 | G14: 56 | H14: 2 | I14: 4.7850000000000001 | J14: 58 | K14: 1 | L14: 4.8949999999999996 | M14: 56 | N14: 3 | O14: 4.734 | P14: 60 | Q14: 5 | R14: 4.6189999999999998 | S14: 58 | T14: 7 | U14: 4.4539999999999997 | V14: 56 | W14: 8 | X14: 3.7949999999999999 | Y14: 58 | Z14: =+Y14+V14+S14+P14+M14+J14+G14+D14 -> 459 | AA14: =+(X14+U14+R14+O14+L14+I14+F14+C14)/8 -> 4.6133749999999996
A15: JUNINHO | B15: 7 | C15: 4.84 | D15: 58 | E15: 8 | F15: 4.8380000000000001 | G15: 59 | H15: 6 | I15: 4.8289999999999997 | J15: 57 | K15: 4 | L15: 4.8949999999999996 | M15: 57 | N15: 2 | O15: 4.9480000000000004 | P15: 57 | Q15: 1 | R15: 5.0570000000000004 | S15: 50 | T15: 3 | U15: 4.5090000000000003 | V15: 53 | W15: 5 | X15: 4.4 | Y15: 57 | Z15: =+Y15+V15+S15+P15+M15+J15+G15+D15 -> 448 | AA15: =+(X15+U15+R15+O15+L15+I15+F15+C15)/8 -> 4.7895000000000003
A16: MARCEL | B16: 5 | C16: 4.8940000000000001 | D16: 53 | E16: 7 | F16: 4.8419999999999996 | G16: 58 | H16: 8 | I16: 4.8949999999999996 | J16: 56 | K16: 6 | L16: 4.8380000000000001 | M16: 58 | N16: 4 | O16: 4.8390000000000004 | P16: 56 | Q16: 2 | R16: 4.7859999999999996 | S16: 57 | T16: 1 | U16: 4.6740000000000004 | V16: 52 | W16: 3 | X16: 4.2889999999999997 | Y16: 58 | Z16: =+Y16+V16+S16+P16+M16+J16+G16+D16 -> 448 | AA16: =+(X16+U16+R16+O16+L16+I16+F16+C16)/8 -> 4.7571250000000003
A17: ERUNDA | B17: 1 | C17: 5.1689999999999996 | D17: 51 | E17: 3 | F17: 4.84 | G17: 55 | H17: 5 | I17: 4.73 | J17: 55 | K17: 7 | L17: 4.73 | M17: 57 | N17: 8 | O17: 4.8390000000000004 | P17: 58 | Q17: 6 | R17: 4.7309999999999999 | S17: 57 | T17: 4 | U17: 4.6239999999999997 | V17: 51 | W17: 2 | X17: 4.0069999999999997 | Y17: 55 | Z17: =+Y17+V17+S17+P17+M17+J17+G17+D17 -> 439 | AA17: =+(X17+U17+R17+O17+L17+I17+F17+C17)/8 -> 4.7087500000000002
A18: MICHEL | B18: 4 | C18: 4.734 | D18: 57 | E18: 2 | F18: 4.8410000000000002 | G18: 55 | H18: 1 | I18: 4.8390000000000004 | J18: 55 | K18: 3 | L18: 4.7839999999999998 | M18: 28 | N18: 5 | O18: 3.9020000000000001 | P18: 59 | Q18: 7 | R18: 4.6740000000000004 | S18: 61 | T18: 8 | U18: 4.3470000000000004 | V18: 55 | W18: 6 | X18: 3.7949999999999999 | Y18: 59 | Z18: =+Y18+V18+S18+P18+M18+J18+G18+D18 -> 429 | AA18: =+(X18+U18+R18+O18+L18+I18+F18+C18)/8 -> 4.4895000000000005
A19: GIOVANNI | B19: 3 | C19: 4.9489999999999998 | D19: 52 | E19: 5 | F19: 4.8949999999999996 | G19: 54 | H19: 7 | I19: 4.8369999999999997 | J19: 53 | K19: 8 | L19: 4.8940000000000001 | M19: 56 | N19: 6 | O19: 4.9489999999999998 | P19: 56 | Q19: 4 | R19: 4.8369999999999997 | S19: 55 | T19: 2 | U19: 4.7839999999999998 | V19: 49 | W19: 1 | X19: 4.8390000000000004 | Y19: 50 | Z19: =+Y19+V19+S19+P19+M19+J19+G19+D19 -> 425 | AA19: =+(X19+U19+R19+O19+L19+I19+F19+C19)/8 -> 4.8729999999999993
A20: GELEIA | B20: 8 | C20: 5.0030000000000001 | D20: 51 | E20: 6 | F20: 4.84 | G20: 52 | H20: 4 | I20: 4.84 | J20: 30 | K20: 2 | L20: 5.0069999999999997 | M20: 52 | N20: 1 | O20: 5.0049999999999999 | P20: 52 | Q20: 3 | R20: 4.8390000000000004 | S20: 52 | T20: 5 | U20: 4.7880000000000003 | V20: 47 | W20: 7 | X20: 4.4450000000000003 | Y20: 53 | Z20: =+Y20+V20+S20+P20+M20+J20+G20+D20 -> 389 | AA20: =+(X20+U20+R20+O20+L20+I20+F20+C20)/8 -> 4.8458750000000004
A21: GOROI | B21: 2 | C21: 5 | D21: 53 | E21: 1 | F21: 5.1689999999999996 | G21: 37 | H21: 3 | I21: 4.95 | J21: 53 | K21: 5 | L21: 4.8390000000000004 | M21: 58 | N21: 7 | O21: 4.8979999999999997 | P21: 56 | Q21: 8 | R21: 4.84 | S21: 56 | T21: 6 | U21: 4.62 | V21: 45 | W21: 4 | X21: 4.4039999999999999 | Y21: 24 | Z21: =+Y21+V21+S21+P21+M21+J21+G21+D21 -> 382 | AA21: =+(X21+U21+R21+O21+L21+I21+F21+C21)/8 -> 4.84
A24: Final
A25: Nome | B25: P | C25: M.VOL | D25: B1 | E25: P | F25: M.VOL | G25: B2 | H25: P | I25: M.VOL | J25: B3 | K25: P | L25: M.VOL | M25: B4 | N25: P | O25: M.VOL | P25: B5 | Q25: P | R25: M.VOL | S25: B6 | T25: P | U25: M.VOL | V25: B7 | W25: P | X25: M.VOL | Y25: B8 | Z25: TOTAL | AA25: MEDIA
A26: JUNINHO | B26: 7 | C26: 4.7290000000000001 | D26: 35 | E26: 8 | F26: 4.7290000000000001 | G26: 34 | H26: 6 | I26: 4.7830000000000004 | J26: 35 | K26: 4 | L26: 4.7309999999999999 | M26: 35 | N26: 2 | O26: 4.9489999999999998 | P26: 34 | Q26: 1 | R26: 4.8949999999999996 | S26: 33 | T26: 3 | U26: 4.7309999999999999 | V26: 35 | W26: 5 | X26: 4.7279999999999998 | Y26: 35 | Z26: =+Y26+V26+S26+P26+M26+J26+G26+D26 -> 276 | AA26: =+(X26+U26+R26+O26+L26+I26+F26+C26)/8 -> 4.7843749999999998
A27: MARQUINHO | B27: 6 | C27: 4.7290000000000001 | D27: 35 | E27: 4 | F27: 4.7839999999999998 | G27: 35 | H27: 2 | I27: 4.8390000000000004 | J27: 35 | K27: 1 | L27: 4.9480000000000004 | M27: 33 | N27: 3 | O27: 4.7850000000000001 | P27: 34 | Q27: 5 | R27: 4.73 | S27: 34 | T27: 7 | U27: 4.7270000000000003 | V27: 35 | W27: 8 | X27: 4.6189999999999998 | Y27: 34 | Z27: =+Y27+V27+S27+P27+M27+J27+G27+D27 -> 275 | AA27: =+(X27+U27+R27+O27+L27+I27+F27+C27)/8 -> 4.7701250000000002
A28: MARCEL | B28: 4 | C28: 4.7859999999999996 | D28: 34 | E28: 2 | F28: 4.8390000000000004 | G28: 33 | H28: 1 | I28: 4.9470000000000001 | J28: 32 | K28: 3 | L28: 4.84 | M28: 34 | N28: 5 | O28: 4.8380000000000001 | P28: 35 | Q28: 7 | R28: 4.7859999999999996 | S28: 35 | T28: 8 | U28: 4.7839999999999998 | V28: 34 | W28: 6 | X28: 4.7309999999999999 | Y28: 35 | Z28: =+Y28+V28+S28+P28+M28+J28+G28+D28 -> 272 | AA28: =+(X28+U28+R28+O28+L28+I28+F28+C28)/8 -> 4.8188750000000002
A29: MICHEL | B29: 3 | C29: 4.8369999999999997 | D29: 28 | E29: 5 | F29: 4.7309999999999999 | G29: 34 | H29: 7 | I29: 4.6189999999999998 | J29: 37 | K29: 8 | L29: 4.6210000000000004 | M29: 35 | N29: 6 | O29: 4.5650000000000004 | P29: 35 | Q29: 4 | R29: 4.7279999999999998 | S29: 35 | T29: 2 | U29: 4.7859999999999996 | V29: 35 | W29: 1 | X29: 4.6749999999999998 | Y29: 33 | Z29: =+Y29+V29+S29+P29+M29+J29+G29+D29 -> 272 | AA29: =+(X29+U29+R29+O29+L29+I29+F29+C29)/8 -> 4.6952499999999997
A30: DINHO | B30: 2 | C30: 5.06 | D30: 32 | E30: 1 | F30: 5.1689999999999996 | G30: 32 | H30: 3 | I30: 4.9480000000000004 | J30: 33 | K30: 5 | L30: 5.0030000000000001 | M30: 34 | N30: 7 | O30: 4.9489999999999998 | P30: 33 | Q30: 8 | R30: 4.95 | S30: 33 | T30: 6 | U30: 4.9470000000000001 | V30: 32 | W30: 4 | X30: 4.84 | Y30: 32 | Z30: =+Y30+V30+S30+P30+M30+J30+G30+D30 -> 261 | AA30: =+(X30+U30+R30+O30+L30+I30+F30+C30)/8 -> 4.98325
A31: BONGA | B31: 5 | C31: 4.95 | D31: 31 | E31: 7 | F31: 4.95 | G31: 30 | H31: 8 | I31: 5.06 | J31: 31 | K31: 6 | L31: 5.0060000000000002 | M31: 32 | N31: 4 | O31: 5.06 | P31: 32 | Q31: 2 | R31: 4.95 | S31: 34 | T31: 1 | U31: 5.0039999999999996 | V31: 32 | W31: 3 | X31: 4.8390000000000004 | Y31: 32 | Z31: =+Y31+V31+S31+P31+M31+J31+G31+D31 -> 254 | AA31: =+(X31+U31+R31+O31+L31+I31+F31+C31)/8 -> 4.9773750000000003
A32: ERUNDA | B32: 1 | C32: 4.9489999999999998 | D32: 32 | E32: 3 | F32: 4.7270000000000003 | G32: 34 | H32: 5 | I32: 4.7850000000000001 | J32: 30 | K32: 7 | L32: 4.7839999999999998 | M32: 28 | N32: 8 | O32: 4.84 | P32: 34 | Q32: 6 | R32: 4.6749999999999998 | S32: 34 | T32: 4 | U32: 4.7290000000000001 | V32: 32 | W32: 2 | X32: 5.1139999999999999 | Y32: 27 | Z32: =+Y32+V32+S32+P32+M32+J32+G32+D32 -> 251 | AA32: =+(X32+U32+R32+O32+L32+I32+F32+C32)/8 -> 4.8253749999999993
A33: GIOVANNI | B33: 8 | C33: 4.84 | D33: 35 | E33: 6 | F33: 4.9480000000000004 | G33: 29 | H33: 4 | I33: 5.0579999999999998 | J33: 31 | K33: 2 | L33: 5.0590000000000002 | M33: 33 | N33: 1 | O33: 5.1689999999999996 | P33: 30 | Q33: 3 | R33: 5.0579999999999998 | S33: 32 | T33: 5 | U33: 5.1150000000000002 | V33: 31 | W33: 7 | X33: 5.06 | Y33: 29 | Z33: =+Y33+V33+S33+P33+M33+J33+G33+D33 -> 250 | AA33: =+(X33+U33+R33+O33+L33+I33+F33+C33)/8 -> 5.0383750000000003