B1: S/DESCARTE | C1: New Beetle | D1: Maverick | E1: Palio | F1: Alfa | G1: Caminhão | H1: Mercedes | I1: Ka | J1: F 250 | K1: LIVRE
A2: Pos | B2: NOME | C2: 1 ETAPA | D2: 2 ETAPA | E2: 3 ETAPA | F2: 4 ETAPA | G2: 5 ETAPA | H2: 6 ETAPA | I2: 7 ETAPA | J2: 8 ETAPA | K2: 9 ETAPA | L2: Desc | M2: Total
A3: 1 | B3: ANDERSON | C3: 242.63800000000001 | D3: 243.191 | E3: 242.45 | F3: 250.93600000000001 | G3: 229 | H3: 263.17021276595744 | I3: 238.63829787234042 | J3: 236.87234042553192 | K3: 261.08510638297872 | L3: =MINA(K3,J3,I3,H3,G3,F3,E3,D3,C3) -> 229 | M3: 1978.9809574468086
A4: =+A3+1 -> 2 | B4: MICHEL | C4: 230.851 | D4: 223.23400000000001 | E4: 239.11 | F4: 260.34 | G4: 230.553 | H4: 252.85106382978699 | I4: 239.74468085106383 | J4: 253.17021276595744 | K4: 250.85106382978722 | L4: =MINA(K4,J4,I4,H4,G4,F4,E4,D4,C4) -> 223.23400000000001 | M4: 1957.4710212765958
A5: =+A4+1 -> 3 | B5: DINHO | C5: 215.78700000000001 | D5: 237.745 | E5: 236.62 | F5: 250.66 | G5: 230.63800000000001 | H5: 254.44680851063831 | I5: 230.78723404255319 | J5: 250.06382978723406 | K5: 236.06382978723406 | L5: =MINA(K5,J5,I5,H5,G5,F5,E5,D5,C5) -> 215.78700000000001 | M5: 1927.0247021276593
A6: =+A5+1 -> 4 | B6: JUNINHO | C6: 220.17 | D6: 230.702 | E6: 222.83 | F6: 254.97900000000001 | G6: 227.34 | H6: 244.87234042553192 | I6: 0 | J6: 239.29787234042553 | K6: 247.65957446808511 | L6: =MINA(K6,J6,I6,H6,G6,F6,E6,D6,C6) -> 0 | M6: 1887.8507872340426
A7: =+A6+1 -> 5 | B7: KLEBER | C7: 203.255 | D7: 215.191 | E7: 227.64 | F7: 248.87200000000001 | G7: 229.66 | H7: 210.61702127659575 | I7: 232.7659574468085 | J7: 255.63829787234042 | K7: 255.89361702127658 | L7: =MINA(K7,J7,I7,H7,G7,F7,E7,D7,C7) -> 203.255 | M7: 1876.2778936170212
A8: =+A7+1 -> 6 | B8: BONGA | C8: 220.82900000000001 | D8: 231.12799999999999 | E8: 222.85 | F8: 243.10599999999999 | G8: 224.66 | H8: 246.82978723404301 | I8: 214.65957446808511 | J8: 229.70212765957447 | K8: 248.85106382978722 | L8: =MINA(K8,J8,I8,H8,G8,F8,E8,D8,C8) -> 214.65957446808511 | M8: 1867.9559787234045
A9: =+A8+1 -> 7 | B9: ERUNDINA | C9: 196.82900000000001 | D9: 220.76599999999999 | E9: 226.74 | F9: 246.53200000000001 | G9: 220.511 | H9: 231 | I9: 229.29787234042553 | J9: 243.85106382978722 | K9: 242.2340425531915 | L9: =MINA(K9,J9,I9,H9,G9,F9,E9,D9,C9) -> 196.82900000000001 | M9: 1860.9319787234047
A10: =+A9+1 -> 8 | B10: CAVANHA | C10: 228.893 | D10: 224.10599999999999 | E10: 225.7 | F10: 179.83 | G10: 227.809 | H10: 242.29787234042601 | I10: 218.85106382978722 | J10: 242.19148936170214 | K10: 241.91489361702128 | L10: =MINA(K10,J10,I10,H10,G10,F10,E10,D10,C10) -> 179.83 | M10: 1851.7633191489372
A11: =+A10+1 -> 9 | B11: MARCEL | C11: 173.23400000000001 | D11: 0 | E11: 231.77 | F11: 229.83 | G11: 231.87200000000001 | H11: 245.48936170212767 | I11: 224.68085106382978 | J11: 238.65957446808511 | K11: 252.21276595744681 | L11: =MINA(K11,J11,I11,H11,G11,F11,E11,D11,C11) -> 0 | M11: 1827.7485531914895
A12: =+A11+1 -> 10 | B12: JULIO | C12: 209.87200000000001 | D12: 224.78700000000001 | E12: 225.19 | F12: 248.36199999999999 | G12: 222.06399999999999 | H12: 214.78723404255319 | I12: 222.17021276595744 | J12: 205.04255319148936 | K12: 243.21276595744681 | L12: =MINA(K12,J12,I12,H12,G12,F12,E12,D12,C12) -> 205.04255319148936 | M12: 1810.4452127659572
A13: =+A12+1 -> 11 | B13: RUBENS | C13: 210.78700000000001 | D13: 219.447 | E13: 211.85 | F13: 229.511 | G13: 223.298 | H13: 232.72340425531914 | I13: 218.42553191489361 | J13: 230.25531914893617 | K13: 243.63829787234042 | L13: =MINA(K13,J13,I13,H13,G13,F13,E13,D13,C13) -> 210.78700000000001 | M13: 1809.1485531914893
A14: =+A13+1 -> 12 | B14: CAVERNA | C14: 212.78700000000001 | D14: 213.27600000000001 | E14: 219.4 | F14: 229.23400000000001 | G14: 226.10599999999999 | H14: 259.08510638297872 | I14: 217.82978723404256 | J14: 230.04255319148936 | K14: 209.19148936170214 | L14: =MINA(K14,J14,I14,H14,G14,F14,E14,D14,C14) -> 209.19148936170214 | M14: 1807.7604468085106
A15: =+A14+1 -> 13 | B15: ANGELÃO | C15: 225.91399999999999 | D15: 213.851 | E15: 212.28 | F15: 218.27699999999999 | G15: 221.511 | H15: 236.25531914893617 | I15: 225.82978723404256 | J15: 215.61702127659575 | K15: 243.29787234042553 | L15: =MINA(K15,J15,I15,H15,G15,F15,E15,D15,C15) -> 212.28 | M15: 1800.5530000000001
A16: =+A15+1 -> 14 | B16: GODOI | C16: 222.21199999999999 | D16: 192.06399999999999 | E16: 218.09 | F16: 234.27699999999999 | G16: 221.17 | H16: 211.65957446808511 | I16: 125 | J16: 232.25531914893617 | K16: 254.85106382978722 | L16: =MINA(K16,J16,I16,H16,G16,F16,E16,D16,C16) -> 125 | M16: 1786.5789574468085
A17: =+A16+1 -> 15 | B17: GABRIEL | C17: 181.851 | D17: 211.12799999999999 | E17: 211.4 | F17: 241.27699999999999 | G17: 222.63800000000001 | H17: 233.57446808510639 | I17: 0 | J17: 232.10638297872342 | K17: 237.10638297872342 | L17: =MINA(K17,J17,I17,H17,G17,F17,E17,D17,C17) -> 0 | M17: 1771.081234042553
A18: =+A17+1 -> 16 | B18: GIOVANNI | C18: 0 | D18: 210.83 | E18: 208.64 | F18: 248 | G18: 209.27699999999999 | H18: 237.06382978723406 | I18: 199.31914893617022 | J18: 223.80851063829786 | K18: 226.97872340425531 | L18: =MINA(K18,J18,I18,H18,G18,F18,E18,D18,C18) -> 0 | M18: 1763.9172127659574
A19: =+A18+1 -> 17 | B19: RICARDO | C19: 205.21199999999999 | D19: 208.23400000000001 | E19: 216.66 | F19: 219.191 | G19: 217.83 | H19: 226.48936170212767 | I19: 229.80851063829786 | J19: 215.12765957446808 | K19: 224.80851063829786 | L19: =MINA(K19,J19,I19,H19,G19,F19,E19,D19,C19) -> 205.21199999999999 | M19: 1758.1490425531911
A20: =+A19+1 -> 18 | B20: ERIC | C20: 0 | D20: 201.65899999999999 | E20: 200.19 | F20: 237.87200000000001 | G20: 220.63800000000001 | H20: 241.12765957446808 | I20: 216.74468085106383 | J20: 224.87234042553192 | K20: 213.06382978723406 | L20: =MINA(K20,J20,I20,H20,G20,F20,E20,D20,C20) -> 0 | M20: 1756.1675106382979
A21: =+A20+1 -> 19 | B21: POWER | C21: 194.61699999999999 | D21: 191.149 | E21: 0 | F21: 232.851 | G21: 224.34 | H21: 223.82978723404256 | I21: 218.61702127659575 | J21: 231.59574468085106 | K21: 237.12765957446808 | L21: =MINA(K21,J21,I21,H21,G21,F21,E21,D21,C21) -> 0 | M21: 1754.1272127659574
A22: =+A21+1 -> 20 | B22: JAPÃO | C22: 223.191 | D22: 203.89400000000001 | E22: 218.66 | F22: 214.61699999999999 | G22: 0 | H22: 213.63829787234042 | I22: 221.38297872340425 | J22: 224.27659574468086 | K22: 231.61702127659575 | L22: =MINA(K22,J22,I22,H22,G22,F22,E22,D22,C22) -> 0 | M22: 1751.2768936170212
A23: =+A22+1 -> 21 | B23: MANE | C23: 197.08500000000001 | D23: 215.23400000000001 | E23: 191.38 | F23: 232.149 | G23: 221.76599999999999 | H23: 202.06382978723406 | I23: 219.91489361702128 | J23: 215.06382978723406 | K23: 237.34042553191489 | L23: =MINA(K23,J23,I23,H23,G23,F23,E23,D23,C23) -> 191.38 | M23: 1740.6169787234044
A24: =+A23+1 -> 22 | B24: JERONIMO | C24: 200.63800000000001 | D24: 193.31899999999999 | E24: 185.87 | F24: 189.298 | G24: 224.809 | H24: 220.25531914893617 | I24: 222.7659574468085 | J24: 234.78723404255319 | K24: 241.14893617021278 | L24: =MINA(K24,J24,I24,H24,G24,F24,E24,D24,C24) -> 185.87 | M24: 1727.0214468085105
A25: =+A24+1 -> 23 | B25: RUDSON | C25: 176.851 | D25: 204.23400000000001 | E25: 215.23 | F25: 229.66 | G25: 210.34 | H25: 211.723404255319 | I25: 202.78723404255319 | J25: 210.40425531914894 | K25: 207.74468085106383 | L25: =MINA(K25,J25,I25,H25,G25,F25,E25,D25,C25) -> 176.851 | M25: 1692.1235744680848
A26: =+A25+1 -> 24 | B26: NETO | C26: 192.851 | D26: 185.04300000000001 | E26: 189.17 | F26: 227.38300000000001 | G26: 179.191 | H26: 227.08510638297872 | I26: 211.19148936170214 | J26: 222.65957446808511 | K26: 194.7659574468085 | L26: =MINA(K26,J26,I26,H26,G26,F26,E26,D26,C26) -> 179.191 | M26: 1650.1491276595746
A27: =+A26+1 -> 25 | B27: M.JOSE | C27: 187.82900000000001 | D27: 180.61699999999999 | E27: 188.28 | F27: 207.17 | G27: 183.23400000000001 | H27: 188.06382978723406 | I27: 0 | J27: 199.63829787234042 | K27: 201.36170212765958 | L27: =MINA(K27,J27,I27,H27,G27,F27,E27,D27,C27) -> 0 | M27: 1536.1938297872341
A28: =+A27+1 -> 26 | B28: CONRADO | C28: 0 | D28: 169.745 | E28: 202.47 | F28: 231.04300000000001 | G28: 218.27699999999999 | H28: 228.63829787234042 | I28: 174.21276595744681 | J28: 0 | K28: 217.85106382978722 | L28: =MINA(K28,J28,I28,H28,G28,F28,E28,D28,C28) -> 0 | M28: 1442.2371276595745
A29: =+A28+1 -> 27 | B29: XUBAKA | C29: 208.65899999999999 | D29: 203.83 | E29: 202.6 | F29: 199.53200000000001 | G29: 205.851 | H29: 219.21276595744681 | I29: 192.31914893617022 | J29: 0 | K29: 0 | L29: =MINA(K29,J29,I29,H29,G29,F29,E29,D29,C29) -> 0 | M29: 1432.0039148936171
A30: =+A29+1 -> 28 | B30: DANIEL | C30: 162.80799999999999 | D30: 159.46799999999999 | E30: 171.28 | F30: 165.17 | G30: 177.191 | H30: 197.31914893617022 | I30: 166.2340425531915 | J30: 179.68085106382978 | K30: 0 | L30: =MINA(K30,J30,I30,H30,G30,F30,E30,D30,C30) -> 0 | M30: 1379.1510425531915
A31: =+A30+1 -> 29 | B31: M.VINICIUS | C31: 180.851 | D31: 146.68100000000001 | E31: 168.28 | F31: 180.53200000000001 | G31: 186.63800000000001 | H31: 182.63829787234042 | I31: 0 | J31: 0 | K31: 163.27659574468086 | L31: =MINA(K31,J31,I31,H31,G31,F31,E31,D31,C31) -> 0 | M31: 1208.8968936170213
A32: =+A31+1 -> 30 | B32: SANDRO ITU | C32: 0 | D32: 0 | E32: 186.83 | F32: 193.23400000000001 | G32: 187.21299999999999 | H32: 181.10638297872342 | I32: 206.14893617021278 | J32: 218.68085106382978 | K32: 0 | L32: =MINA(K32,J32,I32,H32,G32,F32,E32,D32,C32) -> 0 | M32: 1173.213170212766
A33: =+A32+1 -> 31 | B33: WELLINGTON | C33: 200.27600000000001 | D33: 216.68100000000001 | E33: 223.3 | F33: 229.06399999999999 | G33: 212.12799999999999 | H33: 0 | I33: 0 | J33: 0 | K33: 0 | L33: =MINA(K33,J33,I33,H33,G33,F33,E33,D33,C33) -> 0 | M33: 1081.4490000000001
A34: =+A33+1 -> 32 | B34: DANILO | C34: 204.12700000000001 | D34: 209.17 | E34: 190.23 | F34: 215.87200000000001 | G34: 198.91499999999999 | H34: 0 | I34: 0 | J34: 0 | K34: 0 | L34: =MINA(K34,J34,I34,H34,G34,F34,E34,D34,C34) -> 0 | M34: 1018.3140000000001
A35: =+A34+1 -> 33 | B35: JEISON | C35: 190.63800000000001 | D35: 198.298 | E35: 217.53 | F35: 232.46799999999999 | G35: 0 | H35: 0 | I35: 0 | J35: 0 | K35: 0 | L35: =MINA(K35,J35,I35,H35,G35,F35,E35,D35,C35) -> 0 | M35: 838.93399999999997
A36: =+A35+1 -> 34 | B36: GERONIMO | F36: 206.04300000000001 | G36: 212.511 | H36: 0 | I36: 209.65957446808511 | J36: 0 | K36: 208.36170212765958 | L36: =MINA(K36,J36,I36,H36,G36,F36,E36,D36,C36) -> 0 | M36: 836.57527659574464
A37: =+A36+1 -> 35 | B37: PACHECO | C37: 218.08500000000001 | D37: 197.91499999999999 | E37: 178.26 | F37: 0 | G37: 216.78700000000001 | H37: 0 | I37: 0 | J37: 0 | K37: 0 | L37: =MINA(K37,J37,I37,H37,G37,F37,E37,D37,C37) -> 0 | M37: 811.04700000000003
A38: =+A37+1 -> 36 | B38: SIMONE | C38: 0 | D38: 185.04300000000001 | E38: 0 | F38: 219.489 | G38: 192.63800000000001 | H38: 187.85106382978722 | I38: 0 | J38: 0 | K38: 0 | L38: =MINA(K38,J38,I38,H38,G38,F38,E38,D38,C38) -> 0 | M38: 785.02106382978729
A39: =+A38+1 -> 37 | B39: RODRIGUINHO | C39: 193.02099999999999 | D39: 195.12799999999999 | E39: 182.53 | F39: 209.17 | G39: 0 | H39: 0 | I39: 0 | J39: 0 | K39: 0 | L39: =MINA(K39,J39,I39,H39,G39,F39,E39,D39,C39) -> 0 | M39: 779.84899999999993
A40: =+A39+1 -> 38 | B40: MARINHO | C40: 206.404 | D40: 202.553 | E40: 176.85 | F40: 188.21299999999999 | G40: 0 | H40: 0 | I40: 0 | J40: 0 | K40: 0 | L40: =MINA(K40,J40,I40,H40,G40,F40,E40,D40,C40) -> 0 | M40: 774.02
A41: =+A40+1 -> 39 | B41: HENRIQUE | C41: 0 | D41: 218.38300000000001 | E41: 0 | F41: 248.89400000000001 | G41: 229.34 | H41: 0 | I41: 0 | J41: 0 | K41: 0 | L41: =MINA(K41,J41,I41,H41,G41,F41,E41,D41,C41) -> 0 | M41: 696.61700000000008
A42: =+A41+1 -> 40 | B42: ALEX | C42: 210.02099999999999 | D42: 218.83 | E42: 212.72 | F42: 0 | G42: 0 | H42: 0 | I42: 0 | J42: 0 | K42: 0 | L42: =MINA(K42,J42,I42,H42,G42,F42,E42,D42,C42) -> 0 | M42: 641.57100000000003
A43: =+A42+1 -> 41 | B43: KIBOM | C43: 0 | D43: 202.57400000000001 | E43: 0 | F43: 234.04300000000001 | G43: 200.83 | H43: 0 | I43: 0 | J43: 0 | K43: 0 | L43: =MINA(K43,J43,I43,H43,G43,F43,E43,D43,C43) -> 0 | M43: 637.447
A44: =+A43+1 -> 42 | B44: MORA | C44: 199.02099999999999 | D44: 188.31899999999999 | E44: 0 | F44: 0 | G44: 201.66 | H44: 0 | I44: 0 | J44: 0 | K44: 0 | L44: =MINA(K44,J44,I44,H44,G44,F44,E44,D44,C44) -> 0 | M44: 589
A45: =+A44+1 -> 43 | B45: ROBERTO | C45: 0 | D45: 0 | E45: 0 | F45: 185.149 | G45: 182.78700000000001 | H45: 208.27659574468086 | I45: 0 | J45: 0 | K45: 0 | L45: =MINA(K45,J45,I45,H45,G45,F45,E45,D45,C45) -> 0 | M45: 576.21259574468093
A46: =+A45+1 -> 44 | B46: LUIZ FELIPE | C46: 152.148 | D46: 0 | E46: 0 | F46: 0 | G46: 0 | H46: 121.82978723404256 | I46: 126.55319148936171 | J46: 0 | K46: 170.57446808510639 | L46: =MINA(K46,J46,I46,H46,G46,F46,E46,D46,C46) -> 0 | M46: 571.10544680851069
A47: =+A46+1 -> 45 | B47: FLAVIO | C47: 0 | D47: 0 | E47: 0 | F47: 0 | G47: 0 | H47: 0 | I47: 166.21276595744681 | J47: 183.25531914893617 | K47: 199.38297872340425 | L47: =MINA(K47,J47,I47,H47,G47,F47,E47,D47,C47) -> 0 | M47: 548.85106382978722
A48: =+A47+1 -> 46 | B48: RACHID | C48: 153.78700000000001 | D48: 0 | E48: 175.87 | F48: 0 | G48: 0 | H48: 178.31914893617022 | I48: 0 | J48: 0 | K48: 0 | L48: =MINA(K48,J48,I48,H48,G48,F48,E48,D48,C48) -> 0 | M48: 507.97614893617026
A49: =+A48+1 -> 47 | B49: EVANDRO | C49: 0 | D49: 0 | E49: 0 | F49: 0 | G49: 0 | H49: 0 | I49: 0 | J49: 191.87234042553192 | K49: 192.46808510638297 | L49: =MINA(K49,J49,I49,H49,G49,F49,E49,D49,C49) -> 0 | M49: 384.34042553191489
A50: =+A49+1 -> 48 | B50: CAIO | C50: 0 | D50: 141.27600000000001 | E50: 192.11 | F50: 0 | G50: 0 | H50: 0 | I50: 0 | J50: 0 | K50: 0 | L50: =MINA(K50,J50,I50,H50,G50,F50,E50,D50,C50) -> 0 | M50: 333.38600000000002
A51: =+A50+1 -> 49 | B51: MURILO | C51: 0 | D51: 0 | E51: 0 | F51: 0 | G51: 0 | H51: 170.04255319148936 | I51: 0 | J51: 0 | K51: 115.19148936170212 | L51: =MINA(K51,J51,I51,H51,G51,F51,E51,D51,C51) -> 0 | M51: 285.2340425531915
A52: =+A51+1 -> 50 | B52: PICA PAU | C52: 0 | D52: 0 | E52: 0 | F52: 225.63800000000001 | G52: 0 | H52: 0 | I52: 0 | J52: 0 | K52: 0 | L52: =MINA(K52,J52,I52,H52,G52,F52,E52,D52,C52) -> 0 | M52: 225.63800000000001
A53: =+A52+1 -> 51 | B53: PRESUNTINHO | C53: 221.82900000000001 | D53: 0 | E53: 0 | F53: 0 | G53: 0 | H53: 0 | I53: 0 | J53: 0 | K53: 0 | L53: =MINA(K53,J53,I53,H53,G53,F53,E53,D53,C53) -> 0 | M53: 221.82900000000001
A54: =+A53+1 -> 52 | B54: NETO ROSA | C54: 0 | D54: 0 | E54: 0 | F54: 0 | G54: 0 | H54: 192.12765957446808 | I54: 0 | J54: 0 | K54: 0 | L54: =MINA(K54,J54,I54,H54,G54,F54,E54,D54,C54) -> 0 | M54: 192.12765957446808
A55: =+A54+1 -> 53 | B55: CLAYTON | C55: 0 | D55: 0 | E55: 0 | F55: 0 | G55: 0 | H55: 0 | I55: 0 | J55: 0 | K55: 189.7659574468085 | L55: =MINA(K55,J55,I55,H55,G55,F55,E55,D55,C55) -> 0 | M55: 189.7659574468085
A56: =+A55+1 -> 54 | B56: WALDIR | C56: 0 | D56: 0 | E56: 0 | F56: 0 | G56: 187.89400000000001 | H56: 0 | I56: 0 | J56: 0 | K56: 0 | L56: =MINA(K56,J56,I56,H56,G56,F56,E56,D56,C56) -> 0 | M56: 187.89400000000001
A57: =+A56+1 -> 55 | B57: GELEIA | C57: 0 | D57: 0 | E57: 0 | F57: 0 | G57: 0 | H57: 184.63829787234042 | I57: 0 | J57: 0 | K57: 0 | L57: =MINA(K57,J57,I57,H57,G57,F57,E57,D57,C57) -> 0 | M57: 184.63829787234042
A58: =+A57+1 -> 56 | B58: XANEL | C58: 0 | D58: 0 | E58: 0 | F58: 184.191 | G58: 0 | H58: 0 | I58: 0 | J58: 0 | K58: 0 | L58: =MINA(K58,J58,I58,H58,G58,F58,E58,D58,C58) -> 0 | M58: 184.191
A59: =+A58+1 -> 57 | B59: BOMBINHA | C59: 180.68 | D59: 0 | E59: 0 | F59: 0 | G59: 0 | H59: 0 | I59: 0 | J59: 0 | K59: 0 | L59: =MINA(K59,J59,I59,H59,G59,F59,E59,D59,C59) -> 0 | M59: 180.68
A60: =+A59+1 -> 58 | B60: CACO | C60: 0 | D60: 177.65899999999999 | E60: 0 | F60: 0 | G60: 0 | H60: 0 | I60: 0 | J60: 0 | K60: 0 | L60: =MINA(K60,J60,I60,H60,G60,F60,E60,D60,C60) -> 0 | M60: 177.65899999999999
A61: =+A60+1 -> 59 | B61: VANDERSON | C61: 163.255 | D61: 0 | E61: 0 | F61: 0 | G61: 0 | H61: 0 | I61: 0 | J61: 0 | K61: 0 | L61: =MINA(K61,J61,I61,H61,G61,F61,E61,D61,C61) -> 0 | M61: 163.255
A62: =+A61+1 -> 60 | B62: TIRSO | C62: 0 | D62: 0 | E62: 163.21 | F62: 0 | G62: 0 | H62: 0 | I62: 0 | J62: 0 | K62: 0 | L62: =MINA(K62,J62,I62,H62,G62,F62,E62,D62,C62) -> 0 | M62: 163.21
A63: =+A62+1 -> 61 | B63: JOAO GUILHERME | C63: 161.893 | D63: 0 | E63: 0 | F63: 0 | G63: 0 | H63: 0 | I63: 0 | J63: 0 | K63: 0 | L63: =MINA(K63,J63,I63,H63,G63,F63,E63,D63,C63) -> 0 | M63: 161.893
A64: =+A63+1 -> 62 | B64: MANO | C64: 0 | D64: 0 | E64: 0 | F64: 0 | G64: 0 | H64: 0 | I64: 0 | J64: 0 | K64: 159.25531914893617 | L64: =MINA(K64,J64,I64,H64,G64,F64,E64,D64,C64) -> 0 | M64: 159.25531914893617
A65: =+A64+1 -> 63 | B65: CID GOSME | C65: 0 | D65: 0 | E65: 0 | F65: 0 | G65: 0 | H65: 0 | I65: 0 | J65: 0 | K65: 153.2340425531915 | L65: =MINA(K65,J65,I65,H65,G65,F65,E65,D65,C65) -> 0 | M65: 153.2340425531915