A1: R$14,99 mussarela, catupiry, buon gustaio, toscanela, calabresa (preço para retirar no balcão) | C1: R$14,99 mussarela, catupiry, buon gustaio, toscanela, calabresa (preço para retirar no balcão)

A1: Pos | B1: Piloto | C1: 1 Etapa | D1: 2 Etapa | E1: 3 Etapa | F1: 4 Etapa | G1: Total
A2: 1 | B2: KLEBER | C2: 279.10 | D2: 301.89 | E2: 292.61 | F2: 283.87 | G2: =SUM(C2:F2) -> 1157.47
A3: =+A2+1 -> 2 | B3: BONGA | C3: 264.42 | D3: 298.81 | E3: 293.48 | F3: 268.75 | G3: =SUM(C3:F3) -> 1125.46
A4: =+A3+1 -> 3 | B4: EVANDRO | C4: 276.83 | D4: 292.56 | E4: 277.76 | F4: 227.50 | G4: =SUM(C4:F4) -> 1074.65
A5: =+A4+1 -> 4 | B5: MORTA | C5: 266.67 | D5: 288.14 | E5: 270.57 | F5: 248.96 | G5: =SUM(C5:F5) -> 1074.34
A6: =+A5+1 -> 5 | B6: MANE | C6: 255.96 | D6: 274.72 | E6: 260.11 | F6: 258.01 | G6: =SUM(C6:F6) -> 1048.80
A7: =+A6+1 -> 6 | B7: LISTER | C7: 240.25 | D7: 249.59 | E7: 253.03 | F7: 277.10 | G7: =SUM(C7:F7) -> 1019.97
A8: =+A7+1 -> 7 | B8: RUDSON | C8: 258.50 | D8: 238.93 | E8: 256.13 | F8: 204.42 | G8: =SUM(C8:F8) -> 957.98
A9: =+A8+1 -> 8 | B9: JERA | C9: 65.85 | D9: 267.97 | E9: 283.31 | F9: 0.00 | G9: =SUM(C9:F9) -> 617.13
A10: =+A9+1 -> 9 | B10: GABRIEL | C10: 243.02 | D10: 258.02 | E10: 0.00 | F10: 0.00 | G10: =SUM(C10:F10) -> 501.04
A11: =+A10+1 -> 10 | B11: TETA | C11: 243.54 | D11: 0.00 | E11: 0.00 | F11: 0.00 | G11: =SUM(C11:F11) -> 243.54