A1: Patrocinadores

B1: Motos e Acessórios Honda - Rua Sete de Setembro, 387 - Fone: (15) 3331-6700.

A1: Pos | B1: Piloto | C1: Tempo
A2: 1 | B2: DINHO | C2: 4.2355999999999998
A3: =+A2+1 -> 2 | B3: MICHEL | C3: 4.29
A4: =+A3+1 -> 3 | B4: BONGA | C4: 4.2906000000000004
A5: =+A4+1 -> 4 | B5: EVANDRO | C5: 4.3452999999999999
A6: =+A5+1 -> 5 | B6: JERA | C6: 4.4001000000000001
A7: =+A6+1 -> 6 | B7: MARCEL | C7: 4.4002999999999997
A8: =+A7+1 -> 7 | B8: LISTER | C8: 4.4550999999999998
A9: =+A8+1 -> 8 | B9: ANDERSON | C9: 4.4553000000000003
A10: =+A9+1 -> 9 | B10: ZE MARIO | C10: 4.4553000000000003
A11: =+A10+1 -> 10 | B11: RICARDINHO | C11: 4.4558
A12: =+A11+1 -> 11 | B12: JOAO KIBON | C12: 4.5103999999999997
A13: =+A12+1 -> 12 | B13: RUDSON | C13: 4.5655000000000001
A14: =+A13+1 -> 13 | B14: BETO | C14: 4.6204000000000001
A15: =+A14+1 -> 14 | B15: ERIC | C15: 4.6752000000000002
A16: =+A15+1 -> 15 | B16: JULIO | C16: 4.6753
A17: =+A16+1 -> 16 | B17: NETO | C17: 4.6755000000000004
A18: =+A17+1 -> 17 | B18: CONRADO | C18: 4.6756000000000002
A19: =+A18+1 -> 18 | B19: COISA PRETA | C19: 4.7302
A20: =+A19+1 -> 19 | B20: LUIZ | C20: 4.7302
A21: =+A20+1 -> 20 | B21: RUBAO | C21: 4.8403
A22: =+A21+1 -> 21 | B22: CALVO | C22: 4.8956999999999997
A23: =+A22+1 -> 22 | B23: RICARDAO | C23: 4.9500999999999999
A24: =+A23+1 -> 23 | B24: MANE | C24: 5.0601000000000003
A25: =+A24+1 -> 24 | B25: TONI | C25: 5.0602999999999998
A26: =+A25+1 -> 25 | B26: LUIZ FELIPE | C26: 5.4451999999999998

A1: Pos | B1: Pilotos | C1: Voltas
A2: 1 | B2: BONGA | C2: 296.97
A3: =+A2+1 -> 2 | B3: JERA | C3: 295.49
A4: =+A3+1 -> 3 | B4: ANDERSON | C4: 290.6
A5: =+A4+1 -> 4 | B5: MICHEL | C5: 290.16
A6: =+A5+1 -> 5 | B6: DINHO | C6: 289.73
A7: =+A6+1 -> 6 | B7: LISTER | C7: 282.15
A8: =+A7+1 -> 7 | B8: RICARDINHO | C8: 279.75
A9: =+A8+1 -> 8 | B9: EVANDRO | C9: 274.71
A10: =+A9+1 -> 9 | B10: ERIC | C10: 269.55
A11: =+A10+1 -> 10 | B11: CONRADO | C11: 269.45
A12: =+A11+1 -> 11 | B12: RUBAO | C12: 269.24
A13: =+A12+1 -> 12 | B13: JULIO | C13: 263.85
A14: =+A13+1 -> 13 | B14: ZE MARIO | C14: 263.54
A15: =+A14+1 -> 14 | B15: MARCEL | C15: 263.03
A16: =+A15+1 -> 15 | B16: RUDSON | C16: 260.7
A17: =+A16+1 -> 16 | B17: RICARDÃO | C17: 260.59
A18: =+A17+1 -> 17 | B18: TONI | C18: 258.32
A19: =+A18+1 -> 18 | B19: BETO | C19: 253.27
A20: =+A19+1 -> 19 | B20: COISA PRETA | C20: 247.88
A21: =+A20+1 -> 20 | B21: MANE | C21: 246.33
A22: =+A21+1 -> 21 | B22: LUIZ | C22: 240.06
A23: =+A22+1 -> 22 | B23: JOAO KIBOM | C23: 237.34
A24: =+A23+1 -> 23 | B24: LUIZ FELIPE | C24: 232.15
A25: =+A24+1 -> 24 | B25: CALVO | C25: 222.3
A26: =+A25+1 -> 25 | B26: NETO | C26: 208.29