A1: R$14,99 mussarela, catupiry, buon gustaio, toscanela, calabresa (preço para retirar no balcão) | C1: R$14,99 mussarela, catupiry, buon gustaio, toscanela, calabresa (preço para retirar no balcão)

A1: Piloto | B1: Pi | C1: Tempo | D1: Voltas | E1: Pi | F1: Tempo | G1: Voltas | H1: Pi | I1: Tempo | J1: Voltas | K1: Pi | L1: Tempo | M1: Voltas | N1: Pi | O1: Tempo | P1: Voltas | Q1: Pi | R1: Tempo | S1: Voltas | T1: Pi | U1: Tempo | V1: Voltas | W1: Pi | X1: Tempo | Y1: Voltas | Z1: Total | AA1: Media | AB1: Record
A2: BONGA | B2: 3 | C2: 4.8406000000000002 | D2: 35 | E2: 5 | F2: 5.0585000000000004 | G2: 34 | H2: 7 | I2: 5.0606 | J2: 34 | K2: 8 | L2: 5.0586000000000002 | M2: 34 | N2: 6 | O2: 4.8398000000000003 | P2: 34 | Q2: 4 | R2: 4.8404999999999996 | S2: 33 | T2: 2 | U2: 4.8311999999999999 | V2: 33 | W2: 1 | X2: 5.0609000000000002 | Y2: 31.39 | Z2: =+Y2+V2+S2+P2+M2+J2+G2+D2 -> 268.39 | AA2: =+(X2+U2+R2+O2+L2+I2+F2+C2)/8 -> 4.9488375000000007 | AB2: =MINA(X2,U2,R2,O2,L2,I2,F2,C2) -> 4.8311999999999999
A3: MICHEL | B3: 3 | C3: 4.7298999999999998 | D3: 35 | E3: 5 | F3: 4.8400999999999996 | G3: 32 | H3: 7 | I3: 4.84 | J3: 33 | K3: 8 | L3: 4.8409000000000004 | M3: 34 | N3: 6 | O3: 4.8391000000000002 | P3: 34 | Q3: 4 | R3: 4.8399000000000001 | S3: 34 | T3: 2 | U3: 5.0594999999999999 | V3: 34 | W3: 1 | X3: 5.0605000000000002 | Y3: 31.76 | Z3: =+Y3+V3+S3+P3+M3+J3+G3+D3 -> 267.76 | AA3: =+(X3+U3+R3+O3+L3+I3+F3+C3)/8 -> 4.8812375000000001 | AB3: =MINA(X3,U3,R3,O3,L3,I3,F3,C3) -> 4.7298999999999998
A4: MORTA | B4: 5 | C4: 4.8380000000000001 | D4: 34 | E4: 7 | F4: 4.7869000000000002 | G4: 31 | H4: 8 | I4: 5.0552999999999999 | J4: 31 | K4: 6 | L4: 4.8395000000000001 | M4: 34 | N4: 4 | O4: 4.8402000000000003 | P4: 35 | Q4: 2 | R4: 4.8388999999999998 | S4: 34 | T4: 1 | U4: 5.0590999999999999 | V4: 33 | W4: 3 | X4: 4.9539999999999997 | Y4: 35.3 | Z4: =+Y4+V4+S4+P4+M4+J4+G4+D4 -> 267.3 | AA4: =+(X4+U4+R4+O4+L4+I4+F4+C4)/8 -> 4.9014875 | AB4: =MINA(X4,U4,R4,O4,L4,I4,F4,C4) -> 4.7869000000000002
A5: ERCOLIM | B5: 6 | C5: 4.8375000000000004 | D5: 34 | E5: 4 | F5: 4.8403 | G5: 34 | H5: 2 | I5: 4.8399000000000001 | J5: 32 | K5: 1 | L5: 5.2803000000000004 | M5: 28 | N5: 3 | O5: 4.8368000000000002 | P5: 35 | Q5: 5 | R5: 4.8362999999999996 | S5: 32 | T5: 7 | U5: 4.8413000000000004 | V5: 33 | W5: 8 | X5: 5.1694000000000004 | Y5: 31.48 | Z5: =+Y5+V5+S5+P5+M5+J5+G5+D5 -> 259.48 | AA5: =+(X5+U5+R5+O5+L5+I5+F5+C5)/8 -> 4.935225 | AB5: =MINA(X5,U5,R5,O5,L5,I5,F5,C5) -> 4.8362999999999996
A6: CONRADO | B6: 7 | C6: 5.2262000000000004 | D6: 32 | E6: 8 | F6: 5.2809999999999997 | G6: 31 | H6: 6 | I6: 5.1692 | J6: 33 | K6: 4 | L6: 5.0580999999999996 | M6: 33 | N6: 2 | O6: 5.0591999999999997 | P6: 32 | Q6: 1 | R6: 5.1714000000000002 | S6: 30 | T6: 3 | U6: 5.0590999999999999 | V6: 33 | W6: 5 | X6: 5.2792000000000003 | Y6: 33.06 | Z6: =+Y6+V6+S6+P6+M6+J6+G6+D6 -> 257.06 | AA6: =+(X6+U6+R6+O6+L6+I6+F6+C6)/8 -> 5.1629249999999995 | AB6: =MINA(X6,U6,R6,O6,L6,I6,F6,C6) -> 5.0580999999999996
A7: RUBAO | B7: 1 | C7: 5.2789999999999999 | D7: 32 | E7: 3 | F7: 5.0603999999999996 | G7: 32 | H7: 5 | I7: 5.2793999999999999 | J7: 33 | K7: 7 | L7: 5.1684999999999999 | M7: 33 | N7: 8 | O7: 5.3898999999999999 | P7: 32 | Q7: 6 | R7: 5.2801999999999998 | S7: 31 | T7: 4 | U7: 5.0590999999999999 | V7: 32 | W7: 2 | X7: 5.2807000000000004 | Y7: 31.61 | Z7: =+Y7+V7+S7+P7+M7+J7+G7+D7 -> 256.61 | AA7: =+(X7+U7+R7+O7+L7+I7+F7+C7)/8 -> 5.2246500000000005 | AB7: =MINA(X7,U7,R7,O7,L7,I7,F7,C7) -> 5.0590999999999999
A8: TETA | B8: 5 | C8: 5.06 | D8: 22 | E8: 7 | F8: 5.0593000000000004 | G8: 30 | H8: 8 | I8: 5.0049000000000001 | J8: 34 | K8: 6 | L8: 4.8399000000000001 | M8: 34 | N8: 4 | O8: 4.7538 | P8: 33 | Q8: 2 | R8: 4.8390000000000004 | S8: 34 | T8: 1 | U8: 5.0480999999999998 | V8: 32 | W8: 3 | X8: 4.8390000000000004 | Y8: 35.91 | Z8: =+Y8+V8+S8+P8+M8+J8+G8+D8 -> 254.91 | AA8: =+(X8+U8+R8+O8+L8+I8+F8+C8)/8 -> 4.9305000000000003 | AB8: =MINA(X8,U8,R8,O8,L8,I8,F8,C8) -> 4.7538
A9: JERA | B9: 2 | C9: 4.8407 | D9: 34 | E9: 1 | F9: 5.0582000000000003 | G9: 31 | H9: 3 | I9: 4.8403999999999998 | J9: 27 | K9: 5 | L9: 4.8400999999999996 | M9: 33 | N9: 7 | O9: 4.8403 | P9: 34 | Q9: 8 | R9: 5.0435999999999996 | S9: 30 | T9: 6 | U9: 4.9054000000000002 | V9: 34 | W9: 4 | X9: 4.8396999999999997 | Y9: 31.06 | Z9: =+Y9+V9+S9+P9+M9+J9+G9+D9 -> 254.06 | AA9: =+(X9+U9+R9+O9+L9+I9+F9+C9)/8 -> 4.9010499999999997 | AB9: =MINA(X9,U9,R9,O9,L9,I9,F9,C9) -> 4.8396999999999997
A10: DINHO | B10: 7 | C10: 4.7309000000000001 | D10: 9 | E10: 8 | F10: 4.8390000000000004 | G10: 33 | H10: 6 | I10: 4.8204000000000002 | J10: 33 | K10: 4 | L10: 4.62 | M10: 36 | N10: 2 | O10: 4.8213999999999997 | P10: 34 | Q10: 1 | R10: 4.7282999999999999 | S10: 36 | T10: 3 | U10: 4.62 | V10: 36 | W10: 5 | X10: 4.7344999999999997 | Y10: 34.46 | Z10: =+Y10+V10+S10+P10+M10+J10+G10+D10 -> 251.46 | AA10: =+(X10+U10+R10+O10+L10+I10+F10+C10)/8 -> 4.7393124999999996 | AB10: =MINA(X10,U10,R10,O10,L10,I10,F10,C10) -> 4.62
A11: RUDSON | B11: 2 | C11: 5.0076999999999998 | D11: 31 | E11: 1 | F11: 5.0426000000000002 | G11: 33 | H11: 3 | I11: 5.0042999999999997 | J11: 30 | K11: 5 | L11: 5.2801 | M11: 32 | N11: 7 | O11: 5.0620000000000003 | P11: 31 | Q11: 8 | R11: 5.3353000000000002 | S11: 29 | T11: 6 | U11: 5.1703999999999999 | V11: 33 | W11: 4 | X11: 5.0560999999999998 | Y11: 32.06 | Z11: =+Y11+V11+S11+P11+M11+J11+G11+D11 -> 251.06 | AA11: =+(X11+U11+R11+O11+L11+I11+F11+C11)/8 -> 5.1198125000000001 | AB11: =MINA(X11,U11,R11,O11,L11,I11,F11,C11) -> 5.0042999999999997
A12: KLEBER | B12: 4 | C12: 4.6173999999999999 | D12: 32 | E12: 2 | F12: 4.84 | G12: 27 | H12: 1 | I12: 4.4005000000000001 | J12: 31 | K12: 3 | L12: 4.8951000000000002 | M12: 33 | N12: 5 | O12: 4.8391000000000002 | P12: 33 | Q12: 7 | R12: 4.9497 | S12: 35 | T12: 8 | U12: 5.17 | V12: 30 | W12: 6 | X12: 4.8365999999999998 | Y12: 29.56 | Z12: =+Y12+V12+S12+P12+M12+J12+G12+D12 -> 250.56 | AA12: =+(X12+U12+R12+O12+L12+I12+F12+C12)/8 -> 4.8185500000000001 | AB12: =MINA(X12,U12,R12,O12,L12,I12,F12,C12) -> 4.4005000000000001
A13: GIOVANNI | B13: 6 | C13: 4.8395000000000001 | D13: 33 | E13: 4 | F13: 4.8851000000000004 | G13: 30 | H13: 2 | I13: 5.0605000000000002 | J13: 30 | K13: 1 | L13: 5.2790999999999997 | M13: 32 | N13: 3 | O13: 5.0595999999999997 | P13: 23 | Q13: 5 | R13: 5.1155999999999997 | S13: 32 | T13: 7 | U13: 5.0595999999999997 | V13: 32 | W13: 8 | X13: 5.28 | Y13: 27.28 | Z13: =+Y13+V13+S13+P13+M13+J13+G13+D13 -> 239.28 | AA13: =+(X13+U13+R13+O13+L13+I13+F13+C13)/8 -> 5.0723750000000001 | AB13: =MINA(X13,U13,R13,O13,L13,I13,F13,C13) -> 4.8395000000000001
A14: MANE | B14: 4 | C14: 5.06 | D14: 31 | E14: 2 | F14: 5.2801999999999998 | G14: 32 | H14: 1 | I14: 5.5 | J14: 30 | K14: 3 | L14: 5.2607999999999997 | M14: 31 | N14: 5 | O14: 5.7209000000000003 | P14: 26 | Q14: 7 | R14: 5.5008999999999997 | S14: 20 | T14: 8 | U14: 5.4958 | V14: 27 | W14: 6 | X14: 5.4992999999999999 | Y14: 28.5 | Z14: =+Y14+V14+S14+P14+M14+J14+G14+D14 -> 225.5 | AA14: =+(X14+U14+R14+O14+L14+I14+F14+C14)/8 -> 5.4147375000000002 | AB14: =MINA(X14,U14,R14,O14,L14,I14,F14,C14) -> 5.06