A1: R$14,99 mussarela, catupiry, buon gustaio, toscanela, calabresa (preço para retirar no balcão) | C1: R$14,99 mussarela, catupiry, buon gustaio, toscanela, calabresa (preço para retirar no balcão)

A1: Pos | B1: Piloto | C1: Pi | D1: Tempo | E1: Vol | F1: Pi | G1: Tempo | H1: Vol | I1: Pi | J1: Tempo | K1: Vol | L1: Pi | M1: Tempo | N1: Vol | O1: Pi | P1: Tempo | Q1: Vol | R1: Pi | S1: Tempo | T1: Vol | U1: Pi | V1: Tempo | W1: Vol | X1: Pi | Y1: Tempo | Z1: Vol | AA1: Total | AB1: Media | AC1: Record
A2: 1 | B2: DINHO | C2: 7 | D2: 4.7298999999999998 | E2: 36 | F2: 8 | G2: 4.6753999999999998 | H2: 33 | I2: 6 | J2: 4.4557000000000002 | K2: 38 | L2: 4 | M2: 4.6036000000000001 | N2: 36 | O2: 2 | P2: 4.6191000000000004 | Q2: 38 | R2: 1 | S2: 4.3688000000000002 | T2: 37 | U2: 3 | V2: 4.4012000000000002 | W2: 37 | X2: 5 | Y2: 4.6005000000000003 | Z2: 34.46 | AA2: =+Z2+W2+T2+Q2+N2+K2+H2+E2 -> 289.46 | AB2: =+(Y2+V2+S2+P2+M2+J2+G2+D2)/8 -> 4.556775 | AC2: =MINA(Y2,V2,S2,P2,M2,J2,G2,D2) -> 4.3688000000000002
A3: 2 | B3: MICHEL | C3: 3 | D3: 4.6207000000000003 | E3: 37 | F3: 5 | G3: 4.8243 | H3: 34 | I3: 7 | J3: 4.7862 | K3: 36 | L3: 8 | M3: 4.8193999999999999 | N3: 32 | O3: 6 | P3: 4.7895000000000003 | Q3: 35 | R3: 4 | S3: 4.3993000000000002 | T3: 36 | U3: 2 | V3: 4.6745999999999999 | W3: 36 | X3: 1 | Y3: 4.8406000000000002 | Z3: 35.28 | AA3: =+Z3+W3+T3+Q3+N3+K3+H3+E3 -> 281.28 | AB3: =+(Y3+V3+S3+P3+M3+J3+G3+D3)/8 -> 4.7193250000000004 | AC3: =MINA(Y3,V3,S3,P3,M3,J3,G3,D3) -> 4.3993000000000002
A4: 3 | B4: KLEBER | C4: 5 | D4: 4.8376000000000001 | E4: 34 | F4: 7 | G4: 4.8315999999999999 | H4: 35 | I4: 8 | J4: 4.8390000000000004 | K4: 35 | L4: 6 | M4: 4.8243 | N4: 36 | O4: 4 | P4: 3.3018000000000001 | Q4: 36 | R4: 2 | S4: 4.8407 | T4: 34 | U4: 1 | V4: 4.8395000000000001 | W4: 34 | X4: 3 | Y4: 4.7355 | Z4: 34.54 | AA4: =+Z4+W4+T4+Q4+N4+K4+H4+E4 -> 278.54 | AB4: =+(Y4+V4+S4+P4+M4+J4+G4+D4)/8 -> 4.6312499999999996 | AC4: =MINA(Y4,V4,S4,P4,M4,J4,G4,D4) -> 3.3018000000000001
A5: 4 | B5: MORTA | C5: 1 | D5: 4.9503000000000004 | E5: 33 | F5: 3 | G5: 4.6742999999999997 | H5: 35 | I5: 5 | J5: 4.8238000000000003 | K5: 36 | L5: 7 | M5: 4.6201999999999996 | N5: 35 | O5: 8 | P5: 4.7853000000000003 | Q5: 34 | R5: 6 | S5: 4.7294 | T5: 35 | U5: 4 | V5: 4.6173999999999999 | W5: 35 | X5: 2 | Y5: 4.8395999999999999 | Z5: 34.26 | AA5: =+Z5+W5+T5+Q5+N5+K5+H5+E5 -> 277.26 | AB5: =+(Y5+V5+S5+P5+M5+J5+G5+D5)/8 -> 4.7550375000000003 | AC5: =MINA(Y5,V5,S5,P5,M5,J5,G5,D5) -> 4.6173999999999999
A6: 5 | B6: TETA | C6: 4 | D6: 4.8289 | E6: 35 | F6: 2 | G6: 4.9508999999999999 | H6: 32 | I6: 1 | J6: 5.0551000000000004 | K6: 34 | L6: 3 | M6: 4.8391000000000002 | N6: 33 | O6: 5 | P6: 4.8402000000000003 | Q6: 35 | R6: 7 | S6: 4.9507000000000003 | T6: 32 | U6: 8 | V6: 4.8392999999999997 | W6: 35 | X6: 6 | Y6: 4.7205000000000004 | Z6: 34.56 | AA6: =+Z6+W6+T6+Q6+N6+K6+H6+E6 -> 270.56 | AB6: =+(Y6+V6+S6+P6+M6+J6+G6+D6)/8 -> 4.8780874999999995 | AC6: =MINA(Y6,V6,S6,P6,M6,J6,G6,D6) -> 4.7205000000000004
A7: 6 | B7: BONGA | C7: 5 | D7: 4.8605999999999998 | E7: 33 | F7: 7 | G7: 5.0568999999999997 | H7: 32 | I7: 8 | J7: 5.0606 | K7: 33 | L7: 6 | M7: 4.9489999999999998 | N7: 32 | O7: 4 | P7: 4.8316999999999997 | Q7: 35 | R7: 2 | S7: 4.8954000000000004 | T7: 34 | U7: 1 | V7: 5.0563000000000002 | W7: 33 | X7: 3 | Y7: 4.8411999999999997 | Z7: 35.52 | AA7: =+Z7+W7+T7+Q7+N7+K7+H7+E7 -> 267.52 | AB7: =+(Y7+V7+S7+P7+M7+J7+G7+D7)/8 -> 4.9439624999999996 | AC7: =MINA(Y7,V7,S7,P7,M7,J7,G7,D7) -> 4.8316999999999997
A8: 7 | B8: JERA | C8: 1 | D8: 5.0601000000000003 | E8: 31 | F8: 3 | G8: 4.2344999999999997 | H8: 31 | I8: 5 | J8: 4.7850000000000001 | K8: 33 | L8: 7 | M8: 4.7859999999999996 | N8: 35 | O8: 8 | P8: 4.8400999999999996 | Q8: 32 | R8: 6 | S8: 4.8207000000000004 | T8: 34 | U8: 4 | V8: 4.6755000000000004 | W8: 35 | X8: 2 | Y8: 4.7839999999999998 | Z8: 35.06 | AA8: =+Z8+W8+T8+Q8+N8+K8+H8+E8 -> 266.06 | AB8: =+(Y8+V8+S8+P8+M8+J8+G8+D8)/8 -> 4.7482375000000001 | AC8: =MINA(Y8,V8,S8,P8,M8,J8,G8,D8) -> 4.2344999999999997
A9: 8 | B9: RUDSON | C9: 4 | D9: 4.8403999999999998 | E9: 34 | F9: 2 | G9: 5.0593000000000004 | H9: 31 | I9: 1 | J9: 5.0598999999999998 | K9: 34 | L9: 3 | M9: 4.8392999999999997 | N9: 34 | O9: 5 | P9: 5.0614999999999997 | Q9: 30 | R9: 7 | S9: 4.8968999999999996 | T9: 32 | U9: 8 | V9: 5.0712999999999999 | W9: 31 | X9: 6 | Y9: 5.0606999999999998 | Z9: 32.85 | AA9: =+Z9+W9+T9+Q9+N9+K9+H9+E9 -> 258.85 | AB9: =+(Y9+V9+S9+P9+M9+J9+G9+D9)/8 -> 4.9861624999999998 | AC9: =MINA(Y9,V9,S9,P9,M9,J9,G9,D9) -> 4.8392999999999997
A10: =+A9+1 -> 9 | B10: CONRADO | C10: 6 | D10: 5.0507 | E10: 33 | F10: 4 | G10: 5.0058999999999996 | H10: 30 | I10: 2 | J10: 5.0444000000000004 | K10: 33 | L10: 1 | M10: 5.0579000000000001 | N10: 33 | O10: 3 | P10: 4.8410000000000002 | Q10: 33 | R10: 5 | S10: 5.1475 | T10: 25 | U10: 7 | V10: 5.1158000000000001 | W10: 30 | X10: 8 | Y10: 5.1707999999999998 | Z10: 32.69 | AA10: =+Z10+W10+T10+Q10+N10+K10+H10+E10 -> 249.69 | AB10: =+(Y10+V10+S10+P10+M10+J10+G10+D10)/8 -> 5.0542499999999997 | AC10: =MINA(Y10,V10,S10,P10,M10,J10,G10,D10) -> 4.8410000000000002
A11: =+A10+1 -> 10 | B11: MANE | C11: 3 | D11: 5.0608000000000004 | E11: 29 | F11: 5 | G11: 5.0590000000000002 | H11: 30 | I11: 7 | J11: 5.1694000000000004 | K11: 32 | L11: 8 | M11: 5.2815000000000003 | N11: 31 | O11: 6 | P11: 5.2243000000000004 | Q11: 31 | R11: 4 | S11: 5.0597000000000003 | T11: 29 | U11: 2 | V11: 5.1266999999999996 | W11: 31 | X11: 1 | Y11: 5.2793000000000001 | Z11: 32.17 | AA11: =+Z11+W11+T11+Q11+N11+K11+H11+E11 -> 245.17 | AB11: =+(Y11+V11+S11+P11+M11+J11+G11+D11)/8 -> 5.1575875 | AC11: =MINA(Y11,V11,S11,P11,M11,J11,G11,D11) -> 5.0590000000000002
A12: =+A11+1 -> 11 | B12: ERCOLIM | C12: 2 | D12: 4.8396999999999997 | E12: 32 | F12: 1 | G12: 5.0593000000000004 | H12: 31 | I12: 3 | J12: 4.6757 | K12: 35 | L12: 5 | M12: 5.0660999999999996 | N12: 26 | O12: 7 | P12: 5.5004999999999997 | Q12: 21 | R12: 8 | S12: 5.0054999999999996 | T12: 25 | U12: 6 | V12: 4.6750999999999996 | W12: 31 | X12: 4 | Y12: 4.6192000000000002 | Z12: 35.46 | AA12: =+Z12+W12+T12+Q12+N12+K12+H12+E12 -> 236.46 | AB12: =+(Y12+V12+S12+P12+M12+J12+G12+D12)/8 -> 4.9301374999999998 | AC12: =MINA(Y12,V12,S12,P12,M12,J12,G12,D12) -> 4.6192000000000002
A13: =+A12+1 -> 12 | B13: FRED | C13: 6 | D13: 5.0603999999999996 | E13: 33 | F13: 4 | G13: 5.1258999999999997 | H13: 18 | I13: 2 | J13: 5.1151999999999997 | K13: 32 | L13: 1 | M13: 5.1157000000000004 | N13: 30 | O13: 3 | P13: 5.0590999999999999 | Q13: 31 | R13: 5 | S13: 5.2796000000000003 | T13: 17 | U13: 7 | V13: 5.0571999999999999 | W13: 30 | X13: 8 | Y13: 5.0589000000000004 | Z13: 29.33 | AA13: =+Z13+W13+T13+Q13+N13+K13+H13+E13 -> 220.33 | AB13: =+(Y13+V13+S13+P13+M13+J13+G13+D13)/8 -> 5.109 | AC13: =MINA(Y13,V13,S13,P13,M13,J13,G13,D13) -> 5.0571999999999999
A14: =+A13+1 -> 13 | B14: FELIPE | C14: 7 | D14: 5.3893000000000004 | E14: 31 | F14: 8 | G14: 5.5 | H14: 17 | I14: 6 | J14: 5.1157000000000004 | K14: 30 | L14: 4 | M14: 5.0575000000000001 | N14: 32 | O14: 2 | P14: 5.1715999999999998 | Q14: 30 | R14: 1 | S14: 5.2808999999999999 | T14: 14 | U14: 3 | V14: 5.1703999999999999 | W14: 14 | X14: 5 | Y14: 5.2788000000000004 | Z14: 28.48 | AA14: =+Z14+W14+T14+Q14+N14+K14+H14+E14 -> 196.48 | AB14: =+(Y14+V14+S14+P14+M14+J14+G14+D14)/8 -> 5.2455249999999998 | AC14: =MINA(Y14,V14,S14,P14,M14,J14,G14,D14) -> 5.0575000000000001
A15: =+A14+1 -> 14 | B15: RUBAO | C15: 2 | D15: 5.2793000000000001 | E15: 30 | F15: 1 | G15: 5.0606 | H15: 30 | I15: 3 | J15: 5.0583 | K15: 34 | L15: 5 | M15: 5.0598999999999998 | N15: 33 | O15: 7 | P15: 5.0625999999999998 | Q15: 32 | R15: 8 | S15: 5.2797999999999998 | T15: 5 | AA15: =+Z15+W15+T15+Q15+N15+K15+H15+E15 -> 164 | AB15: =+(Y15+V15+S15+P15+M15+J15+G15+D15)/8 -> 3.8500624999999999 | AC15: =MINA(Y15,V15,S15,P15,M15,J15,G15,D15) -> 5.0583