A1: R$14,99 mussarela, catupiry, buon gustaio, toscanela, calabresa (preço para retirar no balcão) | C1: R$14,99 mussarela, catupiry, buon gustaio, toscanela, calabresa (preço para retirar no balcão)

A1: Pos | B1: Piloto | C1: Pi | D1: Tempo | E1: Vol | F1: Pi | G1: Tempo | H1: Vol | I1: Pi | J1: Tempo | K1: Vol | L1: Pi | M1: Tempo | N1: Vol | O1: Pi | P1: Tempo | Q1: Vol | R1: Pi | S1: Tempo | T1: Vol | U1: Pi | V1: Tempo | W1: Vol | X1: Pi | Y1: Tempo | Z1: Vol | AA1: Total | AB1: Media | AC1: Record
A2: 1 | B2: MICHEL | C2: 3 | D2: 4.5106000000000002 | E2: 36 | F2: 5 | G2: 4.6204999999999998 | H2: 37 | I2: 7 | J2: 4.6201999999999996 | K2: 36 | L2: 8 | M2: 4.5658000000000003 | N2: 36 | O2: 6 | P2: 4.5045999999999999 | Q2: 37 | R2: 4 | S2: 4.3978999999999999 | T2: 38 | U2: 2 | V2: 4.51 | W2: 38 | X2: 1 | Y2: 4.6132999999999997 | Z2: 34.76 | AA2: =+Z2+W2+T2+Q2+N2+K2+H2+E2 -> 292.76 | AB2: =+(Y2+V2+S2+P2+M2+J2+G2+D2)/8 -> 4.5428625 | AC2: =MINA(Y2,V2,S2,P2,M2,J2,G2,D2) -> 4.3978999999999999
A3: 2 | B3: DINHO | C3: 7 | D3: 4.5434999999999999 | E3: 34 | F3: 8 | G3: 4.6201999999999996 | H3: 35 | I3: 6 | J3: 4.6119000000000003 | K3: 37 | L3: 4 | M3: 4.5045000000000002 | N3: 38 | O3: 2 | P3: 4.5651000000000002 | Q3: 36 | R3: 1 | S3: 4.5644 | T3: 37 | U3: 3 | V3: 4.5570000000000004 | W3: 38 | X3: 5 | Y3: 4.6462000000000003 | Z3: 37 | AA3: =+Z3+W3+T3+Q3+N3+K3+H3+E3 -> 292 | AB3: =+(Y3+V3+S3+P3+M3+J3+G3+D3)/8 -> 4.5766 | AC3: =MINA(Y3,V3,S3,P3,M3,J3,G3,D3) -> 4.5045000000000002
A4: 3 | B4: MORTA | C4: 5 | D4: 4.6208999999999998 | E4: 34 | F4: 7 | G4: 4.6654999999999998 | H4: 32 | I4: 8 | J4: 4.6208 | K4: 31 | L4: 6 | M4: 4.7196999999999996 | N4: 37 | O4: 4 | P4: 4.4553000000000003 | Q4: 33 | R4: 2 | S4: 4.6208999999999998 | T4: 36 | U4: 1 | V4: 4.5705999999999998 | W4: 34 | X4: 3 | Y4: 4.5071000000000003 | Z4: 37.22 | AA4: =+Z4+W4+T4+Q4+N4+K4+H4+E4 -> 274.22 | AB4: =+(Y4+V4+S4+P4+M4+J4+G4+D4)/8 -> 4.5975999999999999 | AC4: =MINA(Y4,V4,S4,P4,M4,J4,G4,D4) -> 4.4553000000000003
A5: 4 | B5: KLEBER | C5: 2 | D5: 4.5590999999999999 | E5: 36 | F5: 1 | G5: 4.62 | H5: 21 | I5: 3 | J5: 4.5107999999999997 | K5: 38 | L5: 5 | M5: 4.6128999999999998 | N5: 36 | O5: 7 | P5: 4.6208999999999998 | Q5: 35 | R5: 8 | S5: 4.6207000000000003 | T5: 36 | U5: 6 | V5: 4.7001999999999997 | W5: 35 | X5: 4 | Y5: 4.6207000000000003 | Z5: 35.76 | AA5: =+Z5+W5+T5+Q5+N5+K5+H5+E5 -> 272.76 | AB5: =+(Y5+V5+S5+P5+M5+J5+G5+D5)/8 -> 4.6081624999999997 | AC5: =MINA(Y5,V5,S5,P5,M5,J5,G5,D5) -> 4.5107999999999997
A6: 5 | B6: TETA | C6: 4 | D6: 4.8301999999999996 | E6: 33 | F6: 2 | G6: 5.0606 | H6: 33 | I6: 1 | J6: 5.0053000000000001 | K6: 32 | L6: 3 | M6: 4.8952999999999998 | N6: 34 | O6: 5 | P6: 5.0049999999999999 | Q6: 33 | R6: 7 | S6: 4.7408999999999999 | T6: 35 | U6: 8 | V6: 4.8920000000000003 | W6: 35 | X6: 6 | Y6: 4.7215999999999996 | Z6: 36.48 | AA6: =+Z6+W6+T6+Q6+N6+K6+H6+E6 -> 271.48 | AB6: =+(Y6+V6+S6+P6+M6+J6+G6+D6)/8 -> 4.8938625 | AC6: =MINA(Y6,V6,S6,P6,M6,J6,G6,D6) -> 4.7215999999999996
A7: 6 | B7: RUDSON | C7: 1 | D7: 4.9507000000000003 | E7: 32 | F7: 3 | G7: 4.7302999999999997 | H7: 34 | I7: 5 | J7: 4.9504999999999999 | K7: 33 | L7: 7 | M7: 5.0072999999999999 | N7: 32 | O7: 8 | P7: 5.0057 | Q7: 32 | R7: 6 | S7: 5.0053999999999998 | T7: 33 | U7: 4 | V7: 4.8403 | W7: 32 | X7: 2 | Y7: 4.9131999999999998 | Z7: 33.3 | AA7: =+Z7+W7+T7+Q7+N7+K7+H7+E7 -> 261.3 | AB7: =+(Y7+V7+S7+P7+M7+J7+G7+D7)/8 -> 4.9254249999999997 | AC7: =MINA(Y7,V7,S7,P7,M7,J7,G7,D7) -> 4.7302999999999997
A8: 7 | B8: CONRADO | C8: 7 | D8: 4.9503000000000004 | E8: 32 | F8: 8 | G8: 4.9955999999999996 | H8: 31 | I8: 6 | J8: 5.0057 | K8: 33 | L8: 4 | M8: 4.9443999999999999 | N8: 29 | O8: 2 | P8: 4.9501999999999997 | Q8: 34 | R8: 1 | S8: 4.9951999999999996 | T8: 34 | U8: 3 | V8: 4.8856999999999999 | W8: 32 | X8: 5 | Y8: 5.06 | Z8: 33.67 | AA8: =+Z8+W8+T8+Q8+N8+K8+H8+E8 -> 258.67 | AB8: =+(Y8+V8+S8+P8+M8+J8+G8+D8)/8 -> 4.9733874999999994 | AC8: =MINA(Y8,V8,S8,P8,M8,J8,G8,D8) -> 4.8856999999999999
A9: 8 | B9: BONGA | C9: 3 | D9: 4.8400999999999996 | E9: 33 | F9: 5 | G9: 4.7146999999999997 | H9: 32 | I9: 7 | J9: 4.8956999999999997 | K9: 34 | L9: 8 | M9: 4.8849 | N9: 33 | O9: 6 | P9: 4.8952 | Q9: 34 | R9: 4 | S9: 4.5659000000000001 | T9: 36 | U9: 2 | V9: 4.7305000000000001 | W9: 33 | X9: 1 | Y9: 4.8952 | Z9: 22.04 | AA9: =+Z9+W9+T9+Q9+N9+K9+H9+E9 -> 257.04 | AB9: =+(Y9+V9+S9+P9+M9+J9+G9+D9)/8 -> 4.8027749999999996 | AC9: =MINA(Y9,V9,S9,P9,M9,J9,G9,D9) -> 4.5659000000000001
A10: 9 | B10: RUBAO | C10: 2 | D10: 5.3354999999999997 | E10: 31 | F10: 1 | G10: 5.1810999999999998 | H10: 32 | I10: 3 | J10: 4.9945000000000004 | K10: 27 | L10: 5 | M10: 5.2255000000000003 | N10: 30 | O10: 7 | P10: 5.1708999999999996 | Q10: 32 | R10: 8 | S10: 5.2815000000000003 | T10: 32 | U10: 6 | V10: 5.3009000000000004 | W10: 33 | X10: 4 | Y10: 5.0606999999999998 | Z10: 34.26 | AA10: =+Z10+W10+T10+Q10+N10+K10+H10+E10 -> 251.26 | AB10: =+(Y10+V10+S10+P10+M10+J10+G10+D10)/8 -> 5.1938250000000004 | AC10: =MINA(Y10,V10,S10,P10,M10,J10,G10,D10) -> 4.9945000000000004
A11: 10 | B11: MANE | C11: 8 | D11: 4.9519000000000002 | E11: 32 | F11: 6 | G11: 5.1154000000000002 | H11: 18 | I11: 4 | J11: 4.9993999999999996 | K11: 32 | L11: 2 | M11: 5.1707000000000001 | N11: 23 | O11: 1 | P11: 4.8406000000000002 | Q11: 34 | R11: 3 | S11: 4.6097000000000001 | T11: 35 | U11: 5 | V11: 4.8951000000000002 | W11: 33 | X11: 7 | Y11: 5.0156000000000001 | Z11: 31.19 | AA11: =+Z11+W11+T11+Q11+N11+K11+H11+E11 -> 238.19 | AB11: =+(Y11+V11+S11+P11+M11+J11+G11+D11)/8 -> 4.9498000000000006 | AC11: =MINA(Y11,V11,S11,P11,M11,J11,G11,D11) -> 4.6097000000000001
A12: 11 | B12: ERCOLIM | C12: 4 | D12: 4.7302 | E12: 29 | F12: 2 | G12: 5.4452999999999996 | H12: 5 | I12: 1 | J12: 5.2150999999999996 | K12: 20 | L12: 3 | M12: 4.5102000000000002 | N12: 9 | O12: 5 | P12: 4.8406000000000002 | Q12: 23 | R12: 7 | S12: 4.8943000000000003 | T12: 31 | U12: 8 | V12: 4.9410999999999996 | W12: 35 | X12: 6 | Y12: 4.9401999999999999 | Z12: 33.54 | AA12: =+Z12+W12+T12+Q12+N12+K12+H12+E12 -> 185.54 | AB12: =+(Y12+V12+S12+P12+M12+J12+G12+D12)/8 -> 4.9396249999999995 | AC12: =MINA(Y12,V12,S12,P12,M12,J12,G12,D12) -> 4.5102000000000002