A1: R$14,99 mussarela, catupiry, buon gustaio, toscanela, calabresa (preço para retirar no balcão) | C1: R$14,99 mussarela, catupiry, buon gustaio, toscanela, calabresa (preço para retirar no balcão)

A1: Pos | B1: Piloto | C1: 1 Etapa | D1: 2 Etapa | E1: 3 Etapa | F1: 4 Etapa | G1: Total
A2: 1 | B2: MICHEL | C2: 267.76 | D2: 278.96 | E2: 281.28 | F2: 292.76 | G2: =SUM(C2:F2) -> 1120.76
A3: 2 | B3: DINHO | C3: 251.46 | D3: 275.26 | E3: 289.46 | F3: 292 | G3: =SUM(C3:F3) -> 1108.18
A4: 3 | B4: MORTA | C4: 267.3 | D4: 266.17 | E4: 277.26 | F4: 274.22 | G4: =SUM(C4:F4) -> 1084.95
A5: 4 | B5: TETA | C5: 254.91 | D5: 267.46 | E5: 270.56 | F5: 271.48 | G5: =SUM(C5:F5) -> 1064.41
A6: 5 | B6: BONGA | C6: 268.39 | D6: 267.61 | E6: 267.52 | F6: 257.04 | G6: =SUM(C6:F6) -> 1060.56
A7: 6 | B7: CONRADO | C7: 257.06 | D7: 261.76 | E7: 249.69 | F7: 258.67 | G7: =SUM(C7:F7) -> 1027.18
A8: 7 | B8: RUDSON | C8: 251.06 | D8: 222.67 | E8: 258.85 | F8: 261.3 | G8: =SUM(C8:F8) -> 993.88
A9: 8 | B9: MANE | C9: 225.5 | D9: 255.09 | E9: 245.17 | F9: 238.19 | G9: =SUM(C9:F9) -> 963.95
A10: =+A9+1 -> 9 | B10: KLEBER | C10: 250.56 | D10: 146 | E10: 278.54 | F10: 272.76 | G10: =SUM(C10:F10) -> 947.86
A11: =+A10+1 -> 10 | B11: ERCOLIM | C11: 259.48 | D11: 265.26 | E11: 236.46 | F11: 185.54 | G11: =SUM(C11:F11) -> 946.74
A12: =+A11+1 -> 11 | B12: RUBAO | C12: 256.61 | D12: 246.63 | E12: 164 | F12: 251.26 | G12: =SUM(C12:F12) -> 918.5
A13: =+A12+1 -> 12 | B13: JERA | C13: 254.06 | D13: 236.67 | E13: 266.06 | F13: 0 | G13: =SUM(C13:F13) -> 756.79
A14: =+A13+1 -> 13 | B14: GIOVANNI | C14: 239.28 | D14: 0 | E14: 0 | F14: 0 | G14: =SUM(C14:F14) -> 239.28
A15: 14 | B15: FRED | C15: 0 | D15: 0 | E15: 220.33 | F15: 0 | G15: =SUM(C15:F15) -> 220.33
A16: 15 | B16: GASTÃO | C16: 0 | D16: 197.43 | E16: 0 | F16: 0 | G16: =SUM(C16:F16) -> 197.43
A17: 16 | B17: FELIPE | C17: 0 | D17: 0 | E17: 196.48 | F17: 0 | G17: =SUM(C17:F17) -> 196.48