A1: R$14,99 mussarela, catupiry, buon gustaio, toscanela, calabresa (preço para retirar no balcão) | C1: R$14,99 mussarela, catupiry, buon gustaio, toscanela, calabresa (preço para retirar no balcão)

A1: PILOTOS | B1: P | C1: TEMPO | D1: V | E1: P | F1: TEMPO | G1: V | H1: P | I1: TEMPO | J1: V | K1: P | L1: TEMPO | M1: V | N1: P | O1: TEMPO | P1: V | Q1: P | R1: TEMPO | S1: V | T1: P | U1: TEMPO | V1: V | W1: P | X1: TEMPO | Y1: V | Z1: TOTAL | AA1: MEDIA
A2: BONGA | B2: 7 | C2: 4.84 | D2: 44 | E2: 8 | F2: 5.056 | G2: 41 | H2: 6 | I2: 4.84 | J2: 44 | K2: 4 | L2: 4.899 | M2: 42 | N2: 2 | O2: 4.8360000000000003 | P2: 40 | Q2: 1 | R2: 5.0039999999999996 | S2: 41 | T2: 3 | U2: 4.95 | V2: 43 | W2: 5 | X2: 4.8360000000000003 | Y2: 43 | Z2: 339.94444444444446 | AA2: =+(X2+U2+R2+O2+L2+I2+F2+C2)/8 -> 4.9076249999999995
A3: JERA | B3: 1 | C3: 4.8410000000000002 | D3: 44 | E3: 3 | F3: 4.9489999999999998 | G3: 39 | H3: 5 | I3: 4.7850000000000001 | J3: 43 | K3: 7 | L3: 4.9489999999999998 | M3: 42 | N3: 8 | O3: 5.0030000000000001 | P3: 38 | Q3: 6 | R3: 4.952 | S3: 32 | T3: 4 | U3: 4.835 | V3: 39 | W3: 2 | X3: 4.8380000000000001 | Y3: 44 | Z3: 324.5 | AA3: =+(X3+U3+R3+O3+L3+I3+F3+C3)/8 -> 4.8940000000000001
A4: MARQUINHO | B4: 8 | C4: 5.2809999999999997 | D4: 40 | E4: 6 | F4: 5.2759999999999998 | G4: 38 | H4: 4 | I4: 5.1159999999999997 | J4: 40 | K4: 2 | L4: 5.0609999999999999 | M4: 41 | N4: 1 | O4: 5.2249999999999996 | P4: 41 | Q4: 3 | R4: 5.1689999999999996 | S4: 39 | T4: 5 | U4: 4.1260000000000003 | V4: 36 | W4: 7 | X4: 5.45 | Y4: 36 | Z4: 314.09259259259261 | AA4: =+(X4+U4+R4+O4+L4+I4+F4+C4)/8 -> 5.0880000000000001
A5: NETO | B5: 4 | C5: 5.1159999999999997 | D5: 43 | E5: 2 | F5: 4.9509999999999996 | G5: 41 | H5: 1 | I5: 5.0019999999999998 | J5: 38 | K5: 3 | L5: 5.1120000000000001 | M5: 35 | N5: 5 | O5: 5.1150000000000002 | P5: 39 | Q5: 7 | R5: 5.1529999999999996 | S5: 35 | T5: 8 | U5: 5.2789999999999999 | V5: 38 | W5: 6 | X5: 5.3310000000000004 | Y5: 36 | Z5: 306.01851851851853 | AA5: =+(X5+U5+R5+O5+L5+I5+F5+C5)/8 -> 5.1323749999999997
A6: MORTADELA | B6: 2 | C6: 5.2619999999999996 | D6: 38 | E6: 1 | F6: 5.28 | G6: 37 | H6: 3 | I6: 5.17 | J6: 39 | K6: 5 | L6: 5.1340000000000003 | M6: 38 | N6: 7 | O6: 5.3730000000000002 | P6: 38 | Q6: 8 | R6: 5.5549999999999997 | S6: 34 | T6: 6 | U6: 5.39 | V6: 40 | W6: 4 | X6: 5.444 | Y6: 23 | Z6: 287 | AA6: =+(X6+U6+R6+O6+L6+I6+F6+C6)/8 -> 5.3260000000000005
A7: EVANDRO | B7: 6 | C7: 5.391 | D7: 39 | E7: 4 | F7: 5.61 | G7: 34 | H7: 2 | I7: 5.617 | J7: 36 | K7: 1 | L7: 5.665 | M7: 36 | N7: 3 | O7: 5.5 | P7: 35 | Q7: 5 | R7: 5.5549999999999997 | S7: 27 | T7: 7 | U7: 4.0709999999999997 | V7: 37 | W7: 8 | X7: 6.0670000000000002 | Y7: 27 | Z7: 271.46296296296299 | AA7: =+(X7+U7+R7+O7+L7+I7+F7+C7)/8 -> 5.434499999999999
A8: MANE | B8: 3 | C8: 5.5359999999999996 | D8: 29 | E8: 5 | F8: 5.5 | G8: 31 | H8: 7 | I8: 5.444 | J8: 21 | K8: 8 | L8: 5.61 | M8: 28 | N8: 6 | O8: 5.5 | P8: 35 | Q8: 4 | R8: 5.5 | S8: 29 | T8: 2 | U8: 5.665 | V8: 35 | W8: 1 | X8: 5.5529999999999999 | Y8: 32 | Z8: 242.44444444444446 | AA8: =+(X8+U8+R8+O8+L8+I8+F8+C8)/8 -> 5.5385
A9: JUNINHO | B9: 5 | C9: 4.9960000000000004 | D9: 42 | E9: 7 | F9: 4.8949999999999996 | G9: 40 | H9: 8 | I9: 5.0590000000000002 | J9: 41 | K9: 6 | L9: 5.06 | M9: 40 | N9: 4 | O9: 5.4980000000000002 | P9: 26 | Q9: 2 | R9: 5.2080000000000002 | S9: 17 | Z9: 206 | AA9: =+(X9+U9+R9+O9+L9+I9+F9+C9)/6 -> 5.1193333333333335