A1: R$14,99 mussarela, catupiry, buon gustaio, toscanela, calabresa (preço para retirar no balcão) | C1: R$14,99 mussarela, catupiry, buon gustaio, toscanela, calabresa (preço para retirar no balcão)

A1: Pos | B1: PILOTOS | C1: 1 Etapa | D1: 2 Etapa | F1: Total
A2: 1 | B2: BONGA | C2: 339.94400000000002 | D2: 334.2037037037037 | E2: 338.13499999999999 | F2: =SUM(C2:E2) -> 1012.2827037037036
A3: 2 | B3: JERA | C3: 324.5 | D3: 293.03703703703701 | E3: 331.01080000000002 | F3: =SUM(C3:E3) -> 948.54783703703697
A4: 3 | B4: MARQUINHO | C4: 314.09300000000002 | D4: 282.01851851851853 | E4: 327.22140000000002 | F4: =SUM(C4:E4) -> 923.33291851851857
A5: 4 | B5: EVANDRO | C5: 271.46300000000002 | D5: 281.53703703703701 | E5: 306.28620000000001 | F5: =SUM(C5:E5) -> 859.28623703703704
A6: 5 | B6: NETO | C6: 306.01900000000001 | D6: 296.12962962962962 | E6: 256.05939999999998 | F6: =SUM(C6:E6) -> 858.20802962962955
A7: 6 | B7: MORTADELA | C7: 287 | D7: 0 | E7: 303.28620000000001 | F7: =SUM(C7:E7) -> 590.28620000000001
A8: 7 | B8: ERUNDA | C8: 0 | D8: 305.03703703703701 | E8: 0 | F8: =SUM(C8:E8) -> 305.03703703703701
A9: 8 | B9: RUBAO | C9: 0 | D9: 288.66666666666669 | E9: 0 | F9: =SUM(C9:E9) -> 288.66666666666669
A10: 9 | B10: ERIC | C10: 0 | D10: 0 | E10: 283.0702 | F10: =SUM(C10:E10) -> 283.0702
A11: 10 | B11: MANE | C11: 242.44399999999999 | D11: 0 | E11: 0 | F11: =SUM(C11:E11) -> 242.44399999999999
A12: 11 | B12: JUNINHO | C12: 206 | D12: 0 | E12: 0 | F12: =SUM(C12:E12) -> 206