A1: Resultado SJ | F1: Final
A2: Pos | B2: Piloto | C2: Voltas | D2: Pontos | F2: Pos | G2: Piloto | H2: 1 Etapa | I2: 2 Etapa | J2: Total | K2: Loja
A3: 1 | B3: KLEBER | C3: 275.62 | D3: 30 | F3: 1 | G3: KLEBER | H3: 2 | I3: 30 | J3: =+I3+H3 -> 32 | K3: SJ Racing
A4: =+A3+1 -> 2 | B4: PIZA | C4: 269.5 | D4: 27 | F4: =+F3+1 -> 2 | G4: ALÊ | H4: 31 | I4: 0 | J4: =+I4+H4 -> 31 | K4: Talladega
A5: =+A4+1 -> 3 | B5: MARQUINHO | C5: 268.92 | D5: 25 | F5: =+F4+1 -> 3 | G5: RICARDINHO | H5: 21 | I5: 8 | J5: =+I5+H5 -> 29 | K5: Talladega
A6: =+A5+1 -> 4 | B6: DINHO | C6: 268.51 | D6: 23 | F6: =+F5+1 -> 4 | G6: ANDERSON | H6: 10 | I6: 19 | J6: =+I6+H6 -> 29 | K6: SJ Racing
A7: =+A6+1 -> 5 | B7: MICHEL | C7: 266.92 | D7: 21 | F7: =+F6+1 -> 5 | G7: DINHO | H7: 6 | I7: 23 | J7: =+I7+H7 -> 29 | K7: SJ Racing
A8: =+A7+1 -> 6 | B8: ANDERSON | C8: 265.61 | D8: 19 | F8: =+F7+1 -> 6 | G8: BARIZON | H8: 27 | I8: 0 | J8: =+I8+H8 -> 27 | K8: Talladega
A9: =+A8+1 -> 7 | B9: ANGELAO | C9: 265.2 | D9: 17 | F9: =+F8+1 -> 7 | G9: PIZA | H9: 0 | I9: 27 | J9: =+I9+H9 -> 27 | K9: Talladega
A10: =+A9+1 -> 8 | B10: JERA | C10: 262.71 | D10: 15 | F10: =+F9+1 -> 8 | G10: TONINHO | H10: 25 | I10: 0 | J10: =+I10+H10 -> 25 | K10: Talladega
A11: =+A10+1 -> 9 | B11: EVANDRO | C11: 260.27 | D11: 14 | F11: =+F10+1 -> 9 | G11: MARQUINHO | H11: 0 | I11: 25 | J11: =+I11+H11 -> 25 | K11: SJ Racing
A12: =+A11+1 -> 10 | B12: MARCEL | C12: 260.2 | D12: 12 | F12: =+F11+1 -> 10 | G12: RHANAN | H12: 23 | I12: 0 | J12: =+I12+H12 -> 23 | K12: Talladega
A13: =+A12+1 -> 11 | B13: GOROI | C13: 257.62 | D13: 11 | F13: =+F12+1 -> 11 | G13: MICHEL | H13: 0 | I13: 21 | J13: =+I13+H13 -> 21 | K13: SJ Racing
A14: =+A13+1 -> 12 | B14: RUBAO | C14: 257.2 | D14: 10 | F14: =+F13+1 -> 12 | G14: EDILSON | H14: 19 | I14: 0 | J14: =+I14+H14 -> 19 | K14: Talladega
A15: =+A14+1 -> 13 | B15: SANDRO | C15: 255.5 | D15: 9 | F15: =+F14+1 -> 13 | G15: JERA | H15: 3 | I15: 15 | J15: =+I15+H15 -> 18 | K15: SJ Racing
A16: =+A15+1 -> 14 | B16: RICARDINHO | C16: 255.29 | D16: 8 | F16: =+F15+1 -> 14 | G16: NICEU | H16: 17 | I16: 0 | J16: =+I16+H16 -> 17 | K16: Talladega
A17: =+A16+1 -> 15 | B17: ERIC | C17: 253.59 | D17: 7 | F17: =+F16+1 -> 15 | G17: FRANJA | H17: 8 | I17: 9 | J17: =+I17+H17 -> 17 | K17: SJ Racing
A18: =+A17+1 -> 16 | B18: GIOVANNI | C18: 249.72 | D18: 6 | F18: =+F17+1 -> 16 | G18: ANGELAO | H18: 0 | I18: 17 | J18: =+I18+H18 -> 17 | K18: SJ Racing
A19: =+A18+1 -> 17 | B19: BONGA | C19: 248.33 | D19: 5 | F19: =+F18+1 -> 17 | G19: MICHEL | H19: 15 | I19: 0 | J19: =+I19+H19 -> 15 | K19: Talladega
A20: =+A19+1 -> 18 | B20: MANE | C20: 247.31 | D20: 4 | F20: =+F19+1 -> 18 | G20: EVANDRO | H20: 0 | I20: 14 | J20: =+I20+H20 -> 14 | K20: SJ Racing
A21: =+A20+1 -> 19 | B21: CONRADO | C21: 240.77 | D21: 3 | F21: =+F20+1 -> 19 | G21: GLUB | H21: 13 | I21: 0 | J21: =+I21+H21 -> 13 | K21: Talladega
A22: =+A21+1 -> 20 | B22: BECHELLI | C22: 238.5 | D22: 2 | F22: =+F21+1 -> 20 | G22: MARCEL | H22: 1 | I22: 12 | J22: =+I22+H22 -> 13 | K22: SJ Racing
A23: =+A22+1 -> 21 | B23: MORTADELA | C23: 237.98 | D23: 1 | F23: =+F22+1 -> 21 | G23: LUFFE | H23: 12 | I23: 0 | J23: =+I23+H23 -> 12 | K23: Talladega
A24: =+A23+1 -> 22 | B24: RICARDO | C24: 237.35 | D24: 0 | F24: =+F23+1 -> 22 | G24: CARLA | H24: 11 | I24: 0 | J24: =+I24+H24 -> 11 | K24: Talladega
A25: =+A24+1 -> 23 | B25: CLAUDIO SJ | C25: 229.05 | D25: 0 | F25: =+F24+1 -> 23 | G25: GOROI | H25: 0 | I25: 11 | J25: =+I25+H25 -> 11 | K25: SJ Racing
A26: =+A25+1 -> 24 | B26: TONINHO | C26: 219.27 | D26: 0 | F26: =+F25+1 -> 24 | G26: MORTADELA | H26: 9 | I26: 1 | J26: =+I26+H26 -> 10 | K26: SJ Racing
A27: =+A26+1 -> 25 | B27: CORINGA | C27: 218.54 | D27: 0 | F27: =+F26+1 -> 25 | G27: RUBAO | H27: 0 | I27: 10 | J27: =+I27+H27 -> 10 | K27: SJ Racing
A28: =+A27+1 -> 26 | B28: BETO | C28: 216.22 | D28: 0 | F28: =+F27+1 -> 26 | G28: KARINA | H28: 7 | I28: 0 | J28: =+I28+H28 -> 7 | K28: Talladega
A29: =+A28+1 -> 27 | B29: GLUBADO | C29: 211.22 | D29: 0 | F29: =+F28+1 -> 27 | G29: ERIC | H29: 0 | I29: 7 | J29: =+I29+H29 -> 7 | K29: SJ Racing
A30: =+A29+1 -> 28 | B30: EDGAR | C30: 209.64 | D30: 0 | F30: =+F29+1 -> 28 | G30: GIOVANNI | H30: 0 | I30: 6 | J30: =+I30+H30 -> 6 | K30: SJ Racing
A31: =+A30+1 -> 29 | B31: TCHELO | C31: 208.46 | D31: 0 | F31: =+F30+1 -> 29 | G31: CORINGA | H31: 5 | I31: 0 | J31: =+I31+H31 -> 5 | K31: Talladega
A32: =+A31+1 -> 30 | B32: CARLA | C32: 195.59 | D32: 0 | F32: =+F31+1 -> 30 | G32: BONGA | H32: 0 | I32: 5 | J32: =+I32+H32 -> 5 | K32: SJ Racing
A33: =+A32+1 -> 31 | B33: CLAUDIO | C33: 185.38 | D33: 0 | F33: =+F32+1 -> 31 | G33: ALANA | H33: 4 | I33: 0 | J33: =+I33+H33 -> 4 | K33: Talladega
A34: =+A33+1 -> 32 | B34: KARINA | C34: 178.55 | D34: 0 | F34: =+F33+1 -> 32 | G34: MANE | H34: 0 | I34: 4 | J34: =+I34+H34 -> 4 | K34: SJ Racing
A35: =+A34+1 -> 33 | B35: BARIZON | C35: 141 | D35: 0 | F35: =+F34+1 -> 33 | G35: CONRADO | H35: 0 | I35: 3 | J35: =+I35+H35 -> 3 | K35: SJ Racing
A36: =+A35+1 -> 34 | B36: NICEU | C36: 79 | D36: 0 | F36: =+F35+1 -> 34 | G36: BECHELLI | H36: 0 | I36: 2 | J36: =+I36+H36 -> 2 | K36: Talladega
F37: =+F36+1 -> 35 | G37: THIELO | H37: 0 | I37: 0 | J37: =+I37+H37 -> 0 | K37: Talladega
F38: =+F37+1 -> 36 | G38: EDGAR | H38: 0 | I38: 0 | J38: =+I38+H38 -> 0 | K38: Talladega
F39: =+F38+1 -> 37 | G39: CLAUDIO | H39: 0 | I39: 0 | J39: =+I39+H39 -> 0 | K39: Talladega
F40: =+F39+1 -> 38 | G40: RODRIGUES | H40: 0 | I40: 0 | J40: =+I40+H40 -> 0 | K40: Talladega
F41: =+F40+1 -> 39 | G41: RICARDO | H41: 0 | I41: 0 | J41: =+I41+H41 -> 0 | K41: Talladega
F42: =+F41+1 -> 40 | G42: BETO | H42: 0 | I42: 0 | J42: =+I42+H42 -> 0 | K42: Talladega
F43: =+F42+1 -> 41 | G43: MARCOS | H43: 0 | I43: 0 | J43: =+I43+H43 -> 0 | K43: Talladega
F44: =+F43+1 -> 42 | G44: MILENA | H44: 0 | I44: 0 | J44: =+I44+H44 -> 0 | K44: Talladega
F45: =+F44+1 -> 43 | G45: COCA | H45: 0 | I45: 0 | J45: =+I45+H45 -> 0 | K45: Talladega