A1: R$14,99 mussarela, catupiry, buon gustaio, toscanela, calabresa (preço para retirar no balcão) | C1: R$14,99 mussarela, catupiry, buon gustaio, toscanela, calabresa (preço para retirar no balcão)

A1: Pilotos | B1: Pis | C1: Tempo | D1: Vol | E1: Pis | F1: Tempo | G1: Vol | H1: Pis | I1: Tempo | J1: Vol | K1: Pis | L1: Tempo | M1: Vol | N1: Pis | O1: Tempo | P1: Vol | Q1: Pis | R1: Tempo | S1: Vol | T1: Pis | U1: Tempo | V1: Vol | W1: Pis | X1: Tempo | Y1: Vol | Z1: Total | AA1: Media | AB1: Record
A2: MARCEL | B2: 8 | C2: 5.5540000000000003 | D2: 29 | E2: 6 | F2: 5.444 | G2: 30 | H2: 4 | I2: 5.39 | J2: 30 | K2: 2 | L2: 5.39 | M2: 31 | N2: 1 | O2: 5.4429999999999996 | P2: 31 | Q2: 3 | R2: 5.39 | S2: 32 | T2: 5 | U2: 5.4459999999999997 | V2: 31 | W2: 7 | X2: 5.3890000000000002 | Y2: 30 | Z2: 244.07407407407408 | AA2: =+(X2+U2+R2+O2+L2+I2+F2+C2)/8 -> 5.4307500000000006 | AB2: =MINA(X2,U2,R2,O2,L2,I2,F2,C2) -> 5.3890000000000002
A3: KLEBER | B3: 1 | C3: 5.6639999999999997 | D3: 26 | E3: 3 | F3: 5.1719999999999997 | G3: 32 | H3: 5 | I3: 5.1790000000000003 | J3: 29 | K3: 7 | L3: 5.2210000000000001 | M3: 29 | N3: 8 | O3: 5.335 | P3: 31 | Q3: 6 | R3: 5.5549999999999997 | S3: 2 | T3: 4 | U3: 5.28 | V3: 32 | W3: 2 | X3: 5.2249999999999996 | Y3: 29 | Z3: 239.03703703703701 | AA3: =+(X3+U3+R3+O3+L3+I3+F3+C3)/8 -> 5.328875 | AB3: =MINA(X3,U3,R3,O3,L3,I3,F3,C3) -> 5.1719999999999997
A4: BONGA | B4: 8 | C4: 5.5 | D4: 30 | E4: 6 | F4: 5.4509999999999996 | G4: 29 | H4: 4 | I4: 5.335 | J4: 31 | K4: 2 | L4: 5.5010000000000003 | M4: 30 | N4: 1 | O4: 5.61 | P4: 28 | Q4: 3 | R4: 5.1619999999999999 | S4: 31 | T4: 5 | U4: 5.5549999999999997 | V4: 30 | W4: 7 | X4: 5.66 | Y4: 28 | Z4: 237.05555555555554 | AA4: =+(X4+U4+R4+O4+L4+I4+F4+C4)/8 -> 5.4717500000000001 | AB4: =MINA(X4,U4,R4,O4,L4,I4,F4,C4) -> 5.1619999999999999
A5: JERA | B5: 3 | C5: 5.1790000000000003 | D5: 28 | E5: 5 | F5: 5.39 | G5: 21 | H5: 7 | I5: 5.39 | J5: 32 | K5: 8 | L5: 5.3890000000000002 | M5: 27 | N5: 6 | O5: 5.17 | P5: 26 | Q5: 4 | R5: 5.1230000000000002 | S5: 32 | T5: 2 | U5: 5.1120000000000001 | V5: 33 | W5: 1 | X5: 5.1029999999999998 | Y5: 25 | Z5: 224.9814814814815 | AA5: =+(X5+U5+R5+O5+L5+I5+F5+C5)/8 -> 5.2320000000000002 | AB5: =MINA(X5,U5,R5,O5,L5,I5,F5,C5) -> 5.1029999999999998
A6: MORTADELA | B6: 5 | C6: 5.61 | D6: 25 | E6: 7 | F6: 5.5540000000000003 | G6: 28 | H6: 8 | I6: 5.55 | J6: 30 | K6: 6 | L6: 5.5 | M6: 31 | N6: 4 | O6: 5.5 | P6: 30 | Q6: 2 | R6: 5.39 | S6: 29 | T6: 1 | U6: 5.665 | V6: 24 | W6: 3 | X6: 5.6 | Y6: 27 | Z6: 224.42592592592592 | AA6: =+(X6+U6+R6+O6+L6+I6+F6+C6)/8 -> 5.546125 | AB6: =MINA(X6,U6,R6,O6,L6,I6,F6,C6) -> 5.39
A7: RUBAO | B7: 4 | C7: 5.61 | D7: 28 | E7: 2 | F7: 5.61 | G7: 28 | H7: 1 | I7: 4.62 | J7: 26 | K7: 3 | L7: 5.665 | M7: 27 | N7: 5 | O7: 5.17 | P7: 26 | Q7: 7 | R7: 5.83 | S7: 23 | T7: 8 | U7: 5.83 | V7: 29 | W7: 6 | X7: 5.72 | Y7: 29 | Z7: 216 | AA7: =+(X7+U7+R7+O7+L7+I7+F7+C7)/8 -> 5.506875 | AB7: =MINA(X7,U7,R7,O7,L7,I7,F7,C7) -> 4.62
A8: DINHO | B8: 6 | C8: 5.39 | D8: 27 | E8: 4 | F8: 5.3360000000000003 | G8: 31 | H8: 2 | I8: 5.3369999999999997 | J8: 22 | K8: 1 | L8: 5.5659999999999998 | M8: 29 | N8: 3 | O8: 5.335 | P8: 22 | Q8: 5 | R8: 5.28 | S8: 27 | T8: 7 | U8: 5.335 | V8: 27 | W8: 8 | X8: 5.4429999999999996 | Y8: 26 | Z8: 211 | AA8: =+(X8+U8+R8+O8+L8+I8+F8+C8)/8 -> 5.3777499999999998 | AB8: =MINA(X8,U8,R8,O8,L8,I8,F8,C8) -> 5.28
A9: LEONCIO | B9: 1 | C9: 5.8849999999999998 | D9: 20 | E9: 3 | F9: 5.5549999999999997 | G9: 29 | H9: 5 | I9: 5.7750000000000004 | J9: 23 | K9: 7 | L9: 5.72 | M9: 27 | N9: 8 | O9: 5.7750000000000004 | P9: 26 | Q9: 6 | R9: 5.609 | S9: 25 | T9: 4 | U9: 5.7759999999999998 | V9: 27 | W9: 2 | X9: 5.61 | Y9: 27 | Z9: 204.05555555555554 | AA9: =+(X9+U9+R9+O9+L9+I9+F9+C9)/8 -> 5.7131249999999998 | AB9: =MINA(X9,U9,R9,O9,L9,I9,F9,C9) -> 5.5549999999999997
A10: RUDSON | B10: 3 | C10: 6.2149999999999999 | D10: 26 | E10: 5 | F10: 6.2140000000000004 | G10: 26 | H10: 7 | I10: 6.2149999999999999 | J10: 25 | K10: 8 | L10: 6.3250000000000002 | M10: 26 | N10: 6 | O10: 6.4349999999999996 | P10: 24 | Q10: 4 | R10: 7.3689999999999998 | S10: 21 | T10: 2 | U10: 6.8150000000000004 | V10: 22 | W10: 1 | X10: 6.4349999999999996 | Y10: 25 | Z10: 195.0185185185185 | AA10: =+(X10+U10+R10+O10+L10+I10+F10+C10)/8 -> 6.5028749999999995 | AB10: =MINA(X10,U10,R10,O10,L10,I10,F10,C10) -> 6.2140000000000004