A1: Patrocinadores

B1: Motos e Acessórios Honda - Rua Sete de Setembro, 387 - Fone: (15) 3331-6700. | C1: Rua Olavo Bilac, 254 - Vila Santana

A1: Bateria 1
A2: Sem resultados
A3: Bateria 2
A4: Pilotos | B4: Pis | C4: Tempo | D4: Vol | E4: Pis | F4: Tempo | G4: Vol | H4: Pis | I4: Tempo | J4: Vol | K4: Pis | L4: Tempo | M4: Vol | N4: Pis | O4: Tempo | P4: Vol | Q4: Pis | R4: Tempo | S4: Vol | T4: Pis | U4: Tempo | V4: Vol | W4: Pis | X4: Tempo | Y4: Vol | Z4: Total | AA4: Media | AB4: Record
A5: JAPAO | B5: 7 | C5: 5.4829999999999997 | D5: 29 | E5: 8 | F5: 5.72 | G5: 24 | H5: 6 | I5: 5.7220000000000004 | J5: 26 | K5: 4 | L5: 5.6109999999999998 | M5: 29 | N5: 2 | O5: 5.72 | P5: 21 | Q5: 1 | R5: 5.9390000000000001 | S5: 28 | T5: 3 | U5: 5.9390000000000001 | V5: 28 | W5: 5 | X5: 5.9260000000000002 | Y5: 25 | Z5: 210.70400000000001 | AA5: =+(X5+U5+R5+O5+L5+I5+F5+C5)/8 -> 5.7575000000000003 | AB5: =MINA(X5,U5,R5,O5,L5,I5,F5,C5) -> 5.4829999999999997
A6: FERNANDO | B6: 3 | C6: 5.28 | D6: 26 | E6: 5 | F6: 5.4870000000000001 | G6: 18 | H6: 7 | I6: 5.28 | J6: 31 | K6: 8 | L6: 5.5 | M6: 20 | N6: 6 | O6: 5.5 | P6: 24 | Q6: 4 | R6: 5.4939999999999998 | S6: 27 | T6: 2 | U6: 5.7160000000000002 | V6: 29 | W6: 1 | X6: 5.9390000000000001 | Y6: 21 | Z6: 196.185 | AA6: =+(X6+U6+R6+O6+L6+I6+F6+C6)/8 -> 5.5245000000000006 | AB6: =MINA(X6,U6,R6,O6,L6,I6,F6,C6) -> 5.28
A7: JULIO | B7: 4 | C7: 5.06 | D7: 20 | E7: 2 | F7: 4.6210000000000004 | G7: 25 | H7: 1 | I7: 5.4939999999999998 | J7: 28 | K7: 3 | L7: 5.5 | M7: 22 | N7: 5 | O7: 5.7750000000000004 | P7: 28 | Q7: 7 | R7: 5.2789999999999999 | S7: 30 | T7: 8 | U7: 5.5010000000000003 | V7: 25 | W7: 6 | X7: 5.4989999999999997 | Y7: 17 | Z7: 195.03700000000001 | AA7: =+(X7+U7+R7+O7+L7+I7+F7+C7)/8 -> 5.3411250000000008 | AB7: =MINA(X7,U7,R7,O7,L7,I7,F7,C7) -> 4.6210000000000004
A8: LISTER | B8: 6 | C8: 5.6109999999999998 | D8: 25 | E8: 4 | F8: 5.7210000000000001 | G8: 23 | H8: 2 | I8: 5.9390000000000001 | J8: 24 | K8: 1 | L8: 5.94 | M8: 22 | N8: 3 | O8: 5.9390000000000001 | P8: 27 | Q8: 5 | R8: 5.94 | S8: 25 | T8: 7 | U8: 5.9409999999999998 | V8: 25 | W8: 8 | X8: 5.9939999999999998 | Y8: 18 | Z8: 189.667 | AA8: =+(X8+U8+R8+O8+L8+I8+F8+C8)/8 -> 5.8781249999999998 | AB8: =MINA(X8,U8,R8,O8,L8,I8,F8,C8) -> 5.6109999999999998
A9: RUDSON | B9: 2 | C9: 5.665 | D9: 24 | E9: 1 | F9: 5.9390000000000001 | G9: 21 | H9: 3 | I9: 5.9390000000000001 | J9: 24 | K9: 5 | L9: 5.7210000000000001 | M9: 14 | N9: 7 | O9: 5.8289999999999997 | P9: 26 | Q9: 8 | R9: 5.94 | S9: 24 | T9: 6 | U9: 5.72 | V9: 22 | W9: 4 | X9: 5.9530000000000003 | Y9: 20 | Z9: 175.25899999999999 | AA9: =+(X9+U9+R9+O9+L9+I9+F9+C9)/8 -> 5.8382500000000004 | AB9: =MINA(X9,U9,R9,O9,L9,I9,F9,C9) -> 5.665
A10: M.JOSE | B10: 1 | C10: 5.9279999999999999 | D10: 22 | E10: 3 | F10: 5.72 | G10: 17 | H10: 5 | I10: 6.16 | J10: 18 | K10: 7 | L10: 6.16 | M10: 24 | N10: 8 | O10: 6.1589999999999998 | P10: 24 | Q10: 6 | R10: 5.93 | S10: 26 | T10: 4 | U10: 5.9249999999999998 | V10: 25 | W10: 2 | X10: 5.7069999999999999 | Y10: 19 | Z10: 175.01900000000001 | AA10: =+(X10+U10+R10+O10+L10+I10+F10+C10)/8 -> 5.9611249999999991 | AB10: =MINA(X10,U10,R10,O10,L10,I10,F10,C10) -> 5.7069999999999999
A11: FLAVIO | B11: 8 | C11: 5.9260000000000002 | D11: 21 | E11: 6 | F11: 5.72 | G11: 24 | H11: 4 | I11: 6.16 | J11: 17 | K11: 2 | L11: 6.16 | M11: 16 | N11: 1 | O11: 6.6 | P11: 16 | Q11: 3 | R11: 6.1589999999999998 | S11: 23 | T11: 5 | U11: 5.9939999999999998 | V11: 20 | W11: 7 | X11: 6.1539999999999999 | Y11: 22 | Z11: 159.09299999999999 | AA11: =+(X11+U11+R11+O11+L11+I11+F11+C11)/8 -> 6.1091249999999997 | AB11: =MINA(X11,U11,R11,O11,L11,I11,F11,C11) -> 5.72
A12: Bateria 3
A13: Pilotos | B13: Pis | C13: Tempo | D13: Vol | E13: Pis | F13: Tempo | G13: Vol | H13: Pis | I13: Tempo | J13: Vol | K13: Pis | L13: Tempo | M13: Vol | N13: Pis | O13: Tempo | P13: Vol | Q13: Pis | R13: Tempo | S13: Vol | T13: Pis | U13: Tempo | V13: Vol | W13: Pis | X13: Tempo | Y13: Vol | Z13: Total | AA13: Media | AB13: Record
A14: KLEBER | B14: 4 | C14: 5.0590000000000002 | D14: 33 | E14: 2 | F14: 5.0590000000000002 | G14: 33 | H14: 1 | I14: 4.6210000000000004 | J14: 33 | K14: 3 | L14: 5.0590000000000002 | M14: 33 | N14: 5 | O14: 5.06 | P14: 33 | Q14: 7 | R14: 5.0590000000000002 | S14: 34 | T14: 8 | U14: 5.0590000000000002 | V14: 33 | W14: 6 | X14: 4.84 | Y14: 31 | Z14: 263.03699999999998 | AA14: =+(X14+U14+R14+O14+L14+I14+F14+C14)/8 -> 4.9769999999999994 | AB14: =MINA(X14,U14,R14,O14,L14,I14,F14,C14) -> 4.6210000000000004
A15: MANE | B15: 3 | C15: 5.2789999999999999 | D15: 30 | E15: 5 | F15: 5.5 | G15: 26 | H15: 7 | I15: 5.4989999999999997 | J15: 31 | K15: 8 | L15: 5.4930000000000003 | M15: 27 | N15: 6 | O15: 5.28 | P15: 30 | Q15: 4 | R15: 5.2240000000000002 | S15: 30 | T15: 2 | U15: 5.2640000000000002 | V15: 31 | W15: 1 | X15: 5.2789999999999999 | Y15: 29 | Z15: 234.75899999999999 | AA15: =+(X15+U15+R15+O15+L15+I15+F15+C15)/8 -> 5.3522499999999997 | AB15: =MINA(X15,U15,R15,O15,L15,I15,F15,C15) -> 5.2240000000000002
A16: GIOVANNI | B16: 6 | C16: 5.1689999999999996 | D16: 31 | E16: 4 | F16: 5.17 | G16: 30 | H16: 2 | I16: 5.4870000000000001 | J16: 26 | K16: 1 | L16: 5.7050000000000001 | M16: 27 | N16: 3 | O16: 5.335 | P16: 30 | Q16: 5 | R16: 5.39 | S16: 29 | T16: 7 | U16: 5.4960000000000004 | V16: 31 | W16: 8 | X16: 5.5 | Y16: 29 | Z16: 233.01900000000001 | AA16: =+(X16+U16+R16+O16+L16+I16+F16+C16)/8 -> 5.4065000000000003 | AB16: =MINA(X16,U16,R16,O16,L16,I16,F16,C16) -> 5.1689999999999996
A17: CONRADO | B17: 5 | C17: 5.5 | D17: 29 | E17: 7 | F17: 5.4989999999999997 | G17: 29 | H17: 8 | I17: 5.5 | J17: 29 | K17: 6 | L17: 5.4880000000000004 | M17: 23 | N17: 4 | O17: 5.28 | P17: 28 | Q17: 2 | R17: 5.4989999999999997 | S17: 28 | T17: 1 | U17: 5.4989999999999997 | V17: 30 | W17: 3 | X17: 5.2789999999999999 | Y17: 31 | Z17: 227.185 | AA17: =+(X17+U17+R17+O17+L17+I17+F17+C17)/8 -> 5.4430000000000005 | AB17: =MINA(X17,U17,R17,O17,L17,I17,F17,C17) -> 5.2789999999999999
A18: PACHECO | B18: 8 | C18: 5.9390000000000001 | D18: 27 | E18: 6 | F18: 5.8289999999999997 | G18: 20 | H18: 4 | I18: 5.5 | J18: 29 | K18: 2 | L18: 5.7039999999999997 | M18: 29 | N18: 1 | O18: 5.4960000000000004 | P18: 31 | Q18: 3 | R18: 5.4450000000000003 | S18: 31 | T18: 5 | U18: 5.7149999999999999 | V18: 29 | W18: 7 | X18: 5.7329999999999997 | Y18: 19 | Z18: =+Y18+V18+S18+P18+M18+J18+G18+D18 -> 215 | AA18: =+(X18+U18+R18+O18+L18+I18+F18+C18)/8 -> 5.6701250000000005 | AB18: =MINA(X18,U18,R18,O18,L18,I18,F18,C18) -> 5.4450000000000003
A19: SANDRO ITU | B19: 1 | C19: 5.9390000000000001 | D19: 27 | E19: 3 | F19: 5.72 | G19: 21 | H19: 5 | I19: 5.7210000000000001 | J19: 27 | K19: 7 | L19: 5.72 | M19: 22 | N19: 8 | O19: 5.94 | P19: 27 | Q19: 6 | R19: 5.5540000000000003 | S19: 29 | T19: 4 | U19: 5.7119999999999997 | V19: 29 | W19: 2 | X19: 5.7069999999999999 | Y19: 28 | Z19: 210.09299999999999 | AA19: =+(X19+U19+R19+O19+L19+I19+F19+C19)/8 -> 5.7516249999999998 | AB19: =MINA(X19,U19,R19,O19,L19,I19,F19,C19) -> 5.5540000000000003
A20: GERONIMO | B20: 7 | C20: 6.1589999999999998 | D20: 16 | E20: 8 | F20: 6.1609999999999996 | G20: 7 | Z20: =+Y20+V20+S20+P20+M20+J20+G20+D20 -> 23 | AA20: =+(X20+U20+R20+O20+L20+I20+F20+C20)/2 -> 6.16 | AB20: =MINA(X20,U20,R20,O20,L20,I20,F20,C20) -> 6.1589999999999998
A21: Bateria 4
A22: Pilotos | B22: Pis | C22: Tempo | D22: Vol | E22: Pis | F22: Tempo | G22: Vol | H22: Pis | I22: Tempo | J22: Vol | K22: Pis | L22: Tempo | M22: Vol | N22: Pis | O22: Tempo | P22: Vol | Q22: Pis | R22: Tempo | S22: Vol | T22: Pis | U22: Tempo | V22: Vol | W22: Pis | X22: Tempo | Y22: Vol | Z22: Total | AA22: Media | AB22: Record
A23: MICHEL | B23: 3 | C23: 5.1150000000000002 | D23: 31 | E23: 5 | F23: 5.1150000000000002 | G23: 28 | H23: 7 | I23: 5.0579999999999998 | J23: 33 | K23: 8 | L23: 5.2789999999999999 | M23: 31 | N23: 6 | O23: 4.9489999999999998 | P23: 33 | Q23: 4 | R23: 4.8959999999999999 | S23: 32 | T23: 2 | U23: 5.17 | V23: 30 | W23: 1 | X23: 5.2679999999999998 | Y23: 31 | Z23: 249.148 | AA23: =+(X23+U23+R23+O23+L23+I23+F23+C23)/8 -> 5.1062500000000002 | AB23: =MINA(X23,U23,R23,O23,L23,I23,F23,C23) -> 4.8959999999999999
A24: MARCEL | B24: 5 | C24: 5.1139999999999999 | D24: 30 | E24: 7 | F24: 5.2549999999999999 | G24: 31 | H24: 8 | I24: 5.2789999999999999 | J24: 30 | K24: 6 | L24: 5.0039999999999996 | M24: 33 | N24: 4 | O24: 5.17 | P24: 31 | Q24: 2 | R24: 4.8940000000000001 | S24: 32 | T24: 1 | U24: 5.2789999999999999 | V24: 31 | W24: 3 | X24: 4.62 | Y24: 30 | Z24: 248 | AA24: =+(X24+U24+R24+O24+L24+I24+F24+C24)/8 -> 5.0768750000000002 | AB24: =MINA(X24,U24,R24,O24,L24,I24,F24,C24) -> 4.62
A25: EVANDRO | B25: 6 | C25: 5.1150000000000002 | D25: 29 | E25: 4 | F25: 5.28 | G25: 32 | H25: 2 | I25: 5.2789999999999999 | J25: 29 | K25: 1 | L25: 5.28 | M25: 27 | N25: 3 | O25: 5.17 | P25: 29 | Q25: 5 | R25: 5.282 | S25: 30 | T25: 7 | U25: 5.2789999999999999 | V25: 27 | W25: 8 | X25: 5.28 | Y25: 30 | Z25: 233.833 | AA25: =+(X25+U25+R25+O25+L25+I25+F25+C25)/8 -> 5.2456250000000004 | AB25: =MINA(X25,U25,R25,O25,L25,I25,F25,C25) -> 5.1150000000000002
A26: JERA | B26: 8 | C26: 5.0869999999999997 | D26: 26 | E26: 6 | F26: 5.0469999999999997 | G26: 30 | H26: 4 | I26: 4.8949999999999996 | J26: 31 | K26: 2 | L26: 5.06 | M26: 29 | N26: 1 | O26: 5.0590000000000002 | P26: 31 | Q26: 3 | R26: 5.1139999999999999 | S26: 31 | T26: 5 | U26: 5.2789999999999999 | V26: 20 | W26: 7 | X26: 5.0590000000000002 | Y26: 32 | Z26: 230.61099999999999 | AA26: =+(X26+U26+R26+O26+L26+I26+F26+C26)/8 -> 5.0750000000000002 | AB26: =MINA(X26,U26,R26,O26,L26,I26,F26,C26) -> 4.8949999999999996
A27: GOROI | B27: 2 | C27: 5.1139999999999999 | D27: 30 | E27: 1 | F27: 5.266 | G27: 25 | H27: 3 | I27: 5.1689999999999996 | J27: 28 | K27: 5 | L27: 5.5 | M27: 28 | N27: 7 | O27: 5.3890000000000002 | P27: 31 | Q27: 8 | R27: 5.3220000000000001 | S27: 29 | T27: 6 | U27: 4.62 | V27: 30 | W27: 4 | X27: 5.2789999999999999 | Y27: 28 | Z27: 229.90700000000001 | AA27: =+(X27+U27+R27+O27+L27+I27+F27+C27)/8 -> 5.2073749999999999 | AB27: =MINA(X27,U27,R27,O27,L27,I27,F27,C27) -> 4.62
A28: ERIC | B28: 4 | C28: 5.2809999999999997 | D28: 27 | E28: 2 | F28: 5.2789999999999999 | G28: 31 | H28: 1 | I28: 5.1139999999999999 | J28: 30 | K28: 3 | L28: 5.1150000000000002 | M28: 30 | N28: 5 | O28: 5.2789999999999999 | P28: 29 | Q28: 7 | R28: 5.2939999999999996 | S28: 27 | T28: 8 | U28: 5.5 | V28: 27 | W28: 6 | X28: 5.5 | Y28: 28 | Z28: 229.648 | AA28: =+(X28+U28+R28+O28+L28+I28+F28+C28)/8 -> 5.2952500000000002 | AB28: =MINA(X28,U28,R28,O28,L28,I28,F28,C28) -> 5.1139999999999999
A29: GABRIEL | B29: 7 | C29: 5.2809999999999997 | D29: 27 | E29: 8 | F29: 5.7210000000000001 | G29: 26 | H29: 6 | I29: 5.5 | J29: 29 | K29: 4 | L29: 5.4989999999999997 | M29: 28 | N29: 2 | O29: 5.39 | P29: 26 | Q29: 1 | R29: 5.5010000000000003 | S29: 27 | T29: 3 | U29: 5.2249999999999996 | V29: 29 | W29: 5 | X29: 5.7190000000000003 | Y29: 27 | Z29: 219.24100000000001 | AA29: =+(X29+U29+R29+O29+L29+I29+F29+C29)/8 -> 5.4795000000000007 | AB29: =MINA(X29,U29,R29,O29,L29,I29,F29,C29) -> 5.2249999999999996
A30: Bateria 5
A31: Pilotos | B31: Pis | C31: Tempo | D31: Vol | E31: Pis | F31: Tempo | G31: Vol | H31: Pis | I31: Tempo | J31: Vol | K31: Pis | L31: Tempo | M31: Vol | N31: Pis | O31: Tempo | P31: Vol | Q31: Pis | R31: Tempo | S31: Vol | T31: Pis | U31: Tempo | V31: Vol | W31: Pis | X31: Tempo | Y31: Vol | Z31: Total | AA31: Media | AB31: Record
A32: ANDERSON | B32: 6 | C32: 5.0590000000000002 | D32: 31 | E32: 4 | F32: 4.8949999999999996 | G32: 35 | H32: 2 | I32: 4.665 | J32: 31 | K32: 1 | L32: 5.0730000000000004 | M32: 33 | N32: 3 | O32: 5.0460000000000003 | P32: 34 | Q32: 5 | R32: 5.06 | S32: 32 | T32: 7 | U32: 4.6749999999999998 | V32: 33 | W32: 8 | X32: 4.8390000000000004 | Y32: 35 | Z32: 264.24099999999999 | AA32: =+(X32+U32+R32+O32+L32+I32+F32+C32)/8 -> 4.9139999999999997 | AB32: =MINA(X32,U32,R32,O32,L32,I32,F32,C32) -> 4.665
A33: DINHO | B33: 2 | C33: 4.8959999999999999 | D33: 32 | E33: 1 | F33: 5.06 | G33: 30 | H33: 3 | I33: 4.8940000000000001 | J33: 32 | K33: 5 | L33: 5.1219999999999999 | M33: 32 | N33: 7 | O33: 5.06 | P33: 32 | Q33: 8 | R33: 5.28 | S33: 31 | T33: 6 | U33: 5.0490000000000004 | V33: 31 | W33: 4 | X33: 4.84 | Y33: 34 | Z33: 254.25899999999999 | AA33: =+(X33+U33+R33+O33+L33+I33+F33+C33)/8 -> 5.0251250000000001 | AB33: =MINA(X33,U33,R33,O33,L33,I33,F33,C33) -> 4.84
A34: JOAO KIBON | B34: 5 | C34: 5.1989999999999998 | D34: 31 | E34: 7 | F34: 5.2789999999999999 | G34: 31 | H34: 8 | I34: 5.1139999999999999 | J34: 31 | K34: 6 | L34: 5.1150000000000002 | M34: 28 | N34: 4 | O34: 5.0590000000000002 | P34: 32 | Q34: 2 | R34: 5.06 | S34: 33 | T34: 1 | U34: 4.8949999999999996 | V34: 32 | W34: 3 | X34: 5.0579999999999998 | Y34: 31 | Z34: 249.333 | AA34: =+(X34+U34+R34+O34+L34+I34+F34+C34)/8 -> 5.0973749999999995 | AB34: =MINA(X34,U34,R34,O34,L34,I34,F34,C34) -> 4.8949999999999996
A35: BONGA | B35: 3 | C35: 5.0590000000000002 | D35: 32 | E35: 5 | F35: 5.28 | G35: 30 | H35: 7 | I35: 5.1139999999999999 | J35: 31 | K35: 8 | L35: 5.4989999999999997 | M35: 30 | N35: 6 | O35: 5.2649999999999997 | P35: 31 | Q35: 4 | R35: 5.0609999999999999 | S35: 33 | T35: 2 | U35: 4.6749999999999998 | V35: 27 | W35: 1 | X35: 5.2789999999999999 | Y35: 29 | Z35: 243.77799999999999 | AA35: =+(X35+U35+R35+O35+L35+I35+F35+C35)/8 -> 5.1539999999999999 | AB35: =MINA(X35,U35,R35,O35,L35,I35,F35,C35) -> 4.6749999999999998
A36: RUBAO | B36: 7 | C36: 5.335 | D36: 29 | E36: 8 | F36: 5.5540000000000003 | G36: 29 | H36: 6 | I36: 4.6749999999999998 | J36: 28 | K36: 4 | L36: 5.4989999999999997 | M36: 30 | N36: 2 | O36: 5.28 | P36: 31 | Q36: 1 | R36: 5.28 | S36: 29 | T36: 3 | U36: 5.28 | V36: 30 | W36: 5 | X36: 5.49 | Y36: 30 | Z36: 236.74100000000001 | AA36: =+(X36+U36+R36+O36+L36+I36+F36+C36)/8 -> 5.2991250000000001 | AB36: =MINA(X36,U36,R36,O36,L36,I36,F36,C36) -> 4.6749999999999998
A37: ERUNDA | B37: 1 | C37: 5.335 | D37: 30 | E37: 3 | F37: 5.2619999999999996 | G37: 33 | H37: 5 | I37: 5.5 | J37: 21 | K37: 7 | L37: 5.335 | M37: 31 | N37: 8 | O37: 5.335 | P37: 30 | Q37: 6 | R37: 5.2809999999999997 | S37: 27 | T37: 4 | U37: 5.1909999999999998 | V37: 31 | W37: 2 | X37: 5.0590000000000002 | Y37: 33 | Z37: 236.40700000000001 | AA37: =+(X37+U37+R37+O37+L37+I37+F37+C37)/8 -> 5.2872500000000002 | AB37: =MINA(X37,U37,R37,O37,L37,I37,F37,C37) -> 5.0590000000000002
A38: ANGELAO | B38: 4 | C38: 5.0590000000000002 | D38: 31 | E38: 2 | F38: 5.0590000000000002 | G38: 28 | H38: 1 | I38: 4.6740000000000004 | J38: 30 | K38: 3 | L38: 5.0590000000000002 | M38: 34 | N38: 5 | O38: 5.06 | P38: 31 | Q38: 7 | R38: 5.0590000000000002 | S38: 32 | T38: 8 | U38: 4.6909999999999998 | V38: 7 | Z38: =+Y38+V38+S38+P38+M38+J38+G38+D38 -> 193 | AA38: =+(X38+U38+R38+O38+L38+I38+F38+C38)/7 -> 4.9515714285714285 | AB38: =MINA(X38,U38,R38,O38,L38,I38,F38,C38) -> 4.6740000000000004