A1: Patrocinadores

B1: Motos e Acessórios Honda - Rua Sete de Setembro, 387 - Fone: (15) 3331-6700. | C1: Rua Olavo Bilac, 254 - Vila Santana

A1: Bateria 1
A2: Piloto | B2: Pi | C2: Tempo | D2: Voltas | E2: Pi | F2: Tempo | G2: Voltas | H2: Pi | I2: Tempo | J2: Voltas | K2: Pi | L2: Tempo | M2: Voltas | N2: Pi | O2: Tempo | P2: Voltas | Q2: Pi | R2: Tempo | S2: Voltas | T2: Pi | U2: Tempo | V2: Voltas | W2: Pi | X2: Tempo | Y2: Voltas | Z2: Total | AA2: Media | AB2: Record
A3: RUDSON | B3: 3 | C3: 4.8400999999999996 | D3: 26 | E3: 5 | F3: 5.9377000000000004 | G3: 27 | H3: 7 | I3: 5.7205000000000004 | J3: 29 | K3: 8 | L3: 5.9398 | M3: 28 | N3: 6 | O3: 5.7229000000000001 | P3: 28 | Q3: 4 | R3: 5.7656000000000001 | S3: 29 | T3: 2 | U3: 5.7188999999999997 | V3: 25 | W3: 1 | X3: 5.9372999999999996 | Y3: 29.06 | Z3: =+Y3+V3+S3+P3+M3+J3+G3+D3 -> 221.06 | AA3: =+(X3+U3+R3+O3+L3+I3+F3+C3)/8 -> 5.6978499999999999 | AB3: =MINA(X3,U3,R3,O3,L3,I3,F3,C3) -> 4.8400999999999996
A4: CONRADO | B4: 5 | C4: 5.5008999999999997 | D4: 27 | E4: 7 | F4: 5.7195 | G4: 22 | H4: 8 | I4: 5.7190000000000003 | J4: 28 | K4: 6 | L4: 5.7154999999999996 | M4: 29 | N4: 4 | O4: 5.2801 | P4: 30 | Q4: 2 | R4: 4.6208999999999998 | S4: 28 | T4: 1 | U4: 5.6116999999999999 | V4: 28 | W4: 3 | X4: 5.3898000000000001 | Y4: 27.2 | Z4: =+Y4+V4+S4+P4+M4+J4+G4+D4 -> 219.2 | AA4: =+(X4+U4+R4+O4+L4+I4+F4+C4)/8 -> 5.4446750000000002 | AB4: =MINA(X4,U4,R4,O4,L4,I4,F4,C4) -> 4.6208999999999998
A5: GERONIMO | B5: 1 | C5: 6.1597999999999997 | D5: 27 | E5: 3 | F5: 5.9390000000000001 | G5: 27 | H5: 5 | I5: 6.3803999999999998 | J5: 26 | K5: 7 | L5: 5.9409000000000001 | M5: 27 | N5: 8 | O5: 5.9401000000000002 | P5: 26 | Q5: 6 | R5: 5.9386999999999999 | S5: 27 | T5: 4 | U5: 4.6214000000000004 | V5: 30 | W5: 2 | X5: 5.8292000000000002 | Y5: 27.44 | Z5: =+Y5+V5+S5+P5+M5+J5+G5+D5 -> 217.44 | AA5: =+(X5+U5+R5+O5+L5+I5+F5+C5)/8 -> 5.8436874999999997 | AB5: =MINA(X5,U5,R5,O5,L5,I5,F5,C5) -> 4.6214000000000004
A6: MARCOS J | B6: 2 | C6: 5.8297999999999996 | D6: 25 | E6: 1 | F6: 5.72 | G6: 27 | H6: 3 | I6: 5.7209000000000003 | J6: 29 | K6: 5 | L6: 5.5007000000000001 | M6: 29 | N6: 7 | O6: 5.7203999999999997 | P6: 25 | Q6: 8 | R6: 5.7202999999999999 | S6: 27 | T6: 6 | U6: 4.8243 | V6: 26 | W6: 4 | X6: 5.7205000000000004 | Y6: 29.2 | Z6: =+Y6+V6+S6+P6+M6+J6+G6+D6 -> 217.2 | AA6: =+(X6+U6+R6+O6+L6+I6+F6+C6)/8 -> 5.5946125000000002 | AB6: =MINA(X6,U6,R6,O6,L6,I6,F6,C6) -> 4.8243
A7: RICARDO LEO | B7: 7 | C7: 5.7207999999999997 | D7: 26 | E7: 8 | F7: 5.9362000000000004 | G7: 27 | H7: 6 | I7: 5.4968000000000004 | J7: 21 | K7: 4 | L7: 5.5002000000000004 | M7: 26 | N7: 2 | O7: 5.4995000000000003 | P7: 26 | Q7: 1 | R7: 5.6647999999999996 | S7: 27 | T7: 3 | U7: 5.4776999999999996 | V7: 30 | W7: 5 | X7: 5.4865000000000004 | Y7: 29.46 | Z7: =+Y7+V7+S7+P7+M7+J7+G7+D7 -> 212.46 | AA7: =+(X7+U7+R7+O7+L7+I7+F7+C7)/8 -> 5.5978124999999999 | AB7: =MINA(X7,U7,R7,O7,L7,I7,F7,C7) -> 5.4776999999999996
A8: FLAVIO | B8: 6 | C8: 5.7751999999999999 | D8: 25 | E8: 4 | F8: 5.7020999999999997 | G8: 28 | H8: 2 | I8: 5.6102999999999996 | J8: 23 | K8: 1 | L8: 5.9398 | M8: 21 | N8: 3 | O8: 5.6094999999999997 | P8: 28 | Q8: 5 | R8: 5.7225000000000001 | S8: 28 | T8: 7 | U8: 5.7754000000000003 | V8: 29 | W8: 8 | X8: 5.7011000000000003 | Y8: 26.22 | Z8: =+Y8+V8+S8+P8+M8+J8+G8+D8 -> 208.22 | AA8: =+(X8+U8+R8+O8+L8+I8+F8+C8)/8 -> 5.7294875000000003 | AB8: =MINA(X8,U8,R8,O8,L8,I8,F8,C8) -> 5.6094999999999997
A9: LISTER | B9: 4 | C9: 5.5541 | D9: 23 | E9: 2 | F9: 5.7164999999999999 | G9: 23 | H9: 1 | I9: 5.7202999999999999 | J9: 25 | K9: 3 | L9: 5.4901999999999997 | M9: 28 | N9: 5 | O9: 5.6093000000000002 | P9: 28 | Q9: 7 | R9: 5.5559000000000003 | S9: 25 | T9: 8 | U9: 5.7153 | V9: 26 | W9: 6 | X9: 5.7205000000000004 | Y9: 27.26 | Z9: =+Y9+V9+S9+P9+M9+J9+G9+D9 -> 205.26 | AA9: =+(X9+U9+R9+O9+L9+I9+F9+C9)/8 -> 5.6352625000000005 | AB9: =MINA(X9,U9,R9,O9,L9,I9,F9,C9) -> 5.4901999999999997
A10: MARCOS VIN | B10: 8 | C10: 5.9404000000000003 | D10: 21 | E10: 6 | F10: 5.7740999999999998 | G10: 21 | H10: 4 | I10: 5.9405000000000001 | J10: 24 | K10: 2 | L10: 5.8804999999999996 | M10: 19 | N10: 1 | O10: 5.7012 | P10: 25 | Q10: 3 | R10: 5.4995000000000003 | S10: 26 | T10: 5 | U10: 5.7220000000000004 | V10: 26 | W10: 7 | X10: 5.7192999999999996 | Y10: 23.26 | Z10: =+Y10+V10+S10+P10+M10+J10+G10+D10 -> 185.26 | AA10: =+(X10+U10+R10+O10+L10+I10+F10+C10)/8 -> 5.7721875000000002 | AB10: =MINA(X10,U10,R10,O10,L10,I10,F10,C10) -> 5.4995000000000003
A11: Bateria 2
A12: Piloto | B12: Pi | C12: Tempo | D12: Voltas | E12: Pi | F12: Tempo | G12: Voltas | H12: Pi | I12: Tempo | J12: Voltas | K12: Pi | L12: Tempo | M12: Voltas | N12: Pi | O12: Tempo | P12: Voltas | Q12: Pi | R12: Tempo | S12: Voltas | T12: Pi | U12: Tempo | V12: Voltas | W12: Pi | X12: Tempo | Y12: Voltas | Z12: Total | AA12: Media | AB12: Record
A13: JAPAO | B13: 1 | C13: 5.4964000000000004 | D13: 31 | E13: 3 | F13: 5.4817999999999998 | G13: 29 | H13: 5 | I13: 5.3912000000000004 | J13: 31 | K13: 7 | L13: 5.4466999999999999 | M13: 30 | N13: 8 | O13: 5.6104000000000003 | P13: 27 | Q13: 6 | R13: 5.5556000000000001 | S13: 30 | T13: 4 | U13: 5.5566000000000004 | V13: 29 | W13: 2 | X13: 5.556 | Y13: 29.63 | Z13: =+Y13+V13+S13+P13+M13+J13+G13+D13 -> 236.63 | AA13: =+(X13+U13+R13+O13+L13+I13+F13+C13)/8 -> 5.5118374999999995 | AB13: =MINA(X13,U13,R13,O13,L13,I13,F13,C13) -> 5.3912000000000004
A14: EVANDRO | B14: 2 | C14: 5.2843999999999998 | D14: 28 | E14: 1 | F14: 5.5004 | G14: 20 | H14: 3 | I14: 5.2805 | J14: 30 | K14: 5 | L14: 5.4447000000000001 | M14: 25 | N14: 7 | O14: 5.4454000000000002 | P14: 30 | Q14: 8 | R14: 5.3352000000000004 | S14: 29 | T14: 6 | U14: 5.2794999999999996 | V14: 30 | W14: 4 | X14: 5.1882999999999999 | Y14: 33.28 | Z14: =+Y14+V14+S14+P14+M14+J14+G14+D14 -> 225.28 | AA14: =+(X14+U14+R14+O14+L14+I14+F14+C14)/8 -> 5.3448000000000002 | AB14: =MINA(X14,U14,R14,O14,L14,I14,F14,C14) -> 5.1882999999999999
A15: MANE | B15: 7 | C15: 5.0961999999999996 | D15: 29 | E15: 8 | F15: 5.7191000000000001 | G15: 24 | H15: 6 | I15: 5.3528000000000002 | J15: 29 | K15: 4 | L15: 5.4855 | M15: 28 | N15: 2 | O15: 5.4821999999999997 | P15: 28 | Q15: 1 | R15: 5.6684000000000001 | S15: 27 | T15: 3 | U15: 5.3869999999999996 | V15: 30 | W15: 5 | X15: 5.4490999999999996 | Y15: 28.8 | Z15: =+Y15+V15+S15+P15+M15+J15+G15+D15 -> 223.8 | AA15: =+(X15+U15+R15+O15+L15+I15+F15+C15)/8 -> 5.4550374999999995 | AB15: =MINA(X15,U15,R15,O15,L15,I15,F15,C15) -> 5.0961999999999996
A16: SANDRO ITU | B16: 8 | C16: 5.8868 | D16: 30 | E16: 6 | F16: 5.7202000000000002 | G16: 28 | H16: 4 | I16: 5.7004000000000001 | J16: 27 | K16: 2 | L16: 5.7207999999999997 | M16: 27 | N16: 1 | O16: 5.9387999999999996 | P16: 27 | Q16: 3 | R16: 5.8156999999999996 | S16: 29 | T16: 5 | U16: 5.7672999999999996 | V16: 24 | W16: 7 | X16: 5.7759 | Y16: 28.15 | Z16: =+Y16+V16+S16+P16+M16+J16+G16+D16 -> 220.15 | AA16: =+(X16+U16+R16+O16+L16+I16+F16+C16)/8 -> 5.7907374999999996 | AB16: =MINA(X16,U16,R16,O16,L16,I16,F16,C16) -> 5.7004000000000001
A17: PACHECO | B17: 5 | C17: 5.7201000000000004 | D17: 28 | E17: 7 | F17: 5.7202999999999999 | G17: 25 | H17: 8 | I17: 5.7202000000000002 | J17: 27 | K17: 6 | L17: 5.7169999999999996 | M17: 27 | N17: 4 | O17: 5.7747999999999999 | P17: 26 | Q17: 2 | R17: 5.6654 | S17: 28 | T17: 1 | U17: 5.7805 | V17: 26 | W17: 3 | X17: 5.7256 | Y17: 29.3 | Z17: =+Y17+V17+S17+P17+M17+J17+G17+D17 -> 216.3 | AA17: =+(X17+U17+R17+O17+L17+I17+F17+C17)/8 -> 5.7279875000000002 | AB17: =MINA(X17,U17,R17,O17,L17,I17,F17,C17) -> 5.6654
A18: BETO | B18: 4 | C18: 5.2793000000000001 | D18: 29 | E18: 2 | F18: 5.3339999999999996 | G18: 25 | H18: 1 | I18: 5.8307000000000002 | J18: 24 | K18: 3 | L18: 5.2813999999999997 | M18: 27 | N18: 5 | O18: 5.3353000000000002 | P18: 23 | Q18: 7 | R18: 5.3903999999999996 | S18: 24 | T18: 8 | U18: 5.5021000000000004 | V18: 28 | W18: 6 | X18: 5.4972000000000003 | Y18: 24.22 | Z18: =+Y18+V18+S18+P18+M18+J18+G18+D18 -> 204.22 | AA18: =+(X18+U18+R18+O18+L18+I18+F18+C18)/8 -> 5.4312999999999994 | AB18: =MINA(X18,U18,R18,O18,L18,I18,F18,C18) -> 5.2793000000000001
A19: TOMAZ | B19: 3 | C19: 5.6105999999999998 | D19: 29 | E19: 5 | F19: 5.9417 | G19: 19 | H19: 7 | I19: 6.0136000000000003 | J19: 24 | K19: 8 | L19: 5.9954999999999998 | M19: 26 | N19: 6 | O19: 6.2157 | P19: 21 | Q19: 4 | R19: 5.9401000000000002 | S19: 22 | T19: 2 | U19: 5.7195999999999998 | V19: 25 | W19: 1 | X19: 5.8852000000000002 | Y19: 25.67 | Z19: =+Y19+V19+S19+P19+M19+J19+G19+D19 -> 191.67 | AA19: =+(X19+U19+R19+O19+L19+I19+F19+C19)/8 -> 5.9152499999999995 | AB19: =MINA(X19,U19,R19,O19,L19,I19,F19,C19) -> 5.6105999999999998
A20: Bateria 3
A21: Piloto | B21: Pi | C21: Tempo | D21: Voltas | E21: Pi | F21: Tempo | G21: Voltas | H21: Pi | I21: Tempo | J21: Voltas | K21: Pi | L21: Tempo | M21: Voltas | N21: Pi | O21: Tempo | P21: Voltas | Q21: Pi | R21: Tempo | S21: Voltas | T21: Pi | U21: Tempo | V21: Voltas | W21: Pi | X21: Tempo | Y21: Voltas | Z21: Total | AA21: Media | AB21: Record
A22: DINHO | B22: 4 | C22: 5.0582000000000003 | D22: 33 | E22: 2 | F22: 5.2637 | G22: 33 | H22: 1 | I22: 5.2797000000000001 | J22: 31 | K22: 3 | L22: 5.0648 | M22: 30 | N22: 5 | O22: 5.1052 | P22: 31 | Q22: 7 | R22: 5.4810999999999996 | S22: 27 | T22: 8 | U22: 5.2816000000000001 | V22: 31 | W22: 6 | X22: 5.2801 | Y22: 27.26 | Z22: =+Y22+V22+S22+P22+M22+J22+G22+D22 -> 243.26 | AA22: =+(X22+U22+R22+O22+L22+I22+F22+C22)/8 -> 5.2267999999999999 | AB22: =MINA(X22,U22,R22,O22,L22,I22,F22,C22) -> 5.0582000000000003
A23: KLEBER | B23: 5 | C23: 5.1254999999999997 | D23: 22 | E23: 7 | F23: 5.0534999999999997 | G23: 33 | H23: 8 | I23: 5.1159999999999997 | J23: 29 | K23: 6 | L23: 5.0602999999999998 | M23: 33 | N23: 4 | O23: 5.0603999999999996 | P23: 33 | Q23: 2 | R23: 5.2790999999999997 | S23: 27 | T23: 1 | U23: 5.2794999999999996 | V23: 31 | W23: 3 | X23: 5.0602 | Y23: 30.13 | Z23: =+Y23+V23+S23+P23+M23+J23+G23+D23 -> 238.13 | AA23: =+(X23+U23+R23+O23+L23+I23+F23+C23)/8 -> 5.1293125000000002 | AB23: =MINA(X23,U23,R23,O23,L23,I23,F23,C23) -> 5.0534999999999997
A24: GABRIEL | B24: 1 | C24: 5.4997999999999996 | D24: 30 | E24: 3 | F24: 5.2770000000000001 | G24: 30 | H24: 5 | I24: 5.4907000000000004 | J24: 30 | K24: 7 | L24: 5.4916 | M24: 28 | N24: 8 | O24: 5.7103000000000002 | P24: 29 | Q24: 6 | R24: 5.5002000000000004 | S24: 26 | T24: 4 | U24: 5.4821 | V24: 29 | W24: 2 | X24: 5.4825999999999997 | Y24: 31.8 | Z24: =+Y24+V24+S24+P24+M24+J24+G24+D24 -> 233.8 | AA24: =+(X24+U24+R24+O24+L24+I24+F24+C24)/8 -> 5.4917875 | AB24: =MINA(X24,U24,R24,O24,L24,I24,F24,C24) -> 5.2770000000000001
A25: RUBAO | B25: 2 | C25: 5.5006000000000004 | D25: 30 | E25: 1 | F25: 5.5103999999999997 | G25: 30 | H25: 3 | I25: 5.5015999999999998 | J25: 30 | K25: 5 | L25: 5.7186000000000003 | M25: 30 | N25: 7 | O25: 5.5004999999999997 | P25: 30 | Q25: 8 | R25: 5.7037000000000004 | S25: 26 | T25: 6 | U25: 5.4828000000000001 | V25: 30 | W25: 4 | X25: 5.3556999999999997 | Y25: 27.54 | Z25: =+Y25+V25+S25+P25+M25+J25+G25+D25 -> 233.54 | AA25: =+(X25+U25+R25+O25+L25+I25+F25+C25)/8 -> 5.5342374999999997 | AB25: =MINA(X25,U25,R25,O25,L25,I25,F25,C25) -> 5.3556999999999997
A26: MARCEL | B26: 3 | C26: 5.0609999999999999 | D26: 34 | E26: 5 | F26: 5.2794999999999996 | G26: 32 | H26: 7 | I26: 5.2629000000000001 | J26: 30 | K26: 8 | L26: 5.4989999999999997 | M26: 23 | N26: 6 | O26: 5.2801999999999998 | P26: 25 | Q26: 4 | R26: 5.2792000000000003 | S26: 23 | T26: 2 | U26: 5.2797999999999998 | V26: 33 | W26: 1 | X26: 5.2789999999999999 | Y26: 32.46 | Z26: =+Y26+V26+S26+P26+M26+J26+G26+D26 -> 232.46 | AA26: =+(X26+U26+R26+O26+L26+I26+F26+C26)/8 -> 5.2775749999999997 | AB26: =MINA(X26,U26,R26,O26,L26,I26,F26,C26) -> 5.0609999999999999
A27: JOAO KIB | B27: 7 | C27: 5.4823000000000004 | D27: 28 | E27: 8 | F27: 5.4993999999999996 | G27: 30 | H27: 6 | I27: 5.2805 | J27: 25 | K27: 4 | L27: 5.2801 | M27: 28 | N27: 2 | O27: 5.2789999999999999 | P27: 29 | Q27: 1 | R27: 5.4814999999999996 | S27: 29 | T27: 3 | U27: 5.2808000000000002 | V27: 30 | W27: 5 | X27: 5.2614000000000001 | Y27: 22.89 | Z27: =+Y27+V27+S27+P27+M27+J27+G27+D27 -> 221.89 | AA27: =+(X27+U27+R27+O27+L27+I27+F27+C27)/8 -> 5.3556249999999999 | AB27: =MINA(X27,U27,R27,O27,L27,I27,F27,C27) -> 5.2614000000000001
A28: LUIZ FELI | B28: 6 | C28: 5.4833999999999996 | D28: 29 | E28: 4 | F28: 5.2790999999999997 | G28: 27 | H28: 2 | I28: 5.2803000000000004 | J28: 21 | K28: 1 | L28: 5.2900999999999998 | M28: 19 | N28: 3 | O28: 4.6215999999999999 | P28: 31 | Q28: 5 | R28: 5.7196999999999996 | S28: 18 | T28: 7 | U28: 5.7009999999999996 | V28: 24 | W28: 8 | X28: 5.7206999999999999 | Y28: 22.07 | Z28: =+Y28+V28+S28+P28+M28+J28+G28+D28 -> 191.07 | AA28: =+(X28+U28+R28+O28+L28+I28+F28+C28)/8 -> 5.3869875 | AB28: =MINA(X28,U28,R28,O28,L28,I28,F28,C28) -> 4.6215999999999999
A29: Bateria 4
A30: Piloto | B30: Pi | C30: Tempo | D30: Voltas | E30: Pi | F30: Tempo | G30: Voltas | H30: Pi | I30: Tempo | J30: Voltas | K30: Pi | L30: Tempo | M30: Voltas | N30: Pi | O30: Tempo | P30: Voltas | Q30: Pi | R30: Tempo | S30: Voltas | T30: Pi | U30: Tempo | V30: Voltas | W30: Pi | X30: Tempo | Y30: Voltas | Z30: Total | AA30: Media | AB30: Record
A31: ANDERSON | B31: 6 | C31: 4.6205999999999996 | D31: 33 | E31: 4 | F31: 5.0251000000000001 | G31: 33 | H31: 2 | I31: 5.0591999999999997 | J31: 32 | K31: 1 | L31: 5.0609999999999999 | M31: 31 | N31: 3 | O31: 5.0430000000000001 | P31: 34 | Q31: 5 | R31: 5.0593000000000004 | S31: 31 | T31: 7 | U31: 5.1707000000000001 | V31: 31 | W31: 8 | X31: 5.2782999999999998 | Y31: 31.54 | Z31: =+Y31+V31+S31+P31+M31+J31+G31+D31 -> 256.54 | AA31: =+(X31+U31+R31+O31+L31+I31+F31+C31)/8 -> 5.03965 | AB31: =MINA(X31,U31,R31,O31,L31,I31,F31,C31) -> 4.6205999999999996
A32: ERIC | B32: 5 | C32: 5.2758000000000003 | D32: 33 | E32: 7 | F32: 5.2792000000000003 | G32: 31 | H32: 8 | I32: 5.2602000000000002 | J32: 32 | K32: 6 | L32: 5.0605000000000002 | M32: 31 | N32: 4 | O32: 5.1060999999999996 | P32: 34 | Q32: 2 | R32: 5.2706 | S32: 31 | T32: 1 | U32: 5.3897000000000004 | V32: 30 | W32: 3 | X32: 5.0609000000000002 | Y32: 31.7 | Z32: =+Y32+V32+S32+P32+M32+J32+G32+D32 -> 253.7 | AA32: =+(X32+U32+R32+O32+L32+I32+F32+C32)/8 -> 5.2128750000000004 | AB32: =MINA(X32,U32,R32,O32,L32,I32,F32,C32) -> 5.0605000000000002
A33: JULIO | B33: 4 | C33: 5.0591999999999997 | D33: 34 | E33: 2 | F33: 5.2797000000000001 | G33: 29 | H33: 1 | I33: 5.2793999999999999 | J33: 31 | K33: 3 | L33: 5.0580999999999996 | M33: 32 | N33: 5 | O33: 5.2782 | P33: 30 | Q33: 7 | R33: 5.0582000000000003 | S33: 32 | T33: 8 | U33: 5.0603999999999996 | V33: 32 | W33: 6 | X33: 5.0606 | Y33: 33.28 | Z33: =+Y33+V33+S33+P33+M33+J33+G33+D33 -> 253.28 | AA33: =+(X33+U33+R33+O33+L33+I33+F33+C33)/8 -> 5.1417249999999992 | AB33: =MINA(X33,U33,R33,O33,L33,I33,F33,C33) -> 5.0580999999999996
A34: JERA | B34: 1 | C34: 5.2794999999999996 | D34: 30 | E34: 3 | F34: 5.1169000000000002 | G34: 31 | H34: 5 | I34: 5.2792000000000003 | J34: 31 | K34: 7 | L34: 5.1707000000000001 | M34: 31 | N34: 8 | O34: 5.7187000000000001 | P34: 29 | Q34: 6 | R34: 5.2798999999999996 | S34: 31 | T34: 4 | U34: 5.2801999999999998 | V34: 31 | W34: 2 | X34: 5.0608000000000004 | Y34: 29.46 | Z34: =+Y34+V34+S34+P34+M34+J34+G34+D34 -> 243.46 | AA34: =+(X34+U34+R34+O34+L34+I34+F34+C34)/8 -> 5.2732374999999996 | AB34: =MINA(X34,U34,R34,O34,L34,I34,F34,C34) -> 5.0608000000000004
A35: BONGA | B35: 7 | C35: 5.4466999999999999 | D35: 27 | E35: 8 | F35: 5.5 | G35: 30 | H35: 6 | I35: 5.4793000000000003 | J35: 31 | K35: 4 | L35: 5.2797000000000001 | M35: 32 | N35: 2 | O35: 5.4791999999999996 | P35: 31 | Q35: 1 | R35: 5.4996999999999998 | S35: 30 | T35: 3 | U35: 5.2807000000000004 | V35: 29 | W35: 5 | X35: 5.6635 | Y35: 31.3 | Z35: =+Y35+V35+S35+P35+M35+J35+G35+D35 -> 241.3 | AA35: =+(X35+U35+R35+O35+L35+I35+F35+C35)/8 -> 5.4535999999999998 | AB35: =MINA(X35,U35,R35,O35,L35,I35,F35,C35) -> 5.2797000000000001
A36: MICHEL | B36: 3 | C36: 5.0606 | D36: 32 | E36: 5 | F36: 5.2789999999999999 | G36: 29 | H36: 7 | I36: 5.2792000000000003 | J36: 31 | K36: 8 | L36: 5.2807000000000004 | M36: 24 | N36: 6 | O36: 5.1699000000000002 | P36: 31 | Q36: 4 | R36: 5.0713999999999997 | S36: 32 | T36: 2 | U36: 5.28 | V36: 27 | W36: 1 | X36: 5.2809999999999997 | Y36: 25.44 | Z36: =+Y36+V36+S36+P36+M36+J36+G36+D36 -> 231.44 | AA36: =+(X36+U36+R36+O36+L36+I36+F36+C36)/8 -> 5.2127249999999998 | AB36: =MINA(X36,U36,R36,O36,L36,I36,F36,C36) -> 5.0606
A37: GIOVANNI | B37: 8 | C37: 5.5103999999999997 | D37: 26 | E37: 6 | F37: 5.5007000000000001 | G37: 27 | H37: 4 | I37: 5.7203999999999997 | J37: 28 | K37: 2 | L37: 5.72 | M37: 27 | N37: 1 | O37: 5.7194000000000003 | P37: 25 | Q37: 3 | R37: 5.7226999999999997 | S37: 24 | T37: 5 | U37: 5.7201000000000004 | V37: 26 | W37: 7 | X37: 5.7206000000000001 | Y37: 29.04 | Z37: =+Y37+V37+S37+P37+M37+J37+G37+D37 -> 212.04 | AA37: =+(X37+U37+R37+O37+L37+I37+F37+C37)/8 -> 5.6667874999999999 | AB37: =MINA(X37,U37,R37,O37,L37,I37,F37,C37) -> 5.5007000000000001