A1: R$14,99 mussarela, catupiry, buon gustaio, toscanela, calabresa (preço para retirar no balcão) | C1: R$14,99 mussarela, catupiry, buon gustaio, toscanela, calabresa (preço para retirar no balcão)

A1: Pos | B1: Piloto | C1: Pi | D1: Tempo | E1: Voltas | F1: Pi | G1: Tempo | H1: Voltas | I1: Pi | J1: Tempo | K1: Voltas | L1: Pi | M1: Tempo | N1: Voltas | O1: Pi | P1: Tempo | Q1: Voltas | R1: Pi | S1: Tempo | T1: Voltas | U1: Pi | V1: Tempo | W1: Voltas | X1: Pi | Y1: Tempo | Z1: Voltas | AA1: Total | AB1: Media | AC1: Record
A2: 1 | B2: MICHEL | C2: 4 | D2: 4.8009000000000004 | E2: 36 | F2: 2 | G2: 4.8398000000000003 | H2: 35 | I2: 1 | J2: 4.8407 | K2: 32 | L2: 3 | M2: 4.8372000000000002 | N2: 36 | O2: 5 | P2: 4.8403 | Q2: 35 | R2: 7 | S2: 4.8353000000000002 | T2: 36 | U2: 8 | V2: 4.8815999999999997 | W2: 34 | X2: 6 | Y2: 4.8224999999999998 | Z2: 34.96 | AA2: =+Z2+W2+T2+Q2+N2+K2+H2+E2 -> 278.96 | AB2: =+(Y2+V2+S2+P2+M2+J2+G2+D2)/8 -> 4.8372875000000004 | AC2: =MINA(Y2,V2,S2,P2,M2,J2,G2,D2) -> 4.8009000000000004
A3: 2 | B3: DINHO | C3: 6 | D3: 4.84 | E3: 31 | F3: 4 | G3: 4.6203000000000003 | H3: 35 | I3: 2 | J3: 4.7320000000000002 | K3: 34 | L3: 1 | M3: 4.8402000000000003 | N3: 32 | O3: 3 | P3: 4.6204000000000001 | Q3: 36 | R3: 5 | S3: 4.8391999999999999 | T3: 35 | U3: 7 | V3: 4.7295999999999996 | W3: 36 | X3: 8 | Y3: 4.8400999999999996 | Z3: 36.26 | AA3: =+Z3+W3+T3+Q3+N3+K3+H3+E3 -> 275.26 | AB3: =+(Y3+V3+S3+P3+M3+J3+G3+D3)/8 -> 4.7577250000000006 | AC3: =MINA(Y3,V3,S3,P3,M3,J3,G3,D3) -> 4.6203000000000003
A4: 3 | B4: BONGA | C4: 3 | D4: 5.0423 | E4: 35 | F4: 5 | G4: 5.1196999999999999 | H4: 33 | I4: 7 | J4: 5.0603999999999996 | K4: 33 | L4: 8 | M4: 5.1708999999999996 | N4: 32 | O4: 6 | P4: 5.0058999999999996 | Q4: 34 | R4: 4 | S4: 4.9494999999999996 | T4: 33 | U4: 2 | V4: 5.0060000000000002 | W4: 34 | X4: 1 | Y4: 5.0567000000000002 | Z4: 33.61 | AA4: =+Z4+W4+T4+Q4+N4+K4+H4+E4 -> 267.61 | AB4: =+(Y4+V4+S4+P4+M4+J4+G4+D4)/8 -> 5.0514250000000001 | AC4: =MINA(Y4,V4,S4,P4,M4,J4,G4,D4) -> 4.9494999999999996
A5: 4 | B5: TETA | C5: 7 | D5: 5.0594000000000001 | E5: 32 | F5: 8 | G5: 5.0591999999999997 | H5: 34 | I5: 6 | J5: 4.9508000000000001 | K5: 35 | L5: 4 | M5: 4.8406000000000002 | N5: 32 | O5: 2 | P5: 4.8377999999999997 | Q5: 35 | R5: 1 | S5: 4.8975999999999997 | T5: 34 | U5: 3 | V5: 4.9504999999999999 | W5: 31 | X5: 5 | Y5: 4.9470000000000001 | Z5: 34.46 | AA5: =+Z5+W5+T5+Q5+N5+K5+H5+E5 -> 267.46 | AB5: =+(Y5+V5+S5+P5+M5+J5+G5+D5)/8 -> 4.9428625000000004 | AC5: =MINA(Y5,V5,S5,P5,M5,J5,G5,D5) -> 4.8377999999999997
A6: 5 | B6: MORTA | C6: 5 | D6: 4.3992000000000004 | E6: 35 | F6: 7 | G6: 5.0602 | H6: 35 | I6: 8 | J6: 5.0613999999999999 | K6: 32 | L6: 6 | M6: 5.0067000000000004 | N6: 33 | O6: 4 | P6: 4.8949999999999996 | Q6: 35 | R6: 2 | S6: 5.0090000000000003 | T6: 33 | U6: 1 | V6: 5.1706000000000003 | W6: 29 | X6: 3 | Y6: 5.0602999999999998 | Z6: 34.17 | AA6: =+Z6+W6+T6+Q6+N6+K6+H6+E6 -> 266.17 | AB6: =+(Y6+V6+S6+P6+M6+J6+G6+D6)/8 -> 4.9578000000000007 | AC6: =MINA(Y6,V6,S6,P6,M6,J6,G6,D6) -> 4.3992000000000004
A7: 6 | B7: ERCOLIM | C7: 7 | D7: 4.8552999999999997 | E7: 35 | F7: 8 | G7: 5.0608000000000004 | H7: 32 | I7: 6 | J7: 4.8413000000000004 | K7: 35 | L7: 4 | M7: 4.8948999999999998 | N7: 31 | O7: 2 | P7: 4.8404999999999996 | Q7: 35 | R7: 1 | S7: 4.9641999999999999 | T7: 31 | U7: 3 | V7: 4.8410000000000002 | W7: 35 | X7: 5 | Y7: 5.0568999999999997 | Z7: 31.26 | AA7: =+Z7+W7+T7+Q7+N7+K7+H7+E7 -> 265.26 | AB7: =+(Y7+V7+S7+P7+M7+J7+G7+D7)/8 -> 4.9193625000000001 | AC7: =MINA(Y7,V7,S7,P7,M7,J7,G7,D7) -> 4.8404999999999996
A8: 7 | B8: CONRADO | C8: 8 | D8: 5.0609000000000002 | E8: 32 | F8: 6 | G8: 5.0571999999999999 | H8: 33 | I8: 4 | J8: 4.8436000000000003 | K8: 32 | L8: 2 | M8: 4.8956 | N8: 33 | O8: 1 | P8: 5.0068999999999999 | Q8: 34 | R8: 3 | S8: 4.9493 | T8: 33 | U8: 5 | V8: 5.2779999999999996 | W8: 32 | X8: 7 | Y8: 5.0567000000000002 | Z8: 32.76 | AA8: =+Z8+W8+T8+Q8+N8+K8+H8+E8 -> 261.76 | AB8: =+(Y8+V8+S8+P8+M8+J8+G8+D8)/8 -> 5.0185250000000003 | AC8: =MINA(Y8,V8,S8,P8,M8,J8,G8,D8) -> 4.8436000000000003
A9: 8 | B9: MANE | C9: 8 | D9: 5.0606999999999998 | E9: 31 | F9: 6 | G9: 4.8541999999999996 | H9: 33 | I9: 4 | J9: 4.8411999999999997 | K9: 30 | L9: 2 | M9: 4.4015000000000004 | N9: 33 | O9: 1 | P9: 5.0612000000000004 | Q9: 28 | R9: 3 | S9: 4.9499000000000004 | T9: 32 | U9: 5 | V9: 4.2343000000000002 | W9: 41 | X9: 7 | Y9: 5.0606 | Z9: 27.09 | AA9: =+Z9+W9+T9+Q9+N9+K9+H9+E9 -> 255.09 | AB9: =+(Y9+V9+S9+P9+M9+J9+G9+D9)/8 -> 4.8079499999999999 | AC9: =MINA(Y9,V9,S9,P9,M9,J9,G9,D9) -> 4.2343000000000002
A10: 9 | B10: RUBAO | C10: 2 | D10: 5.2672999999999996 | E10: 31 | F10: 1 | G10: 5.3341000000000003 | H10: 31 | I10: 3 | J10: 5.1108000000000002 | K10: 32 | L10: 5 | M10: 5.5510999999999999 | N10: 27 | O10: 7 | P10: 5.0064000000000002 | Q10: 28 | R10: 8 | S10: 5.0561999999999996 | T10: 30 | U10: 6 | V10: 5.0049999999999999 | W10: 33 | X10: 4 | Y10: 5.0484 | Z10: 34.63 | AA10: =+Z10+W10+T10+Q10+N10+K10+H10+E10 -> 246.63 | AB10: =+(Y10+V10+S10+P10+M10+J10+G10+D10)/8 -> 5.1724125000000001 | AC10: =MINA(Y10,V10,S10,P10,M10,J10,G10,D10) -> 5.0049999999999999
A11: 10 | B11: JERA | C11: 1 | D11: 4.8838999999999997 | E11: 26 | F11: 3 | G11: 5.0576999999999996 | H11: 28 | I11: 5 | J11: 5.0594999999999999 | K11: 26 | L11: 7 | M11: 5.0560999999999998 | N11: 32 | O11: 8 | P11: 5.2801999999999998 | Q11: 28 | R11: 6 | S11: 5.0601000000000003 | T11: 33 | U11: 4 | V11: 4.8413000000000004 | W11: 33 | X11: 2 | Y11: 4.8413000000000004 | Z11: 30.67 | AA11: =+Z11+W11+T11+Q11+N11+K11+H11+E11 -> 236.67 | AB11: =+(Y11+V11+S11+P11+M11+J11+G11+D11)/8 -> 5.0100124999999993 | AC11: =MINA(Y11,V11,S11,P11,M11,J11,G11,D11) -> 4.8413000000000004
A12: 11 | B12: RUDSON | C12: 3 | D12: 5.3920000000000003 | E12: 30 | F12: 5 | G12: 5.5007000000000001 | H12: 28 | I12: 7 | J12: 5.4455999999999998 | K12: 27 | L12: 8 | M12: 5.0377999999999998 | N12: 26 | O12: 6 | P12: 5.5 | Q12: 24 | R12: 4 | S12: 5.4991000000000003 | T12: 30 | U12: 2 | V12: 5.3890000000000002 | W12: 29 | X12: 1 | Y12: 5.7205000000000004 | Z12: 28.67 | AA12: =+Z12+W12+T12+Q12+N12+K12+H12+E12 -> 222.67 | AB12: =+(Y12+V12+S12+P12+M12+J12+G12+D12)/8 -> 5.4355875000000013 | AC12: =MINA(Y12,V12,S12,P12,M12,J12,G12,D12) -> 5.0377999999999998
A13: 12 | B13: GASTAO | C13: 2 | D13: 5.7732000000000001 | E13: 24 | F13: 1 | G13: 4.4001000000000001 | H13: 27 | I13: 3 | J13: 5.8844000000000003 | K13: 21 | L13: 5 | M13: 5.7760999999999996 | N13: 24 | O13: 7 | P13: 5.7206000000000001 | Q13: 23 | R13: 8 | S13: 5.7103000000000002 | T13: 25 | U13: 6 | V13: 5.6661000000000001 | W13: 27 | X13: 4 | Y13: 5.72 | Z13: 26.43 | AA13: =+Z13+W13+T13+Q13+N13+K13+H13+E13 -> 197.43 | AB13: =+(Y13+V13+S13+P13+M13+J13+G13+D13)/8 -> 5.5813500000000005 | AC13: =MINA(Y13,V13,S13,P13,M13,J13,G13,D13) -> 4.4001000000000001
A14: 13 | B14: KLEBER | C14: 4 | D14: 4.9519000000000002 | E14: 33 | F14: 2 | G14: 4.8353999999999999 | H14: 34 | I14: 1 | J14: 4.8404999999999996 | K14: 20 | O14: 5 | P14: 4.8975999999999997 | Q14: 32 | R14: 7 | S14: 5.0416999999999996 | T14: 27 | AA14: =+Z14+W14+T14+Q14+N14+K14+H14+E14 -> 146 | AB14: =+(Y14+V14+S14+P14+M14+J14+G14+D14)/5 -> 4.9134199999999995 | AC14: =MINA(Y14,V14,S14,P14,M14,J14,G14,D14) -> 4.8353999999999999