A1: R$14,99 mussarela, catupiry, buon gustaio, toscanela, calabresa (preço para retirar no balcão) | C1: R$14,99 mussarela, catupiry, buon gustaio, toscanela, calabresa (preço para retirar no balcão)

A1: Pos | B1: Piloto | C1: 1 Etapa | D1: 2 Etapa | E1: 3 Etapa | F1: 4 Etapa | G1: Total
A2: 1 | B2: MICHEL | C2: 267.76 | D2: 278.96 | E2: 0 | F2: 0 | G2: =SUM(C2:F2) -> 546.72
A3: 2 | B3: BONGA | C3: 268.39 | D3: 267.61 | E3: 0 | F3: 0 | G3: =SUM(C3:F3) -> 536
A4: 3 | B4: MORTA | C4: 267.3 | D4: 266.17 | E4: 0 | F4: 0 | G4: =SUM(C4:F4) -> 533.47
A5: 4 | B5: DINHO | C5: 251.46 | D5: 275.26 | E5: 0 | F5: 0 | G5: =SUM(C5:F5) -> 526.72
A6: 5 | B6: ERCOLIM | C6: 259.48 | D6: 265.26 | E6: 0 | F6: 0 | G6: =SUM(C6:F6) -> 524.74
A7: 6 | B7: TETA | C7: 254.91 | D7: 267.46 | E7: 0 | F7: 0 | G7: =SUM(C7:F7) -> 522.37
A8: 7 | B8: CONRADO | C8: 257.06 | D8: 261.76 | E8: 0 | F8: 0 | G8: =SUM(C8:F8) -> 518.82
A9: 8 | B9: RUBAO | C9: 256.61 | D9: 246.63 | E9: 0 | F9: 0 | G9: =SUM(C9:F9) -> 503.24
A10: =+A9+1 -> 9 | B10: JERA | C10: 254.06 | D10: 236.67 | E10: 0 | F10: 0 | G10: =SUM(C10:F10) -> 490.73
A11: =+A10+1 -> 10 | B11: MANE | C11: 225.5 | D11: 255.09 | E11: 0 | F11: 0 | G11: =SUM(C11:F11) -> 480.59
A12: =+A11+1 -> 11 | B12: RUDSON | C12: 251.06 | D12: 222.67 | E12: 0 | F12: 0 | G12: =SUM(C12:F12) -> 473.73
A13: =+A12+1 -> 12 | B13: KLEBER | C13: 250.56 | D13: 146 | E13: 0 | F13: 0 | G13: =SUM(C13:F13) -> 396.56
A14: =+A13+1 -> 13 | B14: GIOVANNI | C14: 239.28 | D14: 0 | E14: 0 | F14: 0 | G14: =SUM(C14:F14) -> 239.28
A15: 14 | B15: GASTÃO | C15: 0 | D15: 197.43 | E15: 0 | F15: 0 | G15: =SUM(C15:F15) -> 197.43