A1: Patrocinadores

B1: Motos e Acessórios Honda - Rua Sete de Setembro, 387 - Fone: (15) 3331-6700. | C1: Rua Olavo Bilac, 254 - Vila Santana

A1: Pos | B1: Nome | C1: Total
A2: 1 | B2: ANGELAO | C2: 262.62962962962962
A3: =+A2+1 -> 2 | B3: KLEBER | C3: 262.48148148148147
A4: =+A3+1 -> 3 | B4: MICHEL | C4: 262.16666666666669
A5: =+A4+1 -> 4 | B5: ANDERSON | C5: 261.09259259259261
A6: =+A5+1 -> 5 | B6: MARCEL | C6: 260.85185185185185
A7: =+A6+1 -> 6 | B7: BONGA | C7: 255.03703703703704
A8: =+A7+1 -> 7 | B8: RUBAO | C8: 254.44444444444446
A9: =+A8+1 -> 8 | B9: JERA | C9: 252.7962962962963
A10: =+A9+1 -> 9 | B10: DINHO | C10: 251.14814814814815
A11: =+A10+1 -> 10 | B11: GIOVANNI | C11: 248.24074074074073
A12: =+A11+1 -> 11 | B12: JOAO KIBON | C12: 247.05555555555554
A13: =+A12+1 -> 12 | B13: JULIO | C13: 244.03703703703704
A14: =+A13+1 -> 13 | B14: ERIC | C14: 242.18518518518519
A15: =+A14+1 -> 14 | B15: GOROI | C15: 237.0185185185185
A16: =+A15+1 -> 15 | B16: CONRADO | C16: 236.37037037037038
A17: =+A16+1 -> 16 | B17: NETO | C17: 235.38888888888889
A18: =+A17+1 -> 17 | B18: EVANDRO | C18: 231.72222222222223
A19: =+A18+1 -> 18 | B19: FERNANDO | C19: 230.87037037037038
A20: =+A19+1 -> 19 | B20: GERONIMO | C20: 227.35185185185185
A21: =+A20+1 -> 20 | B21: RICARDO | C21: 227.27777777777777
A22: =+A21+1 -> 21 | B22: XAROPINHO | C22: 225.40740740740742
A23: =+A22+1 -> 22 | B23: GUSTAVO | C23: 223.11111111111111
A24: =+A23+1 -> 23 | B24: BETO | C24: 221.12962962962962
A25: =+A24+1 -> 24 | B25: M. JOSE | C25: 220.42592592592592
A26: =+A25+1 -> 25 | B26: SANDRO ITU | C26: 218.7962962962963
A27: =+A26+1 -> 26 | B27: PACHECO | C27: 217.77777777777777
A28: =+A27+1 -> 27 | B28: LISTER | C28: 215.74074074074073
A29: =+A28+1 -> 28 | B29: DANIEL | C29: 215.4814814814815
A30: =+A29+1 -> 29 | B30: M. VINICIUS | C30: 213.46296296296296
A31: =+A30+1 -> 30 | B31: FLAVIO | C31: 209.24074074074073
A32: =+A31+1 -> 31 | B32: RODRIGO | C32: 205.92592592592592
A33: =+A32+1 -> 32 | B33: CASSIO | C33: 203.61111111111111
A34: =+A33+1 -> 33 | B34: TRASH | C34: 201.07407407407408
A35: =+A34+1 -> 34 | B35: RUDSON | C35: 196.05555555555554
A36: =+A35+1 -> 35 | B36: ERUNDA | C36: 193.7962962962963
A37: =+A36+1 -> 36 | B37: TOMAZ | C37: 193.33333333333334
A38: =+A37+1 -> 37 | B38: JAPAO | C38: 192
A39: =+A38+1 -> 38 | B39: LUIZ FELIPE | C39: 183.94444444444446
A40: =+A39+1 -> 39 | B40: RACHID | C40: 167