A1: Patrocinadores

B1: Motos e Acessórios Honda - Rua Sete de Setembro, 387 - Fone: (15) 3331-6700. | C1: Rua Olavo Bilac, 254 - Vila Santana

A1: 1 Bateria
A2: Piloto | B2: Pi | C2: Tempo | D2: Vol | E2: Pi | F2: Tempo | G2: Vol | H2: Pi | I2: Tempo | J2: Vol | K2: Pi | L2: Tempo | M2: Vol | N2: Pi | O2: Tempo | P2: Vol | Q2: Pi | R2: Tempo | S2: Vol | T2: Pi | U2: Tempo | V2: Vol | W2: Pi | X2: Tempo | Y2: Vol | Z2: Total | AA2: Media | AB2: Record
A3: DOUGLAS | B3: 8 | C3: 5.2617000000000003 | D3: 32 | E3: 6 | F3: 5.0605000000000002 | G3: 29 | H3: 4 | I3: 4.95 | J3: 30 | K3: 2 | L3: 4.7767999999999997 | M3: 35 | N3: 1 | O3: 5.0744999999999996 | P3: 32 | Q3: 3 | R3: 4.7853000000000003 | S3: 31 | T3: 5 | U3: 5.0545999999999998 | V3: 32 | W3: 7 | X3: 5.0597000000000003 | Y3: 32.17 | Z3: =+Y3+V3+S3+P3+M3+J3+G3+D3 -> 253.17 | AA3: =+(X3+U3+R3+O3+L3+I3+F3+C3)/8 -> 5.0028874999999999 | AB3: =MINA(X3,U3,R3,O3,L3,I3,F3,C3) -> 4.7767999999999997
A4: MARQUINHO | B4: 5 | C4: 5.0503999999999998 | D4: 34 | E4: 7 | F4: 5.0597000000000003 | G4: 33 | H4: 8 | I4: 5.17 | J4: 31 | K4: 6 | L4: 5.0601000000000003 | M4: 33 | N4: 4 | O4: 4.8415999999999997 | P4: 29 | Q4: 2 | R4: 5.1624999999999996 | S4: 31 | T4: 1 | U4: 5.5659000000000001 | V4: 26 | W4: 3 | X4: 5.3357000000000001 | Y4: 23.48 | Z4: =+Y4+V4+S4+P4+M4+J4+G4+D4 -> 240.48 | AA4: =+(X4+U4+R4+O4+L4+I4+F4+C4)/8 -> 5.1557375000000008 | AB4: =MINA(X4,U4,R4,O4,L4,I4,F4,C4) -> 4.8415999999999997
A5: PORTUGA | B5: 3 | C5: 5.0582000000000003 | D5: 30 | E5: 5 | F5: 5.0609999999999999 | G5: 30 | H5: 7 | I5: 4.9512 | J5: 30 | K5: 8 | L5: 5.0590000000000002 | M5: 32 | N5: 6 | O5: 5.1706000000000003 | P5: 30 | Q5: 4 | R5: 5.069 | S5: 28 | T5: 2 | U5: 5.1707000000000001 | V5: 30 | W5: 1 | X5: 5.4440999999999997 | Y5: 27.06 | Z5: =+Y5+V5+S5+P5+M5+J5+G5+D5 -> 237.06 | AA5: =+(X5+U5+R5+O5+L5+I5+F5+C5)/8 -> 5.1229750000000003 | AB5: =MINA(X5,U5,R5,O5,L5,I5,F5,C5) -> 4.9512
A6: CUCA | B6: 2 | C6: 5.0602 | D6: 29 | E6: 1 | F6: 5.0605000000000002 | G6: 32 | H6: 3 | I6: 4.117 | J6: 26 | K6: 5 | L6: 5.2794999999999996 | M6: 30 | N6: 7 | O6: 5.1708999999999996 | P6: 27 | Q6: 8 | R6: 4.9507000000000003 | S6: 30 | T6: 6 | U6: 5.0620000000000003 | V6: 31 | W6: 4 | X6: 5.2809999999999997 | Y6: 26.22 | Z6: =+Y6+V6+S6+P6+M6+J6+G6+D6 -> 231.22 | AA6: =+(X6+U6+R6+O6+L6+I6+F6+C6)/8 -> 4.997725 | AB6: =MINA(X6,U6,R6,O6,L6,I6,F6,C6) -> 4.117
A7: GABRIEL O | B7: 6 | C7: 5.2805 | D7: 29 | E7: 4 | F7: 5.2630999999999997 | G7: 28 | H7: 2 | I7: 5.1719999999999997 | J7: 24 | K7: 1 | L7: 5.4458000000000002 | M7: 22 | N7: 3 | O7: 5.1706000000000003 | P7: 27 | Q7: 5 | R7: 5.1703999999999999 | S7: 30 | T7: 7 | U7: 5.2257999999999996 | V7: 28 | W7: 8 | X7: 5.4459 | Y7: 12.44 | Z7: =+Y7+V7+S7+P7+M7+J7+G7+D7 -> 200.44 | AA7: =+(X7+U7+R7+O7+L7+I7+F7+C7)/8 -> 5.2717624999999995 | AB7: =MINA(X7,U7,R7,O7,L7,I7,F7,C7) -> 5.1703999999999999
A8: GUERRA | B8: 1 | C8: 6.1589 | D8: 23 | E8: 3 | F8: 5.7213000000000003 | G8: 25 | H8: 5 | I8: 6.1608999999999998 | J8: 24 | K8: 7 | L8: 5.7758000000000003 | M8: 24 | N8: 8 | O8: 5.7099000000000002 | P8: 25 | Q8: 6 | R8: 5.6109 | S8: 28 | T8: 4 | U8: 5.8197000000000001 | V8: 26 | W8: 2 | X8: 4.1299000000000001 | Y8: 24.19 | Z8: =+Y8+V8+S8+P8+M8+J8+G8+D8 -> 199.19 | AA8: =+(X8+U8+R8+O8+L8+I8+F8+C8)/8 -> 5.6359125000000008 | AB8: =MINA(X8,U8,R8,O8,L8,I8,F8,C8) -> 4.1299000000000001
A9: JUNINHO | B9: 4 | C9: 5.0602999999999998 | D9: 9 | Z9: =+Y9+V9+S9+P9+M9+J9+G9+D9 -> 9 | AA9: =+(X9+U9+R9+O9+L9+I9+F9+C9)/8 -> 0.63253749999999997 | AB9: =MINA(X9,U9,R9,O9,L9,I9,F9,C9) -> 5.0602999999999998
A10: 2 Bateria
A11: Piloto | B11: Pi | C11: Tempo | D11: Vol | E11: Pi | F11: Tempo | G11: Vol | H11: Pi | I11: Tempo | J11: Vol | K11: Pi | L11: Tempo | M11: Vol | N11: Pi | O11: Tempo | P11: Vol | Q11: Pi | R11: Tempo | S11: Vol | T11: Pi | U11: Tempo | V11: Vol | W11: Pi | X11: Tempo | Y11: Vol | Z11: Total | AA11: Media | AB11: Record
A12: ERIC | B12: 5 | C12: 5.0044000000000004 | D12: 33 | E12: 7 | F12: 4.9476000000000004 | G12: 32 | H12: 8 | I12: 5.1039000000000003 | J12: 30 | K12: 6 | L12: 5.1702000000000004 | M12: 33 | N12: 4 | O12: 5.0208000000000004 | P12: 34 | Q12: 2 | R12: 5.0045999999999999 | S12: 33 | T12: 1 | U12: 5.1702000000000004 | V12: 29 | W12: 3 | X12: 4.9055999999999997 | Y12: 34.28 | Z12: =+Y12+V12+S12+P12+M12+J12+G12+D12 -> 258.28 | AA12: =+(X12+U12+R12+O12+L12+I12+F12+C12)/8 -> 5.040912500000001 | AB12: =MINA(X12,U12,R12,O12,L12,I12,F12,C12) -> 4.9055999999999997
A13: JAPAO | B13: 2 | C13: 5.234 | D13: 31 | E13: 1 | F13: 5.3804999999999996 | G13: 28 | H13: 3 | I13: 5.2352999999999996 | J13: 32 | K13: 5 | L13: 5.3341000000000003 | M13: 32 | N13: 7 | O13: 5.1703000000000001 | P13: 31 | Q13: 8 | R13: 5.3791000000000002 | S13: 29 | T13: 6 | U13: 5.38 | V13: 31 | W13: 4 | X13: 5.2263000000000002 | Y13: 31.69 | Z13: =+Y13+V13+S13+P13+M13+J13+G13+D13 -> 245.69 | AA13: =+(X13+U13+R13+O13+L13+I13+F13+C13)/8 -> 5.2924500000000005 | AB13: =MINA(X13,U13,R13,O13,L13,I13,F13,C13) -> 5.1703000000000001
A14: GIOVANNI | B14: 7 | C14: 5.1695000000000002 | D14: 30 | E14: 8 | F14: 5.2957000000000001 | G14: 27 | H14: 6 | I14: 4.8869999999999996 | J14: 30 | K14: 4 | L14: 4.8640999999999996 | M14: 33 | N14: 2 | O14: 5.0515999999999996 | P14: 30 | Q14: 1 | R14: 5.2801 | S14: 24 | T14: 3 | U14: 4.8509000000000002 | V14: 32 | W14: 5 | X14: 5.0605000000000002 | Y14: 32.69 | Z14: =+Y14+V14+S14+P14+M14+J14+G14+D14 -> 238.69 | AA14: =+(X14+U14+R14+O14+L14+I14+F14+C14)/8 -> 5.0574250000000003 | AB14: =MINA(X14,U14,R14,O14,L14,I14,F14,C14) -> 4.8509000000000002
A15: RUDSON | B15: 3 | C15: 5.1703999999999999 | D15: 31 | E15: 5 | F15: 5.2808999999999999 | G15: 28 | H15: 7 | I15: 5.2554999999999996 | J15: 30 | K15: 8 | L15: 5.2061999999999999 | M15: 30 | N15: 6 | O15: 5.1708999999999996 | P15: 30 | Q15: 4 | R15: 5.1158000000000001 | S15: 31 | T15: 2 | U15: 5.2901999999999996 | V15: 30 | W15: 1 | X15: 5.556 | Y15: 28.2 | Z15: =+Y15+V15+S15+P15+M15+J15+G15+D15 -> 238.2 | AA15: =+(X15+U15+R15+O15+L15+I15+F15+C15)/8 -> 5.2557375000000004 | AB15: =MINA(X15,U15,R15,O15,L15,I15,F15,C15) -> 5.1158000000000001
A16: MANE | B16: 1 | C16: 5.1059000000000001 | D16: 30 | E16: 3 | F16: 4.9615999999999998 | G16: 28 | H16: 5 | I16: 4.8951000000000002 | J16: 31 | K16: 7 | L16: 4.9516999999999998 | M16: 28 | N16: 8 | O16: 5.1708999999999996 | P16: 30 | Q16: 6 | R16: 5.0622999999999996 | S16: 28 | T16: 4 | U16: 5.1692999999999998 | V16: 26 | W16: 2 | X16: 4.9545000000000003 | Y16: 32.74 | Z16: =+Y16+V16+S16+P16+M16+J16+G16+D16 -> 233.74 | AA16: =+(X16+U16+R16+O16+L16+I16+F16+C16)/8 -> 5.0339124999999996 | AB16: =MINA(X16,U16,R16,O16,L16,I16,F16,C16) -> 4.8951000000000002
A17: CONRADO | B17: 4 | C17: 4.2906000000000004 | D17: 27 | E17: 2 | F17: 5.0058999999999996 | G17: 23 | H17: 1 | I17: 5.1695000000000002 | J17: 20 | K17: 3 | L17: 5.1258999999999997 | M17: 31 | N17: 5 | O17: 5.3890000000000002 | P17: 28 | Q17: 7 | R17: 5.6116000000000001 | S17: 25 | T17: 8 | U17: 5.5505000000000004 | V17: 26 | W17: 6 | X17: 5.5183 | Y17: 15 | Z17: =+Y17+V17+S17+P17+M17+J17+G17+D17 -> 195 | AA17: =+(X17+U17+R17+O17+L17+I17+F17+C17)/8 -> 5.2076624999999988 | AB17: =MINA(X17,U17,R17,O17,L17,I17,F17,C17) -> 4.2906000000000004
A18: LUIZ FELIP | B18: 6 | C18: 5.4922000000000004 | D18: 23 | E18: 4 | F18: 5.2812000000000001 | G18: 22 | H18: 2 | I18: 5.2744 | J18: 29 | K18: 1 | L18: 5.3895 | M18: 19 | N18: 3 | O18: 5.2784000000000004 | P18: 19 | Q18: 5 | R18: 5.3630000000000004 | S18: 19 | T18: 7 | U18: 5.4997999999999996 | V18: 23 | W18: 8 | X18: 5.3893000000000004 | Y18: 26.28 | Z18: =+Y18+V18+S18+P18+M18+J18+G18+D18 -> 180.28 | AA18: =+(X18+U18+R18+O18+L18+I18+F18+C18)/8 -> 5.3709749999999996 | AB18: =MINA(X18,U18,R18,O18,L18,I18,F18,C18) -> 5.2744
A19: 3 Bateria
A20: Piloto | B20: Pi | C20: Tempo | D20: Vol | E20: Pi | F20: Tempo | G20: Vol | H20: Pi | I20: Tempo | J20: Vol | K20: Pi | L20: Tempo | M20: Vol | N20: Pi | O20: Tempo | P20: Vol | Q20: Pi | R20: Tempo | S20: Vol | T20: Pi | U20: Tempo | V20: Vol | W20: Pi | X20: Tempo | Y20: Vol | Z20: Total | AA20: Media | AB20: Record
A21: BONGA | B21: 7 | C21: 5.0423 | D21: 32 | E21: 8 | F21: 5.0606 | G21: 33 | H21: 6 | I21: 4.9501999999999997 | J21: 33 | K21: 4 | L21: 4.8361999999999998 | M21: 35 | N21: 2 | O21: 4.8369999999999997 | P21: 36 | Q21: 1 | R21: 5.0594999999999999 | S21: 30 | T21: 3 | U21: 4.8247999999999998 | V21: 35 | W21: 5 | X21: 4.1779000000000002 | Y21: 31.63 | Z21: =+Y21+V21+S21+P21+M21+J21+G21+D21 -> 265.63 | AA21: =+(X21+U21+R21+O21+L21+I21+F21+C21)/8 -> 4.848562499999999 | AB21: =MINA(X21,U21,R21,O21,L21,I21,F21,C21) -> 4.1779000000000002
A22: RUBAO | B22: 2 | C22: 5.0598999999999998 | D22: 32 | E22: 1 | F22: 5.2697000000000003 | G22: 32 | H22: 3 | I22: 4.8949999999999996 | J22: 34 | K22: 5 | L22: 5.2363 | M22: 31 | N22: 7 | O22: 5.0601000000000003 | P22: 30 | Q22: 8 | R22: 5.0796999999999999 | S22: 29 | T22: 6 | U22: 5.0410000000000004 | V22: 33 | W22: 4 | X22: 5.0598000000000001 | Y22: 33.06 | Z22: =+Y22+V22+S22+P22+M22+J22+G22+D22 -> 254.06 | AA22: =+(X22+U22+R22+O22+L22+I22+F22+C22)/8 -> 5.0876874999999995 | AB22: =MINA(X22,U22,R22,O22,L22,I22,F22,C22) -> 4.8949999999999996
A23: RICARDO | B23: 8 | C23: 5.2778999999999998 | D23: 29 | E23: 6 | F23: 5.226 | G23: 32 | H23: 4 | I23: 5.0637999999999996 | J23: 33 | K23: 2 | L23: 5.0606 | M23: 31 | N23: 1 | O23: 5.0598000000000001 | P23: 33 | Q23: 3 | R23: 5.0591999999999997 | S23: 31 | T23: 5 | U23: 5.0590999999999999 | V23: 33 | W23: 7 | X23: 5.2794999999999996 | Y23: 31.76 | Z23: =+Y23+V23+S23+P23+M23+J23+G23+D23 -> 253.76 | AA23: =+(X23+U23+R23+O23+L23+I23+F23+C23)/8 -> 5.1357375000000003 | AB23: =MINA(X23,U23,R23,O23,L23,I23,F23,C23) -> 5.0590999999999999
A24: JOAO KIBE | B24: 1 | C24: 5.0423 | D24: 30 | E24: 3 | F24: 5.0602999999999998 | G24: 33 | H24: 5 | I24: 4.8404999999999996 | J24: 30 | K24: 7 | L24: 5.2803000000000004 | M24: 31 | N24: 8 | O24: 5.0587999999999997 | P24: 31 | Q24: 6 | R24: 5.0629999999999997 | S24: 25 | T24: 4 | U24: 4.8404999999999996 | V24: 35 | W24: 2 | X24: 4.8955000000000002 | Y24: 34.72 | Z24: =+Y24+V24+S24+P24+M24+J24+G24+D24 -> 249.72 | AA24: =+(X24+U24+R24+O24+L24+I24+F24+C24)/8 -> 5.0101499999999994 | AB24: =MINA(X24,U24,R24,O24,L24,I24,F24,C24) -> 4.8404999999999996
A25: JULIO | B25: 4 | C25: 4.8402000000000003 | D25: 32 | E25: 2 | F25: 5.0605000000000002 | G25: 31 | H25: 1 | I25: 5.0594000000000001 | J25: 33 | K25: 3 | L25: 4.8399000000000001 | M25: 34 | N25: 5 | O25: 5.2263999999999999 | P25: 29 | Q25: 7 | R25: 5.1704999999999997 | S25: 28 | T25: 8 | U25: 5.2778999999999998 | V25: 31 | W25: 6 | X25: 5.0603999999999996 | Y25: 27.28 | Z25: =+Y25+V25+S25+P25+M25+J25+G25+D25 -> 245.28 | AA25: =+(X25+U25+R25+O25+L25+I25+F25+C25)/8 -> 5.0669000000000004 | AB25: =MINA(X25,U25,R25,O25,L25,I25,F25,C25) -> 4.8399000000000001
A26: LISTER | B26: 3 | C26: 5.0598999999999998 | D26: 27 | E26: 5 | F26: 5.2763 | G26: 29 | H26: 7 | I26: 5.0048000000000004 | J26: 32 | K26: 8 | L26: 5.2797000000000001 | M26: 32 | N26: 6 | O26: 5.2784000000000004 | P26: 30 | Q26: 4 | R26: 5.0606 | S26: 25 | T26: 2 | U26: 5.1707000000000001 | V26: 33 | W26: 1 | X26: 5.2256999999999998 | Y26: 34.09 | Z26: =+Y26+V26+S26+P26+M26+J26+G26+D26 -> 242.09 | AA26: =+(X26+U26+R26+O26+L26+I26+F26+C26)/8 -> 5.1695125000000006 | AB26: =MINA(X26,U26,R26,O26,L26,I26,F26,C26) -> 5.0048000000000004
A27: MARCEL | B27: 5 | C27: 5.2794999999999996 | D27: 29 | E27: 7 | F27: 5.0578000000000003 | G27: 23 | H27: 8 | I27: 5.2803000000000004 | J27: 15 | K27: 6 | L27: 5.0602 | M27: 32 | N27: 4 | O27: 5.0591999999999997 | P27: 12 | Q27: 2 | R27: 5.0593000000000004 | S27: 26 | T27: 1 | U27: 5.1684000000000001 | V27: 33 | W27: 3 | X27: 5.0052000000000003 | Y27: 19 | Z27: =+Y27+V27+S27+P27+M27+J27+G27+D27 -> 189 | AA27: =+(X27+U27+R27+O27+L27+I27+F27+C27)/8 -> 5.1212374999999994 | AB27: =MINA(X27,U27,R27,O27,L27,I27,F27,C27) -> 5.0052000000000003
A28: 4 Bateria
A29: Piloto | B29: Pi | C29: Tempo | D29: Vol | E29: Pi | F29: Tempo | G29: Vol | H29: Pi | I29: Tempo | J29: Vol | K29: Pi | L29: Tempo | M29: Vol | N29: Pi | O29: Tempo | P29: Vol | Q29: Pi | R29: Tempo | S29: Vol | T29: Pi | U29: Tempo | V29: Vol | W29: Pi | X29: Tempo | Y29: Vol | Z29: Total | AA29: Media | AB29: Record
A30: MICHEL | B30: 3 | C30: 4.6374000000000004 | D30: 36 | E30: 5 | F30: 4.8376000000000001 | G30: 35 | H30: 7 | I30: 4.6196999999999999 | J30: 37 | K30: 8 | L30: 4.8391999999999999 | M30: 36 | N30: 6 | O30: 4.8239999999999998 | P30: 34 | Q30: 4 | R30: 4.6010999999999997 | S30: 36 | T30: 2 | U30: 4.6215999999999999 | V30: 37 | W30: 1 | X30: 4.8362999999999996 | Y30: 36.3 | Z30: =+Y30+V30+S30+P30+M30+J30+G30+D30 -> 287.3 | AA30: =+(X30+U30+R30+O30+L30+I30+F30+C30)/8 -> 4.7271124999999996 | AB30: =MINA(X30,U30,R30,O30,L30,I30,F30,C30) -> 4.6010999999999997
A31: JERA | B31: 7 | C31: 4.8391999999999999 | D31: 36 | E31: 8 | F31: 4.8406000000000002 | G31: 34 | H31: 6 | I31: 4.6742999999999997 | J31: 36 | K31: 4 | L31: 4.6208999999999998 | M31: 36 | N31: 2 | O31: 4.6768000000000001 | P31: 36 | Q31: 1 | R31: 4.8390000000000004 | S31: 36 | T31: 3 | U31: 4.7850000000000001 | V31: 35 | W31: 5 | X31: 4.8377999999999997 | Y31: 34.76 | Z31: =+Y31+V31+S31+P31+M31+J31+G31+D31 -> 283.76 | AA31: =+(X31+U31+R31+O31+L31+I31+F31+C31)/8 -> 4.7641999999999998 | AB31: =MINA(X31,U31,R31,O31,L31,I31,F31,C31) -> 4.6208999999999998
A32: DINHO | B32: 4 | C32: 4.6009000000000002 | D32: 37 | E32: 2 | F32: 4.6755000000000004 | G32: 36 | H32: 1 | I32: 4.6763000000000003 | J32: 33 | K32: 3 | L32: 4.6212 | M32: 36 | N32: 5 | O32: 4.6203000000000003 | P32: 36 | Q32: 7 | R32: 4.6501000000000001 | S32: 35 | T32: 8 | U32: 4.8402000000000003 | V32: 33 | W32: 6 | X32: 4.6749000000000001 | Y32: 35.48 | Z32: =+Y32+V32+S32+P32+M32+J32+G32+D32 -> 281.48 | AA32: =+(X32+U32+R32+O32+L32+I32+F32+C32)/8 -> 4.669925000000001 | AB32: =MINA(X32,U32,R32,O32,L32,I32,F32,C32) -> 4.6009000000000002
A33: KLEBER | B33: 2 | C33: 4.6741999999999999 | D33: 35 | E33: 1 | F33: 4.8216999999999999 | G33: 30 | H33: 3 | I33: 4.6205999999999996 | J33: 36 | K33: 5 | L33: 4.7850000000000001 | M33: 36 | N33: 7 | O33: 4.7853000000000003 | P33: 36 | Q33: 8 | R33: 4.6764000000000001 | S33: 35 | T33: 6 | U33: 4.8399000000000001 | V33: 29 | W33: 4 | X33: 4.6104000000000003 | Y33: 35.96 | Z33: =+Y33+V33+S33+P33+M33+J33+G33+D33 -> 272.96 | AA33: =+(X33+U33+R33+O33+L33+I33+F33+C33)/8 -> 4.7266874999999997 | AB33: =MINA(X33,U33,R33,O33,L33,I33,F33,C33) -> 4.6104000000000003
A34: EVANDRO | B34: 8 | C34: 5.0603999999999996 | D34: 33 | E34: 6 | F34: 4.8403 | G34: 33 | H34: 4 | I34: 4.8381999999999996 | J34: 33 | K34: 2 | L34: 4.8385999999999996 | M34: 35 | N34: 1 | O34: 4.8404999999999996 | P34: 35 | Q34: 3 | R34: 4.8403 | S34: 32 | T34: 5 | U34: 4.9508000000000001 | V34: 29 | W34: 7 | X34: 5.2243000000000004 | Y34: 32.22 | Z34: =+Y34+V34+S34+P34+M34+J34+G34+D34 -> 262.22 | AA34: =+(X34+U34+R34+O34+L34+I34+F34+C34)/8 -> 4.9291749999999999 | AB34: =MINA(X34,U34,R34,O34,L34,I34,F34,C34) -> 4.8381999999999996
A35: ANDERSON | B35: 6 | C35: 5.0586000000000002 | D35: 34 | E35: 4 | F35: 4.8216999999999999 | G35: 32 | H35: 2 | I35: 5.0590000000000002 | J35: 29 | K35: 1 | L35: 5.0590999999999999 | M35: 33 | N35: 3 | O35: 4.8391999999999999 | P35: 34 | Q35: 5 | R35: 5.0602999999999998 | S35: 33 | T35: 7 | U35: 4.9311999999999996 | V35: 32 | W35: 8 | X35: 5.2801999999999998 | Y35: 25.28 | Z35: =+Y35+V35+S35+P35+M35+J35+G35+D35 -> 252.28 | AA35: =+(X35+U35+R35+O35+L35+I35+F35+C35)/8 -> 5.0136625000000006 | AB35: =MINA(X35,U35,R35,O35,L35,I35,F35,C35) -> 4.8216999999999999