A1: Pos | B1: Piloto | C1: Voltas
A2: 1 | B2: DINHO | C2: 248.28
A3: =+A2+1 -> 2 | B3: JERA | C3: 247.15
A4: =+A3+1 -> 3 | B4: BONGA | C4: 246.74
A5: =+A4+1 -> 4 | B5: NETO | C5: 240.46
A6: =+A5+1 -> 5 | B6: LUIZ FELIPE | C6: 237.78
A7: =+A6+1 -> 6 | B7: RICARDO | C7: 237.26
A8: =+A7+1 -> 7 | B8: TONY | C8: 233.54
A9: =+A8+1 -> 8 | B9: MORTA | C9: 231.06
A10: =+A9+1 -> 9 | B10: RUBÃO | C10: 230.81
A11: =+A10+1 -> 10 | B11: ERIC | C11: 228.31