A1: Patrocinadores

B1: Motos e Acessórios Honda - Rua Sete de Setembro, 387 - Fone: (15) 3331-6700. | C1: Rua Olavo Bilac, 254 - Vila Santana

A1: 1 Bateria
A2: Piloto | B2: Pi | C2: Tempo | D2: Vol | E2: Pi | F2: Tempo | G2: Vol | H2: Pi | I2: Tempo | J2: Vol | K2: Pi | L2: Tempo | M2: Vol | N2: Pi | O2: Tempo | P2: Vol | Q2: Pi | R2: Tempo | S2: Vol | T2: Pi | U2: Tempo | V2: Vol | W2: Pi | X2: Tempo | Y2: Vol | Z2: Total | AA2: Media | AB2: Record
A3: MARCEL | B3: 2 | C3: 5.5 | D3: 25 | E3: 1 | F3: 5.3540000000000001 | G3: 23 | H3: 3 | I3: 5.2507000000000001 | J3: 30 | K3: 5 | L3: 5.1147999999999998 | M3: 32 | N3: 7 | O3: 5.2793000000000001 | P3: 27 | Q3: 8 | R3: 5.2785000000000002 | S3: 32 | T3: 6 | U3: 5.0693999999999999 | V3: 33 | W3: 4 | X3: 5.0602999999999998 | Y3: 34.09 | Z3: =+Y3+V3+S3+P3+M3+J3+G3+D3 -> 236.09 | AA3: =+(X3+U3+R3+O3+L3+I3+F3+C3)/8 -> 5.2383749999999996 | AB3: =MINA(X3,U3,R3,O3,L3,I3,F3,C3) -> 5.0602999999999998
A4: LISTER | B4: 5 | C4: 5.2812000000000001 | D4: 22 | E4: 7 | F4: 5.1151 | G4: 33 | H4: 8 | I4: 5.4802999999999997 | J4: 24 | K4: 6 | L4: 5.2797999999999998 | M4: 29 | N4: 4 | O4: 5.2792000000000003 | P4: 28 | Q4: 2 | R4: 5.2801999999999998 | S4: 32 | T4: 1 | U4: 5.3901000000000003 | V4: 31 | W4: 3 | X4: 5.2469000000000001 | Y4: 31.65 | Z4: =+Y4+V4+S4+P4+M4+J4+G4+D4 -> 230.65 | AA4: =+(X4+U4+R4+O4+L4+I4+F4+C4)/8 -> 5.2940999999999994 | AB4: =MINA(X4,U4,R4,O4,L4,I4,F4,C4) -> 5.1151
A5: RICARDO | B5: 7 | C5: 5.5002000000000004 | D5: 30 | E5: 8 | F5: 5.5545 | G5: 29 | H5: 6 | I5: 5.6284999999999998 | J5: 26 | K5: 4 | L5: 5.4451000000000001 | M5: 30 | N5: 2 | O5: 5.5003000000000002 | P5: 28 | Q5: 1 | R5: 5.5556999999999999 | S5: 27 | T5: 3 | U5: 5.6101000000000001 | V5: 27 | W5: 5 | X5: 5.5003000000000002 | Y5: 31.28 | Z5: =+Y5+V5+S5+P5+M5+J5+G5+D5 -> 228.28 | AA5: =+(X5+U5+R5+O5+L5+I5+F5+C5)/8 -> 5.5368374999999999 | AB5: =MINA(X5,U5,R5,O5,L5,I5,F5,C5) -> 5.4451000000000001
A6: RUDSON | B6: 4 | C6: 5.3902999999999999 | D6: 27 | E6: 2 | F6: 5.3334000000000001 | G6: 31 | H6: 1 | I6: 5.7195 | J6: 27 | K6: 3 | L6: 5.4983000000000004 | M6: 31 | N6: 5 | O6: 5.5006000000000004 | P6: 28 | Q6: 7 | R6: 5.4997999999999996 | S6: 27 | T6: 8 | U6: 5.7205000000000004 | V6: 26 | W6: 6 | X6: 5.5564999999999998 | Y6: 29.76 | Z6: =+Y6+V6+S6+P6+M6+J6+G6+D6 -> 226.76 | AA6: =+(X6+U6+R6+O6+L6+I6+F6+C6)/8 -> 5.5273624999999988 | AB6: =MINA(X6,U6,R6,O6,L6,I6,F6,C6) -> 5.3334000000000001
A7: TOMAZ | B7: 3 | C7: 6.1596000000000002 | D7: 25 | E7: 5 | F7: 5.9233000000000002 | G7: 21 | H7: 7 | I7: 5.7748999999999997 | J7: 20 | K7: 8 | L7: 6.3792 | M7: 23 | N7: 6 | O7: 5.9401999999999999 | P7: 24 | Q7: 4 | R7: 5.9406999999999996 | S7: 22 | T7: 2 | U7: 5.94 | V7: 27 | W7: 1 | X7: 5.8314000000000004 | Y7: 25.44 | Z7: =+Y7+V7+S7+P7+M7+J7+G7+D7 -> 187.44 | AA7: =+(X7+U7+R7+O7+L7+I7+F7+C7)/8 -> 5.9861624999999998 | AB7: =MINA(X7,U7,R7,O7,L7,I7,F7,C7) -> 5.7748999999999997
A8: FLAVIO | B8: 1 | C8: 6.1615000000000002 | D8: 24 | E8: 3 | F8: 5.9405999999999999 | G8: 20 | H8: 5 | I8: 6.1605999999999996 | J8: 23 | K8: 7 | L8: 5.7751000000000001 | M8: 23 | N8: 8 | O8: 5.6210000000000004 | P8: 24 | Q8: 6 | R8: 5.8308 | S8: 23 | T8: 4 | U8: 5.5542999999999996 | V8: 27 | W8: 2 | X8: 6.1055999999999999 | Y8: 19.56 | Z8: =+Y8+V8+S8+P8+M8+J8+G8+D8 -> 183.56 | AA8: =+(X8+U8+R8+O8+L8+I8+F8+C8)/8 -> 5.8936875000000004 | AB8: =MINA(X8,U8,R8,O8,L8,I8,F8,C8) -> 5.5542999999999996
A9: LUIZ FELIPE | B9: 6 | C9: 5.9413999999999998 | D9: 17 | E9: 4 | F9: 5.2869999999999999 | G9: 24 | H9: 2 | I9: 5.2804000000000002 | J9: 23 | K9: 1 | L9: 5.5006000000000004 | M9: 24 | N9: 3 | O9: 5.2801999999999998 | P9: 23 | Q9: 5 | R9: 5.5 | S9: 21 | T9: 7 | U9: 5.5019999999999998 | V9: 24 | W9: 8 | X9: 5.7111000000000001 | Y9: 25.24 | Z9: =+Y9+V9+S9+P9+M9+J9+G9+D9 -> 181.24 | AA9: =+(X9+U9+R9+O9+L9+I9+F9+C9)/8 -> 5.5003375000000005 | AB9: =MINA(X9,U9,R9,O9,L9,I9,F9,C9) -> 5.2801999999999998
A10: 2 Bateria | Z10: =+Y10+V10+S10+P10+M10+J10+G10+D10 -> 0 | AA10: =+(X10+U10+R10+O10+L10+I10+F10+C10)/8 -> 0 | AB10: =MINA(X10,U10,R10,O10,L10,I10,F10,C10) -> 0
A11: Piloto | B11: Pi | C11: Tempo | D11: Vol | E11: Pi | F11: Tempo | G11: Vol | H11: Pi | I11: Tempo | J11: Vol | K11: Pi | L11: Tempo | M11: Vol | N11: Pi | O11: Tempo | P11: Vol | Q11: Pi | R11: Tempo | S11: Vol | T11: Pi | U11: Tempo | V11: Vol | W11: Pi | X11: Tempo | Y11: Vol | Z11: Total | AA11: Media | AB11: Record
A12: KLEBER | B12: 4 | C12: 5.1153000000000004 | D12: 33 | E12: 2 | F12: 5.0595999999999997 | G12: 32 | H12: 1 | I12: 5.2790999999999997 | J12: 31 | K12: 3 | L12: 4.9503000000000004 | M12: 30 | N12: 5 | O12: 5.2167000000000003 | P12: 32 | Q12: 7 | R12: 5.2789999999999999 | S12: 30 | T12: 8 | U12: 5.2805 | V12: 28 | W12: 6 | X12: 5.2716000000000003 | Y12: 30.17 | Z12: =+Y12+V12+S12+P12+M12+J12+G12+D12 -> 246.17 | AA12: =+(X12+U12+R12+O12+L12+I12+F12+C12)/8 -> 5.1815124999999993 | AB12: =MINA(X12,U12,R12,O12,L12,I12,F12,C12) -> 4.9503000000000004
A13: EVANDRO | B13: 7 | C13: 5.2805 | D13: 29 | E13: 8 | F13: 5.7206999999999999 | G13: 27 | H13: 6 | I13: 5.7098000000000004 | J13: 28 | K13: 4 | L13: 5.0606 | M13: 33 | N13: 2 | O13: 5.0046999999999997 | P13: 24 | Q13: 1 | R13: 5.0595999999999997 | S13: 34 | T13: 3 | U13: 5.0587 | V13: 30 | W13: 5 | X13: 5.1609999999999996 | Y13: 32.74 | Z13: =+Y13+V13+S13+P13+M13+J13+G13+D13 -> 237.74 | AA13: =+(X13+U13+R13+O13+L13+I13+F13+C13)/8 -> 5.2569499999999998 | AB13: =MINA(X13,U13,R13,O13,L13,I13,F13,C13) -> 5.0046999999999997
A14: RUBAO | B14: 2 | C14: 5.5006000000000004 | D14: 29 | E14: 1 | F14: 5.5541 | G14: 30 | H14: 3 | I14: 5.5003000000000002 | J14: 29 | K14: 5 | L14: 5.5000999999999998 | M14: 27 | N14: 7 | O14: 5.5004 | P14: 30 | Q14: 8 | R14: 5.4992000000000001 | S14: 27 | T14: 6 | U14: 5.5018000000000002 | V14: 29 | W14: 4 | X14: 4.4009 | Y14: 31.74 | Z14: =+Y14+V14+S14+P14+M14+J14+G14+D14 -> 232.74 | AA14: =+(X14+U14+R14+O14+L14+I14+F14+C14)/8 -> 5.369675 | AB14: =MINA(X14,U14,R14,O14,L14,I14,F14,C14) -> 4.4009
A15: JOAO KIBON | B15: 3 | C15: 5.3903999999999996 | D15: 30 | E15: 5 | F15: 5.3358999999999996 | G15: 28 | H15: 7 | I15: 5.4997999999999996 | J15: 30 | K15: 8 | L15: 5.6532999999999998 | M15: 28 | N15: 6 | O15: 5.7183000000000002 | P15: 27 | Q15: 4 | R15: 5.2805999999999997 | S15: 31 | T15: 2 | U15: 5.2794999999999996 | V15: 25 | W15: 1 | X15: 5.4908999999999999 | Y15: 31.67 | Z15: =+Y15+V15+S15+P15+M15+J15+G15+D15 -> 230.67 | AA15: =+(X15+U15+R15+O15+L15+I15+F15+C15)/8 -> 5.4560874999999998 | AB15: =MINA(X15,U15,R15,O15,L15,I15,F15,C15) -> 5.2794999999999996
A16: GIOVANNI | B16: 6 | C16: 5.5007999999999999 | D16: 27 | E16: 4 | F16: 5.2789999999999999 | G16: 30 | H16: 2 | I16: 5.2808000000000002 | J16: 25 | K16: 1 | L16: 5.4991000000000003 | M16: 29 | N16: 3 | O16: 5.2793000000000001 | P16: 32 | Q16: 5 | R16: 5.7202999999999999 | S16: 24 | T16: 7 | U16: 5.6275000000000004 | V16: 28 | W16: 8 | X16: 5.5 | Y16: 28.31 | Z16: =+Y16+V16+S16+P16+M16+J16+G16+D16 -> 223.31 | AA16: =+(X16+U16+R16+O16+L16+I16+F16+C16)/8 -> 5.4608499999999989 | AB16: =MINA(X16,U16,R16,O16,L16,I16,F16,C16) -> 5.2789999999999999
A17: MANE | B17: 5 | C17: 5.1707000000000001 | D17: 32 | E17: 7 | F17: 5.2797999999999998 | G17: 30 | H17: 8 | I17: 5.2606999999999999 | J17: 28 | K17: 6 | L17: 5.1619000000000002 | M17: 30 | N17: 4 | O17: 5.0590999999999999 | P17: 33 | Q17: 2 | R17: 5.0590999999999999 | S17: 25 | T17: 1 | U17: 5.3357999999999999 | V17: 15 | W17: 3 | X17: 5.2807000000000004 | Y17: 27.78 | Z17: =+Y17+V17+S17+P17+M17+J17+G17+D17 -> 220.78 | AA17: =+(X17+U17+R17+O17+L17+I17+F17+C17)/8 -> 5.2009749999999997 | AB17: =MINA(X17,U17,R17,O17,L17,I17,F17,C17) -> 5.0590999999999999
A18: JAPAO | B18: 1 | C18: 5.7008999999999999 | D18: 28 | E18: 3 | F18: 5.7198000000000002 | G18: 25 | H18: 5 | I18: 5.7191999999999998 | J18: 29 | K18: 7 | L18: 5.6662999999999997 | M18: 30 | N18: 8 | O18: 5.8303000000000003 | P18: 27 | Q18: 6 | R18: 5.7015000000000002 | S18: 29 | T18: 4 | U18: 5.6105 | V18: 22 | W18: 2 | X18: 5.7201000000000004 | Y18: 29.74 | Z18: =+Y18+V18+S18+P18+M18+J18+G18+D18 -> 219.74 | AA18: =+(X18+U18+R18+O18+L18+I18+F18+C18)/8 -> 5.7085749999999997 | AB18: =MINA(X18,U18,R18,O18,L18,I18,F18,C18) -> 5.6105
A19: 3 Bateria
A20: Piloto | B20: Pi | C20: Tempo | D20: Vol | E20: Pi | F20: Tempo | G20: Vol | H20: Pi | I20: Tempo | J20: Vol | K20: Pi | L20: Tempo | M20: Vol | N20: Pi | O20: Tempo | P20: Vol | Q20: Pi | R20: Tempo | S20: Vol | T20: Pi | U20: Tempo | V20: Vol | W20: Pi | X20: Tempo | Y20: Vol | Z20: Total | AA20: Media | AB20: Record
A21: ANDE | B21: 6 | C21: 5.0587 | D21: 34 | E21: 4 | F21: 4.8395999999999999 | G21: 35 | H21: 2 | I21: 4.95 | J21: 34 | K21: 1 | L21: 4.9509999999999996 | M21: 34 | N21: 3 | O21: 4.8597999999999999 | P21: 32 | Q21: 5 | R21: 5.0411999999999999 | S21: 32 | T21: 7 | U21: 5.0438999999999998 | V21: 33 | W21: 8 | X21: 5.2249999999999996 | Y21: 31.24 | Z21: =+Y21+V21+S21+P21+M21+J21+G21+D21 -> 265.24 | AA21: =+(X21+U21+R21+O21+L21+I21+F21+C21)/8 -> 4.9961500000000001 | AB21: =MINA(X21,U21,R21,O21,L21,I21,F21,C21) -> 4.8395999999999999
A22: MICHEL | B22: 4 | C22: 5.0583999999999998 | D22: 34 | E22: 2 | F22: 5.0442999999999998 | G22: 31 | H22: 1 | I22: 5.0602 | J22: 33 | K22: 3 | L22: 4.9508000000000001 | M22: 34 | N22: 5 | O22: 5.0595999999999997 | P22: 33 | Q22: 7 | R22: 5.0420999999999996 | S22: 33 | T22: 8 | U22: 5.0578000000000003 | V22: 33 | W22: 6 | X22: 5.06 | Y22: 33.2 | Z22: =+Y22+V22+S22+P22+M22+J22+G22+D22 -> 264.2 | AA22: =+(X22+U22+R22+O22+L22+I22+F22+C22)/8 -> 5.0416499999999997 | AB22: =MINA(X22,U22,R22,O22,L22,I22,F22,C22) -> 4.9508000000000001
A23: DINHO | B23: 2 | C23: 5.0601000000000003 | D23: 33 | E23: 1 | F23: 5.2792000000000003 | G23: 32 | H23: 3 | I23: 5.0602999999999998 | J23: 32 | K23: 5 | L23: 5.0597000000000003 | M23: 32 | N23: 7 | O23: 5.2766000000000002 | P23: 31 | Q23: 8 | R23: 5.2428999999999997 | S23: 32 | T23: 6 | U23: 5.06 | V23: 33 | W23: 4 | X23: 5.0506000000000002 | Y23: 32.26 | Z23: =+Y23+V23+S23+P23+M23+J23+G23+D23 -> 257.26 | AA23: =+(X23+U23+R23+O23+L23+I23+F23+C23)/8 -> 5.1361749999999997 | AB23: =MINA(X23,U23,R23,O23,L23,I23,F23,C23) -> 5.0506000000000002
A24: JERA | B24: 3 | C24: 5.0602999999999998 | D24: 31 | E24: 5 | F24: 5.0423999999999998 | G24: 28 | H24: 7 | I24: 5.06 | J24: 33 | K24: 8 | L24: 5.1706000000000003 | M24: 25 | N24: 6 | O24: 5.1695000000000002 | P24: 32 | Q24: 4 | R24: 5.0602999999999998 | S24: 34 | T24: 2 | U24: 5.0601000000000003 | V24: 32 | W24: 1 | X24: 5.0606 | Y24: 34.22 | Z24: =+Y24+V24+S24+P24+M24+J24+G24+D24 -> 249.22 | AA24: =+(X24+U24+R24+O24+L24+I24+F24+C24)/8 -> 5.0854749999999997 | AB24: =MINA(X24,U24,R24,O24,L24,I24,F24,C24) -> 5.0423999999999998
A25: JULIO | B25: 8 | C25: 5.5000999999999998 | D25: 31 | E25: 6 | F25: 5.4847000000000001 | G25: 28 | H25: 4 | I25: 5.1588000000000003 | J25: 32 | K25: 2 | L25: 5.4974999999999996 | M25: 30 | N25: 1 | O25: 5.7195 | P25: 30 | Q25: 3 | R25: 5.4993999999999996 | S25: 31 | T25: 5 | U25: 5.7755999999999998 | V25: 24 | W25: 7 | X25: 5.6234000000000002 | Y25: 31 | Z25: =+Y25+V25+S25+P25+M25+J25+G25+D25 -> 237 | AA25: =+(X25+U25+R25+O25+L25+I25+F25+C25)/8 -> 5.532375 | AB25: =MINA(X25,U25,R25,O25,L25,I25,F25,C25) -> 5.1588000000000003
A26: BONGA | B26: 7 | C26: 5.3358999999999996 | D26: 30 | E26: 8 | F26: 5.5012999999999996 | G26: 29 | H26: 6 | I26: 5.4794999999999998 | J26: 29 | K26: 4 | L26: 5.1161000000000003 | M26: 32 | N26: 2 | O26: 5.2808000000000002 | P26: 24 | Q26: 1 | R26: 5.4962999999999997 | S26: 27 | T26: 3 | U26: 5.2801999999999998 | V26: 32 | W26: 5 | X26: 5.28 | Y26: 33.54 | Z26: =+Y26+V26+S26+P26+M26+J26+G26+D26 -> 236.54 | AA26: =+(X26+U26+R26+O26+L26+I26+F26+C26)/8 -> 5.3462624999999999 | AB26: =MINA(X26,U26,R26,O26,L26,I26,F26,C26) -> 5.1161000000000003
A27: ERIC | B27: 5 | C27: 5.2809999999999997 | D27: 32 | E27: 7 | F27: 5.42 | G27: 32 | H27: 8 | I27: 5.4992999999999999 | J27: 31 | K27: 6 | L27: 5.3879999999999999 | M27: 29 | N27: 4 | O27: 5.2779999999999996 | P27: 31 | Q27: 2 | R27: 5.5000999999999998 | S27: 6 | T27: 1 | U27: 5.2610999999999999 | V27: 30 | W27: 3 | X27: 5.2793000000000001 | Y27: 32.22 | Z27: =+Y27+V27+S27+P27+M27+J27+G27+D27 -> 223.22 | AA27: =+(X27+U27+R27+O27+L27+I27+F27+C27)/8 -> 5.3633499999999996 | AB27: =MINA(X27,U27,R27,O27,L27,I27,F27,C27) -> 5.2610999999999999