A1: Patrocinadores

B1: Motos e Acessórios Honda - Rua Sete de Setembro, 387 - Fone: (15) 3331-6700. | C1: Rua Olavo Bilac, 254 - Vila Santana

A1: Pilotos | B1: Pis | C1: Tempo | D1: Vol | E1: Pis | F1: Tempo | G1: Vol | H1: Pis | I1: Tempo | J1: Vol | K1: Pis | L1: Tempo | M1: Vol | N1: Pis | O1: Tempo | P1: Vol | Q1: Pis | R1: Tempo | S1: Vol | T1: Pis | U1: Tempo | V1: Vol | W1: Pis | X1: Tempo | Y1: Vol | Z1: Total | AA1: Media
A2: GIOVANNI | B2: 5 | C2: 5.5579999999999998 | D2: 25 | E2: 7 | F2: 5.7750000000000004 | G2: 27 | H2: 8 | I2: 5.28 | J2: 27 | K2: 6 | L2: 5.94 | M2: 26 | N2: 4 | O2: 5.94 | P2: 28 | Q2: 2 | R2: 5.94 | S2: 27 | T2: 1 | U2: 6.1589999999999998 | V2: 25 | W2: 3 | X2: 5.72 | Y2: 26 | Z2: 211.88888888888889 | AA2: =+(X2+U2+R2+O2+L2+I2+F2+C2)/8 -> 5.7889999999999997
A3: PACHECO | B3: 7 | C3: 5.6680000000000001 | D3: 24 | E3: 8 | F3: 6.5449999999999999 | G3: 22 | H3: 6 | I3: 6.38 | J3: 24 | K3: 4 | L3: 6.3769999999999998 | M3: 23 | N3: 2 | O3: 6.15 | P3: 27 | Q3: 1 | R3: 6.27 | S3: 26 | T3: 3 | U3: 6.16 | V3: 26 | W3: 5 | X3: 6.16 | Y3: 26 | Z3: 198.85185185185185 | AA3: =+(X3+U3+R3+O3+L3+I3+F3+C3)/8 -> 6.2137500000000001
A4: SANDRO ITU | B4: 4 | C4: 6.3769999999999998 | D4: 23 | E4: 2 | F4: 6.3789999999999996 | G4: 24 | H4: 1 | I4: 6.82 | J4: 23 | K4: 3 | L4: 6.38 | M4: 24 | N4: 5 | O4: 6.3789999999999996 | P4: 23 | Q4: 7 | R4: 6.3810000000000002 | S4: 23 | T4: 8 | U4: 6.6 | V4: 25 | W4: 6 | X4: 6.16 | Y4: 23 | Z4: 188.09259259259258 | AA4: =+(X4+U4+R4+O4+L4+I4+F4+C4)/8 -> 6.4344999999999999
A5: BOLA | B5: 6 | C5: 6.82 | D5: 15 | E5: 4 | F5: 6.3789999999999996 | G5: 24 | H5: 2 | I5: 6.38 | J5: 13 | K5: 1 | L5: 6.6 | M5: 22 | N5: 3 | O5: 6.1589999999999998 | P5: 25 | Q5: 5 | R5: 6.6 | S5: 23 | T5: 7 | U5: 6.16 | V5: 25 | W5: 8 | X5: 6.6 | Y5: 22 | Z5: 169.35185185185185 | AA5: =+(X5+U5+R5+O5+L5+I5+F5+C5)/8 -> 6.46225
A6: TOMAZ | B6: 3 | C6: 4.8949999999999996 | D6: 22 | E6: 5 | F6: 6.9290000000000003 | G6: 20 | H6: 7 | I6: 4.62 | J6: 20 | K6: 8 | L6: 7.0940000000000003 | M6: 19 | N6: 6 | O6: 7.37 | P6: 20 | Q6: 4 | R6: 7.15 | S6: 21 | T6: 2 | U6: 6.82 | V6: 23 | W6: 1 | X6: 7.04 | Y6: 23 | Z6: 168.33333333333334 | AA6: =+(X6+U6+R6+O6+L6+I6+F6+C6)/8 -> 6.489749999999999
A7: M VINICIUS | B7: 1 | C7: 7.1509999999999998 | D7: 19 | E7: 3 | F7: 6.5449999999999999 | G7: 17 | H7: 5 | I7: 6.82 | J7: 21 | K7: 7 | L7: 6.82 | M7: 22 | N7: 8 | O7: 6.6 | P7: 20 | Q7: 6 | R7: 6.5449999999999999 | S7: 21 | T7: 4 | U7: 6.82 | V7: 21 | W7: 2 | X7: 6.6 | Y7: 22 | Z7: 163.03703703703704 | AA7: =+(X7+U7+R7+O7+L7+I7+F7+C7)/8 -> 6.7376249999999995
A8: XUBAKA | B8: 2 | C8: 6.82 | D8: 17 | E8: 1 | F8: 6.875 | G8: 16 | H8: 3 | I8: 6.5990000000000002 | J8: 23 | K8: 5 | L8: 6.819 | M8: 18 | N8: 7 | O8: 5.06 | P8: 17 | Q8: 8 | R8: 7.5350000000000001 | S8: 15 | T8: 6 | U8: 7.5350000000000001 | V8: 15 | W8: 4 | X8: 7.7 | Y8: 11 | Z8: 132.87037037037038 | AA8: =+(X8+U8+R8+O8+L8+I8+F8+C8)/8 -> 6.8678750000000006

A1: Pilotos | B1: Pis | C1: Tempo | D1: Vol | E1: Pis | F1: Tempo | G1: Vol | H1: Pis | I1: Tempo | J1: Vol | K1: Pis | L1: Tempo | M1: Vol | N1: Pis | O1: Tempo | P1: Vol | Q1: Pis | R1: Tempo | S1: Vol | T1: Pis | U1: Tempo | V1: Vol | W1: Pis | X1: Tempo | Y1: Vol | Z1: Total | AA1: Media
A2: JUNINHO | B2: 6 | C2: 5.5 | D2: 29 | E2: 4 | F2: 5.72 | G2: 28 | H2: 2 | I2: 5.7190000000000003 | J2: 27 | K2: 1 | L2: 5.9950000000000001 | M2: 26 | N2: 3 | O2: 5.7190000000000003 | P2: 25 | Q2: 5 | R2: 5.72 | S2: 19 | T2: 7 | U2: 5.4960000000000004 | V2: 27 | W2: 8 | X2: 5.7089999999999996 | Y2: 27 | Z2: 208.77777777777777 | AA2: =+(X2+U2+R2+O2+L2+I2+F2+C2)/8 -> 5.6972500000000004
A3: RODRIGO | B3: 2 | C3: 6.38 | D3: 20 | E3: 1 | F3: 6.2149999999999999 | G3: 26 | H3: 3 | I3: 6.16 | J3: 25 | K3: 5 | L3: 6.3760000000000003 | M3: 23 | N3: 7 | O3: 5.83 | P3: 25 | Q3: 8 | R3: 6.6 | S3: 20 | T3: 6 | U3: 6.1589999999999998 | V3: 24 | W3: 4 | X3: 6.16 | Y3: 24 | Z3: 187.83333333333334 | AA3: =+(X3+U3+R3+O3+L3+I3+F3+C3)/8 -> 6.2350000000000003
A4: CASSIO | B4: 7 | C4: 6.16 | D4: 25 | E4: 8 | F4: 6.38 | G4: 18 | H4: 6 | I4: 6.16 | J4: 18 | K4: 4 | L4: 6.16 | M4: 23 | N4: 2 | O4: 6.16 | P4: 20 | Q4: 1 | R4: 6.6 | S4: 21 | T4: 3 | U4: 6.0510000000000002 | V4: 22 | W4: 5 | X4: 6.3789999999999996 | Y4: 25 | Z4: 172.38888888888889 | AA4: =+(X4+U4+R4+O4+L4+I4+F4+C4)/8 -> 6.2562499999999996
A5: FLAVIO | B5: 5 | C5: 6.3259999999999996 | D5: 20 | E5: 7 | F5: 6.38 | G5: 21 | H5: 8 | I5: 6.38 | J5: 18 | K5: 6 | L5: 6.3760000000000003 | M5: 20 | N5: 4 | O5: 6.26 | P5: 24 | Q5: 2 | R5: 6.375 | S5: 22 | T5: 1 | U5: 6.7110000000000003 | V5: 22 | W5: 3 | X5: 6.38 | Y5: 23 | Z5: 170.85185185185185 | AA5: =+(X5+U5+R5+O5+L5+I5+F5+C5)/8 -> 6.3985000000000003
A6: LUIZ FELIPE | B6: 3 | C6: 6.5990000000000002 | D6: 22 | E6: 5 | F6: 6.82 | G6: 18 | H6: 7 | I6: 6.38 | J6: 18 | K6: 8 | L6: 6.82 | M6: 20 | N6: 6 | O6: 6.6 | P6: 20 | Q6: 4 | R6: 6.6 | S6: 22 | T6: 2 | U6: 6.5449999999999999 | V6: 23 | W6: 1 | X6: 6.601 | Y6: 21 | Z6: 164.35185185185185 | AA6: =+(X6+U6+R6+O6+L6+I6+F6+C6)/8 -> 6.6206250000000004
A7: GUSTAVO | B7: 4 | C7: 6.38 | D7: 14 | E7: 2 | F7: 5.94 | G7: 26 | H7: 1 | I7: 5.5 | J7: 22 | K7: 3 | L7: 5.94 | M7: 26 | N7: 5 | O7: 5.9390000000000001 | P7: 25 | Q7: 7 | R7: 6.1589999999999998 | S7: 5 | T7: 8 | U7: 6.3769999999999998 | V7: 18 | W7: 6 | X7: 6.38 | Y7: 22 | Z7: 158.66666666666666 | AA7: =+(X7+U7+R7+O7+L7+I7+F7+C7)/8 -> 6.0768750000000002
A8: MATHEUS | B8: 1 | C8: 6.82 | D8: 13 | E8: 3 | F8: 6.4349999999999996 | G8: 11 | H8: 5 | I8: 7.0389999999999997 | J8: 16 | K8: 7 | L8: 6.8209999999999997 | M8: 15 | N8: 8 | O8: 7.48 | P8: 9 | Q8: 6 | R8: 7.05 | S8: 14 | T8: 4 | U8: 6.7649999999999997 | V8: 16 | W8: 2 | X8: 6.6 | Y8: 18 | Z8: 112.81481481481481 | AA8: =+(X8+U8+R8+O8+L8+I8+F8+C8)/8 -> 6.8762499999999998

A1: Nome | B1: P | C1: Tempo | D1: Vol | E1: P | F1: Tempo | G1: Vol | H1: P | I1: Tempo | J1: Vol | K1: P | L1: Tempo | M1: Vol | N1: P | O1: Tempo | P1: Vol | Q1: P | R1: Tempo | S1: Vol | T1: P | U1: Tempo | V1: Vol | W1: P | X1: Tempo | Y1: Vol | Z1: Total | AA1: Media | AB1: Record
A2: JAPAO | B2: 5 | C2: 6.1609999999999996 | D2: 24 | E2: 7 | F2: 6.1589999999999998 | G2: 24 | H2: 8 | I2: 6.38 | J2: 25 | K2: 6 | L2: 5.94 | M2: 27 | N2: 4 | O2: 5.94 | P2: 22 | Q2: 2 | R2: 6.16 | S2: 25 | T2: 1 | U2: 6.3780000000000001 | V2: 25 | W2: 3 | X2: 6.16 | Y2: 25 | Z2: 199.61111111111111 | AA2: =+(X2+U2+R2+O2+L2+I2+F2+C2)/8 -> 6.1597500000000007 | AB2: =MINA(X2,U2,R2,O2,L2,I2,F2,C2) -> 5.94
A3: GERONIMO | B3: 2 | C3: 6.38 | D3: 25 | E3: 1 | F3: 6.6 | G3: 25 | H3: 3 | I3: 6.38 | J3: 25 | K3: 5 | L3: 6.38 | M3: 24 | N3: 7 | O3: 6.82 | P3: 21 | Q3: 8 | R3: 6.6 | S3: 23 | T3: 6 | U3: 6.4370000000000003 | V3: 24 | W3: 4 | X3: 6.1589999999999998 | Y3: 24 | Z3: 192.27777777777777 | AA3: =+(X3+U3+R3+O3+L3+I3+F3+C3)/8 -> 6.4695000000000009 | AB3: =MINA(X3,U3,R3,O3,L3,I3,F3,C3) -> 6.1589999999999998
A4: FERNANDO | B4: 1 | C4: 6.3789999999999996 | D4: 22 | E4: 3 | F4: 6.15 | G4: 26 | H4: 5 | I4: 6.1609999999999996 | J4: 24 | K4: 7 | L4: 6.1589999999999998 | M4: 27 | N4: 8 | O4: 6.38 | P4: 23 | Q4: 6 | R4: 5.94 | S4: 21 | T4: 4 | U4: 6.16 | V4: 24 | W4: 2 | X4: 6.38 | Y4: 24 | Z4: 192.05555555555554 | AA4: =+(X4+U4+R4+O4+L4+I4+F4+C4)/8 -> 6.2136249999999995 | AB4: =MINA(X4,U4,R4,O4,L4,I4,F4,C4) -> 5.94
A5: EVANDRO | B5: 4 | C5: 6.27 | D5: 23 | E5: 2 | F5: 6.3760000000000003 | G5: 26 | H5: 1 | I5: 6.4909999999999997 | J5: 25 | K5: 3 | L5: 6.2149999999999999 | M5: 25 | N5: 5 | O5: 6.3810000000000002 | P5: 20 | Q5: 7 | R5: 6.6 | S5: 25 | T5: 8 | U5: 6.5990000000000002 | V5: 24 | W5: 6 | X5: 6.819 | Y5: 21 | Z5: 189.90740740740742 | AA5: =+(X5+U5+R5+O5+L5+I5+F5+C5)/8 -> 6.4688750000000006 | AB5: =MINA(X5,U5,R5,O5,L5,I5,F5,C5) -> 6.2149999999999999
A6: DANIEL | B6: 8 | C6: 5.94 | D6: 21 | E6: 6 | F6: 5.72 | G6: 24 | H6: 4 | I6: 5.7110000000000003 | J6: 24 | K6: 2 | L6: 5.94 | M6: 21 | N6: 1 | O6: 6.38 | P6: 16 | Q6: 3 | R6: 6.16 | S6: 24 | T6: 5 | U6: 5.95 | V6: 26 | W6: 7 | X6: 6.38 | Y6: 19 | Z6: 175.85185185185185 | AA6: =+(X6+U6+R6+O6+L6+I6+F6+C6)/8 -> 6.0226249999999997 | AB6: =MINA(X6,U6,R6,O6,L6,I6,F6,C6) -> 5.7110000000000003
A7: BETO | B7: 6 | C7: 6.2140000000000004 | D7: 20 | E7: 4 | F7: 6.16 | G7: 22 | H7: 2 | I7: 5.9409999999999998 | J7: 23 | K7: 1 | L7: 6.3650000000000002 | M7: 19 | N7: 3 | O7: 6.16 | P7: 23 | Q7: 5 | R7: 6.82 | S7: 19 | T7: 7 | U7: 7.0389999999999997 | V7: 18 | W7: 8 | X7: 6.8209999999999997 | Y7: 18 | Z7: 162.22222222222223 | AA7: =+(X7+U7+R7+O7+L7+I7+F7+C7)/8 -> 6.44 | AB7: =MINA(X7,U7,R7,O7,L7,I7,F7,C7) -> 5.9409999999999998
A8: RICARDO | B8: 3 | C8: 6.05 | D8: 15 | H8: 7 | I8: 6.16 | J8: 25 | K8: 8 | L8: 6.1589999999999998 | M8: 26 | N8: 6 | O8: 6.38 | P8: 25 | Q8: 4 | R8: 7.0389999999999997 | S8: 22 | T8: 2 | U8: 6.1589999999999998 | V8: 7 | W8: 1 | X8: 6.16 | Y8: 22 | Z8: 142.66666666666666 | AA8: =+(X8+U8+R8+O8+L8+I8+F8+C8)/8 -> 5.513374999999999 | AB8: =MINA(X8,U8,R8,O8,L8,I8,F8,C8) -> 6.05

A1: Pilotos | B1: Pis | C1: Tempo | D1: Vol | E1: Pis | F1: Tempo | G1: Vol | H1: Pis | I1: Tempo | J1: Vol | K1: Pis | L1: Tempo | M1: Vol | N1: Pis | O1: Tempo | P1: Vol | Q1: Pis | R1: Tempo | S1: Vol | T1: Pis | U1: Tempo | V1: Vol | W1: Pis | X1: Tempo | Y1: Vol | Z1: Total | AA1: Media
A2: RUDSON | B2: 3 | C2: 6.16 | D2: 25 | E2: 5 | F2: 5.9950000000000001 | G2: 27 | H2: 7 | I2: 6.1609999999999996 | J2: 26 | K2: 8 | L2: 6.1580000000000004 | M2: 26 | N2: 6 | O2: 6.1589999999999998 | P2: 26 | Q2: 4 | R2: 5.94 | S2: 24 | T2: 2 | U2: 5.9359999999999999 | V2: 25 | W2: 1 | X2: 6.2149999999999999 | Y2: 25 | Z2: 204.7962962962963 | AA2: =+(X2+U2+R2+O2+L2+I2+F2+C2)/8 -> 6.0905000000000005
A3: CONRADO | B3: 2 | C3: 6.16 | D3: 22 | E3: 1 | F3: 6.15 | G3: 27 | H3: 3 | I3: 6.16 | J3: 26 | K3: 5 | L3: 6.16 | M3: 26 | N3: 7 | O3: 6.16 | P3: 26 | Q3: 8 | R3: 6.16 | S3: 23 | T3: 6 | U3: 5.94 | V3: 25 | W3: 4 | X3: 5.9390000000000001 | Y3: 26 | Z3: 201.46296296296296 | AA3: =+(X3+U3+R3+O3+L3+I3+F3+C3)/8 -> 6.103625000000001
A4: RACHID | B4: 6 | C4: 5.9390000000000001 | D4: 27 | E4: 4 | F4: 5.9950000000000001 | G4: 27 | H4: 2 | I4: 5.9349999999999996 | J4: 23 | K4: 1 | L4: 5.9349999999999996 | M4: 27 | N4: 3 | O4: 5.72 | P4: 24 | Q4: 5 | R4: 5.7190000000000003 | S4: 24 | T4: 7 | U4: 6.1580000000000004 | V4: 25 | W4: 8 | X4: 6.38 | Y4: 24 | Z4: 201.44444444444446 | AA4: =+(X4+U4+R4+O4+L4+I4+F4+C4)/8 -> 5.9726249999999999
A5: GABRIEL | B5: 7 | C5: 6.1520000000000001 | D5: 26 | E5: 8 | F5: 6.16 | G5: 24 | H5: 6 | I5: 6.16 | J5: 25 | K5: 4 | L5: 5.83 | M5: 25 | N5: 2 | O5: 6.16 | P5: 19 | Q5: 1 | R5: 6.16 | S5: 24 | T5: 3 | U5: 5.94 | V5: 28 | W5: 5 | X5: 5.94 | Y5: 22 | Z5: 193.24074074074073 | AA5: =+(X5+U5+R5+O5+L5+I5+F5+C5)/8 -> 6.0627499999999994
A6: MANE | B6: 8 | C6: 6.16 | D6: 24 | E6: 6 | F6: 6.16 | G6: 22 | H6: 4 | I6: 5.94 | J6: 25 | K6: 2 | L6: 5.94 | M6: 24 | N6: 1 | O6: 4.62 | P6: 24 | Q6: 3 | R6: 5.94 | S6: 25 | T6: 5 | U6: 6.1589999999999998 | V6: 24 | W6: 7 | X6: 6.1589999999999998 | Y6: 22 | Z6: 190.81481481481481 | AA6: =+(X6+U6+R6+O6+L6+I6+F6+C6)/8 -> 5.8847500000000004
A7: MARCOS J | B7: 4 | C7: 6.16 | D7: 22 | E7: 2 | F7: 5.94 | G7: 26 | H7: 1 | I7: 6.16 | J7: 25 | K7: 3 | L7: 6.0389999999999997 | M7: 25 | N7: 5 | O7: 6.27 | P7: 21 | Q7: 7 | R7: 6.157 | S7: 25 | T7: 8 | U7: 6.3760000000000003 | V7: 18 | W7: 6 | X7: 6.601 | Y7: 19 | Z7: 181.85185185185185 | AA7: =+(X7+U7+R7+O7+L7+I7+F7+C7)/8 -> 6.2128749999999986
A8: CHANEL | B8: 5 | C8: 5.72 | D8: 26 | E8: 7 | F8: 6.1589999999999998 | G8: 17 | H8: 8 | I8: 6.1589999999999998 | J8: 26 | K8: 6 | L8: 5.94 | M8: 23 | N8: 4 | O8: 6.16 | P8: 22 | Q8: 2 | R8: 6.1580000000000004 | S8: 23 | T8: 1 | U8: 6.3789999999999996 | V8: 16 | W8: 3 | X8: 6.16 | Y8: 25 | Z8: 178.75925925925927 | AA8: =+(X8+U8+R8+O8+L8+I8+F8+C8)/8 -> 6.1043750000000001

A1: Pilotos | B1: Pis | C1: Tempo | D1: Vol | E1: Pis | F1: Tempo | G1: Vol | H1: Pis | I1: Tempo | J1: Vol | K1: Pis | L1: Tempo | M1: Vol | N1: Pis | O1: Tempo | P1: Vol | Q1: Pis | R1: Tempo | S1: Vol | T1: Pis | U1: Tempo | V1: Vol | W1: Pis | X1: Tempo | Y1: Vol | Z1: Total | AA1: Media
A2: KLEBER | B2: 4 | C2: 5.5 | D2: 27 | E2: 2 | F2: 5.7190000000000003 | G2: 27 | H2: 1 | I2: 5.94 | J2: 28 | K2: 3 | L2: 5.7169999999999996 | M2: 30 | N2: 5 | O2: 5.72 | P2: 28 | Q2: 7 | R2: 5.5 | S2: 26 | T2: 8 | U2: 4.62 | V2: 28 | W2: 6 | X2: 5.5 | Y2: 30 | Z2: 224.62962962962962 | AA2: =+(X2+U2+R2+O2+L2+I2+F2+C2)/8 -> 5.5270000000000001
A3: ERIC | B3: 5 | C3: 5.72 | D3: 25 | E3: 7 | F3: 5.72 | G3: 26 | H3: 8 | I3: 5.72 | J3: 28 | K3: 6 | L3: 5.7190000000000003 | M3: 29 | N3: 4 | O3: 5.4989999999999997 | P3: 27 | Q3: 2 | R3: 5.665 | S3: 29 | T3: 1 | U3: 5.7190000000000003 | V3: 28 | W3: 3 | X3: 5.5 | Y3: 29 | Z3: 221.33333333333334 | AA3: =+(X3+U3+R3+O3+L3+I3+F3+C3)/8 -> 5.6577500000000001
A4: JOAO KIBON | B4: 8 | C4: 6.1559999999999997 | D4: 22 | E4: 6 | F4: 5.7750000000000004 | G4: 28 | H4: 4 | I4: 5.7190000000000003 | J4: 25 | K4: 2 | L4: 5.72 | M4: 26 | N4: 1 | O4: 5.9950000000000001 | P4: 27 | Q4: 3 | R4: 5.7190000000000003 | S4: 27 | T4: 5 | U4: 5.9390000000000001 | V4: 26 | W4: 7 | X4: 5.71 | Y4: 28 | Z4: 209.7037037037037 | AA4: =+(X4+U4+R4+O4+L4+I4+F4+C4)/8 -> 5.8416249999999996
A5: ERUNDA | B5: 6 | C5: 6.3710000000000004 | D5: 22 | E5: 4 | F5: 5.6639999999999997 | G5: 25 | H5: 2 | I5: 5.7210000000000001 | J5: 28 | K5: 1 | L5: 5.7729999999999997 | M5: 28 | N5: 3 | O5: 5.72 | P5: 28 | Q5: 5 | R5: 6.05 | S5: 24 | T5: 7 | U5: 5.9379999999999997 | V5: 26 | W5: 8 | X5: 5.9950000000000001 | Y5: 26 | Z5: 207.77777777777777 | AA5: =+(X5+U5+R5+O5+L5+I5+F5+C5)/8 -> 5.9040000000000008
A6: RUBAO | B6: 2 | C6: 5.7220000000000004 | D6: 28 | E6: 1 | F6: 6.1589999999999998 | G6: 21 | H6: 3 | I6: 5.9390000000000001 | J6: 27 | K6: 5 | L6: 5.9390000000000001 | M6: 24 | N6: 7 | O6: 5.7190000000000003 | P6: 26 | Q6: 8 | R6: 6.1589999999999998 | S6: 26 | T6: 6 | U6: 4.51 | V6: 26 | W6: 4 | X6: 5.72 | Y6: 28 | Z6: 206.12962962962962 | AA6: =+(X6+U6+R6+O6+L6+I6+F6+C6)/8 -> 5.7333750000000006
A7: BONGA | B7: 3 | C7: 5.72 | D7: 27 | E7: 5 | F7: 4.62 | G7: 27 | H7: 7 | I7: 5.72 | J7: 27 | K7: 8 | L7: 5.7210000000000001 | M7: 27 | N7: 6 | O7: 5.72 | P7: 26 | Q7: 4 | R7: 5.72 | S7: 29 | T7: 2 | U7: 5.7210000000000001 | V7: 14 | W7: 1 | X7: 6.2149999999999999 | Y7: 24 | Z7: 201.66666666666666 | AA7: =+(X7+U7+R7+O7+L7+I7+F7+C7)/8 -> 5.6446249999999996
A8: JERA | B8: 1 | C8: 5.9379999999999997 | D8: 26 | E8: 3 | F8: 5.7190000000000003 | G8: 23 | H8: 5 | I8: 5.7190000000000003 | J8: 28 | K8: 7 | L8: 5.7190000000000003 | M8: 26 | N8: 8 | O8: 5.94 | P8: 23 | Q8: 6 | R8: 5.8849999999999998 | S8: 21 | T8: 4 | U8: 5.94 | V8: 22 | W8: 2 | X8: 5.94 | Y8: 25 | Z8: 194.05555555555554 | AA8: =+(X8+U8+R8+O8+L8+I8+F8+C8)/8 -> 5.85

A1: Pilotos | B1: Pis | C1: Tempo | D1: Vol | E1: Pis | F1: Tempo | G1: Vol | H1: Pis | I1: Tempo | J1: Vol | K1: Pis | L1: Tempo | M1: Vol | N1: Pis | O1: Tempo | P1: Vol | Q1: Pis | R1: Tempo | S1: Vol | T1: Pis | U1: Tempo | V1: Vol | W1: Pis | X1: Tempo | Y1: Vol | Z1: Total | AA1: Media
A2: MICHEL | B2: 1 | C2: 5.7210000000000001 | D2: 26 | E2: 3 | F2: 5.4969999999999999 | G2: 30 | H2: 5 | I2: 5.4989999999999997 | J2: 30 | K2: 7 | L2: 5.4989999999999997 | M2: 30 | N2: 8 | O2: 5.72 | P2: 28 | Q2: 6 | R2: 5.2809999999999997 | S2: 27 | T2: 4 | U2: 5.4930000000000003 | V2: 30 | W2: 2 | X2: 5.4450000000000003 | Y2: 30 | Z2: 231.22222222222223 | AA2: =+(X2+U2+R2+O2+L2+I2+F2+C2)/8 -> 5.5193750000000001
A3: ANDERSON | B3: 6 | C3: 5.5 | D3: 28 | E3: 4 | F3: 5.5 | G3: 29 | H3: 2 | I3: 5.5 | J3: 30 | K3: 1 | L3: 5.7190000000000003 | M3: 28 | N3: 3 | O3: 5.3890000000000002 | P3: 27 | Q3: 5 | R3: 5.39 | S3: 29 | T3: 7 | U3: 5.4960000000000004 | V3: 31 | W3: 8 | X3: 5.7149999999999999 | Y3: 28 | Z3: 230.72222222222223 | AA3: =+(X3+U3+R3+O3+L3+I3+F3+C3)/8 -> 5.5261250000000004
A4: DINHO | B4: 8 | C4: 5.7190000000000003 | D4: 28 | E4: 6 | F4: 5.7169999999999996 | G4: 27 | H4: 4 | I4: 5.5 | J4: 30 | K4: 2 | L4: 5.5 | M4: 29 | N4: 1 | O4: 5.7089999999999996 | P4: 28 | Q4: 3 | R4: 5.5 | S4: 26 | T4: 5 | U4: 5.7190000000000003 | V4: 30 | W4: 7 | X4: 5.72 | Y4: 28 | Z4: 226.07407407407408 | AA4: =+(X4+U4+R4+O4+L4+I4+F4+C4)/8 -> 5.6354999999999995
A5: ANGELAO | B5: 5 | C5: 5.5060000000000002 | D5: 28 | E5: 7 | F5: 5.5 | G5: 25 | H5: 8 | I5: 5.7110000000000003 | J5: 26 | K5: 6 | L5: 5.5 | M5: 28 | N5: 4 | O5: 5.3890000000000002 | P5: 27 | Q5: 2 | R5: 5.5010000000000003 | S5: 28 | T5: 1 | U5: 5.72 | V5: 28 | W5: 3 | X5: 5.4960000000000004 | Y5: 28 | Z5: 218.75925925925927 | AA5: =+(X5+U5+R5+O5+L5+I5+F5+C5)/8 -> 5.540375
A6: GOROI | B6: 4 | C6: 5.9379999999999997 | D6: 22 | E6: 2 | F6: 6.1580000000000004 | G6: 25 | H6: 1 | I6: 6.1580000000000004 | J6: 25 | K6: 3 | L6: 5.9379999999999997 | M6: 25 | N6: 5 | O6: 5.718 | P6: 24 | Q6: 7 | R6: 5.83 | S6: 25 | T6: 8 | U6: 5.9390000000000001 | V6: 25 | W6: 6 | X6: 5.9349999999999996 | Y6: 19 | Z6: 190.24074074074073 | AA6: =+(X6+U6+R6+O6+L6+I6+F6+C6)/8 -> 5.9517500000000005
A7: JULIO | B7: 3 | C7: 6.0519999999999996 | D7: 5 | E7: 5 | F7: 5.718 | G7: 22 | H7: 7 | I7: 5.7190000000000003 | J7: 28 | K7: 8 | L7: 5.7149999999999999 | M7: 28 | N7: 6 | O7: 5.5 | P7: 29 | Q7: 4 | R7: 5.665 | S7: 21 | T7: 2 | U7: 5.7190000000000003 | V7: 27 | W7: 1 | X7: 5.774 | Y7: 26 | Z7: 186.33333333333334 | AA7: =+(X7+U7+R7+O7+L7+I7+F7+C7)/8 -> 5.7327500000000002
A8: NETO | B8: 7 | C8: 6.1589999999999998 | D8: 24 | E8: 8 | F8: 6.1589999999999998 | G8: 21 | H8: 6 | I8: 5.94 | J8: 24 | K8: 4 | L8: 5.94 | M8: 22 | N8: 2 | O8: 5.72 | P8: 19 | Q8: 1 | R8: 6.1559999999999997 | S8: 21 | T8: 3 | U8: 5.7729999999999997 | V8: 25 | W8: 5 | X8: 5.9390000000000001 | Y8: 25 | Z8: 181.88888888888889 | AA8: =+(X8+U8+R8+O8+L8+I8+F8+C8)/8 -> 5.9732499999999993