A1: Patrocinadores

B1: Motos e Acessórios Honda - Rua Sete de Setembro, 387 - Fone: (15) 3331-6700. | C1: Rua Olavo Bilac, 254 - Vila Santana

A1: Pos | B1: Pilotos | C1: Total
A2: 1 | B2: MICHEL | C2: 231.22222222222223
A3: =+A2+1 -> 2 | B3: ANDERSON | C3: 230.72222222222223
A4: =+A3+1 -> 3 | B4: DINHO | C4: 226.07407407407408
A5: =+A4+1 -> 4 | B5: KLEBER | C5: 224.62962962962962
A6: =+A5+1 -> 5 | B6: ERIC | C6: 221.33333333333334
A7: =+A6+1 -> 6 | B7: ANGELAO | C7: 218.75925925925927
A8: =+A7+1 -> 7 | B8: GIOVANNI | C8: 211.88888888888889
A9: =+A8+1 -> 8 | B9: JOAO KIBON | C9: 209.7037037037037
A10: =+A9+1 -> 9 | B10: JUNINHO | C10: 208.77777777777777
A11: =+A10+1 -> 10 | B11: ERUNDA | C11: 207.77777777777777
A12: =+A11+1 -> 11 | B12: RUBAO | C12: 206.12962962962962
A13: =+A12+1 -> 12 | B13: RUDSON | C13: 204.7962962962963
A14: =+A13+1 -> 13 | B14: BONGA | C14: 201.66666666666666
A15: =+A14+1 -> 14 | B15: CONRADO | C15: 201.46296296296296
A16: =+A15+1 -> 15 | B16: RACHID | C16: 201.44444444444446
A17: =+A16+1 -> 16 | B17: JAPAO | C17: 199.61111111111111
A18: =+A17+1 -> 17 | B18: PACHECO | C18: 198.85185185185185
A19: =+A18+1 -> 18 | B19: JERA | C19: 194.05555555555554
A20: =+A19+1 -> 19 | B20: GABRIEL | C20: 193.24074074074073
A21: =+A20+1 -> 20 | B21: GERONIMO | C21: 192.27777777777777
A22: =+A21+1 -> 21 | B22: FERNANDO | C22: 192.05555555555554
A23: =+A22+1 -> 22 | B23: MANE | C23: 190.81481481481481
A24: =+A23+1 -> 23 | B24: GOROI | C24: 190.24074074074073
A25: =+A24+1 -> 24 | B25: EVANDRO | C25: 189.90740740740742
A26: =+A25+1 -> 25 | B26: SANDRO ITU | C26: 188.09259259259258
A27: =+A26+1 -> 26 | B27: RODRIGO | C27: 187.83333333333334
A28: =+A27+1 -> 27 | B28: JULIO | C28: 186.33333333333334
A29: =+A28+1 -> 28 | B29: NETO | C29: 181.88888888888889
A30: =+A29+1 -> 29 | B30: MARCOS J | C30: 181.85185185185185
A31: =+A30+1 -> 30 | B31: CHANEL | C31: 178.75925925925927
A32: =+A31+1 -> 31 | B32: DANIEL | C32: 175.85185185185185
A33: =+A32+1 -> 32 | B33: CASSIO | C33: 172.38888888888889
A34: =+A33+1 -> 33 | B34: FLAVIO | C34: 170.85185185185185
A35: =+A34+1 -> 34 | B35: BOLA | C35: 169.35185185185185
A36: =+A35+1 -> 35 | B36: TOMAZ | C36: 168.33333333333334
A37: =+A36+1 -> 36 | B37: LUIZ FELIPE | C37: 164.35185185185185
A38: =+A37+1 -> 37 | B38: M VINICIUS | C38: 163.03703703703704
A39: =+A38+1 -> 38 | B39: BETO | C39: 162.22222222222223
A40: =+A39+1 -> 39 | B40: GUSTAVO | C40: 158.66666666666666
A41: =+A40+1 -> 40 | B41: RICARDO | C41: 142.66666666666666
A42: =+A41+1 -> 41 | B42: XUBAKA | C42: 132.87037037037038
A43: =+A42+1 -> 42 | B43: MATHEUS | C43: 112.81481481481481