A1: R$14,99 mussarela, catupiry, buon gustaio, toscanela, calabresa (preço para retirar no balcão) | C1: R$14,99 mussarela, catupiry, buon gustaio, toscanela, calabresa (preço para retirar no balcão)

A1: Pilotos | B1: Pis | C1: Tempo | D1: Vol | E1: Pis | F1: Tempo | G1: Vol | H1: Pis | I1: Tempo | J1: Vol | K1: Pis | L1: Tempo | M1: Vol | N1: Pis | O1: Tempo | P1: Vol | Q1: Pis | R1: Tempo | S1: Vol | T1: Pis | U1: Tempo | V1: Vol | W1: Pis | X1: Tempo | Y1: Vol | Z1: Total | AA1: Media
A2: BONGA | B2: 7 | C2: 4.8390000000000004 | D2: 41 | E2: 8 | F2: 4.8390000000000004 | G2: 44 | H2: 6 | I2: 4.7850000000000001 | J2: 40 | K2: 4 | L2: 4.6749999999999998 | M2: 42 | N2: 2 | O2: 4.5650000000000004 | P2: 44 | Q2: 1 | R2: 4.8360000000000003 | S2: 41 | T2: 3 | U2: 4.62 | V2: 44 | W2: 5 | X2: 4.7839999999999998 | Y2: 42 | Z2: 338.13499999999999 | AA2: =+(X2+U2+R2+O2+L2+I2+F2+C2)/8 -> 4.7428749999999997
A3: JERONIMO | B3: 6 | C3: 4.62 | D3: 43 | E3: 4 | F3: 4.5659999999999998 | G3: 46 | H3: 2 | I3: 4.5650000000000004 | J3: 42 | K3: 1 | L3: 4.62 | M3: 40 | N3: 3 | O3: 4.62 | P3: 37 | Q3: 5 | R3: 4.62 | S3: 42 | T3: 7 | U3: 4.5140000000000002 | V3: 42 | W3: 8 | X3: 4.84 | Y3: 39 | Z3: 331.01080000000002 | AA3: =+(X3+U3+R3+O3+L3+I3+F3+C3)/8 -> 4.6206250000000004
A4: MARQUINHO | B4: 1 | C4: 5.06 | D4: 39 | E4: 3 | F4: 5.06 | G4: 40 | H4: 5 | I4: 5.17 | J4: 42 | K4: 7 | L4: 5.2779999999999996 | M4: 43 | N4: 8 | O4: 5.2789999999999999 | P4: 42 | Q4: 6 | R4: 5.2789999999999999 | S4: 42 | T4: 4 | U4: 5.0590000000000002 | V4: 41 | W4: 2 | X4: 5.2249999999999996 | Y4: 38 | Z4: 327.22140000000002 | AA4: =+(X4+U4+R4+O4+L4+I4+F4+C4)/8 -> 5.1762499999999996
A5: EVANDRO | B5: 5 | C5: 5.2779999999999996 | D5: 38 | E5: 7 | F5: 5.2270000000000003 | G5: 40 | H5: 8 | I5: 5.5 | J5: 40 | K5: 6 | L5: 5.06 | M5: 41 | N5: 4 | O5: 5.2789999999999999 | P5: 40 | Q5: 2 | R5: 5.1139999999999999 | S5: 41 | T5: 1 | U5: 5.7009999999999996 | V5: 32 | W5: 3 | X5: 5.72 | Y5: 34 | Z5: 306.28620000000001 | AA5: =+(X5+U5+R5+O5+L5+I5+F5+C5)/8 -> 5.3598749999999997
A6: MORTADELA | B6: 8 | C6: 5.2789999999999999 | D6: 39 | E6: 6 | F6: 5.06 | G6: 41 | H6: 4 | I6: 5.0490000000000004 | J6: 42 | K6: 2 | L6: 5.06 | M6: 36 | N6: 1 | O6: 5.335 | P6: 34 | Q6: 3 | R6: 5.1719999999999997 | S6: 41 | T6: 5 | U6: 5.1710000000000003 | V6: 30 | W6: 7 | X6: 4.8949999999999996 | Y6: 40 | Z6: 303.28620000000001 | AA6: =+(X6+U6+R6+O6+L6+I6+F6+C6)/8 -> 5.1276250000000001
A7: ERIC | B7: 3 | C7: 5.2249999999999996 | D7: 41 | E7: 5 | F7: 5.1150000000000002 | G7: 42 | H7: 7 | I7: 5.17 | J7: 37 | K7: 8 | L7: 5.2249999999999996 | M7: 20 | N7: 6 | O7: 5.0579999999999998 | P7: 33 | Q7: 4 | R7: 5.0590000000000002 | S7: 41 | T7: 2 | U7: 5.06 | V7: 41 | W7: 1 | X7: 5.28 | Y7: 28 | Z7: 283.0702 | AA7: =+(X7+U7+R7+O7+L7+I7+F7+C7)/8 -> 5.1490000000000009
A8: NETO | B8: 2 | C8: 5.06 | D8: 37 | E8: 1 | F8: 5.2770000000000001 | G8: 36 | H8: 3 | I8: 5.39 | J8: 30 | K8: 5 | L8: 6.27 | M8: 8 | N8: 7 | O8: 5.2240000000000002 | P8: 41 | Q8: 8 | R8: 5.1150000000000002 | S8: 36 | T8: 6 | U8: 5.1139999999999999 | V8: 34 | W8: 4 | X8: 5.0549999999999997 | Y8: 34 | Z8: 256.05939999999998 | AA8: =+(X8+U8+R8+O8+L8+I8+F8+C8)/8 -> 5.3131250000000003