A1: R$14,99 mussarela, catupiry, buon gustaio, toscanela, calabresa (preço para retirar no balcão) | C1: R$14,99 mussarela, catupiry, buon gustaio, toscanela, calabresa (preço para retirar no balcão)

A1: POS | B1: PILOTOS | C1: 1 ETAPA | D1: 2 ETAPA | E1: 3 ETAPA | F1: 4 ETAPA | G1: TOTAL
A2: 1 | B2: DINHO | C2: 290.38 | D2: 295.8 | E2: 299.8 | F2: 302.41 | G2: =SUM(C2:F2) -> 1188.39
A3: 2 | B3: KLEBER | C3: 296.3 | D3: 302.13 | E3: 281.26 | F3: 293.41 | G3: =SUM(C3:F3) -> 1173.1
A4: 3 | B4: BONGA | C4: 275.3 | D4: 295.24 | E4: 297.15 | F4: 303.83 | G4: =SUM(C4:F4) -> 1171.52
A5: 4 | B5: TETA | C5: 281.93 | D5: 295.54 | E5: 291.22 | F5: 298.07 | G5: =SUM(C5:F5) -> 1166.76
A6: 5 | B6: MORTA | C6: 276.48 | D6: 288.46 | E6: 265.24 | F6: 277.31 | G6: =SUM(C6:F6) -> 1107.49
A7: 6 | B7: LISTER | C7: 277.33 | D7: 287.17 | E7: 274.46 | F7: 268.44 | G7: =SUM(C7:F7) -> 1107.4
A8: 7 | B8: MANE | C8: 260.28 | D8: 207.63 | E8: 262.63 | F8: 267.78 | G8: =SUM(C8:F8) -> 998.32
A9: 8 | B9: RUDSON | C9: 261.28 | D9: 247.22 | E9: 230.09 | F9: 237.26 | G9: =SUM(C9:F9) -> 975.85
A10: 9 | B10: FLAVIO | C10: 214.96 | D10: 256.93 | E10: 236.06 | F10: 230.72 | G10: =SUM(C10:F10) -> 938.67
A11: 10 | B11: FELIPE | C11: 256.93 | D11: 194.56 | E11: 181 | F11: 215.15 | G11: =SUM(C11:F11) -> 847.64
A12: 11 | B12: FRED | C12: 228 | D12: 264.65 | E12: 101 | F12: 239.26 | G12: =SUM(C12:F12) -> 832.91
A13: 12 | B13: EVANDRO | C13: 0 | D13: 274.96 | E13: 260.44 | F13: 270.31 | G13: =SUM(C13:F13) -> 805.71
A14: 13 | B14: ROBERTO | C14: 0 | D14: 176.24 | E14: 214.28 | F14: 227.03 | G14: =SUM(C14:F14) -> 617.55
A15: 14 | B15: JERA | C15: 242.85 | D15: 92 | E15: 0 | F15: 250.31 | G15: =SUM(C15:F15) -> 585.16
A16: 15 | B16: MICHEL | C16: 0 | D16: 291.48 | E16: 0 | F16: 0 | G16: =SUM(C16:F16) -> 291.48
A17: 16 | B17: ANDE | C17: 270.28 | D17: 0 | E17: 0 | F17: 0 | G17: =SUM(C17:F17) -> 270.28
A18: 17 | B18: GIOVANNI | C18: 262.17 | D18: 0 | E18: 0 | F18: 0 | G18: =SUM(C18:F18) -> 262.17
A19: 18 | B19: CHANEL | C19: 0 | D19: 0 | E19: 0 | F19: 191.72 | G19: =SUM(C19:F19) -> 191.72