A1: Patrocinadores

B1: Motos e Acessórios Honda - Rua Sete de Setembro, 387 - Fone: (15) 3331-6700.

A1: 1 Bateria
A2: Piloto | B2: Pi | C2: Tempo | D2: Vol | E2: Pi | F2: Tempo | G2: Vol | H2: Pi | I2: Tempo | J2: Vol | K2: Pi | L2: Tempo | M2: Vol | N2: Pi | O2: Tempo | P2: Vol | Q2: Pi | R2: Tempo | S2: Vol | T2: Pi | U2: Tempo | V2: Vol | W2: Pi | X2: Tempo | Y2: Vol | Z2: Total | AA2: Media | AB2: Record
A3: RICARDAO | B3: 6 | C3: 4.6207000000000003 | D3: 36.3 | E3: 4 | F3: 4.6191000000000004 | G3: 36.44 | H3: 2 | I3: 4.6201999999999996 | J3: 36.21 | K3: 1 | L3: 4.8253000000000004 | M3: 30.75 | N3: 3 | O3: 4.6197999999999997 | P3: 36.74 | Q3: 5 | R3: 4.6181000000000001 | S3: 37.63 | T3: 7 | U3: 4.8395000000000001 | V3: 32.67 | W3: 8 | X3: 4.7308000000000003 | Y3: 33.36 | Z3: =+Y3+V3+S3+P3+M3+J3+G3+D3 -> 280.1 | AA3: =+(X3+U3+R3+O3+L3+I3+F3+C3)/8 -> 4.6866874999999997 | AB3: =MINA(X3,U3,R3,O3,L3,I3,F3,C3) -> 4.6181000000000001
A4: RODRIGO | B4: 3 | C4: 5.04 | D4: 34.02 | E4: 5 | F4: 4.8396999999999997 | G4: 33.23 | H4: 7 | I4: 4.8307000000000002 | J4: 33.74 | K4: 8 | L4: 4.8407999999999998 | M4: 32.61 | N4: 6 | O4: 4.7854999999999999 | P4: 33.57 | Q4: 4 | R4: 4.8406000000000002 | S4: 31.46 | T4: 2 | U4: 3.9729999999999999 | V4: 32.44 | W4: 1 | X4: 4.8404999999999996 | Y4: 33.06 | Z4: =+Y4+V4+S4+P4+M4+J4+G4+D4 -> 264.13 | AA4: =+(X4+U4+R4+O4+L4+I4+F4+C4)/8 -> 4.74885 | AB4: =MINA(X4,U4,R4,O4,L4,I4,F4,C4) -> 3.9729999999999999
A5: LISTER | B5: 5 | C5: 4.8395999999999999 | D5: 30.44 | E5: 7 | F5: 4.8400999999999996 | G5: 29.36 | H5: 8 | I5: 4.84 | J5: 32.57 | K5: 6 | L5: 4.8356000000000003 | M5: 33.44 | N5: 4 | O5: 4.8395999999999999 | P5: 32.32 | Q5: 2 | R5: 5.0603999999999996 | S5: 28.76 | T5: 1 | U5: 4.8932000000000002 | V5: 30.76 | W5: 3 | X5: 4.8391000000000002 | Y5: 34.15 | Z5: =+Y5+V5+S5+P5+M5+J5+G5+D5 -> 251.8 | AA5: =+(X5+U5+R5+O5+L5+I5+F5+C5)/8 -> 4.8734499999999992 | AB5: =MINA(X5,U5,R5,O5,L5,I5,F5,C5) -> 4.8356000000000003
A6: LUIZ FELIPE | B6: 2 | C6: 4.6207000000000003 | D6: 33.81 | E6: 1 | F6: 4.6205999999999996 | G6: 32.32 | H6: 3 | I6: 4.8529999999999998 | J6: 9.29 | K6: 5 | L6: 4.8390000000000004 | M6: 27.63 | N6: 7 | O6: 5.0427 | P6: 31.56 | Q6: 8 | R6: 4.8307000000000002 | S6: 35.33 | T6: 6 | U6: 4.8392999999999997 | V6: 35.04 | W6: 4 | X6: 4.8403999999999998 | Y6: 30.47 | Z6: =+Y6+V6+S6+P6+M6+J6+G6+D6 -> 235.45 | AA6: =+(X6+U6+R6+O6+L6+I6+F6+C6)/8 -> 4.8108000000000004 | AB6: =MINA(X6,U6,R6,O6,L6,I6,F6,C6) -> 4.6205999999999996
A7: RUDSON | B7: 4 | C7: 4.8394000000000004 | D7: 28.75 | E7: 2 | F7: 4.8406000000000002 | G7: 34.22 | H7: 1 | I7: 5.0479000000000003 | J7: 12.64 | K7: 3 | L7: 4.8402000000000003 | M7: 32.23 | N7: 5 | O7: 5.0598000000000001 | P7: 29.58 | Q7: 7 | R7: 5.0590999999999999 | S7: 31.7 | T7: 8 | U7: 4.8391999999999999 | V7: 31.74 | W7: 6 | X7: 4.8392999999999997 | Y7: 32.8 | Z7: =+Y7+V7+S7+P7+M7+J7+G7+D7 -> 233.66 | AA7: =+(X7+U7+R7+O7+L7+I7+F7+C7)/8 -> 4.9206874999999997 | AB7: =MINA(X7,U7,R7,O7,L7,I7,F7,C7) -> 4.8391999999999999
A8: 2 Bateria
A9: Piloto | B9: Pi | C9: Tempo | D9: Vol | E9: Pi | F9: Tempo | G9: Vol | H9: Pi | I9: Tempo | J9: Vol | K9: Pi | L9: Tempo | M9: Vol | N9: Pi | O9: Tempo | P9: Vol | Q9: Pi | R9: Tempo | S9: Vol | T9: Pi | U9: Tempo | V9: Vol | W9: Pi | X9: Tempo | Y9: Vol | Z9: Total | AA9: Media | AB9: Record
A10: BONGA | B10: 7 | C10: 4.6178999999999997 | D10: 36.48 | E10: 8 | F10: 4.6163999999999996 | G10: 37.01 | H10: 6 | I10: 4.6032999999999999 | J10: 36.23 | K10: 4 | L10: 4.4001000000000001 | M10: 39.2 | N10: 2 | O10: 4.4504000000000001 | P10: 38.25 | Q10: 1 | R10: 4.5772000000000004 | S10: 37.82 | T10: 3 | U10: 4.3977000000000004 | V10: 38.76 | W10: 5 | X10: 4.6189999999999998 | Y10: 35.18 | Z10: =+Y10+V10+S10+P10+M10+J10+G10+D10 -> 298.93 | AA10: =+(X10+U10+R10+O10+L10+I10+F10+C10)/8 -> 4.5352500000000004 | AB10: =MINA(X10,U10,R10,O10,L10,I10,F10,C10) -> 4.3977000000000004
A11: MICHEL | B11: 4 | C11: 4.3977000000000004 | D11: 37.22 | E11: 2 | F11: 4.4127999999999998 | G11: 32.5 | H11: 1 | I11: 4.6071 | J11: 36.27 | K11: 3 | L11: 4.3970000000000002 | M11: 39.54 | N11: 5 | O11: 4.6200999999999999 | P11: 36.45 | Q11: 7 | R11: 4.3997999999999999 | S11: 37.91 | T11: 8 | U11: 4.4413 | V11: 38.73 | W11: 6 | X11: 4.5656999999999996 | Y11: 36.02 | Z11: =+Y11+V11+S11+P11+M11+J11+G11+D11 -> 294.64 | AA11: =+(X11+U11+R11+O11+L11+I11+F11+C11)/8 -> 4.4801875000000004 | AB11: =MINA(X11,U11,R11,O11,L11,I11,F11,C11) -> 4.3970000000000002
A12: ERIC | B12: 6 | C12: 4.6752000000000002 | D12: 34.33 | E12: 4 | F12: 4.6185 | G12: 37.2 | H12: 2 | I12: 4.6204999999999998 | J12: 35.33 | K12: 1 | L12: 4.6185999999999998 | M12: 33.69 | N12: 3 | O12: 4.5106000000000002 | P12: 37.82 | Q12: 5 | R12: 4.6161000000000003 | S12: 36.3 | T12: 7 | U12: 4.6197999999999997 | V12: 36.23 | W12: 8 | X12: 4.6707999999999998 | Y12: 34.91 | Z12: =+Y12+V12+S12+P12+M12+J12+G12+D12 -> 285.81 | AA12: =+(X12+U12+R12+O12+L12+I12+F12+C12)/8 -> 4.6187625000000008 | AB12: =MINA(X12,U12,R12,O12,L12,I12,F12,C12) -> 4.5106000000000002
A13: DINHO | B13: 2 | C13: 4.5110999999999999 | D13: 35.49 | E13: 1 | F13: 4.6204000000000001 | G13: 31.18 | H13: 3 | I13: 4.3992000000000004 | J13: 36.85 | K13: 5 | L13: 4.6208 | M13: 31.67 | N13: 7 | O13: 4.7252000000000001 | P13: 35.95 | Q13: 8 | R13: 4.6195000000000004 | S13: 36.63 | T13: 6 | U13: 4.4539999999999997 | V13: 32.46 | W13: 4 | X13: 4.4002999999999997 | Y13: 34.24 | Z13: =+Y13+V13+S13+P13+M13+J13+G13+D13 -> 274.47 | AA13: =+(X13+U13+R13+O13+L13+I13+F13+C13)/8 -> 4.5438124999999996 | AB13: =MINA(X13,U13,R13,O13,L13,I13,F13,C13) -> 4.3992000000000004
A14: MANE | B14: 1 | C14: 4.5662000000000003 | D14: 35.73 | E14: 3 | F14: 4.6169000000000002 | G14: 31.62 | H14: 5 | I14: 4.7853000000000003 | J14: 32.76 | K14: 7 | L14: 4.7251000000000003 | M14: 34.76 | N14: 8 | O14: 4.6077000000000004 | P14: 33.28 | Q14: 6 | R14: 4.6205999999999996 | S14: 32.46 | T14: 4 | U14: 4.6189999999999998 | V14: 34.85 | W14: 2 | X14: 4.6208 | Y14: 37.71 | Z14: =+Y14+V14+S14+P14+M14+J14+G14+D14 -> 273.17 | AA14: =+(X14+U14+R14+O14+L14+I14+F14+C14)/8 -> 4.6452 | AB14: =MINA(X14,U14,R14,O14,L14,I14,F14,C14) -> 4.5662000000000003