A1: Patrocinadores

B1: Motos e Acessórios Honda - Rua Sete de Setembro, 387 - Fone: (15) 3331-6700.

A1: Pos | B1: Piloto | C1: Total
A2: 1 | B2: MICHEL | C2: 290.08
A3: =+A2+1 -> 2 | B3: BONGA | C3: 289.8
A4: =+A3+1 -> 3 | B4: ANDERSON | C4: 288.96
A5: =+A4+1 -> 4 | B5: DINHO | C5: 286.65
A6: =+A5+1 -> 5 | B6: MARCEL | C6: 281.58
A7: =+A6+1 -> 6 | B7: EVANDRO | C7: 280.82
A8: =+A7+1 -> 7 | B8: JOAO LIBON | C8: 278.55
A9: =+A8+1 -> 8 | B9: RICARDAO | C9: 274.93
A10: =+A9+1 -> 9 | B10: LISTER | C10: 273.66
A11: =+A10+1 -> 10 | B11: JERA | C11: 271.49
A12: =+A11+1 -> 11 | B12: RUDSON | C12: 261.81
A13: =+A12+1 -> 12 | B13: LUIZ FELIPE | C13: 256.59
A14: =+A13+1 -> 13 | B14: MANE | C14: 254.79
A15: =+A14+1 -> 14 | B15: NETO | C15: 235.44
A16: =+A15+1 -> 15 | B16: GIOVANNI | C16: 59.35
A17: =+A16+1 -> 16 | B17: ERIC | C17: 36