A1: Patrocinadores

B1: Motos e Acessórios Honda - Rua Sete de Setembro, 387 - Fone: (15) 3331-6700.

A1: 1 Bateria
A2: Piloto | B2: Pi | C2: Tempo | D2: Voltas | E2: Pi | F2: Tempo | G2: Voltas | H2: Pi | I2: Tempo | J2: Voltas | K2: Pi | L2: Tempo | M2: Voltas | N2: Pi | O2: Tempo | P2: Voltas | Q2: Pi | R2: Tempo | S2: Voltas | T2: Pi | U2: Tempo | V2: Voltas | W2: Pi | X2: Tempo | Y2: Voltas | Z2: Total | AA2: Media | AB2: Record
A3: JOAO LIBON | B3: 4 | C3: 4.8228 | D3: 35.02 | E3: 2 | F3: 4.8249000000000004 | G3: 35.26 | H3: 1 | I3: 4.84 | J3: 34.67 | K3: 3 | L3: 4.6177999999999999 | M3: 37.26 | N3: 5 | O3: 4.8398000000000003 | P3: 34.66 | Q3: 7 | R3: 4.6578999999999997 | S3: 35.68 | T3: 8 | U3: 4.8391000000000002 | V3: 34.69 | W3: 6 | X3: 4.8395000000000001 | Y3: 31.31 | Z3: =+Y3+V3+S3+P3+M3+J3+G3+D3 -> 278.55 | AA3: =+(X3+U3+R3+O3+L3+I3+F3+C3)/8 -> 4.7852249999999996 | AB3: =MINA(X3,U3,R3,O3,L3,I3,F3,C3) -> 4.6177999999999999
A4: JERA | B4: 7 | C4: 4.5651000000000002 | D4: 26.22 | E4: 8 | F4: 4.7297000000000002 | G4: 33.5 | H4: 6 | I4: 4.6010999999999997 | J4: 29.44 | K4: 4 | L4: 4.4711999999999996 | M4: 37.4 | N4: 2 | O4: 4.6192000000000002 | P4: 35.54 | Q4: 1 | R4: 4.6765999999999996 | S4: 34.64 | T4: 3 | U4: 4.5094000000000003 | V4: 38.38 | W4: 5 | X4: 4.8244999999999996 | Y4: 36.37 | Z4: =+Y4+V4+S4+P4+M4+J4+G4+D4 -> 271.49 | AA4: =+(X4+U4+R4+O4+L4+I4+F4+C4)/8 -> 4.6246 | AB4: =MINA(X4,U4,R4,O4,L4,I4,F4,C4) -> 4.4711999999999996
A5: RUDSON | B5: 2 | C5: 4.8494000000000002 | D5: 33.24 | E5: 1 | F5: 5.1711 | G5: 28.64 | H5: 3 | I5: 5.0575999999999999 | J5: 32.84 | K5: 5 | L5: 5.0601000000000003 | M5: 32.32 | N5: 7 | O5: 4.9257999999999997 | P5: 34.36 | Q5: 8 | R5: 5.0057 | S5: 34.53 | T5: 6 | U5: 4.8392999999999997 | V5: 31.57 | W5: 4 | X5: 5.0502000000000002 | Y5: 34.31 | Z5: =+Y5+V5+S5+P5+M5+J5+G5+D5 -> 261.81 | AA5: =+(X5+U5+R5+O5+L5+I5+F5+C5)/8 -> 4.9949000000000003 | AB5: =MINA(X5,U5,R5,O5,L5,I5,F5,C5) -> 4.8392999999999997
A6: LUIZ FELIPE | B6: 5 | C6: 4.8240999999999996 | D6: 23.21 | E6: 7 | F6: 4.6193 | G6: 31.52 | H6: 8 | I6: 4.8402000000000003 | J6: 31.9 | K6: 6 | L6: 4.8362999999999996 | M6: 33.75 | N6: 4 | O6: 4.6184000000000003 | P6: 34.01 | Q6: 2 | R6: 4.6162000000000001 | S6: 37.09 | T6: 1 | U6: 4.8250000000000002 | V6: 33.42 | W6: 3 | X6: 4.6203000000000003 | Y6: 31.69 | Z6: =+Y6+V6+S6+P6+M6+J6+G6+D6 -> 256.59 | AA6: =+(X6+U6+R6+O6+L6+I6+F6+C6)/8 -> 4.7249749999999997 | AB6: =MINA(X6,U6,R6,O6,L6,I6,F6,C6) -> 4.6162000000000001
A7: MANE | B7: 8 | C7: 4.8391999999999999 | D7: 29.7 | E7: 6 | F7: 4.8240999999999996 | G7: 31.46 | H7: 4 | I7: 4.6212 | J7: 32.55 | K7: 2 | L7: 4.6022999999999996 | M7: 34.06 | N7: 1 | O7: 4.8400999999999996 | P7: 31.26 | Q7: 3 | R7: 4.8400999999999996 | S7: 31.74 | T7: 5 | U7: 4.8392999999999997 | V7: 31.57 | W7: 7 | X7: 4.8513000000000002 | Y7: 32.45 | Z7: =+Y7+V7+S7+P7+M7+J7+G7+D7 -> 254.79 | AA7: =+(X7+U7+R7+O7+L7+I7+F7+C7)/8 -> 4.7821999999999996 | AB7: =MINA(X7,U7,R7,O7,L7,I7,F7,C7) -> 4.6022999999999996
A8: NETO | B8: 1 | C8: 5.0143000000000004 | D8: 33.25 | E8: 3 | F8: 4.8402000000000003 | G8: 35.01 | H8: 5 | I8: 5.0594999999999999 | J8: 31.3 | K8: 7 | L8: 4.8236999999999997 | M8: 33.27 | N8: 8 | O8: 5.0564 | P8: 30.78 | Q8: 6 | R8: 4.8399000000000001 | S8: 33.56 | T8: 4 | U8: 5.1150000000000002 | V8: 5 | W8: 2 | X8: 4.8400999999999996 | Y8: 33.27 | Z8: =+Y8+V8+S8+P8+M8+J8+G8+D8 -> 235.44 | AA8: =+(X8+U8+R8+O8+L8+I8+F8+C8)/8 -> 4.9486374999999994 | AB8: =MINA(X8,U8,R8,O8,L8,I8,F8,C8) -> 4.8236999999999997
A9: GIOVANNI | B9: 3 | C9: 4.6159999999999997 | D9: 32.89 | E9: 5 | F9: 4.8376999999999999 | G9: 19.46 | H9: 7 | I9: 4.7302 | J9: 7 | Z9: =+Y9+V9+S9+P9+M9+J9+G9+D9 -> 59.35 | AA9: =+(X9+U9+R9+O9+L9+I9+F9+C9)/8 -> 1.7729874999999999 | AB9: =MINA(X9,U9,R9,O9,L9,I9,F9,C9) -> 4.6159999999999997
A10: ERIC | B10: 6 | C10: 4.9507000000000003 | D10: 20 | E10: 4 | F10: 5.0579999999999998 | G10: 13 | H10: 2 | I10: 5.3803999999999998 | J10: 3 | Z10: =+Y10+V10+S10+P10+M10+J10+G10+D10 -> 36 | AA10: =+(X10+U10+R10+O10+L10+I10+F10+C10)/8 -> 1.9236374999999999 | AB10: =MINA(X10,U10,R10,O10,L10,I10,F10,C10) -> 4.9507000000000003
A11: 2 Bateria
A12: Piloto | B12: Pi | C12: Tempo | D12: Voltas | E12: Pi | F12: Tempo | G12: Voltas | H12: Pi | I12: Tempo | J12: Voltas | K12: Pi | L12: Tempo | M12: Voltas | N12: Pi | O12: Tempo | P12: Voltas | Q12: Pi | R12: Tempo | S12: Voltas | T12: Pi | U12: Tempo | V12: Voltas | W12: Pi | X12: Tempo | Y12: Voltas | Z12: Total | AA12: Media | AB12: Record
A13: MICHEL | B13: 5 | C13: 4.6193999999999997 | D13: 34.33 | E13: 7 | F13: 4.4 | G13: 38.63 | H13: 8 | I13: 4.6191000000000004 | J13: 35.62 | K13: 6 | L13: 4.4561000000000002 | M13: 35.89 | N13: 4 | O13: 4.6193999999999997 | P13: 37.23 | Q13: 2 | R13: 4.4762000000000004 | S13: 37.21 | T13: 1 | U13: 4.6022999999999996 | V13: 36.05 | W13: 3 | X13: 4.6010999999999997 | Y13: 35.12 | Z13: =+Y13+V13+S13+P13+M13+J13+G13+D13 -> 290.08 | AA13: =+(X13+U13+R13+O13+L13+I13+F13+C13)/8 -> 4.5491999999999999 | AB13: =MINA(X13,U13,R13,O13,L13,I13,F13,C13) -> 4.4
A14: BONGA | B14: 7 | C14: 4.6193 | D14: 37.54 | E14: 8 | F14: 4.6216999999999997 | G14: 36.32 | H14: 6 | I14: 4.61 | J14: 34.44 | K14: 4 | L14: 4.4002999999999997 | M14: 37.52 | N14: 2 | O14: 4.4009999999999998 | P14: 34.94 | Q14: 1 | R14: 4.6204999999999998 | S14: 35.54 | T14: 3 | U14: 4.4009 | V14: 37.71 | W14: 5 | X14: 4.6760000000000002 | Y14: 35.79 | Z14: =+Y14+V14+S14+P14+M14+J14+G14+D14 -> 289.8 | AA14: =+(X14+U14+R14+O14+L14+I14+F14+C14)/8 -> 4.5437124999999998 | AB14: =MINA(X14,U14,R14,O14,L14,I14,F14,C14) -> 4.4002999999999997
A15: ANDERSON | B15: 6 | C15: 4.6184000000000003 | D15: 35.76 | E15: 4 | F15: 4.6193999999999997 | G15: 35.47 | H15: 2 | I15: 4.5103 | J15: 34.13 | K15: 1 | L15: 4.6059000000000001 | M15: 36.83 | N15: 3 | O15: 4.6191000000000004 | P15: 37.86 | Q15: 5 | R15: 4.6208 | S15: 34.59 | T15: 7 | U15: 4.6009000000000002 | V15: 37.18 | W15: 8 | X15: 4.6191000000000004 | Y15: 37.14 | Z15: =+Y15+V15+S15+P15+M15+J15+G15+D15 -> 288.96 | AA15: =+(X15+U15+R15+O15+L15+I15+F15+C15)/8 -> 4.6017375000000005 | AB15: =MINA(X15,U15,R15,O15,L15,I15,F15,C15) -> 4.5103
A16: DINHO | B16: 1 | C16: 4.62 | D16: 36.05 | E16: 3 | F16: 4.3994999999999997 | G16: 38.63 | H16: 5 | I16: 4.6181999999999999 | J16: 37.13 | K16: 7 | L16: 4.5655999999999999 | M16: 38.77 | N16: 8 | O16: 4.5105000000000004 | P16: 29.46 | Q16: 6 | R16: 4.6193 | S16: 35.69 | T16: 4 | U16: 4.3811999999999998 | V16: 37.15 | W16: 2 | X16: 4.4558 | Y16: 33.77 | Z16: =+Y16+V16+S16+P16+M16+J16+G16+D16 -> 286.65 | AA16: =+(X16+U16+R16+O16+L16+I16+F16+C16)/8 -> 4.5212624999999997 | AB16: =MINA(X16,U16,R16,O16,L16,I16,F16,C16) -> 4.3811999999999998
A17: MARCEL | B17: 3 | C17: 4.1809000000000003 | D17: 36.17 | E17: 5 | F17: 4.8380999999999998 | G17: 35.46 | H17: 7 | I17: 4.6195000000000004 | J17: 35.28 | K17: 8 | L17: 4.8402000000000003 | M17: 33.51 | N17: 6 | O17: 4.8392999999999997 | P17: 35.55 | Q17: 4 | R17: 4.8238000000000003 | S17: 34.22 | T17: 2 | U17: 4.8208000000000002 | V17: 36.13 | W17: 1 | X17: 4.7308000000000003 | Y17: 35.26 | Z17: =+Y17+V17+S17+P17+M17+J17+G17+D17 -> 281.58 | AA17: =+(X17+U17+R17+O17+L17+I17+F17+C17)/8 -> 4.7116749999999996 | AB17: =MINA(X17,U17,R17,O17,L17,I17,F17,C17) -> 4.1809000000000003
A18: EVANDRO | B18: 4 | C18: 4.6021999999999998 | D18: 38.09 | E18: 2 | F18: 4.6078999999999999 | G18: 36.44 | H18: 1 | I18: 4.6200999999999999 | J18: 35.42 | K18: 3 | L18: 4.5647000000000002 | M18: 37.84 | N18: 5 | O18: 4.6204000000000001 | P18: 25.52 | Q18: 7 | R18: 4.6188000000000002 | S18: 38.28 | T18: 8 | U18: 4.6208 | V18: 37.12 | W18: 6 | X18: 4.6178999999999997 | Y18: 32.11 | Z18: =+Y18+V18+S18+P18+M18+J18+G18+D18 -> 280.82 | AA18: =+(X18+U18+R18+O18+L18+I18+F18+C18)/8 -> 4.6090999999999998 | AB18: =MINA(X18,U18,R18,O18,L18,I18,F18,C18) -> 4.5647000000000002
A19: RICARDAO | B19: 8 | C19: 4.6755000000000004 | D19: 34.23 | E19: 6 | F19: 4.6208 | G19: 35.81 | H19: 4 | I19: 4.1795 | J19: 36.65 | K19: 2 | L19: 4.6203000000000003 | M19: 36.04 | N19: 1 | O19: 4.8394000000000004 | P19: 33.69 | Q19: 3 | R19: 4.8391999999999999 | S19: 33.23 | T19: 5 | U19: 4.8212000000000002 | V19: 30.4 | W19: 7 | X19: 4.84 | Y19: 34.88 | Z19: =+Y19+V19+S19+P19+M19+J19+G19+D19 -> 274.93 | AA19: =+(X19+U19+R19+O19+L19+I19+F19+C19)/8 -> 4.6794875000000005 | AB19: =MINA(X19,U19,R19,O19,L19,I19,F19,C19) -> 4.1795
A20: LISTER | B20: 2 | C20: 4.6196000000000002 | D20: 37.22 | E20: 1 | F20: 4.8395999999999999 | G20: 35.62 | H20: 3 | I20: 4.6189 | J20: 34.55 | K20: 5 | L20: 4.8395000000000001 | M20: 32.92 | N20: 7 | O20: 4.8391000000000002 | P20: 33.17 | Q20: 8 | R20: 4.8391999999999999 | S20: 33.74 | T20: 6 | U20: 4.6207000000000003 | V20: 33.17 | W20: 4 | X20: 4.6216999999999997 | Y20: 33.27 | Z20: =+Y20+V20+S20+P20+M20+J20+G20+D20 -> 273.66 | AA20: =+(X20+U20+R20+O20+L20+I20+F20+C20)/8 -> 4.7297874999999996 | AB20: =MINA(X20,U20,R20,O20,L20,I20,F20,C20) -> 4.6189