A1: Patrocinadores

B1: Motos e Acessórios Honda - Rua Sete de Setembro, 387 - Fone: (15) 3331-6700.

A1: 1 Bateria
A2: Piloto | B2: Pi | C2: Tempo | D2: Vol | E2: Pi | F2: Tempo | G2: Vol | H2: Pi | I2: Tempo | J2: Vol | K2: Pi | L2: Tempo | M2: Vol | N2: Pi | O2: Tempo | P2: Vol | Q2: Pi | R2: Tempo | S2: Vol | T2: Pi | U2: Tempo | V2: Vol | W2: Pi | X2: Tempo | Y2: Vol | Z2: Total | AA2: Media | AB2: Record
A3: MANE | B3: 6 | C3: 4.6174999999999997 | D3: 35.83 | E3: 4 | F3: 4.6208 | G3: 34.61 | H3: 2 | I3: 4.6195000000000004 | J3: 36.74 | K3: 1 | L3: 4.6097999999999999 | M3: 35.07 | N3: 3 | O3: 4.6083999999999996 | P3: 37.26 | Q3: 5 | R3: 4.6742999999999997 | S3: 32.21 | T3: 7 | U3: 4.62 | V3: 35.11 | W3: 8 | X3: 4.6234999999999999 | Y3: 32.04 | Z3: =+Y3+V3+S3+P3+M3+J3+G3+D3 -> 278.87 | AA3: =+(X3+U3+R3+O3+L3+I3+F3+C3)/8 -> 4.624225 | AB3: =MINA(X3,U3,R3,O3,L3,I3,F3,C3) -> 4.6083999999999996
A4: RUDSON | B4: 2 | C4: 4.8391999999999999 | D4: 33.64 | E4: 1 | F4: 5.06 | G4: 30.62 | H4: 3 | I4: 4.7849000000000004 | J4: 35.86 | K4: 5 | L4: 4.8390000000000004 | M4: 33.97 | N4: 7 | O4: 4.8383000000000003 | P4: 35.86 | Q4: 8 | R4: 4.8384 | S4: 35.12 | T4: 6 | U4: 4.6204999999999998 | V4: 36.46 | W4: 4 | X4: 4.8403 | Y4: 32.44 | Z4: =+Y4+V4+S4+P4+M4+J4+G4+D4 -> 273.97 | AA4: =+(X4+U4+R4+O4+L4+I4+F4+C4)/8 -> 4.8325750000000003 | AB4: =MINA(X4,U4,R4,O4,L4,I4,F4,C4) -> 4.6204999999999998
A5: MORTA | B5: 1 | C5: 4.84 | D5: 33.75 | E5: 3 | F5: 4.62 | G5: 32.61 | H5: 5 | I5: 4.8391000000000002 | J5: 35.63 | K5: 7 | L5: 4.7702999999999998 | M5: 27.03 | N5: 8 | O5: 4.8448000000000002 | P5: 35.27 | Q5: 6 | R5: 4.8394000000000004 | S5: 35.21 | T5: 4 | U5: 4.8280000000000003 | V5: 34.22 | W5: 2 | X5: 4.8296999999999999 | Y5: 36.8 | Z5: =+Y5+V5+S5+P5+M5+J5+G5+D5 -> 270.52 | AA5: =+(X5+U5+R5+O5+L5+I5+F5+C5)/8 -> 4.8014124999999996 | AB5: =MINA(X5,U5,R5,O5,L5,I5,F5,C5) -> 4.62
A6: RICARDAO | B6: 7 | C6: 4.6734 | D6: 33.27 | E6: 8 | F6: 4.8403 | G6: 31.87 | H6: 6 | I6: 4.6745000000000001 | J6: 34.26 | K6: 4 | L6: 4.6216999999999997 | M6: 35.35 | N6: 2 | O6: 4.6744000000000003 | P6: 34.26 | Q6: 1 | R6: 4.8391000000000002 | S6: 31.03 | T6: 3 | U6: 4.6193 | V6: 36.25 | W6: 5 | X6: 4.7305999999999999 | Y6: 32.21 | Z6: =+Y6+V6+S6+P6+M6+J6+G6+D6 -> 268.5 | AA6: =+(X6+U6+R6+O6+L6+I6+F6+C6)/8 -> 4.7091624999999997 | AB6: =MINA(X6,U6,R6,O6,L6,I6,F6,C6) -> 4.6193
A7: GIOVANI | B7: 3 | C7: 4.84 | D7: 35.29 | E7: 5 | F7: 5.0594000000000001 | G7: 33.69 | H7: 7 | I7: 4.8268000000000004 | J7: 33.75 | K7: 8 | L7: 4.8400999999999996 | M7: 33.22 | N7: 6 | O7: 4.8399000000000001 | P7: 34.07 | Q7: 4 | R7: 4.7304000000000004 | S7: 35.27 | T7: 2 | U7: 4.6749000000000001 | V7: 35.74 | W7: 1 | X7: 5.1177000000000001 | Y7: 6 | Z7: =+Y7+V7+S7+P7+M7+J7+G7+D7 -> 247.03 | AA7: =+(X7+U7+R7+O7+L7+I7+F7+C7)/8 -> 4.8661500000000011 | AB7: =MINA(X7,U7,R7,O7,L7,I7,F7,C7) -> 4.6749000000000001
A8: LUIZ FELIPE | B8: 5 | C8: 4.6201999999999996 | D8: 35.07 | E8: 7 | F8: 4.6203000000000003 | G8: 26.38 | H8: 8 | I8: 4.617 | J8: 33.29 | K8: 6 | L8: 4.8292999999999999 | M8: 23.03 | N8: 4 | O8: 4.8377999999999997 | P8: 29.41 | Q8: 2 | R8: 4.6203000000000003 | S8: 35.76 | T8: 1 | U8: 4.8806000000000003 | V8: 27.59 | W8: 3 | X8: 4.6295999999999999 | Y8: 30.77 | Z8: =+Y8+V8+S8+P8+M8+J8+G8+D8 -> 241.3 | AA8: =+(X8+U8+R8+O8+L8+I8+F8+C8)/8 -> 4.7068874999999997 | AB8: =MINA(X8,U8,R8,O8,L8,I8,F8,C8) -> 4.617
A9: 2 Bateria
A10: Piloto | B10: Pi | C10: Tempo | D10: Vol | E10: Pi | F10: Tempo | G10: Vol | H10: Pi | I10: Tempo | J10: Vol | K10: Pi | L10: Tempo | M10: Vol | N10: Pi | O10: Tempo | P10: Vol | Q10: Pi | R10: Tempo | S10: Vol | T10: Pi | U10: Tempo | V10: Vol | W10: Pi | X10: Tempo | Y10: Vol | Z10: Total | AA10: Media | AB10: Record
A11: DINHO | B11: 4 | C11: 4.5106999999999999 | D11: 38.46 | E11: 2 | F11: 4.3841000000000001 | G11: 39.05 | H11: 1 | I11: 4.3992000000000004 | J11: 38.22 | K11: 3 | L11: 4.3996000000000004 | M11: 39.46 | N11: 5 | O11: 4.3994 | P11: 39.01 | Q11: 7 | R11: 4.4002999999999997 | S11: 38.27 | T11: 8 | U11: 4.4550999999999998 | V11: 38.65 | W11: 6 | X11: 4.3996000000000004 | Y11: 37.6 | Z11: =+Y11+V11+S11+P11+M11+J11+G11+D11 -> 308.72 | AA11: =+(X11+U11+R11+O11+L11+I11+F11+C11)/8 -> 4.4184999999999999 | AB11: =MINA(X11,U11,R11,O11,L11,I11,F11,C11) -> 4.3841000000000001
A12: BONGA | B12: 7 | C12: 4.4001999999999999 | D12: 37.52 | E12: 8 | F12: 4.6197999999999997 | G12: 37.05 | H12: 6 | I12: 4.5144000000000002 | J12: 37.55 | K12: 4 | L12: 4.5102000000000002 | M12: 38.19 | N12: 2 | O12: 4.4008000000000003 | P12: 39.04 | Q12: 1 | R12: 4.5627000000000004 | S12: 38.33 | T12: 3 | U12: 4.4553000000000003 | V12: 39.09 | W12: 5 | X12: 4.6200999999999999 | Y12: 36.45 | Z12: =+Y12+V12+S12+P12+M12+J12+G12+D12 -> 303.22 | AA12: =+(X12+U12+R12+O12+L12+I12+F12+C12)/8 -> 4.5104375000000001 | AB12: =MINA(X12,U12,R12,O12,L12,I12,F12,C12) -> 4.4001999999999999
A13: SAPAO | B13: 6 | C13: 4.5118999999999998 | D13: 38.04 | E13: 4 | F13: 4.4546999999999999 | G13: 38.27 | H13: 2 | I13: 4.4558 | J13: 37.6 | K13: 1 | L13: 4.6176000000000004 | M13: 37.27 | N13: 3 | O13: 4.601 | P13: 35.48 | Q13: 5 | R13: 4.4009 | S13: 38.55 | T13: 7 | U13: 4.51 | V13: 39.08 | W13: 8 | X13: 4.6039000000000003 | Y13: 37.27 | Z13: =+Y13+V13+S13+P13+M13+J13+G13+D13 -> 301.56 | AA13: =+(X13+U13+R13+O13+L13+I13+F13+C13)/8 -> 4.5194749999999999 | AB13: =MINA(X13,U13,R13,O13,L13,I13,F13,C13) -> 4.4009
A14: MICHEL | B14: 5 | C14: 4.6193999999999997 | D14: 37.22 | E14: 7 | F14: 4.6132999999999997 | G14: 38.24 | H14: 8 | I14: 4.6188000000000002 | J14: 37.14 | K14: 6 | L14: 4.4821999999999997 | M14: 35.31 | N14: 4 | O14: 4.5667 | P14: 37.32 | Q14: 2 | R14: 4.4019000000000004 | S14: 39.22 | T14: 1 | U14: 4.5109000000000004 | V14: 38.05 | W14: 3 | X14: 4.5648 | Y14: 38.11 | Z14: =+Y14+V14+S14+P14+M14+J14+G14+D14 -> 300.61 | AA14: =+(X14+U14+R14+O14+L14+I14+F14+C14)/8 -> 4.54725 | AB14: =MINA(X14,U14,R14,O14,L14,I14,F14,C14) -> 4.4019000000000004
A15: EVANDRO | B15: 1 | C15: 4.6207000000000003 | D15: 36.71 | E15: 3 | F15: 4.6174999999999997 | G15: 38.14 | H15: 5 | I15: 4.6196999999999999 | J15: 36.6 | K15: 7 | L15: 4.6162000000000001 | M15: 36.01 | N15: 8 | O15: 4.6200999999999999 | P15: 37.3 | Q15: 6 | R15: 4.3996000000000004 | S15: 36.75 | T15: 4 | U15: 4.3905000000000003 | V15: 39.95 | W15: 2 | X15: 4.3997000000000002 | Y15: 37.6 | Z15: =+Y15+V15+S15+P15+M15+J15+G15+D15 -> 299.06 | AA15: =+(X15+U15+R15+O15+L15+I15+F15+C15)/8 -> 4.5354999999999999 | AB15: =MINA(X15,U15,R15,O15,L15,I15,F15,C15) -> 4.3905000000000003
A16: ERIC | B16: 3 | C16: 4.5113000000000003 | D16: 35.94 | E16: 5 | F16: 4.6204000000000001 | G16: 35.23 | H16: 7 | I16: 4.6205999999999996 | J16: 37.49 | K16: 8 | L16: 4.6205999999999996 | M16: 34.92 | N16: 6 | O16: 4.6033999999999997 | P16: 37.21 | Q16: 4 | R16: 4.4584999999999999 | S16: 36.47 | T16: 2 | U16: 4.6200999999999999 | V16: 35.46 | W16: 1 | X16: 4.6994999999999996 | Y16: 33.77 | Z16: =+Y16+V16+S16+P16+M16+J16+G16+D16 -> 286.49 | AA16: =+(X16+U16+R16+O16+L16+I16+F16+C16)/8 -> 4.5942999999999996 | AB16: =MINA(X16,U16,R16,O16,L16,I16,F16,C16) -> 4.4584999999999999