A1: R$14,99 mussarela, catupiry, buon gustaio, toscanela, calabresa (preço para retirar no balcão) | C1: R$14,99 mussarela, catupiry, buon gustaio, toscanela, calabresa (preço para retirar no balcão)

A1: PILOTOS | B1: P | C1: TEMPO | D1: V | E1: P | F1: TEMPO | G1: V | H1: P | I1: TEMPO | J1: V | K1: P | L1: TEMPO | M1: V | N1: P | O1: TEMPO | P1: V | Q1: P | R1: TEMPO | S1: V | T1: P | U1: TEMPO | V1: V | W1: P | X1: TEMPO | Y1: V | Z1: TOTAL | AA1: MEDIA
A2: BONGA | B2: 1 | C2: 5.0060000000000002 | D2: 27 | E2: 3 | F2: 5.57 | G2: 29 | H2: 5 | I2: 5.7229999999999999 | J2: 25 | K2: 7 | L2: 5.665 | M2: 29 | N2: 8 | O2: 5.827 | P2: 26 | Q2: 6 | R2: 5.7750000000000004 | S2: 29 | T2: 4 | U2: 5.6639999999999997 | V2: 28 | W2: 2 | X2: 5.7709999999999999 | Y2: 27 | Z2: =+Y2+V2+S2+P2+M2+J2+G2+D2 -> 220 | AA2: =+(X2+U2+R2+O2+L2+I2+F2+C2)/8 -> 5.6251249999999997
A3: RUBAO | B3: 4 | C3: 5.5960000000000001 | D3: 29 | E3: 2 | F3: 5.6109999999999998 | G3: 26 | H3: 1 | I3: 5.8259999999999996 | J3: 26 | K3: 3 | L3: 5.72 | M3: 28 | N3: 5 | O3: 5.774 | P3: 26 | Q3: 7 | R3: 5.774 | S3: 28 | T3: 8 | U3: 5.8849999999999998 | V3: 29 | W3: 6 | X3: 5.8310000000000004 | Y3: 25 | Z3: =+Y3+V3+S3+P3+M3+J3+G3+D3 -> 217 | AA3: =+(X3+U3+R3+O3+L3+I3+F3+C3)/8 -> 5.7521249999999995
A4: JERA | B4: 5 | C4: 5.3209999999999997 | D4: 26 | E4: 7 | F4: 5.61 | G4: 24 | H4: 8 | I4: 5.5549999999999997 | J4: 27 | K4: 6 | L4: 5.4560000000000004 | M4: 28 | N4: 4 | O4: 5.4489999999999998 | P4: 22 | Q4: 2 | R4: 5.1550000000000002 | S4: 30 | T4: 1 | U4: 5.3360000000000003 | V4: 29 | W4: 3 | X4: 5.4829999999999997 | Y4: 26 | Z4: =+Y4+V4+S4+P4+M4+J4+G4+D4 -> 212 | AA4: =+(X4+U4+R4+O4+L4+I4+F4+C4)/8 -> 5.4206250000000002
A5: DINHO | B5: 2 | C5: 5.6520000000000001 | D5: 28 | E5: 1 | F5: 5.8849999999999998 | G5: 25 | H5: 3 | I5: 5.609 | J5: 27 | K5: 5 | L5: 5.8150000000000004 | M5: 23 | N5: 7 | O5: 5.915 | P5: 26 | Q5: 8 | R5: 5.8810000000000002 | S5: 27 | T5: 6 | U5: 5.391 | V5: 27 | W5: 4 | X5: 5.649 | Y5: 27 | Z5: =+Y5+V5+S5+P5+M5+J5+G5+D5 -> 210 | AA5: =+(X5+U5+R5+O5+L5+I5+F5+C5)/8 -> 5.7246249999999996
A6: MARQUINHO | B6: 6 | C6: 5.9409999999999998 | D6: 27 | E6: 4 | F6: 5.9950000000000001 | G6: 12 | H6: 2 | I6: 5.665 | J6: 29 | K6: 1 | L6: 5.83 | M6: 26 | N6: 3 | O6: 5.6109999999999998 | P6: 25 | Q6: 5 | R6: 4.9489999999999998 | S6: 28 | T6: 7 | U6: 5.8289999999999997 | V6: 29 | W6: 8 | X6: 5.8150000000000004 | Y6: 27 | Z6: =+Y6+V6+S6+P6+M6+J6+G6+D6 -> 203 | AA6: =+(X6+U6+R6+O6+L6+I6+F6+C6)/8 -> 5.7043749999999998
A7: MORTADELA | B7: 7 | C7: 5.7210000000000001 | D7: 27 | E7: 8 | F7: 6.0880000000000001 | G7: 27 | H7: 6 | I7: 5.7779999999999996 | J7: 25 | K7: 4 | L7: 5.7089999999999996 | M7: 26 | N7: 2 | O7: 5.7190000000000003 | P7: 16 | Q7: 1 | R7: 5.6520000000000001 | S7: 27 | T7: 3 | U7: 5.7089999999999996 | V7: 25 | W7: 5 | X7: 5.8250000000000002 | Y7: 23 | Z7: =+Y7+V7+S7+P7+M7+J7+G7+D7 -> 196 | AA7: =+(X7+U7+R7+O7+L7+I7+F7+C7)/8 -> 5.775125000000001
A8: RICARDO | B8: 3 | C8: 5.665 | D8: 29 | E8: 5 | F8: 5.8860000000000001 | G8: 25 | H8: 7 | I8: 5.556 | J8: 26 | K8: 8 | L8: 5.93 | M8: 28 | N8: 6 | O8: 5.7489999999999997 | P8: 13 | Q8: 4 | R8: 5.94 | S8: 23 | T8: 2 | U8: 5.8710000000000004 | V8: 21 | W8: 1 | X8: 6.0430000000000001 | Y8: 20 | Z8: =+Y8+V8+S8+P8+M8+J8+G8+D8 -> 185 | AA8: =+(X8+U8+R8+O8+L8+I8+F8+C8)/8 -> 5.83
A9: BOTELHO | B9: 8 | C9: 6.0309999999999997 | D9: 21 | E9: 6 | F9: 6.3250000000000002 | G9: 17 | H9: 4 | I9: 6.2690000000000001 | J9: 21 | K9: 2 | L9: 6.6539999999999999 | M9: 17 | N9: 1 | O9: 6.9850000000000003 | P9: 7 | Z9: =+Y9+V9+S9+P9+M9+J9+G9+D9 -> 83 | AA9: =+(X9+U9+R9+O9+L9+I9+F9+C9)/8 -> 4.0330000000000004