A1: R$14,99 mussarela, catupiry, buon gustaio, toscanela, calabresa (preço para retirar no balcão) | C1: R$14,99 mussarela, catupiry, buon gustaio, toscanela, calabresa (preço para retirar no balcão)

A1: Piloto | B1: Pi | C1: Tempo | D1: Voltas | E1: Pi | F1: Tempo | G1: Voltas | H1: Pi | I1: Tempo | J1: Voltas | K1: Pi | L1: Tempo | M1: Voltas | N1: Pi | O1: Tempo | P1: Voltas | Q1: Pi | R1: Tempo | S1: Voltas | T1: Pi | U1: Tempo | V1: Voltas | W1: Pi | X1: Tempo | Y1: Voltas | Z1: Total | AA1: Media | AB1: Record
A2: BONGA | B2: 2 | C2: 4.18 | D2: 37 | E2: 1 | F2: 4.4539999999999997 | G2: 37 | H2: 3 | I2: 4.3419999999999996 | J2: 36 | K2: 5 | L2: 3.9590000000000001 | M2: 37 | N2: 7 | O2: 4.18 | P2: 39 | Q2: 8 | R2: 4.2350000000000003 | S2: 39 | T2: 6 | U2: 3.96 | V2: 40 | W2: 4 | X2: 4.1749999999999998 | Y2: 23 | Z2: =+Y2+V2+S2+P2+M2+J2+G2+D2 -> 288 | AA2: =+(X2+U2+R2+O2+L2+I2+F2+C2)/8 -> 4.1856249999999999 | AB2: =MINA(X2,U2,R2,O2,L2,I2,F2,C2) -> 3.9590000000000001
A3: DINHO | B3: 8 | C3: 4.2359999999999998 | D3: 35 | E3: 6 | F3: 4.2359999999999998 | G3: 34 | H3: 4 | I3: 4.1790000000000003 | J3: 28 | K3: 2 | L3: 4.1790000000000003 | M3: 38 | N3: 1 | O3: 4.1790000000000003 | P3: 35 | Q3: 3 | R3: 4.2949999999999999 | S3: 37 | T3: 5 | U3: 4.181 | V3: 39 | W3: 7 | X3: 4.18 | Y3: 32 | Z3: =+Y3+V3+S3+P3+M3+J3+G3+D3 -> 278 | AA3: =+(X3+U3+R3+O3+L3+I3+F3+C3)/8 -> 4.2081249999999999 | AB3: =MINA(X3,U3,R3,O3,L3,I3,F3,C3) -> 4.1790000000000003
A4: GABRIEL | B4: 4 | C4: 3.851 | D4: 40 | E4: 2 | F4: 4.399 | G4: 12 | H4: 1 | I4: 3.9140000000000001 | J4: 34 | K4: 3 | L4: 3.9590000000000001 | M4: 40 | N4: 5 | O4: 3.9590000000000001 | P4: 36 | Q4: 7 | R4: 3.9580000000000002 | S4: 39 | T4: 8 | U4: 3.9580000000000002 | V4: 34 | W4: 6 | X4: 3.08 | Y4: 32 | Z4: =+Y4+V4+S4+P4+M4+J4+G4+D4 -> 267 | AA4: =+(X4+U4+R4+O4+L4+I4+F4+C4)/8 -> 3.8847500000000004 | AB4: =MINA(X4,U4,R4,O4,L4,I4,F4,C4) -> 3.08
A5: SANDRO | B5: 1 | C5: 4.399 | D5: 37 | E5: 3 | F5: 4.399 | G5: 26 | H5: 5 | I5: 4.62 | J5: 35 | K5: 7 | L5: 4.6189999999999998 | M5: 33 | N5: 8 | O5: 4.6189999999999998 | P5: 36 | Q5: 6 | R5: 4.3970000000000002 | S5: 35 | T5: 4 | U5: 4.3979999999999997 | V5: 33 | W5: 2 | X5: 3.2090000000000001 | Y5: 28 | Z5: =+Y5+V5+S5+P5+M5+J5+G5+D5 -> 263 | AA5: =+(X5+U5+R5+O5+L5+I5+F5+C5)/8 -> 4.3324999999999996 | AB5: =MINA(X5,U5,R5,O5,L5,I5,F5,C5) -> 3.2090000000000001
A6: GIOVANNI | B6: 6 | C6: 4.617 | D6: 35 | E6: 4 | F6: 3.08 | G6: 29 | H6: 2 | I6: 4.6020000000000003 | J6: 30 | K6: 1 | L6: 4.1790000000000003 | M6: 29 | N6: 3 | O6: 4.84 | P6: 26 | Q6: 5 | R6: 4.62 | S6: 36 | T6: 7 | U6: 4.6189999999999998 | V6: 35 | W6: 8 | X6: 4.4539999999999997 | Y6: 34 | Z6: =+Y6+V6+S6+P6+M6+J6+G6+D6 -> 254 | AA6: =+(X6+U6+R6+O6+L6+I6+F6+C6)/8 -> 4.3763750000000003 | AB6: =MINA(X6,U6,R6,O6,L6,I6,F6,C6) -> 3.08
A7: RICARDO | B7: 5 | C7: 4.3959999999999999 | D7: 37 | E7: 7 | F7: 4.18 | G7: 30 | H7: 8 | I7: 4.399 | J7: 19 | K7: 6 | L7: 4.1769999999999996 | M7: 35 | N7: 4 | O7: 3.1890000000000001 | P7: 35 | Q7: 2 | R7: 4.1779999999999999 | S7: 38 | T7: 1 | U7: 4.18 | V7: 34 | W7: 3 | X7: 3.0910000000000002 | Y7: 23 | Z7: =+Y7+V7+S7+P7+M7+J7+G7+D7 -> 251 | AA7: =+(X7+U7+R7+O7+L7+I7+F7+C7)/8 -> 3.9737499999999999 | AB7: =MINA(X7,U7,R7,O7,L7,I7,F7,C7) -> 3.0910000000000002
A8: JERA | B8: 3 | C8: 4.1790000000000003 | D8: 35 | E8: 5 | F8: 4.1790000000000003 | G8: 28 | H8: 7 | I8: 4.18 | J8: 34 | K8: 8 | L8: 4.29 | M8: 32 | N8: 6 | O8: 4.31 | P8: 33 | Q8: 4 | R8: 4.18 | S8: 40 | T8: 2 | U8: 3.96 | V8: 25 | W8: 1 | X8: 3.96 | Y8: 14 | Z8: =+Y8+V8+S8+P8+M8+J8+G8+D8 -> 241 | AA8: =+(X8+U8+R8+O8+L8+I8+F8+C8)/8 -> 4.1547499999999999 | AB8: =MINA(X8,U8,R8,O8,L8,I8,F8,C8) -> 3.96
A9: WALDIR | B9: 7 | C9: 3.08 | D9: 24 | E9: 8 | F9: 4.6210000000000004 | G9: 30 | H9: 6 | I9: 4.84 | J9: 28 | K9: 4 | L9: 4.6760000000000002 | M9: 24 | Z9: =+Y9+V9+S9+P9+M9+J9+G9+D9 -> 106 | AA9: =+(X9+U9+R9+O9+L9+I9+F9+C9)/4 -> 4.3042499999999997 | AB9: =MINA(X9,U9,R9,O9,L9,I9,F9,C9) -> 3.08