A1: Patrocinadores

B1: Motos e Acessórios Honda - Rua Sete de Setembro, 387 - Fone: (15) 3331-6700.

A1: 1 Bateria
A2: Piloto | B2: Pi | C2: Tempo | D2: Voltas | E2: Pi | F2: Tempo | G2: Voltas | H2: Pi | I2: Tempo | J2: Voltas | K2: Pi | L2: Tempo | M2: Voltas | N2: Pi | O2: Tempo | P2: Voltas | Q2: Pi | R2: Tempo | S2: Voltas | T2: Pi | U2: Tempo | V2: Voltas | W2: Pi | X2: Tempo | Y2: Voltas | Z2: Total | AA2: Media | AB2: Record
A3: EVANDRO | B3: 6 | C3: 4.6075999999999997 | D3: 35.24 | E3: 4 | F3: 4.5994999999999999 | G3: 37.91 | H3: 2 | I3: 4.4551999999999996 | J3: 35.05 | K3: 1 | L3: 4.6191000000000004 | M3: 37.59 | N3: 3 | O3: 4.6083999999999996 | P3: 36.79 | Q3: 5 | R3: 4.6071999999999997 | S3: 36.64 | T3: 7 | U3: 4.6205999999999996 | V3: 36.66 | W3: 8 | X3: 4.8356000000000003 | Y3: 35.26 | Z3: =+Y3+V3+S3+P3+M3+J3+G3+D3 -> 291.14 | AA3: =+(X3+U3+R3+O3+L3+I3+F3+C3)/8 -> 4.6191499999999994 | AB3: =MINA(X3,U3,R3,O3,L3,I3,F3,C3) -> 4.4551999999999996
A4: GIOVANNI | B4: 3 | C4: 4.6075999999999997 | D4: 34.95 | E4: 5 | F4: 4.8392999999999997 | G4: 32.32 | H4: 7 | I4: 4.7298999999999998 | J4: 33.21 | K4: 8 | L4: 4.8391999999999999 | M4: 34.4 | N4: 6 | O4: 4.8296000000000001 | P4: 36.24 | Q4: 4 | R4: 4.6191000000000004 | S4: 34.74 | T4: 2 | U4: 4.6181000000000001 | V4: 35.08 | W4: 1 | X4: 4.6192000000000002 | Y4: 35.46 | Z4: =+Y4+V4+S4+P4+M4+J4+G4+D4 -> 276.4 | AA4: =+(X4+U4+R4+O4+L4+I4+F4+C4)/8 -> 4.7127499999999998 | AB4: =MINA(X4,U4,R4,O4,L4,I4,F4,C4) -> 4.6075999999999997
A5: JOAO KIBON | B5: 4 | C5: 4.62 | D5: 34.14 | E5: 2 | F5: 4.6192000000000002 | G5: 36.85 | H5: 1 | I5: 5.0579000000000001 | J5: 23.38 | K5: 3 | L5: 4.8288000000000002 | M5: 36.62 | N5: 5 | O5: 4.6212999999999997 | P5: 32.67 | Q5: 7 | R5: 4.6199000000000003 | S5: 34.24 | T5: 8 | U5: 4.6757 | V5: 35.76 | W5: 6 | X5: 4.6195000000000004 | Y5: 35.17 | Z5: =+Y5+V5+S5+P5+M5+J5+G5+D5 -> 268.83 | AA5: =+(X5+U5+R5+O5+L5+I5+F5+C5)/8 -> 4.7077875000000002 | AB5: =MINA(X5,U5,R5,O5,L5,I5,F5,C5) -> 4.6192000000000002
A6: LUIZ FELIPE | B6: 5 | C6: 4.8235000000000001 | D6: 30.65 | E6: 7 | F6: 4.6205999999999996 | G6: 32.51 | H6: 8 | I6: 4.8219000000000003 | J6: 28.75 | K6: 6 | L6: 4.6071999999999997 | M6: 31.3 | N6: 4 | O6: 4.8400999999999996 | P6: 32.31 | Q6: 2 | R6: 4.6201999999999996 | S6: 35.77 | T6: 1 | U6: 4.9471999999999996 | V6: 31.51 | W6: 3 | X6: 4.8372000000000002 | Y6: 31.27 | Z6: =+Y6+V6+S6+P6+M6+J6+G6+D6 -> 254.07 | AA6: =+(X6+U6+R6+O6+L6+I6+F6+C6)/8 -> 4.7647374999999998 | AB6: =MINA(X6,U6,R6,O6,L6,I6,F6,C6) -> 4.6071999999999997
A7: RUBAO | B7: 7 | C7: 4.8391000000000002 | D7: 30.77 | E7: 8 | F7: 5.1151 | G7: 33.2 | H7: 6 | I7: 4.8413000000000004 | J7: 32.26 | K7: 4 | L7: 5.0597000000000003 | M7: 24.87 | N7: 2 | O7: 5.06 | P7: 29.55 | Q7: 1 | R7: 5.1163999999999996 | S7: 33.51 | T7: 3 | U7: 4.8548999999999998 | V7: 34.26 | W7: 5 | X7: 5.0052000000000003 | Y7: 30.94 | Z7: =+Y7+V7+S7+P7+M7+J7+G7+D7 -> 249.36 | AA7: =+(X7+U7+R7+O7+L7+I7+F7+C7)/8 -> 4.9864625 | AB7: =MINA(X7,U7,R7,O7,L7,I7,F7,C7) -> 4.8391000000000002
A8: GUSTAVO | B8: 1 | C8: 5.2805999999999997 | D8: 29.16 | E8: 3 | F8: 5.2629000000000001 | G8: 30.87 | H8: 5 | I8: 5.2803000000000004 | J8: 30.56 | K8: 7 | L8: 5.3472 | M8: 29.57 | N8: 8 | O8: 5.2789999999999999 | P8: 31.62 | Q8: 6 | R8: 5.2807000000000004 | S8: 26.75 | T8: 4 | U8: 5.1703000000000001 | V8: 32.5 | W8: 2 | X8: 5.3493000000000004 | Y8: 29.8 | Z8: =+Y8+V8+S8+P8+M8+J8+G8+D8 -> 240.83 | AA8: =+(X8+U8+R8+O8+L8+I8+F8+C8)/8 -> 5.2812875000000004 | AB8: =MINA(X8,U8,R8,O8,L8,I8,F8,C8) -> 5.1703000000000001
A9: CONRADO | B9: 8 | C9: 4.8570000000000002 | D9: 15.24 | E9: 6 | F9: 5.0425000000000004 | G9: 28.75 | H9: 4 | I9: 4.6752000000000002 | J9: 30.1 | K9: 2 | L9: 4.6752000000000002 | M9: 33.93 | N9: 1 | O9: 5.0598000000000001 | P9: 27.66 | Q9: 3 | R9: 4.8943000000000003 | S9: 30.77 | T9: 5 | U9: 5.0469999999999997 | V9: 31.66 | W9: 7 | X9: 4.8413000000000004 | Y9: 33.45 | Z9: =+Y9+V9+S9+P9+M9+J9+G9+D9 -> 231.56 | AA9: =+(X9+U9+R9+O9+L9+I9+F9+C9)/8 -> 4.8865375000000002 | AB9: =MINA(X9,U9,R9,O9,L9,I9,F9,C9) -> 4.6752000000000002
A10: 2 Bateria
A11: Piloto | B11: Pi | C11: Tempo | D11: Voltas | E11: Pi | F11: Tempo | G11: Voltas | H11: Pi | I11: Tempo | J11: Voltas | K11: Pi | L11: Tempo | M11: Voltas | N11: Pi | O11: Tempo | P11: Voltas | Q11: Pi | R11: Tempo | S11: Voltas | T11: Pi | U11: Tempo | V11: Voltas | W11: Pi | X11: Tempo | Y11: Voltas | Z11: Total | AA11: Media | AB11: Record
A12: MARCEL | B12: 3 | C12: 4.6195000000000004 | D12: 34.26 | E12: 5 | F12: 4.8391000000000002 | G12: 34.53 | H12: 7 | I12: 4.6196000000000002 | J12: 35.57 | K12: 8 | L12: 4.6653000000000002 | M12: 35.17 | N12: 6 | O12: 4.6196999999999999 | P12: 35.7 | Q12: 4 | R12: 4.5202999999999998 | S12: 34.61 | T12: 2 | U12: 4.6205999999999996 | V12: 36.03 | W12: 1 | X12: 4.6192000000000002 | Y12: 36.28 | Z12: =+Y12+V12+S12+P12+M12+J12+G12+D12 -> 282.15 | AA12: =+(X12+U12+R12+O12+L12+I12+F12+C12)/8 -> 4.6404125000000001 | AB12: =MINA(X12,U12,R12,O12,L12,I12,F12,C12) -> 4.5202999999999998
A13: LISTER | B13: 5 | C13: 4.6185 | D13: 31.05 | E13: 7 | F13: 4.6185 | G13: 34.76 | H13: 8 | I13: 4.7305999999999999 | J13: 36.27 | K13: 6 | L13: 4.5658000000000003 | M13: 36.69 | N13: 4 | O13: 4.6189999999999998 | P13: 35.06 | Q13: 2 | R13: 4.4916999999999998 | S13: 37.29 | T13: 1 | U13: 4.8380999999999998 | V13: 34.54 | W13: 3 | X13: 4.6723999999999997 | Y13: 35.76 | Z13: =+Y13+V13+S13+P13+M13+J13+G13+D13 -> 281.42 | AA13: =+(X13+U13+R13+O13+L13+I13+F13+C13)/8 -> 4.6443249999999994 | AB13: =MINA(X13,U13,R13,O13,L13,I13,F13,C13) -> 4.4916999999999998
A14: RICARDAO | B14: 2 | C14: 4.6208 | D14: 36.45 | E14: 1 | F14: 4.8383000000000003 | G14: 35.27 | H14: 3 | I14: 4.6199000000000003 | J14: 35.75 | K14: 5 | L14: 4.6193999999999997 | M14: 36.52 | N14: 7 | O14: 4.6201999999999996 | P14: 36.94 | Q14: 8 | R14: 4.6196999999999999 | S14: 36.45 | T14: 6 | U14: 4.6203000000000003 | V14: 29.44 | W14: 4 | X14: 4.6188000000000002 | Y14: 34.47 | Z14: =+Y14+V14+S14+P14+M14+J14+G14+D14 -> 281.29 | AA14: =+(X14+U14+R14+O14+L14+I14+F14+C14)/8 -> 4.6471750000000007 | AB14: =MINA(X14,U14,R14,O14,L14,I14,F14,C14) -> 4.6188000000000002
A15: RUDSON | B15: 4 | C15: 4.8394000000000004 | D15: 31.44 | E15: 2 | F15: 4.8380999999999998 | G15: 33.19 | H15: 1 | I15: 5.0606 | J15: 32.01 | K15: 3 | L15: 4.7742000000000004 | M15: 33.65 | N15: 5 | O15: 4.7294 | P15: 33.63 | Q15: 7 | R15: 4.8353999999999999 | S15: 35.45 | T15: 8 | U15: 4.8201000000000001 | V15: 33.57 | W15: 6 | X15: 4.8952 | Y15: 32.27 | Z15: =+Y15+V15+S15+P15+M15+J15+G15+D15 -> 265.21 | AA15: =+(X15+U15+R15+O15+L15+I15+F15+C15)/8 -> 4.8490499999999992 | AB15: =MINA(X15,U15,R15,O15,L15,I15,F15,C15) -> 4.7294
A16: NETO | B16: 7 | C16: 5.0590999999999999 | D16: 32.06 | E16: 8 | F16: 4.8398000000000003 | G16: 34.57 | H16: 6 | I16: 4.8384999999999998 | J16: 34.22 | K16: 4 | L16: 4.7328999999999999 | M16: 34.26 | N16: 2 | O16: 4.8390000000000004 | P16: 20.3 | Q16: 1 | R16: 4.9691000000000001 | S16: 25.1 | T16: 3 | U16: 5.1147 | V16: 30.63 | W16: 5 | X16: 5.0590000000000002 | Y16: 30.2 | Z16: =+Y16+V16+S16+P16+M16+J16+G16+D16 -> 241.34 | AA16: =+(X16+U16+R16+O16+L16+I16+F16+C16)/8 -> 4.9315125000000002 | AB16: =MINA(X16,U16,R16,O16,L16,I16,F16,C16) -> 4.7328999999999999
A17: ERIC | B17: 6 | C17: 4.8398000000000003 | D17: 35.86 | E17: 4 | F17: 4.6178999999999997 | G17: 36.82 | H17: 2 | I17: 4.6193 | J17: 30.22 | K17: 1 | L17: 4.8375000000000004 | M17: 18.22 | N17: 3 | O17: 4.7279 | P17: 32.56 | Q17: 5 | R17: 4.74 | S17: 34.69 | T17: 7 | U17: 4.8202999999999996 | V17: 22.38 | W17: 8 | X17: 4.7305999999999999 | Y17: 21.23 | Z17: =+Y17+V17+S17+P17+M17+J17+G17+D17 -> 231.98 | AA17: =+(X17+U17+R17+O17+L17+I17+F17+C17)/8 -> 4.7416625000000003 | AB17: =MINA(X17,U17,R17,O17,L17,I17,F17,C17) -> 4.6178999999999997
A18: 3 Bateria
A19: Piloto | B19: Pi | C19: Tempo | D19: Voltas | E19: Pi | F19: Tempo | G19: Voltas | H19: Pi | I19: Tempo | J19: Voltas | K19: Pi | L19: Tempo | M19: Voltas | N19: Pi | O19: Tempo | P19: Voltas | Q19: Pi | R19: Tempo | S19: Voltas | T19: Pi | U19: Tempo | V19: Voltas | W19: Pi | X19: Tempo | Y19: Voltas | Z19: Total | AA19: Media | AB19: Record
A20: MICHEL | B20: 5 | C20: 4.6078000000000001 | D20: 37.17 | E20: 7 | F20: 4.4009999999999998 | G20: 37.51 | H20: 8 | I20: 4.6212999999999997 | J20: 37.08 | K20: 6 | L20: 4.4006999999999996 | M20: 38.5 | N20: 4 | O20: 4.4005000000000001 | P20: 38.46 | Q20: 2 | R20: 4.6029 | S20: 38.34 | T20: 1 | U20: 4.7305999999999999 | V20: 36.3 | W20: 3 | X20: 4.6101999999999999 | Y20: 38.03 | Z20: =+Y20+V20+S20+P20+M20+J20+G20+D20 -> 301.39 | AA20: =+(X20+U20+R20+O20+L20+I20+F20+C20)/8 -> 4.546875 | AB20: =MINA(X20,U20,R20,O20,L20,I20,F20,C20) -> 4.4005000000000001
A21: BONGA | B21: 7 | C21: 4.6184000000000003 | D21: 36.62 | E21: 8 | F21: 4.6348000000000003 | G21: 34.27 | H21: 6 | I21: 4.6204000000000001 | J21: 35.34 | K21: 4 | L21: 4.6192000000000002 | M21: 37.76 | N21: 2 | O21: 4.5101000000000004 | P21: 38.94 | Q21: 1 | R21: 4.6169000000000002 | S21: 38.22 | T21: 3 | U21: 4.6204999999999998 | V21: 35.74 | W21: 5 | X21: 4.8236999999999997 | Y21: 34.45 | Z21: =+Y21+V21+S21+P21+M21+J21+G21+D21 -> 291.34 | AA21: =+(X21+U21+R21+O21+L21+I21+F21+C21)/8 -> 4.633 | AB21: =MINA(X21,U21,R21,O21,L21,I21,F21,C21) -> 4.5101000000000004
A22: ANDERSON | B22: 6 | C22: 4.6060999999999996 | D22: 37.25 | E22: 4 | F22: 4.4546999999999999 | G22: 38.21 | H22: 2 | I22: 4.6196000000000002 | J22: 35.28 | K22: 1 | L22: 4.6025 | M22: 37.79 | N22: 3 | O22: 4.6025999999999998 | P22: 36.62 | Q22: 5 | R22: 4.6039000000000003 | S22: 36.24 | T22: 7 | U22: 4.6036999999999999 | V22: 31.4 | W22: 8 | X22: 4.4557000000000002 | Y22: 38.46 | Z22: =+Y22+V22+S22+P22+M22+J22+G22+D22 -> 291.25 | AA22: =+(X22+U22+R22+O22+L22+I22+F22+C22)/8 -> 4.5686 | AB22: =MINA(X22,U22,R22,O22,L22,I22,F22,C22) -> 4.4546999999999999
A23: DINHO | B23: 4 | C23: 4.4005999999999998 | D23: 36.21 | E23: 2 | F23: 4.4042000000000003 | G23: 19.95 | H23: 1 | I23: 4.6116999999999999 | J23: 34.22 | K23: 3 | L23: 4.6071999999999997 | M23: 38.18 | N23: 5 | O23: 4.4004000000000003 | P23: 37.14 | Q23: 7 | R23: 4.3994 | S23: 38.59 | T23: 8 | U23: 4.4005999999999998 | V23: 37.6 | W23: 6 | X23: 4.3992000000000004 | Y23: 38.84 | Z23: =+Y23+V23+S23+P23+M23+J23+G23+D23 -> 280.73 | AA23: =+(X23+U23+R23+O23+L23+I23+F23+C23)/8 -> 4.4529125000000001 | AB23: =MINA(X23,U23,R23,O23,L23,I23,F23,C23) -> 4.3992000000000004
A24: SAPAO | B24: 2 | C24: 4.5659000000000001 | D24: 33.65 | E24: 1 | F24: 4.6197999999999997 | G24: 34.33 | H24: 3 | I24: 4.8372999999999999 | J24: 32.86 | K24: 5 | L24: 4.6025 | M24: 36.47 | N24: 7 | O24: 4.6193 | P24: 36.64 | Q24: 8 | R24: 4.6052999999999997 | S24: 26.26 | T24: 6 | U24: 4.6193999999999997 | V24: 32.73 | W24: 4 | X24: 4.5106999999999999 | Y24: 37.66 | Z24: =+Y24+V24+S24+P24+M24+J24+G24+D24 -> 270.6 | AA24: =+(X24+U24+R24+O24+L24+I24+F24+C24)/8 -> 4.6225249999999996 | AB24: =MINA(X24,U24,R24,O24,L24,I24,F24,C24) -> 4.5106999999999999
A25: JERA | B25: 3 | C25: 4.3994999999999997 | D25: 32.48 | E25: 5 | F25: 4.6193999999999997 | G25: 20.8 | H25: 7 | I25: 4.6195000000000004 | J25: 24.76 | K25: 8 | L25: 4.6032000000000002 | M25: 37.23 | N25: 6 | O25: 4.4569999999999999 | P25: 38.01 | Q25: 4 | R25: 4.3996000000000004 | S25: 17.8 | T25: 2 | U25: 4.4565999999999999 | V25: 36.63 | W25: 1 | X25: 4.6197999999999997 | Y25: 36.39 | Z25: =+Y25+V25+S25+P25+M25+J25+G25+D25 -> 244.1 | AA25: =+(X25+U25+R25+O25+L25+I25+F25+C25)/8 -> 4.5218249999999998 | AB25: =MINA(X25,U25,R25,O25,L25,I25,F25,C25) -> 4.3994999999999997