A1: R$14,99 mussarela, catupiry, buon gustaio, toscanela, calabresa (preço para retirar no balcão) | C1: R$14,99 mussarela, catupiry, buon gustaio, toscanela, calabresa (preço para retirar no balcão)

A1: Bateria 1
A2: Nome | B2: P | C2: Tempo | D2: Vol | E2: P | F2: Tempo | G2: Vol | H2: P | I2: Tempo | J2: Vol | K2: P | L2: Tempo | M2: Vol | N2: P | O2: Tempo | P2: Vol | Q2: P | R2: Tempo | S2: Vol | T2: P | U2: Tempo | V2: Vol | W2: P | X2: Tempo | Y2: Vol | Z2: Total | AA2: Media | AB2: Record
A3: MANO | B3: 2 | C3: 3.96 | D3: 27 | E3: 1 | F3: 3.96 | G3: 24 | H3: 3 | I3: 3.96 | J3: 26 | K3: 5 | L3: 3.96 | M3: 26 | N3: 7 | O3: 3.7389999999999999 | P3: 27 | Q3: 8 | R3: 3.96 | S3: 25 | T3: 6 | U3: 3.74 | V3: 26 | W3: 4 | X3: 4.18 | Y3: 22 | Z3: 203 | AA3: =+(X3+U3+R3+O3+L3+I3+F3+C3)/8 -> 3.9323750000000004 | AB3: =MINA(X3,U3,R3,O3,L3,I3,F3,C3) -> 3.7389999999999999
A4: GOROI | B4: 5 | C4: 4.3970000000000002 | D4: 24 | E4: 7 | F4: 4.3970000000000002 | G4: 23 | H4: 8 | I4: 4.399 | J4: 24 | K4: 6 | L4: 4.18 | M4: 25 | N4: 4 | O4: 4.18 | P4: 27 | Q4: 2 | R4: 4.18 | S4: 24 | T4: 1 | U4: 4.1790000000000003 | V4: 25 | W4: 3 | X4: 4.1760000000000002 | Y4: 25 | Z4: 197 | AA4: =+(X4+U4+R4+O4+L4+I4+F4+C4)/8 -> 4.2610000000000001 | AB4: =MINA(X4,U4,R4,O4,L4,I4,F4,C4) -> 4.1760000000000002
A5: BONGA | B5: 4 | C5: 4.18 | D5: 25 | E5: 2 | F5: 4.4 | G5: 24 | H5: 1 | I5: 4.6189999999999998 | J5: 24 | K5: 3 | L5: 4.62 | M5: 23 | N5: 5 | O5: 4.1769999999999996 | P5: 25 | Q5: 7 | R5: 4.2350000000000003 | S5: 24 | T5: 8 | U5: 4.4 | V5: 24 | W5: 6 | X5: 4.18 | Y5: 24 | Z5: 193 | AA5: =+(X5+U5+R5+O5+L5+I5+F5+C5)/8 -> 4.351375 | AB5: =MINA(X5,U5,R5,O5,L5,I5,F5,C5) -> 4.1769999999999996
A6: SANDRO | B6: 8 | C6: 4.399 | D6: 23 | E6: 6 | F6: 4.18 | G6: 17 | H6: 4 | I6: 4.1790000000000003 | J6: 25 | K6: 2 | L6: 4.3979999999999997 | M6: 17 | N6: 1 | O6: 4.1769999999999996 | P6: 26 | Q6: 3 | R6: 4.18 | S6: 26 | T6: 5 | U6: 4.18 | V6: 25 | W6: 7 | X6: 4.4 | Y6: 21 | Z6: 180 | AA6: =+(X6+U6+R6+O6+L6+I6+F6+C6)/8 -> 4.2616249999999996 | AB6: =MINA(X6,U6,R6,O6,L6,I6,F6,C6) -> 4.1769999999999996
A7: EVANDRO | B7: 7 | C7: 4.4 | D7: 23 | E7: 8 | F7: 4.62 | G7: 14 | H7: 6 | I7: 5.9370000000000003 | J7: 13 | K7: 4 | L7: 5.39 | M7: 18 | N7: 2 | O7: 5.06 | P7: 21 | Q7: 1 | R7: 5.06 | S7: 19 | T7: 3 | U7: 4.6749999999999998 | V7: 21 | W7: 5 | X7: 4.6189999999999998 | Y7: 23 | Z7: 152 | AA7: =+(X7+U7+R7+O7+L7+I7+F7+C7)/8 -> 4.9701249999999995 | AB7: =MINA(X7,U7,R7,O7,L7,I7,F7,C7) -> 4.4
A8: Bateria 2
A9: Nome | B9: P | C9: Tempo | D9: Vol | E9: P | F9: Tempo | G9: Vol | H9: P | I9: Tempo | J9: Vol | K9: P | L9: Tempo | M9: Vol | N9: P | O9: Tempo | P9: Vol | Q9: P | R9: Tempo | S9: Vol | T9: P | U9: Tempo | V9: Vol | W9: P | X9: Tempo | Y9: Vol | Z9: Total | AA9: Media | AB9: Record
A10: MICHEL | B10: 1 | C10: 4.18 | D10: 26 | E10: 3 | F10: 4.1790000000000003 | G10: 25 | H10: 5 | I10: 3.9580000000000002 | J10: 27 | K10: 7 | L10: 3.96 | M10: 27 | N10: 8 | O10: 3.95 | P10: 28 | Q10: 6 | R10: 3.9590000000000001 | S10: 27 | T10: 4 | U10: 3.74 | V10: 26 | W10: 2 | X10: 3.7949999999999999 | Y10: 25 | Z10: 213 | AA10: =+(X10+U10+R10+O10+L10+I10+F10+C10)/8 -> 3.9651250000000005 | AB10: =MINA(X10,U10,R10,O10,L10,I10,F10,C10) -> 3.74
A11: JERA | B11: 4 | C11: 4.125 | D11: 27 | E11: 2 | F11: 3.85 | G11: 28 | H11: 1 | I11: 3.95 | J11: 27 | K11: 3 | L11: 3.96 | M11: 25 | N11: 5 | O11: 4.18 | P11: 24 | Q11: 7 | R11: 4.0149999999999997 | S11: 25 | T11: 8 | U11: 4.1760000000000002 | V11: 26 | W11: 6 | X11: 3.9590000000000001 | Y11: 23 | Z11: 205 | AA11: =+(X11+U11+R11+O11+L11+I11+F11+C11)/8 -> 4.0268750000000004 | AB11: =MINA(X11,U11,R11,O11,L11,I11,F11,C11) -> 3.85
A12: GABRIEL | B12: 6 | C12: 4.125 | D12: 26 | E12: 4 | F12: 3.9609999999999999 | G12: 27 | H12: 2 | I12: 3.9049999999999998 | J12: 21 | K12: 1 | L12: 4.069 | M12: 27 | N12: 3 | O12: 3.96 | P12: 26 | Q12: 5 | R12: 3.9590000000000001 | S12: 28 | T12: 7 | U12: 3.96 | V12: 25 | W12: 8 | X12: 4.18 | Y12: 16 | Z12: 196 | AA12: =+(X12+U12+R12+O12+L12+I12+F12+C12)/8 -> 4.014875 | AB12: =MINA(X12,U12,R12,O12,L12,I12,F12,C12) -> 3.9049999999999998
A13: RICARDO | B13: 5 | C13: 3.96 | D13: 26 | E13: 7 | F13: 4.1779999999999999 | G13: 25 | H13: 8 | I13: 4.4009999999999998 | J13: 2 | K13: 6 | L13: 3.9569999999999999 | M13: 23 | N13: 4 | O13: 4.1790000000000003 | P13: 23 | Q13: 2 | R13: 3.9590000000000001 | S13: 24 | T13: 1 | U13: 3.96 | V13: 22 | W13: 3 | X13: 3.9569999999999999 | Y13: 27 | Z13: 173 | AA13: =+(X13+U13+R13+O13+L13+I13+F13+C13)/8 -> 4.0688750000000002 | AB13: =MINA(X13,U13,R13,O13,L13,I13,F13,C13) -> 3.9569999999999999
A14: JOAO | B14: 8 | C14: 4.6189999999999998 | D14: 20 | E14: 6 | F14: 4.1790000000000003 | G14: 22 | H14: 4 | I14: 4.609 | J14: 15 | K14: 2 | L14: 4.62 | M14: 11 | N14: 1 | O14: 4.1790000000000003 | P14: 22 | Q14: 3 | R14: 4.18 | S14: 22 | T14: 5 | U14: 4.18 | V14: 23 | W14: 7 | X14: 4.4 | Y14: 13 | Z14: 148 | AA14: =+(X14+U14+R14+O14+L14+I14+F14+C14)/8 -> 4.3707500000000001 | AB14: =MINA(X14,U14,R14,O14,L14,I14,F14,C14) -> 4.1790000000000003

A1: Nome | B1: P | C1: Tempo | D1: Vol | E1: P | F1: Tempo | G1: Vol | H1: P | I1: Tempo | J1: Vol | K1: P | L1: Tempo | M1: Vol | N1: P | O1: Tempo | P1: Vol | Q1: P | R1: Tempo | S1: Vol | T1: P | U1: Tempo | V1: Vol | W1: P | X1: Tempo | Y1: Vol | Z1: Total | AA1: Media | AB1: Record
A2: BONGA | B2: 7 | C2: 4.1790000000000003 | D2: 24 | E2: 8 | F2: 4.18 | G2: 25 | H2: 6 | I2: 3.96 | J2: 25 | K2: 4 | L2: 4.18 | M2: 23 | N2: 2 | O2: 4.125 | P2: 26 | Q2: 1 | R2: 4.18 | S2: 24 | T2: 3 | U2: 4.1779999999999999 | V2: 25 | W2: 5 | X2: 4.1760000000000002 | Y2: 25 | Z2: 199 | AA2: =+(X2+U2+R2+O2+L2+I2+F2+C2)/8 -> 4.1447500000000002 | AB2: =MINA(X2,U2,R2,O2,L2,I2,F2,C2) -> 3.96
A3: RICARDO | B3: 8 | C3: 3.9580000000000002 | D3: 23 | E3: 6 | F3: 3.9590000000000001 | G3: 24 | H3: 4 | I3: 4.1790000000000003 | J3: 21 | K3: 2 | L3: 3.96 | M3: 25 | N3: 1 | O3: 4.07 | P3: 25 | Q3: 3 | R3: 3.9590000000000001 | S3: 25 | T3: 5 | U3: 3.85 | V3: 25 | W3: 7 | X3: 4.0149999999999997 | Y3: 26 | Z3: 195 | AA3: =+(X3+U3+R3+O3+L3+I3+F3+C3)/8 -> 3.9937499999999999 | AB3: =MINA(X3,U3,R3,O3,L3,I3,F3,C3) -> 3.85
A4: MANO | B4: 2 | C4: 3.9580000000000002 | D4: 22 | E4: 1 | F4: 3.96 | G4: 22 | H4: 3 | I4: 3.9569999999999999 | J4: 22 | K4: 5 | L4: 3.9569999999999999 | M4: 24 | N4: 7 | O4: 3.9590000000000001 | P4: 22 | Q4: 8 | R4: 3.7290000000000001 | S4: 25 | T4: 6 | U4: 3.903 | V4: 25 | W4: 4 | X4: 3.7370000000000001 | Y4: 24 | Z4: 188 | AA4: =+(X4+U4+R4+O4+L4+I4+F4+C4)/8 -> 3.895 | AB4: =MINA(X4,U4,R4,O4,L4,I4,F4,C4) -> 3.7290000000000001
A5: GOROI | B5: 5 | C5: 4.1820000000000004 | D5: 22 | E5: 7 | F5: 4.2910000000000004 | G5: 25 | H5: 8 | I5: 4.2350000000000003 | J5: 20 | K5: 6 | L5: 4.3959999999999999 | M5: 23 | N5: 4 | O5: 4.3959999999999999 | P5: 22 | Q5: 2 | R5: 3.96 | S5: 25 | T5: 1 | U5: 4.18 | V5: 24 | W5: 3 | X5: 4.2359999999999998 | Y5: 24 | Z5: 185 | AA5: =+(X5+U5+R5+O5+L5+I5+F5+C5)/8 -> 4.2345000000000006 | AB5: =MINA(X5,U5,R5,O5,L5,I5,F5,C5) -> 3.96
A6: JERA | B6: 4 | C6: 4.1689999999999996 | D6: 22 | E6: 2 | F6: 3.9609999999999999 | G6: 24 | H6: 1 | I6: 3.74 | J6: 20 | K6: 3 | L6: 3.9590000000000001 | M6: 23 | N6: 5 | O6: 3.9569999999999999 | P6: 24 | Q6: 7 | R6: 4.1760000000000002 | S6: 25 | T6: 8 | U6: 3.9569999999999999 | V6: 24 | W6: 6 | X6: 3.956 | Y6: 22 | Z6: 185 | AA6: =+(X6+U6+R6+O6+L6+I6+F6+C6)/8 -> 3.984375 | AB6: =MINA(X6,U6,R6,O6,L6,I6,F6,C6) -> 3.74
A7: MICHEL | B7: 1 | C7: 4.181 | D7: 25 | E7: 3 | F7: 4.18 | G7: 24 | H7: 5 | I7: 3.9609999999999999 | J7: 23 | K7: 7 | L7: 4.399 | M7: 23 | N7: 8 | O7: 4.6159999999999997 | P7: 22 | Q7: 6 | R7: 4.3959999999999999 | S7: 23 | T7: 4 | U7: 4.3959999999999999 | V7: 23 | W7: 2 | X7: 4.4 | Y7: 17 | Z7: 181 | AA7: =+(X7+U7+R7+O7+L7+I7+F7+C7)/8 -> 4.3161249999999995 | AB7: =MINA(X7,U7,R7,O7,L7,I7,F7,C7) -> 3.9609999999999999
A8: SANDRO | B8: 3 | C8: 4.4009999999999998 | D8: 19 | E8: 5 | F8: 4.181 | G8: 21 | H8: 7 | I8: 4.6159999999999997 | J8: 21 | K8: 8 | L8: 4.95 | M8: 18 | N8: 6 | O8: 4.4020000000000001 | P8: 22 | Q8: 4 | R8: 4.181 | S8: 22 | T8: 2 | U8: 4.4 | V8: 19 | W8: 1 | X8: 4.1790000000000003 | Y8: 24 | Z8: 167 | AA8: =+(X8+U8+R8+O8+L8+I8+F8+C8)/8 -> 4.4137500000000003 | AB8: =MINA(X8,U8,R8,O8,L8,I8,F8,C8) -> 4.1790000000000003
A9: GABRIEL | B9: 6 | C9: 4.18 | D9: 12 | E9: 4 | F9: 4.0720000000000001 | G9: 18 | H9: 2 | I9: 4.3970000000000002 | J9: 17 | K9: 1 | L9: 4.0149999999999997 | M9: 23 | N9: 3 | O9: 3.907 | P9: 27 | Q9: 5 | R9: 3.956 | S9: 22 | T9: 7 | U9: 3.9529999999999998 | V9: 23 | W9: 8 | X9: 3.9590000000000001 | Y9: 23 | Z9: 165 | AA9: =+(X9+U9+R9+O9+L9+I9+F9+C9)/8 -> 4.0548749999999991 | AB9: =MINA(X9,U9,R9,O9,L9,I9,F9,C9) -> 3.907