A1: R$14,99 mussarela, catupiry, buon gustaio, toscanela, calabresa (preço para retirar no balcão) | C1: R$14,99 mussarela, catupiry, buon gustaio, toscanela, calabresa (preço para retirar no balcão)

A1: Piloto | B1: Pi | C1: Tempo | D1: Voltas | E1: Pi | F1: Tempo | G1: Voltas | H1: Pi | I1: Tempo | J1: Voltas | K1: Pi | L1: Tempo | M1: Voltas | N1: Pi | O1: Tempo | P1: Voltas | Q1: Pi | R1: Tempo | S1: Voltas | T1: Pi | U1: Tempo | V1: Voltas | W1: Pi | X1: Tempo | Y1: Voltas | Z1: Total | AA1: Media | AB1: Record
A2: JERA | B2: 1 | C2: 3.7208000000000001 | D2: 42 | E2: 3 | F2: 3.7403 | G2: 44 | H2: 5 | I2: 3.2999000000000001 | J2: 40 | K2: 7 | L2: 3.9527000000000001 | M2: 40 | N2: 8 | O2: 3.7401 | P2: 37 | Q2: 6 | R2: 3.7393000000000001 | S2: 43 | T2: 4 | U2: 3.7235 | V2: 44 | W2: 2 | X2: 3.7204000000000002 | Y2: 44.33 | Z2: =+Y2+V2+S2+P2+M2+J2+G2+D2 -> 334.33 | AA2: =+(X2+U2+R2+O2+L2+I2+F2+C2)/8 -> 3.7046250000000001 | AB2: =MINA(X2,U2,R2,O2,L2,I2,F2,C2) -> 3.2999000000000001
A3: DINHO | B3: 3 | C3: 3.9601000000000002 | D3: 42 | E3: 5 | F3: 3.9590000000000001 | G3: 42 | H3: 7 | I3: 3.9424000000000001 | J3: 43 | K3: 8 | L3: 3.9805000000000001 | M3: 35 | N3: 6 | O3: 3.9592000000000001 | P3: 39 | Q3: 4 | R3: 3.9594999999999998 | S3: 36 | T3: 2 | U3: 3.74 | V3: 41 | W3: 1 | X3: 3.7391999999999999 | Y3: 37.5 | Z3: =+Y3+V3+S3+P3+M3+J3+G3+D3 -> 315.5 | AA3: =+(X3+U3+R3+O3+L3+I3+F3+C3)/8 -> 3.9049874999999998 | AB3: =MINA(X3,U3,R3,O3,L3,I3,F3,C3) -> 3.7391999999999999
A4: BONGA | B4: 7 | C4: 4.1801000000000004 | D4: 38 | E4: 8 | F4: 4.1807999999999996 | G4: 37 | H4: 6 | I4: 4.1795 | J4: 30 | K4: 4 | L4: 4.1806000000000001 | M4: 36 | N4: 2 | O4: 4.1790000000000003 | P4: 38 | Q4: 1 | R4: 4.1711999999999998 | S4: 39 | T4: 3 | U4: 4.1801000000000004 | V4: 39 | W4: 5 | X4: 3.9617 | Y4: 38.3 | Z4: =+Y4+V4+S4+P4+M4+J4+G4+D4 -> 295.3 | AA4: =+(X4+U4+R4+O4+L4+I4+F4+C4)/8 -> 4.1516250000000001 | AB4: =MINA(X4,U4,R4,O4,L4,I4,F4,C4) -> 3.9617
A5: LISTER | B5: 4 | C5: 3.5205000000000002 | D5: 37 | E5: 2 | F5: 4.1538000000000004 | G5: 34 | H5: 1 | I5: 3.9779 | J5: 36 | K5: 3 | L5: 4.18 | M5: 39 | N5: 5 | O5: 3.3 | P5: 32 | Q5: 7 | R5: 4.3810000000000002 | S5: 37 | T5: 8 | U5: 4.6208 | V5: 33 | W5: 6 | X5: 4.62 | Y5: 31.26 | Z5: =+Y5+V5+S5+P5+M5+J5+G5+D5 -> 279.26 | AA5: =+(X5+U5+R5+O5+L5+I5+F5+C5)/8 -> 4.0942500000000006 | AB5: =MINA(X5,U5,R5,O5,L5,I5,F5,C5) -> 3.3
A6: FRANJA | B6: 1 | C6: 4.1828000000000003 | D6: 33 | E6: 3 | F6: 4.1790000000000003 | G6: 37 | H6: 5 | I6: 4.1802000000000001 | J6: 27 | K6: 7 | L6: 4.4 | M6: 29 | N6: 8 | O6: 4.3998999999999997 | P6: 39 | Q6: 6 | R6: 4.1801000000000004 | S6: 38 | T6: 4 | U6: 4.1791 | V6: 38 | W6: 2 | X6: 3.9603999999999999 | Y6: 37.7 | Z6: =+Y6+V6+S6+P6+M6+J6+G6+D6 -> 278.7 | AA6: =+(X6+U6+R6+O6+L6+I6+F6+C6)/8 -> 4.2076875000000005 | AB6: =MINA(X6,U6,R6,O6,L6,I6,F6,C6) -> 3.9603999999999999
A7: TETA | B7: 5 | C7: 4.4004000000000003 | D7: 36 | E7: 7 | F7: 4.3992000000000004 | G7: 33 | H7: 8 | I7: 4.6021000000000001 | J7: 37 | K7: 6 | L7: 4.3997999999999999 | M7: 37 | N7: 4 | O7: 4.5101000000000004 | P7: 34 | Q7: 2 | R7: 4.6192000000000002 | S7: 31 | T7: 1 | U7: 4.6199000000000003 | V7: 32 | W7: 3 | X7: 4.6013000000000002 | Y7: 37.94 | Z7: =+Y7+V7+S7+P7+M7+J7+G7+D7 -> 277.94 | AA7: =+(X7+U7+R7+O7+L7+I7+F7+C7)/8 -> 4.5190000000000001 | AB7: =MINA(X7,U7,R7,O7,L7,I7,F7,C7) -> 4.3992000000000004
A8: MANO | B8: 5 | C8: 3.9590000000000001 | D8: 23 | E8: 7 | F8: 4.1801000000000004 | G8: 34 | H8: 8 | I8: 4.1801000000000004 | J8: 36 | K8: 6 | L8: 3.9597000000000002 | M8: 38 | N8: 4 | O8: 3.9594 | P8: 39 | Q8: 2 | R8: 3.9603999999999999 | S8: 7 | T8: 1 | U8: 3.9407000000000001 | V8: 40 | W8: 3 | X8: 3.9594999999999998 | Y8: 40.22 | Z8: =+Y8+V8+S8+P8+M8+J8+G8+D8 -> 257.22 | AA8: =+(X8+U8+R8+O8+L8+I8+F8+C8)/8 -> 4.0123625000000001 | AB8: =MINA(X8,U8,R8,O8,L8,I8,F8,C8) -> 3.9407000000000001
A9: RUDSON | B9: 8 | C9: 3.9609999999999999 | D9: 39 | E9: 6 | F9: 3.9617 | G9: 39 | H9: 4 | I9: 4.1787000000000001 | J9: 33 | K9: 2 | L9: 4.1619999999999999 | M9: 38 | N9: 1 | O9: 4.1795999999999998 | P9: 37 | Q9: 3 | R9: 4.3993000000000002 | S9: 11 | T9: 5 | U9: 4.6204999999999998 | V9: 22 | W9: 7 | X9: 4.4017999999999997 | Y9: 33.81 | Z9: =+Y9+V9+S9+P9+M9+J9+G9+D9 -> 252.81 | AA9: =+(X9+U9+R9+O9+L9+I9+F9+C9)/8 -> 4.2330749999999995 | AB9: =MINA(X9,U9,R9,O9,L9,I9,F9,C9) -> 3.9609999999999999
A10: ERIC | B10: 8 | C10: 4.6189999999999998 | D10: 29 | E10: 6 | F10: 4.4551999999999996 | G10: 36 | H10: 4 | I10: 4.6195000000000004 | J10: 34 | K10: 2 | L10: 4.6203000000000003 | M10: 33 | N10: 1 | O10: 4.62 | P10: 35 | Q10: 3 | R10: 4.6191000000000004 | S10: 35 | T10: 5 | U10: 4.62 | V10: 32 | W10: 7 | X10: 4.6207000000000003 | Y10: 13.28 | Z10: =+Y10+V10+S10+P10+M10+J10+G10+D10 -> 247.28 | AA10: =+(X10+U10+R10+O10+L10+I10+F10+C10)/8 -> 4.5992249999999997 | AB10: =MINA(X10,U10,R10,O10,L10,I10,F10,C10) -> 4.4551999999999996
A11: GIOVANNI | B11: 3 | C11: 3.9403999999999999 | D11: 43 | E11: 5 | F11: 4.1791999999999998 | G11: 41 | H11: 7 | I11: 4.1806000000000001 | J11: 35 | K11: 8 | L11: 4.1790000000000003 | M11: 35 | N11: 6 | O11: 4.1516000000000002 | P11: 16 | Q11: 4 | R11: 4.1791 | S11: 37 | T11: 2 | U11: 3.7399 | V11: 23 | W11: 1 | X11: 4.1791 | Y11: 7.99 | Z11: =+Y11+V11+S11+P11+M11+J11+G11+D11 -> 237.99 | AA11: =+(X11+U11+R11+O11+L11+I11+F11+C11)/8 -> 4.0911124999999995 | AB11: =MINA(X11,U11,R11,O11,L11,I11,F11,C11) -> 3.7399
A12: ROGERIO | B12: 2 | C12: 4.8399000000000001 | D12: 29 | E12: 1 | F12: 5.0415000000000001 | G12: 23 | H12: 3 | I12: 5.2803000000000004 | J12: 5 | K12: 5 | L12: 6.6208999999999998 | M12: 9 | N12: 7 | O12: 5.0591999999999997 | P12: 26 | Q12: 8 | R12: 5.0601000000000003 | S12: 28 | T12: 6 | U12: 5.06 | V12: 26 | W12: 4 | X12: 4.8418999999999999 | Y12: 28.76 | Z12: =+Y12+V12+S12+P12+M12+J12+G12+D12 -> 174.76 | AA12: =+(X12+U12+R12+O12+L12+I12+F12+C12)/8 -> 5.2254750000000003 | AB12: =MINA(X12,U12,R12,O12,L12,I12,F12,C12) -> 4.8399000000000001