A1: R$14,99 mussarela, catupiry, buon gustaio, toscanela, calabresa (preço para retirar no balcão) | C1: R$14,99 mussarela, catupiry, buon gustaio, toscanela, calabresa (preço para retirar no balcão)

A1: Piloto | B1: Pi | C1: Tempo | D1: Voltas | E1: Pi | F1: Tempo | G1: Voltas | H1: Pi | I1: Tempo | J1: Voltas | K1: Pi | L1: Tempo | M1: Voltas | N1: Pi | O1: Tempo | P1: Voltas | Q1: Pi | R1: Tempo | S1: Voltas | T1: Pi | U1: Tempo | V1: Voltas | W1: Pi | X1: Tempo | Y1: Voltas | Z1: Total | AA1: Media | AB1: Record
A2: DINHO | B2: 6 | C2: 3.7942999999999998 | D2: 37 | E2: 4 | F2: 3.7957000000000001 | G2: 41 | H2: 2 | I2: 3.6444000000000001 | J2: 45 | K2: 1 | L2: 3.6798000000000002 | M2: 45 | N2: 3 | O2: 3.7280000000000002 | P2: 40 | Q2: 5 | R2: 3.6920000000000002 | S2: 44 | T2: 7 | U2: 3.6873 | V2: 43 | W2: 8 | X2: 3.7334999999999998 | Y2: 43.13 | Z2: =+Y2+V2+S2+P2+M2+J2+G2+D2 -> 338.13 | AA2: =+(X2+U2+R2+O2+L2+I2+F2+C2)/8 -> 3.7193749999999999 | AB2: =MINA(X2,U2,R2,O2,L2,I2,F2,C2) -> 3.6444000000000001
A3: BONGA | B3: 3 | C3: 3.9518 | D3: 41 | E3: 5 | F3: 3.8908999999999998 | G3: 43 | H3: 7 | I3: 3.8456999999999999 | J3: 39 | K3: 8 | L3: 3.9104999999999999 | M3: 43 | N3: 6 | O3: 3.7353999999999998 | P3: 44 | Q3: 4 | R3: 3.7985000000000002 | S3: 41 | T3: 2 | U3: 3.1347 | V3: 44 | W3: 1 | X3: 3.6909999999999998 | Y3: 42.87 | Z3: =+Y3+V3+S3+P3+M3+J3+G3+D3 -> 337.87 | AA3: =+(X3+U3+R3+O3+L3+I3+F3+C3)/8 -> 3.7448124999999997 | AB3: =MINA(X3,U3,R3,O3,L3,I3,F3,C3) -> 3.1347
A4: RUDSON | B4: 6 | C4: 3.9037999999999999 | D4: 36 | E4: 4 | F4: 3.85 | G4: 40 | H4: 2 | I4: 3.8574999999999999 | J4: 38 | K4: 1 | L4: 4.0701999999999998 | M4: 40 | N4: 3 | O4: 3.9056000000000002 | P4: 41 | Q4: 5 | R4: 3.9045000000000001 | S4: 41 | T4: 7 | U4: 3.8512 | V4: 41 | W4: 8 | X4: 3.9701 | Y4: 43.17 | Z4: =+Y4+V4+S4+P4+M4+J4+G4+D4 -> 320.17 | AA4: =+(X4+U4+R4+O4+L4+I4+F4+C4)/8 -> 3.9141125000000003 | AB4: =MINA(X4,U4,R4,O4,L4,I4,F4,C4) -> 3.85
A5: LISTER | B5: 4 | C5: 3.7942999999999998 | D5: 36 | E5: 2 | F5: 4.0143000000000004 | G5: 41 | H5: 1 | I5: 3.9544999999999999 | J5: 41 | K5: 3 | L5: 3.9607000000000001 | M5: 40 | N5: 5 | O5: 3.8694000000000002 | P5: 41 | Q5: 7 | R5: 3.9 | S5: 40 | T5: 8 | U5: 4.0053999999999998 | V5: 38 | W5: 6 | X5: 4.0050999999999997 | Y5: 34.3 | Z5: =+Y5+V5+S5+P5+M5+J5+G5+D5 -> 311.3 | AA5: =+(X5+U5+R5+O5+L5+I5+F5+C5)/8 -> 3.9379625000000003 | AB5: =MINA(X5,U5,R5,O5,L5,I5,F5,C5) -> 3.7942999999999998
A6: FRANJA | B6: 5 | C6: 4.1807999999999996 | D6: 36 | E6: 7 | F6: 4.3455000000000004 | G6: 38 | H6: 8 | I6: 4.2359999999999998 | J6: 39 | K6: 6 | L6: 4.1250999999999998 | M6: 40 | N6: 4 | O6: 4.1237000000000004 | P6: 39 | Q6: 2 | R6: 4.0669000000000004 | S6: 37 | T6: 1 | U6: 3.9561999999999999 | V6: 39 | W6: 3 | X6: 4.1243999999999996 | Y6: 40.81 | Z6: =+Y6+V6+S6+P6+M6+J6+G6+D6 -> 308.81 | AA6: =+(X6+U6+R6+O6+L6+I6+F6+C6)/8 -> 4.144825 | AB6: =MINA(X6,U6,R6,O6,L6,I6,F6,C6) -> 3.9561999999999999
A7: JERA | B7: 1 | C7: 3.2458999999999998 | D7: 33 | E7: 3 | F7: 3.6903999999999999 | G7: 44 | H7: 5 | I7: 3.8504999999999998 | J7: 42 | K7: 7 | L7: 3.7408999999999999 | M7: 34 | N7: 8 | O7: 3.8283999999999998 | P7: 44 | Q7: 6 | R7: 3.7629000000000001 | S7: 32 | T7: 4 | U7: 3.6309999999999998 | V7: 34 | W7: 2 | X7: 3.6255999999999999 | Y7: 43.28 | Z7: =+Y7+V7+S7+P7+M7+J7+G7+D7 -> 306.28 | AA7: =+(X7+U7+R7+O7+L7+I7+F7+C7)/8 -> 3.6719499999999998 | AB7: =MINA(X7,U7,R7,O7,L7,I7,F7,C7) -> 3.2458999999999998
A8: GIOVANNI | B8: 8 | C8: 3.9056999999999999 | D8: 38 | E8: 6 | F8: 3.851 | G8: 40 | H8: 4 | I8: 3.9575999999999998 | J8: 32 | K8: 2 | L8: 3.6482999999999999 | M8: 41 | N8: 1 | O8: 3.96 | P8: 40 | Q8: 3 | R8: 3.8504 | S8: 39 | T8: 5 | U8: 4.0102000000000002 | V8: 38 | W8: 7 | X8: 4.0148000000000001 | Y8: 37.69 | Z8: =+Y8+V8+S8+P8+M8+J8+G8+D8 -> 305.69 | AA8: =+(X8+U8+R8+O8+L8+I8+F8+C8)/8 -> 3.8997499999999996 | AB8: =MINA(X8,U8,R8,O8,L8,I8,F8,C8) -> 3.6482999999999999
A9: MANO | B9: 5 | C9: 3.74 | D9: 30 | E9: 7 | F9: 3.7946 | G9: 23 | H9: 8 | I9: 3.4658000000000002 | J9: 43 | K9: 6 | L9: 3.6313 | M9: 36 | N9: 4 | O9: 3.6297000000000001 | P9: 43 | Q9: 2 | R9: 3.5703999999999998 | S9: 40 | T9: 1 | U9: 3.6242999999999999 | V9: 40 | W9: 3 | X9: 3.6815000000000002 | Y9: 39.63 | Z9: =+Y9+V9+S9+P9+M9+J9+G9+D9 -> 294.63 | AA9: =+(X9+U9+R9+O9+L9+I9+F9+C9)/8 -> 3.6421999999999999 | AB9: =MINA(X9,U9,R9,O9,L9,I9,F9,C9) -> 3.4658000000000002
A10: TETA | B10: 4 | C10: 4.1230000000000002 | D10: 34 | E10: 2 | F10: 3.9567000000000001 | G10: 40 | H10: 1 | I10: 4.0671999999999997 | J10: 39 | K10: 3 | L10: 4.0160999999999998 | M10: 38 | N10: 5 | O10: 4.1261000000000001 | P10: 29 | Q10: 7 | R10: 4.1661000000000001 | S10: 26 | T10: 8 | U10: 4.3456999999999999 | V10: 32 | W10: 6 | X10: 4.1181000000000001 | Y10: 40.8 | Z10: =+Y10+V10+S10+P10+M10+J10+G10+D10 -> 278.8 | AA10: =+(X10+U10+R10+O10+L10+I10+F10+C10)/8 -> 4.1148750000000005 | AB10: =MINA(X10,U10,R10,O10,L10,I10,F10,C10) -> 3.9567000000000001
A11: MANE | B11: 2 | C11: 4.0697999999999999 | D11: 32 | E11: 1 | F11: 4.1813000000000002 | G11: 37 | H11: 3 | I11: 4.1253000000000002 | J11: 36 | K11: 5 | L11: 4.0141999999999998 | M11: 34 | N11: 7 | O11: 4.1794000000000002 | P11: 36 | Q11: 8 | R11: 4.2770999999999999 | S11: 32 | T11: 6 | U11: 4.2359999999999998 | V11: 35 | W11: 4 | X11: 4.4554999999999998 | Y11: 26.39 | Z11: =+Y11+V11+S11+P11+M11+J11+G11+D11 -> 268.39 | AA11: =+(X11+U11+R11+O11+L11+I11+F11+C11)/8 -> 4.1923249999999994 | AB11: =MINA(X11,U11,R11,O11,L11,I11,F11,C11) -> 4.0141999999999998