A1: R$14,99 mussarela, catupiry, buon gustaio, toscanela, calabresa (preço para retirar no balcão) | C1: R$14,99 mussarela, catupiry, buon gustaio, toscanela, calabresa (preço para retirar no balcão)

A1: Piloto | B1: Pi | C1: Tempo | D1: Voltas | E1: Pi | F1: Tempo | G1: Voltas | H1: Pi | I1: Tempo | J1: Voltas | K1: Pi | L1: Tempo | M1: Voltas | N1: Pi | O1: Tempo | P1: Voltas | Q1: Pi | R1: Tempo | S1: Voltas | T1: Pi | U1: Tempo | V1: Voltas | W1: Pi | X1: Tempo | Y1: Voltas | Z1: Total | AA1: Media | AB1: Record
A2: DINHO | B2: 4 | C2: 3.9603000000000002 | D2: 40 | E2: 2 | F2: 3.9594999999999998 | G2: 39 | H2: 1 | I2: 3.9603999999999999 | J2: 41 | K2: 3 | L2: 4.0674000000000001 | M2: 41 | N2: 5 | O2: 4.0166000000000004 | P2: 41 | Q2: 7 | R2: 3.9594999999999998 | S2: 43 | T2: 8 | U2: 4.1807999999999996 | V2: 35 | W2: 6 | X2: 3.9618000000000002 | Y2: 42.59 | Z2: =+Y2+V2+S2+P2+M2+J2+G2+D2 -> 322.59 | AA2: =+(X2+U2+R2+O2+L2+I2+F2+C2)/8 -> 4.0082874999999998 | AB2: =MINA(X2,U2,R2,O2,L2,I2,F2,C2) -> 3.9594999999999998
A3: BONGA | B3: 1 | C3: 3.9590999999999998 | D3: 43 | E3: 3 | F3: 3.9603999999999999 | G3: 35 | H3: 5 | I3: 3.9601000000000002 | J3: 43 | K3: 7 | L3: 3.9590000000000001 | M3: 30 | N3: 8 | O3: 3.9409000000000001 | P3: 40 | Q3: 6 | R3: 3.9592999999999998 | S3: 42 | T3: 4 | U3: 3.3003999999999998 | V3: 39 | W3: 2 | X3: 3.9577 | Y3: 42.83 | Z3: =+Y3+V3+S3+P3+M3+J3+G3+D3 -> 314.83 | AA3: =+(X3+U3+R3+O3+L3+I3+F3+C3)/8 -> 3.8746125 | AB3: =MINA(X3,U3,R3,O3,L3,I3,F3,C3) -> 3.3003999999999998
A4: LISTER | B4: 6 | C4: 3.9607999999999999 | D4: 34 | E4: 4 | F4: 3.7404000000000002 | G4: 41 | H4: 2 | I4: 3.5202 | J4: 38 | K4: 1 | L4: 3.7395999999999998 | M4: 38 | N4: 3 | O4: 3.3010000000000002 | P4: 41 | Q4: 5 | R4: 3.9590000000000001 | S4: 38 | T4: 7 | U4: 3.7406000000000001 | V4: 37 | W4: 8 | X4: 3.3029000000000002 | Y4: 44.3 | Z4: =+Y4+V4+S4+P4+M4+J4+G4+D4 -> 311.3 | AA4: =+(X4+U4+R4+O4+L4+I4+F4+C4)/8 -> 3.6580624999999998 | AB4: =MINA(X4,U4,R4,O4,L4,I4,F4,C4) -> 3.3010000000000002
A5: RUDSON | B5: 6 | C5: 3.9603999999999999 | D5: 37 | E5: 4 | F5: 4.1801000000000004 | G5: 35 | H5: 2 | I5: 4.1599000000000004 | J5: 38 | K5: 1 | L5: 4.1791 | M5: 39 | N5: 3 | O5: 4.1254 | P5: 39 | Q5: 5 | R5: 4.0938999999999997 | S5: 39 | T5: 7 | U5: 4.1797000000000004 | V5: 35 | W5: 8 | X5: 4.0698999999999996 | Y5: 39.78 | Z5: =+Y5+V5+S5+P5+M5+J5+G5+D5 -> 301.78 | AA5: =+(X5+U5+R5+O5+L5+I5+F5+C5)/8 -> 4.1185500000000008 | AB5: =MINA(X5,U5,R5,O5,L5,I5,F5,C5) -> 3.9603999999999999
A6: JERA | B6: 8 | C6: 3.9605000000000001 | D6: 39 | E6: 6 | F6: 3.7953000000000001 | G6: 7 | H6: 4 | I6: 3.74 | J6: 36 | K6: 2 | L6: 3.7391999999999999 | M6: 41 | N6: 1 | O6: 3.7395 | P6: 45 | Q6: 3 | R6: 3.7181999999999999 | S6: 45 | T6: 5 | U6: 3.9047000000000001 | V6: 44 | W6: 7 | X6: 3.8506 | Y6: 42.39 | Z6: =+Y6+V6+S6+P6+M6+J6+G6+D6 -> 299.39 | AA6: =+(X6+U6+R6+O6+L6+I6+F6+C6)/8 -> 3.806 | AB6: =MINA(X6,U6,R6,O6,L6,I6,F6,C6) -> 3.7181999999999999
A7: FRANJA | B7: 2 | C7: 4.3996000000000004 | D7: 35 | E7: 1 | F7: 3.3022 | G7: 38 | H7: 3 | I7: 4.1794000000000002 | J7: 36 | K7: 5 | L7: 4.1801000000000004 | M7: 39 | N7: 7 | O7: 4.2907000000000002 | P7: 35 | Q7: 8 | R7: 4.4004000000000003 | S7: 37 | T7: 6 | U7: 4.3765000000000001 | V7: 37 | W7: 4 | X7: 4.2359 | Y7: 39.69 | Z7: =+Y7+V7+S7+P7+M7+J7+G7+D7 -> 296.69 | AA7: =+(X7+U7+R7+O7+L7+I7+F7+C7)/8 -> 4.1706000000000003 | AB7: =MINA(X7,U7,R7,O7,L7,I7,F7,C7) -> 3.3022
A8: GIOVANNI | B8: 2 | C8: 3.9053 | D8: 39 | E8: 1 | F8: 3.9586999999999999 | G8: 39 | H8: 3 | I8: 3.9384999999999999 | J8: 33 | K8: 5 | L8: 4.0153999999999996 | M8: 37 | N8: 7 | O8: 4.1795 | P8: 32 | Q8: 8 | R8: 4.1790000000000003 | S8: 35 | T8: 6 | U8: 4.1795999999999998 | V8: 38 | W8: 4 | X8: 4.1802999999999999 | Y8: 33.3 | Z8: =+Y8+V8+S8+P8+M8+J8+G8+D8 -> 286.3 | AA8: =+(X8+U8+R8+O8+L8+I8+F8+C8)/8 -> 4.0670374999999996 | AB8: =MINA(X8,U8,R8,O8,L8,I8,F8,C8) -> 3.9053
A9: TETA | B9: 5 | C9: 3.5215999999999998 | D9: 37 | E9: 7 | F9: 4.1798999999999999 | G9: 37 | H9: 8 | I9: 4.3982999999999999 | J9: 32 | K9: 6 | L9: 4.1801000000000004 | M9: 41 | N9: 4 | O9: 4.0712000000000002 | P9: 36 | Q9: 2 | R9: 4.1787000000000001 | S9: 37 | T9: 1 | U9: 4.1806999999999999 | V9: 25 | W9: 3 | X9: 3.9590000000000001 | Y9: 34.3 | Z9: =+Y9+V9+S9+P9+M9+J9+G9+D9 -> 279.3 | AA9: =+(X9+U9+R9+O9+L9+I9+F9+C9)/8 -> 4.0836874999999999 | AB9: =MINA(X9,U9,R9,O9,L9,I9,F9,C9) -> 3.5215999999999998
A10: MANE | B10: 4 | C10: 4.3993000000000002 | D10: 29 | E10: 2 | F10: 4.4105999999999996 | G10: 36 | H10: 1 | I10: 4.6035000000000004 | J10: 34 | K10: 3 | L10: 4.4554999999999998 | M10: 35 | N10: 5 | O10: 4.6192000000000002 | P10: 32 | Q10: 7 | R10: 4.6203000000000003 | S10: 33 | T10: 8 | U10: 4.6207000000000003 | V10: 34 | W10: 6 | X10: 4.62 | Y10: 32.3 | Z10: =+Y10+V10+S10+P10+M10+J10+G10+D10 -> 265.3 | AA10: =+(X10+U10+R10+O10+L10+I10+F10+C10)/8 -> 4.5436375 | AB10: =MINA(X10,U10,R10,O10,L10,I10,F10,C10) -> 4.3993000000000002
A11: MANO | B11: 3 | C11: 3.7212999999999998 | D11: 44 | E11: 5 | F11: 3.3006000000000002 | G11: 38 | H11: 7 | I11: 3.7401 | J11: 33 | K11: 8 | L11: 3.7157 | M11: 42 | N11: 6 | O11: 3.7395999999999998 | P11: 37 | Q11: 4 | R11: 3.7957999999999998 | S11: 23 | T11: 2 | U11: 3.7402000000000002 | V11: 2 | Z11: =+Y11+V11+S11+P11+M11+J11+G11+D11 -> 219 | AA11: =+(X11+U11+R11+O11+L11+I11+F11+C11)/8 -> 3.2191624999999999 | AB11: =MINA(X11,U11,R11,O11,L11,I11,F11,C11) -> 3.3006000000000002
A12: ROGERIO | B12: 8 | C12: 5.0601000000000003 | D12: 25 | E12: 6 | F12: 4.8396999999999997 | G12: 28 | H12: 4 | I12: 4.8380000000000001 | J12: 26 | K12: 2 | L12: 4.6753999999999998 | M12: 33 | N12: 1 | O12: 5.0603999999999996 | P12: 25 | Q12: 3 | R12: 4.6189999999999998 | S12: 24 | Z12: =+Y12+V12+S12+P12+M12+J12+G12+D12 -> 161 | AA12: =+(X12+U12+R12+O12+L12+I12+F12+C12)/8 -> 3.6365749999999997 | AB12: =MINA(X12,U12,R12,O12,L12,I12,F12,C12) -> 4.6189999999999998