A1: R$14,99 mussarela, catupiry, buon gustaio, toscanela, calabresa (preço para retirar no balcão) | C1: R$14,99 mussarela, catupiry, buon gustaio, toscanela, calabresa (preço para retirar no balcão)

A1: Piloto | B1: Pi | C1: Tempo | D1: Voltas | E1: Pi | F1: Tempo | G1: Voltas | H1: Pi | I1: Tempo | J1: Voltas | K1: Pi | L1: Tempo | M1: Voltas | N1: Pi | O1: Tempo | P1: Voltas | Q1: Pi | R1: Tempo | S1: Voltas | T1: Pi | U1: Tempo | V1: Voltas | W1: Pi | X1: Tempo | Y1: Voltas | Z1: Total | AA1: Media | AB1: Record
A2: JERA | B2: 1 | C2: 3.7448999999999999 | D2: 35 | E2: 3 | F2: 3.629 | G2: 43 | H2: 5 | I2: 3.8483999999999998 | J2: 40 | K2: 7 | L2: 3.9058000000000002 | M2: 42 | N2: 8 | O2: 3.6957 | P2: 43 | Q2: 6 | R2: 3.7467000000000001 | S2: 39 | T2: 4 | U2: 3.6926999999999999 | V2: 45 | W2: 2 | X2: 3.6238999999999999 | Y2: 45.11 | Z2: =+Y2+V2+S2+P2+M2+J2+G2+D2 -> 332.11 | AA2: =+(X2+U2+R2+O2+L2+I2+F2+C2)/8 -> 3.7358875 | AB2: =MINA(X2,U2,R2,O2,L2,I2,F2,C2) -> 3.6238999999999999
A3: FRANJA | B3: 2 | C3: 3.9537 | D3: 37 | E3: 1 | F3: 3.9925999999999999 | G3: 39 | H3: 3 | I3: 3.9603999999999999 | J3: 41 | K3: 5 | L3: 3.9537 | M3: 41 | N3: 7 | O3: 4.008 | P3: 40 | Q3: 8 | R3: 4.0159000000000002 | S3: 40 | T3: 6 | U3: 3.8502000000000001 | V3: 39 | W3: 4 | X3: 3.9519000000000002 | Y3: 37.59 | Z3: =+Y3+V3+S3+P3+M3+J3+G3+D3 -> 314.59 | AA3: =+(X3+U3+R3+O3+L3+I3+F3+C3)/8 -> 3.9608000000000003 | AB3: =MINA(X3,U3,R3,O3,L3,I3,F3,C3) -> 3.8502000000000001
A4: DINHO | B4: 6 | C4: 4.1216999999999997 | D4: 37 | E4: 4 | F4: 4.0724999999999998 | G4: 37 | H4: 2 | I4: 4.0133000000000001 | J4: 41 | K4: 1 | L4: 4.0625999999999998 | M4: 39 | N4: 3 | O4: 3.9605000000000001 | P4: 39 | Q4: 5 | R4: 4.0137999999999998 | S4: 39 | T4: 7 | U4: 4.0339999999999998 | V4: 43 | W4: 8 | X4: 3.9601999999999999 | Y4: 39.31 | Z4: =+Y4+V4+S4+P4+M4+J4+G4+D4 -> 314.31 | AA4: =+(X4+U4+R4+O4+L4+I4+F4+C4)/8 -> 4.0298249999999998 | AB4: =MINA(X4,U4,R4,O4,L4,I4,F4,C4) -> 3.9601999999999999
A5: LISTER | B5: 8 | C5: 3.9056999999999999 | D5: 39 | E5: 6 | F5: 4.0076000000000001 | G5: 36 | H5: 4 | I5: 3.9609000000000001 | J5: 38 | K5: 2 | L5: 3.9026000000000001 | M5: 40 | N5: 1 | O5: 3.8473999999999999 | P5: 41 | Q5: 3 | R5: 3.9611999999999998 | S5: 40 | T5: 5 | U5: 4.2350000000000003 | V5: 35 | W5: 7 | X5: 4.2873000000000001 | Y5: 37.24 | Z5: =+Y5+V5+S5+P5+M5+J5+G5+D5 -> 306.24 | AA5: =+(X5+U5+R5+O5+L5+I5+F5+C5)/8 -> 4.0134625000000002 | AB5: =MINA(X5,U5,R5,O5,L5,I5,F5,C5) -> 3.8473999999999999
A6: RUDSON | B6: 7 | C6: 4.2356999999999996 | D6: 28 | E6: 8 | F6: 4.1211000000000002 | G6: 39 | H6: 6 | I6: 4.1253000000000002 | J6: 35 | K6: 4 | L6: 4.2805 | M6: 35 | N6: 2 | O6: 4.18 | P6: 36 | Q6: 1 | R6: 4.2278000000000002 | S6: 37 | T6: 3 | U6: 4.1787999999999998 | V6: 37 | W6: 5 | X6: 4.1741999999999999 | Y6: 40.3 | Z6: =+Y6+V6+S6+P6+M6+J6+G6+D6 -> 287.3 | AA6: =+(X6+U6+R6+O6+L6+I6+F6+C6)/8 -> 4.1904250000000003 | AB6: =MINA(X6,U6,R6,O6,L6,I6,F6,C6) -> 4.1211000000000002
A7: MANO | B7: 4 | C7: 3.8504999999999998 | D7: 36 | E7: 2 | F7: 3.7395 | G7: 43 | H7: 1 | I7: 3.7326999999999999 | J7: 40 | K7: 3 | L7: 3.9521999999999999 | M7: 35 | N7: 5 | O7: 4.0080999999999998 | P7: 34 | Q7: 7 | R7: 3.8403999999999998 | S7: 24 | Z7: =+Y7+V7+S7+P7+M7+J7+G7+D7 -> 212 | AA7: =+(X7+U7+R7+O7+L7+I7+F7+C7)/8 -> 2.890425 | AB7: =MINA(X7,U7,R7,O7,L7,I7,F7,C7) -> 3.7326999999999999
A8: BONGA | B8: 3 | C8: 3.8763999999999998 | D8: 41 | E8: 5 | F8: 3.9024000000000001 | G8: 41 | H8: 7 | I8: 3.9056999999999999 | J8: 42 | K8: 8 | L8: 4.0149999999999997 | M8: 41 | N8: 6 | O8: 4.0724 | P8: 38 | Z8: =+Y8+V8+S8+P8+M8+J8+G8+D8 -> 203 | AA8: =+(X8+U8+R8+O8+L8+I8+F8+C8)/8 -> 2.4714874999999998 | AB8: =MINA(X8,U8,R8,O8,L8,I8,F8,C8) -> 3.8763999999999998