A1: R$14,99 mussarela, catupiry, buon gustaio, toscanela, calabresa (preço para retirar no balcão) | C1: R$14,99 mussarela, catupiry, buon gustaio, toscanela, calabresa (preço para retirar no balcão)

A1: Pos | B1: Piloto | C1: 1 Etapa | D1: 2 Etapa | E1: 3 Etapa | F1: 4 Etapa | G1: Total
A2: 1 | B2: DINHO | C2: 315.5 | D2: 338.13 | E2: 322.59 | F2: 314.31 | G2: =SUM(C2:F2) -> 1290.53
A3: 2 | B3: JERA | C3: 334.33 | D3: 306.28 | E3: 299.39 | F3: 332.11 | G3: =SUM(C3:F3) -> 1272.11
A4: 3 | B4: LISTER | C4: 279.26 | D4: 311.3 | E4: 311.3 | F4: 306.24 | G4: =SUM(C4:F4) -> 1208.1
A5: 4 | B5: FRANJA | C5: 278.7 | D5: 308.81 | E5: 296.69 | F5: 314.59 | G5: =SUM(C5:F5) -> 1198.79
A6: 5 | B6: RUDSON | C6: 252.81 | D6: 320.17 | E6: 301.78 | F6: 287.3 | G6: =SUM(C6:F6) -> 1162.06
A7: 6 | B7: BONGA | C7: 295.3 | D7: 337.87 | E7: 314.83 | F7: 203 | G7: =SUM(C7:F7) -> 1151
A8: 7 | B8: MANO | C8: 257.22 | D8: 294.63 | E8: 219 | F8: 312 | G8: =SUM(C8:F8) -> 1082.85
A9: 8 | B9: TETA | C9: 277.94 | D9: 278.8 | E9: 279.3 | F9: 0 | G9: =SUM(C9:F9) -> 836.04
A10: 9 | B10: GIOVANNI | C10: 237.99 | D10: 305.69 | E10: 286.3 | F10: 0 | G10: =SUM(C10:F10) -> 829.98
A11: 10 | B11: MANE | C11: 247.28 | D11: 268.39 | E11: 265.3 | F11: 0 | G11: =SUM(C11:F11) -> 780.97
A12: 11 | B12: ROGERIO | C12: 174.76 | D12: 0 | E12: 161 | F12: 0 | G12: =SUM(C12:F12) -> 335.76