A1: Categoria Junior | B1: Categoria Graduados | C1: Categoria Aspirantes

B1: 1 Bateria
A2: Pos | B2: Piloto | C2: Pi | D2: Tempo | E2: Vol | F2: Pi | G2: Tempo | H2: Vol | I2: Pi | J2: Tempo | K2: Vol | L2: Pi | M2: Tempo | N2: Vol | O2: Pi | P2: Tempo | Q2: Vol | R2: Pi | S2: Tempo | T2: Vol | U2: Pi | V2: Tempo | W2: Vol | X2: Pi | Y2: Tempo | Z2: Vol | AA2: Total | AB2: Media | AC2: Record
A3: 1 | B3: 170-PORTUGA | C3: 4 | D3: 4.6215000000000002 | E3: 34.22 | F3: 2 | G3: 4.6792999999999996 | H3: 35.35 | I3: 1 | J3: 4.8402000000000003 | K3: 34.07 | L3: 3 | M3: 4.5651999999999999 | N3: 37.64 | O3: 5 | P3: 4.5061 | Q3: 37.23 | R3: 7 | S3: 4.4973999999999998 | T3: 37.33 | U3: 8 | V3: 4.5056000000000003 | W3: 37.26 | X3: 6 | Y3: 4.6193 | Z3: 36.15 | AA3: =+Z3+W3+T3+Q3+N3+K3+H3+E3 -> 289.25 | AB3: =+(Y3+V3+S3+P3+M3+J3+G3+D3)/8 -> 4.6043249999999993 | AC3: =MINA(Y3,V3,S3,P3,M3,J3,G3,D3) -> 4.4973999999999998
A4: 2 | B4: 162-FRAN | C4: 2 | D4: 4.4550000000000001 | E4: 35.09 | F4: 1 | G4: 5.0564999999999998 | H4: 29.64 | I4: 3 | J4: 4.4006999999999996 | K4: 38.27 | L4: 5 | M4: 4.6745999999999999 | N4: 35.33 | O4: 7 | P4: 4.4002999999999997 | Q4: 38.54 | R4: 8 | S4: 4.6193 | T4: 37.46 | U4: 6 | V4: 4.2359 | W4: 35.62 | X4: 4 | Y4: 4.3998999999999997 | Z4: 37.11 | AA4: =+Z4+W4+T4+Q4+N4+K4+H4+E4 -> 287.06 | AB4: =+(Y4+V4+S4+P4+M4+J4+G4+D4)/8 -> 4.5302749999999996 | AC4: =MINA(Y4,V4,S4,P4,M4,J4,G4,D4) -> 4.2359
A5: 3 | B5: 187-RUDSON | C5: 5 | D5: 4.6208999999999998 | E5: 34.85 | F5: 7 | G5: 4.6203000000000003 | H5: 36.49 | I5: 8 | J5: 4.7301000000000002 | K5: 35.37 | L5: 6 | M5: 4.4958 | N5: 36.26 | O5: 4 | P5: 4.6165000000000003 | Q5: 35.45 | R5: 2 | S5: 4.4005999999999998 | T5: 36.57 | U5: 1 | V5: 4.4421999999999997 | W5: 35.47 | X5: 3 | Y5: 4.6192000000000002 | Z5: 35.22 | AA5: =+Z5+W5+T5+Q5+N5+K5+H5+E5 -> 285.68 | AB5: =+(Y5+V5+S5+P5+M5+J5+G5+D5)/8 -> 4.5682 | AC5: =MINA(Y5,V5,S5,P5,M5,J5,G5,D5) -> 4.4005999999999998
A6: 4 | B6: 224-TONY | C6: 6 | D6: 4.6196000000000002 | E6: 34.8 | F6: 4 | G6: 4.6703999999999999 | H6: 36.08 | I6: 2 | J6: 4.6180000000000003 | K6: 35.77 | L6: 1 | M6: 4.8403999999999998 | N6: 34.75 | O6: 3 | P6: 4.6199000000000003 | Q6: 35.78 | R6: 5 | S6: 4.6753 | T6: 32.52 | U6: 7 | V6: 4.5651999999999999 | W6: 33.35 | X6: 8 | Y6: 4.6877000000000004 | Z6: 35.06 | AA6: =+Z6+W6+T6+Q6+N6+K6+H6+E6 -> 278.11 | AB6: =+(Y6+V6+S6+P6+M6+J6+G6+D6)/8 -> 4.6620625000000002 | AC6: =MINA(Y6,V6,S6,P6,M6,J6,G6,D6) -> 4.5651999999999999
A7: 5 | B7: 48-BRENO | C7: 3 | D7: 4.7305000000000001 | E7: 31.53 | F7: 5 | G7: 4.7884000000000002 | H7: 31.86 | I7: 7 | J7: 4.2874999999999996 | K7: 35.36 | L7: 8 | M7: 4.6196999999999999 | N7: 35.91 | O7: 6 | P7: 4.6207000000000003 | Q7: 35.65 | R7: 4 | S7: 4.5056000000000003 | T7: 37.23 | U7: 2 | V7: 4.4557000000000002 | W7: 36.55 | X7: 1 | Y7: 5.0053999999999998 | Z7: 30.07 | AA7: =+Z7+W7+T7+Q7+N7+K7+H7+E7 -> 274.16 | AB7: =+(Y7+V7+S7+P7+M7+J7+G7+D7)/8 -> 4.6266875000000001 | AC7: =MINA(Y7,V7,S7,P7,M7,J7,G7,D7) -> 4.2874999999999996
A8: 6 | B8: 168-CORINGA | C8: 7 | D8: 5.1157000000000004 | E8: 31.46 | F8: 8 | G8: 5.2763 | H8: 32.26 | I8: 6 | J8: 5.0758000000000001 | K8: 32.21 | L8: 4 | M8: 5.0099 | N8: 32.17 | O8: 2 | P8: 4.8403 | Q8: 33.27 | R8: 1 | S8: 5.4339000000000004 | T8: 29.08 | U8: 3 | V8: 4.8403 | W8: 33.06 | X8: 5 | Y8: 5.0606999999999998 | Z8: 32.28 | AA8: =+Z8+W8+T8+Q8+N8+K8+H8+E8 -> 255.79 | AB8: =+(Y8+V8+S8+P8+M8+J8+G8+D8)/8 -> 5.0816125000000003 | AC8: =MINA(Y8,V8,S8,P8,M8,J8,G8,D8) -> 4.8403
A9: 7 | B9: 220-CLAUDG | C9: 1 | D9: 5.4965000000000002 | E9: 27.24 | F9: 3 | G9: 4.8912000000000004 | H9: 31.27 | I9: 5 | J9: 4.8400999999999996 | K9: 29.71 | L9: 7 | M9: 5.0029000000000003 | N9: 31.26 | O9: 8 | P9: 4.8384999999999998 | Q9: 31.75 | R9: 6 | S9: 4.7267999999999999 | T9: 34.15 | U9: 4 | V9: 5.0603999999999996 | W9: 29.74 | X9: 2 | Y9: 4.5632000000000001 | Z9: 31.69 | AA9: =+Z9+W9+T9+Q9+N9+K9+H9+E9 -> 246.81 | AB9: =+(Y9+V9+S9+P9+M9+J9+G9+D9)/8 -> 4.9274499999999994 | AC9: =MINA(Y9,V9,S9,P9,M9,J9,G9,D9) -> 4.5632000000000001
B11: 2 Bateria
A12: Pos | B12: Piloto | C12: Pi | D12: Tempo | E12: Vol | F12: Pi | G12: Tempo | H12: Vol | I12: Pi | J12: Tempo | K12: Vol | L12: Pi | M12: Tempo | N12: Vol | O12: Pi | P12: Tempo | Q12: Vol | R12: Pi | S12: Tempo | T12: Vol | U12: Pi | V12: Tempo | W12: Vol | X12: Pi | Y12: Tempo | Z12: Vol | AA12: Total | AB12: Media | AC12: Record
A13: 1 | B13: 223-LEO | C13: 2 | D13: 4.4009999999999998 | E13: 36.51 | F13: 1 | G13: 4.73 | H13: 33.19 | I13: 3 | J13: 4.2500999999999998 | K13: 33.12 | L13: 5 | M13: 4.7302999999999997 | N13: 33.85 | O13: 7 | P13: 4.7286999999999999 | Q13: 35.06 | R13: 8 | S13: 4.8952999999999998 | T13: 33.24 | U13: 6 | V13: 4.7881999999999998 | W13: 34.49 | X13: 4 | Y13: 4.2748999999999997 | Z13: 34.87 | AA13: =+Z13+W13+T13+Q13+N13+K13+H13+E13 -> 274.33 | AB13: =+(Y13+V13+S13+P13+M13+J13+G13+D13)/8 -> 4.5998124999999987 | AC13: =MINA(Y13,V13,S13,P13,M13,J13,G13,D13) -> 4.2500999999999998
A14: 2 | B14: 123-GLUB | C14: 1 | D14: 4.8944000000000001 | E14: 32.6 | F14: 3 | G14: 4.8418999999999999 | H14: 31.2 | I14: 5 | J14: 4.6218000000000004 | K14: 33.07 | L14: 7 | M14: 4.9504000000000001 | N14: 33.39 | O14: 8 | P14: 4.8388999999999998 | Q14: 32.29 | R14: 6 | S14: 4.8400999999999996 | T14: 33.6 | U14: 4 | V14: 4.8973000000000004 | W14: 31.81 | X14: 2 | Y14: 4.8837000000000002 | Z14: 33.35 | AA14: =+Z14+W14+T14+Q14+N14+K14+H14+E14 -> 261.31 | AB14: =+(Y14+V14+S14+P14+M14+J14+G14+D14)/8 -> 4.8460625000000004 | AC14: =MINA(Y14,V14,S14,P14,M14,J14,G14,D14) -> 4.6218000000000004
A15: 3 | B15: 257-LEONCIO | C15: 5 | D15: 4.8830999999999998 | E15: 24.4 | F15: 7 | G15: 4.6173999999999999 | H15: 33.21 | I15: 8 | J15: 4.5087999999999999 | K15: 34.26 | L15: 6 | M15: 4.6189999999999998 | N15: 31.22 | O15: 4 | P15: 4.3994 | Q15: 34.59 | R15: 2 | S15: 4.4013999999999998 | T15: 37.44 | U15: 1 | V15: 4.9537000000000004 | W15: 28.03 | X15: 3 | Y15: 4.3982999999999999 | Z15: 36.42 | AA15: =+Z15+W15+T15+Q15+N15+K15+H15+E15 -> 259.57 | AB15: =+(Y15+V15+S15+P15+M15+J15+G15+D15)/8 -> 4.5976375000000003 | AC15: =MINA(Y15,V15,S15,P15,M15,J15,G15,D15) -> 4.3982999999999999
A16: 4 | B16: 226-VIRSO | C16: 6 | D16: 5.5515999999999996 | E16: 24.47 | F16: 4 | G16: 5.4580000000000002 | H16: 27.82 | I16: 2 | J16: 5.0603999999999996 | K16: 27.31 | L16: 1 | M16: 4.8453999999999997 | N16: 32.13 | O16: 3 | P16: 5.0578000000000003 | Q16: 28.62 | R16: 5 | S16: 5.4461000000000004 | T16: 25.32 | U16: 7 | V16: 5.3891 | W16: 27.34 | X16: 8 | Y16: 5.3346999999999998 | Z16: 28.73 | AA16: =+Z16+W16+T16+Q16+N16+K16+H16+E16 -> 221.74 | AB16: =+(Y16+V16+S16+P16+M16+J16+G16+D16)/8 -> 5.2678875000000005 | AC16: =MINA(Y16,V16,S16,P16,M16,J16,G16,D16) -> 4.8453999999999997
A17: 5 | B17: 75-RAMOS | C17: 8 | D17: 5.0610999999999997 | E17: 29.77 | F17: 6 | G17: 5.2253999999999996 | H17: 28.19 | I17: 4 | J17: 5.4992999999999999 | K17: 27.73 | L17: 2 | M17: 5.0605000000000002 | N17: 28.42 | O17: 1 | P17: 5.5008999999999997 | Q17: 27.09 | R17: 3 | S17: 5.2807000000000004 | T17: 29.05 | U17: 5 | V17: 5.3940999999999999 | W17: 23.8 | X17: 7 | Y17: 4.6207000000000003 | Z17: 17.72 | AA17: =+Z17+W17+T17+Q17+N17+K17+H17+E17 -> 211.77 | AB17: =+(Y17+V17+S17+P17+M17+J17+G17+D17)/8 -> 5.2053375000000006 | AC17: =MINA(Y17,V17,S17,P17,M17,J17,G17,D17) -> 4.6207000000000003
A18: 6 | B18: 175-SCHUMA | C18: 3 | D18: 5.5004999999999997 | E18: 25.54 | F18: 5 | G18: 5.7161 | H18: 24.74 | I18: 7 | J18: 5.0606 | K18: 27.21 | L18: 8 | M18: 5.2807000000000004 | N18: 21.79 | O18: 6 | P18: 4.8410000000000002 | Q18: 31.81 | R18: 4 | S18: 5.5522999999999998 | T18: 18.19 | U18: 2 | V18: 5.3943000000000003 | W18: 19.21 | X18: 1 | Y18: 5.9409000000000001 | Z18: 26.29 | AA18: =+Z18+W18+T18+Q18+N18+K18+H18+E18 -> 194.78 | AB18: =+(Y18+V18+S18+P18+M18+J18+G18+D18)/8 -> 5.4108000000000001 | AC18: =MINA(Y18,V18,S18,P18,M18,J18,G18,D18) -> 4.8410000000000002
B20: 3 Bateria
A21: Pos | B21: Piloto | C21: Pi | D21: Tempo | E21: Vol | F21: Pi | G21: Tempo | H21: Vol | I21: Pi | J21: Tempo | K21: Vol | L21: Pi | M21: Tempo | N21: Vol | O21: Pi | P21: Tempo | Q21: Vol | R21: Pi | S21: Tempo | T21: Vol | U21: Pi | V21: Tempo | W21: Vol | X21: Pi | Y21: Tempo | Z21: Vol | AA21: Total | AB21: Media | AC21: Record
A22: 1 | B22: 14-CAIO | C22: 2 | D22: 4.4146000000000001 | E22: 32.23 | F22: 1 | G22: 5.0602 | H22: 31.05 | I22: 3 | J22: 4.2356999999999996 | K22: 35.59 | L22: 5 | M22: 4.4592000000000001 | N22: 35.35 | O22: 7 | P22: 4.2366000000000001 | Q22: 37.19 | R22: 8 | S22: 4.2908999999999997 | T22: 36.32 | U22: 6 | V22: 4.1242999999999999 | W22: 35.88 | X22: 4 | Y22: 4.0151000000000003 | Z22: 37.66 | AA22: =+Z22+W22+T22+Q22+N22+K22+H22+E22 -> 281.27 | AB22: =+(Y22+V22+S22+P22+M22+J22+G22+D22)/8 -> 4.3545749999999996 | AC22: =MINA(Y22,V22,S22,P22,M22,J22,G22,D22) -> 4.0151000000000003
A23: 2 | B23: 177-XARA | C23: 1 | D23: 5.0094000000000003 | E23: 31.75 | F23: 3 | G23: 4.6181000000000001 | H23: 34.21 | I23: 5 | J23: 4.2355999999999998 | K23: 34.6 | L23: 7 | M23: 4.4031000000000002 | N23: 33.27 | O23: 8 | P23: 4.351 | Q23: 32.2 | R23: 6 | S23: 4.6193999999999997 | T23: 35.08 | U23: 4 | V23: 4.5681000000000003 | W23: 33.15 | X23: 2 | Y23: 4.5373999999999999 | Z23: 33.15 | AA23: =+Z23+W23+T23+Q23+N23+K23+H23+E23 -> 267.41 | AB23: =+(Y23+V23+S23+P23+M23+J23+G23+D23)/8 -> 4.5427624999999994 | AC23: =MINA(Y23,V23,S23,P23,M23,J23,G23,D23) -> 4.2355999999999998
A24: 3 | B24: 174-MUTE | C24: 8 | D24: 4.6993999999999998 | E24: 33.26 | F24: 6 | G24: 4.6212 | H24: 33.27 | I24: 4 | J24: 4.6163999999999996 | K24: 30.95 | L24: 2 | M24: 4.3977000000000004 | N24: 31.26 | O24: 1 | P24: 4.8960999999999997 | Q24: 30.54 | R24: 3 | S24: 4.1978 | T24: 33.31 | U24: 5 | V24: 4.1790000000000003 | W24: 32.26 | X24: 7 | Y24: 4.0598999999999998 | Z24: 34.21 | AA24: =+Z24+W24+T24+Q24+N24+K24+H24+E24 -> 259.06 | AB24: =+(Y24+V24+S24+P24+M24+J24+G24+D24)/8 -> 4.4584374999999996 | AC24: =MINA(Y24,V24,S24,P24,M24,J24,G24,D24) -> 4.0598999999999998
A25: 4 | B25: 85-S EDGAR | C25: 4 | D25: 5.0621 | E25: 32.84 | F25: 2 | G25: 4.9493999999999998 | H25: 33.06 | I25: 1 | J25: 5.0132000000000003 | K25: 30.81 | L25: 3 | M25: 5.1048999999999998 | N25: 31.73 | O25: 5 | P25: 4.7908999999999997 | Q25: 32.23 | R25: 7 | S25: 4.3456000000000001 | T25: 32.77 | U25: 8 | V25: 5.1711 | W25: 30.47 | X25: 6 | Y25: 4.7744 | Z25: 30.2 | AA25: =+Z25+W25+T25+Q25+N25+K25+H25+E25 -> 254.11 | AB25: =+(Y25+V25+S25+P25+M25+J25+G25+D25)/8 -> 4.9014500000000005 | AC25: =MINA(Y25,V25,S25,P25,M25,J25,G25,D25) -> 4.3456000000000001
A26: 5 | B26: 11-VILLAR | C26: 7 | D26: 4.4523999999999999 | E26: 29.19 | F26: 8 | G26: 4.6210000000000004 | H26: 29.48 | I26: 6 | J26: 4.6966999999999999 | K26: 29.66 | L26: 4 | M26: 4.6144999999999996 | N26: 26.16 | O26: 2 | P26: 4.4008000000000003 | Q26: 32.26 | R26: 1 | S26: 4.4866000000000001 | T26: 28.56 | U26: 3 | V26: 4.6704999999999997 | W26: 16 | X26: 5 | Y26: 5.0490000000000004 | Z26: 28.01 | AA26: =+Z26+W26+T26+Q26+N26+K26+H26+E26 -> 219.32 | AB26: =+(Y26+V26+S26+P26+M26+J26+G26+D26)/8 -> 4.6239374999999994 | AC26: =MINA(Y26,V26,S26,P26,M26,J26,G26,D26) -> 4.4008000000000003
A27: 6 | B27: 222-RICARDAO | C27: 5 | D27: 4.6186999999999996 | E27: 35.03 | F27: 7 | G27: 4.4550000000000001 | H27: 36.28 | I27: 8 | J27: 4.4545000000000003 | K27: 35.74 | L27: 6 | M27: 4.4527000000000001 | N27: 37.93 | O27: 4 | P27: 4.4128999999999996 | Q27: 35.02 | AA27: =+Z27+W27+T27+Q27+N27+K27+H27+E27 -> 180 | AB27: =+(Y27+V27+S27+P27+M27+J27+G27+D27)/8 -> 2.7992250000000003 | AC27: =MINA(Y27,V27,S27,P27,M27,J27,G27,D27) -> 4.4128999999999996
B29: Geral
A30: Pos | B30: Piloto | C30: Pi | D30: Tempo | E30: Vol | F30: Pi | G30: Tempo | H30: Vol | I30: Pi | J30: Tempo | K30: Vol | L30: Pi | M30: Tempo | N30: Vol | O30: Pi | P30: Tempo | Q30: Vol | R30: Pi | S30: Tempo | T30: Vol | U30: Pi | V30: Tempo | W30: Vol | X30: Pi | Y30: Tempo | Z30: Vol | AA30: Total | AB30: Media | AC30: Record
A31: 1 | B31: 170-PORTUGA | C31: 4 | D31: 4.6215000000000002 | E31: 34.22 | F31: 2 | G31: 4.6792999999999996 | H31: 35.35 | I31: 1 | J31: 4.8402000000000003 | K31: 34.07 | L31: 3 | M31: 4.5651999999999999 | N31: 37.64 | O31: 5 | P31: 4.5061 | Q31: 37.23 | R31: 7 | S31: 4.4973999999999998 | T31: 37.33 | U31: 8 | V31: 4.5056000000000003 | W31: 37.26 | X31: 6 | Y31: 4.6193 | Z31: 36.15 | AA31: =+Z31+W31+T31+Q31+N31+K31+H31+E31 -> 289.25 | AB31: =+(Y31+V31+S31+P31+M31+J31+G31+D31)/8 -> 4.6043249999999993 | AC31: =MINA(Y31,V31,S31,P31,M31,J31,G31,D31) -> 4.4973999999999998
A32: 2 | B32: 162-FRAN | C32: 2 | D32: 4.4550000000000001 | E32: 35.09 | F32: 1 | G32: 5.0564999999999998 | H32: 29.64 | I32: 3 | J32: 4.4006999999999996 | K32: 38.27 | L32: 5 | M32: 4.6745999999999999 | N32: 35.33 | O32: 7 | P32: 4.4002999999999997 | Q32: 38.54 | R32: 8 | S32: 4.6193 | T32: 37.46 | U32: 6 | V32: 4.2359 | W32: 35.62 | X32: 4 | Y32: 4.3998999999999997 | Z32: 37.11 | AA32: =+Z32+W32+T32+Q32+N32+K32+H32+E32 -> 287.06 | AB32: =+(Y32+V32+S32+P32+M32+J32+G32+D32)/8 -> 4.5302749999999996 | AC32: =MINA(Y32,V32,S32,P32,M32,J32,G32,D32) -> 4.2359
A33: 3 | B33: 187-RUDSON | C33: 5 | D33: 4.6208999999999998 | E33: 34.85 | F33: 7 | G33: 4.6203000000000003 | H33: 36.49 | I33: 8 | J33: 4.7301000000000002 | K33: 35.37 | L33: 6 | M33: 4.4958 | N33: 36.26 | O33: 4 | P33: 4.6165000000000003 | Q33: 35.45 | R33: 2 | S33: 4.4005999999999998 | T33: 36.57 | U33: 1 | V33: 4.4421999999999997 | W33: 35.47 | X33: 3 | Y33: 4.6192000000000002 | Z33: 35.22 | AA33: =+Z33+W33+T33+Q33+N33+K33+H33+E33 -> 285.68 | AB33: =+(Y33+V33+S33+P33+M33+J33+G33+D33)/8 -> 4.5682 | AC33: =MINA(Y33,V33,S33,P33,M33,J33,G33,D33) -> 4.4005999999999998
A34: 4 | B34: 14-CAIO | C34: 2 | D34: 4.4146000000000001 | E34: 32.23 | F34: 1 | G34: 5.0602 | H34: 31.05 | I34: 3 | J34: 4.2356999999999996 | K34: 35.59 | L34: 5 | M34: 4.4592000000000001 | N34: 35.35 | O34: 7 | P34: 4.2366000000000001 | Q34: 37.19 | R34: 8 | S34: 4.2908999999999997 | T34: 36.32 | U34: 6 | V34: 4.1242999999999999 | W34: 35.88 | X34: 4 | Y34: 4.0151000000000003 | Z34: 37.66 | AA34: =+Z34+W34+T34+Q34+N34+K34+H34+E34 -> 281.27 | AB34: =+(Y34+V34+S34+P34+M34+J34+G34+D34)/8 -> 4.3545749999999996 | AC34: =MINA(Y34,V34,S34,P34,M34,J34,G34,D34) -> 4.0151000000000003
A35: 5 | B35: 224-TONY | C35: 6 | D35: 4.6196000000000002 | E35: 34.8 | F35: 4 | G35: 4.6703999999999999 | H35: 36.08 | I35: 2 | J35: 4.6180000000000003 | K35: 35.77 | L35: 1 | M35: 4.8403999999999998 | N35: 34.75 | O35: 3 | P35: 4.6199000000000003 | Q35: 35.78 | R35: 5 | S35: 4.6753 | T35: 32.52 | U35: 7 | V35: 4.5651999999999999 | W35: 33.35 | X35: 8 | Y35: 4.6877000000000004 | Z35: 35.06 | AA35: =+Z35+W35+T35+Q35+N35+K35+H35+E35 -> 278.11 | AB35: =+(Y35+V35+S35+P35+M35+J35+G35+D35)/8 -> 4.6620625000000002 | AC35: =MINA(Y35,V35,S35,P35,M35,J35,G35,D35) -> 4.5651999999999999
A36: 6 | B36: 223-LEO | C36: 2 | D36: 4.4009999999999998 | E36: 36.51 | F36: 1 | G36: 4.73 | H36: 33.19 | I36: 3 | J36: 4.2500999999999998 | K36: 33.12 | L36: 5 | M36: 4.7302999999999997 | N36: 33.85 | O36: 7 | P36: 4.7286999999999999 | Q36: 35.06 | R36: 8 | S36: 4.8952999999999998 | T36: 33.24 | U36: 6 | V36: 4.7881999999999998 | W36: 34.49 | X36: 4 | Y36: 4.2748999999999997 | Z36: 34.87 | AA36: =+Z36+W36+T36+Q36+N36+K36+H36+E36 -> 274.33 | AB36: =+(Y36+V36+S36+P36+M36+J36+G36+D36)/8 -> 4.5998124999999987 | AC36: =MINA(Y36,V36,S36,P36,M36,J36,G36,D36) -> 4.2500999999999998
A37: =+A36+1 -> 7 | B37: 48-BRENO | C37: 3 | D37: 4.7305000000000001 | E37: 31.53 | F37: 5 | G37: 4.7884000000000002 | H37: 31.86 | I37: 7 | J37: 4.2874999999999996 | K37: 35.36 | L37: 8 | M37: 4.6196999999999999 | N37: 35.91 | O37: 6 | P37: 4.6207000000000003 | Q37: 35.65 | R37: 4 | S37: 4.5056000000000003 | T37: 37.23 | U37: 2 | V37: 4.4557000000000002 | W37: 36.55 | X37: 1 | Y37: 5.0053999999999998 | Z37: 30.07 | AA37: =+Z37+W37+T37+Q37+N37+K37+H37+E37 -> 274.16 | AB37: =+(Y37+V37+S37+P37+M37+J37+G37+D37)/8 -> 4.6266875000000001 | AC37: =MINA(Y37,V37,S37,P37,M37,J37,G37,D37) -> 4.2874999999999996
A38: =+A37+1 -> 8 | B38: 177-XARA | C38: 1 | D38: 5.0094000000000003 | E38: 31.75 | F38: 3 | G38: 4.6181000000000001 | H38: 34.21 | I38: 5 | J38: 4.2355999999999998 | K38: 34.6 | L38: 7 | M38: 4.4031000000000002 | N38: 33.27 | O38: 8 | P38: 4.351 | Q38: 32.2 | R38: 6 | S38: 4.6193999999999997 | T38: 35.08 | U38: 4 | V38: 4.5681000000000003 | W38: 33.15 | X38: 2 | Y38: 4.5373999999999999 | Z38: 33.15 | AA38: =+Z38+W38+T38+Q38+N38+K38+H38+E38 -> 267.41 | AB38: =+(Y38+V38+S38+P38+M38+J38+G38+D38)/8 -> 4.5427624999999994 | AC38: =MINA(Y38,V38,S38,P38,M38,J38,G38,D38) -> 4.2355999999999998
A39: =+A38+1 -> 9 | B39: 123-GLUB | C39: 1 | D39: 4.8944000000000001 | E39: 32.6 | F39: 3 | G39: 4.8418999999999999 | H39: 31.2 | I39: 5 | J39: 4.6218000000000004 | K39: 33.07 | L39: 7 | M39: 4.9504000000000001 | N39: 33.39 | O39: 8 | P39: 4.8388999999999998 | Q39: 32.29 | R39: 6 | S39: 4.8400999999999996 | T39: 33.6 | U39: 4 | V39: 4.8973000000000004 | W39: 31.81 | X39: 2 | Y39: 4.8837000000000002 | Z39: 33.35 | AA39: =+Z39+W39+T39+Q39+N39+K39+H39+E39 -> 261.31 | AB39: =+(Y39+V39+S39+P39+M39+J39+G39+D39)/8 -> 4.8460625000000004 | AC39: =MINA(Y39,V39,S39,P39,M39,J39,G39,D39) -> 4.6218000000000004
A40: =+A39+1 -> 10 | B40: 257-LEONCIO | C40: 5 | D40: 4.8830999999999998 | E40: 24.4 | F40: 7 | G40: 4.6173999999999999 | H40: 33.21 | I40: 8 | J40: 4.5087999999999999 | K40: 34.26 | L40: 6 | M40: 4.6189999999999998 | N40: 31.22 | O40: 4 | P40: 4.3994 | Q40: 34.59 | R40: 2 | S40: 4.4013999999999998 | T40: 37.44 | U40: 1 | V40: 4.9537000000000004 | W40: 28.03 | X40: 3 | Y40: 4.3982999999999999 | Z40: 36.42 | AA40: =+Z40+W40+T40+Q40+N40+K40+H40+E40 -> 259.57 | AB40: =+(Y40+V40+S40+P40+M40+J40+G40+D40)/8 -> 4.5976375000000003 | AC40: =MINA(Y40,V40,S40,P40,M40,J40,G40,D40) -> 4.3982999999999999
A41: =+A40+1 -> 11 | B41: 174-MUTE | C41: 8 | D41: 4.6993999999999998 | E41: 33.26 | F41: 6 | G41: 4.6212 | H41: 33.27 | I41: 4 | J41: 4.6163999999999996 | K41: 30.95 | L41: 2 | M41: 4.3977000000000004 | N41: 31.26 | O41: 1 | P41: 4.8960999999999997 | Q41: 30.54 | R41: 3 | S41: 4.1978 | T41: 33.31 | U41: 5 | V41: 4.1790000000000003 | W41: 32.26 | X41: 7 | Y41: 4.0598999999999998 | Z41: 34.21 | AA41: =+Z41+W41+T41+Q41+N41+K41+H41+E41 -> 259.06 | AB41: =+(Y41+V41+S41+P41+M41+J41+G41+D41)/8 -> 4.4584374999999996 | AC41: =MINA(Y41,V41,S41,P41,M41,J41,G41,D41) -> 4.0598999999999998
A42: =+A41+1 -> 12 | B42: 168-CORINGA | C42: 7 | D42: 5.1157000000000004 | E42: 31.46 | F42: 8 | G42: 5.2763 | H42: 32.26 | I42: 6 | J42: 5.0758000000000001 | K42: 32.21 | L42: 4 | M42: 5.0099 | N42: 32.17 | O42: 2 | P42: 4.8403 | Q42: 33.27 | R42: 1 | S42: 5.4339000000000004 | T42: 29.08 | U42: 3 | V42: 4.8403 | W42: 33.06 | X42: 5 | Y42: 5.0606999999999998 | Z42: 32.28 | AA42: =+Z42+W42+T42+Q42+N42+K42+H42+E42 -> 255.79 | AB42: =+(Y42+V42+S42+P42+M42+J42+G42+D42)/8 -> 5.0816125000000003 | AC42: =MINA(Y42,V42,S42,P42,M42,J42,G42,D42) -> 4.8403
A43: =+A42+1 -> 13 | B43: 85-S EDGAR | C43: 4 | D43: 5.0621 | E43: 32.84 | F43: 2 | G43: 4.9493999999999998 | H43: 33.06 | I43: 1 | J43: 5.0132000000000003 | K43: 30.81 | L43: 3 | M43: 5.1048999999999998 | N43: 31.73 | O43: 5 | P43: 4.7908999999999997 | Q43: 32.23 | R43: 7 | S43: 4.3456000000000001 | T43: 32.77 | U43: 8 | V43: 5.1711 | W43: 30.47 | X43: 6 | Y43: 4.7744 | Z43: 30.2 | AA43: =+Z43+W43+T43+Q43+N43+K43+H43+E43 -> 254.11 | AB43: =+(Y43+V43+S43+P43+M43+J43+G43+D43)/8 -> 4.9014500000000005 | AC43: =MINA(Y43,V43,S43,P43,M43,J43,G43,D43) -> 4.3456000000000001
A44: =+A43+1 -> 14 | B44: 220-CLAUDG | C44: 1 | D44: 5.4965000000000002 | E44: 27.24 | F44: 3 | G44: 4.8912000000000004 | H44: 31.27 | I44: 5 | J44: 4.8400999999999996 | K44: 29.71 | L44: 7 | M44: 5.0029000000000003 | N44: 31.26 | O44: 8 | P44: 4.8384999999999998 | Q44: 31.75 | R44: 6 | S44: 4.7267999999999999 | T44: 34.15 | U44: 4 | V44: 5.0603999999999996 | W44: 29.74 | X44: 2 | Y44: 4.5632000000000001 | Z44: 31.69 | AA44: =+Z44+W44+T44+Q44+N44+K44+H44+E44 -> 246.81 | AB44: =+(Y44+V44+S44+P44+M44+J44+G44+D44)/8 -> 4.9274499999999994 | AC44: =MINA(Y44,V44,S44,P44,M44,J44,G44,D44) -> 4.5632000000000001
A45: =+A44+1 -> 15 | B45: 226-VIRSO | C45: 6 | D45: 5.5515999999999996 | E45: 24.47 | F45: 4 | G45: 5.4580000000000002 | H45: 27.82 | I45: 2 | J45: 5.0603999999999996 | K45: 27.31 | L45: 1 | M45: 4.8453999999999997 | N45: 32.13 | O45: 3 | P45: 5.0578000000000003 | Q45: 28.62 | R45: 5 | S45: 5.4461000000000004 | T45: 25.32 | U45: 7 | V45: 5.3891 | W45: 27.34 | X45: 8 | Y45: 5.3346999999999998 | Z45: 28.73 | AA45: =+Z45+W45+T45+Q45+N45+K45+H45+E45 -> 221.74 | AB45: =+(Y45+V45+S45+P45+M45+J45+G45+D45)/8 -> 5.2678875000000005 | AC45: =MINA(Y45,V45,S45,P45,M45,J45,G45,D45) -> 4.8453999999999997
A46: =+A45+1 -> 16 | B46: 11-VILLAR | C46: 7 | D46: 4.4523999999999999 | E46: 29.19 | F46: 8 | G46: 4.6210000000000004 | H46: 29.48 | I46: 6 | J46: 4.6966999999999999 | K46: 29.66 | L46: 4 | M46: 4.6144999999999996 | N46: 26.16 | O46: 2 | P46: 4.4008000000000003 | Q46: 32.26 | R46: 1 | S46: 4.4866000000000001 | T46: 28.56 | U46: 3 | V46: 4.6704999999999997 | W46: 16 | X46: 5 | Y46: 5.0490000000000004 | Z46: 28.01 | AA46: =+Z46+W46+T46+Q46+N46+K46+H46+E46 -> 219.32 | AB46: =+(Y46+V46+S46+P46+M46+J46+G46+D46)/8 -> 4.6239374999999994 | AC46: =MINA(Y46,V46,S46,P46,M46,J46,G46,D46) -> 4.4008000000000003
A47: =+A46+1 -> 17 | B47: 75-RAMOS | C47: 8 | D47: 5.0610999999999997 | E47: 29.77 | F47: 6 | G47: 5.2253999999999996 | H47: 28.19 | I47: 4 | J47: 5.4992999999999999 | K47: 27.73 | L47: 2 | M47: 5.0605000000000002 | N47: 28.42 | O47: 1 | P47: 5.5008999999999997 | Q47: 27.09 | R47: 3 | S47: 5.2807000000000004 | T47: 29.05 | U47: 5 | V47: 5.3940999999999999 | W47: 23.8 | X47: 7 | Y47: 4.6207000000000003 | Z47: 17.72 | AA47: =+Z47+W47+T47+Q47+N47+K47+H47+E47 -> 211.77 | AB47: =+(Y47+V47+S47+P47+M47+J47+G47+D47)/8 -> 5.2053375000000006 | AC47: =MINA(Y47,V47,S47,P47,M47,J47,G47,D47) -> 4.6207000000000003
A48: =+A47+1 -> 18 | B48: 175-SCHUMA | C48: 3 | D48: 5.5004999999999997 | E48: 25.54 | F48: 5 | G48: 5.7161 | H48: 24.74 | I48: 7 | J48: 5.0606 | K48: 27.21 | L48: 8 | M48: 5.2807000000000004 | N48: 21.79 | O48: 6 | P48: 4.8410000000000002 | Q48: 31.81 | R48: 4 | S48: 5.5522999999999998 | T48: 18.19 | U48: 2 | V48: 5.3943000000000003 | W48: 19.21 | X48: 1 | Y48: 5.9409000000000001 | Z48: 26.29 | AA48: =+Z48+W48+T48+Q48+N48+K48+H48+E48 -> 194.78 | AB48: =+(Y48+V48+S48+P48+M48+J48+G48+D48)/8 -> 5.4108000000000001 | AC48: =MINA(Y48,V48,S48,P48,M48,J48,G48,D48) -> 4.8410000000000002
A49: =+A48+1 -> 19 | B49: 222-RICARDAO | C49: 5 | D49: 4.6186999999999996 | E49: 35.03 | F49: 7 | G49: 4.4550000000000001 | H49: 36.28 | I49: 8 | J49: 4.4545000000000003 | K49: 35.74 | L49: 6 | M49: 4.4527000000000001 | N49: 37.93 | O49: 4 | P49: 4.4128999999999996 | Q49: 35.02 | AA49: =+Z49+W49+T49+Q49+N49+K49+H49+E49 -> 180 | AB49: =+(Y49+V49+S49+P49+M49+J49+G49+D49)/8 -> 2.7992250000000003 | AC49: =MINA(Y49,V49,S49,P49,M49,J49,G49,D49) -> 4.4128999999999996