A1: Categoria Junior | B1: Categoria Graduados | C1: Categoria Aspirantes

B1: 1 Bateria
A2: Pos | B2: Piloto | C2: Pi | D2: Tempo | E2: Vol | F2: Pi | G2: Tempo | H2: Vol | I2: Pi | J2: Tempo | K2: Vol | L2: Pi | M2: Tempo | N2: Vol | O2: Pi | P2: Tempo | Q2: Vol | R2: Pi | S2: Tempo | T2: Vol | U2: Pi | V2: Tempo | W2: Vol | X2: Pi | Y2: Tempo | Z2: Vol | AA2: Total | AB2: Media | AC2: Record
A3: 1 | B3: 27-DOUGLAS | C3: 7 | D3: 4.2168000000000001 | E3: 35.05 | F3: 8 | G3: 4.2657999999999996 | H3: 36.46 | I3: 6 | J3: 4.2930999999999999 | K3: 36.48 | L3: 4 | M3: 4.3612000000000002 | N3: 37.57 | O3: 2 | P3: 4.4043999999999999 | Q3: 36.71 | R3: 1 | S3: 4.2613000000000003 | T3: 35.27 | U3: 3 | V3: 4.8387000000000002 | W3: 36.25 | X3: 5 | Y3: 5.0495999999999999 | Z3: 32.94 | AA3: =+Z3+W3+T3+Q3+N3+K3+H3+E3 -> 286.73 | AB3: =+(Y3+V3+S3+P3+M3+J3+G3+D3)/8 -> 4.4613624999999999 | AC3: =MINA(Y3,V3,S3,P3,M3,J3,G3,D3) -> 4.2168000000000001
A4: 2 | B4: 35-BIG | C4: 2 | D4: 4.3994999999999997 | E4: 32.06 | F4: 1 | G4: 4.4157000000000002 | H4: 35.04 | I4: 3 | J4: 4.4157999999999999 | K4: 36.49 | L4: 5 | M4: 4.7961 | N4: 35.01 | O4: 7 | P4: 4.6144999999999996 | Q4: 37.4 | R4: 8 | S4: 4.6055000000000001 | T4: 37.46 | U4: 6 | V4: 4.4008000000000003 | W4: 35.55 | X4: 4 | Y4: 4.5768000000000004 | Z4: 30.61 | AA4: =+Z4+W4+T4+Q4+N4+K4+H4+E4 -> 279.62 | AB4: =+(Y4+V4+S4+P4+M4+J4+G4+D4)/8 -> 4.5280874999999998 | AC4: =MINA(Y4,V4,S4,P4,M4,J4,G4,D4) -> 4.3994999999999997
A5: 3 | B5: 8-LAERTE | C5: 6 | D5: 4.5907999999999998 | E5: 32.46 | F5: 4 | G5: 4.6584000000000003 | H5: 35.45 | I5: 2 | J5: 4.5918000000000001 | K5: 34.65 | L5: 1 | M5: 4.6773999999999996 | N5: 30.14 | O5: 3 | P5: 4.7575000000000003 | Q5: 37.77 | R5: 5 | S5: 4.7051999999999996 | T5: 32.62 | U5: 7 | V5: 4.8403 | W5: 33.27 | X5: 8 | Y5: 4.7976000000000001 | Z5: 35.65 | AA5: =+Z5+W5+T5+Q5+N5+K5+H5+E5 -> 272.01 | AB5: =+(Y5+V5+S5+P5+M5+J5+G5+D5)/8 -> 4.702375 | AC5: =MINA(Y5,V5,S5,P5,M5,J5,G5,D5) -> 4.5907999999999998
A6: 4 | B6: 130-THIELO | C6: 8 | D6: 4.8273999999999999 | E6: 34.22 | F6: 6 | G6: 4.8651999999999997 | H6: 36.07 | I6: 4 | J6: 4.7515999999999998 | K6: 34.61 | L6: 2 | M6: 4.8601000000000001 | N6: 34.06 | O6: 1 | P6: 4.8009000000000004 | Q6: 26.12 | R6: 3 | S6: 4.8468 | T6: 36.32 | U6: 5 | V6: 4.8285 | W6: 31.35 | X6: 7 | Y6: 4.8305999999999996 | Z6: 33.47 | AA6: =+Z6+W6+T6+Q6+N6+K6+H6+E6 -> 266.22 | AB6: =+(Y6+V6+S6+P6+M6+J6+G6+D6)/8 -> 4.8263874999999992 | AC6: =MINA(Y6,V6,S6,P6,M6,J6,G6,D6) -> 4.7515999999999998
A7: 5 | B7: 106-DELGRAN | C7: 1 | D7: 4.7150999999999996 | E7: 35.49 | F7: 3 | G7: 4.8807 | H7: 36.31 | I7: 5 | J7: 4.7708000000000004 | K7: 38.54 | L7: 7 | M7: 4.859 | N7: 26.45 | O7: 8 | P7: 4.8692000000000002 | Q7: 36.14 | R7: 6 | S7: 4.7702999999999998 | T7: 33.78 | U7: 4 | V7: 4.6208 | W7: 31.78 | X7: 2 | Y7: 4.8403999999999998 | Z7: 25 | AA7: =+Z7+W7+T7+Q7+N7+K7+H7+E7 -> 263.49 | AB7: =+(Y7+V7+S7+P7+M7+J7+G7+D7)/8 -> 4.7907874999999995 | AC7: =MINA(Y7,V7,S7,P7,M7,J7,G7,D7) -> 4.6208
B9: 2 Bateria
A10: Pos | B10: Piloto | C10: Pi | D10: Tempo | E10: Vol | F10: Pi | G10: Tempo | H10: Vol | I10: Pi | J10: Tempo | K10: Vol | L10: Pi | M10: Tempo | N10: Vol | O10: Pi | P10: Tempo | Q10: Vol | R10: Pi | S10: Tempo | T10: Vol | U10: Pi | V10: Tempo | W10: Vol | X10: Pi | Y10: Tempo | Z10: Vol | AA10: Total | AB10: Media | AC10: Record
A11: 1 | B11: 188-DINHO | C11: 4 | D11: 4.3040000000000003 | E11: 39.8 | F11: 2 | G11: 4.4001999999999999 | H11: 39.83 | I11: 1 | J11: 4.4005000000000001 | K11: 35.85 | L11: 3 | M11: 4.2911999999999999 | N11: 39.76 | O11: 5 | P11: 4.3874000000000004 | Q11: 39.34 | R11: 7 | S11: 4.3992000000000004 | T11: 39.49 | U11: 8 | V11: 4.3992000000000004 | W11: 38.74 | X11: 6 | Y11: 4.3979999999999997 | Z11: 37.05 | AA11: =+Z11+W11+T11+Q11+N11+K11+H11+E11 -> 309.86 | AB11: =+(Y11+V11+S11+P11+M11+J11+G11+D11)/8 -> 4.3724625000000001 | AC11: =MINA(Y11,V11,S11,P11,M11,J11,G11,D11) -> 4.2911999999999999
A12: 2 | B12: 186-MICHEL | C12: 3 | D12: 4.4002999999999997 | E12: 38.27 | F12: 5 | G12: 4.4001000000000001 | H12: 39.47 | I12: 7 | J12: 4.3992000000000004 | K12: 39.53 | L12: 8 | M12: 4.3994999999999997 | N12: 39.6 | O12: 6 | P12: 4.3879000000000001 | Q12: 38.48 | R12: 4 | S12: 4.3856999999999999 | T12: 39.27 | U12: 2 | V12: 4.4005000000000001 | W12: 38.58 | X12: 1 | Y12: 4.6056999999999997 | Z12: 36.06 | AA12: =+Z12+W12+T12+Q12+N12+K12+H12+E12 -> 309.26 | AB12: =+(Y12+V12+S12+P12+M12+J12+G12+D12)/8 -> 4.4223625000000002 | AC12: =MINA(Y12,V12,S12,P12,M12,J12,G12,D12) -> 4.3856999999999999
A13: 3 | B13: 116-BONGA | C13: 7 | D13: 4.6189999999999998 | E13: 36.9 | F13: 8 | G13: 4.3996000000000004 | H13: 39.25 | I13: 6 | J13: 4.5713999999999997 | K13: 38.78 | L13: 4 | M13: 4.18 | N13: 40.2 | O13: 2 | P13: 4.3981000000000003 | Q13: 37.87 | R13: 1 | S13: 4.3875999999999999 | T13: 38.02 | U13: 3 | V13: 4.4001999999999999 | W13: 38.08 | X13: 5 | Y13: 4.4002999999999997 | Z13: 37.56 | AA13: =+Z13+W13+T13+Q13+N13+K13+H13+E13 -> 306.66 | AB13: =+(Y13+V13+S13+P13+M13+J13+G13+D13)/8 -> 4.4195250000000001 | AC13: =MINA(Y13,V13,S13,P13,M13,J13,G13,D13) -> 4.18
A14: 4 | B14: 36-NAN | C14: 2 | D14: 4.61 | E14: 35.16 | F14: 1 | G14: 4.7855999999999996 | H14: 35.27 | I14: 3 | J14: 4.3989000000000003 | K14: 37.76 | L14: 5 | M14: 4.6082000000000001 | N14: 37.5 | O14: 7 | P14: 4.6182999999999996 | Q14: 36.65 | R14: 8 | S14: 4.8406000000000002 | T14: 33.85 | U14: 6 | V14: 4.6200999999999999 | W14: 36.27 | X14: 4 | Y14: 4.6201999999999996 | Z14: 37.49 | AA14: =+Z14+W14+T14+Q14+N14+K14+H14+E14 -> 289.95 | AB14: =+(Y14+V14+S14+P14+M14+J14+G14+D14)/8 -> 4.6377375000000001 | AC14: =MINA(Y14,V14,S14,P14,M14,J14,G14,D14) -> 4.3989000000000003
A15: 5 | B15: 228-SAPAO | C15: 6 | D15: 4.4002999999999997 | E15: 34.63 | F15: 4 | G15: 4.3997999999999999 | H15: 37.47 | I15: 2 | J15: 4.6060999999999996 | K15: 36.46 | L15: 1 | M15: 5.0606999999999998 | N15: 5 | O15: 3 | P15: 4.6196999999999999 | Q15: 37.27 | R15: 5 | S15: 4.5115999999999996 | T15: 37.67 | U15: 7 | V15: 4.6197999999999997 | W15: 35.78 | X15: 8 | Y15: 4.8404999999999996 | Z15: 34.27 | AA15: =+Z15+W15+T15+Q15+N15+K15+H15+E15 -> 258.55 | AB15: =+(Y15+V15+S15+P15+M15+J15+G15+D15)/8 -> 4.6323125000000003 | AC15: =MINA(Y15,V15,S15,P15,M15,J15,G15,D15) -> 4.3997999999999999
B17: Geral
A18: Pos | B18: Piloto | C18: Pi | D18: Tempo | E18: Vol | F18: Pi | G18: Tempo | H18: Vol | I18: Pi | J18: Tempo | K18: Vol | L18: Pi | M18: Tempo | N18: Vol | O18: Pi | P18: Tempo | Q18: Vol | R18: Pi | S18: Tempo | T18: Vol | U18: Pi | V18: Tempo | W18: Vol | X18: Pi | Y18: Tempo | Z18: Vol | AA18: Total | AB18: Media | AC18: Record
A19: 1 | B19: 188-DINHO | C19: 4 | D19: 4.3040000000000003 | E19: 39.8 | F19: 2 | G19: 4.4001999999999999 | H19: 39.83 | I19: 1 | J19: 4.4005000000000001 | K19: 35.85 | L19: 3 | M19: 4.2911999999999999 | N19: 39.76 | O19: 5 | P19: 4.3874000000000004 | Q19: 39.34 | R19: 7 | S19: 4.3992000000000004 | T19: 39.49 | U19: 8 | V19: 4.3992000000000004 | W19: 38.74 | X19: 6 | Y19: 4.3979999999999997 | Z19: 37.05 | AA19: =+Z19+W19+T19+Q19+N19+K19+H19+E19 -> 309.86 | AB19: =+(Y19+V19+S19+P19+M19+J19+G19+D19)/8 -> 4.3724625000000001 | AC19: =MINA(Y19,V19,S19,P19,M19,J19,G19,D19) -> 4.2911999999999999
A20: 2 | B20: 186-MICHEL | C20: 3 | D20: 4.4002999999999997 | E20: 38.27 | F20: 5 | G20: 4.4001000000000001 | H20: 39.47 | I20: 7 | J20: 4.3992000000000004 | K20: 39.53 | L20: 8 | M20: 4.3994999999999997 | N20: 39.6 | O20: 6 | P20: 4.3879000000000001 | Q20: 38.48 | R20: 4 | S20: 4.3856999999999999 | T20: 39.27 | U20: 2 | V20: 4.4005000000000001 | W20: 38.58 | X20: 1 | Y20: 4.6056999999999997 | Z20: 36.06 | AA20: =+Z20+W20+T20+Q20+N20+K20+H20+E20 -> 309.26 | AB20: =+(Y20+V20+S20+P20+M20+J20+G20+D20)/8 -> 4.4223625000000002 | AC20: =MINA(Y20,V20,S20,P20,M20,J20,G20,D20) -> 4.3856999999999999
A21: 3 | B21: 116-BONGA | C21: 7 | D21: 4.6189999999999998 | E21: 36.9 | F21: 8 | G21: 4.3996000000000004 | H21: 39.25 | I21: 6 | J21: 4.5713999999999997 | K21: 38.78 | L21: 4 | M21: 4.18 | N21: 40.2 | O21: 2 | P21: 4.3981000000000003 | Q21: 37.87 | R21: 1 | S21: 4.3875999999999999 | T21: 38.02 | U21: 3 | V21: 4.4001999999999999 | W21: 38.08 | X21: 5 | Y21: 4.4002999999999997 | Z21: 37.56 | AA21: =+Z21+W21+T21+Q21+N21+K21+H21+E21 -> 306.66 | AB21: =+(Y21+V21+S21+P21+M21+J21+G21+D21)/8 -> 4.4195250000000001 | AC21: =MINA(Y21,V21,S21,P21,M21,J21,G21,D21) -> 4.18
A22: 4 | B22: 36-NAN | C22: 2 | D22: 4.61 | E22: 35.16 | F22: 1 | G22: 4.7855999999999996 | H22: 35.27 | I22: 3 | J22: 4.3989000000000003 | K22: 37.76 | L22: 5 | M22: 4.6082000000000001 | N22: 37.5 | O22: 7 | P22: 4.6182999999999996 | Q22: 36.65 | R22: 8 | S22: 4.8406000000000002 | T22: 33.85 | U22: 6 | V22: 4.6200999999999999 | W22: 36.27 | X22: 4 | Y22: 4.6201999999999996 | Z22: 37.49 | AA22: =+Z22+W22+T22+Q22+N22+K22+H22+E22 -> 289.95 | AB22: =+(Y22+V22+S22+P22+M22+J22+G22+D22)/8 -> 4.6377375000000001 | AC22: =MINA(Y22,V22,S22,P22,M22,J22,G22,D22) -> 4.3989000000000003
A23: 5 | B23: 27-DOUGLAS | C23: 7 | D23: 4.2168000000000001 | E23: 35.05 | F23: 8 | G23: 4.2657999999999996 | H23: 36.46 | I23: 6 | J23: 4.2930999999999999 | K23: 36.48 | L23: 4 | M23: 4.3612000000000002 | N23: 37.57 | O23: 2 | P23: 4.4043999999999999 | Q23: 36.71 | R23: 1 | S23: 4.2613000000000003 | T23: 35.27 | U23: 3 | V23: 4.8387000000000002 | W23: 36.25 | X23: 5 | Y23: 5.0495999999999999 | Z23: 32.94 | AA23: =+Z23+W23+T23+Q23+N23+K23+H23+E23 -> 286.73 | AB23: =+(Y23+V23+S23+P23+M23+J23+G23+D23)/8 -> 4.4613624999999999 | AC23: =MINA(Y23,V23,S23,P23,M23,J23,G23,D23) -> 4.2168000000000001
A24: 6 | B24: 35-BIG | C24: 2 | D24: 4.3994999999999997 | E24: 32.06 | F24: 1 | G24: 4.4157000000000002 | H24: 35.04 | I24: 3 | J24: 4.4157999999999999 | K24: 36.49 | L24: 5 | M24: 4.7961 | N24: 35.01 | O24: 7 | P24: 4.6144999999999996 | Q24: 37.4 | R24: 8 | S24: 4.6055000000000001 | T24: 37.46 | U24: 6 | V24: 4.4008000000000003 | W24: 35.55 | X24: 4 | Y24: 4.5768000000000004 | Z24: 30.61 | AA24: =+Z24+W24+T24+Q24+N24+K24+H24+E24 -> 279.62 | AB24: =+(Y24+V24+S24+P24+M24+J24+G24+D24)/8 -> 4.5280874999999998 | AC24: =MINA(Y24,V24,S24,P24,M24,J24,G24,D24) -> 4.3994999999999997
A25: 7 | B25: 8-LAERTE | C25: 6 | D25: 4.5907999999999998 | E25: 32.46 | F25: 4 | G25: 4.6584000000000003 | H25: 35.45 | I25: 2 | J25: 4.5918000000000001 | K25: 34.65 | L25: 1 | M25: 4.6773999999999996 | N25: 30.14 | O25: 3 | P25: 4.7575000000000003 | Q25: 37.77 | R25: 5 | S25: 4.7051999999999996 | T25: 32.62 | U25: 7 | V25: 4.8403 | W25: 33.27 | X25: 8 | Y25: 4.7976000000000001 | Z25: 35.65 | AA25: =+Z25+W25+T25+Q25+N25+K25+H25+E25 -> 272.01 | AB25: =+(Y25+V25+S25+P25+M25+J25+G25+D25)/8 -> 4.702375 | AC25: =MINA(Y25,V25,S25,P25,M25,J25,G25,D25) -> 4.5907999999999998
A26: 8 | B26: 130-THIELO | C26: 8 | D26: 4.8273999999999999 | E26: 34.22 | F26: 6 | G26: 4.8651999999999997 | H26: 36.07 | I26: 4 | J26: 4.7515999999999998 | K26: 34.61 | L26: 2 | M26: 4.8601000000000001 | N26: 34.06 | O26: 1 | P26: 4.8009000000000004 | Q26: 26.12 | R26: 3 | S26: 4.8468 | T26: 36.32 | U26: 5 | V26: 4.8285 | W26: 31.35 | X26: 7 | Y26: 4.8305999999999996 | Z26: 33.47 | AA26: =+Z26+W26+T26+Q26+N26+K26+H26+E26 -> 266.22 | AB26: =+(Y26+V26+S26+P26+M26+J26+G26+D26)/8 -> 4.8263874999999992 | AC26: =MINA(Y26,V26,S26,P26,M26,J26,G26,D26) -> 4.7515999999999998
A27: 9 | B27: 106-DELGRAN | C27: 1 | D27: 4.7150999999999996 | E27: 35.49 | F27: 3 | G27: 4.8807 | H27: 36.31 | I27: 5 | J27: 4.7708000000000004 | K27: 38.54 | L27: 7 | M27: 4.859 | N27: 26.45 | O27: 8 | P27: 4.8692000000000002 | Q27: 36.14 | R27: 6 | S27: 4.7702999999999998 | T27: 33.78 | U27: 4 | V27: 4.6208 | W27: 31.78 | X27: 2 | Y27: 4.8403999999999998 | Z27: 25 | AA27: =+Z27+W27+T27+Q27+N27+K27+H27+E27 -> 263.49 | AB27: =+(Y27+V27+S27+P27+M27+J27+G27+D27)/8 -> 4.7907874999999995 | AC27: =MINA(Y27,V27,S27,P27,M27,J27,G27,D27) -> 4.6208
A28: 10 | B28: 228-SAPAO | C28: 6 | D28: 4.4002999999999997 | E28: 34.63 | F28: 4 | G28: 4.3997999999999999 | H28: 37.47 | I28: 2 | J28: 4.6060999999999996 | K28: 36.46 | L28: 1 | M28: 5.0606999999999998 | N28: 5 | O28: 3 | P28: 4.6196999999999999 | Q28: 37.27 | R28: 5 | S28: 4.5115999999999996 | T28: 37.67 | U28: 7 | V28: 4.6197999999999997 | W28: 35.78 | X28: 8 | Y28: 4.8404999999999996 | Z28: 34.27 | AA28: =+Z28+W28+T28+Q28+N28+K28+H28+E28 -> 258.55 | AB28: =+(Y28+V28+S28+P28+M28+J28+G28+D28)/8 -> 4.6323125000000003 | AC28: =MINA(Y28,V28,S28,P28,M28,J28,G28,D28) -> 4.3997999999999999