A1: Categoria Junior | B1: Categoria Graduados | C1: Categoria Aspirantes

B1: 1 Bateria
A2: Pos | B2: Piloto | C2: Pi | D2: Tempo | E2: Vol | F2: Pi | G2: Tempo | H2: Vol | I2: Pi | J2: Tempo | K2: Vol | L2: Pi | M2: Tempo | N2: Vol | O2: Pi | P2: Tempo | Q2: Vol | R2: Pi | S2: Tempo | T2: Vol | U2: Pi | V2: Tempo | W2: Vol | X2: Pi | Y2: Tempo | Z2: Vol | AA2: Total | AB2: Media | AC2: Record
A3: 1 | B3: CUCA | C3: 4 | D3: 4.5655000000000001 | E3: 35.5 | F3: 2 | G3: 4.8403 | H3: 18.09 | I3: 1 | J3: 4.8376999999999999 | K3: 32.74 | L3: 3 | M3: 4.8242000000000003 | N3: 34.8 | O3: 5 | P3: 4.6201999999999996 | Q3: 33.46 | R3: 7 | S3: 4.7304000000000004 | T3: 36.28 | U3: 8 | V3: 4.8395000000000001 | W3: 35.28 | X3: 6 | Y3: 4.84 | Z3: 35.02 | AA3: =+Z3+W3+T3+Q3+N3+K3+H3+E3 -> 261.17 | AB3: =+(Y3+V3+S3+P3+M3+J3+G3+D3)/8 -> 4.7622249999999999 | AC3: =MINA(Y3,V3,S3,P3,M3,J3,G3,D3) -> 4.5655000000000001
A4: 2 | B4: MATHEUS | C4: 1 | D4: 4.6753999999999998 | E4: 30.78 | F4: 3 | G4: 5.0605000000000002 | H4: 27.33 | I4: 5 | J4: 5.0594999999999999 | K4: 29.44 | L4: 7 | M4: 4.8249000000000004 | N4: 34.63 | O4: 8 | P4: 4.7275999999999998 | Q4: 31.41 | R4: 6 | S4: 4.8398000000000003 | T4: 35.65 | U4: 4 | V4: 5.1708999999999996 | W4: 30.62 | X4: 2 | Y4: 4.7316000000000003 | Z4: 31.16 | AA4: =+Z4+W4+T4+Q4+N4+K4+H4+E4 -> 251.02 | AB4: =+(Y4+V4+S4+P4+M4+J4+G4+D4)/8 -> 4.8862749999999995 | AC4: =MINA(Y4,V4,S4,P4,M4,J4,G4,D4) -> 4.6753999999999998
A5: 3 | B5: FELIPE DG | C5: 2 | D5: 4.8301999999999996 | E5: 32.46 | F5: 1 | G5: 5.1169000000000002 | H5: 28.13 | I5: 3 | J5: 4.6044999999999998 | K5: 31.29 | L5: 5 | M5: 4.6193999999999997 | N5: 33.45 | O5: 7 | P5: 4.8418999999999999 | Q5: 29.27 | R5: 8 | S5: 5.0572999999999997 | T5: 29.51 | U5: 6 | V5: 4.7835999999999999 | W5: 33.86 | X5: 4 | Y5: 4.6204999999999998 | Z5: 29.05 | AA5: =+Z5+W5+T5+Q5+N5+K5+H5+E5 -> 247.02 | AB5: =+(Y5+V5+S5+P5+M5+J5+G5+D5)/8 -> 4.8092874999999999 | AC5: =MINA(Y5,V5,S5,P5,M5,J5,G5,D5) -> 4.6044999999999998
A6: 4 | B6: LUIZ | C6: 5 | D6: 5.3395999999999999 | E6: 26.52 | F6: 7 | G6: 5.3348000000000004 | H6: 27.18 | I6: 8 | J6: 5.2717999999999998 | K6: 27.46 | L6: 6 | M6: 5.0602 | N6: 31.21 | O6: 4 | P6: 5.6113999999999997 | Q6: 22.24 | R6: 2 | S6: 4.8396999999999997 | T6: 29.2 | U6: 1 | V6: 5.4989999999999997 | W6: 27.21 | X6: 3 | Y6: 5.28 | Z6: 26.61 | AA6: =+Z6+W6+T6+Q6+N6+K6+H6+E6 -> 217.63 | AB6: =+(Y6+V6+S6+P6+M6+J6+G6+D6)/8 -> 5.2795624999999999 | AC6: =MINA(Y6,V6,S6,P6,M6,J6,G6,D6) -> 4.8396999999999997
A7: 5 | B7: LEO | C7: 7 | D7: 5.6700999999999997 | E7: 20.21 | F7: 8 | G7: 5.7201000000000004 | H7: 22.73 | I7: 6 | J7: 6.0349000000000004 | K7: 22.77 | L7: 4 | M7: 5.7096999999999998 | N7: 25.09 | O7: 2 | P7: 5.7744999999999997 | Q7: 22.73 | R7: 1 | S7: 5.9424999999999999 | T7: 24.82 | U7: 3 | V7: 5.5391000000000004 | W7: 23.85 | X7: 5 | Y7: 5.5004999999999997 | Z7: 23.43 | AA7: =+Z7+W7+T7+Q7+N7+K7+H7+E7 -> 185.63 | AB7: =+(Y7+V7+S7+P7+M7+J7+G7+D7)/8 -> 5.7364249999999997 | AC7: =MINA(Y7,V7,S7,P7,M7,J7,G7,D7) -> 5.5004999999999997
B9: 2 Bateria
A10: Pos | B10: Piloto | C10: Pi | D10: Tempo | E10: Vol | F10: Pi | G10: Tempo | H10: Vol | I10: Pi | J10: Tempo | K10: Vol | L10: Pi | M10: Tempo | N10: Vol | O10: Pi | P10: Tempo | Q10: Vol | R10: Pi | S10: Tempo | T10: Vol | U10: Pi | V10: Tempo | W10: Vol | X10: Pi | Y10: Tempo | Z10: Vol | AA10: Total | AB10: Media | AC10: Record
A11: 1 | B11: FORMIGA | C11: 7 | D11: 4.8392999999999997 | E11: 32.86 | F11: 8 | G11: 4.8395000000000001 | H11: 35.18 | I11: 6 | J11: 4.6228999999999996 | K11: 35.39 | L11: 4 | M11: 4.6257999999999999 | N11: 34.62 | O11: 2 | P11: 4.6105999999999998 | Q11: 36.85 | R11: 1 | S11: 4.8407 | T11: 34.51 | U11: 3 | V11: 4.6741999999999999 | W11: 35.68 | X11: 5 | Y11: 4.7313999999999998 | Z11: 35.22 | AA11: =+Z11+W11+T11+Q11+N11+K11+H11+E11 -> 280.31 | AB11: =+(Y11+V11+S11+P11+M11+J11+G11+D11)/8 -> 4.7230500000000006 | AC11: =MINA(Y11,V11,S11,P11,M11,J11,G11,D11) -> 4.6105999999999998
A12: 2 | B12: ZOPPA | C12: 3 | D12: 4.8403999999999998 | E12: 33.36 | F12: 5 | G12: 5.0458999999999996 | H12: 34.69 | I12: 7 | J12: 4.6208 | K12: 35.2 | L12: 8 | M12: 4.8403999999999998 | N12: 34.49 | O12: 6 | P12: 4.6132999999999997 | Q12: 36.58 | R12: 4 | S12: 4.8365999999999998 | T12: 34.6 | U12: 2 | V12: 4.7972999999999999 | W12: 34.26 | X12: 1 | Y12: 5.1250999999999998 | Z12: 30.21 | AA12: =+Z12+W12+T12+Q12+N12+K12+H12+E12 -> 273.39 | AB12: =+(Y12+V12+S12+P12+M12+J12+G12+D12)/8 -> 4.8399749999999999 | AC12: =MINA(Y12,V12,S12,P12,M12,J12,G12,D12) -> 4.6132999999999997
A13: 3 | B13: CASSIANO | C13: 1 | D13: 4.8394000000000004 | E13: 31.32 | F13: 3 | G13: 4.6083999999999996 | H13: 31.05 | I13: 5 | J13: 4.8956999999999997 | K13: 31.28 | L13: 7 | M13: 4.6201999999999996 | N13: 33.8 | O13: 8 | P13: 4.5664999999999996 | Q13: 36.49 | R13: 6 | S13: 4.6154999999999999 | T13: 33.93 | U13: 4 | V13: 4.5114999999999998 | W13: 34.73 | X13: 2 | Y13: 4.4947999999999997 | Z13: 35.26 | AA13: =+Z13+W13+T13+Q13+N13+K13+H13+E13 -> 267.86 | AB13: =+(Y13+V13+S13+P13+M13+J13+G13+D13)/8 -> 4.6440000000000001 | AC13: =MINA(Y13,V13,S13,P13,M13,J13,G13,D13) -> 4.4947999999999997
A14: 4 | B14: JIMMY | C14: 2 | D14: 4.6219000000000001 | E14: 32.34 | F14: 1 | G14: 5.0603999999999996 | H14: 30.62 | I14: 3 | J14: 4.6204000000000001 | K14: 35.69 | L14: 5 | M14: 4.84 | N14: 34.11 | O14: 7 | P14: 4.6059999999999999 | Q14: 33.51 | R14: 8 | S14: 4.8357000000000001 | T14: 33.88 | U14: 6 | V14: 4.6199000000000003 | W14: 32.36 | X14: 4 | Y14: 4.6321000000000003 | Z14: 33.76 | AA14: =+Z14+W14+T14+Q14+N14+K14+H14+E14 -> 266.27 | AB14: =+(Y14+V14+S14+P14+M14+J14+G14+D14)/8 -> 4.7295499999999997 | AC14: =MINA(Y14,V14,S14,P14,M14,J14,G14,D14) -> 4.6059999999999999
A15: 5 | B15: SHADOW BOY | C15: 6 | D15: 6.1646999999999998 | E15: 21.2 | F15: 4 | G15: 7.5355999999999996 | H15: 19.26 | I15: 2 | J15: 5.9946000000000002 | K15: 24.79 | L15: 1 | M15: 6.5952999999999999 | N15: 16.34 | O15: 3 | P15: 6.4348999999999998 | Q15: 18.48 | R15: 5 | S15: 6.1566999999999998 | T15: 19.64 | U15: 7 | V15: 6.218 | W15: 21.9 | X15: 8 | Y15: 6.3800999999999997 | Z15: 16.24 | AA15: =+Z15+W15+T15+Q15+N15+K15+H15+E15 -> 157.85 | AB15: =+(Y15+V15+S15+P15+M15+J15+G15+D15)/8 -> 6.4349875000000001 | AC15: =MINA(Y15,V15,S15,P15,M15,J15,G15,D15) -> 5.9946000000000002
B17: Geral Junior
A18: Pos | B18: Piloto | C18: Pi | D18: Tempo | E18: Vol | F18: Pi | G18: Tempo | H18: Vol | I18: Pi | J18: Tempo | K18: Vol | L18: Pi | M18: Tempo | N18: Vol | O18: Pi | P18: Tempo | Q18: Vol | R18: Pi | S18: Tempo | T18: Vol | U18: Pi | V18: Tempo | W18: Vol | X18: Pi | Y18: Tempo | Z18: Vol | AA18: Total | AB18: Media | AC18: Record
A19: 1 | B19: FORMIGA | C19: 7 | D19: 4.8392999999999997 | E19: 32.86 | F19: 8 | G19: 4.8395000000000001 | H19: 35.18 | I19: 6 | J19: 4.6228999999999996 | K19: 35.39 | L19: 4 | M19: 4.6257999999999999 | N19: 34.62 | O19: 2 | P19: 4.6105999999999998 | Q19: 36.85 | R19: 1 | S19: 4.8407 | T19: 34.51 | U19: 3 | V19: 4.6741999999999999 | W19: 35.68 | X19: 5 | Y19: 4.7313999999999998 | Z19: 35.22 | AA19: =+Z19+W19+T19+Q19+N19+K19+H19+E19 -> 280.31 | AB19: =+(Y19+V19+S19+P19+M19+J19+G19+D19)/8 -> 4.7230500000000006 | AC19: =MINA(Y19,V19,S19,P19,M19,J19,G19,D19) -> 4.6105999999999998
A20: 2 | B20: ZOPPA | C20: 3 | D20: 4.8403999999999998 | E20: 33.36 | F20: 5 | G20: 5.0458999999999996 | H20: 34.69 | I20: 7 | J20: 4.6208 | K20: 35.2 | L20: 8 | M20: 4.8403999999999998 | N20: 34.49 | O20: 6 | P20: 4.6132999999999997 | Q20: 36.58 | R20: 4 | S20: 4.8365999999999998 | T20: 34.6 | U20: 2 | V20: 4.7972999999999999 | W20: 34.26 | X20: 1 | Y20: 5.1250999999999998 | Z20: 30.21 | AA20: =+Z20+W20+T20+Q20+N20+K20+H20+E20 -> 273.39 | AB20: =+(Y20+V20+S20+P20+M20+J20+G20+D20)/8 -> 4.8399749999999999 | AC20: =MINA(Y20,V20,S20,P20,M20,J20,G20,D20) -> 4.6132999999999997
A21: 3 | B21: CASSIANO | C21: 1 | D21: 4.8394000000000004 | E21: 31.32 | F21: 3 | G21: 4.6083999999999996 | H21: 31.05 | I21: 5 | J21: 4.8956999999999997 | K21: 31.28 | L21: 7 | M21: 4.6201999999999996 | N21: 33.8 | O21: 8 | P21: 4.5664999999999996 | Q21: 36.49 | R21: 6 | S21: 4.6154999999999999 | T21: 33.93 | U21: 4 | V21: 4.5114999999999998 | W21: 34.73 | X21: 2 | Y21: 4.4947999999999997 | Z21: 35.26 | AA21: =+Z21+W21+T21+Q21+N21+K21+H21+E21 -> 267.86 | AB21: =+(Y21+V21+S21+P21+M21+J21+G21+D21)/8 -> 4.6440000000000001 | AC21: =MINA(Y21,V21,S21,P21,M21,J21,G21,D21) -> 4.4947999999999997
A22: 4 | B22: JIMMY | C22: 2 | D22: 4.6219000000000001 | E22: 32.34 | F22: 1 | G22: 5.0603999999999996 | H22: 30.62 | I22: 3 | J22: 4.6204000000000001 | K22: 35.69 | L22: 5 | M22: 4.84 | N22: 34.11 | O22: 7 | P22: 4.6059999999999999 | Q22: 33.51 | R22: 8 | S22: 4.8357000000000001 | T22: 33.88 | U22: 6 | V22: 4.6199000000000003 | W22: 32.36 | X22: 4 | Y22: 4.6321000000000003 | Z22: 33.76 | AA22: =+Z22+W22+T22+Q22+N22+K22+H22+E22 -> 266.27 | AB22: =+(Y22+V22+S22+P22+M22+J22+G22+D22)/8 -> 4.7295499999999997 | AC22: =MINA(Y22,V22,S22,P22,M22,J22,G22,D22) -> 4.6059999999999999
A23: 5 | B23: CUCA | C23: 4 | D23: 4.5655000000000001 | E23: 35.5 | F23: 2 | G23: 4.8403 | H23: 18.09 | I23: 1 | J23: 4.8376999999999999 | K23: 32.74 | L23: 3 | M23: 4.8242000000000003 | N23: 34.8 | O23: 5 | P23: 4.6201999999999996 | Q23: 33.46 | R23: 7 | S23: 4.7304000000000004 | T23: 36.28 | U23: 8 | V23: 4.8395000000000001 | W23: 35.28 | X23: 6 | Y23: 4.84 | Z23: 35.02 | AA23: =+Z23+W23+T23+Q23+N23+K23+H23+E23 -> 261.17 | AB23: =+(Y23+V23+S23+P23+M23+J23+G23+D23)/8 -> 4.7622249999999999 | AC23: =MINA(Y23,V23,S23,P23,M23,J23,G23,D23) -> 4.5655000000000001
A24: 6 | B24: MATHEUS | C24: 1 | D24: 4.6753999999999998 | E24: 30.78 | F24: 3 | G24: 5.0605000000000002 | H24: 27.33 | I24: 5 | J24: 5.0594999999999999 | K24: 29.44 | L24: 7 | M24: 4.8249000000000004 | N24: 34.63 | O24: 8 | P24: 4.7275999999999998 | Q24: 31.41 | R24: 6 | S24: 4.8398000000000003 | T24: 35.65 | U24: 4 | V24: 5.1708999999999996 | W24: 30.62 | X24: 2 | Y24: 4.7316000000000003 | Z24: 31.16 | AA24: =+Z24+W24+T24+Q24+N24+K24+H24+E24 -> 251.02 | AB24: =+(Y24+V24+S24+P24+M24+J24+G24+D24)/8 -> 4.8862749999999995 | AC24: =MINA(Y24,V24,S24,P24,M24,J24,G24,D24) -> 4.6753999999999998
A25: 7 | B25: FELIPE DG | C25: 2 | D25: 4.8301999999999996 | E25: 32.46 | F25: 1 | G25: 5.1169000000000002 | H25: 28.13 | I25: 3 | J25: 4.6044999999999998 | K25: 31.29 | L25: 5 | M25: 4.6193999999999997 | N25: 33.45 | O25: 7 | P25: 4.8418999999999999 | Q25: 29.27 | R25: 8 | S25: 5.0572999999999997 | T25: 29.51 | U25: 6 | V25: 4.7835999999999999 | W25: 33.86 | X25: 4 | Y25: 4.6204999999999998 | Z25: 29.05 | AA25: =+Z25+W25+T25+Q25+N25+K25+H25+E25 -> 247.02 | AB25: =+(Y25+V25+S25+P25+M25+J25+G25+D25)/8 -> 4.8092874999999999 | AC25: =MINA(Y25,V25,S25,P25,M25,J25,G25,D25) -> 4.6044999999999998
A26: 8 | B26: LUIZ | C26: 5 | D26: 5.3395999999999999 | E26: 26.52 | F26: 7 | G26: 5.3348000000000004 | H26: 27.18 | I26: 8 | J26: 5.2717999999999998 | K26: 27.46 | L26: 6 | M26: 5.0602 | N26: 31.21 | O26: 4 | P26: 5.6113999999999997 | Q26: 22.24 | R26: 2 | S26: 4.8396999999999997 | T26: 29.2 | U26: 1 | V26: 5.4989999999999997 | W26: 27.21 | X26: 3 | Y26: 5.28 | Z26: 26.61 | AA26: =+Z26+W26+T26+Q26+N26+K26+H26+E26 -> 217.63 | AB26: =+(Y26+V26+S26+P26+M26+J26+G26+D26)/8 -> 5.2795624999999999 | AC26: =MINA(Y26,V26,S26,P26,M26,J26,G26,D26) -> 4.8396999999999997
A27: 9 | B27: LEO | C27: 7 | D27: 5.6700999999999997 | E27: 20.21 | F27: 8 | G27: 5.7201000000000004 | H27: 22.73 | I27: 6 | J27: 6.0349000000000004 | K27: 22.77 | L27: 4 | M27: 5.7096999999999998 | N27: 25.09 | O27: 2 | P27: 5.7744999999999997 | Q27: 22.73 | R27: 1 | S27: 5.9424999999999999 | T27: 24.82 | U27: 3 | V27: 5.5391000000000004 | W27: 23.85 | X27: 5 | Y27: 5.5004999999999997 | Z27: 23.43 | AA27: =+Z27+W27+T27+Q27+N27+K27+H27+E27 -> 185.63 | AB27: =+(Y27+V27+S27+P27+M27+J27+G27+D27)/8 -> 5.7364249999999997 | AC27: =MINA(Y27,V27,S27,P27,M27,J27,G27,D27) -> 5.5004999999999997
A28: 10 | B28: SHADOW BOY | C28: 6 | D28: 6.1646999999999998 | E28: 21.2 | F28: 4 | G28: 7.5355999999999996 | H28: 19.26 | I28: 2 | J28: 5.9946000000000002 | K28: 24.79 | L28: 1 | M28: 6.5952999999999999 | N28: 16.34 | O28: 3 | P28: 6.4348999999999998 | Q28: 18.48 | R28: 5 | S28: 6.1566999999999998 | T28: 19.64 | U28: 7 | V28: 6.218 | W28: 21.9 | X28: 8 | Y28: 6.3800999999999997 | Z28: 16.24 | AA28: =+Z28+W28+T28+Q28+N28+K28+H28+E28 -> 157.85 | AB28: =+(Y28+V28+S28+P28+M28+J28+G28+D28)/8 -> 6.4349875000000001 | AC28: =MINA(Y28,V28,S28,P28,M28,J28,G28,D28) -> 5.9946000000000002