A1: R$14,99 mussarela, catupiry, buon gustaio, toscanela, calabresa (preço para retirar no balcão) | C1: R$14,99 mussarela, catupiry, buon gustaio, toscanela, calabresa (preço para retirar no balcão)

A1: Pilotos | B1: Pis | C1: Tempo | D1: Vol | E1: Pis | F1: Tempo | G1: Vol | H1: Pis | I1: Tempo | J1: Vol | K1: Pis | L1: Tempo | M1: Vol | N1: Pis | O1: Tempo | P1: Vol | Q1: Pis | R1: Tempo | S1: Vol | T1: Pis | U1: Tempo | V1: Vol | W1: Pis | X1: Tempo | Y1: Vol | Z1: Total | AA1: Media | AB1: Record
A2: JERA | B2: 1 | C2: 3.7949999999999999 | D2: 38 | E2: 3 | F2: 3.9590000000000001 | G2: 36 | H2: 5 | I2: 3.96 | J2: 41 | K2: 7 | L2: 3.95 | M2: 41 | N2: 8 | O2: 3.9319999999999999 | P2: 42 | Q2: 6 | R2: 3.9510000000000001 | S2: 42 | T2: 4 | U2: 3.7959999999999998 | V2: 43 | W2: 2 | X2: 3.7309999999999999 | Y2: 42 | Z2: =+Y2+V2+S2+P2+M2+J2+G2+D2 -> 325 | AA2: =+(X2+U2+R2+O2+L2+I2+F2+C2)/8 -> 3.8842499999999998 | AB2: =MINA(X2,U2,R2,O2,L2,I2,F2,C2) -> 3.7309999999999999
A3: BONGA | B3: 3 | C3: 3.97 | D3: 40 | E3: 5 | F3: 4.0049999999999999 | G3: 37 | H3: 7 | I3: 3.9319999999999999 | J3: 41 | K3: 8 | L3: 4.0709999999999997 | M3: 39 | N3: 6 | O3: 3.9060000000000001 | P3: 41 | Q3: 4 | R3: 3.9359999999999999 | S3: 39 | T3: 2 | U3: 3.7669999999999999 | V3: 39 | W3: 1 | X3: 3.96 | Y3: 40 | Z3: =+Y3+V3+S3+P3+M3+J3+G3+D3 -> 316 | AA3: =+(X3+U3+R3+O3+L3+I3+F3+C3)/8 -> 3.9433749999999996 | AB3: =MINA(X3,U3,R3,O3,L3,I3,F3,C3) -> 3.7669999999999999
A4: MANO | B4: 5 | C4: 3.7919999999999998 | D4: 41 | E4: 7 | F4: 3.794 | G4: 36 | H4: 8 | I4: 3.7949999999999999 | J4: 39 | K4: 6 | L4: 3.8780000000000001 | M4: 39 | N4: 4 | O4: 4.0709999999999997 | P4: 37 | Q4: 2 | R4: 3.74 | S4: 40 | T4: 1 | U4: 3.85 | V4: 36 | W4: 3 | X4: 3.8250000000000002 | Y4: 34 | Z4: =+Y4+V4+S4+P4+M4+J4+G4+D4 -> 302 | AA4: =+(X4+U4+R4+O4+L4+I4+F4+C4)/8 -> 3.8431250000000001 | AB4: =MINA(X4,U4,R4,O4,L4,I4,F4,C4) -> 3.74
A5: GOROI | B5: 4 | C5: 3.9350000000000001 | D5: 39 | E5: 2 | F5: 3.74 | G5: 40 | H5: 1 | I5: 3.5209999999999999 | J5: 42 | K5: 3 | L5: 3.6579999999999999 | M5: 39 | N5: 5 | O5: 3.63 | P5: 43 | Q5: 7 | R5: 3.7490000000000001 | S5: 39 | T5: 8 | U5: 3.85 | V5: 40 | W5: 6 | X5: 3.7669999999999999 | Y5: 18 | Z5: =+Y5+V5+S5+P5+M5+J5+G5+D5 -> 300 | AA5: =+(X5+U5+R5+O5+L5+I5+F5+C5)/8 -> 3.7312500000000002 | AB5: =MINA(X5,U5,R5,O5,L5,I5,F5,C5) -> 3.5209999999999999
A6: DINHO | B6: 8 | C6: 4.2910000000000004 | D6: 36 | E6: 6 | F6: 4.234 | G6: 36 | H6: 4 | I6: 3.95 | J6: 40 | K6: 2 | L6: 4.1749999999999998 | M6: 37 | N6: 1 | O6: 3.9049999999999998 | P6: 40 | Q6: 3 | R6: 3.9319999999999999 | S6: 38 | T6: 5 | U6: 4.18 | V6: 36 | W6: 7 | X6: 4.07 | Y6: 35 | Z6: =+Y6+V6+S6+P6+M6+J6+G6+D6 -> 298 | AA6: =+(X6+U6+R6+O6+L6+I6+F6+C6)/8 -> 4.0921249999999993 | AB6: =MINA(X6,U6,R6,O6,L6,I6,F6,C6) -> 3.9049999999999998
A7: ERIC | B7: 2 | C7: 4.1340000000000003 | D7: 39 | E7: 1 | F7: 3.9590000000000001 | G7: 39 | H7: 3 | I7: 3.9689999999999999 | J7: 38 | K7: 5 | L7: 4.1710000000000003 | M7: 38 | N7: 7 | O7: 4.18 | P7: 36 | Q7: 8 | R7: 4.29 | S7: 34 | T7: 6 | U7: 4.125 | V7: 35 | W7: 4 | X7: 4.617 | Y7: 31 | Z7: =+Y7+V7+S7+P7+M7+J7+G7+D7 -> 290 | AA7: =+(X7+U7+R7+O7+L7+I7+F7+C7)/8 -> 4.180625 | AB7: =MINA(X7,U7,R7,O7,L7,I7,F7,C7) -> 3.9590000000000001
A8: MORTADELA | B8: 7 | C8: 4.2619999999999996 | D8: 38 | E8: 8 | F8: 4.4550000000000001 | G8: 33 | H8: 6 | I8: 4.18 | J8: 30 | K8: 4 | L8: 4.4089999999999998 | M8: 29 | N8: 2 | O8: 4.0609999999999999 | P8: 30 | Q8: 1 | R8: 4.069 | S8: 16 | T8: 3 | U8: 4.07 | V8: 38 | W8: 5 | X8: 4.18 | Y8: 35 | Z8: =+Y8+V8+S8+P8+M8+J8+G8+D8 -> 249 | AA8: =+(X8+U8+R8+O8+L8+I8+F8+C8)/8 -> 4.21075 | AB8: =MINA(X8,U8,R8,O8,L8,I8,F8,C8) -> 4.0609999999999999
A9: GABRIEL | B9: 6 | C9: 4.016 | D9: 34 | E9: 4 | F9: 3.8769999999999998 | G9: 39 | H9: 2 | I9: 3.794 | J9: 20 | K9: 1 | L9: 4.0990000000000002 | M9: 36 | N9: 3 | O9: 3.8050000000000002 | P9: 37 | Q9: 5 | R9: 4.069 | S9: 34 | T9: 7 | U9: 4.0709999999999997 | V9: 37 | W9: 8 | X9: 4.2080000000000002 | Y9: 9 | Z9: =+Y9+V9+S9+P9+M9+J9+G9+D9 -> 246 | AA9: =+(X9+U9+R9+O9+L9+I9+F9+C9)/8 -> 3.992375 | AB9: =MINA(X9,U9,R9,O9,L9,I9,F9,C9) -> 3.794