A1: Patrocinadores

B1: Motos e Acessórios Honda - Rua Sete de Setembro, 387 - Fone: (15) 3331-6700.

A1: 1 Bateria
A2: Piloto | B2: Pi | C2: Tempo | D2: Voltas | E2: Pi | F2: Tempo | G2: Voltas | H2: Pi | I2: Tempo | J2: Voltas | K2: Pi | L2: Tempo | M2: Voltas | N2: Pi | O2: Tempo | P2: Voltas | Q2: Pi | R2: Tempo | S2: Voltas | T2: Pi | U2: Tempo | V2: Voltas | W2: Pi | X2: Tempo | Y2: Voltas | Z2: Total | AA2: Media | AB2: Record
A3: SAPAO | B3: 8 | C3: 5.0590000000000002 | D3: 30.56 | E3: 6 | F3: 5.0494000000000003 | G3: 32.45 | H3: 4 | I3: 4.9516 | J3: 35.05 | K3: 2 | L3: 5.0571000000000002 | M3: 33.92 | N3: 1 | O3: 5.0609999999999999 | P3: 31 | Q3: 3 | R3: 4.8959999999999999 | S3: 35.21 | T3: 5 | U3: 5.0595999999999997 | V3: 32.26 | W3: 7 | X3: 5.0593000000000004 | Y3: 34.18 | Z3: =+Y3+V3+S3+P3+M3+J3+G3+D3 -> 264.63 | AA3: =+(X3+U3+R3+O3+L3+I3+F3+C3)/8 -> 5.0241249999999997 | AB3: =MINA(X3,U3,R3,O3,L3,I3,F3,C3) -> 4.8959999999999999
A4: ERIC | B4: 1 | C4: 5.39 | D4: 30.11 | E4: 3 | F4: 4.8807999999999998 | G4: 33.46 | H4: 5 | I4: 5.0597000000000003 | J4: 32.65 | K4: 7 | L4: 5.0587 | M4: 33.63 | N4: 8 | O4: 4.9509999999999996 | P4: 33.74 | Q4: 6 | R4: 5.0045999999999999 | S4: 33.08 | T4: 4 | U4: 5.0590000000000002 | V4: 33.24 | W4: 2 | X4: 4.8963000000000001 | Y4: 33.31 | Z4: =+Y4+V4+S4+P4+M4+J4+G4+D4 -> 263.22 | AA4: =+(X4+U4+R4+O4+L4+I4+F4+C4)/8 -> 5.0375125000000001 | AB4: =MINA(X4,U4,R4,O4,L4,I4,F4,C4) -> 4.8807999999999998
A5: LISTER | B5: 6 | C5: 5.0594999999999999 | D5: 28.75 | E5: 4 | F5: 5.0610999999999997 | G5: 30.53 | H5: 2 | I5: 5.0580999999999996 | J5: 32.08 | K5: 1 | L5: 5.0593000000000004 | M5: 33.01 | N5: 3 | O5: 5.0465999999999998 | P5: 31.93 | Q5: 5 | R5: 5.0605000000000002 | S5: 30.08 | T5: 7 | U5: 5.0484 | V5: 29.98 | W5: 8 | X5: 5.2789999999999999 | Y5: 29.45 | Z5: =+Y5+V5+S5+P5+M5+J5+G5+D5 -> 245.81 | AA5: =+(X5+U5+R5+O5+L5+I5+F5+C5)/8 -> 5.0840624999999999 | AB5: =MINA(X5,U5,R5,O5,L5,I5,F5,C5) -> 5.0465999999999998
A6: GIOVANNI | B6: 2 | C6: 5.0576999999999996 | D6: 32.5 | E6: 1 | F6: 5.2807000000000004 | G6: 27.06 | H6: 3 | I6: 5.0594999999999999 | J6: 30.22 | K6: 5 | L6: 5.1811999999999996 | M6: 29.46 | N6: 7 | O6: 5.0609000000000002 | P6: 32.79 | Q6: 8 | R6: 5.2788000000000004 | S6: 27.55 | T6: 6 | U6: 5.0608000000000004 | V6: 31.84 | W6: 4 | X6: 4.8966000000000003 | Y6: 32.07 | Z6: =+Y6+V6+S6+P6+M6+J6+G6+D6 -> 243.49 | AA6: =+(X6+U6+R6+O6+L6+I6+F6+C6)/8 -> 5.1095249999999997 | AB6: =MINA(X6,U6,R6,O6,L6,I6,F6,C6) -> 4.8966000000000003
A7: RUDSON | B7: 4 | C7: 5.2794999999999996 | D7: 29.76 | E7: 2 | F7: 5.2803000000000004 | G7: 25.2 | H7: 1 | I7: 5.4976000000000003 | J7: 30.15 | K7: 3 | L7: 5.1816000000000004 | M7: 30.64 | N7: 5 | O7: 5.2685000000000004 | P7: 32.68 | Q7: 7 | R7: 5.2708000000000004 | S7: 31.66 | T7: 8 | U7: 5.2797000000000001 | V7: 30.46 | W7: 6 | X7: 5.0617999999999999 | Y7: 29.65 | Z7: =+Y7+V7+S7+P7+M7+J7+G7+D7 -> 240.2 | AA7: =+(X7+U7+R7+O7+L7+I7+F7+C7)/8 -> 5.2649749999999997 | AB7: =MINA(X7,U7,R7,O7,L7,I7,F7,C7) -> 5.0617999999999999
A8: NETO | B8: 7 | C8: 5.2671999999999999 | D8: 21.52 | E8: 8 | F8: 5.0591999999999997 | G8: 39.23 | H8: 6 | I8: 5.1153000000000004 | J8: 32.24 | K8: 4 | L8: 5.048 | M8: 29.73 | N8: 2 | O8: 5.0065999999999997 | P8: 28.06 | Q8: 1 | R8: 5.2803000000000004 | S8: 24.08 | T8: 3 | U8: 5.17 | V8: 29.63 | W8: 5 | X8: 5.2797000000000001 | Y8: 27.85 | Z8: =+Y8+V8+S8+P8+M8+J8+G8+D8 -> 232.34 | AA8: =+(X8+U8+R8+O8+L8+I8+F8+C8)/8 -> 5.1532875000000002 | AB8: =MINA(X8,U8,R8,O8,L8,I8,F8,C8) -> 5.0065999999999997
A9: LUIZ FELIPE | B9: 5 | C9: 5.2804000000000002 | D9: 29.49 | E9: 7 | F9: 5.2813999999999997 | G9: 24.1 | H9: 8 | I9: 5.2637 | J9: 28.6 | K9: 6 | L9: 5.2683 | M9: 25.74 | N9: 4 | O9: 5.0601000000000003 | P9: 31.13 | Q9: 2 | R9: 5.2790999999999997 | S9: 30.55 | T9: 1 | U9: 5.2712000000000003 | V9: 31.35 | W9: 3 | X9: 5.2796000000000003 | Y9: 19.08 | Z9: =+Y9+V9+S9+P9+M9+J9+G9+D9 -> 220.04 | AA9: =+(X9+U9+R9+O9+L9+I9+F9+C9)/8 -> 5.2479750000000003 | AB9: =MINA(X9,U9,R9,O9,L9,I9,F9,C9) -> 5.0601000000000003
A10: JERA | B10: 3 | C10: 5.0499000000000001 | D10: 30.57 | E10: 5 | F10: 5.0591999999999997 | G10: 32.26 | H10: 7 | I10: 5.0590999999999999 | J10: 32.34 | K10: 8 | L10: 5.5002000000000004 | M10: 10.25 | N10: 6 | O10: 5.5007999999999999 | P10: 23.1 | Z10: =+Y10+V10+S10+P10+M10+J10+G10+D10 -> 128.52 | AA10: =+(X10+U10+R10+O10+L10+I10+F10+C10)/5 -> 5.2338400000000007 | AB10: =MINA(X10,U10,R10,O10,L10,I10,F10,C10) -> 5.0499000000000001
A11: 2 Bateria
A12: Piloto | B12: Pi | C12: Tempo | D12: Voltas | E12: Pi | F12: Tempo | G12: Voltas | H12: Pi | I12: Tempo | J12: Voltas | K12: Pi | L12: Tempo | M12: Voltas | N12: Pi | O12: Tempo | P12: Voltas | Q12: Pi | R12: Tempo | S12: Voltas | T12: Pi | U12: Tempo | V12: Voltas | W12: Pi | X12: Tempo | Y12: Voltas | Z12: Total | AA12: Media | AB12: Record
A13: MICHEL | B13: 5 | C13: 4.8262999999999998 | D13: 35.75 | E13: 7 | F13: 4.7850000000000001 | G13: 36.65 | H13: 8 | I13: 4.8398000000000003 | J13: 35.24 | K13: 6 | L13: 4.7217000000000002 | M13: 36.78 | N13: 4 | O13: 4.8282999999999996 | P13: 36.07 | Q13: 2 | R13: 4.62 | S13: 36.46 | T13: 1 | U13: 4.7344999999999997 | V13: 35.74 | W13: 3 | X13: 4.8270999999999997 | Y13: 35.59 | Z13: =+Y13+V13+S13+P13+M13+J13+G13+D13 -> 288.28 | AA13: =+(X13+U13+R13+O13+L13+I13+F13+C13)/8 -> 4.7728374999999996 | AB13: =MINA(X13,U13,R13,O13,L13,I13,F13,C13) -> 4.62
A14: ANDERSON | B14: 6 | C14: 4.7428999999999997 | D14: 35.1 | E14: 4 | F14: 4.7140000000000004 | G14: 35.7 | H14: 2 | I14: 4.7286000000000001 | J14: 34.2 | K14: 1 | L14: 4.8403 | M14: 35.75 | N14: 3 | O14: 4.8250000000000002 | P14: 36.82 | Q14: 5 | R14: 4.8266999999999998 | S14: 35.7 | T14: 7 | U14: 4.8254999999999999 | V14: 35.69 | W14: 8 | X14: 4.7817999999999996 | Y14: 35.72 | Z14: =+Y14+V14+S14+P14+M14+J14+G14+D14 -> 284.68 | AA14: =+(X14+U14+R14+O14+L14+I14+F14+C14)/8 -> 4.7855999999999996 | AB14: =MINA(X14,U14,R14,O14,L14,I14,F14,C14) -> 4.7140000000000004
A15: DINHO | B15: 4 | C15: 4.6643999999999997 | D15: 35.6 | E15: 2 | F15: 4.8399000000000001 | G15: 34.78 | H15: 1 | I15: 5.0487000000000002 | J15: 34.92 | K15: 3 | L15: 4.7290000000000001 | M15: 35.77 | N15: 5 | O15: 4.8257000000000003 | P15: 35.95 | Q15: 7 | R15: 4.7286999999999999 | S15: 36.97 | T15: 8 | U15: 4.6763000000000003 | V15: 34.12 | W15: 6 | X15: 4.8385999999999996 | Y15: 34.56 | Z15: =+Y15+V15+S15+P15+M15+J15+G15+D15 -> 282.67 | AA15: =+(X15+U15+R15+O15+L15+I15+F15+C15)/8 -> 4.7939125000000002 | AB15: =MINA(X15,U15,R15,O15,L15,I15,F15,C15) -> 4.6643999999999997
A16: BONGA | B16: 7 | C16: 4.9473000000000003 | D16: 33.61 | E16: 8 | F16: 5.0606999999999998 | G16: 34.91 | H16: 6 | I16: 4.8959999999999999 | J16: 34.15 | K16: 4 | L16: 4.8391999999999999 | M16: 36.09 | N16: 2 | O16: 4.8376999999999999 | P16: 35.89 | Q16: 1 | R16: 4.8963999999999999 | S16: 35.27 | T16: 3 | U16: 5.0480999999999998 | V16: 34.21 | W16: 5 | X16: 4.6196000000000002 | Y16: 34.69 | Z16: =+Y16+V16+S16+P16+M16+J16+G16+D16 -> 278.82 | AA16: =+(X16+U16+R16+O16+L16+I16+F16+C16)/8 -> 4.8931250000000004 | AB16: =MINA(X16,U16,R16,O16,L16,I16,F16,C16) -> 4.6196000000000002
A17: EVANDRO | B17: 8 | C17: 5.0602 | D17: 32.61 | E17: 6 | F17: 4.8417000000000003 | G17: 34.42 | H17: 4 | I17: 4.8385999999999996 | J17: 35.45 | K17: 2 | L17: 4.7866 | M17: 36.24 | N17: 1 | O17: 4.8404999999999996 | P17: 32.62 | Q17: 3 | R17: 4.6760000000000002 | S17: 35.98 | T17: 5 | U17: 4.7298 | V17: 35.98 | W17: 7 | X17: 4.84 | Y17: 33.03 | Z17: =+Y17+V17+S17+P17+M17+J17+G17+D17 -> 276.33 | AA17: =+(X17+U17+R17+O17+L17+I17+F17+C17)/8 -> 4.8266750000000007 | AB17: =MINA(X17,U17,R17,O17,L17,I17,F17,C17) -> 4.6760000000000002
A18: MARCEL | B18: 3 | C18: 4.8394000000000004 | D18: 35.09 | E18: 5 | F18: 4.9192 | G18: 32.31 | H18: 7 | I18: 4.8392999999999997 | J18: 34.82 | K18: 8 | L18: 4.8417000000000003 | M18: 34.82 | N18: 6 | O18: 4.8399000000000001 | P18: 35.61 | Q18: 4 | R18: 4.6204000000000001 | S18: 28.63 | T18: 2 | U18: 4.6868999999999996 | V18: 36.98 | W18: 1 | X18: 4.8403 | Y18: 35.11 | Z18: =+Y18+V18+S18+P18+M18+J18+G18+D18 -> 273.37 | AA18: =+(X18+U18+R18+O18+L18+I18+F18+C18)/8 -> 4.8033874999999995 | AB18: =MINA(X18,U18,R18,O18,L18,I18,F18,C18) -> 4.6204000000000001
A19: RICARDAO | B19: 1 | C19: 5.1715 | D19: 32.6 | E19: 3 | F19: 5.0065 | G19: 33.51 | H19: 5 | I19: 5.0038 | J19: 32.08 | K19: 7 | L19: 4.8960999999999997 | M19: 33.22 | N19: 8 | O19: 5.0602 | P19: 33.53 | Q19: 6 | R19: 4.8951000000000002 | S19: 32.97 | T19: 4 | U19: 5.0606999999999998 | V19: 32.08 | W19: 2 | X19: 5.0434999999999999 | Y19: 33.41 | Z19: =+Y19+V19+S19+P19+M19+J19+G19+D19 -> 263.4 | AA19: =+(X19+U19+R19+O19+L19+I19+F19+C19)/8 -> 5.0171750000000008 | AB19: =MINA(X19,U19,R19,O19,L19,I19,F19,C19) -> 4.8951000000000002