A1: Patrocinadores

B1: Motos e Acessórios Honda - Rua Sete de Setembro, 387 - Fone: (15) 3331-6700.

A1: Pos | B1: Pilotos | C1: Voltas
A2: 1 | B2: MICHEL | C2: 290.48
A3: =+A2+1 -> 2 | B3: BONGA | C3: 286.18
A4: =+A3+1 -> 3 | B4: EVANDRO | C4: 283.61
A5: =+A4+1 -> 4 | B5: DINHO | C5: 283.55
A6: =+A5+1 -> 5 | B6: ANDERSON | C6: 282.48
A7: =+A6+1 -> 6 | B7: JERA | C7: 276.6
A8: =+A7+1 -> 7 | B8: NETO | C8: 273.51
A9: =+A8+1 -> 8 | B9: ERIC | C9: 269.41
A10: =+A9+1 -> 9 | B10: MARCEL | C10: 263.21
A11: =+A10+1 -> 10 | B11: RICARDINHO | C11: 259.15
A12: =+A11+1 -> 11 | B12: GIOVANNI | C12: 257.83
A13: =+A12+1 -> 12 | B13: LISTER | C13: 257.28
A14: =+A13+1 -> 13 | B14: SAPAO | C14: 256.69
A15: =+A14+1 -> 14 | B15: RICARDAO | C15: 254.96
A16: =+A15+1 -> 15 | B16: JULIO | C16: 252.86
A17: =+A16+1 -> 16 | B17: COISA PRETA | C17: 245.12
A18: =+A17+1 -> 17 | B18: LUIZ FELIPE | C18: 238.59
A19: =+A18+1 -> 18 | B19: LUIZ PROPART | C19: 234.66
A20: =+A19+1 -> 19 | B20: MANE | C20: 226.22
A21: =+A20+1 -> 20 | B21: TONI | C21: 225.53
A22: =+A21+1 -> 21 | B22: CONRADO | C22: 217.26
A23: =+A22+1 -> 22 | B23: RUBAO | C23: 182.63