A1: Patrocinadores

B1: Motos e Acessórios Honda - Rua Sete de Setembro, 387 - Fone: (15) 3331-6700. | C1: Rua Olavo Bilac, 254 - Vila Santana

A1: 1 Bateria
A2: Piloto | B2: Pi | C2: Tempo | D2: Voltas | E2: Pi | F2: Tempo | G2: Voltas | H2: Pi | I2: Tempo | J2: Voltas | K2: Pi | L2: Tempo | M2: Voltas | N2: Pi | O2: Tempo | P2: Voltas | Q2: Pi | R2: Tempo | S2: Voltas | T2: Pi | U2: Tempo | V2: Voltas | W2: Pi | X2: Tempo | Y2: Voltas | Z2: Total | AA2: Media | AB2: Record
A3: LUIZ FELIPE | B3: 3 | C3: 4.9459999999999997 | D3: 31,00 | E3: 5 | F3: 5.7210000000000001 | G3: 27,00 | H3: 7 | I3: 5.7759999999999998 | J3: 26,00 | K3: 8 | L3: 5.94 | M3: 25,00 | N3: 6 | O3: 5.9390000000000001 | P3: 27,00 | Q3: 4 | R3: 5.7210000000000001 | S3: 29,00 | T3: 2 | U3: 5.74 | V3: 26,00 | W3: 1 | X3: 5.7889999999999997 | Y3: 24,35 | Z3: =+Y3+V3+S3+P3+M3+J3+G3+D3 -> 215.35 | AA3: =+(X3+U3+R3+O3+L3+I3+F3+C3)/8 -> 5.6965000000000003 | AB3: =MINA(X3,U3,R3,O3,L3,I3,F3,C3) -> 4.9459999999999997
A4: BETO | B4: 7 | C4: 5.83 | D4: 28,00 | E4: 8 | F4: 5.94 | G4: 26,00 | H4: 6 | I4: 5.94 | J4: 26,00 | K4: 4 | L4: 5.883 | M4: 27,00 | N4: 2 | O4: 5.94 | P4: 26,00 | Q4: 1 | R4: 5.7789999999999999 | S4: 28,00 | T4: 3 | U4: 5.6630000000000003 | V4: 28,00 | W4: 5 | X4: 5.9359999999999999 | Y4: 26,11 | Z4: =+Y4+V4+S4+P4+M4+J4+G4+D4 -> 215.11 | AA4: =+(X4+U4+R4+O4+L4+I4+F4+C4)/8 -> 5.8638749999999993 | AB4: =MINA(X4,U4,R4,O4,L4,I4,F4,C4) -> 5.6630000000000003
A5: TOMAZ | B5: 2 | C5: 6.1580000000000004 | D5: 28,00 | E5: 1 | F5: 6.1589999999999998 | G5: 25,00 | H5: 3 | I5: 6.0490000000000004 | J5: 26,00 | K5: 5 | L5: 6.2039999999999997 | M5: 26,00 | N5: 7 | O5: 6.04 | P5: 24,00 | Q5: 8 | R5: 5.9950000000000001 | S5: 24,00 | T5: 6 | U5: 6.05 | V5: 19,00 | W5: 4 | X5: 5.9939999999999998 | Y5: 24,48 | Z5: =+Y5+V5+S5+P5+M5+J5+G5+D5 -> 196.48 | AA5: =+(X5+U5+R5+O5+L5+I5+F5+C5)/8 -> 6.0811250000000001 | AB5: =MINA(X5,U5,R5,O5,L5,I5,F5,C5) -> 5.9939999999999998
A6: GERONIMO | B6: 5 | C6: 6.6550000000000002 | D6: 23,00 | E6: 7 | F6: 6.38 | G6: 25,00 | H6: 8 | I6: 6.5979999999999999 | J6: 22,00 | K6: 6 | L6: 6.38 | M6: 24,00 | N6: 4 | O6: 6.1589999999999998 | P6: 25,00 | Q6: 2 | R6: 6.3840000000000003 | S6: 26,00 | T6: 1 | U6: 6.49 | V6: 21,00 | W6: 3 | X6: 6.1559999999999997 | Y6: 25,16 | Z6: =+Y6+V6+S6+P6+M6+J6+G6+D6 -> 191.16 | AA6: =+(X6+U6+R6+O6+L6+I6+F6+C6)/8 -> 6.4002500000000007 | AB6: =MINA(X6,U6,R6,O6,L6,I6,F6,C6) -> 6.1559999999999997
A7: RUDSON | B7: 1 | C7: 6.3280000000000003 | D7: 20,00 | E7: 3 | F7: 6.16 | G7: 25,00 | H7: 5 | I7: 6.3789999999999996 | J7: 16,00 | K7: 7 | L7: 6.2690000000000001 | M7: 24,00 | N7: 8 | O7: 6.3769999999999998 | P7: 26,00 | Q7: 6 | R7: 6.4870000000000001 | S7: 24,00 | T7: 4 | U7: 6.16 | V7: 26,00 | W7: 2 | X7: 6.3250000000000002 | Y7: 22,22 | Z7: =+Y7+V7+S7+P7+M7+J7+G7+D7 -> 183.22 | AA7: =+(X7+U7+R7+O7+L7+I7+F7+C7)/8 -> 6.3106249999999999 | AB7: =MINA(X7,U7,R7,O7,L7,I7,F7,C7) -> 6.16
A8: MARCOS JOSE | B8: 8 | C8: 6.4340000000000002 | D8: 25,00 | E8: 6 | F8: 6.1050000000000004 | G8: 25,00 | H8: 4 | I8: 6.4320000000000004 | J8: 18,00 | K8: 2 | L8: 5.94 | M8: 21,00 | N8: 1 | O8: 6.1609999999999996 | P8: 18,00 | Q8: 3 | R8: 5.9390000000000001 | S8: 25,00 | T8: 5 | U8: 5.9939999999999998 | V8: 27,00 | W8: 7 | X8: 6.1589999999999998 | Y8: 19,66 | Z8: =+Y8+V8+S8+P8+M8+J8+G8+D8 -> 178.66 | AA8: =+(X8+U8+R8+O8+L8+I8+F8+C8)/8 -> 6.1455000000000002 | AB8: =MINA(X8,U8,R8,O8,L8,I8,F8,C8) -> 5.9390000000000001
A9: FLAVIO | B9: 4 | C9: 6.1589999999999998 | D9: 26,00 | E9: 2 | F9: 6.1609999999999996 | G9: 21,00 | H9: 1 | I9: 6.4329999999999998 | J9: 22,00 | K9: 3 | L9: 6.05 | M9: 23,00 | N9: 5 | O9: 6.3810000000000002 | P9: 23,00 | Q9: 7 | R9: 6.6 | S9: 24,00 | T9: 8 | U9: 7.1509999999999998 | V9: 18,00 | W9: 6 | X9: 6.38 | Y9: 21,05 | Z9: =+Y9+V9+S9+P9+M9+J9+G9+D9 -> 178.05 | AA9: =+(X9+U9+R9+O9+L9+I9+F9+C9)/8 -> 6.4143749999999997 | AB9: =MINA(X9,U9,R9,O9,L9,I9,F9,C9) -> 6.05
A10: M VINICIUS | B10: 6 | C10: 6.6550000000000002 | D10: 20,00 | E10: 4 | F10: 6.2149999999999999 | G10: 23,00 | H10: 2 | I10: 6.3250000000000002 | J10: 22,00 | K10: 1 | L10: 6.218 | M10: 24,00 | N10: 3 | O10: 6.1609999999999996 | P10: 24,00 | Q10: 5 | R10: 6.5979999999999999 | S10: 22,00 | T10: 7 | U10: 6.4349999999999996 | V10: 25,00 | W10: 8 | X10: 6.5990000000000002 | Y10: 14,27 | Z10: =+Y10+V10+S10+P10+M10+J10+G10+D10 -> 174.27 | AA10: =+(X10+U10+R10+O10+L10+I10+F10+C10)/8 -> 6.4007500000000004 | AB10: =MINA(X10,U10,R10,O10,L10,I10,F10,C10) -> 6.1609999999999996
A11: 2 Bateria
A12: Piloto | B12: Pi | C12: Tempo | D12: Voltas | E12: Pi | F12: Tempo | G12: Voltas | H12: Pi | I12: Tempo | J12: Voltas | K12: Pi | L12: Tempo | M12: Voltas | N12: Pi | O12: Tempo | P12: Voltas | Q12: Pi | R12: Tempo | S12: Voltas | T12: Pi | U12: Tempo | V12: Voltas | W12: Pi | X12: Tempo | Y12: Voltas | Z12: Total | AA12: Media | AB12: Record
A13: JULIO | B13: 4 | C13: 4.7290000000000001 | D13: 26,00 | E13: 2 | F13: 5.444 | G13: 29,00 | H13: 1 | I13: 5.72 | J13: 29,00 | K13: 3 | L13: 4.6239999999999997 | M13: 29,00 | N13: 5 | O13: 5.4489999999999998 | P13: 29,00 | Q13: 7 | R13: 5.55 | S13: 28,00 | T13: 8 | U13: 5.55 | V13: 30,00 | W13: 6 | X13: 5.4539999999999997 | Y13: 30,48 | Z13: =+Y13+V13+S13+P13+M13+J13+G13+D13 -> 230.48 | AA13: =+(X13+U13+R13+O13+L13+I13+F13+C13)/8 -> 5.3150000000000004 | AB13: =MINA(X13,U13,R13,O13,L13,I13,F13,C13) -> 4.6239999999999997
A14: GABRIEL | B14: 6 | C14: 5.83 | D14: 29,00 | E14: 4 | F14: 5.6660000000000004 | G14: 28,00 | H14: 2 | I14: 5.63 | J14: 29,00 | K14: 1 | L14: 5.9349999999999996 | M14: 24,00 | N14: 3 | O14: 5.72 | P14: 28,00 | Q14: 5 | R14: 5.89 | S14: 29,00 | T14: 7 | U14: 5.7160000000000002 | V14: 29,00 | W14: 8 | X14: 4.73 | Y14: 29,50 | Z14: =+Y14+V14+S14+P14+M14+J14+G14+D14 -> 225.5 | AA14: =+(X14+U14+R14+O14+L14+I14+F14+C14)/8 -> 5.6396250000000006 | AB14: =MINA(X14,U14,R14,O14,L14,I14,F14,C14) -> 4.73
A15: JAPAO | B15: 1 | C15: 5.9409999999999998 | D15: 23,00 | E15: 3 | F15: 5.718 | G15: 27,00 | H15: 5 | I15: 5.9390000000000001 | J15: 28,00 | K15: 7 | L15: 5.8029999999999999 | M15: 25,00 | N15: 8 | O15: 5.9349999999999996 | P15: 29,00 | Q15: 6 | R15: 5.9349999999999996 | S15: 26,00 | T15: 4 | U15: 5.94 | V15: 27,00 | W15: 2 | X15: 5.8849999999999998 | Y15: 29,26 | Z15: =+Y15+V15+S15+P15+M15+J15+G15+D15 -> 214.26 | AA15: =+(X15+U15+R15+O15+L15+I15+F15+C15)/8 -> 5.8870000000000005 | AB15: =MINA(X15,U15,R15,O15,L15,I15,F15,C15) -> 5.718
A16: PACHECO | B16: 5 | C16: 6.2709999999999999 | D16: 22,00 | E16: 7 | F16: 6.492 | G16: 23,00 | H16: 8 | I16: 6.3250000000000002 | J16: 24,00 | K16: 6 | L16: 6.27 | M16: 25,00 | N16: 4 | O16: 5.9779999999999998 | P16: 25,00 | Q16: 2 | R16: 6.0490000000000004 | S16: 25,00 | T16: 1 | U16: 6.1630000000000003 | V16: 27,00 | W16: 3 | X16: 5.9950000000000001 | Y16: 27,26 | Z16: =+Y16+V16+S16+P16+M16+J16+G16+D16 -> 198.26 | AA16: =+(X16+U16+R16+O16+L16+I16+F16+C16)/8 -> 6.1928749999999999 | AB16: =MINA(X16,U16,R16,O16,L16,I16,F16,C16) -> 5.9779999999999998
A17: SANDRO ITU | B17: 2 | C17: 5.9349999999999996 | D17: 18,00 | E17: 1 | F17: 6.0469999999999997 | G17: 26,00 | H17: 3 | I17: 5.7750000000000004 | J17: 25,00 | K17: 5 | L17: 6.16 | M17: 21,00 | N17: 7 | O17: 6.0010000000000003 | P17: 26,00 | Q17: 8 | R17: 6.1580000000000004 | S17: 25,00 | T17: 6 | U17: 5.9960000000000004 | V17: 25,00 | W17: 4 | X17: 5.9390000000000001 | Y17: 27,31 | Z17: =+Y17+V17+S17+P17+M17+J17+G17+D17 -> 193.31 | AA17: =+(X17+U17+R17+O17+L17+I17+F17+C17)/8 -> 6.0013750000000003 | AB17: =MINA(X17,U17,R17,O17,L17,I17,F17,C17) -> 5.7750000000000004
A18: RICARDO | B18: 7 | C18: 5.9370000000000003 | D18: 23,00 | E18: 8 | F18: 5.9379999999999997 | G18: 22,00 | H18: 6 | I18: 5.89 | J18: 26,00 | K18: 4 | L18: 4.7850000000000001 | M18: 25,00 | N18: 2 | O18: 6.1589999999999998 | P18: 25,00 | Q18: 1 | R18: 6.3789999999999996 | S18: 24,00 | T18: 3 | U18: 5.7270000000000003 | V18: 19,00 | W18: 5 | X18: 5.72 | Y18: 28,43 | Z18: =+Y18+V18+S18+P18+M18+J18+G18+D18 -> 192.43 | AA18: =+(X18+U18+R18+O18+L18+I18+F18+C18)/8 -> 5.8168749999999996 | AB18: =MINA(X18,U18,R18,O18,L18,I18,F18,C18) -> 4.7850000000000001
A19: CONRADO | B19: 8 | C19: 6.16 | D19: 22,00 | E19: 6 | F19: 5.81 | G19: 26,00 | H19: 4 | I19: 5.72 | J19: 29,00 | K19: 2 | L19: 5.94 | M19: 22,00 | N19: 1 | O19: 6.0510000000000002 | P19: 5,00 | Q19: 3 | R19: 5.8860000000000001 | S19: 27,00 | T19: 5 | U19: 5.8860000000000001 | V19: 28,00 | W19: 7 | X19: 5.7850000000000001 | Y19: 30,05 | Z19: =+Y19+V19+S19+P19+M19+J19+G19+D19 -> 189.05 | AA19: =+(X19+U19+R19+O19+L19+I19+F19+C19)/8 -> 5.9047499999999999 | AB19: =MINA(X19,U19,R19,O19,L19,I19,F19,C19) -> 5.72
A20: LISTER | B20: 3 | C20: 5.7750000000000004 | D20: 24,00 | E20: 5 | F20: 5.9370000000000003 | G20: 20,00 | H20: 7 | I20: 5.9390000000000001 | J20: 26,00 | K20: 8 | L20: 6.3289999999999997 | M20: 20,00 | N20: 6 | O20: 6.12 | P20: 23,00 | Q20: 4 | R20: 5.5049999999999999 | S20: 25,00 | T20: 2 | U20: 5.976 | V20: 17,00 | W20: 1 | X20: 5.94 | Y20: 24,37 | Z20: =+Y20+V20+S20+P20+M20+J20+G20+D20 -> 179.37 | AA20: =+(X20+U20+R20+O20+L20+I20+F20+C20)/8 -> 5.9401249999999992 | AB20: =MINA(X20,U20,R20,O20,L20,I20,F20,C20) -> 5.5049999999999999
A21: 3 Bateria
A22: Piloto | B22: Pi | C22: Tempo | D22: Voltas | E22: Pi | F22: Tempo | G22: Voltas | H22: Pi | I22: Tempo | J22: Voltas | K22: Pi | L22: Tempo | M22: Voltas | N22: Pi | O22: Tempo | P22: Voltas | Q22: Pi | R22: Tempo | S22: Voltas | T22: Pi | U22: Tempo | V22: Voltas | W22: Pi | X22: Tempo | Y22: Voltas | Z22: Total | AA22: Media | AB22: Record
A23: JERA | B23: 8 | C23: 5.5549999999999997 | D23: 29,00 | E23: 6 | F23: 5.4969999999999999 | G23: 31,00 | H23: 4 | I23: 5.391 | J23: 31,00 | K23: 2 | L23: 5.4829999999999997 | M23: 31,00 | N23: 1 | O23: 5.2789999999999999 | P23: 29,00 | Q23: 3 | R23: 5.3879999999999999 | S23: 30,00 | T23: 5 | U23: 5.4459999999999997 | V23: 25,00 | W23: 7 | X23: 5.5170000000000003 | Y23: 29,52 | Z23: =+Y23+V23+S23+P23+M23+J23+G23+D23 -> 235.52 | AA23: =+(X23+U23+R23+O23+L23+I23+F23+C23)/8 -> 5.4444999999999997 | AB23: =MINA(X23,U23,R23,O23,L23,I23,F23,C23) -> 5.2789999999999999
A24: ERIC | B24: 7 | C24: 5.5579999999999998 | D24: 28,00 | E24: 8 | F24: 5.72 | G24: 29,00 | H24: 6 | I24: 5.5 | J24: 29,00 | K24: 4 | L24: 5.7030000000000003 | M24: 30,00 | N24: 2 | O24: 5.6059999999999999 | P24: 27,00 | Q24: 1 | R24: 5.665 | S24: 30,00 | T24: 3 | U24: 5.5010000000000003 | V24: 30,00 | W24: 5 | X24: 5.06 | Y24: 26,44 | Z24: =+Y24+V24+S24+P24+M24+J24+G24+D24 -> 229.44 | AA24: =+(X24+U24+R24+O24+L24+I24+F24+C24)/8 -> 5.5391249999999994 | AB24: =MINA(X24,U24,R24,O24,L24,I24,F24,C24) -> 5.06
A25: GIOVANNI | B25: 6 | C25: 5.7729999999999997 | D25: 27,00 | E25: 4 | F25: 5.5 | G25: 30,00 | H25: 2 | I25: 5.72 | J25: 29,00 | K25: 1 | L25: 5.9240000000000004 | M25: 28,00 | N25: 3 | O25: 5.7210000000000001 | P25: 28,00 | Q25: 5 | R25: 5.83 | S25: 29,00 | T25: 7 | U25: 5.6669999999999998 | V25: 29,00 | W25: 8 | X25: 5.9379999999999997 | Y25: 28,70 | Z25: =+Y25+V25+S25+P25+M25+J25+G25+D25 -> 228.7 | AA25: =+(X25+U25+R25+O25+L25+I25+F25+C25)/8 -> 5.7591250000000009 | AB25: =MINA(X25,U25,R25,O25,L25,I25,F25,C25) -> 5.5
A26: RUBAO | B26: 2 | C26: 5.72 | D26: 28,00 | E26: 1 | F26: 5.72 | G26: 29,00 | H26: 3 | I26: 5.72 | J26: 27,00 | K26: 5 | L26: 5.7190000000000003 | M26: 30,00 | N26: 7 | O26: 5.8259999999999996 | P26: 27,00 | Q26: 8 | R26: 5.7750000000000004 | S26: 29,00 | T26: 6 | U26: 5.827 | V26: 27,00 | W26: 4 | X26: 5.8840000000000003 | Y26: 28,13 | Z26: =+Y26+V26+S26+P26+M26+J26+G26+D26 -> 225.13 | AA26: =+(X26+U26+R26+O26+L26+I26+F26+C26)/8 -> 5.7738750000000003 | AB26: =MINA(X26,U26,R26,O26,L26,I26,F26,C26) -> 5.7190000000000003
A27: MANE | B27: 3 | C27: 5.61 | D27: 29,00 | E27: 5 | F27: 5.72 | G27: 27,00 | H27: 7 | I27: 5.06 | J27: 26,00 | K27: 8 | L27: 5.83 | M27: 26,00 | N27: 6 | O27: 5.7190000000000003 | P27: 26,00 | Q27: 4 | R27: 5.4989999999999997 | S27: 27,00 | T27: 2 | U27: 5.5380000000000003 | V27: 28,00 | W27: 1 | X27: 5.7190000000000003 | Y27: 25,17 | Z27: =+Y27+V27+S27+P27+M27+J27+G27+D27 -> 214.17 | AA27: =+(X27+U27+R27+O27+L27+I27+F27+C27)/8 -> 5.586875 | AB27: =MINA(X27,U27,R27,O27,L27,I27,F27,C27) -> 5.06
A28: EVANDRO | B28: 5 | C28: 5.7190000000000003 | D28: 25,00 | E28: 7 | F28: 5.72 | G28: 30,00 | H28: 8 | I28: 5.72 | J28: 27,00 | K28: 6 | L28: 5.7190000000000003 | M28: 24,00 | N28: 4 | O28: 5.6639999999999997 | P28: 28,00 | Q28: 2 | R28: 5.7750000000000004 | S28: 27,00 | T28: 1 | U28: 5.9249999999999998 | V28: 25,00 | W28: 3 | X28: 5.7210000000000001 | Y28: 26,70 | Z28: =+Y28+V28+S28+P28+M28+J28+G28+D28 -> 212.7 | AA28: =+(X28+U28+R28+O28+L28+I28+F28+C28)/8 -> 5.7453750000000001 | AB28: =MINA(X28,U28,R28,O28,L28,I28,F28,C28) -> 5.6639999999999997
A29: ERUNDA | B29: 4 | C29: 5.7169999999999996 | D29: 26,00 | E29: 2 | F29: 5.7210000000000001 | G29: 26,00 | H29: 1 | I29: 5.992 | J29: 24,00 | K29: 3 | L29: 5.72 | M29: 29,00 | N29: 5 | O29: 5.9409999999999998 | P29: 27,00 | Q29: 7 | R29: 5.94 | S29: 27,00 | T29: 8 | U29: 6.16 | V29: 27,00 | W29: 6 | X29: 5.94 | Y29: 24,04 | Z29: =+Y29+V29+S29+P29+M29+J29+G29+D29 -> 210.04 | AA29: =+(X29+U29+R29+O29+L29+I29+F29+C29)/8 -> 5.891375 | AB29: =MINA(X29,U29,R29,O29,L29,I29,F29,C29) -> 5.7169999999999996
A30: 4 Bateria
A31: Piloto | B31: Pi | C31: Tempo | D31: Voltas | E31: Pi | F31: Tempo | G31: Voltas | H31: Pi | I31: Tempo | J31: Voltas | K31: Pi | L31: Tempo | M31: Voltas | N31: Pi | O31: Tempo | P31: Voltas | Q31: Pi | R31: Tempo | S31: Voltas | T31: Pi | U31: Tempo | V31: Voltas | W31: Pi | X31: Tempo | Y31: Voltas | Z31: Total | AA31: Media | AB31: Record
A32: MICHEL | B32: 3 | C32: 5.2960000000000003 | D32: 31,00 | E32: 5 | F32: 5.28 | G32: 30,00 | H32: 7 | I32: 5.39 | J32: 32,00 | K32: 8 | L32: 5.4989999999999997 | M32: 31,00 | N32: 6 | O32: 5.391 | P32: 30,00 | Q32: 4 | R32: 5.2830000000000004 | S32: 32,00 | T32: 2 | U32: 5.335 | V32: 30,00 | W32: 1 | X32: 5.2789999999999999 | Y32: 31,05 | Z32: =+Y32+V32+S32+P32+M32+J32+G32+D32 -> 247.05 | AA32: =+(X32+U32+R32+O32+L32+I32+F32+C32)/8 -> 5.344125 | AB32: =MINA(X32,U32,R32,O32,L32,I32,F32,C32) -> 5.2789999999999999
A33: ANDERSON | B33: 6 | C33: 5.335 | D33: 30,00 | E33: 4 | F33: 5.3310000000000004 | G33: 29,00 | H33: 2 | I33: 5.2779999999999996 | J33: 32,00 | K33: 1 | L33: 4.6189999999999998 | M33: 31,00 | N33: 3 | O33: 5.2240000000000002 | P33: 31,00 | Q33: 5 | R33: 5.39 | S33: 29,00 | T33: 7 | U33: 5.335 | V33: 31,00 | W33: 8 | X33: 5.5 | Y33: 30,61 | Z33: =+Y33+V33+S33+P33+M33+J33+G33+D33 -> 243.61 | AA33: =+(X33+U33+R33+O33+L33+I33+F33+C33)/8 -> 5.2515000000000001 | AB33: =MINA(X33,U33,R33,O33,L33,I33,F33,C33) -> 4.6189999999999998
A34: BONGA | B34: 7 | C34: 5.8289999999999997 | D34: 27,00 | E34: 8 | F34: 5.665 | G34: 29,00 | H34: 6 | I34: 5.5979999999999999 | J34: 30,00 | K34: 4 | L34: 5.7169999999999996 | M34: 29,00 | N34: 2 | O34: 5.556 | P34: 29,00 | Q34: 1 | R34: 5.5759999999999996 | S34: 31,00 | T34: 3 | U34: 5.665 | V34: 27,00 | W34: 5 | X34: 5.7729999999999997 | Y34: 28,46 | Z34: =+Y34+V34+S34+P34+M34+J34+G34+D34 -> 230.46 | AA34: =+(X34+U34+R34+O34+L34+I34+F34+C34)/8 -> 5.6723749999999997 | AB34: =MINA(X34,U34,R34,O34,L34,I34,F34,C34) -> 5.556
A35: KLEBER | B35: 4 | C35: 5.335 | D35: 28,00 | E35: 2 | F35: 5.4989999999999997 | G35: 23,00 | H35: 1 | I35: 5.5039999999999996 | J35: 31,00 | K35: 3 | L35: 5.5 | M35: 28,00 | N35: 5 | O35: 5.61 | P35: 27,00 | Q35: 7 | R35: 5.3789999999999996 | S35: 29,00 | T35: 8 | U35: 5.44 | V35: 30,00 | W35: 6 | X35: 5.4980000000000002 | Y35: 30,74 | Z35: =+Y35+V35+S35+P35+M35+J35+G35+D35 -> 226.74 | AA35: =+(X35+U35+R35+O35+L35+I35+F35+C35)/8 -> 5.4706250000000001 | AB35: =MINA(X35,U35,R35,O35,L35,I35,F35,C35) -> 5.335
A36: MARCEL | B36: 1 | C36: 5.5549999999999997 | D36: 23,00 | E36: 3 | F36: 5.319 | G36: 30,00 | H36: 5 | I36: 5.4989999999999997 | J36: 30,00 | K36: 7 | L36: 5.4249999999999998 | M36: 31,00 | N36: 8 | O36: 4.6180000000000003 | P36: 32,00 | Q36: 6 | R36: 5.3360000000000003 | S36: 32,00 | T36: 4 | U36: 5.28 | V36: 30,00 | W36: 2 | X36: 5.39 | Y36: 18,52 | Z36: =+Y36+V36+S36+P36+M36+J36+G36+D36 -> 226.52 | AA36: =+(X36+U36+R36+O36+L36+I36+F36+C36)/8 -> 5.3027500000000005 | AB36: =MINA(X36,U36,R36,O36,L36,I36,F36,C36) -> 4.6180000000000003
A37: JOAO KIBON | B37: 5 | C37: 5.72 | D37: 26,00 | E37: 7 | F37: 5.665 | G37: 30,00 | H37: 8 | I37: 5.72 | J37: 27,00 | K37: 6 | L37: 5.7169999999999996 | M37: 29,00 | N37: 4 | O37: 4.9509999999999996 | P37: 28,00 | Q37: 2 | R37: 5.6639999999999997 | S37: 28,00 | T37: 1 | U37: 5.5549999999999997 | V37: 26,00 | W37: 3 | X37: 4.62 | Y37: 27,74 | Z37: =+Y37+V37+S37+P37+M37+J37+G37+D37 -> 221.74 | AA37: =+(X37+U37+R37+O37+L37+I37+F37+C37)/8 -> 5.4514999999999993 | AB37: =MINA(X37,U37,R37,O37,L37,I37,F37,C37) -> 4.62
A38: DINHO | B38: 2 | C38: 5.6609999999999996 | D38: 24,00 | E38: 1 | F38: 5.7210000000000001 | G38: 26,00 | H38: 3 | I38: 5.4459999999999997 | J38: 29,00 | K38: 5 | L38: 5.6230000000000002 | M38: 29,00 | N38: 7 | O38: 5.4470000000000001 | P38: 31,00 | Q38: 8 | R38: 5.56 | S38: 27,00 | T38: 6 | U38: 5.4450000000000003 | V38: 25,00 | W38: 4 | X38: 5.4450000000000003 | Y38: 27,55 | Z38: =+Y38+V38+S38+P38+M38+J38+G38+D38 -> 218.55 | AA38: =+(X38+U38+R38+O38+L38+I38+F38+C38)/8 -> 5.5434999999999999 | AB38: =MINA(X38,U38,R38,O38,L38,I38,F38,C38) -> 5.4450000000000003