A1: Patrocinadores

B1: Motos e Acessórios Honda - Rua Sete de Setembro, 387 - Fone: (15) 3331-6700. | C1: Rua Olavo Bilac, 254 - Vila Santana

A1: Pos | B1: Piloto | C1: Voltas
A2: 1 | B2: MICHEL | C2: 247.05
A3: =+A2+1 -> 2 | B3: ANDERSON | C3: 243.61
A4: =+A3+1 -> 3 | B4: JERA | C4: 235.52
A5: =+A4+1 -> 4 | B5: JULIO | C5: 230.48
A6: =+A5+1 -> 5 | B6: BONGA | C6: 230.46
A7: =+A6+1 -> 6 | B7: ERIC | C7: 229.44
A8: =+A7+1 -> 7 | B8: GIOVANNI | C8: 228.7
A9: =+A8+1 -> 8 | B9: KLEBER | C9: 226.74
A10: =+A9+1 -> 9 | B10: MARCEL | C10: 226.52
A11: =+A10+1 -> 10 | B11: GABRIEL | C11: 225.5
A12: =+A11+1 -> 11 | B12: RUBAO | C12: 225.13
A13: =+A12+1 -> 12 | B13: JOAO KIBON | C13: 221.74
A14: =+A13+1 -> 13 | B14: DINHO | C14: 218.55
A15: =+A14+1 -> 14 | B15: LUIZ FELIPE | C15: 215.35
A16: =+A15+1 -> 15 | B16: BETO | C16: 215.11
A17: =+A16+1 -> 16 | B17: JAPAO | C17: 214.26
A18: =+A17+1 -> 17 | B18: MANE | C18: 214.17
A19: =+A18+1 -> 18 | B19: EVANDRO | C19: 212.7
A20: =+A19+1 -> 19 | B20: ERUNDA | C20: 210.04
A21: =+A20+1 -> 20 | B21: PACHECO | C21: 198.26
A22: =+A21+1 -> 21 | B22: TOMAZ | C22: 196.48
A23: =+A22+1 -> 22 | B23: SANDRO ITU | C23: 193.31
A24: =+A23+1 -> 23 | B24: RICARDO | C24: 192.43
A25: =+A24+1 -> 24 | B25: GERONIMO | C25: 191.16
A26: =+A25+1 -> 25 | B26: CONRADO | C26: 189.05
A27: =+A26+1 -> 26 | B27: RUDSON | C27: 183.22
A28: =+A27+1 -> 27 | B28: LISTER | C28: 179.37
A29: =+A28+1 -> 28 | B29: MARCOS JOSE | C29: 178.66
A30: =+A29+1 -> 29 | B30: FLAVIO | C30: 178.05
A31: =+A30+1 -> 30 | B31: M VINICIUS | C31: 174.27