A1: R$14,99 mussarela, catupiry, buon gustaio, toscanela, calabresa (preço para retirar no balcão) | C1: R$14,99 mussarela, catupiry, buon gustaio, toscanela, calabresa (preço para retirar no balcão)

A1: Pilotos | B1: Pis | C1: Tempo | D1: Vol | E1: Pis | F1: Tempo | G1: Vol | H1: Pis | I1: Tempo | J1: Vol | K1: Pis | L1: Tempo | M1: Vol | N1: Pis | O1: Tempo | P1: Vol | Q1: Pis | R1: Tempo | S1: Vol | T1: Pis | U1: Tempo | V1: Vol | W1: Pis | X1: Tempo | Y1: Vol | Z1: Total | AA1: Media
A2: GOROI | B2: 3 | C2: 5.6639999999999997 | D2: 27 | E2: 5 | F2: 5.7750000000000004 | G2: 26 | H2: 7 | I2: 5.7759999999999998 | J2: 29 | K2: 8 | L2: 5.758 | M2: 23 | N2: 6 | O2: 5.6660000000000004 | P2: 29 | Q2: 4 | R2: 5.8129999999999997 | S2: 28 | T2: 2 | U2: 5.83 | V2: 27 | W2: 1 | X2: 5.94 | Y2: 26 | Z2: =+Y2+V2+S2+P2+M2+J2+G2+D2 -> 215 | AA2: =+(X2+U2+R2+O2+L2+I2+F2+C2)/8 -> 5.7777500000000002
A3: RUBAO | B3: 5 | C3: 5.94 | D3: 24 | E3: 7 | F3: 5.875 | G3: 27 | H3: 8 | I3: 6.0110000000000001 | J3: 27 | K3: 6 | L3: 5.8129999999999997 | M3: 26 | N3: 4 | O3: 5.7759999999999998 | P3: 27 | Q3: 2 | R3: 5.83 | S3: 26 | T3: 1 | U3: 5.8849999999999998 | V3: 26 | W3: 3 | X3: 5.8849999999999998 | Y3: 29 | Z3: =+Y3+V3+S3+P3+M3+J3+G3+D3 -> 212 | AA3: =+(X3+U3+R3+O3+L3+I3+F3+C3)/8 -> 5.8768750000000001
A4: BONGA | B4: 4 | C4: 5.843 | D4: 27 | E4: 2 | F4: 5.9409999999999998 | G4: 26 | H4: 1 | I4: 5.61 | J4: 28 | K4: 3 | L4: 5.8289999999999997 | M4: 25 | N4: 5 | O4: 5.8979999999999997 | P4: 26 | Q4: 7 | R4: 5.8310000000000004 | S4: 29 | T4: 8 | U4: 6.0490000000000004 | V4: 23 | W4: 6 | X4: 5.83 | Y4: 27 | Z4: =+Y4+V4+S4+P4+M4+J4+G4+D4 -> 211 | AA4: =+(X4+U4+R4+O4+L4+I4+F4+C4)/8 -> 5.8538750000000004
A5: NETO | B5: 7 | C5: 5.5640000000000001 | D5: 26 | E5: 8 | F5: 5.431 | G5: 27 | H5: 6 | I5: 5.2809999999999997 | J5: 28 | K5: 4 | L5: 5.5369999999999999 | M5: 22 | N5: 2 | O5: 5.4 | P5: 27 | Q5: 1 | R5: 5.5650000000000004 | S5: 21 | T5: 3 | U5: 5.5549999999999997 | V5: 24 | W5: 5 | X5: 5.6260000000000003 | Y5: 26 | Z5: =+Y5+V5+S5+P5+M5+J5+G5+D5 -> 201 | AA5: =+(X5+U5+R5+O5+L5+I5+F5+C5)/8 -> 5.4948749999999995
A6: GIOVANNI | B6: 8 | C6: 5.8280000000000003 | D6: 25 | E6: 6 | F6: 5.67 | G6: 27 | H6: 4 | I6: 5.609 | J6: 26 | K6: 2 | L6: 5.758 | M6: 19 | N6: 1 | O6: 5.673 | P6: 28 | Q6: 3 | R6: 5.7759999999999998 | S6: 24 | T6: 5 | U6: 6.0609999999999999 | V6: 25 | W6: 7 | X6: 5.899 | Y6: 23 | Z6: =+Y6+V6+S6+P6+M6+J6+G6+D6 -> 197 | AA6: =+(X6+U6+R6+O6+L6+I6+F6+C6)/8 -> 5.7842500000000001
A7: DINHO | B7: 6 | C7: 6.38 | D7: 19 | E7: 4 | F7: 6.1050000000000004 | G7: 23 | H7: 2 | I7: 6.056 | J7: 25 | K7: 1 | L7: 6.05 | M7: 23 | N7: 3 | O7: 5.72 | P7: 25 | Q7: 5 | R7: 5.94 | S7: 26 | T7: 7 | U7: 6.0090000000000003 | V7: 26 | W7: 8 | X7: 5.8849999999999998 | Y7: 27 | Z7: =+Y7+V7+S7+P7+M7+J7+G7+D7 -> 194 | AA7: =+(X7+U7+R7+O7+L7+I7+F7+C7)/8 -> 6.0181250000000004
A8: RICARDO | B8: 2 | C8: 6.27 | D8: 19 | E8: 1 | F8: 6.1050000000000004 | G8: 21 | H8: 3 | I8: 5.94 | J8: 25 | K8: 5 | L8: 5.94 | M8: 23 | N8: 7 | O8: 5.9950000000000001 | P8: 26 | Q8: 8 | R8: 5.766 | S8: 25 | T8: 6 | U8: 5.7210000000000001 | V8: 23 | W8: 4 | X8: 6.1040000000000001 | Y8: 22 | Z8: =+Y8+V8+S8+P8+M8+J8+G8+D8 -> 184 | AA8: =+(X8+U8+R8+O8+L8+I8+F8+C8)/8 -> 5.9801249999999992