A1: R$14,99 mussarela, catupiry, buon gustaio, toscanela, calabresa (preço para retirar no balcão) | C1: R$14,99 mussarela, catupiry, buon gustaio, toscanela, calabresa (preço para retirar no balcão)

A1: Pos | B1: Nome | C1: 1 ETAPA | D1: 2 ETAPA | E1: 3 ETAPA | F1: 4 ETAPA | G1: 5 ETAPA | H1: 6 ETAPA | I1: 7 ETAPA | J1: 8 ETAPA | K1: 9 ETAPA | L1: 10 ETAPA | M1: 11 ETAPA | N1: PONTOS | O1: DESCARTE | P1: TOTAL
A2: 1 | B2: BONGA | C2: 165 | D2: 165 | E2: 165 | F2: 175 | G2: 175 | H2: 175 | I2: 175 | J2: 175 | K2: 165 | L2: 0 | M2: 175 | N2: =SUM(C2:M2) -> 1710 | O2: =MINA(M2,L2,K2,J2,I2,H2,G2,F2,E2,D2,C2) -> 0 | P2: =+N2-O2 -> 1710
A3: 2 | B3: RUBAO | C3: 0 | D3: 170 | E3: 175 | F3: 165 | G3: 170 | H3: 0 | I3: 170 | J3: 155 | K3: 150 | L3: 160 | M3: 155 | N3: =SUM(C3:M3) -> 1470 | O3: =MINA(M3,L3,K3,J3,I3,H3,G3,F3,E3,D3,C3) -> 0 | P3: =+N3-O3 -> 1470
A4: 3 | B4: JERA | C4: 134 | D4: 0 | E4: 146 | F4: 170 | G4: 165 | H4: 0 | I4: 165 | J4: 160 | K4: 160 | L4: 170 | M4: 150 | N4: =SUM(C4:M4) -> 1420 | O4: =MINA(M4,L4,K4,J4,I4,H4,G4,F4,E4,D4,C4) -> 0 | P4: =+N4-O4 -> 1420
A5: 4 | B5: MORTADELA | C5: 160 | D5: 0 | E5: 0 | F5: 160 | G5: 160 | H5: 0 | I5: 150 | J5: 146 | K5: 155 | L5: 165 | M5: 160 | N5: =SUM(C5:M5) -> 1256 | O5: =MINA(M5,L5,K5,J5,I5,H5,G5,F5,E5,D5,C5) -> 0 | P5: =+N5-O5 -> 1256
A6: 5 | B6: DINHO | C6: 170 | D6: 150 | E6: 0 | F6: 0 | G6: 142 | H6: 170 | I6: 160 | J6: 170 | K6: 146 | L6: 0 | M6: 0 | N6: =SUM(C6:M6) -> 1108 | O6: =MINA(M6,L6,K6,J6,I6,H6,G6,F6,E6,D6,C6) -> 0 | P6: =+N6-O6 -> 1108
A7: 6 | B7: NETO | C7: 155 | D7: 160 | E7: 150 | F7: 146 | G7: 155 | H7: 155 | I7: 0 | J7: 0 | K7: 0 | L7: 0 | M7: 0 | N7: =SUM(C7:M7) -> 921 | O7: =MINA(M7,L7,K7,J7,I7,H7,G7,F7,E7,D7,C7) -> 0 | P7: =+N7-O7 -> 921
A8: 7 | B8: KLEBER | C8: 142 | D8: 0 | E8: 0 | F8: 0 | G8: 0 | H8: 0 | I8: 0 | J8: 165 | K8: 170 | L8: 175 | M8: 170 | N8: =SUM(C8:M8) -> 822 | O8: =MINA(M8,L8,K8,J8,I8,H8,G8,F8,E8,D8,C8) -> 0 | P8: =+N8-O8 -> 822
A9: 8 | B9: GOROI | C9: 175 | D9: 175 | E9: 160 | F9: 150 | G9: 146 | H9: 0 | I9: 0 | J9: 0 | K9: 0 | L9: 0 | M9: 0 | N9: =SUM(C9:M9) -> 806 | O9: =MINA(M9,L9,K9,J9,I9,H9,G9,F9,E9,D9,C9) -> 0 | P9: =+N9-O9 -> 806
A10: 9 | B10: MARCEL | C10: 0 | D10: 0 | E10: 0 | F10: 0 | G10: 0 | H10: 0 | I10: 0 | J10: 134 | K10: 175 | L10: 155 | M10: 165 | N10: =SUM(C10:M10) -> 629 | O10: =MINA(M10,L10,K10,J10,I10,H10,G10,F10,E10,D10,C10) -> 0 | P10: =+N10-O10 -> 629
A11: 10 | B11: GIOVANNI | C11: 146 | D11: 155 | E11: 155 | F11: 0 | G11: 0 | H11: 165 | I11: 0 | J11: 0 | K11: 0 | L11: 0 | M11: 0 | N11: =SUM(C11:M11) -> 621 | O11: =MINA(M11,L11,K11,J11,I11,H11,G11,F11,E11,D11,C11) -> 0 | P11: =+N11-O11 -> 621
A12: 11 | B12: RUDSON | C12: 0 | D12: 0 | E12: 0 | F12: 0 | G12: 146 | H12: 0 | I12: 0 | J12: 0 | K12: 138 | L12: 146 | M12: 146 | N12: =SUM(C12:M12) -> 576 | O12: =MINA(M12,L12,K12,J12,I12,H12,G12,F12,E12,D12,C12) -> 0 | P12: =+N12-O12 -> 576
A13: 12 | B13: ERIC | C13: 0 | D13: 0 | E13: 0 | F13: 0 | G13: 150 | H13: 160 | I13: 0 | J13: 150 | K13: 0 | L13: 0 | M13: 0 | N13: =SUM(C13:M13) -> 460 | O13: =MINA(M13,L13,K13,J13,I13,H13,G13,F13,E13,D13,C13) -> 0 | P13: =+N13-O13 -> 460
A14: 13 | B14: MICHEL | C14: 130 | D14: 0 | E14: 170 | F14: 0 | G14: 0 | H14: 0 | I14: 0 | J14: 0 | K14: 0 | L14: 150 | M14: 0 | N14: =SUM(C14:M14) -> 450 | O14: =MINA(M14,L14,K14,J14,I14,H14,G14,F14,E14,D14,C14) -> 0 | P14: =+N14-O14 -> 450
A15: 14 | B15: MARQUINHO | C15: 150 | D15: 0 | E15: 0 | F15: 0 | G15: 0 | H15: 0 | I15: 155 | J15: 138 | K15: 0 | L15: 0 | M15: 0 | N15: =SUM(C15:M15) -> 443 | O15: =MINA(M15,L15,K15,J15,I15,H15,G15,F15,E15,D15,C15) -> 0 | P15: =+N15-O15 -> 443
A16: 15 | B16: RICARDO | C16: 138 | D16: 146 | E16: 0 | F16: 0 | G16: 0 | H16: 0 | I16: 146 | J16: 0 | K16: 0 | L16: 0 | M16: 0 | N16: =SUM(C16:M16) -> 430 | O16: =MINA(M16,L16,K16,J16,I16,H16,G16,F16,E16,D16,C16) -> 0 | P16: =+N16-O16 -> 430
A17: 16 | B17: JULIO | C17: 0 | D17: 0 | E17: 0 | F17: 155 | G17: 0 | H17: 0 | I17: 0 | J17: 0 | K17: 0 | L17: 0 | M17: 0 | N17: =SUM(C17:M17) -> 155 | O17: =MINA(M17,L17,K17,J17,I17,H17,G17,F17,E17,D17,C17) -> 0 | P17: =+N17-O17 -> 155
A18: 17 | B18: BOTELHO | C18: 0 | D18: 0 | E18: 0 | F18: 0 | G18: 0 | H18: 0 | I18: 142 | J18: 0 | K18: 0 | L18: 0 | M18: 0 | N18: =SUM(C18:M18) -> 142 | O18: =MINA(M18,L18,K18,J18,I18,H18,G18,F18,E18,D18,C18) -> 0 | P18: =+N18-O18 -> 142
A19: 18 | B19: RACHID | C19: 0 | D19: 0 | E19: 0 | F19: 142 | G19: 0 | H19: 0 | I19: 0 | J19: 0 | K19: 0 | L19: 0 | M19: 0 | N19: =SUM(C19:M19) -> 142 | O19: =MINA(M19,L19,K19,J19,I19,H19,G19,F19,E19,D19,C19) -> 0 | P19: =+N19-O19 -> 142
A20: 19 | B20: MANE | C20: 0 | D20: 0 | E20: 0 | F20: 0 | G20: 0 | H20: 0 | I20: 0 | J20: 142 | K20: 0 | L20: 0 | M20: 0 | N20: =SUM(C20:M20) -> 142 | O20: =MINA(M20,L20,K20,J20,I20,H20,G20,F20,E20,D20,C20) -> 0 | P20: =+N20-O20 -> 142
A21: 20 | B21: LEONCIO | C21: 0 | D21: 0 | E21: 0 | F21: 0 | G21: 0 | H21: 0 | I21: 0 | J21: 0 | K21: 142 | L21: 0 | M21: 0 | N21: =SUM(C21:M21) -> 142 | O21: =MINA(M21,L21,K21,J21,I21,H21,G21,F21,E21,D21,C21) -> 0 | P21: =+N21-O21 -> 142

A1: Record | B1: Voltas
A2: Bonga | B2: 246.188