A1: PILOTOS | B1: P | C1: TEMPO | D1: V | E1: P | F1: TEMPO | G1: V | H1: P | I1: TEMPO | J1: V | K1: P | L1: TEMPO | M1: V | N1: P | O1: TEMPO | P1: V | Q1: P | R1: TEMPO | S1: V | T1: P | U1: TEMPO | V1: V | W1: P | X1: TEMPO | Y1: V | Z1: TOTAL | AA1: MEDIA
A2: ANDERSON | B2: 8 | C2: 5.056 | D2: 30 | E2: 6 | F2: 4.8959999999999999 | G2: 31 | H2: 4 | I2: 5.0609999999999999 | J2: 30 | K2: 2 | L2: 4.9 | M2: 31 | N2: 1 | O2: 4.6749999999999998 | P2: 33 | Q2: 3 | R2: 4.84 | S2: 32 | T2: 5 | U2: 4.66 | V2: 32 | W2: 7 | X2: 4.51 | Y2: 33 | Z2: 252.87037037037038 | AA2: =+(X2+U2+R2+O2+L2+I2+F2+C2)/8 -> 4.8247499999999999
A3: ANGELAO | B3: 5 | C3: 4.6749999999999998 | D3: 29 | E3: 7 | F3: 5.06 | G3: 31 | H3: 8 | I3: 5.0590000000000002 | J3: 31 | K3: 6 | L3: 4.8940000000000001 | M3: 32 | N3: 4 | O3: 4.8390000000000004 | P3: 33 | Q3: 2 | R3: 4.62 | S3: 30 | T3: 1 | U3: 4.6749999999999998 | V3: 33 | W3: 3 | X3: 4.5359999999999996 | Y3: 31 | Z3: 252.27777777777777 | AA3: =+(X3+U3+R3+O3+L3+I3+F3+C3)/8 -> 4.7947499999999996
A4: DINHO | B4: 3 | C4: 4.8949999999999996 | D4: 32 | E4: 5 | F4: 5.1150000000000002 | G4: 28 | H4: 7 | I4: 5.1180000000000003 | J4: 32 | K4: 8 | L4: 4.867 | M4: 31 | N4: 6 | O4: 5.2809999999999997 | P4: 30 | Q4: 4 | R4: 5.06 | S4: 30 | T4: 2 | U4: 4.8949999999999996 | V4: 32 | W4: 1 | X4: 4.7039999999999997 | Y4: 30 | Z4: 246.24074074074073 | AA4: =+(X4+U4+R4+O4+L4+I4+F4+C4)/8 -> 4.9918750000000003
A5: RICARDO | B5: 7 | C5: 5.28 | D5: 27 | E5: 8 | F5: 4.867 | G5: 28 | H5: 6 | I5: 5.3879999999999999 | J5: 30 | K5: 4 | L5: 5.2779999999999996 | M5: 28 | N5: 2 | O5: 5.0590000000000002 | P5: 31 | Q5: 1 | R5: 5.07 | S5: 28 | T5: 3 | U5: 4.8940000000000001 | V5: 31 | W5: 5 | X5: 5.0069999999999997 | Y5: 25 | Z5: 229.12962962962962 | AA5: =+(X5+U5+R5+O5+L5+I5+F5+C5)/8 -> 5.1053749999999996
A6: RUBAO | B6: 1 | C6: 5.0570000000000004 | D6: 28 | E6: 3 | F6: 5.1189999999999998 | G6: 26 | H6: 5 | I6: 5.17 | J6: 30 | K6: 7 | L6: 5.3310000000000004 | M6: 29 | N6: 8 | O6: 5.4020000000000001 | P6: 29 | Q6: 6 | R6: 5.3890000000000002 | S6: 28 | T6: 4 | U6: 5.17 | V6: 30 | W6: 2 | X6: 4.5640000000000001 | Y6: 26 | Z6: 226.25925925925927 | AA6: =+(X6+U6+R6+O6+L6+I6+F6+C6)/8 -> 5.1502500000000007
A7: HENRIQUE | B7: 2 | C7: 5.0570000000000004 | D7: 28 | E7: 1 | F7: 5.3390000000000004 | G7: 31 | H7: 3 | I7: 5.4989999999999997 | J7: 26 | K7: 5 | L7: 5.1239999999999997 | M7: 27 | N7: 7 | O7: 5.06 | P7: 32 | Q7: 8 | R7: 5.1130000000000004 | S7: 29 | T7: 6 | U7: 5.1109999999999998 | V7: 26 | W7: 4 | X7: 4.7839999999999998 | Y7: 24 | Z7: 224.2962962962963 | AA7: =+(X7+U7+R7+O7+L7+I7+F7+C7)/8 -> 5.1358749999999995
A8: JOAO K | B8: 4 | C8: 4.8949999999999996 | D8: 30 | E8: 2 | F8: 5.17 | G8: 21 | H8: 1 | I8: 5.3869999999999996 | J8: 29 | K8: 3 | L8: 5.27 | M8: 22 | N8: 5 | O8: 5.1189999999999998 | P8: 29 | Q8: 7 | R8: 5.39 | S8: 27 | T8: 8 | U8: 5.2789999999999999 | V8: 26 | W8: 6 | X8: 4.5359999999999996 | Y8: 30 | Z8: 216.14814814814815 | AA8: =+(X8+U8+R8+O8+L8+I8+F8+C8)/8 -> 5.130749999999999
A9: JERA | B9: 6 | C9: 5.2779999999999996 | D9: 23 | E9: 4 | F9: 4.6470000000000002 | G9: 19 | H9: 2 | I9: 5.1669999999999998 | J9: 24 | K9: 1 | L9: 5.335 | M9: 22 | N9: 3 | O9: 4.9219999999999997 | P9: 27 | Q9: 5 | R9: 5.4020000000000001 | S9: 24 | T9: 7 | U9: 5.1319999999999997 | V9: 26 | W9: 8 | X9: 4.5640000000000001 | Y9: 19 | Z9: 184.44444444444446 | AA9: =+(X9+U9+R9+O9+L9+I9+F9+C9)/8 -> 5.0558749999999995