A1: PILOTOS | B1: P | C1: TEMPO | D1: V | E1: P | F1: TEMPO | G1: V | H1: P | I1: TEMPO | J1: V | K1: P | L1: TEMPO | M1: V | N1: P | O1: TEMPO | P1: V | Q1: P | R1: TEMPO | S1: V | T1: P | U1: TEMPO | V1: V | W1: P | X1: TEMPO | Y1: V | Z1: TOTAL | AA1: MEDIA
A2: NETO | B2: 4 | C2: 5.883 | D2: 23 | E2: 2 | F2: 5.5 | G2: 26 | H2: 1 | I2: 5.5549999999999997 | J2: 27 | K2: 3 | L2: 5.5 | M2: 26 | N2: 5 | O2: 5.9349999999999996 | P2: 25 | Q2: 7 | R2: 5.83 | S2: 24 | T2: 8 | U2: 5.72 | V2: 28 | W2: 6 | X2: 5.83 | Y2: 27 | Z2: 206.66666666666666 | AA2: =+(X2+U2+R2+O2+L2+I2+F2+C2)/8 -> 5.7191250000000009
A3: CHANEL | B3: 7 | C3: 5.94 | D3: 23 | E3: 8 | F3: 5.7750000000000004 | G3: 19 | H3: 6 | I3: 5.72 | J3: 26 | K3: 4 | L3: 5.72 | M3: 22 | N3: 2 | O3: 5.5 | P3: 26 | Q3: 1 | R3: 5.1669999999999998 | S3: 26 | T3: 3 | U3: 5.4960000000000004 | V3: 25 | W3: 5 | X3: 5.72 | Y3: 21 | Z3: 188.37037037037038 | AA3: =+(X3+U3+R3+O3+L3+I3+F3+C3)/8 -> 5.6297499999999996
A4: ERIC | B4: 6 | C4: 5.72 | D4: 25 | E4: 4 | F4: 6.3250000000000002 | G4: 9 | H4: 2 | I4: 5.9409999999999998 | J4: 26 | K4: 1 | L4: 6.04 | M4: 24 | N4: 3 | O4: 5.9450000000000003 | P4: 22 | Q4: 5 | R4: 5.9969999999999999 | S4: 22 | T4: 7 | U4: 5.9450000000000003 | V4: 26 | W4: 8 | X4: 5.9390000000000001 | Y4: 25 | Z4: 180.62962962962962 | AA4: =+(X4+U4+R4+O4+L4+I4+F4+C4)/8 -> 5.9815000000000005
A5: M.JOSE | B5: 2 | C5: 6.8209999999999997 | D5: 20 | E5: 1 | F5: 6.82 | G5: 21 | H5: 3 | I5: 6.7140000000000004 | J5: 22 | K5: 5 | L5: 6.4909999999999997 | M5: 19 | N5: 7 | O5: 6.1639999999999997 | P5: 20 | Q5: 8 | R5: 5.3890000000000002 | S5: 16 | T5: 6 | U5: 6.3250000000000002 | V5: 23 | W5: 4 | X5: 6.0110000000000001 | Y5: 19 | Z5: 162.64814814814815 | AA5: =+(X5+U5+R5+O5+L5+I5+F5+C5)/8 -> 6.3418749999999999
A6: M.VINICIUS | B6: 3 | C6: 6.82 | D6: 20 | E6: 5 | F6: 4.8040000000000003 | G6: 17 | H6: 7 | I6: 6.82 | J6: 20 | K6: 8 | L6: 6.8710000000000004 | M6: 10 | N6: 6 | O6: 4.9729999999999999 | P6: 16 | Q6: 4 | R6: 6.601 | S6: 18 | T6: 2 | U6: 6.6520000000000001 | V6: 19 | W6: 1 | X6: 5.7530000000000001 | Y6: 15 | Z6: 236.0185185185185 | AA6: =+(X6+U6+R6+O6+L6+I6+F6+C6)/8 -> 6.1617500000000005
A7: LUIZ FELIPE | B7: 1 | C7: 6.3250000000000002 | D7: 15 | E7: 3 | F7: 5.8979999999999997 | G7: 14 | H7: 5 | I7: 6.8739999999999997 | J7: 16 | K7: 7 | L7: 6.27 | M7: 15 | N7: 8 | O7: 4.84 | P7: 18 | Q7: 6 | R7: 4.95 | S7: 11 | T7: 4 | U7: 6.82 | V7: 7 | W7: 2 | X7: 6.6559999999999997 | Y7: 16 | Z7: 112.87037037037037 | AA7: =+(X7+U7+R7+O7+L7+I7+F7+C7)/8 -> 6.0791249999999994

A1: PILOTOS | B1: P | C1: TEMPO | D1: V | E1: P | F1: TEMPO | G1: V | H1: P | I1: TEMPO | J1: V | K1: P | L1: TEMPO | M1: V | N1: P | O1: TEMPO | P1: V | Q1: P | R1: TEMPO | S1: V | T1: P | U1: TEMPO | V1: V | W1: P | X1: TEMPO | Y1: V | Z1: TOTAL | AA1: MEDIA
A2: JOAO K | B2: 4 | C2: 5.335 | D2: 29 | E2: 2 | F2: 5.4989999999999997 | G2: 28 | H2: 1 | I2: 5.1429999999999998 | J2: 29 | K2: 3 | L2: 5.5 | M2: 28 | N2: 5 | O2: 5.5 | P2: 29 | Q2: 7 | R2: 5.5529999999999999 | S2: 30 | T2: 8 | U2: 5.6139999999999999 | V2: 24 | W2: 6 | X2: 5.5549999999999997 | Y2: 27 | Z2: 225.03703703703704 | AA2: =+(X2+U2+R2+O2+L2+I2+F2+C2)/8 -> 5.4623750000000006
A3: JERA | B3: 1 | C3: 5.72 | D3: 27 | E3: 3 | F3: 5.665 | G3: 28 | H3: 5 | I3: 4.923 | J3: 27 | K3: 7 | L3: 5.1429999999999998 | M3: 30 | N3: 8 | O3: 5.4950000000000001 | P3: 26 | Q3: 6 | R3: 5.2679999999999998 | S3: 28 | T3: 4 | U3: 5.2789999999999999 | V3: 26 | W3: 2 | X3: 5.2249999999999996 | Y3: 22 | Z3: 215.07407407407408 | AA3: =+(X3+U3+R3+O3+L3+I3+F3+C3)/8 -> 5.3397499999999996
A4: EVANDRO | B4: 2 | C4: 6.1050000000000004 | D4: 25 | E4: 1 | F4: 5.9980000000000002 | G4: 26 | H4: 3 | I4: 5.9950000000000001 | J4: 25 | K4: 5 | L4: 5.9370000000000003 | M4: 27 | N4: 7 | O4: 4.6159999999999997 | P4: 27 | Q4: 8 | R4: 5.774 | S4: 25 | T4: 6 | U4: 5.7210000000000001 | V4: 28 | W4: 4 | X4: 5.9989999999999997 | Y4: 22 | Z4: 205.66666666666666 | AA4: =+(X4+U4+R4+O4+L4+I4+F4+C4)/8 -> 5.7681250000000004
A5: BONGA | B5: 3 | C5: 5.7169999999999996 | D5: 27 | E5: 5 | F5: 5.7759999999999998 | G5: 27 | H5: 7 | I5: 5.6790000000000003 | J5: 26 | K5: 8 | L5: 5.61 | M5: 26 | N5: 6 | O5: 5.7249999999999996 | P5: 24 | Q5: 4 | R5: 5.4889999999999999 | S5: 27 | T5: 2 | U5: 5.5529999999999999 | V5: 25 | W5: 1 | X5: 4.7290000000000001 | Y5: 21 | Z5: 203.94444444444446 | AA5: =+(X5+U5+R5+O5+L5+I5+F5+C5)/8 -> 5.5347500000000007
A6: CONRADO | B6: 8 | C6: 6.3819999999999997 | D6: 20 | E6: 6 | F6: 6.16 | G6: 26 | H6: 4 | I6: 6.0469999999999997 | J6: 25 | K6: 2 | L6: 6.2149999999999999 | M6: 21 | N6: 1 | O6: 6.1630000000000003 | P6: 23 | Q6: 3 | R6: 6.37 | S6: 24 | T6: 5 | U6: 5.6420000000000003 | V6: 22 | W6: 7 | X6: 6.4930000000000003 | Y6: 24 | Z6: 186.2037037037037 | AA6: =+(X6+U6+R6+O6+L6+I6+F6+C6)/8 -> 6.1840000000000002
A7: RACHID | B7: 6 | C7: 5.774 | D7: 26 | E7: 4 | F7: 5.718 | G7: 25 | H7: 2 | I7: 5.9359999999999999 | J7: 25 | K7: 1 | L7: 6.157 | M7: 20 | N7: 3 | O7: 5.3079999999999998 | P7: 26 | Q7: 5 | R7: 5.9359999999999999 | S7: 21 | T7: 7 | U7: 5.9370000000000003 | V7: 24 | W7: 8 | X7: 6.3760000000000003 | Y7: 16 | Z7: 185.55555555555554 | AA7: =+(X7+U7+R7+O7+L7+I7+F7+C7)/8 -> 5.8927500000000013
A8: GOROI | B8: 5 | C8: 5.7190000000000003 | D8: 27 | E8: 7 | F8: 5.992 | G8: 26 | H8: 8 | I8: 5.7160000000000002 | J8: 19 | K8: 6 | L8: 5.5 | M8: 22 | N8: 4 | O8: 5.7169999999999996 | P8: 19 | Q8: 2 | R8: 11.675000000000001 | S8: 1 | W8: 3 | X8: 6.1559999999999997 | Y8: 13 | Z8: 128 | AA8: =+(X8+U8+R8+O8+L8+I8+F8+C8)/8 -> 5.8093750000000002

A1: PILOTOS | B1: P | C1: TEMPO | D1: V | E1: P | F1: TEMPO | G1: V | H1: P | I1: TEMPO | J1: V | K1: P | L1: TEMPO | M1: V | N1: P | O1: TEMPO | P1: V | Q1: P | R1: TEMPO | S1: V | T1: P | U1: TEMPO | V1: V | W1: P | X1: TEMPO | Y1: V | Z1: TOTAL | AA1: MEDIA
A2: ANDERSON | B2: 8 | C2: 5.0049999999999999 | D2: 31 | E2: 6 | F2: 4.9509999999999996 | G2: 30 | H2: 4 | I2: 5.056 | J2: 30 | K2: 2 | L2: 4.8949999999999996 | M2: 31 | N2: 1 | O2: 4.6740000000000004 | P2: 30 | Q2: 3 | R2: 5.056 | S2: 32 | T2: 5 | U2: 5.056 | V2: 31 | W2: 7 | X2: 4.8410000000000002 | Y2: 31 | Z2: 247.92592592592592 | AA2: =+(X2+U2+R2+O2+L2+I2+F2+C2)/8 -> 4.9417499999999999
A3: ANGELAO | B3: 5 | C3: 5.06 | D3: 29 | E3: 7 | F3: 4.8940000000000001 | G3: 31 | H3: 8 | I3: 4.7119999999999997 | J3: 27 | K3: 6 | L3: 5.056 | M3: 31 | N3: 4 | O3: 4.8949999999999996 | P3: 31 | Q3: 2 | R3: 4.7309999999999999 | S3: 31 | T3: 1 | U3: 4.907 | V3: 33 | W3: 3 | X3: 5.06 | Y3: 32 | Z3: 246.94444444444446 | AA3: =+(X3+U3+R3+O3+L3+I3+F3+C3)/8 -> 4.9143749999999997
A4: DINHO | B4: 6 | C4: 5.1120000000000001 | D4: 31 | E4: 4 | F4: 5.0590000000000002 | G4: 30 | H4: 2 | I4: 5.0590000000000002 | J4: 30 | K4: 1 | L4: 5.0579999999999998 | M4: 32 | N4: 3 | O4: 4.6749999999999998 | P4: 34 | Q4: 5 | R4: 5.0590000000000002 | S4: 28 | T4: 7 | U4: 5.0060000000000002 | V4: 28 | W4: 8 | X4: 5.06 | Y4: 28 | Z4: 243.0185185185185 | AA4: =+(X4+U4+R4+O4+L4+I4+F4+C4)/8 -> 5.0110000000000001
A5: HENRIQUE | B5: 2 | C5: 5.2220000000000004 | D5: 29 | E5: 1 | F5: 5.2809999999999997 | G5: 30 | H5: 3 | I5: 5.4969999999999999 | J5: 26 | K5: 5 | L5: 5.29 | M5: 30 | N5: 7 | O5: 5.1710000000000003 | P5: 31 | Q5: 8 | R5: 5.2809999999999997 | S5: 28 | T5: 6 | U5: 5.39 | V5: 26 | W5: 4 | X5: 5.4420000000000002 | Y5: 28 | Z5: 229.75925925925927 | AA5: =+(X5+U5+R5+O5+L5+I5+F5+C5)/8 -> 5.3217499999999998
A6: RUBAO | B6: 4 | C6: 5.39 | D6: 26 | E6: 2 | F6: 5.2750000000000004 | G6: 30 | H6: 1 | I6: 4.6150000000000002 | J6: 23 | K6: 3 | L6: 5.3390000000000004 | M6: 27 | N6: 5 | O6: 5.39 | P6: 29 | Q6: 7 | R6: 5.28 | S6: 30 | T6: 8 | U6: 5.4969999999999999 | V6: 28 | W6: 6 | X6: 5.46 | Y6: 28 | Z6: 224.03703703703704 | AA6: =+(X6+U6+R6+O6+L6+I6+F6+C6)/8 -> 5.2807500000000003
A7: RICARDO | B7: 3 | C7: 5.2839999999999998 | D7: 21 | E7: 5 | F7: 5.3890000000000002 | G7: 30 | H7: 7 | I7: 5.117 | J7: 27 | K7: 8 | L7: 5.28 | M7: 30 | N7: 6 | O7: 5.391 | P7: 26 | Q7: 4 | R7: 5.4980000000000002 | S7: 30 | T7: 2 | U7: 5.28 | V7: 30 | W7: 1 | X7: 5.39 | Y7: 28 | Z7: 222.77777777777777 | AA7: =+(X7+U7+R7+O7+L7+I7+F7+C7)/8 -> 5.3286249999999997