A1: R$14,99 mussarela, catupiry, buon gustaio, toscanela, calabresa (preço para retirar no balcão) | C1: R$14,99 mussarela, catupiry, buon gustaio, toscanela, calabresa (preço para retirar no balcão)

A1: Piloto | B1: Pi | C1: Tempo | D1: Voltas | E1: Pi | F1: Tempo | G1: Voltas | H1: Pi | I1: Tempo | J1: Voltas | K1: Pi | L1: Tempo | M1: Voltas | N1: Pi | O1: Tempo | P1: Voltas | Q1: Pi | R1: Tempo | S1: Voltas | T1: Pi | U1: Tempo | V1: Voltas | W1: Pi | X1: Tempo | Y1: Voltas | Z1: Total | AA1: Media | AB1: Record
A2: MARC+MICHEL | B2: 6 | C2: 4.8390000000000004 | D2: 338 | E2: 4 | F2: 4.4 | G2: 337 | H2: 2 | I2: 4.6189999999999998 | J2: 348 | K2: 1 | L2: 4.8220000000000001 | M2: 338 | N2: 3 | O2: 4.8040000000000003 | P2: 322 | Q2: 5 | R2: 4.8390000000000004 | S2: 308 | T2: 7 | U2: 4.4539999999999997 | V2: 337 | W2: 8 | X2: 5.0590000000000002 | Y2: 310 | Z2: =+Y2+V2+S2+P2+M2+J2+G2+D2 -> 2638 | AA2: =+(X2+U2+R2+O2+L2+I2+F2+C2)/8 -> 4.7294999999999998 | AB2: =MINA(X2,U2,R2,O2,L2,I2,F2,C2) -> 4.4
A3: BONGA+DINHO | B3: 1 | C3: 4.84 | D3: 330 | E3: 3 | F3: 5.0049999999999999 | G3: 332 | H3: 5 | I3: 4.8390000000000004 | J3: 319 | K3: 7 | L3: 5.0590000000000002 | M3: 312 | N3: 8 | O3: 4.62 | P3: 306 | Q3: 6 | R3: 4.6859999999999999 | S3: 325 | T3: 4 | U3: 4.399 | V3: 330 | W3: 2 | X3: 5.0510000000000002 | Y3: 318 | Z3: =+Y3+V3+S3+P3+M3+J3+G3+D3 -> 2572 | AA3: =+(X3+U3+R3+O3+L3+I3+F3+C3)/8 -> 4.8123750000000012 | AB3: =MINA(X3,U3,R3,O3,L3,I3,F3,C3) -> 4.399
A4: JERA+RUBAO | B4: 7 | C4: 4.9509999999999996 | D4: 332 | E4: 8 | F4: 4.38 | G4: 309 | H4: 6 | I4: 4.8179999999999996 | J4: 319 | K4: 4 | L4: 5.0590000000000002 | M4: 315 | N4: 2 | O4: 4.8390000000000004 | P4: 314 | Q4: 1 | R4: 4.8920000000000003 | S4: 313 | T4: 3 | U4: 4.4009999999999998 | V4: 322 | W4: 5 | X4: 4.399 | Y4: 304 | Z4: =+Y4+V4+S4+P4+M4+J4+G4+D4 -> 2528 | AA4: =+(X4+U4+R4+O4+L4+I4+F4+C4)/8 -> 4.7173750000000005 | AB4: =MINA(X4,U4,R4,O4,L4,I4,F4,C4) -> 4.38
A5: MORT+MARQ | B5: 2 | C5: 4.8390000000000004 | D5: 336 | E5: 1 | F5: 4.9550000000000001 | G5: 327 | H5: 3 | I5: 4.8490000000000002 | J5: 323 | K5: 5 | L5: 5.2619999999999996 | M5: 296 | N5: 7 | O5: 4.4550000000000001 | P5: 311 | Q5: 8 | R5: 4.4 | S5: 280 | T5: 6 | U5: 4.4509999999999996 | V5: 335 | W5: 4 | X5: 5.0590000000000002 | Y5: 246 | Z5: =+Y5+V5+S5+P5+M5+J5+G5+D5 -> 2454 | AA5: =+(X5+U5+R5+O5+L5+I5+F5+C5)/8 -> 4.7837500000000004 | AB5: =MINA(X5,U5,R5,O5,L5,I5,F5,C5) -> 4.4
A6: ANDE+KLEBER | B6: 3 | C6: 5.0049999999999999 | D6: 325 | E6: 5 | F6: 5.2789999999999999 | G6: 298 | H6: 7 | I6: 4.6239999999999997 | J6: 328 | K6: 8 | L6: 4.4 | M6: 299 | N6: 6 | O6: 4.399 | P6: 284 | Q6: 4 | R6: 5.0049999999999999 | S6: 241 | T6: 2 | U6: 4.399 | V6: 301 | W6: 1 | X6: 5.3339999999999996 | Y6: 270 | Z6: =+Y6+V6+S6+P6+M6+J6+G6+D6 -> 2346 | AA6: =+(X6+U6+R6+O6+L6+I6+F6+C6)/8 -> 4.805625 | AB6: =MINA(X6,U6,R6,O6,L6,I6,F6,C6) -> 4.399
A7: RICAR+EVAND | B7: 8 | C7: 5.06 | D7: 311 | E7: 6 | F7: 5.1150000000000002 | G7: 299 | H7: 4 | I7: 4.6239999999999997 | J7: 320 | K7: 2 | L7: 4.4009999999999998 | M7: 278 | N7: 1 | O7: 5.5 | P7: 239 | Q7: 3 | R7: 5.06 | S7: 282 | T7: 5 | U7: 4.4480000000000004 | V7: 274 | W7: 7 | X7: 5.0449999999999999 | Y7: 235 | Z7: =+Y7+V7+S7+P7+M7+J7+G7+D7 -> 2238 | AA7: =+(X7+U7+R7+O7+L7+I7+F7+C7)/8 -> 4.906625 | AB7: =MINA(X7,U7,R7,O7,L7,I7,F7,C7) -> 4.4009999999999998
A8: ERIC+GIOVAN | B8: 5 | C8: 5.17 | D8: 267 | E8: 7 | F8: 4.8410000000000002 | G8: 246 | H8: 8 | I8: 4.4 | J8: 244 | K8: 6 | L8: 5.17 | M8: 308 | N8: 4 | O8: 4.4 | P8: 286 | Q8: 2 | R8: 4.9279999999999999 | S8: 287 | T8: 1 | U8: 4.7309999999999999 | V8: 308 | W8: 3 | X8: 4.399 | Y8: 287 | Z8: =+Y8+V8+S8+P8+M8+J8+G8+D8 -> 2233 | AA8: =+(X8+U8+R8+O8+L8+I8+F8+C8)/8 -> 4.7548750000000002 | AB8: =MINA(X8,U8,R8,O8,L8,I8,F8,C8) -> 4.399
A9: CHOR+BETO | B9: 4 | C9: 4.9489999999999998 | D9: 312 | E9: 2 | F9: 5.2750000000000004 | G9: 295 | H9: 1 | I9: 4.9489999999999998 | J9: 288 | K9: 3 | L9: 5.3879999999999999 | M9: 288 | N9: 5 | O9: 5.2809999999999997 | P9: 209 | Q9: 7 | R9: 4.62 | S9: 239 | T9: 8 | U9: 5.5 | V9: 259 | W9: 6 | X9: 5.28 | Y9: 258 | Z9: =+Y9+V9+S9+P9+M9+J9+G9+D9 -> 2148 | AA9: =+(X9+U9+R9+O9+L9+I9+F9+C9)/8 -> 5.1552499999999997 | AB9: =MINA(X9,U9,R9,O9,L9,I9,F9,C9) -> 4.62