A1: R$14,99 mussarela, catupiry, buon gustaio, toscanela, calabresa (preço para retirar no balcão) | C1: R$14,99 mussarela, catupiry, buon gustaio, toscanela, calabresa (preço para retirar no balcão)

A1: Pilotos | B1: Pis | C1: Tempo | D1: Vol | E1: Pis | F1: Tempo | G1: Vol | H1: Pis | I1: Tempo | J1: Vol | K1: Pis | L1: Tempo | M1: Vol | N1: Pis | O1: Tempo | P1: Vol | Q1: Pis | R1: Tempo | S1: Vol | T1: Pis | U1: Tempo | V1: Vol | W1: Pis | X1: Tempo | Y1: Vol | Z1: Total | AA1: Media
A2: VEIA LOCA | B2: 3 | C2: 5.5549999999999997 | D2: 42 | E2: 5 | F2: 5.5540000000000003 | G2: 36 | H2: 7 | I2: 5.2229999999999999 | J2: 45 | K2: 8 | L2: 5.6239999999999997 | M2: 40 | N2: 6 | O2: 5.266 | P2: 37 | Q2: 4 | R2: 5.3360000000000003 | S2: 30 | T2: 2 | U2: 5.5 | V2: 46 | W2: 1 | X2: 5.444 | Y2: 41 | Z2: =+Y2+V2+S2+P2+M2+J2+G2+D2 -> 317 | AA2: =+(X2+U2+R2+O2+L2+I2+F2+C2)/8 -> 5.4377500000000003
A3: MORTADELA | B3: 5 | C3: 5.9950000000000001 | D3: 42 | E3: 7 | F3: 5.8849999999999998 | G3: 43 | H3: 8 | I3: 6.3129999999999997 | J3: 33 | K3: 6 | L3: 5.9409999999999998 | M3: 41 | N3: 4 | O3: 5.7759999999999998 | P3: 40 | Q3: 2 | R3: 5.8819999999999997 | S3: 35 | T3: 1 | U3: 6.16 | V3: 37 | W3: 3 | X3: 5.8259999999999996 | Y3: 42 | Z3: 315 | AA3: =+(X3+U3+R3+O3+L3+I3+F3+C3)/8 -> 5.9722499999999998
A4: GERA CASSIO | B4: 4 | C4: 6.4370000000000003 | D4: 41 | E4: 2 | F4: 5.8840000000000003 | G4: 42 | H4: 1 | I4: 6.6429999999999998 | J4: 35 | K4: 3 | L4: 5.8319999999999999 | M4: 43 | N4: 5 | O4: 7.04 | P4: 30 | Q4: 7 | R4: 6.2270000000000003 | S4: 39 | T4: 8 | U4: 6.5449999999999999 | V4: 41 | W4: 6 | X4: 5.9969999999999999 | Y4: 41 | Z4: =+Y4+V4+S4+P4+M4+J4+G4+D4 -> 312 | AA4: =+(X4+U4+R4+O4+L4+I4+F4+C4)/8 -> 6.3256249999999996
A5: DINHO JERA | B5: 2 | C5: 5.9409999999999998 | D5: 33 | E5: 1 | F5: 5.6689999999999996 | G5: 43 | H5: 3 | I5: 5.8310000000000004 | J5: 36 | K5: 5 | L5: 5.8310000000000004 | M5: 35 | N5: 7 | O5: 5.6680000000000001 | P5: 37 | Q5: 8 | R5: 5.83 | S5: 41 | T5: 6 | U5: 5.72 | V5: 39 | W5: 4 | X5: 5.3890000000000002 | Y5: 41 | Z5: =+Y5+V5+S5+P5+M5+J5+G5+D5 -> 305 | AA5: =+(X5+U5+R5+O5+L5+I5+F5+C5)/8 -> 5.7348749999999997
A6: GOSMENT | B6: 1 | C6: 6.0529999999999999 | D6: 38 | E6: 3 | F6: 5.9950000000000001 | G6: 43 | H6: 5 | I6: 6.27 | J6: 36 | K6: 7 | L6: 5.9950000000000001 | M6: 40 | N6: 8 | O6: 5.83 | P6: 30 | Q6: 6 | R6: 5.8849999999999998 | S6: 42 | T6: 4 | U6: 5.7220000000000004 | V6: 40 | W6: 2 | X6: 5.72 | Y6: 34 | Z6: =+Y6+V6+S6+P6+M6+J6+G6+D6 -> 303 | AA6: =+(X6+U6+R6+O6+L6+I6+F6+C6)/8 -> 5.9337499999999999
A7: RACHIDS | B7: 6 | C7: 6.11 | D7: 32 | E7: 4 | F7: 6.05 | G7: 41 | H7: 2 | I7: 6.0069999999999997 | J7: 38 | K7: 1 | L7: 6.6550000000000002 | M7: 28 | N7: 3 | O7: 6.1029999999999998 | P7: 27 | Q7: 5 | R7: 6.3789999999999996 | S7: 34 | T7: 7 | U7: 6.2149999999999999 | V7: 36 | W7: 8 | X7: 6.2709999999999999 | Y7: 37 | Z7: =+Y7+V7+S7+P7+M7+J7+G7+D7 -> 273 | AA7: =+(X7+U7+R7+O7+L7+I7+F7+C7)/8 -> 6.2237499999999999