A1: Calendário | B1: LOJA | C1: PISTA
A2: 28/03/2004 | B2: Stockcar - Piracicaba | C2: Blue King | D2: Resultados
A3: 02/05/2004 | B3: Targa - Limeira | C3: Blue King | D3: Resultados
A4: 30/05/2004 | B4: Monza São - Paulo | C4: Blue King | D4: Resultados
A5: 27/06/2004 | B5: Blue King - Ribeirão Preto | C5: Blue King | D5: Resultados
A6: 01/08/2004 | B6: SJ Racing – Sorocaba | C6: SJ Racing | D6: Resultados

B1: COPA PARMA DO INTERIOR | G1: 1º etapa/StockCar | I1: 38074 | J1: 2º etapa/ Targa | L1: 3º etapa / Monza | N1: 4º etapa/Blue King | P1: 5º etapa/SJ Racing
A2: 2004 | D2: total geral | E2: desc. | F2: SUB-TOTAL | G2: tomada | H2: corrida | J2: corrida | L2: corrida | N2: corrida | P2: corrida
A3: POS | B3: PILOTO | C3: EQUIPE | G3: pos/tempo | H3: pos/voltas | I3: pontos | J3: pos/voltas | K3: pontos | L3: pos/voltas | M3: pontos | N3: pos/voltas | O3: pontos | P3: pos/voltas | Q3: pontos
A4: 1 | B4: Ricardo Teixeira | C4: Monza | D4: =+F4-E4 -> 672 | E4: =MINA(I4,K4,M4,O4,Q4) -> 0 | F4: =+I4+K4+M4+O4+Q4 -> 672 | G4: 3,17 / 1º | H4: 36º/338 | I4: 0 | J4: 4º / 299/0 | K4: 162 | L4: 1º / 361 | M4: 175 | N4: 2º / 360 | O4: 170 | P4: 3º / 280,52 | Q4: 165
A5: 2 | B5: Kal | C5: Blue king | D5: =+F5-E5 -> 654 | E5: =MINA(I5,K5,M5,O5,Q5) -> 131 | F5: =+I5+K5+M5+O5+Q5 -> 785 | G5: 4,41 / 6º | H5: 1º/359 | I5: 175 | J5: 10º / 272 | K5: 145 | L5: 5º / 341 | M5: 159 | N5: 1º / 378 | O5: 175 | P5: 17º / 250,3 | Q5: 131
A6: 3 | B6: Bonga | C6: SJ. Racing | D6: =+F6-E6 -> 630 | E6: =MINA(I6,K6,M6,O6,Q6) -> 143 | F6: =+I6+K6+M6+O6+Q6 -> 773 | H6: 11º/310 | I6: 143 | J6: 5º / 298 | K6: 159 | L6: 6º / 339 | M6: 156 | N6: 4º / 352 | O6: 162 | P6: 7º / 271,54 | Q6: 153
A7: 4 | B7: Radar | C7: Stockar | D7: =+F7-E7 -> 603 | E7: =MINA(I7,K7,M7,O7,Q7) -> 118 | F7: =+I7+K7+M7+O7+Q7 -> 721 | H7: 8º/331 | I7: 150 | J7: 1º / 303 | K7: 175 | L7: 29º / 306 | M7: 118 | N7: 7º / 340 | O7: 153 | P7: 22º / 242,22 | Q7: 125
A8: 5 | B8: Márcio Godoi | C8: SJ. Racing | D8: =+F8-E8 -> 591 | E8: =MINA(I8,K8,M8,O8,Q8) -> 0 | F8: =+I8+K8+M8+O8+Q8 -> 591 | H8: 20º/270 | I8: 127 | J8: 2º / 299 | K8: 170 | L8: 15º / 328 | M8: 135 | N8: 5º / 344 | O8: 159 | Q8: 0
A9: 6 | B9: Henrique Rosa | C9: SJ. Racing | D9: =+F9-E9 -> 573 | E9: =MINA(I9,K9,M9,O9,Q9) -> 115 | F9: =+I9+K9+M9+O9+Q9 -> 688 | H9: 32º/115 | I9: 115 | J9: 16º / 256 | K9: 133 | L9: 21º / 317 | M9: 126 | N9: 13º / 323 | O9: 139 | P9: 1º / 283,17 | Q9: 175
A10: 7 | B10: Marcos Lolata | C10: SJ. Racing | D10: =+F10-E10 -> 569 | E10: =MINA(I10,K10,M10,O10,Q10) -> 120 | F10: =+I10+K10+M10+O10+Q10 -> 689 | H10: 13º/296 | I10: 139 | J10: 8º / 280 | K10: 150 | L10: 13º / 329 | M10: 139 | N10: 27º / 252 | O10: 120 | P10: 12º / 267,54 | Q10: 141
A11: 8 | B11: Anderson diogo (Dinho) | C11: SJ. Racing | D11: =+F11-E11 -> 557 | E11: =MINA(I11,K11,M11,O11,Q11) -> 0 | F11: =+I11+K11+M11+O11+Q11 -> 557 | H11: 16º/292 | I11: 133 | J11: 14º/ 261/40 | K11: 137 | L11: 30º / 306 | M11: 117 | N11: 34º / 101 | O11: 0 | P11: 2º / 281,48 | Q11: 170
A12: 9 | B12: Daniel Lombardi | C12: Blue king | D12: =+F12-E12 -> 551 | E12: =MINA(I12,K12,M12,O12,Q12) -> 124 | F12: =+I12+K12+M12+O12+Q12 -> 675 | G12: 3,47 / 9º | H12: 6º/336 | I12: 156 | J12: 22º / 239 | K12: 125 | L12: 11º / 330 | M12: 143 | N12: 20º / 303 | O12: 127 | P12: 23º / 229,07 | Q12: 124
A13: 10 | B13: Rubão | C13: Blue king | D13: =+F13-E13 -> 547 | E13: =MINA(I13,K13,M13,O13,Q13) -> 0 | F13: =+I13+K13+M13+O13+Q13 -> 547 | H13: 35º/43 | I13: 0 | J13: 6º / 297/27 | K13: 156 | L13: 24º / 315 | M13: 123 | N13: 15º / 318 | O13: 135 | P13: 16º / 253,19 | Q13: 133
A14: 11 | B14: Felipe João | C14: Stockar | D14: =+F14-E14 -> 542 | E14: =MINA(I14,K14,M14,O14,Q14) -> 116 | F14: =+I14+K14+M14+O14+Q14 -> 658 | H14: 31º/127 | I14: 116 | J14: 9º / 275 | K14: 147 | L14: 22º / 317 | M14: 125 | N14: 9º / 334 | O14: 147 | P14: 24º / 225,2 | Q14: 123
A15: 12 | B15: Sandro Rosa (Franja) | C15: SJ. Racing | D15: =+F15-E15 -> 541 | E15: =MINA(I15,K15,M15,O15,Q15) -> 0 | F15: =+I15+K15+M15+O15+Q15 -> 541 | H15: 5º/338 | I15: 159 | J15: 27º / 15 | K15: 120 | L15: 38º / 238 | M15: 0 | N15: 22º / 286 | O15: 125 | P15: 14º / 263,81 | Q15: 137
A16: 13 | B16: Ado | C16: Blue king | D16: =+F16-E16 -> 534 | E16: =MINA(I16,K16,M16,O16,Q16) -> 0 | F16: =+I16+K16+M16+O16+Q16 -> 534 | H16: 33º/79 | I16: 0 | J16: 14º / 254 | K16: 137 | L16: 18º / 325 | M16: 129 | N16: 12º / 328 | O16: 141 | P16: 20º / 246,46 | Q16: 127
A17: 14 | B17: Silvio Kuratomi | C17: Blue king | D17: =+F17-E17 -> 511 | E17: =MINA(I17,K17,M17,O17,Q17) -> 0 | F17: =+I17+K17+M17+O17+Q17 -> 511 | H17: 29º/156 | I17: 118 | J17: 19º / 246 | K17: 128 | L17: 43º / 162 | M17: 0 | N17: 11º / 332 | O17: 143 | P17: 25º / 210,3 | Q17: 122
A18: 15 | B18: Juliano Touso | C18: Blue king | D18: =+F18-E18 -> 462 | E18: =MINA(I18,K18,M18,O18,Q18) -> 0 | F18: =+I18+K18+M18+O18+Q18 -> 462 | H18: 9º/323 | I18: 147 | J18: 3º / 299/12 | K18: 165 | L18: 45º / 129 | M18: 0 | N18: 8º / 338 | O18: 150 | Q18: 0
A19: 16 | B19: Eduardo Borges (Bola) | C19: Targa | D19: =+F19-E19 -> 403 | E19: =MINA(I19,K19,M19,O19,Q19) -> 0 | F19: =+I19+K19+M19+O19+Q19 -> 403 | G19: 3,45 / 7º | H19: 15º/295 | I19: 135 | J19: 12º / 266 | K19: 141 | L19: 20º / 320 | M19: 127 | Q19: 0
A20: 17 | B20: Gilberto Fernandes | C20: Targa | D20: =+F20-E20 -> 390 | E20: =MINA(I20,K20,M20,O20,Q20) -> 0 | F20: =+I20+K20+M20+O20+Q20 -> 390 | G20: 3,38 / 4º | H20: 7º/335 | I20: 153 | J20: 29º / 286 | K20: 118 | L20: 28º / 308 | M20: 119 | Q20: 0
A21: 18 | B21: Carlos Martins | C21: Blue king | D21: =+F21-E21 -> 372 | E21: =MINA(I21,K21,M21,O21,Q21) -> 0 | F21: =+I21+K21+M21+O21+Q21 -> 372 | H21: 30º/148 | I21: 117 | J21: 25º / 222 | K21: 122 | L21: 16º / 328 | M21: 133 | Q21: 0
A22: 19 | B22: Marcel | C22: SJ. Racing | D22: =+F22-E22 -> 290 | E22: =+M22 -> 120 | F22: =+I22+K22+M22+O22+Q22 -> 410 | H22: 0 | I22: 0 | J22: 0 | K22: 0 | L22: 27º / 308 | M22: 120 | N22: 10º / 332 | O22: 145 | P22: 10º / 269,91 | Q22: 145
A23: 20 | B23: Jeronimo Stecca | C23: SJ. Racing | D23: =+F23-E23 -> 290 | E23: =+O23 -> 0 | F23: =+I23+K23+M23+O23+Q23 -> 290 | H23: 14º/295 | I23: 137 | J23: 7º / 297/10 | K23: 153 | L23: 35º / 285 | M23: 0 | N23: 33º / 131 | O23: 0 | Q23: 0
A24: 21 | B24: Gosment (Rubão) | C24: SJ. Racing | D24: =+F24-E24 -> 273 | E24: =+M24 -> 116 | F24: =+I24+K24+M24+O24+Q24 -> 389 | H24: 0 | I24: 0 | J24: 0 | K24: 0 | L24: 31º / 305 | M24: 116 | N24: 21º / 293 | O24: 126 | P24: 9º / 270,98 | Q24: 147
A25: 22 | B25: Ramos | D25: =+F25-E25 -> 252 | E25: =+M25 -> 128 | F25: =+I25+K25+M25+O25+Q25 -> 380 | H25: 0 | I25: 0 | J25: 0 | K25: 0 | L25: 19º / 320 | M25: 128 | N25: 17º / 316 | O25: 131 | P25: 26º / 207,63 | Q25: 121
A26: 23 | B26: Michel Afonso | C26: SJ. Racing | D26: =+F26-E26 -> 170 | E26: =+I26 -> 162 | F26: =+I26+K26+M26+O26+Q26 -> 332 | H26: 4º/338 | I26: 162 | J26: 0 | K26: 0 | L26: 2º / 357 | M26: 170 | O26: 0 | Q26: 0
A27: 24 | B27: Luiz Sergio | C27: Blue king | D27: =+F27-E27 -> 165 | E27: =+Q27 -> 135 | F27: =+I27+K27+M27+O27+Q27 -> 300 | H27: 0 | I27: 0 | J27: 0 | K27: 0 | L27: 0 | M27: 0 | N27: 3º / 356 | O27: 165 | P27: 15º / 260,65 | Q27: 135
A28: 25 | B28: Angelo Fofo | C28: SJ. Racing | D28: =+F28-E28 -> 162 | E28: =+I28 -> 145 | F28: =+I28+K28+M28+O28+Q28 -> 307 | G28: 3,35 / 2º | H28: 10º/313 | I28: 145 | J28: 0 | K28: 0 | L28: 4º / 346 | M28: 162 | O28: 0 | Q28: 0
A29: 26 | B29: Ike | C29: Blue king | D29: =+F29-E29 -> 153 | E29: =+I29 -> 121 | F29: =+I29+K29+M29+O29+Q29 -> 274 | G29: 3,36 / 3º | H29: 26º/177 | I29: 121 | J29: 0 | K29: 0 | L29: 7º / 338 | M29: 153 | N29: 37º / 10 | O29: 0 | Q29: 0
A30: 27 | B30: Roberto Petersen | C30: Blue king | D30: =+F30-E30 -> 147 | E30: =+I30 -> 129 | F30: =+I30+K30+M30+O30+Q30 -> 276 | H30: 18º/288 | I30: 129 | J30: 0 | K30: 0 | L30: 9º / 332 | M30: 147 | N30: 35º / 72 | O30: 0 | Q30: 0
A31: 28 | B31: Paulo Dikerts | C31: Targa | D31: =+F31-E31 -> 143 | E31: =+I31 -> 131 | F31: =+I31+K31+M31+O31+Q31 -> 274 | H31: 17º/289 | I31: 131 | J31: 11º / 270 | K31: 143 | M31: 0 | O31: 0 | Q31: 0
A32: 29 | B32: Kleber Preto | C32: SJ. Racing | D32: =+F32-E32 -> 143 | E32: =+I32 -> 126 | F32: =+I32+K32+M32+O32+Q32 -> 269 | H32: 21º/269 | I32: 126 | J32: 0 | K32: 0 | M32: 0 | O32: 0 | P32: 11º / 268,28 | Q32: 143
A33: 30 | B33: Marcos | C33: SJ. Racing | D33: =+F33-E33 -> 139 | E33: =+O33 -> 121 | F33: =+I33+K33+M33+O33+Q33 -> 260 | H33: 0 | I33: 0 | J33: 13º / 265 | K33: 139 | M33: 0 | N33: 26º / 268 | O33: 121 | Q33: 0
A34: 31 | B34: Fabio | C34: Blue king | D34: =+F34-E34 -> 137 | E34: =+M34 -> 124 | F34: =+I34+K34+M34+O34+Q34 -> 261 | H34: 0 | I34: 0 | J34: 0 | K34: 0 | L34: 23º / 317 | M34: 124 | N34: 14º / 320 | O34: 137 | Q34: 0
A35: 32 | B35: Eric | C35: SJ. Racing | D35: =+F35-E35 -> 135 | E35: =+M35 -> 0 | F35: =+I35+K35+M35+O35+Q35 -> 135 | H35: 0 | I35: 0 | J35: 15º / 261/15 | K35: 135 | L35: 39º / 228 | M35: 0 | O35: 0 | Q35: 0
A36: 33 | B36: Luffe | C36: Monza | D36: =+F36-E36 -> 129 | E36: =+I36 -> 122 | F36: =+I36+K36+M36+O36+Q36 -> 251 | G36: 3,39 / 5º | H36: 25º/187 | I36: 122 | J36: 0 | K36: 0 | M36: 0 | O36: 0 | P36: 18º / 249,22 | Q36: 129
A37: 34 | B37: André Paulo | C37: Targa | D37: =+F37-E37 -> 128 | E37: =+K37 -> 119 | F37: =+I37+K37+M37+O37+Q37 -> 247 | H37: 19º/284 | I37: 128 | J37: 28º / 7 | K37: 119 | M37: 0 | O37: 0 | Q37: 0
A38: 35 | B38: Luiz Felipe | C38: SJ. Racing | D38: =+F38-E38 -> 126 | E38: =MINA(I38,K38,M38,O38,Q38) -> 0 | F38: =+I38+K38+M38+O38+Q38 -> 126 | H38: 0 | I38: 0 | J38: 21º / 244 | K38: 126 | L38: 36º / 264 | M38: 0 | O38: 0 | Q38: 0
A39: 36 | B39: Nivaldo | D39: =+F39-E39 -> 123 | E39: =+M39 -> 0 | F39: =+I39+K39+M39+O39+Q39 -> 123 | H39: 0 | I39: 0 | J39: 0 | K39: 0 | L39: 37º / 260 | M39: 0 | N39: 24º / 277 | O39: 123 | Q39: 0
A40: 37 | B40: Homero | D40: =+F40-E40 -> 122 | E40: =+K40 -> 0 | F40: =+I40+K40+M40+O40+Q40 -> 122 | H40: 0 | I40: 0 | J40: 0 | K40: 0 | L40: 40º / 214 | M40: 0 | N40: 25º / 271 | O40: 122 | Q40: 0
A41: 38 | B41: Fernando Bueno | C41: Stockar | D41: =+F41-E41 -> 121 | E41: =+I41 -> 119 | F41: =+I41+K41+M41+O41+Q41 -> 240 | H41: 28º/158 | I41: 119 | J41: 0 | K41: 0 | L41: 26º / 309 | M41: 121 | O41: 0 | Q41: 0
A42: 39 | B42: João Kibon | C42: SJ. Racing | D42: =+F42-E42 -> 120 | E42: =+M42 -> 0 | F42: =+I42+K42+M42+O42+Q42 -> 120 | H42: 0 | I42: 0 | J42: 0 | K42: 0 | L42: 33 º / 295 | M42: 0 | O42: 0 | P42: 27º / 165 | Q42: 120
A43: 40 | B43: Luciano Aversa | C43: Stockar | D43: =+F43-E43 -> 119 | E43: =+I43 -> 125 | F43: =+I43+K43+M43+O43+Q43 -> 244 | H43: 22º/258 | I43: 125 | J43: 0 | K43: 0 | M43: 0 | N43: 28º / 239 | O43: 119 | Q43: 0
A44: 41 | B44: Carlao | D44: =+F44-E44 -> 115 | E44: =+M44 -> 131 | F44: =+I44+K44+M44+O44+Q44 -> 246 | H44: 0 | I44: 0 | J44: 0 | K44: 0 | L44: 17º / 327 | M44: 131 | N44: 32º / 181 | O44: 115 | Q44: 0
A45: 42 | B45: Elder | C45: Stockar | D45: =+F45-E45 -> 0 | E45: =+I45 -> 170 | F45: =+I45+K45+M45+O45+Q45 -> 170 | G45: 4,47 / 8º | H45: 2º/355 | I45: 170 | J45: 0 | K45: 0 | M45: 0 | O45: 0 | Q45: 0
A46: 43 | B46: Francisco Ferreira | C46: Monza | D46: =+F46-E46 -> 0 | E46: =+I46 -> 165 | F46: =+I46+K46+M46+O46+Q46 -> 165 | H46: 3º/340 | I46: 165 | J46: 0 | K46: 0 | M46: 0 | O46: 0 | Q46: 0
A47: 44 | B47: AJ | C47: Monza | D47: =+F47-E47 -> 0 | E47: =+M47 -> 165 | F47: =+I47+K47+M47+O47+Q47 -> 165 | H47: 0 | I47: 0 | J47: 0 | K47: 0 | L47: 3º / 350 | M47: 165 | O47: 0 | Q47: 0
A48: 45 | B48: ANDE | D48: 0 | E48: =MINA(I48,K48,M48,O48) -> 0 | F48: =+I48+K48+M48+O48+Q48 -> 162 | I48: 0 | K48: 0 | M48: 0 | P48: 4º / 281,48 | Q48: 162
A49: 46 | B49: EVANDRO | D49: 0 | E49: =MINA(I49,K49,M49,O49) -> 0 | F49: =+I49+K49+M49+O49+Q49 -> 159 | I49: 0 | K49: 0 | M49: 0 | P49: 5º / 275,50 | Q49: 159
A50: 47 | B50: Isaias | C50: Imola | D50: 0 | E50: =MINA(I50,K50,M50,O50) -> 0 | F50: =+I50+K50+M50+O50+Q50 -> 156 | G50: 0 | H50: 0 | I50: 0 | J50: 0 | K50: 0 | L50: 0 | M50: 0 | N50: 6º / 341 | O50: 156 | Q50: 0
A51: =+A50+1 -> 48 | B51: LISTER | D51: 0 | E51: =MINA(I51,K51,M51,O51) -> 0 | F51: =+I51+K51+M51+O51+Q51 -> 156 | I51: 0 | K51: 0 | M51: 0 | P51: 6º / 274,22 | Q51: 156
A52: =+A51+1 -> 49 | B52: Arthur | D52: =+F52-E52 -> 0 | E52: =+M52 -> 150 | F52: =+I52+K52+M52+O52+Q52 -> 150 | H52: 0 | I52: 0 | J52: 0 | K52: 0 | L52: 8º / 336 | M52: 150 | O52: 0 | Q52: 0
A53: =+A52+1 -> 50 | B53: RICARDAO | D53: 0 | E53: =MINA(I53,K53,M53,O53) -> 0 | F53: =+I53+K53+M53+O53+Q53 -> 150 | I53: 0 | K53: 0 | M53: 0 | P53: 8º / 271,26 | Q53: 150
A54: =+A53+1 -> 51 | B54: Yasley | D54: =+F54-E54 -> 0 | E54: =+M54 -> 145 | F54: =+I54+K54+M54+O54+Q54 -> 145 | H54: 0 | I54: 0 | J54: 0 | K54: 0 | L54: 10º / 331 | M54: 145 | O54: 0 | Q54: 0
A55: =+A54+1 -> 52 | B55: Marcelo Mazei | C55: Stockar | D55: =+F55-E55 -> 0 | E55: =+I55 -> 141 | F55: =+I55+K55+M55+O55+Q55 -> 141 | H55: 12º/309 | I55: 141 | J55: 0 | K55: 0 | M55: 0 | O55: 0 | Q55: 0
A56: =+A55+1 -> 53 | B56: Dotto | D56: =+F56-E56 -> 0 | E56: =+M56 -> 141 | F56: =+I56+K56+M56+O56+Q56 -> 141 | H56: 0 | I56: 0 | J56: 0 | K56: 0 | L56: 12º / 329 | M56: 141 | O56: 0 | Q56: 0
A57: =+A56+1 -> 54 | B57: JULIO GOSMENT | D57: 0 | E57: 0 | F57: =+I57+K57+M57+O57+Q57 -> 139 | H57: 0 | I57: 0 | K57: 0 | M57: 0 | P57: 13º / 264,65 | Q57: 139
A58: =+A57+1 -> 55 | B58: Vladi | D58: =+F58-E58 -> 0 | E58: =+M58 -> 137 | F58: =+I58+K58+M58+O58+Q58 -> 137 | H58: 0 | I58: 0 | J58: 0 | K58: 0 | L58: 14º / 329 | M58: 137 | O58: 0 | Q58: 0
A59: =+A58+1 -> 56 | B59: Marquinhos (Primo) | C59: Blue king | D59: =+F59-E59 -> 0 | E59: =+O59 -> 133 | F59: =+I59+K59+M59+O59+Q59 -> 133 | H59: 0 | I59: 0 | J59: 0 | K59: 0 | L59: 0 | M59: 0 | N59: 16º / 317 | O59: 133 | Q59: 0
A60: =+A59+1 -> 57 | B60: Giovani | C60: SJ. Racing | D60: =+F60-E60 -> 0 | E60: =+K60 -> 131 | F60: =+I60+K60+M60+O60+Q60 -> 131 | H60: 0 | I60: 0 | J60: 17º / 255 | K60: 131 | M60: 0 | O60: 0 | Q60: 0
A61: =+A60+1 -> 58 | B61: Tchello | D61: =+F61-E61 -> 0 | E61: =+O61 -> 129 | F61: =+I61+K61+M61+O61+Q61 -> 129 | H61: 0 | I61: 0 | J61: 0 | K61: 0 | L61: 0 | M61: 0 | N61: 18º / 306 | O61: 129 | Q61: 0
A62: =+A61+1 -> 59 | B62: Gabriel | C62: Blue king | D62: =+F62-E62 -> 0 | E62: =+O62 -> 128 | F62: =+I62+K62+M62+O62+Q62 -> 128 | H62: 0 | I62: 0 | J62: 0 | K62: 0 | L62: 0 | M62: 0 | N62: 19º / 305 | O62: 128 | Q62: 0
A63: =+A62+1 -> 60 | B63: BETO | D63: 0 | E63: 128 | F63: =+I63+K63+M63+O63+Q63 -> 128 | H63: 0 | I63: 0 | K63: 0 | M63: 0 | P63: 19º / 247,28 | Q63: 128
A64: =+A63+1 -> 61 | B64: Ricardo Degan | C64: Targa | D64: =+F64-E64 -> 0 | E64: =+K64 -> 127 | F64: =+I64+K64+M64+O64+Q64 -> 127 | H64: 0 | I64: 0 | J64: 20º / 245 | K64: 127 | M64: 0 | O64: 0 | Q64: 0
A65: =+A64+1 -> 62 | B65: CAMELO | D65: 0 | E65: =+Q65 -> 126 | F65: =+I65+K65+M65+O65+Q65 -> 126 | H65: 0 | I65: 0 | K65: 0 | M65: 0 | P65: 21º / 243,17 | Q65: 126
A66: =+A65+1 -> 63 | B66: Rafael | C66: Targa | D66: =+F66-E66 -> 0 | E66: =+K66 -> 124 | F66: =+I66+K66+M66+O66+Q66 -> 124 | H66: 0 | I66: 0 | J66: 23º / 231 | K66: 124 | M66: 0 | O66: 0 | Q66: 0
A67: =+A66+1 -> 64 | B67: Renato Araujo | D67: =+F67-E67 -> 0 | E67: =+I67 -> 124 | F67: =+I67+K67+M67+O67+Q67 -> 124 | H67: 23º/243 | I67: 124 | J67: 0 | K67: 0 | M67: 0 | O67: 0 | Q67: 0
A68: =+A67+1 -> 65 | B68: Juliano | C68: Blue king | D68: =+F68-E68 -> 0 | E68: =+O68 -> 124 | F68: =+I68+K68+M68+O68+Q68 -> 124 | H68: 0 | I68: 0 | J68: 0 | K68: 0 | L68: 0 | M68: 0 | N68: 23º / 281 | O68: 124 | Q68: 0
A69: =+A68+1 -> 66 | B69: Andre Leitão | C69: Targa | D69: =+F69-E69 -> 0 | E69: =+K69 -> 123 | F69: =+I69+K69+M69+O69+Q69 -> 123 | H69: 0 | I69: 0 | J69: 24º / 223 | K69: 123 | M69: 0 | O69: 0 | Q69: 0
A70: =+A69+1 -> 67 | B70: Paulette | C70: Targa | D70: =+F70-E70 -> 0 | E70: =+I70 -> 123 | F70: =+I70+K70+M70+O70+Q70 -> 123 | H70: 24º/219 | I70: 123 | J70: 0 | K70: 0 | M70: 0 | O70: 0 | Q70: 0
A71: =+A70+1 -> 68 | B71: Brazuka | D71: =+F71-E71 -> 0 | E71: =+M71 -> 122 | F71: =+I71+K71+M71+O71+Q71 -> 122 | H71: 0 | I71: 0 | J71: 0 | K71: 0 | L71: 25º / 311 | M71: 122 | O71: 0 | Q71: 0
A72: =+A71+1 -> 69 | B72: Xandão | C72: Targa | D72: =+F72-E72 -> 0 | E72: =+K72 -> 121 | F72: =+I72+K72+M72+O72+Q72 -> 121 | H72: 0 | I72: 0 | J72: 26º / 56 | K72: 121 | M72: 0 | O72: 0 | Q72: 0
A73: =+A72+1 -> 70 | B73: Tico | C73: Stockar | D73: =+F73-E73 -> 0 | E73: =+I73 -> 120 | F73: =+I73+K73+M73+O73+Q73 -> 120 | H73: 27º/170 | I73: 120 | J73: 0 | K73: 0 | M73: 0 | O73: 0 | Q73: 0
A74: =+A73+1 -> 71 | B74: Lucas | D74: =+F74-E74 -> 0 | E74: =+O74 -> 118 | F74: =+I74+K74+M74+O74+Q74 -> 118 | H74: 0 | I74: 0 | J74: 0 | K74: 0 | L74: 0 | M74: 0 | N74: 29º / 215 | O74: 118 | Q74: 0
A75: =+A74+1 -> 72 | B75: Luciano | D75: =+F75-E75 -> 0 | E75: =+O75 -> 117 | F75: =+I75+K75+M75+O75+Q75 -> 117 | H75: 0 | I75: 0 | J75: 0 | K75: 0 | L75: 0 | M75: 0 | N75: 30º / 203 | O75: 117 | Q75: 0
A76: =+A75+1 -> 73 | B76: Fabiano | D76: =+F76-E76 -> 0 | E76: =+O76 -> 116 | F76: =+I76+K76+M76+O76+Q76 -> 116 | H76: 0 | I76: 0 | J76: 0 | K76: 0 | L76: 0 | M76: 0 | N76: 31º / 200 | O76: 116 | Q76: 0
A77: =+A76+1 -> 74 | B77: Edson | D77: =+F77-E77 -> 0 | E77: =+M77 -> 115 | F77: =+I77+K77+M77+O77+Q77 -> 115 | H77: 0 | I77: 0 | J77: 0 | K77: 0 | L77: 32º / 304 | M77: 115 | O77: 0 | Q77: 0
A78: =+A77+1 -> 75 | B78: Surfista | C78: Monza | D78: =+F78-E78 -> 0 | E78: =+I78 -> 0 | F78: =+I78+K78+M78+O78+Q78 -> 0 | H78: 34º/78 | I78: 0 | J78: 0 | K78: 0 | M78: 0 | O78: 0 | Q78: 0
A79: =+A78+1 -> 76 | B79: Piu | D79: =+F79-E79 -> 0 | E79: =+I79 -> 0 | F79: =+I79+K79+M79+O79+Q79 -> 0 | H79: 0 | I79: 0 | J79: 0 | K79: 0 | L79: 34º / 290 | M79: 0 | N79: 36º / 53 | O79: 0 | Q79: 0
A80: =+A79+1 -> 77 | B80: Lorena | D80: =+F80-E80 -> 0 | E80: =+I80 -> 0 | F80: =+I80+K80+M80+O80+Q80 -> 0 | H80: 0 | I80: 0 | J80: 0 | K80: 0 | L80: 41º / 206 | M80: 0 | O80: 0 | Q80: 0
A81: =+A80+1 -> 78 | B81: Mulequinho | D81: =+F81-E81 -> 0 | E81: =+I81 -> 0 | F81: =+I81+K81+M81+O81+Q81 -> 0 | H81: 0 | I81: 0 | J81: 0 | K81: 0 | L81: 42º / 189 | M81: 0 | O81: 0 | Q81: 0
A82: =+A81+1 -> 79 | B82: Thielo | D82: =+F82-E82 -> 0 | E82: =+I82 -> 0 | F82: =+I82+K82+M82+O82+Q82 -> 0 | H82: 0 | I82: 0 | J82: 0 | K82: 0 | L82: 44º / 132 | M82: 0 | O82: 0 | Q82: 0