A1: R$14,99 mussarela, catupiry, buon gustaio, toscanela, calabresa (preço para retirar no balcão) | C1: R$14,99 mussarela, catupiry, buon gustaio, toscanela, calabresa (preço para retirar no balcão)

A1: Piloto | B1: Pis | C1: Tempo | D1: Vol | E1: Pis | F1: Tempo | G1: Vol | H1: Pis | I1: Tempo | J1: Vol | K1: Pis | L1: Tempo | M1: Vol | N1: Pis | O1: Tempo | P1: Vol | Q1: Pis | R1: Tempo | S1: Vol | T1: Pis | U1: Tempo | V1: Vol | W1: Pis | X1: Tempo | Y1: Vol | Z1: Total
A2: BONGA | B2: 5 | C2: 5.5010000000000003 | D2: 30 | E2: 7 | F2: 5.52 | G2: 26 | H2: 8 | I2: 5.4950000000000001 | J2: 29 | K2: 6 | L2: 5.5 | M2: 30 | N2: 4 | O2: 5.2809999999999997 | P2: 30 | Q2: 2 | R2: 5.5 | S2: 28 | T2: 1 | U2: 5.609 | V2: 29 | W2: 3 | X2: 5.2510000000000003 | Y2: 27 | Z2: =+Y2+V2+S2+P2+M2+J2+G2+D2 -> 229
A3: DINHO | B3: 7 | C3: 5.6109999999999998 | D3: 28 | E3: 8 | F3: 5.9160000000000004 | G3: 25 | H3: 6 | I3: 5.5010000000000003 | J3: 29 | K3: 4 | L3: 5.2789999999999999 | M3: 29 | N3: 2 | O3: 5.3890000000000002 | P3: 29 | Q3: 1 | R3: 5.5010000000000003 | S3: 26 | T3: 3 | U3: 5.39 | V3: 31 | W3: 5 | X3: 5.7190000000000003 | Y3: 30 | Z3: =+Y3+V3+S3+P3+M3+J3+G3+D3 -> 227
A4: GIOVANNI | B4: 6 | C4: 5.9409999999999998 | D4: 28 | E4: 4 | F4: 5.94 | G4: 26 | H4: 2 | I4: 5.9390000000000001 | J4: 27 | K4: 1 | L4: 5.72 | M4: 26 | N4: 3 | O4: 6.0410000000000004 | P4: 27 | Q4: 5 | R4: 5.94 | S4: 28 | T4: 7 | U4: 6.1050000000000004 | V4: 25 | W4: 8 | X4: 6.6 | Y4: 23 | Z4: =+Y4+V4+S4+P4+M4+J4+G4+D4 -> 210
A5: ERIC | B5: 4 | C5: 5.72 | D5: 23 | E5: 3 | F5: 5.9340000000000002 | G5: 26 | H5: 1 | I5: 5.7190000000000003 | J5: 25 | K5: 3 | L5: 5.4779999999999998 | M5: 30 | N5: 5 | O5: 5.7190000000000003 | P5: 22 | Q5: 7 | R5: 5.665 | S5: 27 | T5: 8 | U5: 5.7190000000000003 | V5: 28 | W5: 6 | X5: 5.5 | Y5: 27 | Z5: =+Y5+V5+S5+P5+M5+J5+G5+D5 -> 208
A6: NETO | B6: 2 | C6: 5.609 | D6: 22 | E6: 1 | F6: 5.83 | G6: 20 | H6: 3 | I6: 5.61 | J6: 28 | K6: 5 | L6: 5.72 | M6: 25 | N6: 7 | O6: 5.5549999999999997 | P6: 28 | Q6: 8 | R6: 5.7210000000000001 | S6: 28 | T6: 6 | U6: 5.5179999999999998 | V6: 23 | W6: 4 | X6: 5.5 | Y6: 27 | Z6: =+Y6+V6+S6+P6+M6+J6+G6+D6 -> 201