A1: Patrocinadores

B1: Motos e Acessórios Honda - Rua Sete de Setembro, 387 - Fone: (15) 3331-6700.

A1: Pos | B1: Piloto | C1: T/Tempo | D1: BMW EURO | E1: PANOZ | F1: BENTLEY | G1: CADILAC | H1: LOLA | I1: FORMULA 1 | J1: AUDI | K1: FERRARI | L1: BMW | M1: CADILAC | N1: MERCEDES | O1: VALIRIUN | P1: Tot/S/D | Q1: Tot/C/D
A2: 1 | B2: MICHEL | C2: 0 | D2: 157 | E2: 175 | F2: 163 | G2: 175 | H2: 175 | I2: 175 | J2: 145 | K2: 157 | L2: 175 | M2: 175 | N2: 175 | O2: 169 | P2: =SUM(C2:O2) -> 2016 | Q2: =SUM(C2:O2)-MINA(D2:O2) -> 1871
A3: 2 | B3: BONGA | C3: 0 | D3: 175 | E3: 169 | F3: 157 | G3: 169 | H3: 169 | I3: 157 | J3: 163 | K3: 169 | L3: 169 | M3: 169 | N3: 163 | O3: 175 | P3: =SUM(C3:O3) -> 2004 | Q3: =SUM(C3:O3)-MINA(D3:O3) -> 1847
A4: 3 | B4: DINHO | C4: 1 | D4: 151 | E4: 157 | F4: 169 | G4: 133 | H4: 157 | I4: 163 | J4: 175 | K4: 175 | L4: 145 | M4: 157 | N4: 157 | O4: 151 | P4: =SUM(C4:O4) -> 1891 | Q4: =SUM(C4:O4)-MINA(D4:O4) -> 1758
A5: 4 | B5: ERIC | C5: 0 | D5: 127 | E5: 133 | F5: 122 | G5: 82 | H5: 92 | I5: 127 | J5: 139 | K5: 145 | L5: 139 | M5: 145 | N5: 169 | O5: 163 | P5: =SUM(C5:O5) -> 1583 | Q5: =SUM(C5:O5)-MINA(D5:O5) -> 1501
A6: 5 | B6: LISTER | C6: 0 | D6: 145 | E6: 112 | F6: 139 | G6: 145 | H6: 127 | I6: 122 | J6: 127 | K6: 0 | L6: 127 | M6: 139 | N6: 139 | O6: 133 | P6: =SUM(C6:O6) -> 1455 | Q6: =SUM(C6:O6)-MINA(D6:O6) -> 1455
A7: 6 | B7: RICARDAO | C7: 0 | D7: 92 | E7: 102 | F7: 133 | G7: 139 | H7: 133 | I7: 133 | J7: 122 | K7: 122 | L7: 133 | M7: 127 | N7: 133 | O7: 157 | P7: =SUM(C7:O7) -> 1526 | Q7: =SUM(C7:O7)-MINA(D7:O7) -> 1434
A8: 7 | B8: EVANDRO | C8: 0 | D8: 133 | E8: 163 | F8: 73 | G8: 157 | H8: 145 | I8: 151 | J8: 169 | K8: 151 | L8: 163 | M8: 0 | N8: 0 | O8: 0 | P8: =SUM(C8:O8) -> 1305 | Q8: =SUM(C8:O8)-MINA(D8:O8) -> 1305
A9: 8 | B9: RUDSON | C9: 0 | D9: 97 | E9: 0 | F9: 117 | G9: 112 | H9: 117 | I9: 112 | J9: 117 | K9: 133 | L9: 122 | M9: 122 | N9: 127 | O9: 122 | P9: =SUM(C9:O9) -> 1298 | Q9: =SUM(C9:O9)-MINA(D9:O9) -> 1298
A10: 9 | B10: MARCEL | C10: 0 | D10: 102 | E10: 127 | F10: 112 | G10: 151 | H10: 151 | I10: 145 | J10: 133 | K10: 0 | L10: 151 | M10: 163 | N10: 0 | O10: 0 | P10: =SUM(C10:O10) -> 1235 | Q10: =SUM(C10:O10)-MINA(D10:O10) -> 1235
A11: 10 | B11: LUIZ FELIPE | C11: 0 | D11: 61 | E11: 87 | F11: 102 | G11: 107 | H11: 112 | I11: 102 | J11: 112 | K11: 112 | L11: 117 | M11: 117 | N11: 122 | O11: 127 | P11: =SUM(C11:O11) -> 1278 | Q11: =SUM(C11:O11)-MINA(D11:O11) -> 1217
A12: 11 | B12: ANDERSON | C12: 0 | D12: 163 | E12: 151 | F12: 151 | G12: 163 | H12: 163 | I12: 169 | J12: 151 | K12: 0 | L12: 0 | M12: 0 | N12: 0 | O12: 0 | P12: =SUM(C12:O12) -> 1111 | Q12: =SUM(C12:O12)-MINA(D12:O12) -> 1111
A13: 12 | B13: SAPAO | C13: 0 | D13: 0 | E13: 107 | F13: 145 | G13: 122 | H13: 0 | I13: 139 | J13: 157 | K13: 163 | L13: 157 | M13: 0 | N13: 0 | O13: 0 | P13: =SUM(C13:O13) -> 990 | Q13: =SUM(C13:O13)-MINA(D13:O13) -> 990
A14: 13 | B14: MANE | C14: 0 | D14: 73 | E14: 77 | F14: 127 | G14: 0 | H14: 107 | I14: 0 | J14: 0 | K14: 139 | L14: 0 | M14: 0 | N14: 145 | O14: 145 | P14: =SUM(C14:O14) -> 813 | Q14: =SUM(C14:O14)-MINA(D14:O14) -> 813
A15: =+A14+1 -> 14 | B15: JERA | C15: 0 | D15: 169 | E15: 145 | F15: 175 | G15: 97 | H15: 122 | I15: 97 | J15: 0 | K15: 0 | L15: 0 | M15: 0 | N15: 0 | O15: 0 | P15: =SUM(C15:O15) -> 805 | Q15: =SUM(C15:O15)-MINA(D15:O15) -> 805
A16: =+A15+1 -> 15 | B16: GIOVANNI | C16: 0 | D16: 0 | E16: 117 | F16: 0 | G16: 127 | H16: 97 | I16: 117 | J16: 0 | K16: 117 | L16: 0 | M16: 0 | N16: 112 | O16: 0 | P16: =SUM(C16:O16) -> 687 | Q16: =SUM(C16:O16)-MINA(D16:O16) -> 687
A17: =+A16+1 -> 16 | B17: CONRADO | C17: 0 | D17: 122 | E17: 69 | F17: 87 | G17: 77 | H17: 0 | I17: 0 | J17: 0 | K17: 0 | L17: 0 | M17: 151 | N17: 151 | O17: 0 | P17: =SUM(C17:O17) -> 657 | Q17: =SUM(C17:O17)-MINA(D17:O17) -> 657
A18: =+A17+1 -> 17 | B18: NETO | C18: 0 | D18: 53 | E18: 139 | F18: 107 | G18: 92 | H18: 102 | I18: 107 | J18: 0 | K18: 0 | L18: 0 | M18: 0 | N18: 0 | O18: 0 | P18: =SUM(C18:O18) -> 600 | Q18: =SUM(C18:O18)-MINA(D18:O18) -> 600
A19: =+A18+1 -> 18 | B19: JOAO KIBOM | C19: 0 | D19: 65 | E19: 0 | F19: 92 | G19: 117 | H19: 139 | I19: 0 | J19: 0 | K19: 0 | L19: 0 | M19: 0 | N19: 0 | O19: 0 | P19: =SUM(C19:O19) -> 413 | Q19: =SUM(C19:O19)-MINA(D19:O19) -> 413
A20: =+A19+1 -> 19 | B20: RUBAO | C20: 0 | D20: 117 | E20: 65 | F20: 97 | G20: 102 | H20: 0 | I20: 0 | J20: 0 | K20: 0 | L20: 0 | M20: 0 | N20: 0 | O20: 0 | P20: =SUM(C20:O20) -> 381 | Q20: =SUM(C20:O20)-MINA(D20:O20) -> 381
A21: =+A20+1 -> 20 | B21: JULIO | C21: 0 | D21: 112 | E21: 97 | F21: 82 | G21: 0 | H21: 0 | I21: 0 | J21: 0 | K21: 0 | L21: 0 | M21: 0 | N21: 0 | O21: 0 | P21: =SUM(C21:O21) -> 291 | Q21: =SUM(C21:O21)-MINA(D21:O21) -> 291
A22: =+A21+1 -> 21 | B22: RICARDINHO | C22: 0 | D22: 139 | E22: 122 | F22: 0 | G22: 0 | H22: 0 | I22: 0 | J22: 0 | K22: 0 | L22: 0 | M22: 0 | N22: 0 | O22: 0 | P22: =SUM(C22:O22) -> 261 | Q22: =SUM(C22:O22)-MINA(D22:O22) -> 261
A23: =+A22+1 -> 22 | B23: RODRIGO | C23: 0 | D23: 0 | E23: 0 | F23: 0 | G23: 0 | I23: 0 | J23: 0 | K23: 0 | L23: 0 | M23: 0 | N23: 117 | O23: 139 | P23: =SUM(C23:O23) -> 256 | Q23: =SUM(C23:O23)-MINA(D23:O23) -> 256
A24: =+A23+1 -> 23 | B24: COISA PRETA | C24: 0 | D24: 77 | E24: 92 | F24: 77 | G24: 0 | H24: 0 | I24: 0 | J24: 0 | K24: 0 | L24: 0 | M24: 0 | N24: 0 | O24: 0 | P24: =SUM(C24:O24) -> 246 | Q24: =SUM(C24:O24)-MINA(D24:O24) -> 246
A25: =+A24+1 -> 24 | B25: TONI | C25: 0 | D25: 87 | E25: 73 | F25: 0 | G25: 0 | H25: 0 | I25: 0 | J25: 0 | K25: 0 | L25: 0 | M25: 0 | N25: 0 | O25: 0 | P25: =SUM(C25:O25) -> 160 | Q25: =SUM(C25:O25)-MINA(D25:O25) -> 160
A26: =+A25+1 -> 25 | B26: LUIZ PROPARTS | C26: 0 | D26: 69 | E26: 82 | F26: 0 | G26: 0 | H26: 0 | I26: 0 | J26: 0 | K26: 0 | L26: 0 | M26: 0 | N26: 0 | O26: 0 | P26: =SUM(C26:O26) -> 151 | Q26: =SUM(C26:O26)-MINA(D26:O26) -> 151
A27: =+A26+1 -> 26 | B27: ZE MARIO | C27: 0 | D27: 107 | E27: 0 | F27: 0 | G27: 0 | H27: 0 | I27: 0 | J27: 0 | K27: 0 | L27: 0 | M27: 0 | N27: 0 | O27: 0 | P27: =SUM(C27:O27) -> 107 | Q27: =SUM(C27:O27)-MINA(D27:O27) -> 107
A28: 27 | B28: GUSTAVO | C28: 0 | D28: 0 | E28: 0 | F28: 0 | G28: 87 | H28: 0 | I28: 0 | J28: 0 | K28: 0 | L28: 0 | M28: 0 | N28: 0 | O28: 0 | P28: =SUM(C28:O28) -> 87 | Q28: =SUM(C28:O28)-MINA(D28:O28) -> 87
A29: 28 | B29: BETO | C29: 0 | D29: 82 | E29: 0 | F29: 0 | G29: 0 | H29: 0 | I29: 0 | J29: 0 | K29: 0 | L29: 0 | M29: 0 | N29: 0 | O29: 0 | P29: =SUM(C29:O29) -> 82 | Q29: =SUM(C29:O29)-MINA(D29:O29) -> 82
A30: 29 | B30: CALVO | C30: 0 | D30: 57 | E30: 0 | F30: 0 | G30: 0 | H30: 0 | I30: 0 | J30: 0 | K30: 0 | L30: 0 | M30: 0 | N30: 0 | O30: 0 | P30: =SUM(C30:O30) -> 57 | Q30: =SUM(C30:O30)-MINA(D30:O30) -> 57
A32: SENIOR
A33: Pos | B33: Piloto | C33: T/Tempo | D33: BMW EURO | E33: PANOZ | F33: BENTLEY | G33: CADILAC | H33: LOLA | I33: FORMULA 1 | J33: AUDI | K33: FERRARI | L33: BMW | M33: CADILAC | N33: MERCEDES | O33: VALIRIUN | P33: Tot/S/D | Q33: Tot/C/D
A34: 1 | B34: LISTER | C34: 0 | D34: 175 | E34: 169 | F34: 175 | G34: 175 | H34: 169 | I34: 169 | J34: 175 | K34: 0 | L34: 169 | M34: 175 | N34: 169 | O34: 163 | P34: =SUM(C34:O34) -> 1883 | Q34: =SUM(C34:O34)-MINA(D34:O34) -> 1883
A35: 2 | B35: RICARDAO | C35: 0 | D35: 151 | E35: 163 | F35: 169 | G35: 169 | H35: 175 | I35: 175 | J35: 169 | K35: 163 | L35: 175 | M35: 163 | N35: 163 | O35: 175 | P35: =SUM(C35:O35) -> 2010 | Q35: =SUM(C35:O35)-MINA(D35:O35) -> 1859
A36: 3 | B36: RUDSON | C36: 0 | D36: 157 | E36: 0 | F36: 157 | G36: 163 | H36: 163 | I36: 163 | J36: 163 | K36: 169 | L36: 163 | M36: 157 | O36: 157 | P36: =SUM(C36:O36) -> 1612 | Q36: =SUM(C36:O36)-MINA(D36:O36) -> 1612
A37: 4 | B37: MANE | C37: 0 | D37: 145 | E37: 157 | F37: 163 | G37: 0 | H37: 157 | I37: 0 | J37: 0 | K37: 175 | L37: 0 | M37: 169 | N37: 175 | P37: =SUM(C37:O37) -> 1141 | Q37: =SUM(C37:O37)-MINA(D37:O37) -> 1141
A38: 5 | B38: NETO | C38: 0 | D38: 139 | E38: 175 | F38: 151 | G38: 151 | H38: 151 | I38: 157 | J38: 0 | K38: 0 | L38: 0 | M38: 0 | O38: 169 | P38: =SUM(C38:O38) -> 1093 | Q38: =SUM(C38:O38)-MINA(D38:O38) -> 1093
A39: =+A38+1 -> 6 | B39: RUBAO | C39: 0 | D39: 169 | E39: 151 | F39: 145 | G39: 157 | H39: 0 | I39: 0 | J39: 0 | K39: 0 | L39: 0 | M39: 0 | P39: =SUM(C39:O39) -> 622 | Q39: =SUM(C39:O39)-MINA(D39:O39) -> 622
A40: =+A39+1 -> 7 | B40: ZE MARIO | C40: 0 | D40: 163 | E40: 0 | F40: 0 | G40: 0 | I40: 0 | J40: 0 | K40: 0 | L40: 0 | M40: 0 | P40: =SUM(C40:O40) -> 163 | Q40: =SUM(C40:O40)-MINA(D40:O40) -> 163

A1: Pos | B1: Pilotos | C1: Voltas | D1: Data | E1: Bolha
A2: 1 | B2: DINHO | C2: 301.36 | D2: 38473 | E2: Ferrari
A3: 2 | B3: MICHEL | C3: 301.36 | D3: 38473 | E3: Cadilac
A4: 3 | B4: BONGA | C4: 296.97 | D4: 38396 | E4: Cadilac