A1: Patrocinadores

B1: Motos e Acessórios Honda - Rua Sete de Setembro, 387 - Fone: (15) 3331-6700.

A1: Pos. | B1: Pontos | C1: Pos. | D1: Pontos | E1: Pos. | F1: Pontos | G1: Pos. | H1: Pontos | I1: Pos. | J1: Pontos | K1: Pos. | L1: Pontos | M1: Pos. | N1: Pontos | O1: Pos. | P1: Pontos
A2: 1 | B2: 175 | C2: 6 | D2: 145 | E2: 11 | F2: 117 | G2: 16 | H2: 92 | I2: 21 | J2: 69 | K2: 26 | L2: 49 | M2: 31 | N2: 31 | O2: 36 | P2: 16
A3: 2 | B3: =+B2-6 -> 169 | C3: 7 | D3: 139 | E3: =+E2+1 -> 12 | F3: 112 | G3: =+G2+1 -> 17 | H3: 87 | I3: =+I2+1 -> 22 | J3: 65 | K3: =+K2+1 -> 27 | L3: 45 | M3: =+M2+1 -> 32 | N3: 28 | O3: =+O2+1 -> 37 | P3: 13
A4: 3 | B4: =+B3-6 -> 163 | C4: 8 | D4: 133 | E4: =+E3+1 -> 13 | F4: 107 | G4: =+G3+1 -> 18 | H4: 82 | I4: =+I3+1 -> 23 | J4: 61 | K4: =+K3+1 -> 28 | L4: 41 | M4: =+M3+1 -> 33 | N4: 25 | O4: =+O3+1 -> 38 | P4: 10
A5: 4 | B5: =+B4-6 -> 157 | C5: 9 | D5: 127 | E5: =+E4+1 -> 14 | F5: 102 | G5: =+G4+1 -> 19 | H5: 77 | I5: =+I4+1 -> 24 | J5: 57 | K5: =+K4+1 -> 29 | L5: 37 | M5: =+M4+1 -> 34 | N5: 22 | O5: =+O4+1 -> 39 | P5: 7
A6: 5 | B6: =+B5-6 -> 151 | C6: 10 | D6: 122 | E6: =+E5+1 -> 15 | F6: 97 | G6: =+G5+1 -> 20 | H6: 73 | I6: =+I5+1 -> 25 | J6: 53 | K6: =+K5+1 -> 30 | L6: 34 | M6: =+M5+1 -> 35 | N6: 19 | O6: =+O5+1 -> 40 | P6: 4