A1: R$14,99 mussarela, catupiry, buon gustaio, toscanela, calabresa (preço para retirar no balcão) | C1: R$14,99 mussarela, catupiry, buon gustaio, toscanela, calabresa (preço para retirar no balcão)

A1: PILOTOS | B1: P | C1: TEMPO | D1: V | E1: P | F1: TEMPO | G1: V | H1: P | I1: TEMPO | J1: V | K1: P | L1: TEMPO | M1: V | N1: P | O1: TEMPO | P1: V | Q1: P | R1: TEMPO | S1: V | T1: P | U1: TEMPO | V1: V | W1: P | X1: TEMPO | Y1: V | Z1: TOTAL | AA1: MEDIA
A2: BONGA | B2: 5 | C2: 4.7290000000000001 | D2: 28 | E2: 7 | F2: 5.6660000000000004 | G2: 28 | H2: 8 | I2: 4.625 | J2: 26 | K2: 6 | L2: 5.609 | M2: 28 | N2: 4 | O2: 5.8390000000000004 | P2: 28 | Q2: 2 | R2: 5.609 | S2: 28 | T2: 1 | U2: 5.72 | V2: 27 | W2: 3 | X2: 5.6070000000000002 | Y2: 29 | Z2: =+Y2+V2+S2+P2+M2+J2+G2+D2 -> 222 | AA2: =+(X2+U2+R2+O2+L2+I2+F2+C2)/8 -> 5.4254999999999995
A3: JERA | B3: 8 | C3: 5.7210000000000001 | D3: 25 | E3: 6 | F3: 5.7750000000000004 | G3: 26 | H3: 4 | I3: 5.94 | J3: 27 | K3: 2 | L3: 5.8840000000000003 | M3: 27 | N3: 1 | O3: 5.72 | P3: 29 | Q3: 3 | R3: 5.7190000000000003 | S3: 27 | T3: 5 | U3: 5.1769999999999996 | V3: 29 | W3: 7 | X3: 5.72 | Y3: 28 | Z3: =+Y3+V3+S3+P3+M3+J3+G3+D3 -> 218 | AA3: =+(X3+U3+R3+O3+L3+I3+F3+C3)/8 -> 5.706999999999999
A4: RUBAO | B4: 4 | C4: 5.79 | D4: 26 | E4: 2 | F4: 5.8140000000000001 | G4: 28 | H4: 1 | I4: 5.9390000000000001 | J4: 26 | K4: 3 | L4: 5.94 | M4: 25 | N4: 5 | O4: 5.8310000000000004 | P4: 28 | Q4: 7 | R4: 5.8840000000000003 | S4: 26 | T4: 8 | U4: 5.9950000000000001 | V4: 26 | W4: 6 | X4: 5.9930000000000003 | Y4: 26 | Z4: =+Y4+V4+S4+P4+M4+J4+G4+D4 -> 211 | AA4: =+(X4+U4+R4+O4+L4+I4+F4+C4)/8 -> 5.89825
A5: HENRIQUE | B5: 3 | C5: 5.8849999999999998 | D5: 25 | E5: 5 | F5: 5.8840000000000003 | G5: 26 | H5: 7 | I5: 5.8310000000000004 | J5: 27 | K5: 8 | L5: 6.1059999999999999 | M5: 25 | N5: 6 | O5: 5.9930000000000003 | P5: 25 | Q5: 4 | R5: 5.5549999999999997 | S5: 26 | T5: 2 | U5: 5.665 | V5: 25 | W5: 1 | X5: 5.61 | Y5: 29 | Z5: =+Y5+V5+S5+P5+M5+J5+G5+D5 -> 208 | AA5: =+(X5+U5+R5+O5+L5+I5+F5+C5)/8 -> 5.8161250000000004
A6: JOVINO | B6: 7 | C6: 6.2549999999999999 | D6: 26 | E6: 8 | F6: 6.45 | G6: 22 | H6: 6 | I6: 6.27 | J6: 24 | K6: 4 | L6: 6.2160000000000002 | M6: 24 | N6: 2 | O6: 6.16 | P6: 27 | Q6: 1 | R6: 6.38 | S6: 24 | T6: 3 | U6: 6.1050000000000004 | V6: 25 | W6: 5 | X6: 6.2160000000000002 | Y6: 27 | Z6: =+Y6+V6+S6+P6+M6+J6+G6+D6 -> 199 | AA6: =+(X6+U6+R6+O6+L6+I6+F6+C6)/8 -> 6.2565000000000008
A7: GOROI | B7: 2 | C7: 5.8739999999999997 | D7: 27 | E7: 1 | F7: 5.9960000000000004 | G7: 25 | H7: 3 | I7: 5.8289999999999997 | J7: 27 | K7: 5 | L7: 5.9249999999999998 | M7: 26 | N7: 7 | O7: 6.12 | P7: 24 | Q7: 8 | R7: 6.3250000000000002 | S7: 20 | T7: 6 | U7: 6.2160000000000002 | V7: 23 | W7: 4 | X7: 5.9390000000000001 | Y7: 20 | Z7: =+Y7+V7+S7+P7+M7+J7+G7+D7 -> 192 | AA7: =+(X7+U7+R7+O7+L7+I7+F7+C7)/8 -> 6.0280000000000005
A8: NETO | B8: 1 | C8: 6.1050000000000004 | D8: 22 | E8: 3 | F8: 5.72 | G8: 21 | H8: 5 | I8: 5.8849999999999998 | J8: 25 | K8: 7 | L8: 5.8360000000000003 | M8: 26 | N8: 8 | O8: 5.9390000000000001 | P8: 24 | Q8: 6 | R8: 5.9950000000000001 | S8: 24 | T8: 4 | U8: 5.7750000000000004 | V8: 22 | W8: 2 | X8: 5.94 | Y8: 25 | Z8: =+Y8+V8+S8+P8+M8+J8+G8+D8 -> 189 | AA8: =+(X8+U8+R8+O8+L8+I8+F8+C8)/8 -> 5.899375
A9: RACID | B9: 6 | C9: 6.2149999999999999 | D9: 18 | E9: 4 | F9: 6.0469999999999997 | G9: 22 | H9: 2 | I9: 6.38 | J9: 19 | K9: 1 | L9: 6.1609999999999996 | M9: 24 | N9: 3 | O9: 6.27 | P9: 4 | Q9: 5 | R9: 999 | S9: 1 | T9: 7 | U9: 6.3780000000000001 | V9: 12 | Z9: =+Y9+V9+S9+P9+M9+J9+G9+D9 -> 100 | AA9: =+(X9+U9+R9+O9+L9+I9+F9+C9)/8 -> 129.556375