A1: Patrocinadores

B1: Motos e Acessórios Honda - Rua Sete de Setembro, 387 - Fone: (15) 3331-6700.

A1: 1 Bateria
A2: Pilotos | B2: Pis | C2: Tempo | D2: Vol | E2: Pis | F2: Tempo | G2: Vol | H2: Pis | I2: Tempo | J2: Vol | K2: Pis | L2: Tempo | M2: Vol | N2: Pis | O2: Tempo | P2: Vol | Q2: Pis | R2: Tempo | S2: Vol | T2: Pis | U2: Tempo | V2: Vol | W2: Pis | X2: Tempo | Y2: Vol | Z2: Total | AA2: Media | AB2: Record
A3: CONRADO | B3: 6 | C3: 4.7854000000000001 | D3: 34.58 | E3: 4 | F3: 4.8353000000000002 | G3: 32.63 | H3: 2 | I3: 4.6216999999999997 | J3: 35.49 | K3: 1 | L3: 4.8236999999999997 | M3: 34.27 | N3: 3 | O3: 4.6200999999999999 | P3: 34.47 | Q3: 5 | R3: 4.7305000000000001 | S3: 32.41 | T3: 7 | U3: 4.7328000000000001 | V3: 35.29 | W3: 8 | X3: 5.0587 | Y3: 30.31 | Z3: =+V3+S3+P3+M3+J3+G3+D3+Y3 -> 269.45 | AA3: =+(X3+U3+R3+O3+L3+I3+F3+C3)/8 -> 4.7760249999999997 | AB3: =MINA(X3,U3,R3,O3,L3,I3,F3,C3) -> 4.6200999999999999
A4: RUBAO | B4: 2 | C4: 4.8922999999999996 | D4: 35.47 | E4: 1 | F4: 4.8406000000000002 | G4: 34.4 | H4: 3 | I4: 4.7850000000000001 | J4: 34.47 | K4: 5 | L4: 4.8226000000000004 | M4: 33.28 | N4: 7 | O4: 5.0458999999999996 | P4: 32.63 | Q4: 8 | R4: 5.0038999999999998 | S4: 32.51 | T4: 6 | U4: 4.8388999999999998 | V4: 33.26 | W4: 4 | X4: 4.8414000000000001 | Y4: 33.22 | Z4: =+V4+S4+P4+M4+J4+G4+D4+Y4 -> 269.24 | AA4: =+(X4+U4+R4+O4+L4+I4+F4+C4)/8 -> 4.8838249999999999 | AB4: =MINA(X4,U4,R4,O4,L4,I4,F4,C4) -> 4.7850000000000001
A5: RICARDAO | B5: 1 | C5: 4.8907999999999996 | D5: 29.26 | E5: 3 | F5: 4.6750999999999996 | G5: 36.1 | H5: 5 | I5: 4.6748000000000003 | J5: 33.35 | K5: 7 | L5: 4.8394000000000004 | M5: 30.33 | N5: 8 | O5: 5.06 | P5: 31.75 | Q5: 6 | R5: 4.8369999999999997 | S5: 31.1 | T5: 4 | U5: 4.7851999999999997 | V5: 33.53 | W5: 2 | X5: 4.7354000000000003 | Y5: 35.17 | Z5: =+V5+S5+P5+M5+J5+G5+D5+Y5 -> 260.59 | AA5: =+(X5+U5+R5+O5+L5+I5+F5+C5)/8 -> 4.8122125000000002 | AB5: =MINA(X5,U5,R5,O5,L5,I5,F5,C5) -> 4.6748000000000003
A6: TONI | B6: 7 | C6: 5.0603999999999996 | D6: 32.84 | E6: 8 | F6: 5.0065 | G6: 31.94 | H6: 6 | I6: 5.0591999999999997 | J6: 33.49 | K6: 4 | L6: 5.2234999999999996 | M6: 30.67 | N6: 2 | O6: 5.0594000000000001 | P6: 32.77 | Q6: 1 | R6: 5.1147 | S6: 30.56 | T6: 3 | U6: 5.0049999999999999 | V6: 34.65 | W6: 5 | X6: 5.1708999999999996 | Y6: 31.4 | Z6: =+V6+S6+P6+M6+J6+G6+D6+Y6 -> 258.32 | AA6: =+(X6+U6+R6+O6+L6+I6+F6+C6)/8 -> 5.0874499999999996 | AB6: =MINA(X6,U6,R6,O6,L6,I6,F6,C6) -> 5.0049999999999999
A7: COISA PRETA | B7: 3 | C7: 5.0095999999999998 | D7: 32.29 | E7: 5 | F7: 4.8394000000000004 | G7: 27.27 | H7: 7 | I7: 4.8909000000000002 | J7: 30.55 | K7: 8 | L7: 5.1669999999999998 | M7: 30.44 | N7: 6 | O7: 4.9568000000000003 | P7: 33.11 | Q7: 4 | R7: 4.9465000000000003 | S7: 31.46 | T7: 2 | U7: 5.0598999999999998 | V7: 32.51 | W7: 1 | X7: 5.0617000000000001 | Y7: 30.25 | Z7: =+V7+S7+P7+M7+J7+G7+D7+Y7 -> 247.88 | AA7: =+(X7+U7+R7+O7+L7+I7+F7+C7)/8 -> 4.9914750000000003 | AB7: =MINA(X7,U7,R7,O7,L7,I7,F7,C7) -> 4.8394000000000004
A8: MANE | B8: 4 | C8: 4.6227 | D8: 32.21 | E8: 2 | F8: 4.6166 | G8: 31.53 | H8: 1 | I8: 4.8958000000000004 | J8: 31.25 | K8: 3 | L8: 4.6201999999999996 | M8: 31.28 | N8: 5 | O8: 5.0426000000000002 | P8: 32.47 | Q8: 7 | R8: 4.8413000000000004 | S8: 28.41 | T8: 8 | U8: 4.8785999999999996 | V8: 28.23 | W8: 6 | X8: 4.8266999999999998 | Y8: 30.95 | Z8: =+V8+S8+P8+M8+J8+G8+D8+Y8 -> 246.33 | AA8: =+(X8+U8+R8+O8+L8+I8+F8+C8)/8 -> 4.7930625000000004 | AB8: =MINA(X8,U8,R8,O8,L8,I8,F8,C8) -> 4.6166
A9: LUIZ | B9: 5 | C9: 5.0513000000000003 | D9: 31.21 | E9: 7 | F9: 5.1746999999999996 | G9: 30.74 | H9: 8 | I9: 5.1734999999999998 | J9: 30.44 | K9: 6 | L9: 5.0655000000000001 | M9: 30.56 | N9: 4 | O9: 5.1708999999999996 | P9: 28.46 | Q9: 2 | R9: 4.9569000000000001 | S9: 32.54 | T9: 1 | U9: 5.6658999999999997 | V9: 24.86 | W9: 3 | X9: 5.0069999999999997 | Y9: 31.25 | Z9: =+V9+S9+P9+M9+J9+G9+D9+Y9 -> 240.06 | AA9: =+(X9+U9+R9+O9+L9+I9+F9+C9)/8 -> 5.1582124999999994 | AB9: =MINA(X9,U9,R9,O9,L9,I9,F9,C9) -> 4.9569000000000001
A10: LUIZ FELIPE | B10: 8 | C10: 5.0430999999999999 | D10: 29.6 | E10: 6 | F10: 4.8407999999999998 | G10: 32.64 | H10: 4 | I10: 5.0602999999999998 | J10: 32.41 | K10: 2 | L10: 4.8404999999999996 | M10: 31.26 | N10: 1 | O10: 5.0045999999999999 | P10: 29.7 | Q10: 3 | R10: 4.9504000000000001 | S10: 32.43 | T10: 5 | U10: 5.2793999999999999 | V10: 20 | W10: 7 | X10: 4.4542999999999999 | Y10: 24.11 | Z10: =+V10+S10+P10+M10+J10+G10+D10+Y10 -> 232.15 | AA10: =+(X10+U10+R10+O10+L10+I10+F10+C10)/8 -> 4.9341749999999998 | AB10: =MINA(X10,U10,R10,O10,L10,I10,F10,C10) -> 4.4542999999999999
A11: CALVO | B11: 1 | C11: 5.2792000000000003 | D11: 29.8 | E11: 3 | F11: 5.0578000000000003 | G11: 27.9 | H11: 5 | I11: 5.1816000000000004 | J11: 26.87 | K11: 7 | L11: 5.4908999999999999 | M11: 27.76 | N11: 8 | O11: 5.2793000000000001 | P11: 26.77 | Q11: 6 | R11: 5.0437000000000003 | S11: 28.35 | T11: 4 | U11: 5.3274999999999997 | V11: 26.38 | W11: 2 | X11: 5.2253999999999996 | Y11: 28.47 | Z11: =+V11+S11+P11+M11+J11+G11+D11+Y11 -> 222.3 | AA11: =+(X11+U11+R11+O11+L11+I11+F11+C11)/8 -> 5.2356750000000005 | AB11: =MINA(X11,U11,R11,O11,L11,I11,F11,C11) -> 5.0437000000000003
A12: 2 Bateria
A13: Piloto | B13: Pi | C13: Tempo | D13: Vol | E13: Pi | F13: Tempo | G13: Vol | H13: Pi | I13: Tempo | J13: Vol | K13: Pi | L13: Tempo | M13: Vol | N13: Pi | O13: Tempo | P13: Vol | Q13: Pi | R13: Tempo | S13: Vol | T13: Pi | U13: Tempo | V13: Vol | W13: Pi | X13: Tempo | Y13: Vol | Z13: Total | AA13: Media | AB13: Record
A14: RICARDINHO | B14: 5 | C14: 4.5265000000000004 | D14: 36.92 | E14: 7 | F14: 4.5103 | G14: 35.33 | H14: 8 | I14: 4.6254 | J14: 33.21 | K14: 6 | L14: 4.6177999999999999 | M14: 34.4 | N14: 4 | O14: 4.5107999999999997 | P14: 34.46 | Q14: 2 | R14: 4.4375999999999998 | S14: 35.9 | T14: 1 | U14: 4.7305999999999999 | V14: 35.26 | W14: 3 | X14: 4.3895999999999997 | Y14: 34.27 | Z14: =+Y14+V14+S14+P14+M14+J14+G14+D14 -> 279.75 | AA14: =+(X14+U14+R14+O14+L14+I14+F14+C14)/8 -> 4.5435749999999997 | AB14: =MINA(X14,U14,R14,O14,L14,I14,F14,C14) -> 4.3895999999999997
A15: ERIC | B15: 6 | C15: 4.8368000000000002 | D15: 30.06 | E15: 4 | F15: 4.6738999999999997 | G15: 35.71 | H15: 2 | I15: 4.7290000000000001 | J15: 36.32 | K15: 1 | L15: 4.694 | M15: 33.31 | N15: 3 | O15: 4.7256 | P15: 34.76 | Q15: 5 | R15: 4.8360000000000003 | S15: 35.45 | T15: 7 | U15: 5.0601000000000003 | V15: 30.43 | W15: 8 | X15: 4.8459000000000003 | Y15: 33.51 | Z15: =+Y15+V15+S15+P15+M15+J15+G15+D15 -> 269.55 | AA15: =+(X15+U15+R15+O15+L15+I15+F15+C15)/8 -> 4.800162499999999 | AB15: =MINA(X15,U15,R15,O15,L15,I15,F15,C15) -> 4.6738999999999997
A16: JULIO | B16: 8 | C16: 4.8952999999999998 | D16: 32.55 | E16: 6 | F16: 4.7298999999999998 | G16: 32.62 | H16: 4 | I16: 4.84 | J16: 31.64 | K16: 2 | L16: 4.6745999999999999 | M16: 33.91 | N16: 1 | O16: 4.8787000000000003 | P16: 32.11 | Q16: 3 | R16: 4.6719999999999997 | S16: 32.49 | T16: 5 | U16: 4.7503000000000002 | V16: 35.78 | W16: 7 | X16: 4.9707999999999997 | Y16: 32.75 | Z16: =+Y16+V16+S16+P16+M16+J16+G16+D16 -> 263.85 | AA16: =+(X16+U16+R16+O16+L16+I16+F16+C16)/8 -> 4.8014499999999991 | AB16: =MINA(X16,U16,R16,O16,L16,I16,F16,C16) -> 4.6719999999999997
A17: ZE MARIO | B17: 4 | C17: 4.3966000000000003 | D17: 33.86 | E17: 2 | F17: 4.5655999999999999 | G17: 32.26 | H17: 1 | I17: 4.6150000000000002 | J17: 36.05 | K17: 3 | L17: 4.5646000000000004 | M17: 34.78 | N17: 5 | O17: 4.6162000000000001 | P17: 30.86 | Q17: 7 | R17: 4.3971999999999998 | S17: 32.7 | T17: 8 | U17: 4.7291999999999996 | V17: 32.43 | W17: 6 | X17: 4.6025 | Y17: 30.6 | Z17: =+Y17+V17+S17+P17+M17+J17+G17+D17 -> 263.54 | AA17: =+(X17+U17+R17+O17+L17+I17+F17+C17)/8 -> 4.5608624999999998 | AB17: =MINA(X17,U17,R17,O17,L17,I17,F17,C17) -> 4.3966000000000003
A18: RUDSON | B18: 7 | C18: 4.6773999999999996 | D18: 31.28 | E18: 8 | F18: 4.7298999999999998 | G18: 33.33 | H18: 6 | I18: 4.8394000000000004 | J18: 29.31 | K18: 4 | L18: 4.5660999999999996 | M18: 33.15 | N18: 2 | O18: 4.6200999999999999 | P18: 34.64 | Q18: 1 | R18: 4.8364000000000003 | S18: 33.74 | T18: 3 | U18: 4.5107999999999997 | V18: 33.62 | W18: 5 | X18: 4.6212999999999997 | Y18: 31.63 | Z18: =+Y18+V18+S18+P18+M18+J18+G18+D18 -> 260.7 | AA18: =+(X18+U18+R18+O18+L18+I18+F18+C18)/8 -> 4.6751749999999994 | AB18: =MINA(X18,U18,R18,O18,L18,I18,F18,C18) -> 4.5107999999999997
A19: BETO | B19: 3 | C19: 4.8414000000000001 | D19: 35.27 | E19: 5 | F19: 4.8360000000000003 | G19: 29.13 | H19: 7 | I19: 5.0052000000000003 | J19: 28.85 | K19: 8 | L19: 5.0603999999999996 | M19: 30.73 | N19: 6 | O19: 4.8413000000000004 | P19: 32.96 | Q19: 4 | R19: 5.1111000000000004 | S19: 32.07 | T19: 2 | U19: 4.7812000000000001 | V19: 35.25 | W19: 1 | X19: 5.0609000000000002 | Y19: 29.01 | Z19: =+Y19+V19+S19+P19+M19+J19+G19+D19 -> 253.27 | AA19: =+(X19+U19+R19+O19+L19+I19+F19+C19)/8 -> 4.9421875000000002 | AB19: =MINA(X19,U19,R19,O19,L19,I19,F19,C19) -> 4.7812000000000001
A20: JOAO KIBOM | B20: 2 | C20: 4.6181000000000001 | D20: 35.26 | E20: 1 | F20: 4.8201999999999998 | G20: 23.01 | H20: 3 | I20: 4.6151 | J20: 35.75 | K20: 5 | L20: 4.7343000000000002 | M20: 34.47 | N20: 7 | O20: 4.782 | P20: 33.75 | Q20: 8 | R20: 4.9507000000000003 | S20: 10.08 | T20: 6 | U20: 4.5753000000000004 | V20: 33.16 | W20: 4 | X20: 4.6192000000000002 | Y20: 31.86 | Z20: =+Y20+V20+S20+P20+M20+J20+G20+D20 -> 237.34 | AA20: =+(X20+U20+R20+O20+L20+I20+F20+C20)/8 -> 4.7143625 | AB20: =MINA(X20,U20,R20,O20,L20,I20,F20,C20) -> 4.5753000000000004
A21: NETO | B21: 1 | C21: 4.6325000000000003 | D21: 29.45 | E21: 3 | F21: 4.6196000000000002 | G21: 33.91 | H21: 5 | I21: 4.8410000000000002 | J21: 20.62 | K21: 7 | L21: 4.7855999999999996 | M21: 31.66 | N21: 8 | O21: 5.0057999999999998 | P21: 25.45 | Q21: 6 | R21: 4.8414000000000001 | S21: 32.72 | T21: 4 | U21: 4.7313999999999998 | V21: 31.48 | W21: 2 | X21: 5.2268999999999997 | Y21: 3 | Z21: =+Y21+V21+S21+P21+M21+J21+G21+D21 -> 208.29 | AA21: =+(X21+U21+R21+O21+L21+I21+F21+C21)/8 -> 4.8355249999999996 | AB21: =MINA(X21,U21,R21,O21,L21,I21,F21,C21) -> 4.6196000000000002
A22: 3 Bateria
A23: Piloto | B23: Pi | C23: Tempo | D23: Vol | E23: Pi | F23: Tempo | G23: Vol | H23: Pi | I23: Tempo | J23: Vol | K23: Pi | L23: Tempo | M23: Vol | N23: Pi | O23: Tempo | P23: Vol | Q23: Pi | R23: Tempo | S23: Vol | T23: Pi | U23: Tempo | V23: Vol | W23: Pi | X23: Tempo | Y23: Vol | Z23: Total | AA23: Media | AB23: Record
A24: BONGA | B24: 7 | C24: 4.4676 | D24: 38.23 | E24: 8 | F24: 4.6201999999999996 | G24: 37.51 | H24: 6 | I24: 4.6193999999999997 | J24: 36.33 | K24: 4 | L24: 4.4002999999999997 | M24: 37.5 | N24: 2 | O24: 4.4545000000000003 | P24: 37.2 | Q24: 1 | R24: 4.6002999999999998 | S24: 35.76 | T24: 3 | U24: 4.4576000000000002 | V24: 37.98 | W24: 5 | X24: 4.6181000000000001 | Y24: 36.46 | Z24: =+Y24+V24+S24+P24+M24+J24+G24+D24 -> 296.97 | AA24: =+(X24+U24+R24+O24+L24+I24+F24+C24)/8 -> 4.5297499999999999 | AB24: =MINA(X24,U24,R24,O24,L24,I24,F24,C24) -> 4.4002999999999997
A25: JERA | B25: 6 | C25: 4.6200999999999999 | D25: 38.22 | E25: 4 | F25: 4.5106000000000002 | G25: 37.03 | H25: 2 | I25: 4.4550999999999998 | J25: 38.09 | K25: 1 | L25: 4.617 | M25: 37.04 | N25: 3 | O25: 4.6166 | P25: 36.33 | Q25: 5 | R25: 4.6208999999999998 | S25: 36.54 | T25: 7 | U25: 4.5991999999999997 | V25: 36.04 | W25: 8 | X25: 4.6208 | Y25: 36.2 | Z25: =+Y25+V25+S25+P25+M25+J25+G25+D25 -> 295.49 | AA25: =+(X25+U25+R25+O25+L25+I25+F25+C25)/8 -> 4.5825374999999999 | AB25: =MINA(X25,U25,R25,O25,L25,I25,F25,C25) -> 4.4550999999999998
A26: ANDERSON | B26: 1 | C26: 4.6189999999999998 | D26: 37.11 | E26: 3 | F26: 4.4001000000000001 | G26: 36.86 | H26: 5 | I26: 4.617 | J26: 37.8 | K26: 7 | L26: 4.5662000000000003 | M26: 37.51 | N26: 8 | O26: 4.5628000000000002 | P26: 38.11 | Q26: 6 | R26: 4.5147000000000004 | S26: 36.5 | T26: 4 | U26: 4.4560000000000004 | V26: 30.45 | W26: 2 | X26: 4.4004000000000003 | Y26: 36.26 | Z26: =+Y26+V26+S26+P26+M26+J26+G26+D26 -> 290.6 | AA26: =+(X26+U26+R26+O26+L26+I26+F26+C26)/8 -> 4.5170250000000003 | AB26: =MINA(X26,U26,R26,O26,L26,I26,F26,C26) -> 4.4001000000000001
A27: MICHEL | B27: 3 | C27: 4.6158999999999999 | D27: 36.21 | E27: 5 | F27: 4.6170999999999998 | G27: 38.19 | H27: 7 | I27: 4.6151999999999997 | J27: 34.09 | K27: 8 | L27: 4.8413000000000004 | M27: 34.61 | N27: 6 | O27: 4.6197999999999997 | P27: 37.03 | Q27: 4 | R27: 4.6192000000000002 | S27: 36.91 | T27: 2 | U27: 4.5609999999999999 | V27: 36.14 | W27: 1 | X27: 4.7072000000000003 | Y27: 36.98 | Z27: =+Y27+V27+S27+P27+M27+J27+G27+D27 -> 290.16 | AA27: =+(X27+U27+R27+O27+L27+I27+F27+C27)/8 -> 4.6495874999999991 | AB27: =MINA(X27,U27,R27,O27,L27,I27,F27,C27) -> 4.5609999999999999
A28: DINHO | B28: 4 | C28: 4.4001000000000001 | D28: 39.06 | E28: 2 | F28: 4.3983999999999996 | G28: 35.87 | H28: 1 | I28: 4.6205999999999996 | J28: 34.49 | K28: 3 | L28: 4.4002999999999997 | M28: 36.12 | N28: 5 | O28: 4.4569999999999999 | P28: 38.89 | Q28: 7 | R28: 4.6205999999999996 | S28: 32.74 | T28: 8 | U28: 4.5652999999999997 | V28: 36.94 | W28: 6 | X28: 4.6154999999999999 | Y28: 35.62 | Z28: =+Y28+V28+S28+P28+M28+J28+G28+D28 -> 289.73 | AA28: =+(X28+U28+R28+O28+L28+I28+F28+C28)/8 -> 4.5097249999999995 | AB28: =MINA(X28,U28,R28,O28,L28,I28,F28,C28) -> 4.3983999999999996
A29: LISTER | B29: 2 | C29: 4.4008000000000003 | D29: 36.24 | E29: 1 | F29: 4.6863000000000001 | G29: 34.84 | H29: 3 | I29: 4.5107999999999997 | J29: 36.12 | K29: 5 | L29: 4.6745000000000001 | M29: 36.07 | N29: 7 | O29: 4.7309999999999999 | P29: 36.37 | Q29: 8 | R29: 4.8402000000000003 | S29: 32.76 | T29: 6 | U29: 4.7293000000000003 | V29: 33.46 | W29: 4 | X29: 4.6166999999999998 | Y29: 36.29 | Z29: =+Y29+V29+S29+P29+M29+J29+G29+D29 -> 282.15 | AA29: =+(X29+U29+R29+O29+L29+I29+F29+C29)/8 -> 4.6486999999999998 | AB29: =MINA(X29,U29,R29,O29,L29,I29,F29,C29) -> 4.4008000000000003
A30: EVANDRO | B30: 5 | C30: 4.7849000000000004 | D30: 35.62 | E30: 7 | F30: 4.8394000000000004 | G30: 34.83 | H30: 8 | I30: 4.8917999999999999 | J30: 33.21 | K30: 6 | L30: 4.8365 | M30: 31.84 | N30: 4 | O30: 4.8958000000000004 | P30: 33.71 | Q30: 2 | R30: 4.1254999999999997 | S30: 35.27 | T30: 1 | U30: 4.7850000000000001 | V30: 33.75 | W30: 3 | X30: 4.6197999999999997 | Y30: 36.48 | Z30: =+Y30+V30+S30+P30+M30+J30+G30+D30 -> 274.71 | AA30: =+(X30+U30+R30+O30+L30+I30+F30+C30)/8 -> 4.7223375000000001 | AB30: =MINA(X30,U30,R30,O30,L30,I30,F30,C30) -> 4.1254999999999997
A31: MARCEL | B31: 8 | C31: 4.8207000000000004 | D31: 35.53 | E31: 6 | F31: 4.6768999999999998 | G31: 35.23 | H31: 4 | I31: 4.8208000000000002 | J31: 31.64 | K31: 2 | L31: 4.84 | M31: 32.75 | N31: 1 | O31: 5.0594999999999999 | P31: 33.83 | Q31: 3 | R31: 4.7180999999999997 | S31: 35.28 | T31: 5 | U31: 4.8956 | V31: 30.6 | W31: 7 | X31: 5.2251000000000003 | Y31: 28.17 | Z31: =+Y31+V31+S31+P31+M31+J31+G31+D31 -> 263.03 | AA31: =+(X31+U31+R31+O31+L31+I31+F31+C31)/8 -> 4.8820875000000008 | AB31: =MINA(X31,U31,R31,O31,L31,I31,F31,C31) -> 4.6768999999999998