A1: Patrocinadores

B1: Motos e Acessórios Honda - Rua Sete de Setembro, 387 - Fone: (15) 3331-6700. | C1: Rua Olavo Bilac, 254 - Vila Santana

A1: 1 Bateria
A2: Piloto | B2: Pi | C2: Tempo | D2: Voltas | E2: Pi | F2: Tempo | G2: Voltas | H2: Pi | I2: Tempo | J2: Voltas | K2: Pi | L2: Tempo | M2: Voltas | N2: Pi | O2: Tempo | P2: Voltas | Q2: Pi | R2: Tempo | S2: Voltas | T2: Pi | U2: Tempo | V2: Voltas | W2: Pi | X2: Tempo | Y2: Voltas | Z2: Total | AA2: Media | AB2: Record
A3: GIOVANNI | B3: 5 | C3: 5.4450000000000003 | D3: 30 | E3: 7 | F3: 5.4995000000000003 | G3: 30 | H3: 8 | I3: 5.4992999999999999 | J3: 27 | K3: 6 | L3: 5.4999000000000002 | M3: 29 | N3: 4 | O3: 5.5 | P3: 31 | Q3: 2 | R3: 5.4992999999999999 | S3: 29 | T3: 1 | U3: 5.4993999999999996 | V3: 29 | W3: 3 | X3: 5.3357999999999999 | Y3: 31.39 | Z3: =+Y3+V3+S3+P3+M3+J3+G3+D3 -> 236.39 | AA3: =+(X3+U3+R3+O3+L3+I3+F3+C3)/8 -> 5.4722749999999998 | AB3: =MINA(X3,U3,R3,O3,L3,I3,F3,C3) -> 5.3357999999999999
A4: LUIZ FELIPE | B4: 4 | C4: 5.4836 | D4: 27 | E4: 2 | F4: 5.3906999999999998 | G4: 27 | H4: 1 | I4: 5.5000999999999998 | J4: 22 | K4: 3 | L4: 5.3905000000000003 | M4: 31 | N4: 5 | O4: 5.718 | P4: 27 | Q4: 7 | R4: 5.9393000000000002 | S4: 26 | T4: 8 | U4: 5.7202000000000002 | V4: 20 | W4: 6 | X4: 5.9222999999999999 | Y4: 27.74 | Z4: =+Y4+V4+S4+P4+M4+J4+G4+D4 -> 207.74 | AA4: =+(X4+U4+R4+O4+L4+I4+F4+C4)/8 -> 5.6330875000000002 | AB4: =MINA(X4,U4,R4,O4,L4,I4,F4,C4) -> 5.3905000000000003
A5: PICA PAU | B5: 6 | C5: 5.7206000000000001 | D5: 26 | E5: 4 | F5: 5.4995000000000003 | G5: 28 | H5: 2 | I5: 5.7210000000000001 | J5: 23 | K5: 1 | L5: 5.9409000000000001 | M5: 27 | N5: 3 | O5: 5.7098000000000004 | P5: 26 | Q5: 5 | R5: 5.2804000000000002 | S5: 26 | T5: 7 | U5: 5.5007000000000001 | V5: 24 | W5: 8 | X5: 5.9408000000000003 | Y5: 24.43 | Z5: =+Y5+V5+S5+P5+M5+J5+G5+D5 -> 204.43 | AA5: =+(X5+U5+R5+O5+L5+I5+F5+C5)/8 -> 5.6642124999999997 | AB5: =MINA(X5,U5,R5,O5,L5,I5,F5,C5) -> 5.2804000000000002
A6: LISTER | B6: 2 | C6: 5.5010000000000003 | D6: 28 | E6: 1 | F6: 5.0605000000000002 | G6: 24 | H6: 3 | I6: 5.7218999999999998 | J6: 18 | K6: 5 | L6: 5.7032999999999996 | M6: 29 | N6: 7 | O6: 5.5018000000000002 | P6: 24 | Q6: 8 | R6: 5.5006000000000004 | S6: 28 | T6: 6 | U6: 5.5204000000000004 | V6: 19 | W6: 4 | X6: 5.3894000000000002 | Y6: 31.2 | Z6: =+Y6+V6+S6+P6+M6+J6+G6+D6 -> 201.2 | AA6: =+(X6+U6+R6+O6+L6+I6+F6+C6)/8 -> 5.4873624999999997 | AB6: =MINA(X6,U6,R6,O6,L6,I6,F6,C6) -> 5.0605000000000002
A7: TOMAZ | B7: 1 | C7: 5.7202000000000002 | D7: 27 | E7: 3 | F7: 5.7183000000000002 | G7: 24 | H7: 5 | I7: 6.16 | J7: 22 | K7: 7 | L7: 5.9378000000000002 | M7: 24 | N7: 8 | O7: 5.9401000000000002 | P7: 24 | Q7: 6 | R7: 6.1067999999999998 | S7: 24 | T7: 4 | U7: 5.7240000000000002 | V7: 26 | W7: 2 | X7: 5.8301999999999996 | Y7: 26.24 | Z7: =+Y7+V7+S7+P7+M7+J7+G7+D7 -> 197.24 | AA7: =+(X7+U7+R7+O7+L7+I7+F7+C7)/8 -> 5.8921749999999999 | AB7: =MINA(X7,U7,R7,O7,L7,I7,F7,C7) -> 5.7183000000000002
A8: RICARDO | B8: 7 | C8: 5.9240000000000004 | D8: 23 | E8: 8 | F8: 6.1604999999999999 | G8: 24 | H8: 6 | I8: 6.3680000000000003 | J8: 17 | K8: 4 | L8: 5.9406999999999996 | M8: 26 | N8: 2 | O8: 5.2804000000000002 | P8: 26 | Q8: 1 | R8: 5.0612000000000004 | S8: 26 | T8: 3 | U8: 6.1592000000000002 | V8: 26 | W8: 5 | X8: 6.2701000000000002 | Y8: 27.22 | Z8: =+Y8+V8+S8+P8+M8+J8+G8+D8 -> 195.22 | AA8: =+(X8+U8+R8+O8+L8+I8+F8+C8)/8 -> 5.8955124999999997 | AB8: =MINA(X8,U8,R8,O8,L8,I8,F8,C8) -> 5.0612000000000004
A9: FLAVIO | B9: 8 | C9: 5.6650999999999998 | D9: 24 | E9: 6 | F9: 5.7203999999999997 | G9: 27 | H9: 4 | I9: 5.4993999999999996 | J9: 27 | K9: 2 | L9: 5.7187999999999999 | M9: 24 | N9: 1 | O9: 5.7207999999999997 | P9: 26 | Q9: 3 | R9: 5.5007999999999999 | S9: 23 | T9: 5 | U9: 4.6205999999999996 | V9: 21 | W9: 7 | X9: 5.7201000000000004 | Y9: 19.48 | Z9: =+Y9+V9+S9+P9+M9+J9+G9+D9 -> 191.48 | AA9: =+(X9+U9+R9+O9+L9+I9+F9+C9)/8 -> 5.5207500000000005 | AB9: =MINA(X9,U9,R9,O9,L9,I9,F9,C9) -> 4.6205999999999996
A10: 2 Bateria
A11: Piloto | B11: Pi | C11: Tempo | D11: Voltas | E11: Pi | F11: Tempo | G11: Voltas | H11: Pi | I11: Tempo | J11: Voltas | K11: Pi | L11: Tempo | M11: Voltas | N11: Pi | O11: Tempo | P11: Voltas | Q11: Pi | R11: Tempo | S11: Voltas | T11: Pi | U11: Tempo | V11: Voltas | W11: Pi | X11: Tempo | Y11: Voltas | Z11: Total | AA11: Media | AB11: Record
A12: JOAO KIBON | B12: 5 | C12: 5.5000999999999998 | D12: 26 | E12: 7 | F12: 5.3353000000000002 | G12: 30 | H12: 8 | I12: 5.4991000000000003 | J12: 30 | K12: 6 | L12: 5.2797000000000001 | M12: 32 | N12: 4 | O12: 5.2790999999999997 | P12: 30 | Q12: 2 | R12: 5.2591999999999999 | S12: 28 | T12: 1 | U12: 5.4996999999999998 | V12: 28 | W12: 3 | X12: 5.3323 | Y12: 31.77 | Z12: =+Y12+V12+S12+P12+M12+J12+G12+D12 -> 235.77 | AA12: =+(X12+U12+R12+O12+L12+I12+F12+C12)/8 -> 5.3730624999999996 | AB12: =MINA(X12,U12,R12,O12,L12,I12,F12,C12) -> 5.2591999999999999
A13: CONRADO | B13: 8 | C13: 5.7195 | D13: 23 | E13: 6 | F13: 5.7209000000000003 | G13: 29 | H13: 4 | I13: 5.7209000000000003 | J13: 24 | K13: 2 | L13: 5.6978999999999997 | M13: 27 | N13: 1 | O13: 5.7206000000000001 | P13: 28 | Q13: 3 | R13: 5.5008999999999997 | S13: 30 | T13: 5 | U13: 5.7199 | V13: 28 | W13: 7 | X13: 5.7187000000000001 | Y13: 29.15 | Z13: =+Y13+V13+S13+P13+M13+J13+G13+D13 -> 218.15 | AA13: =+(X13+U13+R13+O13+L13+I13+F13+C13)/8 -> 5.6899125000000002 | AB13: =MINA(X13,U13,R13,O13,L13,I13,F13,C13) -> 5.5008999999999997
A14: GERONIMO | B14: 1 | C14: 6.3796999999999997 | D14: 26 | E14: 3 | F14: 5.7990000000000004 | G14: 27 | H14: 5 | I14: 6.2709999999999999 | J14: 21 | K14: 7 | L14: 6.0500999999999996 | M14: 28 | N14: 8 | O14: 5.9398 | P14: 27 | Q14: 6 | R14: 5.9404000000000003 | S14: 28 | T14: 4 | U14: 5.7202000000000002 | V14: 29 | W14: 2 | X14: 6.0484 | Y14: 26.56 | Z14: =+Y14+V14+S14+P14+M14+J14+G14+D14 -> 212.56 | AA14: =+(X14+U14+R14+O14+L14+I14+F14+C14)/8 -> 6.0185750000000002 | AB14: =MINA(X14,U14,R14,O14,L14,I14,F14,C14) -> 5.7202000000000002
A15: RUDSON | B15: 3 | C15: 5.7184999999999997 | D15: 28 | E15: 5 | F15: 5.7198000000000002 | G15: 26 | H15: 7 | I15: 5.9194000000000004 | J15: 24 | K15: 8 | L15: 5.9958999999999998 | M15: 26 | N15: 6 | O15: 5.7201000000000004 | P15: 26 | Q15: 4 | R15: 5.7196999999999996 | S15: 27 | T15: 2 | U15: 5.7209000000000003 | V15: 27 | W15: 1 | X15: 5.7209000000000003 | Y15: 28.13 | Z15: =+Y15+V15+S15+P15+M15+J15+G15+D15 -> 212.13 | AA15: =+(X15+U15+R15+O15+L15+I15+F15+C15)/8 -> 5.7793999999999999 | AB15: =MINA(X15,U15,R15,O15,L15,I15,F15,C15) -> 5.7184999999999997
A16: SANDRO ITU | B16: 2 | C16: 5.9402999999999997 | D16: 26 | E16: 1 | F16: 5.9955999999999996 | G16: 29 | H16: 3 | I16: 5.9970999999999997 | J16: 26 | K16: 5 | L16: 6.0492999999999997 | M16: 27 | N16: 7 | O16: 5.9191000000000003 | P16: 25 | Q16: 8 | R16: 6.1047000000000002 | S16: 25 | T16: 6 | U16: 6.0502000000000002 | V16: 26 | W16: 4 | X16: 6.1597 | Y16: 27.74 | Z16: =+Y16+V16+S16+P16+M16+J16+G16+D16 -> 211.74 | AA16: =+(X16+U16+R16+O16+L16+I16+F16+C16)/8 -> 6.0270000000000001 | AB16: =MINA(X16,U16,R16,O16,L16,I16,F16,C16) -> 5.9191000000000003
A17: MARCOS JOSE | B17: 7 | C17: 5.9396000000000004 | D17: 25 | E17: 8 | F17: 5.9424999999999999 | G17: 22 | H17: 6 | I17: 6.1597 | J17: 23 | K17: 4 | L17: 5.9410999999999996 | M17: 23 | N17: 2 | O17: 6.0518000000000001 | P17: 23 | Q17: 1 | R17: 5.9394 | S17: 24 | T17: 3 | U17: 5.7436999999999996 | V17: 23 | W17: 5 | X17: 5.9396000000000004 | Y17: 25.22 | Z17: =+Y17+V17+S17+P17+M17+J17+G17+D17 -> 188.22 | AA17: =+(X17+U17+R17+O17+L17+I17+F17+C17)/8 -> 5.9571749999999994 | AB17: =MINA(X17,U17,R17,O17,L17,I17,F17,C17) -> 5.7436999999999996
A18: PACHECO | B18: 6 | C18: 5.9173 | D18: 26 | E18: 4 | F18: 5.5331999999999999 | G18: 23 | H18: 2 | I18: 5.7655000000000003 | J18: 26 | K18: 1 | L18: 5.7202999999999999 | M18: 28 | N18: 3 | O18: 5.7744 | P18: 26 | Q18: 5 | R18: 5.9634 | S18: 26 | T18: 7 | U18: 5.9393000000000002 | V18: 6 | Z18: =+Y18+V18+S18+P18+M18+J18+G18+D18 -> 161 | AA18: =+(X18+U18+R18+O18+L18+I18+F18+C18)/8 -> 5.0766749999999989 | AB18: =MINA(X18,U18,R18,O18,L18,I18,F18,C18) -> 5.5331999999999999
A19: 3 Bateria
A20: Piloto | B20: Pi | C20: Tempo | D20: Voltas | E20: Pi | F20: Tempo | G20: Voltas | H20: Pi | I20: Tempo | J20: Voltas | K20: Pi | L20: Tempo | M20: Voltas | N20: Pi | O20: Tempo | P20: Voltas | Q20: Pi | R20: Tempo | S20: Voltas | T20: Pi | U20: Tempo | V20: Voltas | W20: Pi | X20: Tempo | Y20: Voltas | Z20: Total | AA20: Media | AB20: Record
A21: MICHEL | B21: 3 | C21: 5.2793000000000001 | D21: 32 | E21: 5 | F21: 5.5042999999999997 | G21: 31 | H21: 7 | I21: 5.2789999999999999 | J21: 30 | K21: 8 | L21: 5.3342999999999998 | M21: 32 | N21: 6 | O21: 5.28 | P21: 32 | Q21: 4 | R21: 5.2272999999999996 | S21: 32 | T21: 2 | U21: 5.2632000000000003 | V21: 32 | W21: 1 | X21: 5.2618999999999998 | Y21: 30.2 | Z21: =+Y21+V21+S21+P21+M21+J21+G21+D21 -> 251.2 | AA21: =+(X21+U21+R21+O21+L21+I21+F21+C21)/8 -> 5.3036624999999997 | AB21: =MINA(X21,U21,R21,O21,L21,I21,F21,C21) -> 5.2272999999999996
A22: KLEBER | B22: 4 | C22: 5.2622999999999998 | D22: 32 | E22: 2 | F22: 5.2809999999999997 | G22: 31 | H22: 1 | I22: 5.3353999999999999 | J22: 26 | K22: 3 | L22: 5.3352000000000004 | M22: 32 | N22: 5 | O22: 5.3353000000000002 | P22: 32 | Q22: 7 | R22: 5.3898999999999999 | S22: 32 | T22: 8 | U22: 5.3893000000000004 | V22: 31 | W22: 6 | X22: 5.2789999999999999 | Y22: 31.46 | Z22: =+Y22+V22+S22+P22+M22+J22+G22+D22 -> 247.46 | AA22: =+(X22+U22+R22+O22+L22+I22+F22+C22)/8 -> 5.3259249999999998 | AB22: =MINA(X22,U22,R22,O22,L22,I22,F22,C22) -> 5.2622999999999998
A23: MARCEL | B23: 6 | C23: 5.2778999999999998 | D23: 30 | E23: 4 | F23: 5.2782 | G23: 30 | H23: 2 | I23: 5.4960000000000004 | J23: 30 | K23: 1 | L23: 5.5056000000000003 | M23: 30 | N23: 3 | O23: 5.3311000000000002 | P23: 31 | Q23: 5 | R23: 5.5533999999999999 | S23: 29 | T23: 7 | U23: 5.4992999999999999 | V23: 27 | W23: 8 | X23: 5.6109 | Y23: 29.3 | Z23: =+Y23+V23+S23+P23+M23+J23+G23+D23 -> 236.3 | AA23: =+(X23+U23+R23+O23+L23+I23+F23+C23)/8 -> 5.4440499999999998 | AB23: =MINA(X23,U23,R23,O23,L23,I23,F23,C23) -> 5.2778999999999998
A24: RUBAO | B24: 2 | C24: 5.6441999999999997 | D24: 30 | E24: 1 | F24: 5.6661000000000001 | G24: 30 | H24: 3 | I24: 5.5004 | J24: 29 | K24: 5 | L24: 5.7020999999999997 | M24: 29 | N24: 7 | O24: 5.6698000000000004 | P24: 29 | Q24: 8 | R24: 5.7206000000000001 | S24: 28 | T24: 6 | U24: 5.5007999999999999 | V24: 26 | W24: 4 | X24: 5.6101000000000001 | Y24: 30.19 | Z24: =+Y24+V24+S24+P24+M24+J24+G24+D24 -> 231.19 | AA24: =+(X24+U24+R24+O24+L24+I24+F24+C24)/8 -> 5.6267624999999999 | AB24: =MINA(X24,U24,R24,O24,L24,I24,F24,C24) -> 5.5004
A25: JAPAO | B25: 1 | C25: 5.7803000000000004 | D25: 27 | E25: 3 | F25: 5.3360000000000003 | G25: 30 | H25: 5 | I25: 5.5608000000000004 | J25: 25 | K25: 7 | L25: 5.6109999999999998 | M25: 30 | N25: 8 | O25: 5.7198000000000002 | P25: 29 | Q25: 6 | R25: 5.7168000000000001 | S25: 28 | T25: 4 | U25: 5.5067000000000004 | V25: 28 | W25: 2 | X25: 5.5560999999999998 | Y25: 28.96 | Z25: =+Y25+V25+S25+P25+M25+J25+G25+D25 -> 225.96 | AA25: =+(X25+U25+R25+O25+L25+I25+F25+C25)/8 -> 5.5984375000000002 | AB25: =MINA(X25,U25,R25,O25,L25,I25,F25,C25) -> 5.3360000000000003
A26: MANE | B26: 8 | C26: 5.8308 | D26: 25 | E26: 6 | F26: 5.5545999999999998 | G26: 25 | H26: 4 | I26: 5.4653 | J26: 28 | K26: 2 | L26: 5.4454000000000002 | M26: 29 | N26: 1 | O26: 5.5004 | P26: 29 | Q26: 3 | R26: 5.3891 | S26: 30 | T26: 5 | U26: 5.6113999999999997 | V26: 25 | W26: 7 | X26: 5.6650999999999998 | Y26: 27.67 | Z26: =+Y26+V26+S26+P26+M26+J26+G26+D26 -> 218.67 | AA26: =+(X26+U26+R26+O26+L26+I26+F26+C26)/8 -> 5.5577624999999991 | AB26: =MINA(X26,U26,R26,O26,L26,I26,F26,C26) -> 5.3891
A27: GABRIEL | B27: 5 | C27: 5.7163000000000004 | D27: 28 | E27: 7 | F27: 5.6102999999999996 | G27: 27 | H27: 8 | I27: 6.2150999999999996 | J27: 16 | K27: 6 | L27: 5.7743000000000002 | M27: 27 | N27: 4 | O27: 5.4836999999999998 | P27: 25 | Q27: 2 | R27: 5.9396000000000004 | S27: 19 | Z27: =+Y27+V27+S27+P27+M27+J27+G27+D27 -> 142 | AA27: =+(X27+U27+R27+O27+L27+I27+F27+C27)/8 -> 4.3424125 | AB27: =MINA(X27,U27,R27,O27,L27,I27,F27,C27) -> 5.4836999999999998
A28: 4 Bateria
A29: Piloto | B29: Pi | C29: Tempo | D29: Voltas | E29: Pi | F29: Tempo | G29: Voltas | H29: Pi | I29: Tempo | J29: Voltas | K29: Pi | L29: Tempo | M29: Voltas | N29: Pi | O29: Tempo | P29: Voltas | Q29: Pi | R29: Tempo | S29: Voltas | T29: Pi | U29: Tempo | V29: Voltas | W29: Pi | X29: Tempo | Y29: Voltas | Z29: Total | AA29: Media | AB29: Record
A30: ANDERSON | B30: 6 | C30: 5.2808999999999999 | D30: 28 | E30: 4 | F30: 4.9969000000000001 | G30: 34 | H30: 2 | I30: 5.1696999999999997 | J30: 33 | K30: 1 | L30: 5.1199000000000003 | M30: 32 | N30: 3 | O30: 5.1692 | P30: 33 | Q30: 5 | R30: 5.2808000000000002 | S30: 29 | T30: 7 | U30: 5.2794999999999996 | V30: 32 | W30: 8 | X30: 5.3734000000000002 | Y30: 32.3 | Z30: =+Y30+V30+S30+P30+M30+J30+G30+D30 -> 253.3 | AA30: =+(X30+U30+R30+O30+L30+I30+F30+C30)/8 -> 5.2087874999999997 | AB30: =MINA(X30,U30,R30,O30,L30,I30,F30,C30) -> 4.9969000000000001
A31: DINHO | B31: 7 | C31: 5.2759999999999998 | D31: 32 | E31: 8 | F31: 5.2778 | G31: 32 | H31: 6 | I31: 5.2759 | J31: 32 | K31: 4 | L31: 5.1108000000000002 | M31: 33 | N31: 2 | O31: 5.2805 | P31: 32 | Q31: 1 | R31: 5.4490999999999996 | S31: 30 | T31: 3 | U31: 5.3869999999999996 | V31: 31 | W31: 5 | X31: 5.3193000000000001 | Y31: 31.07 | Z31: =+Y31+V31+S31+P31+M31+J31+G31+D31 -> 253.07 | AA31: =+(X31+U31+R31+O31+L31+I31+F31+C31)/8 -> 5.2970500000000005 | AB31: =MINA(X31,U31,R31,O31,L31,I31,F31,C31) -> 5.1108000000000002
A32: ERIC | B32: 4 | C32: 5.2803000000000004 | D32: 31 | E32: 2 | F32: 5.3430999999999997 | G32: 32 | H32: 1 | I32: 5.5004999999999997 | J32: 30 | K32: 3 | L32: 5.1689999999999996 | M32: 33 | N32: 5 | O32: 5.3346999999999998 | P32: 31 | Q32: 7 | R32: 5.2832999999999997 | S32: 30 | T32: 8 | U32: 5.3368000000000002 | V32: 31 | W32: 6 | X32: 5.1702000000000004 | Y32: 32.61 | Z32: =+Y32+V32+S32+P32+M32+J32+G32+D32 -> 250.61 | AA32: =+(X32+U32+R32+O32+L32+I32+F32+C32)/8 -> 5.3022375000000004 | AB32: =MINA(X32,U32,R32,O32,L32,I32,F32,C32) -> 5.1689999999999996
A33: BONGA | B33: 5 | C33: 5.5011000000000001 | D33: 30 | E33: 7 | F33: 5.4976000000000003 | G33: 31 | H33: 8 | I33: 5.7187999999999999 | J33: 30 | K33: 6 | L33: 5.4508000000000001 | M33: 29 | N33: 4 | O33: 5.444 | P33: 30 | Q33: 2 | R33: 5.4907000000000004 | S33: 31 | T33: 1 | U33: 5.4955999999999996 | V33: 29 | W33: 3 | X33: 5.3905000000000003 | Y33: 31.46 | Z33: =+Y33+V33+S33+P33+M33+J33+G33+D33 -> 241.46 | AA33: =+(X33+U33+R33+O33+L33+I33+F33+C33)/8 -> 5.4986375000000001 | AB33: =MINA(X33,U33,R33,O33,L33,I33,F33,C33) -> 5.3905000000000003
A34: JULIO | B34: 3 | C34: 5.3312999999999997 | D34: 32 | E34: 5 | F34: 5.3342000000000001 | G34: 32 | H34: 7 | I34: 5.2798999999999996 | J34: 32 | K34: 8 | L34: 5.2797999999999998 | M34: 31 | N34: 6 | O34: 5.2803000000000004 | P34: 32 | Q34: 4 | R34: 5.1158000000000001 | S34: 30 | T34: 2 | U34: 5.4977 | V34: 30 | W34: 1 | X34: 5.6710000000000003 | Y34: 13.26 | Z34: =+Y34+V34+S34+P34+M34+J34+G34+D34 -> 232.26 | AA34: =+(X34+U34+R34+O34+L34+I34+F34+C34)/8 -> 5.3487499999999999 | AB34: =MINA(X34,U34,R34,O34,L34,I34,F34,C34) -> 5.1158000000000001
A35: JERA | B35: 2 | C35: 5.3918999999999997 | D35: 24 | E35: 1 | F35: 5.5540000000000003 | G35: 29 | H35: 3 | I35: 5.1154000000000002 | J35: 29 | K35: 5 | L35: 5.5000999999999998 | M35: 28 | N35: 7 | O35: 5.5007000000000001 | P35: 30 | Q35: 8 | R35: 5.7202000000000002 | S35: 27 | T35: 6 | U35: 5.5000999999999998 | V35: 26 | W35: 4 | X35: 5.4825999999999997 | Y35: 28.74 | Z35: =+Y35+V35+S35+P35+M35+J35+G35+D35 -> 221.74 | AA35: =+(X35+U35+R35+O35+L35+I35+F35+C35)/8 -> 5.4706250000000001 | AB35: =MINA(X35,U35,R35,O35,L35,I35,F35,C35) -> 5.1154000000000002