A1: R$14,99 mussarela, catupiry, buon gustaio, toscanela, calabresa (preço para retirar no balcão) | C1: R$14,99 mussarela, catupiry, buon gustaio, toscanela, calabresa (preço para retirar no balcão)

A1: Pilotos | B1: Pis | C1: Tempo | D1: Vol | E1: Pis | F1: Tempo | G1: Vol | H1: Pis | I1: Tempo | J1: Vol | K1: Pis | L1: Tempo | M1: Vol | N1: Pis | O1: Tempo | P1: Vol | Q1: Pis | R1: Tempo | S1: Vol | T1: Pis | U1: Tempo | V1: Vol | W1: Pis | X1: Tempo | Y1: Vol | Z1: Total | AA1: Media | AB1: Record
A2: BONGA | B2: 3 | C2: 4.95 | D2: 40 | E2: 5 | F2: 4.9489999999999998 | G2: 43 | H2: 7 | I2: 5.0179999999999998 | J2: 44 | K2: 8 | L2: 5.17 | M2: 33 | N2: 6 | O2: 4.827 | P2: 46 | Q2: 4 | R2: 4.7839999999999998 | S2: 42 | T2: 2 | U2: 4.8540000000000001 | V2: 40 | W2: 1 | X2: 4.84 | Y2: 45 | Z2: 334.2037037037037 | AA2: =+(X2+U2+R2+O2+L2+I2+F2+C2)/8 -> 4.9240000000000004 | AB2: =MINA(X2,U2,R2,O2,L2,I2,C2,F2) -> 4.7839999999999998
A3: ERUNDA | B3: 5 | C3: 5.18 | D3: 36 | E3: 7 | F3: 5.39 | G3: 26 | H3: 8 | I3: 5.4989999999999997 | J3: 39 | K3: 6 | L3: 5.335 | M3: 41 | N3: 4 | O3: 5.3339999999999996 | P3: 40 | Q3: 2 | R3: 5.2240000000000002 | S3: 38 | T3: 1 | U3: 5.2240000000000002 | V3: 41 | W3: 3 | X3: 5.12 | Y3: 43 | Z3: 305.03703703703701 | AA3: =+(X3+U3+R3+O3+L3+I3+F3+C3)/8 -> 5.2882499999999997 | AB3: =MINA(X3,U3,R3,O3,L3,I3,C3,F3) -> 5.12
A4: NETO | B4: 4 | C4: 5.0609999999999999 | D4: 38 | E4: 2 | F4: 5.06 | G4: 44 | H4: 1 | I4: 5.17 | J4: 41 | K4: 3 | L4: 4.9489999999999998 | M4: 37 | N4: 5 | O4: 5.2709999999999999 | P4: 26 | Q4: 7 | R4: 5.1150000000000002 | S4: 34 | T4: 8 | U4: 5.1710000000000003 | V4: 39 | W4: 6 | X4: 5.1139999999999999 | Y4: 36 | Z4: 296.12962962962962 | AA4: =+(X4+U4+R4+O4+L4+I4+F4+C4)/8 -> 5.1138750000000002 | AB4: =MINA(X4,U4,R4,O4,L4,I4,C4,F4) -> 4.9489999999999998
A5: JERA | B5: 7 | C5: 5.1710000000000003 | D5: 40 | E5: 8 | F5: 5.2789999999999999 | G5: 33 | H5: 6 | I5: 4.95 | J5: 40 | K5: 4 | L5: 5.0039999999999996 | M5: 35 | N5: 2 | O5: 4.95 | P5: 37 | Q5: 1 | R5: 5.1689999999999996 | S5: 24 | T5: 3 | U5: 5.1120000000000001 | V5: 41 | W5: 5 | X5: 4.95 | Y5: 42 | Z5: 293.03703703703701 | AA5: =+(X5+U5+R5+O5+L5+I5+F5+C5)/8 -> 5.0731250000000001 | AB5: =MINA(X5,U5,R5,O5,L5,I5,C5,F5) -> 4.95
A6: RUBAO | B6: 2 | C6: 5.3339999999999996 | D6: 41 | E6: 1 | F6: 5.3890000000000002 | G6: 38 | H6: 3 | I6: 5.2930000000000001 | J6: 41 | K6: 5 | L6: 5.1680000000000001 | M6: 38 | N6: 7 | O6: 5.4450000000000003 | P6: 18 | Q6: 8 | R6: 5.4960000000000004 | S6: 36 | T6: 6 | U6: 5.39 | V6: 39 | W6: 4 | X6: 5.39 | Y6: 36 | Z6: 288.66666666666669 | AA6: =+(X6+U6+R6+O6+L6+I6+F6+C6)/8 -> 5.3631250000000001 | AB6: =MINA(X6,U6,R6,O6,L6,I6,C6,F6) -> 5.1680000000000001
A7: MARQUINHO | B7: 8 | C7: 5.7750000000000004 | D7: 35 | E7: 6 | F7: 5.335 | G7: 39 | H7: 4 | I7: 5.39 | J7: 40 | K7: 2 | L7: 5.5540000000000003 | M7: 23 | N7: 1 | O7: 5.431 | P7: 39 | Q7: 3 | R7: 5.444 | S7: 33 | T7: 5 | U7: 5.6239999999999997 | V7: 35 | W7: 7 | X7: 5.609 | Y7: 37 | Z7: 282.01851851851853 | AA7: =+(X7+U7+R7+O7+L7+I7+F7+C7)/8 -> 5.5202499999999999 | AB7: =MINA(X7,U7,R7,O7,L7,I7,C7,F7) -> 5.335
A8: EVANDRO | B8: 1 | C8: 5.7750000000000004 | D8: 26 | E8: 3 | F8: 5.29 | G8: 37 | H8: 5 | I8: 5.3339999999999996 | J8: 36 | K8: 7 | L8: 5.4589999999999996 | M8: 39 | N8: 8 | O8: 5.94 | P8: 30 | Q8: 6 | R8: 5.5490000000000004 | S8: 35 | T8: 4 | U8: 5.399 | V8: 40 | W8: 2 | X8: 5.6790000000000003 | Y8: 37 | Z8: 281.53703703703701 | AA8: =+(X8+U8+R8+O8+L8+I8+F8+C8)/8 -> 5.5531249999999996 | AB8: =MINA(X8,U8,R8,O8,L8,I8,C8,F8) -> 5.29