A1: Piloto | B1: Pi | C1: Tempo | D1: Vol | E1: Pi | F1: Tempo | G1: Vol | H1: Pi | I1: Tempo | J1: Vol | K1: Pi | L1: Tempo | M1: Vol | N1: Pi | O1: Tempo | P1: Vol | Q1: Pi | R1: Tempo | S1: Vol | T1: Pi | U1: Tempo | V1: Vol | W1: Pi | X1: Tempo | Y1: Vol | Z1: Total | AA1: Media | AB1: Record
A2: BONGADINHO | B2: 8 | C2: 4.6207000000000003 | D2: 179 | E2: 6 | F2: 4.6204000000000001 | G2: 165 | H2: 4 | I2: 4.6017000000000001 | J2: 174 | K2: 2 | L2: 4.62 | M2: 159 | N2: 1 | O2: 4.3994 | P2: 179 | Q2: 3 | R2: 4.4009999999999998 | S2: 153 | T2: 5 | U2: 4.6201999999999996 | V2: 148 | W2: 7 | X2: 4.8367000000000004 | Y2: 117 | Z2: =+Y2+V2+S2+P2+M2+J2+G2+D2 -> 1274 | AA2: =+(X2+U2+R2+O2+L2+I2+F2+C2)/8 -> 4.5900125000000003 | AB2: =MINA(X2,U2,R2,O2,L2,I2,F2,C2) -> 4.3994
A3: MORJERA | B3: 5 | C3: 4.8212999999999999 | D3: 176 | E3: 7 | F3: 4.8390000000000004 | G3: 154 | H3: 8 | I3: 4.8409000000000004 | J3: 135 | K3: 6 | L3: 4.8390000000000004 | M3: 146 | N3: 4 | O3: 4.8193000000000001 | P3: 143 | Q3: 2 | R3: 4.6013000000000002 | S3: 156 | T3: 1 | U3: 4.8201000000000001 | V3: 161 | W3: 3 | X3: 4.6219000000000001 | Y3: 164 | Z3: =+Y3+V3+S3+P3+M3+J3+G3+D3 -> 1235 | AA3: =+(X3+U3+R3+O3+L3+I3+F3+C3)/8 -> 4.7753500000000004 | AB3: =MINA(X3,U3,R3,O3,L3,I3,F3,C3) -> 4.6013000000000002
A4: SLOT CAR | B4: 2 | C4: 5.0603999999999996 | D4: 147 | E4: 1 | F4: 5.2807000000000004 | G4: 144 | H4: 3 | I4: 5.0595999999999997 | J4: 145 | K4: 5 | L4: 5.2813999999999997 | M4: 129 | N4: 7 | O4: 5.2804000000000002 | P4: 136 | Q4: 8 | R4: 5.2792000000000003 | S4: 131 | T4: 6 | U4: 5.7211999999999996 | V4: 85 | W4: 4 | X4: 5.0613000000000001 | Y4: 145 | Z4: =+Y4+V4+S4+P4+M4+J4+G4+D4 -> 1062 | AA4: =+(X4+U4+R4+O4+L4+I4+F4+C4)/8 -> 5.2530250000000001 | AB4: =MINA(X4,U4,R4,O4,L4,I4,F4,C4) -> 5.0595999999999997
A5: FRANPAO | B5: 4 | C5: 4.8220000000000001 | D5: 158 | E5: 2 | F5: 5.0579999999999998 | G5: 137 | H5: 1 | I5: 5.0580999999999996 | J5: 139 | K5: 3 | L5: 4.8188000000000004 | M5: 144 | N5: 5 | O5: 5.0608000000000004 | P5: 71 | Q5: 7 | R5: 4.9505999999999997 | S5: 137 | T5: 8 | U5: 5.0579999999999998 | V5: 111 | W5: 6 | X5: 4.73 | Y5: 156 | Z5: =+Y5+V5+S5+P5+M5+J5+G5+D5 -> 1053 | AA5: =+(X5+U5+R5+O5+L5+I5+F5+C5)/8 -> 4.9445375 | AB5: =MINA(X5,U5,R5,O5,L5,I5,F5,C5) -> 4.73