A1: Pos | B1: Piloto | C1: 1 Etapa | D1: 2 Etapa | E1: 3 Etapa | F1: 4 Etapa | G1: 5 Etapa | H1: Tot/S/D | I1: Tot/C/D
A2: 1 | B2: ERIC | C2: 135.65 | D2: 132.26 | E2: 135.83 | F2: 0 | G2: 137.46 | H2: =SUM(C2:G2) -> 541.2 | I2: =SUM(C2:G2)-MINA(C2:F2) -> 541.2
A3: 2 | B3: JERA | C3: 128.69 | D3: 121.44 | E3: 134.9 | F3: 137.61 | G3: 137 | H3: =SUM(C3:G3) -> 659.64 | I3: =SUM(C3:G3)-MINA(C3:F3) -> 538.2
A4: 3 | B4: FERNANDO | C4: 126.9 | D4: 0 | E4: 125.68 | F4: 138.89 | G4: 136.53 | H4: =SUM(C4:G4) -> 528 | I4: =SUM(C4:G4)-MINA(C4:F4) -> 528
A5: 4 | B5: EDUARDO | C5: 125.45 | D5: 0 | E5: 139.27 | F5: 136.91 | G5: 0 | H5: =SUM(C5:G5) -> 401.63 | I5: =SUM(C5:G5)-MINA(C5:F5) -> 401.63
A6: 5 | B6: LISTER | C6: 45.61 | D6: 111.29 | E6: 0 | F6: 121.94 | G6: 113.38 | H6: =SUM(C6:G6) -> 392.22 | I6: =SUM(C6:G6)-MINA(C6:F6) -> 392.22
A7: 6 | B7: ARIGONE | C7: 0 | D7: 0 | E7: 106.58 | F7: 134.32 | G7: 139.45 | H7: =SUM(C7:G7) -> 380.35 | I7: =SUM(C7:G7)-MINA(C7:F7) -> 380.35
A8: 7 | B8: SERGIO | C8: 0 | D8: 0 | E8: 129.57 | F8: 0 | G8: 0 | H8: =SUM(C8:G8) -> 129.57 | I8: =SUM(C8:G8)-MINA(C8:F8) -> 129.57
A9: 8 | B9: BONGA | C9: 126.73 | D9: 0 | E9: 0 | F9: 0 | G9: 0 | H9: =SUM(C9:G9) -> 126.73 | I9: =SUM(C9:G9)-MINA(C9:F9) -> 126.73
A10: 9 | B10: DANILO | C10: 126.69 | D10: 0 | E10: 0 | F10: 0 | G10: 0 | H10: =SUM(C10:G10) -> 126.69 | I10: =SUM(C10:G10)-MINA(C10:F10) -> 126.69
A11: 10 | B11: GIOVANNI | C11: 124.31 | D11: 0 | E11: 0 | F11: 0 | G11: 0 | H11: =SUM(C11:G11) -> 124.31 | I11: =SUM(C11:G11)-MINA(C11:F11) -> 124.31
A12: 11 | B12: MORTA | C12: 119.45 | D12: 0 | E12: 0 | F12: 0 | G12: 0 | H12: =SUM(C12:G12) -> 119.45 | I12: =SUM(C12:G12)-MINA(C12:F12) -> 119.45
A13: 12 | B13: MARCELO | C13: 0 | D13: 103.72 | E13: 0 | F13: 0 | G13: 0 | H13: =SUM(C13:G13) -> 103.72 | I13: =SUM(C13:G13)-MINA(C13:F13) -> 103.72
A14: 13 | B14: DINHO | C14: 0 | D14: 0 | E14: 0 | F14: 21.45 | G14: 0 | H14: =SUM(C14:G14) -> 21.45 | I14: =SUM(C14:G14)-MINA(C14:F14) -> 21.45