A1: R$14,99 mussarela, catupiry, buon gustaio, toscanela, calabresa (preço para retirar no balcão) | C1: R$14,99 mussarela, catupiry, buon gustaio, toscanela, calabresa (preço para retirar no balcão)

A1: Nome | B1: P | C1: Tempo | D1: Vol | E1: P | F1: Tempo | G1: Vol | H1: P | I1: Tempo | J1: Vol | K1: P | L1: Tempo | M1: Vol | N1: P | O1: Tempo | P1: Vol | Q1: P | R1: Tempo | S1: Vol | T1: P | U1: Tempo | V1: Vol | W1: P | X1: Tempo | Y1: Vol | Z1: Total | AA1: Media | AB1: Record
A2: RUBAO | B2: 2 | C2: 5.7750000000000004 | D2: 44 | E2: 1 | F2: 5.9390000000000001 | G2: 44 | H2: 3 | I2: 5.6660000000000004 | J2: 46 | K2: 5 | L2: 5.83 | M2: 40 | N2: 7 | O2: 4.95 | P2: 44 | Q2: 8 | R2: 6.16 | S2: 41 | T2: 6 | U2: 5.8849999999999998 | V2: 42 | W2: 4 | X2: 5.61 | Y2: 47 | Z2: 348 | AA2: =+(X2+U2+R2+O2+L2+I2+F2+C2)/8 -> 5.7268749999999997 | AB2: =MINA(X2,U2,R2,O2,L2,I2,F2,C2) -> 4.95
A3: MICHEL | B3: 4 | C3: 5.4859999999999998 | D3: 49 | E3: 2 | F3: 5.61 | G3: 32 | H3: 1 | I3: 5.7050000000000001 | J3: 41 | K3: 3 | L3: 5.4539999999999997 | M3: 45 | N3: 5 | O3: 5.6210000000000004 | P3: 44 | Q3: 7 | R3: 5.4870000000000001 | S3: 49 | T3: 8 | U3: 5.617 | V3: 41 | W3: 6 | X3: 5.609 | Y3: 45 | Z3: 346 | AA3: =+(X3+U3+R3+O3+L3+I3+F3+C3)/8 -> 5.5736249999999998 | AB3: =MINA(X3,U3,R3,O3,L3,I3,F3,C3) -> 5.4539999999999997
A4: BONGA | B4: 3 | C4: 5.6639999999999997 | D4: 42 | E4: 5 | F4: 5.8280000000000003 | G4: 39 | H4: 7 | I4: 5.8849999999999998 | J4: 40 | K4: 8 | L4: 6.3789999999999996 | M4: 41 | N4: 6 | O4: 5.609 | P4: 45 | Q4: 4 | R4: 5.61 | S4: 46 | T4: 2 | U4: 5.5549999999999997 | V4: 42 | W4: 1 | X4: 5.5540000000000003 | Y4: 47 | Z4: 342 | AA4: =+(X4+U4+R4+O4+L4+I4+F4+C4)/8 -> 5.7605000000000004 | AB4: =MINA(X4,U4,R4,O4,L4,I4,F4,C4) -> 5.5540000000000003
A5: GOROI | B5: 6 | C5: 5.8849999999999998 | D5: 47 | E5: 4 | F5: 5.8280000000000003 | G5: 42 | H5: 2 | I5: 5.7759999999999998 | J5: 41 | K5: 1 | L5: 5.9950000000000001 | M5: 39 | N5: 3 | O5: 5.673 | P5: 48 | Q5: 5 | R5: 5.7210000000000001 | S5: 43 | T5: 7 | U5: 5.72 | V5: 41 | W5: 8 | X5: 6.2149999999999999 | Y5: 38 | Z5: 339 | AA5: =+(X5+U5+R5+O5+L5+I5+F5+C5)/8 -> 5.8516250000000003 | AB5: =MINA(X5,U5,R5,O5,L5,I5,F5,C5) -> 5.673
A6: GIOVANNI | B6: 7 | C6: 5.7649999999999997 | D6: 40 | E6: 8 | F6: 6.0449999999999999 | G6: 39 | H6: 6 | I6: 5.8849999999999998 | J6: 28 | K6: 4 | L6: 5.665 | M6: 36 | N6: 2 | O6: 5.609 | P6: 38 | Q6: 1 | R6: 5.72 | S6: 44 | T6: 3 | U6: 5.5540000000000003 | V6: 43 | W6: 5 | X6: 5.8840000000000003 | Y6: 39 | Z6: 307 | AA6: =+(X6+U6+R6+O6+L6+I6+F6+C6)/8 -> 5.7658750000000003 | AB6: =MINA(X6,U6,R6,O6,L6,I6,F6,C6) -> 5.5540000000000003
A7: NETO | B7: 1 | C7: 5.8289999999999997 | D7: 33 | E7: 3 | F7: 5.8289999999999997 | G7: 41 | H7: 5 | I7: 5.9950000000000001 | J7: 35 | K7: 7 | L7: 5.9290000000000003 | M7: 19 | N7: 8 | O7: 6.2149999999999999 | P7: 38 | Q7: 6 | R7: 5.9950000000000001 | S7: 35 | T7: 4 | U7: 5.8979999999999997 | V7: 39 | W7: 2 | X7: 5.9489999999999998 | Y7: 40 | Z7: 280 | AA7: =+(X7+U7+R7+O7+L7+I7+F7+C7)/8 -> 5.9548749999999995 | AB7: =MINA(X7,U7,R7,O7,L7,I7,F7,C7) -> 5.8289999999999997
A8: JERA | B8: 8 | C8: 6.2220000000000004 | D8: 29 | E8: 6 | F8: 5.5650000000000004 | G8: 40 | H8: 4 | I8: 5.931 | J8: 17 | K8: 2 | L8: 7.149 | M8: 16 | N8: 1 | O8: 5.665 | P8: 31 | Q8: 3 | R8: 5.7750000000000004 | S8: 32 | T8: 5 | U8: 6.0490000000000004 | V8: 31 | W8: 7 | X8: 6.3789999999999996 | Y8: 22 | Z8: 218 | AA8: =+(X8+U8+R8+O8+L8+I8+F8+C8)/8 -> 6.0918749999999999 | AB8: =MINA(X8,U8,R8,O8,L8,I8,F8,C8) -> 5.5650000000000004