A1: Patrocinadores

B1: Motos e Acessórios Honda - Rua Sete de Setembro, 387 - Fone: (15) 3331-6700.

A1: 1 Bateria
A2: Piloto | B2: Pi | C2: Tempo | D2: Vol | E2: Pi | F2: Tempo | G2: Vol | H2: Pi | I2: Tempo | J2: Vol | K2: Pi | L2: Tempo | M2: Vol | N2: Pi | O2: Tempo | P2: Vol | Q2: Pi | R2: Tempo | S2: Vol | T2: Pi | U2: Tempo | V2: Vol | W2: Pi | X2: Tempo | Y2: Vol | Z2: Total | AA2: Media | AB2: Record
A3: TETA | B3: 3 | C3: 4.6199000000000003 | D3: 35.25 | E3: 5 | F3: 4.6047000000000002 | G3: 37.1 | H3: 7 | I3: 4.6195000000000004 | J3: 36.21 | K3: 8 | L3: 4.6105999999999998 | M3: 36.26 | N3: 6 | O3: 4.6173000000000002 | P3: 37.61 | Q3: 4 | R3: 4.3993000000000002 | S3: 36.21 | T3: 2 | U3: 4.3979999999999997 | V3: 32.09 | W3: 1 | X3: 4.6193999999999997 | Y3: 30.07 | Z3: =+Y3+V3+S3+P3+M3+J3+G3+D3 -> 280.8 | AA3: =+(X3+U3+R3+O3+L3+I3+F3+C3)/8 -> 4.5610875000000002 | AB3: =MINA(X3,U3,R3,O3,L3,I3,F3,C3) -> 4.3979999999999997
A4: ERIC | B4: 5 | C4: 4.6186999999999996 | D4: 36.11 | E4: 7 | F4: 4.6204999999999998 | G4: 36.67 | H4: 8 | I4: 4.8289999999999997 | J4: 34.45 | K4: 6 | L4: 4.6189999999999998 | M4: 34.9 | N4: 4 | O4: 4.6189999999999998 | P4: 35.87 | Q4: 2 | R4: 4.6196999999999999 | S4: 37.08 | T4: 1 | U4: 4.8968999999999996 | V4: 28.07 | W4: 3 | X4: 4.6177999999999999 | Y4: 35.38 | Z4: =+Y4+V4+S4+P4+M4+J4+G4+D4 -> 278.53 | AA4: =+(X4+U4+R4+O4+L4+I4+F4+C4)/8 -> 4.6800749999999995 | AB4: =MINA(X4,U4,R4,O4,L4,I4,F4,C4) -> 4.6177999999999999
A5: RICARDAO | B5: 2 | C5: 4.6330999999999998 | D5: 31.52 | E5: 1 | F5: 4.8364000000000003 | G5: 33.66 | H5: 3 | I5: 4.6193 | J5: 36.18 | K5: 5 | L5: 4.6207000000000003 | M5: 35.55 | N5: 7 | O5: 4.4554999999999998 | P5: 36.27 | Q5: 8 | R5: 4.6203000000000003 | S5: 35.21 | T5: 6 | U5: 4.6204999999999998 | V5: 32.52 | W5: 4 | X5: 4.8384 | Y5: 34.28 | Z5: =+Y5+V5+S5+P5+M5+J5+G5+D5 -> 275.19 | AA5: =+(X5+U5+R5+O5+L5+I5+F5+C5)/8 -> 4.6555249999999999 | AB5: =MINA(X5,U5,R5,O5,L5,I5,F5,C5) -> 4.4554999999999998
A6: LISTER | B6: 6 | C6: 4.8403999999999998 | D6: 34.32 | E6: 4 | F6: 4.7319000000000004 | G6: 34.19 | H6: 2 | I6: 4.7319000000000004 | J6: 31.08 | K6: 1 | L6: 4.8362999999999996 | M6: 35.22 | N6: 3 | O6: 4.6204999999999998 | P6: 35.65 | Q6: 5 | R6: 4.6230000000000002 | S6: 33.28 | T6: 7 | U6: 4.7294 | V6: 33.82 | W6: 8 | X6: 4.8399000000000001 | Y6: 34.21 | Z6: =+Y6+V6+S6+P6+M6+J6+G6+D6 -> 271.77 | AA6: =+(X6+U6+R6+O6+L6+I6+F6+C6)/8 -> 4.7441624999999998 | AB6: =MINA(X6,U6,R6,O6,L6,I6,F6,C6) -> 4.6204999999999998
A7: RUDSON | B7: 8 | C7: 4.8288000000000002 | D7: 33.3 | E7: 6 | F7: 4.6798000000000002 | G7: 34.29 | H7: 4 | I7: 4.6204999999999998 | J7: 33.89 | K7: 2 | L7: 4.8396999999999997 | M7: 34.8 | N7: 1 | O7: 4.8281999999999998 | P7: 31.57 | Q7: 3 | R7: 4.6203000000000003 | S7: 24.61 | T7: 5 | U7: 4.6193 | V7: 33.22 | W7: 7 | X7: 4.6191000000000004 | Y7: 33.33 | Z7: =+Y7+V7+S7+P7+M7+J7+G7+D7 -> 259.01 | AA7: =+(X7+U7+R7+O7+L7+I7+F7+C7)/8 -> 4.7069625000000004 | AB7: =MINA(X7,U7,R7,O7,L7,I7,F7,C7) -> 4.6191000000000004
A8: LUIZ FELIPE | B8: 4 | C8: 4.6200999999999999 | D8: 25.73 | E8: 2 | F8: 4.8413000000000004 | G8: 29.85 | H8: 1 | I8: 4.8403 | J8: 17.07 | K8: 3 | L8: 4.6125999999999996 | M8: 35 | N8: 5 | O8: 4.6195000000000004 | P8: 35.69 | Q8: 7 | R8: 4.6182999999999996 | S8: 6.22 | T8: 8 | U8: 4.8406000000000002 | V8: 31.26 | W8: 6 | X8: 4.7839 | Y8: 32.4 | Z8: =+Y8+V8+S8+P8+M8+J8+G8+D8 -> 213.22 | AA8: =+(X8+U8+R8+O8+L8+I8+F8+C8)/8 -> 4.7220750000000002 | AB8: =MINA(X8,U8,R8,O8,L8,I8,F8,C8) -> 4.6125999999999996
A9: 2 Bateria | Z9: =+Y9+V9+S9+P9+M9+J9+G9+D9 -> 0 | AA9: =+(X9+U9+R9+O9+L9+I9+F9+C9)/8 -> 0 | AB9: =MINA(X9,U9,R9,O9,L9,I9,F9,C9) -> 0
A10: Piloto | B10: Pi | C10: Tempo | D10: Vol | E10: Pi | F10: Tempo | G10: Vol | H10: Pi | I10: Tempo | J10: Vol | K10: Pi | L10: Tempo | M10: Vol | N10: Pi | O10: Tempo | P10: Vol | Q10: Pi | R10: Tempo | S10: Vol | T10: Pi | U10: Tempo | V10: Vol | W10: Pi | X10: Tempo | Y10: Vol | Z10: Total | AA10: Media | AB10: Record
A11: MICHEL | B11: 4 | C11: 4.4006999999999996 | D11: 38.65 | E11: 2 | F11: 4.4002999999999997 | G11: 38.64 | H11: 1 | I11: 4.6204000000000001 | J11: 37.22 | K11: 3 | L11: 4.3997999999999999 | M11: 39.85 | N11: 5 | O11: 4.6106999999999996 | P11: 37.64 | Q11: 7 | R11: 4.4009999999999998 | S11: 38.27 | T11: 8 | U11: 4.6199000000000003 | V11: 36.91 | W11: 6 | X11: 4.6185 | Y11: 37.76 | Z11: =+Y11+V11+S11+P11+M11+J11+G11+D11 -> 304.94 | AA11: =+(X11+U11+R11+O11+L11+I11+F11+C11)/8 -> 4.5089125000000001 | AB11: =MINA(X11,U11,R11,O11,L11,I11,F11,C11) -> 4.3997999999999999
A12: BONGA | B12: 7 | C12: 4.6116999999999999 | D12: 38.32 | E12: 8 | F12: 4.6199000000000003 | G12: 37.21 | H12: 6 | I12: 4.6024000000000003 | J12: 37.78 | K12: 4 | L12: 4.3986000000000001 | M12: 36.88 | N12: 2 | O12: 4.6193999999999997 | P12: 36.16 | Q12: 1 | R12: 4.6170999999999998 | S12: 35.2 | T12: 3 | U12: 4.3993000000000002 | V12: 37.27 | W12: 5 | X12: 4.6197999999999997 | Y12: 37.45 | Z12: =+Y12+V12+S12+P12+M12+J12+G12+D12 -> 296.27 | AA12: =+(X12+U12+R12+O12+L12+I12+F12+C12)/8 -> 4.5610249999999999 | AB12: =MINA(X12,U12,R12,O12,L12,I12,F12,C12) -> 4.3986000000000001
A13: EVANDRO | B13: 3 | C13: 4.4008000000000003 | D13: 37.67 | E13: 5 | F13: 4.6093999999999999 | G13: 37.21 | H13: 7 | I13: 4.3997999999999999 | J13: 36.59 | K13: 8 | L13: 4.6227999999999998 | M13: 35.73 | N13: 6 | O13: 4.6193999999999997 | P13: 37.48 | Q13: 4 | R13: 4.4728000000000003 | S13: 37.25 | T13: 2 | U13: 4.6162999999999998 | V13: 35.97 | W13: 1 | X13: 4.8381999999999996 | Y13: 36.05 | Z13: =+Y13+V13+S13+P13+M13+J13+G13+D13 -> 293.95 | AA13: =+(X13+U13+R13+O13+L13+I13+F13+C13)/8 -> 4.5724374999999995 | AB13: =MINA(X13,U13,R13,O13,L13,I13,F13,C13) -> 4.3997999999999999
A14: SAPAO | B14: 1 | C14: 4.6189999999999998 | D14: 35.35 | E14: 3 | F14: 4.4554 | G14: 37.87 | H14: 5 | I14: 4.5654000000000003 | J14: 37.78 | K14: 7 | L14: 4.6181999999999999 | M14: 38.18 | N14: 8 | O14: 4.6753 | P14: 36.15 | Q14: 6 | R14: 4.6317000000000004 | S14: 36.07 | T14: 4 | U14: 4.6201999999999996 | V14: 35.45 | W14: 2 | X14: 4.6195000000000004 | Y14: 35.76 | Z14: =+Y14+V14+S14+P14+M14+J14+G14+D14 -> 292.61 | AA14: =+(X14+U14+R14+O14+L14+I14+F14+C14)/8 -> 4.6005875000000005 | AB14: =MINA(X14,U14,R14,O14,L14,I14,F14,C14) -> 4.4554
A15: DINHO | B15: 5 | C15: 4.4008000000000003 | D15: 36.89 | E15: 7 | F15: 4.3853 | G15: 38.88 | H15: 8 | I15: 4.6054000000000004 | J15: 37.38 | K15: 6 | L15: 4.4016000000000002 | M15: 37.12 | N15: 4 | O15: 4.6067999999999998 | P15: 31.35 | Q15: 2 | R15: 4.6101999999999999 | S15: 30.75 | T15: 1 | U15: 4.6207000000000003 | V15: 33.21 | W15: 3 | X15: 4.6196999999999999 | Y15: 35.04 | Z15: =+Y15+V15+S15+P15+M15+J15+G15+D15 -> 280.62 | AA15: =+(X15+U15+R15+O15+L15+I15+F15+C15)/8 -> 4.5313125000000003 | AB15: =MINA(X15,U15,R15,O15,L15,I15,F15,C15) -> 4.3853