A1: Patrocinadores

B1: Motos e Acessórios Honda - Rua Sete de Setembro, 387 - Fone: (15) 3331-6700. | C1: Rua Olavo Bilac, 254 - Vila Santana

A1: 1 Bateria
A2: Piloto | B2: Pi | C2: Tempo | D2: Vol | E2: Pi | F2: Tempo | G2: Vol | H2: Pi | I2: Tempo | J2: Vol | K2: Pi | L2: Tempo | M2: Vol | N2: Pi | O2: Tempo | P2: Vol | Q2: Pi | R2: Tempo | S2: Vol | T2: Pi | U2: Tempo | V2: Vol | W2: Pi | X2: Tempo | Y2: Vol | Z2: Total | AA2: Media | AB2: Record
A3: EVANDRO | B3: 1 | C3: 5.9404000000000003 | D3: 22 | E3: 3 | F3: 5.4999000000000002 | G3: 31 | H3: 5 | I3: 5.7190000000000003 | J3: 26 | K3: 7 | L3: 5.6096000000000004 | M3: 21 | N3: 8 | O3: 5.5 | P3: 29 | Q3: 6 | R3: 5.4832999999999998 | S3: 25 | T3: 4 | U3: 5.39 | V3: 27 | W3: 2 | X3: 5.5000999999999998 | Y3: 31.04 | Z3: =+Y3+V3+S3+P3+M3+J3+G3+D3 -> 212.04 | AA3: =+(X3+U3+R3+O3+L3+I3+F3+C3)/8 -> 5.580287499999999 | AB3: =MINA(X3,U3,R3,O3,L3,I3,F3,C3) -> 5.39
A4: FLAVIO | B4: 8 | C4: 5.7205000000000004 | D4: 25 | E4: 6 | F4: 5.3285 | G4: 24 | H4: 4 | I4: 5.4984999999999999 | J4: 27 | K4: 2 | L4: 5.5002000000000004 | M4: 27 | N4: 1 | O4: 5.7206999999999999 | P4: 27 | Q4: 3 | R4: 5.4817 | S4: 27 | T4: 5 | U4: 5.5553999999999997 | V4: 27 | W4: 7 | X4: 5.7220000000000004 | Y4: 25.8 | Z4: =+Y4+V4+S4+P4+M4+J4+G4+D4 -> 209.8 | AA4: =+(X4+U4+R4+O4+L4+I4+F4+C4)/8 -> 5.5659375000000004 | AB4: =MINA(X4,U4,R4,O4,L4,I4,F4,C4) -> 5.3285
A5: RUDSON | B5: 4 | C5: 5.7203999999999997 | D5: 26 | E5: 2 | F5: 5.7176999999999998 | G5: 28 | H5: 1 | I5: 6.1612999999999998 | J5: 22 | K5: 3 | L5: 5.9383999999999997 | M5: 27 | N5: 5 | O5: 5.9203999999999999 | P5: 29 | Q5: 7 | R5: 5.9382000000000001 | S5: 24 | T5: 8 | U5: 6.1593 | V5: 25 | W5: 6 | X5: 5.9438000000000004 | Y5: 24 | Z5: =+Y5+V5+S5+P5+M5+J5+G5+D5 -> 205 | AA5: =+(X5+U5+R5+O5+L5+I5+F5+C5)/8 -> 5.9374374999999997 | AB5: =MINA(X5,U5,R5,O5,L5,I5,F5,C5) -> 5.7176999999999998
A6: SANDRO ITU | B6: 2 | C6: 5.7206000000000001 | D6: 25 | E6: 1 | F6: 6.0503 | G6: 23 | H6: 3 | I6: 5.9404000000000003 | J6: 25 | K6: 5 | L6: 5.8292999999999999 | M6: 25 | N6: 7 | O6: 5.9394 | P6: 28 | Q6: 8 | R6: 5.7117000000000004 | S6: 27 | T6: 6 | U6: 5.9417999999999997 | V6: 23 | W6: 4 | X6: 5.7195 | Y6: 27.2 | Z6: =+Y6+V6+S6+P6+M6+J6+G6+D6 -> 203.2 | AA6: =+(X6+U6+R6+O6+L6+I6+F6+C6)/8 -> 5.8566249999999993 | AB6: =MINA(X6,U6,R6,O6,L6,I6,F6,C6) -> 5.7117000000000004
A7: TOMAZ | B7: 3 | C7: 5.9406999999999996 | D7: 26 | E7: 5 | F7: 4.6002000000000001 | G7: 27 | H7: 7 | I7: 5.9954000000000001 | J7: 23 | K7: 8 | L7: 6.2893999999999997 | M7: 21 | N7: 6 | O7: 6.1604999999999999 | P7: 26 | Q7: 4 | R7: 5.9401000000000002 | S7: 25 | T7: 2 | U7: 5.9394999999999998 | V7: 24 | W7: 1 | X7: 6.1584000000000003 | Y7: 23.65 | Z7: =+Y7+V7+S7+P7+M7+J7+G7+D7 -> 195.65 | AA7: =+(X7+U7+R7+O7+L7+I7+F7+C7)/8 -> 5.8780250000000001 | AB7: =MINA(X7,U7,R7,O7,L7,I7,F7,C7) -> 4.6002000000000001
A8: LISTER | B8: 6 | C8: 5.2797000000000001 | D8: 17 | E8: 4 | F8: 5.2801 | G8: 28 | H8: 2 | I8: 4.8411999999999997 | J8: 22 | K8: 1 | L8: 5.2251000000000003 | M8: 28 | N8: 3 | O8: 5.28 | P8: 22 | Q8: 5 | R8: 5.2807000000000004 | S8: 29 | T8: 7 | U8: 5.5 | V8: 21 | W8: 8 | X8: 5.61 | Y8: 28.52 | Z8: =+Y8+V8+S8+P8+M8+J8+G8+D8 -> 195.52 | AA8: =+(X8+U8+R8+O8+L8+I8+F8+C8)/8 -> 5.2870999999999997 | AB8: =MINA(X8,U8,R8,O8,L8,I8,F8,C8) -> 4.8411999999999997
A9: LUIZ FELIPE | B9: 5 | C9: 4.6210000000000004 | D9: 21 | E9: 7 | F9: 5.4996999999999998 | G9: 27 | H9: 8 | I9: 5.5540000000000003 | J9: 23 | K9: 6 | L9: 5.7195999999999998 | M9: 26 | N9: 4 | O9: 5.5003000000000002 | P9: 20 | Q9: 2 | R9: 5.7023000000000001 | S9: 29 | T9: 1 | U9: 5.7206999999999999 | V9: 14 | W9: 3 | X9: 5.7186000000000003 | Y9: 27.8 | Z9: =+Y9+V9+S9+P9+M9+J9+G9+D9 -> 187.8 | AA9: =+(X9+U9+R9+O9+L9+I9+F9+C9)/8 -> 5.5045250000000001 | AB9: =MINA(X9,U9,R9,O9,L9,I9,F9,C9) -> 4.6210000000000004
A10: RICARDO | B10: 7 | C10: 5.7202000000000002 | D10: 26 | E10: 8 | F10: 5.7168000000000001 | G10: 26 | H10: 6 | I10: 5.9401999999999999 | J10: 24 | K10: 4 | L10: 5.7751999999999999 | M10: 18 | N10: 2 | O10: 5.9204999999999997 | P10: 26 | Q10: 1 | R10: 6.3827999999999996 | S10: 19 | T10: 3 | U10: 5.8296999999999999 | V10: 24 | W10: 5 | X10: 5.9942000000000002 | Y10: 23.28 | Z10: =+Y10+V10+S10+P10+M10+J10+G10+D10 -> 186.28 | AA10: =+(X10+U10+R10+O10+L10+I10+F10+C10)/8 -> 5.9099499999999994 | AB10: =MINA(X10,U10,R10,O10,L10,I10,F10,C10) -> 5.7168000000000001
A11: 2 Bateria
A12: Piloto | B12: Pi | C12: Tempo | D12: Vol | E12: Pi | F12: Tempo | G12: Vol | H12: Pi | I12: Tempo | J12: Vol | K12: Pi | L12: Tempo | M12: Vol | N12: Pi | O12: Tempo | P12: Vol | Q12: Pi | R12: Tempo | S12: Vol | T12: Pi | U12: Tempo | V12: Vol | W12: Pi | X12: Tempo | Y12: Vol | Z12: Total | AA12: Media | AB12: Record
A13: JERA | B13: 7 | C13: 5.2801 | D13: 31 | E13: 8 | F13: 5.3354999999999997 | G13: 29 | H13: 6 | I13: 5.2617000000000003 | J13: 29 | K13: 4 | L13: 5.1146000000000003 | M13: 31 | N13: 2 | O13: 5.2263000000000002 | P13: 33 | Q13: 1 | R13: 5.2796000000000003 | S13: 31 | T13: 3 | U13: 5.0609000000000002 | V13: 32 | W13: 5 | X13: 5.2770000000000001 | Y13: 32.28 | Z13: =+Y13+V13+S13+P13+M13+J13+G13+D13 -> 248.28 | AA13: =+(X13+U13+R13+O13+L13+I13+F13+C13)/8 -> 5.2294624999999995 | AB13: =MINA(X13,U13,R13,O13,L13,I13,F13,C13) -> 5.0609000000000002
A14: JULIO | B14: 3 | C14: 5.2796000000000003 | D14: 31 | E14: 5 | F14: 5.4832000000000001 | G14: 29 | H14: 7 | I14: 5.3361999999999998 | J14: 31 | K14: 8 | L14: 5.5015999999999998 | M14: 29 | N14: 6 | O14: 5.4997999999999996 | P14: 28 | Q14: 4 | R14: 5.4981 | S14: 27 | T14: 2 | U14: 5.5002000000000004 | V14: 30 | W14: 1 | X14: 5.7108999999999996 | Y14: 28.54 | Z14: =+Y14+V14+S14+P14+M14+J14+G14+D14 -> 233.54 | AA14: =+(X14+U14+R14+O14+L14+I14+F14+C14)/8 -> 5.4762000000000004 | AB14: =MINA(X14,U14,R14,O14,L14,I14,F14,C14) -> 5.2796000000000003
A15: JOAO KIBON | B15: 8 | C15: 5.5547000000000004 | D15: 28 | E15: 6 | F15: 5.4995000000000003 | G15: 27 | H15: 4 | I15: 5.5004999999999997 | J15: 30 | K15: 2 | L15: 5.4814999999999996 | M15: 29 | N15: 1 | O15: 5.4825999999999997 | P15: 30 | Q15: 3 | R15: 5.4904000000000002 | S15: 30 | T15: 5 | U15: 5.5025000000000004 | V15: 30 | W15: 7 | X15: 5.7011000000000003 | Y15: 26.81 | Z15: =+Y15+V15+S15+P15+M15+J15+G15+D15 -> 230.81 | AA15: =+(X15+U15+R15+O15+L15+I15+F15+C15)/8 -> 5.5266000000000002 | AB15: =MINA(X15,U15,R15,O15,L15,I15,F15,C15) -> 5.4814999999999996
A16: JAPAO | B16: 1 | C16: 5.5 | D16: 30 | E16: 3 | F16: 5.5007999999999999 | G16: 29 | H16: 5 | I16: 4.6207000000000003 | J16: 30 | K16: 7 | L16: 5.7214 | M16: 25 | N16: 8 | O16: 5.7190000000000003 | P16: 29 | Q16: 6 | R16: 5.7206999999999999 | S16: 27 | T16: 4 | U16: 5.4808000000000003 | V16: 30 | W16: 2 | X16: 5.7194000000000003 | Y16: 28.31 | Z16: =+Y16+V16+S16+P16+M16+J16+G16+D16 -> 228.31 | AA16: =+(X16+U16+R16+O16+L16+I16+F16+C16)/8 -> 5.4978499999999997 | AB16: =MINA(X16,U16,R16,O16,L16,I16,F16,C16) -> 4.6207000000000003
A17: RUBAO | B17: 2 | C17: 5.5007000000000001 | D17: 30 | E17: 1 | F17: 5.5381 | G17: 25 | H17: 3 | I17: 5.4992000000000001 | J17: 29 | K17: 5 | L17: 5.5541 | M17: 29 | N17: 7 | O17: 5.4995000000000003 | P17: 30 | Q17: 8 | R17: 5.2807000000000004 | S17: 30 | T17: 6 | U17: 5.4992999999999999 | V17: 26 | W17: 4 | X17: 5.5008999999999997 | Y17: 27.02 | Z17: =+Y17+V17+S17+P17+M17+J17+G17+D17 -> 226.02 | AA17: =+(X17+U17+R17+O17+L17+I17+F17+C17)/8 -> 5.4840625000000003 | AB17: =MINA(X17,U17,R17,O17,L17,I17,F17,C17) -> 5.2807000000000004
A18: GERONIMO | B18: 4 | C18: 5.7117000000000004 | D18: 30 | E18: 2 | F18: 5.7751999999999999 | G18: 27 | H18: 1 | I18: 6.1418999999999997 | J18: 25 | K18: 3 | L18: 5.7427999999999999 | M18: 28 | N18: 5 | O18: 6.0510000000000002 | P18: 27 | Q18: 7 | R18: 5.9215 | S18: 29 | T18: 8 | U18: 5.7748999999999997 | V18: 28 | W18: 6 | X18: 5.9390999999999998 | Y18: 26.46 | Z18: =+Y18+V18+S18+P18+M18+J18+G18+D18 -> 220.46 | AA18: =+(X18+U18+R18+O18+L18+I18+F18+C18)/8 -> 5.8822625000000004 | AB18: =MINA(X18,U18,R18,O18,L18,I18,F18,C18) -> 5.7117000000000004
A19: MANE | B19: 6 | C19: 4.6204000000000001 | D19: 25 | E19: 4 | F19: 5.5004999999999997 | G19: 28 | H19: 2 | I19: 5.4977999999999998 | J19: 29 | K19: 1 | L19: 5.7035999999999998 | M19: 29 | N19: 3 | O19: 5.3886000000000003 | P19: 27 | Q19: 5 | R19: 5.7198000000000002 | S19: 16 | T19: 7 | U19: 5.5015000000000001 | V19: 29 | W19: 8 | X19: 4.6205999999999996 | Y19: 29.37 | Z19: =+Y19+V19+S19+P19+M19+J19+G19+D19 -> 212.37 | AA19: =+(X19+U19+R19+O19+L19+I19+F19+C19)/8 -> 5.3191000000000006 | AB19: =MINA(X19,U19,R19,O19,L19,I19,F19,C19) -> 4.6204000000000001
A20: CONRADO | B20: 5 | C20: 5.4812000000000003 | D20: 24 | E20: 7 | F20: 5.5022000000000002 | G20: 19 | H20: 8 | I20: 5.7192999999999996 | J20: 26 | K20: 6 | L20: 5.5022000000000002 | M20: 29 | N20: 4 | O20: 5.4824000000000002 | P20: 30 | Z20: =+Y20+V20+S20+P20+M20+J20+G20+D20 -> 128 | AA20: =+(X20+U20+R20+O20+L20+I20+F20+C20)/8 -> 3.4609125000000001 | AB20: =MINA(X20,U20,R20,O20,L20,I20,F20,C20) -> 5.4812000000000003
A21: 3 Bateria
A22: Piloto | B22: Pi | C22: Tempo | D22: Vol | E22: Pi | F22: Tempo | G22: Vol | H22: Pi | I22: Tempo | J22: Vol | K22: Pi | L22: Tempo | M22: Vol | N22: Pi | O22: Tempo | P22: Vol | Q22: Pi | R22: Tempo | S22: Vol | T22: Pi | U22: Tempo | V22: Vol | W22: Pi | X22: Tempo | Y22: Vol | Z22: Total | AA22: Media | AB22: Record
A23: MICHEL | B23: 3 | C23: 5.0589000000000004 | D23: 33 | E23: 5 | F23: 5.2812000000000001 | G23: 28 | H23: 7 | I23: 5.2798999999999996 | J23: 32 | K23: 8 | L23: 4.6208999999999998 | M23: 31 | N23: 6 | O23: 5.2801999999999998 | P23: 30 | Q23: 4 | R23: 5.2790999999999997 | S23: 34 | T23: 2 | U23: 5.2797999999999998 | V23: 31 | W23: 1 | X23: 5.5003000000000002 | Y23: 28.15 | Z23: =+Y23+V23+S23+P23+M23+J23+G23+D23 -> 247.15 | AA23: =+(X23+U23+R23+O23+L23+I23+F23+C23)/8 -> 5.1975375000000001 | AB23: =MINA(X23,U23,R23,O23,L23,I23,F23,C23) -> 4.6208999999999998
A24: DINHO | B24: 2 | C24: 5.0833000000000004 | D24: 32 | E24: 1 | F24: 5.5008999999999997 | G24: 27 | H24: 3 | I24: 5.2794999999999996 | J24: 32 | K24: 5 | L24: 5.2610000000000001 | M24: 30 | N24: 7 | O24: 5.2788000000000004 | P24: 32 | Q24: 8 | R24: 5.2803000000000004 | S24: 30 | T24: 6 | U24: 5.2798999999999996 | V24: 33 | W24: 4 | X24: 5.1158999999999999 | Y24: 30.74 | Z24: =+Y24+V24+S24+P24+M24+J24+G24+D24 -> 246.74 | AA24: =+(X24+U24+R24+O24+L24+I24+F24+C24)/8 -> 5.2599499999999999 | AB24: =MINA(X24,U24,R24,O24,L24,I24,F24,C24) -> 5.0833000000000004
A25: BONGA | B25: 7 | C25: 5.2812000000000001 | D25: 28 | E25: 8 | F25: 5.4993999999999996 | G25: 29 | H25: 6 | I25: 5.3907999999999996 | J25: 31 | K25: 4 | L25: 5.1688999999999998 | M25: 32 | N25: 2 | O25: 5.2819000000000003 | P25: 30 | Q25: 1 | R25: 5.4912000000000001 | S25: 31 | T25: 3 | U25: 5.2798999999999996 | V25: 30 | W25: 5 | X25: 5.4996 | Y25: 29.46 | Z25: =+Y25+V25+S25+P25+M25+J25+G25+D25 -> 240.46 | AA25: =+(X25+U25+R25+O25+L25+I25+F25+C25)/8 -> 5.3616124999999997 | AB25: =MINA(X25,U25,R25,O25,L25,I25,F25,C25) -> 5.1688999999999998
A26: ANDE | B26: 6 | C26: 5.28 | D26: 31 | E26: 4 | F26: 5.0593000000000004 | G26: 30 | H26: 2 | I26: 5.2797999999999998 | J26: 28 | K26: 1 | L26: 5.2805 | M26: 29 | N26: 3 | O26: 5.2606000000000002 | P26: 30 | Q26: 5 | R26: 4.6188000000000002 | S26: 30 | T26: 7 | U26: 5.3342999999999998 | V26: 32 | W26: 8 | X26: 5.5003000000000002 | Y26: 27.78 | Z26: =+Y26+V26+S26+P26+M26+J26+G26+D26 -> 237.78 | AA26: =+(X26+U26+R26+O26+L26+I26+F26+C26)/8 -> 5.2016999999999998 | AB26: =MINA(X26,U26,R26,O26,L26,I26,F26,C26) -> 4.6188000000000002
A27: ERIC | B27: 5 | C27: 5.2266000000000004 | D27: 31 | E27: 7 | F27: 5.5002000000000004 | G27: 28 | H27: 8 | I27: 5.7195 | J27: 27 | K27: 6 | L27: 5.4992999999999999 | M27: 30 | N27: 4 | O27: 5.2804000000000002 | P27: 31 | Q27: 2 | R27: 5.4805000000000001 | S27: 31 | T27: 1 | U27: 5.5004 | V27: 28 | W27: 3 | X27: 5.2804000000000002 | Y27: 31.26 | Z27: =+Y27+V27+S27+P27+M27+J27+G27+D27 -> 237.26 | AA27: =+(X27+U27+R27+O27+L27+I27+F27+C27)/8 -> 5.4359124999999988 | AB27: =MINA(X27,U27,R27,O27,L27,I27,F27,C27) -> 5.2266000000000004
A28: KLEBER | B28: 1 | C28: 5.2805999999999997 | D28: 28 | E28: 3 | F28: 5.2592999999999996 | G28: 28 | H28: 5 | I28: 5.2781000000000002 | J28: 33 | K28: 7 | L28: 5.2793999999999999 | M28: 31 | N28: 8 | O28: 5.2807000000000004 | P28: 27 | Q28: 6 | R28: 5.1982999999999997 | S28: 26 | T28: 4 | U28: 5.4829999999999997 | V28: 30 | W28: 2 | X28: 5.4455 | Y28: 28.06 | Z28: =+Y28+V28+S28+P28+M28+J28+G28+D28 -> 231.06 | AA28: =+(X28+U28+R28+O28+L28+I28+F28+C28)/8 -> 5.3131124999999999 | AB28: =MINA(X28,U28,R28,O28,L28,I28,F28,C28) -> 5.1982999999999997
A29: GIOVANNI | B29: 4 | C29: 5.2808000000000002 | D29: 31 | E29: 2 | F29: 5.2797999999999998 | G29: 26 | H29: 1 | I29: 5.5007000000000001 | J29: 27 | K29: 3 | L29: 5.2796000000000003 | M29: 28 | N29: 5 | O29: 5.5006000000000004 | P29: 28 | Q29: 7 | R29: 5.7201000000000004 | S29: 26 | T29: 8 | U29: 5.5002000000000004 | V29: 29 | W29: 6 | X29: 5.5004999999999997 | Y29: 30.44 | Z29: =+Y29+V29+S29+P29+M29+J29+G29+D29 -> 225.44 | AA29: =+(X29+U29+R29+O29+L29+I29+F29+C29)/8 -> 5.4452875000000009 | AB29: =MINA(X29,U29,R29,O29,L29,I29,F29,C29) -> 5.2796000000000003
A30: MARCEL | B30: 8 | C30: 5.2808000000000002 | D30: 31 | H30: 4 | I30: 5.1159999999999997 | J30: 32 | K30: 2 | L30: 5.2785000000000002 | M30: 29 | N30: 1 | O30: 5.7190000000000003 | P30: 27 | Q30: 3 | R30: 5.2801 | S30: 31 | T30: 5 | U30: 5.2792000000000003 | V30: 28 | W30: 7 | X30: 5.5007999999999999 | Y30: 23.61 | Z30: =+Y30+V30+S30+P30+M30+J30+G30+D30 -> 201.61 | AA30: =+(X30+U30+R30+O30+L30+I30+F30+C30)/8 -> 4.6818000000000008 | AB30: =MINA(X30,U30,R30,O30,L30,I30,F30,C30) -> 5.1159999999999997