A1: Pos | B1: Piloto | C1: Pis | D1: Tempo | E1: Vol | F1: Pis | G1: Tempo | H1: Vol | I1: Pis | J1: Tempo | K1: Vol | L1: Pis | M1: Tempo | N1: Vol | O1: Total | P1: Media | Q1: Record
A2: 1 | B2: ERIC | C2: 1 | D2: 8.1404999999999994 | E2: 32 | F2: 4 | G2: 8.58 | H2: 32 | I2: 3 | J2: 8.3465000000000007 | K2: 32 | L2: 2 | M2: 7.9210000000000003 | N2: 33.13 | O2: =+N2+K2+H2+E2 -> 129.13 | P2: =+(M2+J2+G2+D2)/4 -> 8.2469999999999999 | Q2: =MINA(M2,J2,G2,D2) -> 7.9210000000000003
A3: =+A2+1 -> 2 | B3: ADRIANO | C3: 2 | D3: 8.3595000000000006 | E3: 32 | F3: 1 | G3: 8.5802999999999994 | H3: 31 | I3: 4 | J3: 8.5792999999999999 | K3: 32 | L3: 3 | M3: 8.3597000000000001 | N3: 33.06 | O3: =+N3+K3+H3+E3 -> 128.06 | P3: =+(M3+J3+G3+D3)/4 -> 8.4696999999999996 | Q3: =MINA(M3,J3,G3,D3) -> 8.3595000000000006
A4: =+A3+1 -> 3 | B4: DINHO | C4: 3 | D4: 8.5790000000000006 | E4: 30 | F4: 1 | G4: 8.5809999999999995 | H4: 30 | I4: 2 | J4: 7.8445999999999998 | K4: 33 | L4: 4 | M4: 7.8544999999999998 | N4: 31.97 | O4: =+N4+K4+H4+E4 -> 124.97 | P4: =+(M4+J4+G4+D4)/4 -> 8.2147749999999995 | Q4: =MINA(M4,J4,G4,D4) -> 7.8445999999999998
A5: =+A4+1 -> 4 | B5: LISTER | C5: 2 | D5: 8.8001000000000005 | E5: 31 | F5: 1 | G5: 8.8009000000000004 | H5: 30 | I5: 3 | J5: 8.3605 | K5: 32 | L5: 4 | M5: 9.0210000000000008 | N5: 29.9 | O5: =+N5+K5+H5+E5 -> 122.9 | P5: =+(M5+J5+G5+D5)/4 -> 8.7456250000000004 | Q5: =MINA(M5,J5,G5,D5) -> 8.3605
A6: =+A5+1 -> 5 | B6: DANILO | C6: 3 | D6: 9.0206 | E6: 28 | F6: 2 | G6: 8.7997999999999994 | H6: 32 | I6: 4 | J6: 8.6450999999999993 | K6: 30 | L6: 1 | M6: 8.5803999999999991 | N6: 32.74 | O6: =+N6+K6+H6+E6 -> 122.74 | P6: =+(M6+J6+G6+D6)/4 -> 8.761474999999999 | Q6: =MINA(M6,J6,G6,D6) -> 8.5803999999999991
A7: =+A6+1 -> 6 | B7: JERA | C7: 4 | D7: 8.8008000000000006 | E7: 27 | F7: 3 | G7: 8.8003999999999998 | H7: 32 | I7: 2 | J7: 8.3594000000000008 | K7: 32 | L7: 1 | M7: 8.3614999999999995 | N7: 31.32 | O7: =+N7+K7+H7+E7 -> 122.32 | P7: =+(M7+J7+G7+D7)/4 -> 8.5805249999999997 | Q7: =MINA(M7,J7,G7,D7) -> 8.3594000000000008
A8: =+A7+1 -> 7 | B8: MORTA | C8: 3 | D8: 8.3603000000000005 | E8: 30 | F8: 2 | G8: 8.3605 | H8: 33 | I8: 1 | J8: 8.3605 | K8: 27 | L8: 4 | M8: 8.1050000000000004 | N8: 31.35 | O8: =+N8+K8+H8+E8 -> 121.35 | P8: =+(M8+J8+G8+D8)/4 -> 8.2965750000000007 | Q8: =MINA(M8,J8,G8,D8) -> 8.1050000000000004
A9: =+A8+1 -> 8 | B9: RENATO | C9: 3 | D9: 8.8552999999999997 | E9: 30 | F9: 2 | G9: 8.6356999999999999 | H9: 30 | I9: 4 | J9: 9.0211000000000006 | K9: 29 | L9: 1 | M9: 8.5813000000000006 | N9: 31.35 | O9: =+N9+K9+H9+E9 -> 120.35 | P9: =+(M9+J9+G9+D9)/4 -> 8.7733500000000006 | Q9: =MINA(M9,J9,G9,D9) -> 8.5813000000000006
A10: =+A9+1 -> 9 | B10: FERNANDO B | C10: 2 | D10: 8.8011999999999997 | E10: 29 | F10: 3 | G10: 8.5805000000000007 | H10: 31 | I10: 4 | J10: 8.6357999999999997 | K10: 27 | L10: 1 | M10: 8.6137999999999995 | N10: 30.58 | O10: =+N10+K10+H10+E10 -> 117.58 | P10: =+(M10+J10+G10+D10)/4 -> 8.6578250000000008 | Q10: =MINA(M10,J10,G10,D10) -> 8.5805000000000007
A11: =+A10+1 -> 10 | B11: FERNANDO M | C11: 3 | D11: 9.4602000000000004 | E11: 27 | F11: 1 | G11: 8.8535000000000004 | H11: 29 | I11: 2 | J11: 9.0167999999999999 | K11: 31 | L11: 4 | M11: 8.8003 | N11: 30.23 | O11: =+N11+K11+H11+E11 -> 117.23 | P11: =+(M11+J11+G11+D11)/4 -> 9.0327000000000002 | Q11: =MINA(M11,J11,G11,D11) -> 8.8003
A12: =+A11+1 -> 11 | B12: BONGA | C12: 1 | D12: 9.0204000000000004 | E12: 25 | F12: 4 | G12: 9.2946000000000009 | H12: 30 | I12: 3 | J12: 9.2406000000000006 | K12: 31 | L12: 2 | M12: 8.7992000000000008 | N12: 31.23 | O12: =+N12+K12+H12+E12 -> 117.23 | P12: =+(M12+J12+G12+D12)/4 -> 9.0887000000000011 | Q12: =MINA(M12,J12,G12,D12) -> 8.7992000000000008
A13: =+A12+1 -> 12 | B13: ERCOLIN | C13: 1 | D13: 9.0208999999999993 | E13: 28 | F13: 2 | G13: 8.7992000000000008 | H13: 32 | I13: 3 | J13: 8.7821999999999996 | K13: 31 | L13: 4 | M13: 8.2350999999999992 | N13: 25.97 | O13: =+N13+K13+H13+E13 -> 116.97 | P13: =+(M13+J13+G13+D13)/4 -> 8.7093499999999988 | Q13: =MINA(M13,J13,G13,D13) -> 8.2350999999999992
A14: =+A13+1 -> 13 | B14: CONRADO | C14: 4 | D14: 9.0203000000000007 | E14: 28 | F14: 1 | G14: 8.8003 | H14: 29 | I14: 2 | J14: 8.8004999999999995 | K14: 29 | L14: 3 | M14: 8.8007000000000009 | N14: 28.84 | O14: =+N14+K14+H14+E14 -> 114.84 | P14: =+(M14+J14+G14+D14)/4 -> 8.8554499999999994 | Q14: =MINA(M14,J14,G14,D14) -> 8.8003
A15: =+A14+1 -> 14 | B15: ANDRE | C15: 4 | D15: 9.8993000000000002 | E15: 24 | F15: 2 | G15: 9.2941000000000003 | H15: 30 | I15: 1 | J15: 9.0210000000000008 | K15: 30 | L15: 3 | M15: 7.8457999999999997 | N15: 29.77 | O15: =+N15+K15+H15+E15 -> 113.77 | P15: =+(M15+J15+G15+D15)/4 -> 9.0150500000000005 | Q15: =MINA(M15,J15,G15,D15) -> 7.8457999999999997
A16: =+A15+1 -> 15 | B16: BINHO | C16: 1 | D16: 9.9558999999999997 | E16: 26 | F16: 4 | G16: 9.2392000000000003 | H16: 27 | I16: 3 | J16: 8.8002000000000002 | K16: 30 | L16: 2 | M16: 8.4149999999999991 | N16: 29.45 | O16: =+N16+K16+H16+E16 -> 112.45 | P16: =+(M16+J16+G16+D16)/4 -> 9.1025749999999999 | Q16: =MINA(M16,J16,G16,D16) -> 8.4149999999999991
A17: =+A16+1 -> 16 | B17: CID | C17: 4 | D17: 10.1204 | E17: 25 | F17: 3 | G17: 9.4614999999999991 | H17: 28 | I17: 1 | J17: 9.6809999999999992 | K17: 26 | L17: 2 | M17: 9.2401 | N17: 29.68 | O17: =+N17+K17+H17+E17 -> 108.68 | P17: =+(M17+J17+G17+D17)/4 -> 9.62575 | Q17: =MINA(M17,J17,G17,D17) -> 9.2401
A18: =+A17+1 -> 17 | B18: KARAN | C18: 4 | D18: 9.6806999999999999 | E18: 22 | F18: 1 | G18: 9.0193999999999992 | H18: 27 | I18: 2 | J18: 8.6356000000000002 | K18: 28 | L18: 3 | M18: 7.9195000000000002 | N18: 27.71 | O18: =+N18+K18+H18+E18 -> 104.71 | P18: =+(M18+J18+G18+D18)/4 -> 8.8138000000000005 | Q18: =MINA(M18,J18,G18,D18) -> 7.9195000000000002