A1: Patrocinadores

B1: Motos e Acessórios Honda - Rua Sete de Setembro, 387 - Fone: (15) 3331-6700.

A1: 1 Bateria
A2: Piloto | B2: Pi | C2: Tempo | D2: Vol | E2: Pi | F2: Tempo | G2: Vol | H2: Pi | I2: Tempo | J2: Vol | K2: Pi | L2: Tempo | M2: Vol | N2: Pi | O2: Tempo | P2: Vol | Q2: Pi | R2: Tempo | S2: Vol | T2: Pi | U2: Tempo | V2: Vol | W2: Pi | X2: Tempo | Y2: Vol | Z2: Total | AA2: Media | AB2: Record
A3: SAPAO | B3: 2 | C3: 4.8296999999999999 | D3: 34.23 | E3: 1 | F3: 4.8390000000000004 | G3: 34.92 | H3: 3 | I3: 4.62 | J3: 36.63 | K3: 5 | L3: 4.8391000000000002 | M3: 35.53 | N3: 7 | O3: 4.8399000000000001 | P3: 35.26 | Q3: 8 | R3: 4.8390000000000004 | S3: 34.28 | T3: 6 | U3: 4.6201999999999996 | V3: 36.22 | W3: 4 | X3: 4.8033999999999999 | Y3: 33.6 | Z3: =+Y3+V3+S3+P3+M3+J3+G3+D3 -> 280.67 | AA3: =+(X3+U3+R3+O3+L3+I3+F3+C3)/8 -> 4.7787875000000009 | AB3: =MINA(X3,U3,R3,O3,L3,I3,F3,C3) -> 4.62
A4: ERIC | B4: 5 | C4: 4.8301999999999996 | D4: 30.26 | E4: 7 | F4: 4.1801000000000004 | G4: 34.57 | H4: 8 | I4: 4.84 | J4: 33.75 | K4: 6 | L4: 4.8391000000000002 | M4: 31.57 | N4: 4 | O4: 4.8394000000000004 | P4: 33.53 | Q4: 2 | R4: 4.8395000000000001 | S4: 33.27 | T4: 1 | U4: 5.0425000000000004 | V4: 34.11 | W4: 3 | X4: 4.62 | Y4: 35.31 | Z4: =+Y4+V4+S4+P4+M4+J4+G4+D4 -> 266.37 | AA4: =+(X4+U4+R4+O4+L4+I4+F4+C4)/8 -> 4.7538499999999999 | AB4: =MINA(X4,U4,R4,O4,L4,I4,F4,C4) -> 4.1801000000000004
A5: LISTER | B5: 6 | C5: 4.8395000000000001 | D5: 33.77 | E5: 4 | F5: 4.8280000000000003 | G5: 35.73 | H5: 2 | I5: 4.6218000000000004 | J5: 31.23 | K5: 1 | L5: 4.8404999999999996 | M5: 34.29 | N5: 3 | O5: 4.8400999999999996 | P5: 33.55 | Q5: 5 | R5: 5.0591999999999997 | S5: 29.61 | T5: 7 | U5: 5.0598999999999998 | V5: 30.72 | W5: 8 | X5: 4.8494999999999999 | Y5: 17.82 | Z5: =+Y5+V5+S5+P5+M5+J5+G5+D5 -> 246.72 | AA5: =+(X5+U5+R5+O5+L5+I5+F5+C5)/8 -> 4.8673124999999997 | AB5: =MINA(X5,U5,R5,O5,L5,I5,F5,C5) -> 4.6218000000000004
A6: RICARDAO | B6: 7 | C6: 5.0598999999999998 | D6: 31.42 | E6: 8 | F6: 5.2792000000000003 | G6: 32.75 | H6: 6 | I6: 5.0593000000000004 | J6: 33.59 | K6: 4 | L6: 5.0602 | M6: 27.76 | N6: 2 | O6: 5.0547000000000004 | P6: 30.24 | Q6: 1 | R6: 5.2803000000000004 | S6: 27.72 | T6: 3 | U6: 5.2801999999999998 | V6: 32.26 | W6: 5 | X6: 5.0537000000000001 | Y6: 29.56 | Z6: =+Y6+V6+S6+P6+M6+J6+G6+D6 -> 245.3 | AA6: =+(X6+U6+R6+O6+L6+I6+F6+C6)/8 -> 5.1409374999999997 | AB6: =MINA(X6,U6,R6,O6,L6,I6,F6,C6) -> 5.0537000000000001
A7: RUDSON | B7: 4 | C7: 5.2671000000000001 | D7: 29.2 | E7: 2 | F7: 5.2790999999999997 | G7: 32.31 | H7: 1 | I7: 5.4924999999999997 | J7: 29.47 | K7: 3 | L7: 5.0593000000000004 | M7: 33.26 | N7: 5 | O7: 5.06 | P7: 30.68 | Q7: 7 | R7: 5.0602 | S7: 32.22 | T7: 8 | U7: 5.0598999999999998 | V7: 31.28 | W7: 6 | X7: 5.0602 | Y7: 26.55 | Z7: =+Y7+V7+S7+P7+M7+J7+G7+D7 -> 244.97 | AA7: =+(X7+U7+R7+O7+L7+I7+F7+C7)/8 -> 5.1672875000000005 | AB7: =MINA(X7,U7,R7,O7,L7,I7,F7,C7) -> 5.0593000000000004
A8: LUIZ FELIPE | B8: 3 | C8: 4.8959000000000001 | D8: 27.22 | E8: 5 | F8: 5.0610999999999997 | G8: 27.08 | H8: 7 | I8: 5.0601000000000003 | J8: 30.26 | K8: 8 | L8: 5.2657999999999996 | M8: 25.44 | N8: 6 | O8: 5.0591999999999997 | P8: 28.98 | Q8: 4 | R8: 4.8418999999999999 | S8: 28.09 | T8: 2 | U8: 4.6741000000000001 | V8: 31.19 | W8: 1 | X8: 5.0602 | Y8: 28.48 | Z8: =+Y8+V8+S8+P8+M8+J8+G8+D8 -> 226.74 | AA8: =+(X8+U8+R8+O8+L8+I8+F8+C8)/8 -> 4.9897875000000003 | AB8: =MINA(X8,U8,R8,O8,L8,I8,F8,C8) -> 4.6741000000000001
A9: 2 Bateria
A10: Piloto | B10: Pi | C10: Tempo | D10: Vol | E10: Pi | F10: Tempo | G10: Vol | H10: Pi | I10: Tempo | J10: Vol | K10: Pi | L10: Tempo | M10: Vol | N10: Pi | O10: Tempo | P10: Vol | Q10: Pi | R10: Tempo | S10: Vol | T10: Pi | U10: Tempo | V10: Vol | W10: Pi | X10: Tempo | Y10: Vol | Z10: Total | AA10: Media | AB10: Record
A11: DINHO | B11: 4 | C11: 4.6208999999999998 | D11: 36.83 | E11: 2 | F11: 4.6119000000000003 | G11: 36.45 | H11: 1 | I11: 4.7278000000000002 | J11: 36.97 | K11: 3 | L11: 4.5751999999999997 | M11: 35.23 | N11: 5 | O11: 4.6191000000000004 | P11: 37.27 | Q11: 7 | R11: 4.6242999999999999 | S11: 35.26 | T11: 8 | U11: 4.6101999999999999 | V11: 37.3 | W11: 6 | X11: 4.5652999999999997 | Y11: 36.46 | Z11: =+Y11+V11+S11+P11+M11+J11+G11+D11 -> 291.77 | AA11: =+(X11+U11+R11+O11+L11+I11+F11+C11)/8 -> 4.6193374999999994 | AB11: =MINA(X11,U11,R11,O11,L11,I11,F11,C11) -> 4.5652999999999997
A12: EVANDRO | B12: 3 | C12: 4.5099 | D12: 35.5 | E12: 5 | F12: 4.7301000000000002 | G12: 36.63 | H12: 7 | I12: 4.6756000000000002 | J12: 36.22 | K12: 8 | L12: 4.7858000000000001 | M12: 33.07 | N12: 6 | O12: 4.6753 | P12: 37.73 | Q12: 4 | R12: 4.5650000000000004 | S12: 37.25 | T12: 2 | U12: 4.516 | V12: 37.15 | W12: 1 | X12: 4.7302999999999997 | Y12: 34.76 | Z12: =+Y12+V12+S12+P12+M12+J12+G12+D12 -> 288.31 | AA12: =+(X12+U12+R12+O12+L12+I12+F12+C12)/8 -> 4.6485000000000003 | AB12: =MINA(X12,U12,R12,O12,L12,I12,F12,C12) -> 4.5099
A13: BONGA | B13: 5 | C13: 4.7304000000000004 | D13: 35.86 | E13: 7 | F13: 4.7302999999999997 | G13: 35.11 | H13: 8 | I13: 4.7328000000000001 | J13: 33.11 | K13: 6 | L13: 4.7854999999999999 | M13: 35.63 | N13: 4 | O13: 4.5640000000000001 | P13: 36.75 | Q13: 2 | R13: 4.6148999999999996 | S13: 37.38 | T13: 1 | U13: 4.7857000000000003 | V13: 35.98 | W13: 3 | X13: 4.6204999999999998 | Y13: 37.06 | Z13: =+Y13+V13+S13+P13+M13+J13+G13+D13 -> 286.88 | AA13: =+(X13+U13+R13+O13+L13+I13+F13+C13)/8 -> 4.6955125000000004 | AB13: =MINA(X13,U13,R13,O13,L13,I13,F13,C13) -> 4.5640000000000001
A14: ANDERSON | B14: 6 | C14: 4.758 | D14: 32.3 | E14: 4 | F14: 4.6200999999999999 | G14: 37.02 | H14: 2 | I14: 4.6333000000000002 | J14: 36.76 | K14: 1 | L14: 5.0258000000000003 | M14: 27.81 | N14: 3 | O14: 4.6204999999999998 | P14: 37.27 | Q14: 5 | R14: 4.8192000000000004 | S14: 34.28 | T14: 7 | U14: 4.5651999999999999 | V14: 36.66 | W14: 8 | X14: 4.6303999999999998 | Y14: 36.39 | Z14: =+Y14+V14+S14+P14+M14+J14+G14+D14 -> 278.49 | AA14: =+(X14+U14+R14+O14+L14+I14+F14+C14)/8 -> 4.7090624999999999 | AB14: =MINA(X14,U14,R14,O14,L14,I14,F14,C14) -> 4.5651999999999999
A15: MICHEL | B15: 7 | C15: 4.6207000000000003 | D15: 14.75 | E15: 8 | F15: 4.6757999999999997 | G15: 36.21 | H15: 6 | I15: 4.5072999999999999 | J15: 36.02 | K15: 4 | L15: 4.5069999999999997 | M15: 35.34 | N15: 2 | O15: 4.51 | P15: 38.92 | Q15: 1 | R15: 4.5650000000000004 | S15: 37.54 | T15: 3 | U15: 4.5655000000000001 | V15: 37.77 | W15: 5 | X15: 4.6753 | Y15: 35.61 | Z15: =+Y15+V15+S15+P15+M15+J15+G15+D15 -> 272.16 | AA15: =+(X15+U15+R15+O15+L15+I15+F15+C15)/8 -> 4.5783250000000004 | AB15: =MINA(X15,U15,R15,O15,L15,I15,F15,C15) -> 4.5069999999999997
A16: MARCEL | B16: 2 | C16: 4.6201999999999996 | D16: 33.26 | E16: 1 | F16: 4.8616000000000001 | G16: 34.22 | H16: 3 | I16: 4.6776999999999997 | J16: 37.27 | K16: 5 | L16: 4.8615000000000004 | M16: 32.46 | N16: 7 | O16: 4.7232000000000003 | P16: 37.28 | Q16: 8 | R16: 4.8403999999999998 | S16: 34.57 | T16: 6 | U16: 4.6750999999999996 | V16: 35.76 | W16: 4 | X16: 4.84 | Y16: 19 | Z16: =+Y16+V16+S16+P16+M16+J16+G16+D16 -> 263.82 | AA16: =+(X16+U16+R16+O16+L16+I16+F16+C16)/8 -> 4.7624624999999998 | AB16: =MINA(X16,U16,R16,O16,L16,I16,F16,C16) -> 4.6201999999999996