A1: Patrocinadores

B1: Motos e Acessórios Honda - Rua Sete de Setembro, 387 - Fone: (15) 3331-6700. | C1: Rua Olavo Bilac, 254 - Vila Santana

A1: Pos | B1: Pilotos | C1: Tempo | D1: Fusca | E1: Mercedes | F1: Form 1 | G1: Vectra | H1: F 250 | I1: Maveric | J1: Bmw | K1: Caminhão | L1: Audi | M1: Volvo | N1: Livre * | O1: Total
A2: 1 | B2: ANDERSON | C2: 1 | D2: 170 | E2: 165 | F2: 160 | G2: 175 | H2: 175 | I2: 170 | J2: 175 | K2: 175 | L2: 155 | M2: 175 | N2: 130 | O2: =SUM(C2:N2) -> 1826
A3: 2 | B3: MICHEL | C3: 1 | D3: 175 | E3: 175 | F3: 165 | G3: 134 | H3: 155 | I3: 175 | J3: 127 | K3: 165 | L3: 170 | M3: 170 | N3: 175 | O3: =SUM(C3:N3) -> 1787
A4: 3 | B4: DINHO | C4: 2 | D4: 165 | E4: 124 | F4: 138 | G4: 155 | H4: 165 | I4: 124 | J4: 155 | K4: 170 | L4: 165 | M4: 165 | N4: 165 | O4: =SUM(C4:N4) -> 1693
A5: 4 | B5: BONGA | C5: 1 | D5: 124 | E5: 146 | F5: 150 | G5: 165 | H5: 146 | I5: 155 | J5: 150 | K5: 150 | L5: 160 | M5: 142 | N5: 155 | O5: =SUM(C5:N5) -> 1644
A6: 5 | B6: KLEBER | C6: 1 | D6: 160 | E6: 85 | F6: 170 | G6: 112 | H6: 170 | I6: 142 | J6: 146 | K6: 155 | L6: 142 | M6: 155 | N6: 160 | O6: =SUM(C6:N6) -> 1598
A7: 6 | B7: JERA | C7: 1 | D7: 109 | E7: 138 | F7: 142 | G7: 118 | H7: 124 | I7: 165 | J7: 160 | K7: 124 | L7: 175 | M7: 160 | N7: 170 | O7: =SUM(C7:N7) -> 1586
A8: 7 | B8: ERIC | C8: 1 | D8: 155 | E8: 142 | F8: 124 | G8: 138 | H8: 118 | I8: 150 | J8: 170 | K8: 160 | L8: 150 | M8: 115 | N8: 146 | O8: =SUM(C8:N8) -> 1569
A9: 8 | B9: RUBAO | C9: 1 | D9: 130 | E9: 155 | F9: 146 | G9: 150 | H9: 142 | I9: 130 | J9: 134 | K9: 130 | L9: 130 | M9: 134 | N9: 142 | O9: =SUM(C9:N9) -> 1524
A10: 9 | B10: JOAO KIBON | C10: 1 | D10: 142 | E10: 150 | F10: 130 | G10: 160 | H10: 160 | I10: 127 | J10: 118 | K10: 138 | L10: 138 | M10: 130 | N10: 127 | O10: =SUM(C10:N10) -> 1521
A11: 10 | B11: JULIO | C11: 1 | D11: 82 | E11: 134 | F11: 127 | G11: 88 | H11: 88 | I11: 160 | J11: 165 | K11: 134 | L11: 150 | M11: 146 | N11: 121 | O11: =SUM(C11:N11) -> 1396
A12: 11 | B12: GIOVANNI | C12: 0 | D12: 146 | E12: 130 | F12: 134 | G12: 109 | H12: 127 | I12: 146 | J12: 94 | K12: 146 | L12: 127 | M12: 118 | N12: 112 | O12: =SUM(C12:N12) -> 1389
A13: 12 | B13: MARCEL | C13: 1 | D13: 0 | E13: 160 | F13: 155 | G13: 142 | H13: 150 | I13: 138 | J13: 130 | K13: 142 | L13: 106 | M13: 138 | N13: 88 | O13: =SUM(C13:N13) -> 1350
A14: 13 | B14: EVANDRO | C14: 1 | D14: 91 | E14: 115 | F14: 112 | G14: 121 | H14: 130 | I14: 109 | J14: 124 | K14: 0 | L14: 118 | M14: 150 | N14: 150 | O14: =SUM(C14:N14) -> 1221
A15: 14 | B15: JAPAO | C15: 1 | D15: 115 | E15: 112 | F15: 52 | G15: 82 | H15: 103 | I15: 115 | J15: 142 | K15: 127 | L15: 134 | M15: 109 | N15: 124 | O15: =SUM(C15:N15) -> 1216
A16: 15 | B16: MANE | C16: 1 | D16: 97 | E16: 91 | F16: 0 | G16: 106 | H16: 134 | I16: 112 | J16: 121 | K16: 121 | L16: 121 | M16: 112 | N16: 103 | O16: =SUM(C16:N16) -> 1119
A17: 16 | B17: RUDSON | C17: 1 | D17: 127 | E17: 94 | F17: 61 | G17: 73 | H17: 76 | I17: 85 | J17: 115 | K17: 112 | L17: 112 | M17: 121 | N17: 109 | O17: =SUM(C17:N17) -> 1086
A18: 17 | B18: RICARDO LE | C18: 1 | D18: 43 | E18: 109 | F18: 103 | G18: 0 | H18: 94 | I18: 97 | J18: 97 | K18: 94 | L18: 94 | M18: 124 | N18: 138 | O18: =SUM(C18:N18) -> 994
A19: 18 | B19: CONRADO | C19: 1 | D19: 121 | E19: 0 | F19: 118 | G19: 103 | H19: 115 | I19: 88 | J19: 109 | K19: 118 | L19: 91 | M19: 0 | N19: 91 | O19: =SUM(C19:N19) -> 955
A20: 19 | B20: GERONIMO | C20: 1 | D20: 103 | E20: 103 | F20: 106 | G20: 97 | H20: 55 | I20: 91 | J20: 106 | K20: 115 | L20: 124 | M20: 0 | N20: 0 | O20: =SUM(C20:N20) -> 901
A21: 20 | B21: LUIZ FELIP | C21: 1 | D21: 55 | E21: 52 | F21: 49 | G21: 61 | H21: 67 | I21: 121 | J21: 79 | K21: 106 | L21: 97 | M21: 100 | N21: 85 | O21: =SUM(C21:N21) -> 873
A22: 21 | B22: LISTER | C22: 0 | D22: 0 | E22: 0 | F22: 82 | G22: 91 | H22: 82 | I22: 82 | J22: 88 | K22: 100 | L22: 100 | M22: 127 | N22: 118 | O22: =SUM(C22:N22) -> 870
A23: 22 | B23: SANDRO ITU | C23: 0 | D23: 88 | E23: 55 | F23: 88 | G23: 100 | H23: 100 | I23: 97 | J23: 112 | K23: 109 | L23: 109 | M23: 0 | N23: 0 | O23: =SUM(C23:N23) -> 858
A24: 23 | B24: FLAVIO | C24: 1 | D24: 64 | E24: 73 | F24: 73 | G24: 85 | H24: 64 | I24: 76 | J24: 91 | K24: 91 | L24: 115 | M24: 103 | N24: 0 | O24: =SUM(C24:N24) -> 836
A25: 24 | B25: TOMAZ | C25: 0 | D25: 58 | E25: 64 | F25: 55 | G25: 64 | H25: 70 | I25: 100 | J25: 82 | K25: 97 | L25: 103 | M25: 106 | N25: 0 | O25: =SUM(C25:N25) -> 799
A26: 25 | B26: GABRIEL | C26: 1 | D26: 106 | E26: 97 | F26: 0 | G26: 124 | H26: 109 | I26: 134 | J26: 138 | K26: 82 | L26: 0 | M26: 0 | N26: 0 | O26: =SUM(C26:N26) -> 791
A27: 26 | B27: PACHECO | C27: 0 | D27: 112 | E27: 106 | F27: 85 | G27: 94 | H27: 106 | I27: 103 | J27: 100 | K27: 85 | L27: 0 | M27: 0 | N27: 0 | O27: =SUM(C27:N27) -> 791
A28: 27 | B28: ANGELAO | C28: 1 | D28: 150 | E28: 170 | F28: 175 | G28: 170 | H28: 85 | I28: 0 | J28: 0 | K28: 0 | L28: 0 | M28: 0 | N28: 0 | O28: =SUM(C28:N28) -> 751
A29: 28 | B29: ERUNDA | C29: 1 | D29: 134 | E29: 127 | F29: 58 | G29: 146 | H29: 138 | I29: 106 | J29: 0 | K29: 0 | L29: 0 | M29: 0 | N29: 0 | O29: =SUM(C29:N29) -> 710
A30: 29 | B30: MARCOS JOS | C30: 1 | D30: 76 | E30: 88 | F30: 91 | G30: 79 | H30: 73 | I30: 79 | J30: 103 | K30: 88 | L30: 0 | M30: 0 | N30: 0 | O30: =SUM(C30:N30) -> 678
A31: 30 | B31: GOROI | C31: 1 | D31: 94 | E31: 121 | F31: 121 | G31: 127 | H31: 121 | J31: 0 | K31: 0 | L31: 0 | M31: 0 | N31: 0 | O31: =SUM(C31:N31) -> 585
A32: 31 | B32: FERNANDO | C32: 1 | D32: 100 | E32: 118 | F32: 109 | G32: 115 | H32: 91 | J32: 0 | K32: 0 | L32: 0 | M32: 0 | N32: 0 | O32: =SUM(C32:N32) -> 534
A33: 32 | B33: BETO | C33: 1 | D33: 49 | E33: 0 | F33: 94 | G33: 70 | H33: 79 | I33: 118 | J33: 85 | K33: 0 | L33: 0 | M33: 0 | N33: 0 | O33: =SUM(C33:N33) -> 496
A34: 33 | B34: NETO | C34: 1 | D34: 79 | E34: 79 | F34: 115 | G34: 130 | H34: 0 | J34: 0 | K34: 0 | L34: 0 | M34: 0 | N34: 0 | O34: =SUM(C34:N34) -> 404
A35: 34 | B35: M VINICIUS | C35: 0 | D35: 52 | E35: 58 | F35: 76 | G35: 67 | H35: 0 | I35: 73 | J35: 76 | K35: 0 | L35: 0 | M35: 0 | N35: 0 | O35: =SUM(C35:N35) -> 402
A36: 35 | B36: JUNINHO | C36: 1 | D36: 138 | E36: 0 | F36: 0 | G36: 0 | H36: 112 | J36: 0 | K36: 0 | L36: 0 | M36: 0 | N36: 82 | O36: =SUM(C36:N36) -> 333
A37: 36 | B37: GUSTAVO | C37: 1 | D37: 46 | E37: 100 | F37: 97 | G37: 0 | H37: 0 | J37: 0 | K37: 0 | L37: 0 | M37: 0 | N37: 0 | O37: =SUM(C37:N37) -> 244
A38: 37 | B38: DANIEL | C38: 1 | D38: 70 | E38: 82 | F38: 79 | G38: 0 | H38: 0 | J38: 0 | K38: 0 | L38: 0 | M38: 0 | N38: 0 | O38: =SUM(C38:N38) -> 232
A39: 38 | B39: RACHID | C39: 1 | D39: 118 | E39: 61 | F39: 46 | G39: 0 | H39: 0 | J39: 0 | K39: 0 | L39: 0 | M39: 0 | N39: 0 | O39: =SUM(C39:N39) -> 226
A40: 39 | B40: RODRIGO | C40: 1 | D40: 85 | E40: 70 | F40: 70 | G40: 0 | H40: 0 | J40: 0 | K40: 0 | L40: 0 | M40: 0 | N40: 0 | O40: =SUM(C40:N40) -> 226
A41: 40 | B41: CASSIO | C41: 1 | D41: 67 | E41: 76 | F41: 67 | G41: 0 | H41: 0 | J41: 0 | K41: 0 | L41: 0 | M41: 0 | N41: 0 | O41: =SUM(C41:N41) -> 211
A42: 41 | B42: XAROPINHO | C42: 0 | D42: 0 | E42: 0 | F42: 100 | G42: 0 | H42: 97 | J42: 0 | K42: 0 | L42: 0 | M42: 0 | N42: 0 | O42: =SUM(C42:N42) -> 197
A43: 42 | B43: DOUGLAS | C43: 0 | D43: 0 | E43: 0 | F43: 0 | G43: 0 | H43: 0 | I43: 0 | J43: 0 | K43: 0 | L43: 0 | M43: 0 | N43: 0 | O43: 134
A44: 43 | B44: BOLA | C44: 0 | D44: 61 | E44: 67 | F44: 0 | G44: 0 | H44: 0 | J44: 0 | K44: 0 | L44: 0 | M44: 0 | N44: 0 | O44: =SUM(C44:N44) -> 128
A45: 44 | B45: TRASH | C45: 0 | D45: 0 | E45: 0 | F45: 64 | G45: 0 | H45: 58 | J45: 0 | K45: 0 | L45: 0 | M45: 0 | N45: 0 | O45: =SUM(C45:N45) -> 122
A46: 45 | B46: PORTUGA | C46: 0 | D46: 0 | E46: 0 | F46: 0 | G46: 0 | H46: 0 | I46: 0 | J46: 0 | K46: 0 | L46: 0 | M46: 0 | N46: 0 | O46: 106
A47: 46 | B47: PICA PAU | C47: 0 | D47: 0 | E47: 0 | F47: 0 | G47: 0 | H47: 0 | I47: 0 | J47: 0 | K47: 103 | L47: 0 | M47: 0 | N47: 0 | O47: =SUM(C47:N47) -> 103
A48: 47 | B48: CUCA | C48: 0 | D48: 0 | E48: 0 | F48: 0 | G48: 0 | H48: 0 | I48: 0 | J48: 0 | K48: 0 | L48: 0 | M48: 0 | N48: 0 | O48: 100
A49: 48 | B49: GABRIEL OC | C49: 0 | D49: 0 | E49: 0 | F49: 0 | G49: 0 | H49: 0 | I49: 0 | J49: 0 | K49: 0 | L49: 0 | M49: 0 | N49: 0 | O49: 97
A50: =+A49+1 -> 49 | B50: GUERRA | C50: 0 | D50: 0 | E50: 0 | F50: 0 | G50: 0 | H50: 0 | I50: 0 | J50: 0 | K50: 0 | L50: 0 | M50: 0 | N50: 0 | O50: 94
A51: =+A50+1 -> 50 | B51: BOTELHO | C51: 0 | D51: 0 | E51: 0 | F51: 0 | G51: 76 | H51: 0 | J51: 0 | K51: 0 | L51: 0 | M51: 0 | N51: 0 | O51: =SUM(C51:N51) -> 76
A52: =+A51+1 -> 51 | B52: CHANEL | C52: 1 | D52: 73 | E52: 0 | F52: 0 | G52: 0 | H52: 0 | J52: 0 | K52: 0 | L52: 0 | M52: 0 | N52: 0 | O52: =SUM(C52:N52) -> 74
A53: =+A52+1 -> 52 | B53: XUBAKA | C53: 0 | D53: 40 | E53: 0 | F53: 0 | G53: 0 | H53: 0 | J53: 0 | K53: 0 | L53: 0 | M53: 0 | N53: 0 | O53: =SUM(C53:N53) -> 40
A54: =+A53+1 -> 53 | B54: MATHEUS | C54: 1 | D54: 37 | E54: 0 | F54: 0 | G54: 0 | H54: 0 | J54: 0 | K54: 0 | L54: 0 | M54: 0 | N54: 0 | O54: =SUM(C54:N54) -> 38

A1: Pos | B1: Pilotos | C1: Tom | D1: Fusca | E1: Mercedes | F1: Form 1 | G1: Vectra | H1: F 250 | I1: Maverik | J1: Bmw | K1: Caminhão | L1: Audi | M1: Volvo | N1: Livre * | O1: Total
A2: 1 | B2: JERA | C2: 0 | D2: 175 | E2: 175 | F2: 175 | G2: 170 | H2: 170 | I2: 175 | J2: 175 | K2: 175 | L2: 175 | M2: 175 | N2: 175 | O2: =SUM(C2:N2) -> 1915
A3: 2 | B3: LUIZ FELIPE | C3: 0 | D3: 155 | E3: 146 | F3: 142 | G3: 155 | H3: 160 | I3: 170 | J3: 160 | K3: 170 | L3: 165 | M3: 165 | N3: 170 | O3: =SUM(C3:N3) -> 1758
A4: 3 | B4: EVANDRO | C4: 0 | D4: 170 | E4: 170 | F4: 170 | G4: 175 | H4: 175 | I4: 160 | J4: 170 | K4: 0 | L4: 170 | M4: 170 | N4: 165 | O4: =SUM(C4:N4) -> 1695
A5: 4 | B5: BETO | C5: 0 | D5: 146 | E5: 0 | F5: 160 | G5: 165 | H5: 165 | I5: 165 | J5: 165 | K5: 0 | L5: 0 | M5: 0 | N5: 0 | O5: =SUM(C5:N5) -> 966
A6: 5 | B6: M VINICIUS | C6: 0 | D6: 150 | E6: 150 | F6: 150 | G6: 160 | H6: 0 | I6: 155 | J6: 155 | K6: 0 | L6: 0 | M6: 0 | N6: 0 | O6: =SUM(C6:N6) -> 920
A7: 6 | B7: DANIEL | C7: 0 | D7: 160 | E7: 160 | F7: 155 | G7: 0 | H7: 0 | I7: 0 | J7: 0 | K7: 0 | L7: 0 | M7: 0 | N7: 0 | O7: =SUM(C7:N7) -> 475
A8: 7 | B8: GUSTAVO | C8: 0 | D8: 142 | E8: 165 | F8: 165 | G8: 0 | H8: 0 | I8: 0 | J8: 0 | K8: 0 | L8: 0 | M8: 0 | N8: 0 | O8: =SUM(C8:N8) -> 472
A9: 8 | B9: RODRIGO | C9: 0 | D9: 165 | E9: 155 | F9: 146 | G9: 0 | H9: 0 | I9: 0 | J9: 0 | K9: 0 | L9: 0 | M9: 0 | N9: 0 | O9: =SUM(C9:N9) -> 466
A10: 9 | B10: MATHEUS | C10: 0 | D10: 138 | E10: 0 | F10: 0 | G10: 0 | H10: 0 | I10: 0 | J10: 0 | K10: 0 | L10: 0 | M10: 0 | N10: 0 | O10: =SUM(C10:N10) -> 138

A1: F1 - 19/12/2004
A2: Record | B2: Voltas
A3: MICHEL | B3: 264.24