A1: Patrocinadores

B1: Motos e Acessórios Honda - Rua Sete de Setembro, 387 - Fone: (15) 3331-6700. | C1: Rua Olavo Bilac, 254 - Vila Santana

A1: Pos | B1: Pilotos | C1: Tempo | D1: Fusca | E1: Mercedes | F1: Form 1 | G1: Vectra | H1: F 250 | I1: Bmw | J1: Caminhão | K1: Audi | L1: Volvo | M1: Livre * | N1: Total
A2: 1 | B2: MICHEL | C2: 1 | D2: 175 | E2: 175 | F2: 165 | G2: 0 | H2: 0 | I2: 0 | J2: 0 | K2: 0 | L2: 0 | M2: 0 | N2: =SUM(C2:M2) -> 516
A3: =+A2+1 -> 2 | B3: ANGELAO | C3: 1 | D3: 150 | E3: 170 | F3: 175 | G3: 0 | H3: 0 | I3: 0 | J3: 0 | K3: 0 | L3: 0 | M3: 0 | N3: =SUM(C3:M3) -> 496
A4: =+A3+1 -> 3 | B4: ANDERSON | C4: 1 | D4: 170 | E4: 165 | F4: 160 | G4: 0 | H4: 0 | I4: 0 | J4: 0 | K4: 0 | L4: 0 | M4: 0 | N4: =SUM(C4:M4) -> 496
A5: =+A4+1 -> 4 | B5: RUBAO | C5: 1 | D5: 130 | E5: 155 | F5: 146 | G5: 0 | H5: 0 | I5: 0 | J5: 0 | K5: 0 | L5: 0 | M5: 0 | N5: =SUM(C5:M5) -> 432
A6: =+A5+1 -> 5 | B6: DINHO | C6: 2 | D6: 165 | E6: 124 | F6: 138 | G6: 0 | H6: 0 | I6: 0 | J6: 0 | K6: 0 | L6: 0 | M6: 0 | N6: =SUM(C6:M6) -> 429
A7: =+A6+1 -> 6 | B7: JOAO KIBON | C7: 1 | D7: 142 | E7: 150 | F7: 130 | G7: 0 | H7: 0 | I7: 0 | J7: 0 | K7: 0 | L7: 0 | M7: 0 | N7: =SUM(C7:M7) -> 423
A8: =+A7+1 -> 7 | B8: ERIC | C8: 1 | D8: 155 | E8: 142 | F8: 124 | G8: 0 | H8: 0 | I8: 0 | J8: 0 | K8: 0 | L8: 0 | M8: 0 | N8: =SUM(C8:M8) -> 422
A9: =+A8+1 -> 8 | B9: BONGA | C9: 1 | D9: 124 | E9: 146 | F9: 150 | G9: 0 | H9: 0 | I9: 0 | J9: 0 | K9: 0 | L9: 0 | M9: 0 | N9: =SUM(C9:M9) -> 421
A10: =+A9+1 -> 9 | B10: KLEBER | C10: 1 | D10: 160 | E10: 85 | F10: 170 | G10: 0 | H10: 0 | I10: 0 | J10: 0 | K10: 0 | L10: 0 | M10: 0 | N10: =SUM(C10:M10) -> 416
A11: =+A10+1 -> 10 | B11: GIOVANNI | C11: 0 | D11: 146 | E11: 130 | F11: 134 | G11: 0 | H11: 0 | I11: 0 | J11: 0 | K11: 0 | L11: 0 | M11: 0 | N11: =SUM(C11:M11) -> 410
A12: =+A11+1 -> 11 | B12: JERA | C12: 1 | D12: 109 | E12: 138 | F12: 142 | G12: 0 | H12: 0 | I12: 0 | J12: 0 | K12: 0 | L12: 0 | M12: 0 | N12: =SUM(C12:M12) -> 390
A13: =+A12+1 -> 12 | B13: JULIO | C13: 1 | D13: 82 | E13: 134 | F13: 127 | G13: 0 | H13: 0 | I13: 0 | J13: 0 | K13: 0 | L13: 0 | M13: 0 | N13: =SUM(C13:M13) -> 344
A14: =+A13+1 -> 13 | B14: GOROI | C14: 1 | D14: 94 | E14: 121 | F14: 121 | G14: 0 | H14: 0 | I14: 0 | J14: 0 | K14: 0 | L14: 0 | M14: 0 | N14: =SUM(C14:M14) -> 337
A15: =+A14+1 -> 14 | B15: FERNANDO | C15: 1 | D15: 100 | E15: 118 | F15: 109 | G15: 0 | H15: 0 | I15: 0 | J15: 0 | K15: 0 | L15: 0 | M15: 0 | N15: =SUM(C15:M15) -> 328
A16: =+A15+1 -> 15 | B16: ERUNDA | C16: 1 | D16: 134 | E16: 127 | F16: 58 | G16: 0 | H16: 0 | I16: 0 | J16: 0 | K16: 0 | L16: 0 | M16: 0 | N16: =SUM(C16:M16) -> 320
A17: =+A16+1 -> 16 | B17: EVANDRO | C17: 1 | D17: 91 | E17: 115 | F17: 112 | G17: 0 | H17: 0 | I17: 0 | J17: 0 | K17: 0 | L17: 0 | M17: 0 | N17: =SUM(C17:M17) -> 319
A18: =+A17+1 -> 17 | B18: MARCEL | C18: 1 | D18: 0 | E18: 160 | F18: 155 | G18: 0 | H18: 0 | I18: 0 | J18: 0 | K18: 0 | L18: 0 | M18: 0 | N18: =SUM(C18:M18) -> 316
A19: =+A18+1 -> 18 | B19: GERONIMO | C19: 1 | D19: 103 | E19: 103 | F19: 106 | G19: 0 | H19: 0 | I19: 0 | J19: 0 | K19: 0 | L19: 0 | M19: 0 | N19: =SUM(C19:M19) -> 313
A20: =+A19+1 -> 19 | B20: PACHECO | C20: 0 | D20: 112 | E20: 106 | F20: 85 | G20: 0 | H20: 0 | I20: 0 | J20: 0 | K20: 0 | L20: 0 | M20: 0 | N20: =SUM(C20:M20) -> 303
A21: =+A20+1 -> 20 | B21: RUDSON | C21: 1 | D21: 127 | E21: 94 | F21: 61 | G21: 0 | H21: 0 | I21: 0 | J21: 0 | K21: 0 | L21: 0 | M21: 0 | N21: =SUM(C21:M21) -> 283
A22: =+A21+1 -> 21 | B22: JAPAO | C22: 1 | D22: 115 | E22: 112 | F22: 52 | G22: 0 | H22: 0 | I22: 0 | J22: 0 | K22: 0 | L22: 0 | M22: 0 | N22: =SUM(C22:M22) -> 280
A23: =+A22+1 -> 22 | B23: NETO | C23: 1 | D23: 79 | E23: 79 | F23: 115 | G23: 0 | H23: 0 | I23: 0 | J23: 0 | K23: 0 | L23: 0 | M23: 0 | N23: =SUM(C23:M23) -> 274
A24: =+A23+1 -> 23 | B24: MARCOS JOS | C24: 1 | D24: 76 | E24: 88 | F24: 91 | G24: 0 | H24: 0 | I24: 0 | J24: 0 | K24: 0 | L24: 0 | M24: 0 | N24: =SUM(C24:M24) -> 256
A25: =+A24+1 -> 24 | B25: RICARDO LE | C25: 1 | D25: 43 | E25: 109 | F25: 103 | G25: 0 | H25: 0 | I25: 0 | J25: 0 | K25: 0 | L25: 0 | M25: 0 | N25: =SUM(C25:M25) -> 256
A26: =+A25+1 -> 25 | B26: GUSTAVO | C26: 1 | D26: 46 | E26: 100 | F26: 97 | G26: 0 | H26: 0 | I26: 0 | J26: 0 | K26: 0 | L26: 0 | M26: 0 | N26: =SUM(C26:M26) -> 244
A27: =+A26+1 -> 26 | B27: CONRADO | C27: 1 | D27: 121 | E27: 0 | F27: 118 | G27: 0 | H27: 0 | I27: 0 | J27: 0 | K27: 0 | L27: 0 | M27: 0 | N27: =SUM(C27:M27) -> 240
A28: =+A27+1 -> 27 | B28: DANIEL | C28: 1 | D28: 70 | E28: 82 | F28: 79 | G28: 0 | H28: 0 | I28: 0 | J28: 0 | K28: 0 | L28: 0 | M28: 0 | N28: =SUM(C28:M28) -> 232
A29: =+A28+1 -> 28 | B29: SANDRO ITU | C29: 0 | D29: 88 | E29: 55 | F29: 88 | G29: 0 | H29: 0 | I29: 0 | J29: 0 | K29: 0 | L29: 0 | M29: 0 | N29: =SUM(C29:M29) -> 231
A30: =+A29+1 -> 29 | B30: RACHID | C30: 1 | D30: 118 | E30: 61 | F30: 46 | G30: 0 | H30: 0 | I30: 0 | J30: 0 | K30: 0 | L30: 0 | M30: 0 | N30: =SUM(C30:M30) -> 226
A31: =+A30+1 -> 30 | B31: RODRIGO | C31: 1 | D31: 85 | E31: 70 | F31: 70 | G31: 0 | H31: 0 | I31: 0 | J31: 0 | K31: 0 | L31: 0 | M31: 0 | N31: =SUM(C31:M31) -> 226
A32: =+A31+1 -> 31 | B32: CASSIO | C32: 1 | D32: 67 | E32: 76 | F32: 67 | G32: 0 | H32: 0 | I32: 0 | J32: 0 | K32: 0 | L32: 0 | M32: 0 | N32: =SUM(C32:M32) -> 211
A33: =+A32+1 -> 32 | B33: FLAVIO | C33: 1 | D33: 64 | E33: 73 | F33: 73 | G33: 0 | H33: 0 | I33: 0 | J33: 0 | K33: 0 | L33: 0 | M33: 0 | N33: =SUM(C33:M33) -> 211
A34: =+A33+1 -> 33 | B34: GABRIEL | C34: 1 | D34: 106 | E34: 97 | F34: 0 | G34: 0 | H34: 0 | I34: 0 | J34: 0 | K34: 0 | L34: 0 | M34: 0 | N34: =SUM(C34:M34) -> 204
A35: =+A34+1 -> 34 | B35: MANE | C35: 1 | D35: 97 | E35: 91 | F35: 0 | G35: 0 | H35: 0 | I35: 0 | J35: 0 | K35: 0 | L35: 0 | M35: 0 | N35: =SUM(C35:M35) -> 189
A36: =+A35+1 -> 35 | B36: M VINICIUS | C36: 0 | D36: 52 | E36: 58 | F36: 76 | G36: 0 | H36: 0 | I36: 0 | J36: 0 | K36: 0 | L36: 0 | M36: 0 | N36: =SUM(C36:M36) -> 186
A37: =+A36+1 -> 36 | B37: TOMAZ | C37: 0 | D37: 58 | E37: 64 | F37: 55 | G37: 0 | H37: 0 | I37: 0 | J37: 0 | K37: 0 | L37: 0 | M37: 0 | N37: =SUM(C37:M37) -> 177
A38: =+A37+1 -> 37 | B38: LUIZ FELIP | C38: 1 | D38: 55 | E38: 52 | F38: 49 | G38: 0 | H38: 0 | I38: 0 | J38: 0 | K38: 0 | L38: 0 | M38: 0 | N38: =SUM(C38:M38) -> 157
A39: =+A38+1 -> 38 | B39: BETO | C39: 1 | D39: 49 | E39: 0 | F39: 94 | G39: 0 | H39: 0 | I39: 0 | J39: 0 | K39: 0 | L39: 0 | M39: 0 | N39: =SUM(C39:M39) -> 144
A40: =+A39+1 -> 39 | B40: JUNINHO | C40: 1 | D40: 138 | E40: 0 | F40: 0 | G40: 0 | H40: 0 | I40: 0 | J40: 0 | K40: 0 | L40: 0 | M40: 0 | N40: =SUM(C40:M40) -> 139
A41: =+A40+1 -> 40 | B41: BOLA | C41: 0 | D41: 61 | E41: 67 | F41: 0 | G41: 0 | H41: 0 | I41: 0 | J41: 0 | K41: 0 | L41: 0 | M41: 0 | N41: =SUM(C41:M41) -> 128
A42: =+A41+1 -> 41 | B42: XAROPINHO | C42: 0 | D42: 0 | E42: 0 | F42: 100 | G42: 0 | H42: 0 | I42: 0 | J42: 0 | K42: 0 | L42: 0 | M42: 0 | N42: =SUM(C42:M42) -> 100
A43: =+A42+1 -> 42 | B43: CHANEL | C43: 1 | D43: 73 | E43: 0 | F43: 0 | G43: 0 | H43: 0 | I43: 0 | J43: 0 | K43: 0 | L43: 0 | M43: 0 | N43: =SUM(C43:M43) -> 74
A44: =+A43+1 -> 43 | B44: TRASH | C44: 0 | D44: 0 | E44: 0 | F44: 64 | G44: 0 | H44: 0 | I44: 0 | J44: 0 | K44: 0 | L44: 0 | M44: 0 | N44: =SUM(C44:M44) -> 64
A45: =+A44+1 -> 44 | B45: XUBAKA | C45: 0 | D45: 40 | E45: 0 | F45: 0 | G45: 0 | H45: 0 | I45: 0 | J45: 0 | K45: 0 | L45: 0 | M45: 0 | N45: =SUM(C45:M45) -> 40
A46: =+A45+1 -> 45 | B46: MATHEUS | C46: 1 | D46: 37 | E46: 0 | F46: 0 | G46: 0 | H46: 0 | I46: 0 | J46: 0 | K46: 0 | L46: 0 | M46: 0 | N46: =SUM(C46:M46) -> 38

A1: Pos | B1: Pilotos | C1: Tom | D1: Fusca | E1: Mercedes | F1: Form 1 | G1: Vectra | H1: F 250 | I1: Bmw | J1: Caminhão | K1: Audi | L1: Volvo | M1: Livre * | N1: Total
A2: 1 | B2: JERA | C2: 0 | D2: 175 | E2: 175 | F2: 175 | G2: 0 | H2: 0 | I2: 0 | J2: 0 | K2: 0 | L2: 0 | M2: 0 | N2: =SUM(C2:M2) -> 525
A3: 2 | B3: EVANDRO | C3: 0 | D3: 170 | E3: 170 | F3: 170 | G3: 0 | H3: 0 | I3: 0 | J3: 0 | K3: 0 | L3: 0 | M3: 0 | N3: =SUM(C3:M3) -> 510
A4: 3 | B4: DANIEL | C4: 0 | D4: 160 | E4: 160 | F4: 155 | G4: 0 | H4: 0 | I4: 0 | J4: 0 | K4: 0 | L4: 0 | M4: 0 | N4: =SUM(C4:M4) -> 475
A5: 4 | B5: GUSTAVO | C5: 0 | D5: 142 | E5: 165 | F5: 165 | G5: 0 | H5: 0 | I5: 0 | J5: 0 | K5: 0 | L5: 0 | M5: 0 | N5: =SUM(C5:M5) -> 472
A6: 5 | B6: RODRIGO | C6: 0 | D6: 165 | E6: 155 | F6: 146 | G6: 0 | H6: 0 | I6: 0 | J6: 0 | K6: 0 | L6: 0 | M6: 0 | N6: =SUM(C6:M6) -> 466
A7: 6 | B7: M VINICIUS | C7: 0 | D7: 150 | E7: 150 | F7: 150 | G7: 0 | H7: 0 | I7: 0 | J7: 0 | K7: 0 | L7: 0 | M7: 0 | N7: =SUM(C7:M7) -> 450
A8: 7 | B8: LUIZ FELIPE | C8: 0 | D8: 155 | E8: 146 | F8: 142 | G8: 0 | H8: 0 | I8: 0 | J8: 0 | K8: 0 | L8: 0 | M8: 0 | N8: =SUM(C8:M8) -> 443
A9: 8 | B9: BETO | C9: 0 | D9: 146 | E9: 0 | F9: 160 | G9: 0 | H9: 0 | I9: 0 | J9: 0 | K9: 0 | L9: 0 | M9: 0 | N9: =SUM(C9:M9) -> 306
A10: 9 | B10: MATHEUS | C10: 0 | D10: 138 | E10: 0 | F10: 0 | G10: 0 | H10: 0 | I10: 0 | J10: 0 | K10: 0 | L10: 0 | M10: 0 | N10: =SUM(C10:M10) -> 138

A1: Record | B1: Voltas
A2: Angelão | B2: 262.630