A1: Patrocinadores

B1: Motos e Acessórios Honda - Rua Sete de Setembro, 387 - Fone: (15) 3331-6700. | C1: Rua Olavo Bilac, 254 - Vila Santana

B1: Pilotos | C1: Tempo | D1: Voltas | E1: Posicao
A2: 1 | B2: DINHO | C2: 5.28 | D2: 9 | E2: 2
A3: =+A2+1 -> 2 | B3: ANDERSON | C3: 5.28 | D3: 8 | E3: 1
A4: =+A3+1 -> 3 | B4: ANGELAO | C4: 5.335 | D4: 9 | E4: 1
A5: =+A4+1 -> 4 | B5: NETO | C5: 5.39 | D5: 9 | E5: 1
A6: =+A5+1 -> 5 | B6: GOROI | C6: 5.4450000000000003 | D6: 9 | E6: 3
A7: =+A6+1 -> 6 | B7: MICHEL | C7: 5.4450000000000003 | D7: 8 | E7: 1
A8: =+A7+1 -> 7 | B8: MARCEL | C8: 5.4450000000000003 | D8: 6 | E8: 2
A9: =+A8+1 -> 8 | B9: JULIO | C9: 5.5 | D9: 9 | E9: 1
A10: =+A9+1 -> 9 | B10: ERIC | C10: 5.5 | D10: 9 | E10: 2
A11: =+A10+1 -> 10 | B11: JERA | C11: 5.5549999999999997 | D11: 9 | E11: 1
A12: =+A11+1 -> 11 | B12: RUBAO | C12: 5.61 | D12: 9 | E12: 2
A13: =+A12+1 -> 12 | B13: ERUNDA | C13: 5.61 | D13: 8 | E13: 1
A14: =+A13+1 -> 13 | B14: KLEBER | C14: 5.72 | D14: 7 | E14: 1
A15: =+A14+1 -> 14 | B15: JOAO KIBON | C15: 5.7750000000000004 | D15: 7 | E15: 1
A16: =+A15+1 -> 15 | B16: BONGA | C16: 5.83 | D16: 8 | E16: 1
A17: =+A16+1 -> 16 | B17: RUDSON | C17: 5.83 | D17: 8 | E17: 2
A18: =+A17+1 -> 17 | B18: RACHID | C18: 5.8849999999999998 | D18: 8 | E18: 2
A19: =+A18+1 -> 18 | B19: CHANEL | C19: 5.8849999999999998 | D19: 7 | E19: 1
A20: =+A19+1 -> 19 | B20: CONRADO | C20: 5.94 | D20: 8 | E20: 2
A21: =+A20+1 -> 20 | B21: GABRIEL | C21: 5.94 | D21: 7 | E21: 1
A22: =+A21+1 -> 21 | B22: MARCOS JOS | C22: 6.1050000000000004 | D22: 8 | E22: 1
A23: =+A22+1 -> 22 | B23: MANE | C23: 6.1050000000000004 | D23: 8 | E23: 2
A24: =+A23+1 -> 23 | B24: JAPAO | C24: 6.16 | D24: 8 | E24: 1
A25: =+A24+1 -> 24 | B25: EVANDRO | C25: 6.16 | D25: 6 | E25: 1
A26: =+A25+1 -> 25 | B26: RICARDO LE | C26: 6.2149999999999999 | D26: 8 | E26: 1
A27: =+A26+1 -> 26 | B27: GERONIMO | C27: 6.27 | D27: 8 | E27: 2
A28: =+A27+1 -> 27 | B28: FERNANDO | C28: 6.27 | D28: 7 | E28: 1
A29: =+A28+1 -> 28 | B29: BETO | C29: 6.27 | D29: 7 | E29: 2
A30: =+A29+1 -> 29 | B30: DANIEL | C30: 6.6 | D30: 6 | E30: 1
A31: =+A30+1 -> 30 | B31: CASSIO | C31: 6.6550000000000002 | D31: 7 | E31: 1
A32: =+A31+1 -> 31 | B32: GUSTAVO | C32: 6.71 | D32: 8 | E32: 1
A33: =+A32+1 -> 32 | B33: RODRIGO | C33: 6.82 | D33: 7 | E33: 1
A34: =+A33+1 -> 33 | B34: LUIZ FELIP | C34: 6.93 | D34: 7 | E34: 1
A35: =+A34+1 -> 34 | B35: MATHEUS | C35: 6.9850000000000003 | D35: 6 | E35: 1
A36: =+A35+1 -> 35 | B36: FLAVIO | C36: 7.04 | D36: 5 | E36: 1
A37: =+A36+1 -> 36 | B37: JUNINHO | C37: 7.6449999999999996 | D37: 3 | E37: 1
A38: =+A36+1 -> 37 | B38: GIOVANNI | C38: 7.6449999999999996 | D38: 0 | E38: 0
A39: =+A36+1 -> 38 | B39: XUBAKA | C39: 7.6449999999999996 | D39: 0 | E39: 0
A40: =+A36+1 -> 39 | B40: MARCIO FLO | C40: 7.6449999999999996 | D40: 0 | E40: 0
A41: =+A36+1 -> 40 | B41: PACHECO | C41: 7.6449999999999996 | D41: 0 | E41: 0
A42: =+A36+1 -> 41 | B42: SANDRO ITU | C42: 7.6449999999999996 | D42: 0 | E42: 0
A43: =+A36+1 -> 42 | C43: 7.6449999999999996 | D43: 0 | E43: 0