A1: Patrocinadores

B1: Motos e Acessórios Honda - Rua Sete de Setembro, 387 - Fone: (15) 3331-6700.

A1: 1 Bateria
A2: Piloto | B2: Pi | C2: Tempo | D2: Voltas | E2: Pi | F2: Tempo | G2: Voltas | H2: Pi | I2: Tempo | J2: Voltas | K2: Pi | L2: Tempo | M2: Voltas | N2: Pi | O2: Tempo | P2: Voltas | Q2: Pi | R2: Tempo | S2: Voltas | T2: Pi | U2: Tempo | V2: Voltas | W2: Pi | X2: Tempo | Y2: Voltas | Z2: Total | AA2: Media | AB2: Record
A3: MANE | B3: 6 | C3: 4.7320000000000002 | D3: 30.48 | E3: 4 | F3: 4.8212999999999999 | G3: 35.48 | H3: 2 | I3: 4.6756000000000002 | J3: 35.47 | K3: 1 | L3: 4.9592999999999998 | M3: 17.71 | N3: 3 | O3: 4.6200999999999999 | P3: 34.47 | Q3: 5 | R3: 4.8417000000000003 | S3: 33.09 | T3: 7 | U3: 4.6208999999999998 | V3: 34.17 | W3: 8 | X3: 4.6718999999999999 | Y3: 32.96 | Z3: =+Y3+V3+S3+P3+M3+J3+G3+D3 -> 253.83 | AA3: =+(X3+U3+R3+O3+L3+I3+F3+C3)/8 -> 4.7428499999999998 | AB3: =MINA(X3,U3,R3,O3,L3,I3,F3,C3) -> 4.6200999999999999
A4: RUDSON | B4: 1 | C4: 5.0613999999999999 | D4: 30.64 | E4: 3 | F4: 4.8398000000000003 | G4: 31.63 | H4: 5 | I4: 4.8495999999999997 | J4: 31.25 | K4: 7 | L4: 5.0590000000000002 | M4: 24.88 | N4: 8 | O4: 5.0052000000000003 | P4: 32.64 | Q4: 6 | R4: 5.0601000000000003 | S4: 32.07 | T4: 4 | U4: 4.7350000000000003 | V4: 33.46 | W4: 2 | X4: 4.8365 | Y4: 31.68 | Z4: =+Y4+V4+S4+P4+M4+J4+G4+D4 -> 248.25 | AA4: =+(X4+U4+R4+O4+L4+I4+F4+C4)/8 -> 4.9308249999999996 | AB4: =MINA(X4,U4,R4,O4,L4,I4,F4,C4) -> 4.7350000000000003
A5: LUIZ FELIPE | B5: 5 | C5: 4.8411 | D5: 32.52 | E5: 7 | F5: 4.8399000000000001 | G5: 29.82 | H5: 8 | I5: 4.8404999999999996 | J5: 30.5 | K5: 6 | L5: 4.8920000000000003 | M5: 27.32 | N5: 4 | O5: 4.8392999999999997 | P5: 31.27 | Q5: 2 | R5: 4.8403999999999998 | S5: 27.44 | T5: 1 | U5: 4.7869999999999999 | V5: 30.23 | W5: 3 | X5: 4.8977000000000004 | Y5: 25.47 | Z5: =+Y5+V5+S5+P5+M5+J5+G5+D5 -> 234.57 | AA5: =+(X5+U5+R5+O5+L5+I5+F5+C5)/8 -> 4.8472374999999985 | AB5: =MINA(X5,U5,R5,O5,L5,I5,F5,C5) -> 4.7869999999999999
A6: RUBAO | B6: 3 | C6: 4.8838999999999997 | D6: 30.42 | E6: 5 | F6: 5.0594999999999999 | G6: 30.56 | H6: 7 | I6: 4.8403999999999998 | J6: 31.65 | K6: 8 | L6: 4.8253000000000004 | M6: 28.84 | N6: 6 | O6: 4.9504999999999999 | P6: 30.14 | Q6: 4 | R6: 4.9207000000000001 | S6: 30.77 | T6: 2 | U6: 4.7279 | V6: 30.44 | W6: 1 | X6: 5.0011000000000001 | Y6: 21.74 | Z6: =+Y6+V6+S6+P6+M6+J6+G6+D6 -> 234.56 | AA6: =+(X6+U6+R6+O6+L6+I6+F6+C6)/8 -> 4.9011624999999999 | AB6: =MINA(X6,U6,R6,O6,L6,I6,F6,C6) -> 4.7279
A7: JOAO KIBON | B7: 4 | C7: 4.6215999999999999 | D7: 31.51 | E7: 2 | F7: 4.6725000000000003 | G7: 28.45 | H7: 1 | I7: 5.2796000000000003 | J7: 22.26 | K7: 3 | L7: 4.6753999999999998 | M7: 35.28 | N7: 5 | O7: 5.0065999999999997 | P7: 22.61 | Q7: 7 | R7: 4.8407999999999998 | S7: 31.21 | T7: 8 | U7: 4.8400999999999996 | V7: 28.47 | W7: 6 | X7: 4.8956999999999997 | Y7: 29.61 | Z7: =+Y7+V7+S7+P7+M7+J7+G7+D7 -> 229.4 | AA7: =+(X7+U7+R7+O7+L7+I7+F7+C7)/8 -> 4.8540374999999996 | AB7: =MINA(X7,U7,R7,O7,L7,I7,F7,C7) -> 4.6215999999999999
A8: CONRADO | B8: 8 | C8: 4.8380999999999998 | D8: 33.42 | E8: 6 | F8: 4.8701999999999996 | G8: 25.82 | H8: 4 | I8: 4.6898 | J8: 28.09 | K8: 2 | L8: 4.8361000000000001 | M8: 28.07 | N8: 1 | O8: 4.8398000000000003 | P8: 30.07 | Q8: 3 | R8: 4.84 | S8: 22.32 | T8: 5 | U8: 4.8276000000000003 | V8: 31.08 | W8: 7 | X8: 4.9089999999999998 | Y8: 29.11 | Z8: =+Y8+V8+S8+P8+M8+J8+G8+D8 -> 227.98 | AA8: =+(X8+U8+R8+O8+L8+I8+F8+C8)/8 -> 4.8313249999999988 | AB8: =MINA(X8,U8,R8,O8,L8,I8,F8,C8) -> 4.6898
A9: COISA PRETA | B9: 2 | C9: 4.8395000000000001 | D9: 26.77 | E9: 1 | F9: 4.8967999999999998 | G9: 30.07 | H9: 3 | I9: 4.7304000000000004 | J9: 32.27 | K9: 5 | L9: 5.2797999999999998 | M9: 26.59 | N9: 7 | O9: 5.0602 | P9: 30.06 | Q9: 8 | R9: 5.0484 | S9: 25.42 | T9: 6 | U9: 4.8704000000000001 | V9: 21.28 | W9: 4 | X9: 4.8282999999999996 | Y9: 25.06 | Z9: =+Y9+V9+S9+P9+M9+J9+G9+D9 -> 217.52 | AA9: =+(X9+U9+R9+O9+L9+I9+F9+C9)/8 -> 4.9442250000000003 | AB9: =MINA(X9,U9,R9,O9,L9,I9,F9,C9) -> 4.7304000000000004
A10: 2 Bateria
A11: Piloto | B11: Pi | C11: Tempo | D11: Voltas | E11: Pi | F11: Tempo | G11: Voltas | H11: Pi | I11: Tempo | J11: Voltas | K11: Pi | L11: Tempo | M11: Voltas | N11: Pi | O11: Tempo | P11: Voltas | Q11: Pi | R11: Tempo | S11: Voltas | T11: Pi | U11: Tempo | V11: Voltas | W11: Pi | X11: Tempo | Y11: Voltas | Z11: Total | AA11: Media | AB11: Record
A12: SAPAO | B12: 1 | C12: 4.7302999999999997 | D12: 35.06 | E12: 3 | F12: 4.6193 | G12: 34.1 | H12: 5 | I12: 4.7845000000000004 | J12: 35.74 | K12: 7 | L12: 4.8367000000000004 | M12: 34.09 | N12: 8 | O12: 4.7866999999999997 | P12: 34.74 | Q12: 6 | R12: 4.8391000000000002 | S12: 33.23 | T12: 4 | U12: 4.0694999999999997 | V12: 34.24 | W12: 2 | X12: 4.7176 | Y12: 35.75 | Z12: =+Y12+V12+S12+P12+M12+J12+G12+D12 -> 276.95 | AA12: =+(X12+U12+R12+O12+L12+I12+F12+C12)/8 -> 4.6729625000000006 | AB12: =MINA(X12,U12,R12,O12,L12,I12,F12,C12) -> 4.0694999999999997
A13: LISTER | B13: 5 | C13: 4.8992000000000004 | D13: 32.6 | E13: 7 | F13: 4.8959000000000001 | G13: 29.65 | H13: 8 | I13: 4.8384 | J13: 31.2 | K13: 6 | L13: 4.8948 | M13: 34.52 | N13: 4 | O13: 4.8274999999999997 | P13: 34.22 | Q13: 2 | R13: 4.7358000000000002 | S13: 34.84 | T13: 1 | U13: 4.8398000000000003 | V13: 34.91 | W13: 3 | X13: 4.6755000000000004 | Y13: 33.56 | Z13: =+Y13+V13+S13+P13+M13+J13+G13+D13 -> 265.5 | AA13: =+(X13+U13+R13+O13+L13+I13+F13+C13)/8 -> 4.8258625000000004 | AB13: =MINA(X13,U13,R13,O13,L13,I13,F13,C13) -> 4.6755000000000004
A14: RICARDAO | B14: 8 | C14: 4.8379000000000003 | D14: 32.42 | E14: 6 | F14: 4.8381999999999996 | G14: 29.19 | H14: 4 | I14: 4.8437000000000001 | J14: 31.45 | K14: 2 | L14: 4.8108000000000004 | M14: 31.75 | N14: 1 | O14: 5.0601000000000003 | P14: 32.68 | Q14: 3 | R14: 4.84 | S14: 35.27 | T14: 5 | U14: 4.8407999999999998 | V14: 31.89 | W14: 7 | X14: 5.0091000000000001 | Y14: 31.73 | Z14: =+Y14+V14+S14+P14+M14+J14+G14+D14 -> 256.38 | AA14: =+(X14+U14+R14+O14+L14+I14+F14+C14)/8 -> 4.8850749999999996 | AB14: =MINA(X14,U14,R14,O14,L14,I14,F14,C14) -> 4.8108000000000004
A15: ERIC | B15: 6 | C15: 4.8391000000000002 | D15: 33.55 | E15: 4 | F15: 4.6216999999999997 | G15: 31.14 | H15: 2 | I15: 4.6196000000000002 | J15: 32.29 | K15: 1 | L15: 5.0058999999999996 | M15: 32.08 | N15: 3 | O15: 4.8402000000000003 | P15: 32.48 | Q15: 5 | R15: 5.0079000000000002 | S15: 32.76 | T15: 7 | U15: 4.8958000000000004 | V15: 28.1 | W15: 8 | X15: 4.8358999999999996 | Y15: 27.63 | Z15: =+Y15+V15+S15+P15+M15+J15+G15+D15 -> 250.03 | AA15: =+(X15+U15+R15+O15+L15+I15+F15+C15)/8 -> 4.8332625 | AB15: =MINA(X15,U15,R15,O15,L15,I15,F15,C15) -> 4.6196000000000002
A16: MARCEL | B16: 2 | C16: 4.6151999999999997 | D16: 31.55 | E16: 1 | F16: 4.8388 | G16: 29.61 | H16: 3 | I16: 4.5103 | J16: 14 | K16: 5 | L16: 4.6193999999999997 | M16: 30.27 | N16: 7 | O16: 4.5659999999999998 | P16: 37.28 | Q16: 8 | R16: 4.6337999999999999 | S16: 35.26 | T16: 6 | U16: 4.6924000000000001 | V16: 31.74 | W16: 4 | X16: 4.6215999999999999 | Y16: 31.74 | Z16: =+Y16+V16+S16+P16+M16+J16+G16+D16 -> 241.45 | AA16: =+(X16+U16+R16+O16+L16+I16+F16+C16)/8 -> 4.6371874999999996 | AB16: =MINA(X16,U16,R16,O16,L16,I16,F16,C16) -> 4.5103
A17: NETO | B17: 4 | C17: 4.6757999999999997 | D17: 29.6 | E17: 2 | F17: 4.7862999999999998 | G17: 33.24 | H17: 1 | I17: 4.8407999999999998 | J17: 29.04 | K17: 3 | L17: 4.8945999999999996 | M17: 25.7 | N17: 5 | O17: 5.0502000000000002 | P17: 31.65 | Q17: 7 | R17: 5.0556000000000001 | S17: 27.73 | T17: 8 | U17: 4.7301000000000002 | V17: 33.28 | W17: 6 | X17: 4.6703000000000001 | Y17: 30.88 | Z17: =+Y17+V17+S17+P17+M17+J17+G17+D17 -> 241.12 | AA17: =+(X17+U17+R17+O17+L17+I17+F17+C17)/8 -> 4.8379624999999997 | AB17: =MINA(X17,U17,R17,O17,L17,I17,F17,C17) -> 4.6703000000000001
A18: JULIO | B18: 7 | C18: 4.8388999999999998 | D18: 28.71 | E18: 8 | F18: 4.8395000000000001 | G18: 27.75 | H18: 6 | I18: 4.7877999999999998 | J18: 12.43 | K18: 4 | L18: 4.8403999999999998 | M18: 25.26 | N18: 2 | O18: 5.0045999999999999 | P18: 32.47 | Q18: 1 | R18: 5.0610999999999997 | S18: 32.22 | T18: 3 | U18: 4.8422000000000001 | V18: 35.64 | W18: 5 | X18: 4.9466000000000001 | Y18: 29.28 | Z18: =+Y18+V18+S18+P18+M18+J18+G18+D18 -> 223.76 | AA18: =+(X18+U18+R18+O18+L18+I18+F18+C18)/8 -> 4.8951375000000006 | AB18: =MINA(X18,U18,R18,O18,L18,I18,F18,C18) -> 4.7877999999999998
A19: 3 Bateria
A20: Piloto | B20: Pi | C20: Tempo | D20: Voltas | E20: Pi | F20: Tempo | G20: Voltas | H20: Pi | I20: Tempo | J20: Voltas | K20: Pi | L20: Tempo | M20: Voltas | N20: Pi | O20: Tempo | P20: Voltas | Q20: Pi | R20: Tempo | S20: Voltas | T20: Pi | U20: Tempo | V20: Voltas | W20: Pi | X20: Tempo | Y20: Voltas | Z20: Total | AA20: Media | AB20: Record
A21: JERA | B21: 5 | C21: 4.5091000000000001 | D21: 34.5 | E21: 7 | F21: 4.6163999999999996 | G21: 36.26 | H21: 8 | I21: 4.5101000000000004 | J21: 36.62 | K21: 6 | L21: 4.3998999999999997 | M21: 37.27 | N21: 4 | O21: 4.4120999999999997 | P21: 38.22 | Q21: 2 | R21: 4.399 | S21: 39.65 | T21: 1 | U21: 4.6159999999999997 | V21: 36.23 | W21: 3 | X21: 4.6162000000000001 | Y21: 36.84 | Z21: =+Y21+V21+S21+P21+M21+J21+G21+D21 -> 295.59 | AA21: =+(X21+U21+R21+O21+L21+I21+F21+C21)/8 -> 4.5098500000000001 | AB21: =MINA(X21,U21,R21,O21,L21,I21,F21,C21) -> 4.399
A22: DINHO | B22: 2 | C22: 4.5106999999999999 | D22: 36.26 | E22: 1 | F22: 4.6158000000000001 | G22: 35.26 | H22: 3 | I22: 4.4519000000000002 | J22: 35.64 | K22: 5 | L22: 4.3992000000000004 | M22: 37.29 | N22: 7 | O22: 4.5704000000000002 | P22: 37.88 | Q22: 8 | R22: 4.6151 | S22: 37.82 | T22: 6 | U22: 4.5651999999999999 | V22: 38.49 | W22: 4 | X22: 4.5107999999999997 | Y22: 36.84 | Z22: =+Y22+V22+S22+P22+M22+J22+G22+D22 -> 295.48 | AA22: =+(X22+U22+R22+O22+L22+I22+F22+C22)/8 -> 4.5298875000000001 | AB22: =MINA(X22,U22,R22,O22,L22,I22,F22,C22) -> 4.3992000000000004
A23: MICHEL | B23: 3 | C23: 4.4 | D23: 37.11 | E23: 5 | F23: 4.6205999999999996 | G23: 36.27 | H23: 7 | I23: 4.4549000000000003 | J23: 37.24 | K23: 8 | L23: 4.6178999999999997 | M23: 34.81 | N23: 6 | O23: 4.5316999999999998 | P23: 35.46 | Q23: 4 | R23: 4.4002999999999997 | S23: 37.78 | T23: 2 | U23: 4.5053999999999998 | V23: 37.62 | W23: 1 | X23: 4.7134999999999998 | Y23: 36.21 | Z23: =+Y23+V23+S23+P23+M23+J23+G23+D23 -> 292.5 | AA23: =+(X23+U23+R23+O23+L23+I23+F23+C23)/8 -> 4.5305375000000003 | AB23: =MINA(X23,U23,R23,O23,L23,I23,F23,C23) -> 4.4
A24: BONGA | B24: 7 | C24: 4.6237000000000004 | D24: 36.09 | E24: 8 | F24: 4.8390000000000004 | G24: 30.62 | H24: 6 | I24: 4.6196000000000002 | J24: 37.55 | K24: 4 | L24: 4.6193 | M24: 35.66 | N24: 2 | O24: 4.5801999999999996 | P24: 38.25 | Q24: 1 | R24: 4.6746999999999996 | S24: 36.44 | T24: 3 | U24: 4.5601000000000003 | V24: 38.57 | W24: 5 | X24: 4.6148999999999996 | Y24: 37.07 | Z24: =+Y24+V24+S24+P24+M24+J24+G24+D24 -> 290.25 | AA24: =+(X24+U24+R24+O24+L24+I24+F24+C24)/8 -> 4.6414374999999994 | AB24: =MINA(X24,U24,R24,O24,L24,I24,F24,C24) -> 4.5601000000000003
A25: ANDERSON | B25: 6 | C25: 4.6216999999999997 | D25: 34.23 | E25: 4 | F25: 4.6196000000000002 | G25: 37.62 | H25: 2 | I25: 4.6096000000000004 | J25: 37.17 | K25: 1 | L25: 4.8437000000000001 | M25: 29.37 | N25: 3 | O25: 4.2225999999999999 | P25: 29.65 | Q25: 5 | R25: 4.6043000000000003 | S25: 37.63 | T25: 7 | U25: 4.3997999999999999 | V25: 37.63 | W25: 8 | X25: 4.468 | Y25: 38.1 | Z25: =+Y25+V25+S25+P25+M25+J25+G25+D25 -> 281.4 | AA25: =+(X25+U25+R25+O25+L25+I25+F25+C25)/8 -> 4.5486624999999989 | AB25: =MINA(X25,U25,R25,O25,L25,I25,F25,C25) -> 4.2225999999999999
A26: EVANDRO | B26: 4 | C26: 4.4004000000000003 | D26: 33 | E26: 2 | F26: 4.4001999999999999 | G26: 29.64 | H26: 1 | I26: 4.8223000000000003 | J26: 32.68 | K26: 3 | L26: 4.4554999999999998 | M26: 29.56 | N26: 5 | O26: 999 | P26: 1 | Z26: =+Y26+V26+S26+P26+M26+J26+G26+D26 -> 125.88 | AA26: =+(X26+U26+R26+O26+L26+I26+F26+C26)/8 -> 127.13480000000001 | AB26: =MINA(X26,U26,R26,O26,L26,I26,F26,C26) -> 4.4001999999999999