A1: Pos | B1: Piloto | C1: 1 Etapa | D1: 2 Etapa | E1: 3 Etapa | F1: 4 Etapa | G1: 5 Etapa | H1: Tot/S/D | I1: Tot/C/D
A2: 1 | B2: ERIC | C2: 78.39 | D2: 80.97 | E2: 83.99 | F2: 85.16 | G2: 86.68 | H2: =SUM(C2:G2) -> 415.19 | I2: =H2-(MINA(G2,F2,E2,D2,C2)) -> 336.8
A3: 2 | B3: TETA | C3: 80.09 | D3: 77.32 | E3: 82.44 | F3: 85.14 | G3: 81.73 | H3: =SUM(C3:G3) -> 406.72 | I3: =H3-(MINA(G3,F3,E3,D3,C3)) -> 329.4
A4: 3 | B4: GIOVANNI | C4: 78.88 | D4: 77.78 | E4: 78.79 | F4: 0 | G4: 81.12 | H4: =SUM(C4:G4) -> 316.57 | I4: =H4-(MINA(G4,F4,E4,D4,C4)) -> 316.57
A5: 4 | B5: JERA | C5: 67.38 | D5: 74.13 | E5: 74.04 | F5: 82.63 | G5: 84.46 | H5: =SUM(C5:G5) -> 382.64 | I5: =H5-(MINA(G5,F5,E5,D5,C5)) -> 315.26
A6: 5 | B6: MORTA | C6: 64.7 | D6: 70.17 | E6: 77.74 | F6: 76.69 | G6: 0 | H6: =SUM(C6:G6) -> 289.3 | I6: =H6-(MINA(G6,F6,E6,D6,C6)) -> 289.3
A7: 6 | B7: BONGA | C7: 0 | D7: 78.77 | E7: 82.39 | F7: 81.12 | G7: 0 | H7: =SUM(C7:G7) -> 242.28 | I7: =H7-(MINA(G7,F7,E7,D7,C7)) -> 242.28
A8: 7 | B8: PACHECO | C8: 0 | D8: 67.03 | E8: 76.27 | F8: 0 | G8: 0 | H8: =SUM(C8:G8) -> 143.3 | I8: =H8-(MINA(G8,F8,E8,D8,C8)) -> 143.3
A9: 8 | B9: DINHO | C9: 36.69 | D9: 0 | E9: 71.57 | F9: 0 | G9: 0 | H9: =SUM(C9:G9) -> 108.26 | I9: =H9-(MINA(G9,F9,E9,D9,C9)) -> 108.26
A10: 9 | B10: JULIO | C10: 0 | D10: 78.78 | E10: 20.81 | F10: 0 | G10: 0 | H10: =SUM(C10:G10) -> 99.59 | I10: =H10-(MINA(G10,F10,E10,D10,C10)) -> 99.59
A11: 10 | B11: JOAO KIBON | C11: 75.99 | D11: 0 | E11: 0 | F11: 0 | G11: 0 | H11: =SUM(C11:G11) -> 75.99 | I11: =H11-(MINA(G11,F11,E11,D11,C11)) -> 75.99
A12: 11 | B12: LISTER | C12: 69.15 | D12: 0 | E12: 0 | F12: 0 | G12: 0 | H12: =SUM(C12:G12) -> 69.15 | I12: =H12-(MINA(G12,F12,E12,D12,C12)) -> 69.15
A13: 12 | B13: RUDSON | C13: 62.32 | D13: 0 | E13: 0 | F13: 0 | G13: 0 | H13: =SUM(C13:G13) -> 62.32 | I13: =H13-(MINA(G13,F13,E13,D13,C13)) -> 62.32