A1: Patrocinadores

B1: Motos e Acessórios Honda - Rua Sete de Setembro, 387 - Fone: (15) 3331-6700. | C1: Rua Olavo Bilac, 254 - Vila Santana

A1: POS | B1: Nome | C1: VOLTAS
A2: 1 | B2: ANDERSON | C2: 261.81481481481484
A3: =+A2+1 -> 2 | B3: ANGELAO | C3: 258.24074074074076
A4: =+A3+1 -> 3 | B4: BONGA | C4: 257.74074074074076
A5: =+A4+1 -> 4 | B5: JOAO KIBON | C5: 252.53703703703704
A6: =+A5+1 -> 5 | B6: DINHO | C6: 252.37037037037038
A7: =+A6+1 -> 6 | B7: RUBAO | C7: 250.46296296296296
A8: =+A7+1 -> 7 | B8: ERUNDA | C8: 247.87037037037038
A9: =+A8+1 -> 8 | B9: MARCEL | C9: 247.42592592592592
A10: =+A9+1 -> 9 | B10: ERIC | C10: 244.4814814814815
A11: =+A10+1 -> 10 | B11: MICHEL | C11: 244.09259259259258
A12: =+A11+1 -> 11 | B12: NETO | C12: 243.94444444444446
A13: =+A12+1 -> 12 | B13: GOROI | C13: 243.81481481481481
A14: =+A13+1 -> 13 | B14: GABRIEL | C14: 241.16666666666666
A15: =+A14+1 -> 14 | B15: EVANDRO | C15: 237.27777777777777
A16: =+A15+1 -> 15 | B16: JERA | C16: 236.57407407407408
A17: =+A16+1 -> 16 | B17: FERNANDO | C17: 233.2037037037037
A18: =+A17+1 -> 17 | B18: KLEBER | C18: 232.4814814814815
A19: =+A18+1 -> 18 | B19: GIOVANNI | C19: 230.77777777777777
A20: =+A19+1 -> 19 | B20: MANE | C20: 224.27777777777777
A21: =+A20+1 -> 20 | B21: CONRADO | C21: 224.0185185185185
A22: =+A21+1 -> 21 | B22: SANDRO ITU | C22: 221.61111111111111
A23: =+A22+1 -> 22 | B23: GERONIMO | C23: 219.64814814814815
A24: =+A23+1 -> 23 | B24: PACHECO | C24: 216.87037037037038
A25: =+A24+1 -> 24 | B25: LISTER | C25: 208.31481481481481
A26: =+A25+1 -> 25 | B26: JULIO | C26: 207.72222222222223
A27: =+A26+1 -> 26 | B27: FLAVIO | C27: 206.96296296296296
A28: =+A27+1 -> 27 | B28: JAPAO | C28: 206.14814814814815
A29: =+A28+1 -> 28 | B29: M. JOSE | C29: 203.88888888888889
A30: =+A29+1 -> 29 | B30: BOTELHO | C30: 203.68518518518519
A31: =+A30+1 -> 30 | B31: RUDSON | C31: 196.44444444444446
A32: =+A31+1 -> 31 | B32: BETO | C32: 190.18518518518519
A33: =+A32+1 -> 32 | B33: M. VINICIUS | C33: 188.24074074074073
A34: =+A33+1 -> 33 | B34: TOMAZ | C34: 186.55555555555554
A35: =+A34+1 -> 34 | B35: LUIZ FELIPE | C35: 182.87037037037038