A1: Patrocinadores

B1: Motos e Acessórios Honda - Rua Sete de Setembro, 387 - Fone: (15) 3331-6700.

A1: 1 Bateria
A2: Piloto | B2: Pi | C2: Tempo | D2: Vol | E2: Pi | F2: Tempo | G2: Vol | H2: Pi | I2: Tempo | J2: Vol | K2: Pi | L2: Tempo | M2: Vol | N2: Pi | O2: Tempo | P2: Vol | Q2: Pi | R2: Tempo | S2: Vol | T2: Pi | U2: Tempo | V2: Vol | W2: Pi | X2: Tempo | Y2: Vol | Z2: Total | AA2: Media | AB2: Record
A3: MANE | B3: 3 | C3: 4.9523999999999999 | D3: 31.02 | E3: 5 | F3: 5.0582000000000003 | G3: 30.22 | H3: 7 | I3: 5.06 | J3: 27.97 | K3: 8 | L3: 5.1144999999999996 | M3: 31.64 | N3: 6 | O3: 5.0590999999999999 | P3: 32.81 | Q3: 4 | R3: 4.8396999999999997 | S3: 32.86 | T3: 2 | U3: 4.8404999999999996 | V3: 32.52 | W3: 1 | X3: 5.0608000000000004 | Y3: 32.61 | Z3: =+Y3+V3+S3+P3+M3+J3+G3+D3 -> 251.65 | AA3: =+(X3+U3+R3+O3+L3+I3+F3+C3)/8 -> 4.9981499999999999 | AB3: =MINA(X3,U3,R3,O3,L3,I3,F3,C3) -> 4.8396999999999997
A4: RICARDAO | B4: 5 | C4: 5.1689999999999996 | D4: 28.6 | E4: 7 | F4: 4.8959000000000001 | G4: 30.21 | H4: 8 | I4: 5.2803000000000004 | J4: 29.02 | K4: 6 | L4: 5.0602 | M4: 30.26 | N4: 4 | O4: 4.8395000000000001 | P4: 31.75 | Q4: 2 | R4: 4.8418999999999999 | S4: 31.23 | T4: 1 | U4: 5.5002000000000004 | V4: 25.05 | W4: 3 | X4: 5.0453999999999999 | Y4: 30.34 | Z4: =+Y4+V4+S4+P4+M4+J4+G4+D4 -> 236.46 | AA4: =+(X4+U4+R4+O4+L4+I4+F4+C4)/8 -> 5.0790499999999996 | AB4: =MINA(X4,U4,R4,O4,L4,I4,F4,C4) -> 4.8395000000000001
A5: RUDSON | B5: 7 | C5: 5.0587 | D5: 29.98 | E5: 8 | F5: 5.3875999999999999 | G5: 27.91 | H5: 6 | I5: 5.2789999999999999 | J5: 32.3 | K5: 4 | L5: 5.0613000000000001 | M5: 29.15 | N5: 2 | O5: 5.2808000000000002 | P5: 24.53 | Q5: 1 | R5: 5.5015999999999998 | S5: 26.35 | T5: 3 | U5: 5.0593000000000004 | V5: 30.67 | W5: 5 | X5: 5.0574000000000003 | Y5: 31.22 | Z5: =+Y5+V5+S5+P5+M5+J5+G5+D5 -> 232.11 | AA5: =+(X5+U5+R5+O5+L5+I5+F5+C5)/8 -> 5.2107125000000005 | AB5: =MINA(X5,U5,R5,O5,L5,I5,F5,C5) -> 5.0574000000000003
A6: LUIZ FELIPE | B6: 2 | C6: 5.0602999999999998 | D6: 28.22 | E6: 1 | F6: 5.6104000000000003 | G6: 23.54 | H6: 3 | I6: 5.0602 | J6: 22.04 | K6: 5 | L6: 5.2805999999999997 | M6: 26.34 | N6: 7 | O6: 5.2792000000000003 | P6: 29.09 | Q6: 8 | R6: 5.2790999999999997 | S6: 28.46 | T6: 6 | U6: 5.0457000000000001 | V6: 28.65 | W6: 4 | X6: 4.8406000000000002 | Y6: 25.02 | Z6: =+Y6+V6+S6+P6+M6+J6+G6+D6 -> 211.36 | AA6: =+(X6+U6+R6+O6+L6+I6+F6+C6)/8 -> 5.1820124999999999 | AB6: =MINA(X6,U6,R6,O6,L6,I6,F6,C6) -> 4.8406000000000002
A7: RODRIGO | B7: 4 | C7: 4.9391999999999996 | D7: 13 | E7: 2 | F7: 5.7762000000000002 | G7: 22.22 | H7: 1 | I7: 6.4352999999999998 | J7: 11.12 | K7: 3 | L7: 5.6656000000000004 | M7: 20.12 | N7: 5 | O7: 5.2782999999999998 | P7: 27.53 | Q7: 7 | R7: 5.0601000000000003 | S7: 30.54 | T7: 8 | U7: 5.2805999999999997 | V7: 29.14 | W7: 6 | X7: 4.9513999999999996 | Y7: 32.53 | Z7: =+Y7+V7+S7+P7+M7+J7+G7+D7 -> 186.2 | AA7: =+(X7+U7+R7+O7+L7+I7+F7+C7)/8 -> 5.4233375000000006 | AB7: =MINA(X7,U7,R7,O7,L7,I7,F7,C7) -> 4.9391999999999996
A8: GIOVANNI | B8: 6 | C8: 5.0572999999999997 | D8: 32.48 | E8: 4 | F8: 5.0590000000000002 | G8: 7.67 | H8: 2 | I8: 4.8391999999999999 | J8: 27 | K8: 1 | L8: 5.2817999999999996 | M8: 16 | Z8: =+Y8+V8+S8+P8+M8+J8+G8+D8 -> 83.15 | AA8: =+(L8+I8+F8+C8)/4 -> 5.0593249999999994 | AB8: =MINA(X8,U8,R8,O8,L8,I8,F8,C8) -> 4.8391999999999999
A9: 2 Bateria
A10: Piloto | B10: Pi | C10: Tempo | D10: Vol | E10: Pi | F10: Tempo | G10: Vol | H10: Pi | I10: Tempo | J10: Vol | K10: Pi | L10: Tempo | M10: Vol | N10: Pi | O10: Tempo | P10: Vol | Q10: Pi | R10: Tempo | S10: Vol | T10: Pi | U10: Tempo | V10: Vol | W10: Pi | X10: Tempo | Y10: Vol | Z10: Total | AA10: Media | AB10: Record
A11: MICHEL | B11: 4 | C11: 4.6197999999999997 | D11: 36.67 | E11: 2 | F11: 4.6193 | G11: 37.54 | H11: 1 | I11: 4.62 | J11: 36.21 | K11: 3 | L11: 4.6045999999999996 | M11: 37.28 | N11: 5 | O11: 4.6193 | P11: 37.46 | Q11: 7 | R11: 4.6142000000000003 | S11: 35.64 | T11: 8 | U11: 4.6193 | V11: 36.76 | W11: 6 | X11: 4.6036000000000001 | Y11: 37.16 | Z11: =+Y11+V11+S11+P11+M11+J11+G11+D11 -> 294.72 | AA11: =+(X11+U11+R11+O11+L11+I11+F11+C11)/8 -> 4.6150124999999997 | AB11: =MINA(X11,U11,R11,O11,L11,I11,F11,C11) -> 4.6036000000000001
A12: ERIC | B12: 5 | C12: 4.8403 | D12: 32.91 | E12: 7 | F12: 4.6317000000000004 | G12: 36.76 | H12: 8 | I12: 4.8403999999999998 | J12: 33.46 | K12: 6 | L12: 4.8238000000000003 | M12: 33.62 | N12: 4 | O12: 4.6192000000000002 | P12: 37.12 | Q12: 2 | R12: 4.62 | S12: 36.45 | T12: 1 | U12: 4.84 | V12: 31.95 | W12: 3 | X12: 4.6197999999999997 | Y12: 32 | Z12: =+Y12+V12+S12+P12+M12+J12+G12+D12 -> 274.27 | AA12: =+(X12+U12+R12+O12+L12+I12+F12+C12)/8 -> 4.7293999999999992 | AB12: =MINA(X12,U12,R12,O12,L12,I12,F12,C12) -> 4.6192000000000002
A13: BONGA | B13: 7 | C13: 4.8399000000000001 | D13: 33.16 | E13: 8 | F13: 4.8407 | G13: 31.26 | H13: 6 | I13: 4.8239000000000001 | J13: 34.03 | K13: 4 | L13: 4.4558999999999997 | M13: 34.21 | N13: 2 | O13: 4.6189999999999998 | P13: 35.22 | Q13: 1 | R13: 4.8319000000000001 | S13: 34.46 | T13: 3 | U13: 4.6196000000000002 | V13: 35.31 | W13: 5 | X13: 3.9594 | Y13: 35.47 | Z13: =+Y13+V13+S13+P13+M13+J13+G13+D13 -> 273.12 | AA13: =+(X13+U13+R13+O13+L13+I13+F13+C13)/8 -> 4.6237874999999997 | AB13: =MINA(X13,U13,R13,O13,L13,I13,F13,C13) -> 3.9594
A14: DINHO | B14: 2 | C14: 4.8403 | D14: 33.25 | E14: 1 | F14: 5.0491000000000001 | G14: 30.31 | H14: 3 | I14: 4.6193 | J14: 35.45 | K14: 5 | L14: 4.6752000000000002 | M14: 33.47 | N14: 7 | O14: 4.62 | P14: 35.23 | Q14: 8 | R14: 4.8301999999999996 | S14: 34.27 | T14: 6 | U14: 4.8395999999999999 | V14: 35.67 | W14: 4 | X14: 4.6200999999999999 | Y14: 33.75 | Z14: =+Y14+V14+S14+P14+M14+J14+G14+D14 -> 271.4 | AA14: =+(X14+U14+R14+O14+L14+I14+F14+C14)/8 -> 4.7617250000000002 | AB14: =MINA(X14,U14,R14,O14,L14,I14,F14,C14) -> 4.6193
A15: CONRADO | B15: 6 | C15: 4.8396999999999997 | D15: 30.74 | E15: 4 | F15: 4.6208 | G15: 35.5 | H15: 2 | I15: 4.62 | J15: 35.08 | K15: 1 | L15: 4.8391999999999999 | M15: 30.44 | N15: 3 | O15: 4.6200999999999999 | P15: 34.62 | Q15: 5 | R15: 4.8400999999999996 | S15: 32.05 | T15: 7 | U15: 4.8407999999999998 | V15: 30.94 | W15: 8 | X15: 5.0594999999999999 | Y15: 31.11 | Z15: =+Y15+V15+S15+P15+M15+J15+G15+D15 -> 260.48 | AA15: =+(X15+U15+R15+O15+L15+I15+F15+C15)/8 -> 4.7850250000000001 | AB15: =MINA(X15,U15,R15,O15,L15,I15,F15,C15) -> 4.62
A16: LISTER | B16: 1 | C16: 4.8391999999999999 | D16: 27.75 | E16: 3 | F16: 4.8409000000000004 | G16: 33.07 | H16: 5 | I16: 5.0598999999999998 | J16: 28.21 | K16: 7 | L16: 4.8564999999999996 | M16: 32.41 | N16: 8 | O16: 5.0593000000000004 | P16: 31.29 | Q16: 6 | R16: 5.0437000000000003 | S16: 32.79 | T16: 4 | U16: 4.8314000000000004 | V16: 24.54 | W16: 2 | X16: 5.0594000000000001 | Y16: 28.1 | Z16: =+Y16+V16+S16+P16+M16+J16+G16+D16 -> 238.16 | AA16: =+(X16+U16+R16+O16+L16+I16+F16+C16)/8 -> 4.9487874999999999 | AB16: =MINA(X16,U16,R16,O16,L16,I16,F16,C16) -> 4.8314000000000004