A1: R$14,99 mussarela, catupiry, buon gustaio, toscanela, calabresa (preço para retirar no balcão) | C1: R$14,99 mussarela, catupiry, buon gustaio, toscanela, calabresa (preço para retirar no balcão)

A1: Pos | B1: Nome | C1: 1 etapa | D1: 2 etapa | E1: 3 etapa | F1: 4 etapa | G1: 5 etapa | H1: 6 etapa | I1: Pontos | J1: Descar | K1: Total
A2: 1 | B2: BONGA | C2: 142 | D2: 170 | E2: 175 | F2: 170 | G2: 170 | H2: 175 | I2: =SUM(C2:H2) -> 1002 | J2: =MINA(G2,F2,E2,D2,C2,H2) -> 142 | K2: =+I2-J2 -> 860
A3: 2 | B3: GOROI | C3: 150 | D3: 160 | E3: 160 | F3: 160 | G3: 160 | H3: 0 | I3: =SUM(C3:H3) -> 790 | J3: =MINA(G3,F3,E3,D3,C3,H3) -> 0 | K3: =+I3-J3 -> 790
A4: 3 | B4: JERA | C4: 170 | D4: 0 | E4: 155 | F4: 175 | G4: 142 | H4: 146 | I4: =SUM(C4:H4) -> 788 | J4: =MINA(G4,F4,E4,D4,C4,H4) -> 0 | K4: =+I4-J4 -> 788
A5: 4 | B5: SANDRAO | C5: 165 | D5: 165 | E5: 146 | F5: 134 | G5: 134 | H5: 160 | I5: =SUM(C5:H5) -> 904 | J5: =MINA(G5,F5,E5,D5,C5,H5) -> 134 | K5: =+I5-J5 -> 770
A6: 5 | B6: RICARDO | C6: 134 | D6: 150 | E6: 170 | F6: 138 | G6: 127 | H6: 150 | I6: =SUM(C6:H6) -> 869 | J6: =MINA(G6,F6,E6,D6,C6,H6) -> 127 | K6: =+I6-J6 -> 742
A7: 6 | B7: MANO | C7: 160 | D7: 0 | E7: 165 | F7: 165 | G7: 165 | H7: 0 | I7: =SUM(C7:H7) -> 655 | J7: =MINA(G7,F7,E7,D7,C7,H7) -> 0 | K7: =+I7-J7 -> 655
A8: 7 | B8: GABRIEL | C8: 175 | D8: 0 | E8: 142 | F8: 142 | H8: 165 | I8: =SUM(C8:H8) -> 624 | J8: =MINA(G8,F8,E8,D8,C8,H8) -> 0 | K8: =+I8-J8 -> 624
A9: 8 | B9: DINHO | C9: 0 | D9: 0 | E9: 0 | F9: 155 | G9: 175 | H9: 170 | I9: =SUM(C9:H9) -> 500 | J9: =MINA(G9,F9,E9,D9,C9,H9) -> 0 | K9: =+I9-J9 -> 500
A10: 9 | B10: ERIC | C10: 0 | D10: 0 | E10: 0 | F10: 150 | G10: 146 | H10: 0 | I10: =SUM(C10:H10) -> 296 | J10: =MINA(G10,F10,E10,D10,C10,H10) -> 0 | K10: =+I10-J10 -> 296
A11: 10 | B11: JUNINHO | C11: 155 | D11: 0 | E11: 0 | F11: 0 | G11: 138 | H11: 0 | I11: =SUM(C11:H11) -> 293 | J11: =MINA(G11,F11,E11,D11,C11,H11) -> 0 | K11: =+I11-J11 -> 293
A12: 11 | B12: EVANDRO | C12: 0 | D12: 0 | E12: 138 | F12: 0 | G12: 155 | H12: 0 | I12: =SUM(C12:H12) -> 293 | J12: =MINA(G12,F12,E12,D12,C12,H12) -> 0 | K12: =+I12-J12 -> 293
A13: 12 | B13: GIOVANNI | C13: 0 | D13: 0 | E13: 0 | F13: 127 | H13: 155 | I13: =SUM(C13:H13) -> 282 | J13: =MINA(G13,F13,E13,D13,C13,H13) -> 0 | K13: =+I13-J13 -> 282
A14: 13 | B14: LEONCIO | C14: 0 | D14: 0 | E14: 0 | F14: 130 | G14: 150 | H14: 0 | I14: =SUM(C14:H14) -> 280 | J14: =MINA(G14,F14,E14,D14,C14,H14) -> 0 | K14: =+I14-J14 -> 280
A15: 14 | B15: ERUNDA | C15: 0 | D15: 155 | E15: 0 | F15: 121 | H15: 0 | I15: =SUM(C15:H15) -> 276 | J15: =MINA(G15,F15,E15,D15,C15,H15) -> 0 | K15: =+I15-J15 -> 276
A16: 15 | B16: ANGELAO | C16: 0 | D16: 175 | E16: 0 | F16: 0 | H16: 0 | I16: =SUM(C16:H16) -> 175 | J16: =MINA(G16,F16,E16,D16,C16,H16) -> 0 | K16: =+I16-J16 -> 175
A17: 16 | B17: MICHEL | C17: 0 | D17: 0 | E17: 150 | F17: 0 | H17: 0 | I17: =SUM(C17:H17) -> 150 | J17: =MINA(G17,F17,E17,D17,C17,H17) -> 0 | K17: =+I17-J17 -> 150
A18: 17 | B18: RACHID | C18: 146 | D18: 0 | E18: 0 | F18: 0 | H18: 0 | I18: =SUM(C18:H18) -> 146 | J18: =MINA(G18,F18,E18,D18,C18,H18) -> 0 | K18: =+I18-J18 -> 146
A19: 18 | B19: KLEBER | C19: 0 | D19: 146 | E19: 0 | F19: 0 | H19: 0 | I19: =SUM(C19:H19) -> 146 | J19: =MINA(G19,F19,E19,D19,C19,H19) -> 0 | K19: =+I19-J19 -> 146
A20: 19 | B20: MORTADELA | C20: 0 | D20: 0 | E20: 0 | F20: 146 | H20: 0 | I20: =SUM(C20:H20) -> 146 | J20: =MINA(G20,F20,E20,D20,C20,H20) -> 0 | K20: =+I20-J20 -> 146
A21: 20 | B21: WALDIR | C21: 0 | D21: 0 | E21: 0 | F21: 0 | G21: 0 | H21: 142 | I21: =SUM(C21:H21) -> 142 | J21: =MINA(G21,F21,E21,D21,C21,H21) -> 0 | K21: =+I21-J21 -> 142
A22: 21 | B22: XANEL | C22: 138 | D22: 0 | E22: 0 | F22: 0 | H22: 0 | I22: =SUM(C22:H22) -> 138 | J22: =MINA(G22,F22,E22,D22,C22,H22) -> 0 | K22: =+I22-J22 -> 138
A23: 22 | B23: JOÃO KIBON | C23: 0 | D23: 0 | E23: 134 | F23: 0 | H23: 0 | I23: =SUM(C23:H23) -> 134 | J23: =MINA(G23,F23,E23,D23,C23,H23) -> 0 | K23: =+I23-J23 -> 134
A24: 23 | B24: MARQUINHO | C24: 0 | D24: 0 | E24: 0 | F24: 0 | G24: 130 | H24: 0 | I24: =SUM(C24:H24) -> 130 | J24: =MINA(G24,F24,E24,D24,C24,H24) -> 0 | K24: =+I24-J24 -> 130
A25: 24 | B25: MARINHO | C25: 0 | D25: 0 | E25: 0 | F25: 124 | H25: 0 | I25: =SUM(C25:H25) -> 124 | J25: =MINA(G25,F25,E25,D25,C25,H25) -> 0 | K25: =+I25-J25 -> 124
A26: 25 | B26: BOTELHO | C26: 0 | D26: 0 | E26: 0 | F26: 0 | G26: 124 | H26: 0 | I26: =SUM(C26:H26) -> 124 | J26: =MINA(G26,F26,E26,D26,C26,H26) -> 0 | K26: =+I26-J26 -> 124