A1: R$14,99 mussarela, catupiry, buon gustaio, toscanela, calabresa (preço para retirar no balcão) | C1: R$14,99 mussarela, catupiry, buon gustaio, toscanela, calabresa (preço para retirar no balcão)

A1: POS | B1: Piloto | C1: 1 Etapa | D1: 2 Etapa | E1: 3 Etapa | F1: 4 Etapa | G1: Total
A2: 1 | B2: BONGA | C2: 236.89 | D2: 236.41 | E2: 239.52 | F2: 241.41 | G2: =SUM(C2:F2) -> 954.23
A3: =+A2+1 -> 2 | B3: DINHO | C3: 239.06 | D3: 234.7 | E3: 236.98 | F3: 243.11 | G3: =SUM(C3:F3) -> 953.85
A4: =+A3+1 -> 3 | B4: MARCEL | C4: 232.22 | D4: 217.43 | E4: 233.3 | F4: 228.61 | G4: =SUM(C4:F4) -> 911.56
A5: =+A4+1 -> 4 | B5: SAPAO | C5: 226.54 | D5: 209.83 | E5: 228.78 | F5: 233.44 | G5: =SUM(C5:F5) -> 898.59
A6: =+A5+1 -> 5 | B6: JERA | C6: 216.28 | D6: 230.26 | E6: 212.96 | F6: 223.83 | G6: =SUM(C6:F6) -> 883.33
A7: =+A6+1 -> 6 | B7: MORTA | C7: 235.65 | D7: 202.5 | E7: 220.78 | F7: 221.2 | G7: =SUM(C7:F7) -> 880.13
A8: =+A7+1 -> 7 | B8: MANE | C8: 218.65 | D8: 208.52 | E8: 207.22 | F8: 214.04 | G8: =SUM(C8:F8) -> 848.43
A9: =+A8+1 -> 8 | B9: RUDSON | C9: 204.26 | D9: 203.43 | E9: 208.2 | F9: 213.46 | G9: =SUM(C9:F9) -> 829.35
A10: =+A9+1 -> 9 | B10: RUBAO | C10: 206.52 | D10: 212.37 | E10: 151.41 | F10: 0 | G10: =SUM(C10:F10) -> 570.3
A11: =+A10+1 -> 10 | B11: MICHEL | C11: 224.06 | D11: 158 | E11: 0 | F11: 0 | G11: =SUM(C11:F11) -> 382.06
A12: =+A11+1 -> 11 | B12: CAMELO | C12: 174.28 | D12: 204.99 | E12: 0 | F12: 0 | G12: =SUM(C12:F12) -> 379.27
A13: =+A12+1 -> 12 | B13: CHORAO | C13: 190.67 | D13: 184.44 | E13: 0 | F13: 0 | G13: =SUM(C13:F13) -> 375.11
A14: =+A13+1 -> 13 | B14: MARQUINHO | C14: 221.39 | D14: 0 | E14: 0 | F14: 0 | G14: =SUM(C14:F14) -> 221.39
A15: =+A14+1 -> 14 | B15: JULIO | C15: 0 | D15: 0 | E15: 151.41 | F15: 0 | G15: =SUM(C15:F15) -> 151.41
A16: =+A15+1 -> 15 | B16: GIOVANNI | C16: 0 | D16: 0 | E16: 145.99 | F16: 0 | G16: =SUM(C16:F16) -> 145.99
A17: =+A16+1 -> 16 | B17: JOVINO | C17: 100 | D17: 0 | E17: 0 | F17: 0 | G17: =SUM(C17:F17) -> 100