A1: R$14,99 mussarela, catupiry, buon gustaio, toscanela, calabresa (preço para retirar no balcão) | C1: R$14,99 mussarela, catupiry, buon gustaio, toscanela, calabresa (preço para retirar no balcão)

A1: Piloto | B1: Pi | C1: Tempo | D1: Voltas | E1: Pi | F1: Tempo | G1: Voltas | H1: Pi | I1: Tempo | J1: Voltas | K1: Pi | L1: Tempo | M1: Voltas | N1: Pi | O1: Tempo | P1: Voltas | Q1: Pi | R1: Tempo | S1: Voltas | T1: Pi | U1: Tempo | V1: Voltas | W1: Pi | X1: Tempo | Y1: Voltas | Z1: Total | AA1: Media | AB1: Record
A2: DINHO | B2: 2 | C2: 5.2808000000000002 | D2: 31 | E2: 1 | F2: 5.2268999999999997 | G2: 31 | H2: 3 | I2: 5.1708999999999996 | J2: 32 | K2: 5 | L2: 5.2778 | M2: 32 | N2: 7 | O2: 5.7141000000000002 | P2: 29 | Q2: 8 | R2: 5.5006000000000004 | S2: 30 | T2: 6 | U2: 5.4997999999999996 | V2: 25 | W2: 4 | X2: 5.06 | Y2: 33.11 | Z2: =+Y2+V2+S2+P2+M2+J2+G2+D2 -> 243.11 | AA2: =+(X2+U2+R2+O2+L2+I2+F2+C2)/8 -> 5.3413625000000007 | AB2: =MINA(X2,U2,R2,O2,L2,I2,F2,C2) -> 5.06
A3: BONGA | B3: 1 | C3: 5.4465000000000003 | D3: 27 | E3: 3 | F3: 5.0605000000000002 | G3: 29 | H3: 5 | I3: 5.2798999999999996 | J3: 33 | K3: 7 | L3: 5.2801999999999998 | M3: 31 | N3: 8 | O3: 5.3903999999999996 | P3: 29 | Q3: 6 | R3: 5.2801 | S3: 29 | T3: 4 | U3: 5.0594999999999999 | V3: 30 | W3: 2 | X3: 5.2618 | Y3: 33.41 | Z3: =+Y3+V3+S3+P3+M3+J3+G3+D3 -> 241.41 | AA3: =+(X3+U3+R3+O3+L3+I3+F3+C3)/8 -> 5.2573625000000002 | AB3: =MINA(X3,U3,R3,O3,L3,I3,F3,C3) -> 5.0594999999999999
A4: KLEBER | B4: 6 | C4: 5.2793000000000001 | D4: 27 | E4: 4 | F4: 5.1151999999999997 | G4: 30 | H4: 2 | I4: 5.1151999999999997 | J4: 30 | K4: 1 | L4: 5.5000999999999998 | M4: 32 | N4: 3 | O4: 5.1154000000000002 | P4: 33 | Q4: 5 | R4: 5.1700999999999997 | S4: 32 | T4: 7 | U4: 5.4813000000000001 | V4: 23 | W4: 8 | X4: 5.4873000000000003 | Y4: 26.44 | Z4: =+Y4+V4+S4+P4+M4+J4+G4+D4 -> 233.44 | AA4: =+(X4+U4+R4+O4+L4+I4+F4+C4)/8 -> 5.2829874999999999 | AB4: =MINA(X4,U4,R4,O4,L4,I4,F4,C4) -> 5.1151999999999997
A5: MARCEL | B5: 5 | C5: 5.2893999999999997 | D5: 22 | E5: 7 | F5: 5.2263999999999999 | G5: 32 | H5: 8 | I5: 5.1128999999999998 | J5: 32 | K5: 6 | L5: 5.2793999999999999 | M5: 20 | N5: 4 | O5: 5.1158999999999999 | P5: 33 | Q5: 2 | R5: 5.2805999999999997 | S5: 28 | T5: 1 | U5: 5.4798999999999998 | V5: 28 | W5: 3 | X5: 5.0608000000000004 | Y5: 33.61 | Z5: =+Y5+V5+S5+P5+M5+J5+G5+D5 -> 228.61 | AA5: =+(X5+U5+R5+O5+L5+I5+F5+C5)/8 -> 5.2306625000000002 | AB5: =MINA(X5,U5,R5,O5,L5,I5,F5,C5) -> 5.0608000000000004
A6: JERA | B6: 4 | C6: 5.2793999999999999 | D6: 24 | E6: 2 | F6: 5.0595999999999997 | G6: 32 | H6: 1 | I6: 5.2811000000000003 | J6: 20 | K6: 3 | L6: 5.0545 | M6: 33 | N6: 5 | O6: 4.8410000000000002 | P6: 32 | Q6: 7 | R6: 5.0556999999999999 | S6: 31 | T6: 8 | U6: 5.2813999999999997 | V6: 26 | W6: 6 | X6: 5.1153000000000004 | Y6: 25.83 | Z6: =+Y6+V6+S6+P6+M6+J6+G6+D6 -> 223.83 | AA6: =+(X6+U6+R6+O6+L6+I6+F6+C6)/8 -> 5.1209999999999996 | AB6: =MINA(X6,U6,R6,O6,L6,I6,F6,C6) -> 4.8410000000000002
A7: MORTA | B7: 8 | C7: 5.4988999999999999 | D7: 27 | E7: 6 | F7: 5.4837999999999996 | G7: 19 | H7: 4 | I7: 5.2614000000000001 | J7: 33 | K7: 2 | L7: 5.2808000000000002 | M7: 25 | N7: 1 | O7: 5.4814999999999996 | P7: 29 | Q7: 3 | R7: 5.0594999999999999 | S7: 30 | T7: 5 | U7: 5.2801 | V7: 29 | W7: 7 | X7: 5.1703999999999999 | Y7: 29.2 | Z7: =+Y7+V7+S7+P7+M7+J7+G7+D7 -> 221.2 | AA7: =+(X7+U7+R7+O7+L7+I7+F7+C7)/8 -> 5.3145499999999997 | AB7: =MINA(X7,U7,R7,O7,L7,I7,F7,C7) -> 5.0594999999999999
A8: MANE | B8: 3 | C8: 5.5035999999999996 | D8: 24 | E8: 5 | F8: 4.8417000000000003 | G8: 25 | H8: 7 | I8: 5.4992999999999999 | J8: 29 | K8: 8 | L8: 5.718 | M8: 26 | N8: 6 | O8: 5.7202999999999999 | P8: 24 | Q8: 4 | R8: 5.4485999999999999 | S8: 29 | T8: 2 | U8: 5.4974999999999996 | V8: 26 | W8: 1 | X8: 5.5 | Y8: 31.04 | Z8: =+Y8+V8+S8+P8+M8+J8+G8+D8 -> 214.04 | AA8: =+(X8+U8+R8+O8+L8+I8+F8+C8)/8 -> 5.4661249999999999 | AB8: =MINA(X8,U8,R8,O8,L8,I8,F8,C8) -> 4.8417000000000003
A9: RUDSON | B9: 7 | C9: 6.1593 | D9: 25 | E9: 8 | F9: 5.9397000000000002 | G9: 26 | H9: 6 | I9: 5.9408000000000003 | J9: 29 | K9: 4 | L9: 5.9401000000000002 | M9: 25 | N9: 2 | O9: 5.9419000000000004 | P9: 28 | Q9: 1 | R9: 6.1599000000000004 | S9: 26 | T9: 3 | U9: 5.9592000000000001 | V9: 27 | W9: 5 | X9: 6.2150999999999996 | Y9: 27.46 | Z9: =+Y9+V9+S9+P9+M9+J9+G9+D9 -> 213.46 | AA9: =+(X9+U9+R9+O9+L9+I9+F9+C9)/8 -> 6.0320000000000009 | AB9: =MINA(X9,U9,R9,O9,L9,I9,F9,C9) -> 5.9397000000000002