A1: R$14,99 mussarela, catupiry, buon gustaio, toscanela, calabresa (preço para retirar no balcão) | C1: R$14,99 mussarela, catupiry, buon gustaio, toscanela, calabresa (preço para retirar no balcão)

A1: Piloto | B1: Pi | C1: Tempo | D1: Voltas | E1: Pi | F1: Tempo | G1: Voltas | H1: Pi | I1: Tempo | J1: Voltas | K1: Pi | L1: Tempo | M1: Voltas | N1: Pi | O1: Tempo | P1: Voltas | Q1: Pi | R1: Tempo | S1: Voltas | T1: Pi | U1: Tempo | V1: Voltas | W1: Pi | X1: Tempo | Y1: Voltas | Z1: Total | AA1: Media | AB1: Record
A2: BONGA | B2: 6 | C2: 5.7194000000000003 | D2: 30 | E2: 4 | F2: 5.28 | G2: 31 | H2: 2 | I2: 5.4451999999999998 | J2: 30 | K2: 1 | L2: 5.7206000000000001 | M2: 30 | N2: 3 | O2: 5.5 | P2: 29 | Q2: 5 | R2: 5.9401000000000002 | S2: 27 | T2: 7 | U2: 5.6277999999999997 | V2: 29 | W2: 8 | X2: 5.7202000000000002 | Y2: 30.41 | Z2: =+Y2+V2+S2+P2+M2+J2+G2+D2 -> 236.41 | AA2: =+(X2+U2+R2+O2+L2+I2+F2+C2)/8 -> 5.6191625000000007 | AB2: =MINA(X2,U2,R2,O2,L2,I2,F2,C2) -> 5.28
A3: DINHO | B3: 7 | C3: 5.3818000000000001 | D3: 31 | E3: 8 | F3: 5.5000999999999998 | G3: 28 | H3: 6 | I3: 5.2801 | J3: 30 | K3: 4 | L3: 5.3902000000000001 | M3: 30 | N3: 2 | O3: 5.2808999999999999 | P3: 27 | Q3: 1 | R3: 5.7759999999999998 | S3: 27 | T3: 3 | U3: 5.4833999999999996 | V3: 31 | W3: 5 | X3: 5.3009000000000004 | Y3: 30.7 | Z3: =+Y3+V3+S3+P3+M3+J3+G3+D3 -> 234.7 | AA3: =+(X3+U3+R3+O3+L3+I3+F3+C3)/8 -> 5.424175 | AB3: =MINA(X3,U3,R3,O3,L3,I3,F3,C3) -> 5.2801
A4: JERA | B4: 8 | C4: 5.9390999999999998 | D4: 29 | E4: 6 | F4: 5.9240000000000004 | G4: 26 | H4: 4 | I4: 5.4997999999999996 | J4: 30 | K4: 2 | L4: 5.7194000000000003 | M4: 28 | N4: 1 | O4: 5.9394999999999998 | P4: 28 | Q4: 3 | R4: 5.4999000000000002 | S4: 29 | T4: 5 | U4: 5.4992000000000001 | V4: 29 | W4: 7 | X4: 5.0616000000000003 | Y4: 31.26 | Z4: =+Y4+V4+S4+P4+M4+J4+G4+D4 -> 230.26 | AA4: =+(X4+U4+R4+O4+L4+I4+F4+C4)/8 -> 5.6353125000000004 | AB4: =MINA(X4,U4,R4,O4,L4,I4,F4,C4) -> 5.0616000000000003
A5: MARCEL | B5: 4 | C5: 5.5002000000000004 | D5: 31 | E5: 2 | F5: 5.5007999999999999 | G5: 26 | H5: 1 | I5: 5.9406999999999996 | J5: 26 | K5: 3 | L5: 4.8956999999999997 | M5: 27 | N5: 5 | O5: 5.9393000000000002 | P5: 24 | Q5: 7 | R5: 5.7195 | S5: 26 | T5: 8 | U5: 5.7202999999999999 | V5: 29 | W5: 6 | X5: 5.7205000000000004 | Y5: 28.43 | Z5: =+Y5+V5+S5+P5+M5+J5+G5+D5 -> 217.43 | AA5: =+(X5+U5+R5+O5+L5+I5+F5+C5)/8 -> 5.6171249999999997 | AB5: =MINA(X5,U5,R5,O5,L5,I5,F5,C5) -> 4.8956999999999997
A6: RUBAO | B6: 2 | C6: 5.9405999999999999 | D6: 26 | E6: 1 | F6: 6.1597999999999997 | G6: 27 | H6: 3 | I6: 5.9396000000000004 | J6: 27 | K6: 5 | L6: 6.1402999999999999 | M6: 22 | N6: 7 | O6: 6.1440999999999999 | P6: 27 | Q6: 8 | R6: 6.1607000000000003 | S6: 28 | T6: 6 | U6: 5.9402999999999997 | V6: 27 | W6: 4 | X6: 5.9309000000000003 | Y6: 28.37 | Z6: =+Y6+V6+S6+P6+M6+J6+G6+D6 -> 212.37 | AA6: =+(X6+U6+R6+O6+L6+I6+F6+C6)/8 -> 6.0445375000000006 | AB6: =MINA(X6,U6,R6,O6,L6,I6,F6,C6) -> 5.9309000000000003
A7: SAPAO | B7: 2 | C7: 5.5002000000000004 | D7: 22 | E7: 1 | F7: 5.7744999999999997 | G7: 29 | H7: 3 | I7: 5.5011000000000001 | J7: 27 | K7: 5 | L7: 5.5557999999999996 | M7: 25 | N7: 7 | O7: 5.9387999999999996 | P7: 25 | Q7: 8 | R7: 5.9390000000000001 | S7: 25 | T7: 6 | U7: 5.7206000000000001 | V7: 27 | W7: 4 | X7: 5.5008999999999997 | Y7: 29.83 | Z7: =+Y7+V7+S7+P7+M7+J7+G7+D7 -> 209.83 | AA7: =+(X7+U7+R7+O7+L7+I7+F7+C7)/8 -> 5.6788625000000001 | AB7: =MINA(X7,U7,R7,O7,L7,I7,F7,C7) -> 5.5002000000000004
A8: MANE | B8: 6 | C8: 5.9408000000000003 | D8: 23 | E8: 4 | F8: 5.9396000000000004 | G8: 26 | H8: 2 | I8: 5.9412000000000003 | J8: 23 | K8: 1 | L8: 5.9211 | M8: 28 | N8: 3 | O8: 5.7203999999999997 | P8: 26 | Q8: 5 | R8: 5.7205000000000004 | S8: 28 | T8: 7 | U8: 5.7191999999999998 | V8: 28 | W8: 8 | X8: 5.7009999999999996 | Y8: 26.52 | Z8: =+Y8+V8+S8+P8+M8+J8+G8+D8 -> 208.52 | AA8: =+(X8+U8+R8+O8+L8+I8+F8+C8)/8 -> 5.825475 | AB8: =MINA(X8,U8,R8,O8,L8,I8,F8,C8) -> 5.7009999999999996
A9: CAMELO | B9: 3 | C9: 6.1595000000000004 | D9: 26 | E9: 5 | F9: 6.1772 | G9: 25 | H9: 7 | I9: 5.9584000000000001 | J9: 27 | K9: 8 | L9: 6.1618000000000004 | M9: 23 | N9: 6 | O9: 5.9419000000000004 | P9: 27 | Q9: 4 | R9: 6.1619999999999999 | S9: 25 | T9: 2 | U9: 6.1402999999999999 | V9: 27 | W9: 1 | X9: 6.1417999999999999 | Y9: 24.99 | Z9: =+Y9+V9+S9+P9+M9+J9+G9+D9 -> 204.99 | AA9: =+(X9+U9+R9+O9+L9+I9+F9+C9)/8 -> 6.1053625 | AB9: =MINA(X9,U9,R9,O9,L9,I9,F9,C9) -> 5.9419000000000004
A10: RUDSON | B10: 5 | C10: 6.1593 | D10: 24 | E10: 7 | F10: 6.3792999999999997 | G10: 26 | H10: 8 | I10: 6.38 | J10: 27 | K10: 6 | L10: 6.3807999999999998 | M10: 24 | N10: 4 | O10: 6.1420000000000003 | P10: 26 | Q10: 2 | R10: 6.3803000000000001 | S10: 25 | T10: 1 | U10: 6.3792 | V10: 26 | W10: 3 | X10: 5.9401999999999999 | Y10: 25.43 | Z10: =+Y10+V10+S10+P10+M10+J10+G10+D10 -> 203.43 | AA10: =+(X10+U10+R10+O10+L10+I10+F10+C10)/8 -> 6.2676375000000002 | AB10: =MINA(X10,U10,R10,O10,L10,I10,F10,C10) -> 5.9401999999999999
A11: MORTA | B11: 5 | C11: 5.4999000000000002 | D11: 28 | E11: 7 | F11: 5.9173999999999998 | G11: 21 | H11: 8 | I11: 5.9394999999999998 | J11: 25 | K11: 6 | L11: 6.2156000000000002 | M11: 20 | N11: 4 | O11: 5.9943 | P11: 26 | Q11: 2 | R11: 6.1069000000000004 | S11: 27 | T11: 1 | U11: 6.1597 | V11: 27 | W11: 3 | X11: 5.7215999999999996 | Y11: 28.5 | Z11: =+Y11+V11+S11+P11+M11+J11+G11+D11 -> 202.5 | AA11: =+(X11+U11+R11+O11+L11+I11+F11+C11)/8 -> 5.9443625000000004 | AB11: =MINA(X11,U11,R11,O11,L11,I11,F11,C11) -> 5.4999000000000002
A12: CHORAO | B12: 7 | C12: 6.4897999999999998 | D12: 11 | E12: 8 | F12: 6.6 | G12: 25 | H12: 6 | I12: 6.3795999999999999 | J12: 23 | K12: 4 | L12: 6.5948000000000002 | M12: 25 | N12: 2 | O12: 6.3802000000000003 | P12: 26 | Q12: 1 | R12: 6.3795999999999999 | S12: 24 | T12: 3 | U12: 6.1593 | V12: 27 | W12: 5 | X12: 6.3806000000000003 | Y12: 23.44 | Z12: =+Y12+V12+S12+P12+M12+J12+G12+D12 -> 184.44 | AA12: =+(X12+U12+R12+O12+L12+I12+F12+C12)/8 -> 6.420487500000001 | AB12: =MINA(X12,U12,R12,O12,L12,I12,F12,C12) -> 6.1593
A13: MICHEL | B13: 3 | C13: 5.1704999999999997 | D13: 32 | E13: 5 | F13: 5.7194000000000003 | G13: 24 | H13: 7 | I13: 5.5008999999999997 | J13: 25 | K13: 8 | L13: 5.5671999999999997 | M13: 29 | N13: 6 | O13: 5.4989999999999997 | P13: 23 | Q13: 4 | R13: 5.4996 | S13: 25 | Z13: =+Y13+V13+S13+P13+M13+J13+G13+D13 -> 158 | AA13: =+(X13+U13+R13+O13+L13+I13+F13+C13)/6 -> 5.4927666666666655 | AB13: =MINA(X13,U13,R13,O13,L13,I13,F13,C13) -> 5.1704999999999997