A1: R$14,99 mussarela, catupiry, buon gustaio, toscanela, calabresa (preço para retirar no balcão) | C1: R$14,99 mussarela, catupiry, buon gustaio, toscanela, calabresa (preço para retirar no balcão)

A1: Piloto | B1: Pi | C1: Tempo | D1: Voltas | E1: Pi | F1: Tempo | G1: Voltas | H1: Pi | I1: Tempo | J1: Voltas | K1: Pi | L1: Tempo | M1: Voltas | N1: Pi | O1: Tempo | P1: Voltas | Q1: Pi | R1: Tempo | S1: Voltas | T1: Pi | U1: Tempo | V1: Voltas | W1: Pi | X1: Tempo | Y1: Voltas | Z1: Total | AA1: Media | AB1: Record
A2: BONGA | B2: 3 | C2: 5.2797999999999998 | D2: 27 | E2: 5 | F2: 5.3367000000000004 | G2: 32 | H2: 7 | I2: 5.2267999999999999 | J2: 31 | K2: 8 | L2: 5.6105999999999998 | M2: 30 | N2: 6 | O2: 5.4999000000000002 | P2: 30 | Q2: 4 | R2: 5.2801 | S2: 32 | T2: 2 | U2: 5.3917000000000002 | V2: 29 | W2: 1 | X2: 5.5556000000000001 | Y2: 28.52 | Z2: =+Y2+V2+S2+P2+M2+J2+G2+D2 -> 239.52 | AA2: =+(X2+U2+R2+O2+L2+I2+F2+C2)/8 -> 5.3976499999999996 | AB2: =MINA(X2,U2,R2,O2,L2,I2,F2,C2) -> 5.2267999999999999
A3: DINHO | B3: 1 | C3: 5.7003000000000004 | D3: 25 | E3: 3 | F3: 5.4661999999999997 | G3: 31 | H3: 5 | I3: 5.3895999999999997 | J3: 31 | K3: 7 | L3: 5.4989999999999997 | M3: 29 | N3: 8 | O3: 5.5556999999999999 | P3: 30 | Q3: 6 | R3: 5.4992999999999999 | S3: 31 | T3: 4 | U3: 5.5000999999999998 | V3: 31 | W3: 2 | X3: 5.3659999999999997 | Y3: 28.98 | Z3: =+Y3+V3+S3+P3+M3+J3+G3+D3 -> 236.98 | AA3: =+(X3+U3+R3+O3+L3+I3+F3+C3)/8 -> 5.4970249999999998 | AB3: =MINA(X3,U3,R3,O3,L3,I3,F3,C3) -> 5.3659999999999997
A4: TETA | B4: 5 | C4: 5.5007999999999999 | D4: 30 | E4: 7 | F4: 5.3345000000000002 | G4: 31 | H4: 8 | I4: 5.3665000000000003 | J4: 30 | K4: 6 | L4: 5.2792000000000003 | M4: 30 | N4: 4 | O4: 5.5007000000000001 | P4: 28 | Q4: 2 | R4: 5.5007000000000001 | S4: 29 | T4: 1 | U4: 5.9112999999999998 | V4: 24 | W4: 3 | X4: 5.3353000000000002 | Y4: 31.3 | Z4: =+Y4+V4+S4+P4+M4+J4+G4+D4 -> 233.3 | AA4: =+(X4+U4+R4+O4+L4+I4+F4+C4)/8 -> 5.4661249999999999 | AB4: =MINA(X4,U4,R4,O4,L4,I4,F4,C4) -> 5.2792000000000003
A5: SAPAO | B5: 5 | C5: 5.5004999999999997 | D5: 27 | E5: 7 | F5: 5.2257999999999996 | G5: 32 | H5: 8 | I5: 5.2805999999999997 | J5: 29 | K5: 6 | L5: 5.0614999999999997 | M5: 31 | N5: 4 | O5: 5.282 | P5: 29 | Q5: 2 | R5: 5.5003000000000002 | S5: 25 | T5: 1 | U5: 5.7202000000000002 | V5: 23 | W5: 3 | X5: 5.2622 | Y5: 32.78 | Z5: =+Y5+V5+S5+P5+M5+J5+G5+D5 -> 228.78 | AA5: =+(X5+U5+R5+O5+L5+I5+F5+C5)/8 -> 5.3541375000000002 | AB5: =MINA(X5,U5,R5,O5,L5,I5,F5,C5) -> 5.0614999999999997
A6: MORTA | B6: 8 | C6: 5.5004999999999997 | D6: 30 | E6: 6 | F6: 5.2816999999999998 | G6: 25 | H6: 4 | I6: 5.2793999999999999 | J6: 32 | K6: 2 | L6: 5.0606999999999998 | M6: 29 | N6: 1 | O6: 5.5004999999999997 | P6: 12 | Q6: 3 | R6: 5.0595999999999997 | S6: 33 | T6: 5 | U6: 5.1143000000000001 | V6: 27 | W6: 7 | X6: 5.0590000000000002 | Y6: 32.78 | Z6: =+Y6+V6+S6+P6+M6+J6+G6+D6 -> 220.78 | AA6: =+(X6+U6+R6+O6+L6+I6+F6+C6)/8 -> 5.2319624999999998 | AB6: =MINA(X6,U6,R6,O6,L6,I6,F6,C6) -> 5.0590000000000002
A7: JERA | B7: 2 | C7: 5.4999000000000002 | D7: 20 | E7: 1 | F7: 5.4996 | G7: 25 | H7: 3 | I7: 5.226 | J7: 27 | K7: 5 | L7: 5.5552999999999999 | M7: 27 | N7: 7 | O7: 5.5000999999999998 | P7: 28 | Q7: 8 | R7: 5.5000999999999998 | S7: 26 | T7: 6 | U7: 5.4997999999999996 | V7: 29 | W7: 4 | X7: 5.1157000000000004 | Y7: 30.96 | Z7: =+Y7+V7+S7+P7+M7+J7+G7+D7 -> 212.96 | AA7: =+(X7+U7+R7+O7+L7+I7+F7+C7)/8 -> 5.4245625000000004 | AB7: =MINA(X7,U7,R7,O7,L7,I7,F7,C7) -> 5.1157000000000004
A8: RUDSON | B8: 3 | C8: 5.7003000000000004 | D8: 27 | E8: 5 | F8: 5.9390999999999998 | G8: 27 | H8: 7 | I8: 5.7205000000000004 | J8: 28 | K8: 8 | L8: 5.9409000000000001 | M8: 25 | N8: 6 | O8: 4.8400999999999996 | P8: 27 | Q8: 4 | R8: 5.9393000000000002 | S8: 28 | T8: 2 | U8: 5.9412000000000003 | V8: 17 | W8: 1 | X8: 5.9355000000000002 | Y8: 29.2 | Z8: =+Y8+V8+S8+P8+M8+J8+G8+D8 -> 208.2 | AA8: =+(X8+U8+R8+O8+L8+I8+F8+C8)/8 -> 5.7446124999999988 | AB8: =MINA(X8,U8,R8,O8,L8,I8,F8,C8) -> 4.8400999999999996
A9: MANE | B9: 4 | C9: 5.7035999999999998 | D9: 25 | E9: 2 | F9: 5.4992999999999999 | G9: 26 | H9: 1 | I9: 5.5791000000000004 | J9: 25 | K9: 3 | L9: 5.5 | M9: 28 | N9: 5 | O9: 5.4995000000000003 | P9: 24 | Q9: 7 | R9: 5.4991000000000003 | S9: 28 | T9: 8 | U9: 5.5008999999999997 | V9: 24 | W9: 6 | X9: 5.7191000000000001 | Y9: 27.22 | Z9: =+Y9+V9+S9+P9+M9+J9+G9+D9 -> 207.22 | AA9: =+(X9+U9+R9+O9+L9+I9+F9+C9)/8 -> 5.5625749999999998 | AB9: =MINA(X9,U9,R9,O9,L9,I9,F9,C9) -> 5.4991000000000003
A10: GABRIEL | B10: 2 | C10: 5.9398 | D10: 23 | E10: 1 | F10: 5.9405000000000001 | G10: 24 | H10: 3 | I10: 5.7206000000000001 | J10: 26 | K10: 5 | L10: 6.1601999999999997 | M10: 21 | N10: 7 | O10: 6.1603000000000003 | P10: 17 | Q10: 8 | R10: 5.9409000000000001 | S10: 25 | T10: 6 | U10: 5.9382000000000001 | V10: 21 | W10: 4 | X10: 5.7760999999999996 | Y10: 20.74 | Z10: =+Y10+V10+S10+P10+M10+J10+G10+D10 -> 177.74 | AA10: =+(X10+U10+R10+O10+L10+I10+F10+C10)/8 -> 5.9470749999999999 | AB10: =MINA(X10,U10,R10,O10,L10,I10,F10,C10) -> 5.7206000000000001
A11: JULIO | B11: 7 | C11: 5.9348999999999998 | D11: 27 | E11: 8 | F11: 5.6976000000000004 | G11: 27 | H11: 6 | I11: 6.1607000000000003 | J11: 4 | K11: 4 | L11: 5.9405000000000001 | M11: 20 | N11: 2 | O11: 6.0496999999999996 | P11: 23 | Q11: 1 | R11: 7.0968999999999998 | S11: 19 | T11: 3 | U11: 6.4347000000000003 | V11: 21 | W11: 5 | X11: 8.4161000000000001 | Y11: 10.41 | Z11: =+Y11+V11+S11+P11+M11+J11+G11+D11 -> 151.41 | AA11: =+(X11+U11+R11+O11+L11+I11+F11+C11)/8 -> 6.4663874999999997 | AB11: =MINA(X11,U11,R11,O11,L11,I11,F11,C11) -> 5.6976000000000004
A12: RUBAO | B12: 4 | C12: 6.1063999999999998 | D12: 18 | E12: 2 | F12: 5.9401000000000002 | G12: 24 | H12: 1 | I12: 6.0490000000000004 | J12: 20 | K12: 3 | L12: 6.4123000000000001 | M12: 15 | N12: 5 | O12: 6.3795999999999999 | P12: 20 | Q12: 7 | R12: 6.1516999999999999 | S12: 23 | T12: 8 | U12: 6.6005000000000003 | V12: 21 | W12: 6 | X12: 7.5895000000000001 | Y12: 10.41 | Z12: =+Y12+V12+S12+P12+M12+J12+G12+D12 -> 151.41 | AA12: =+(X12+U12+R12+O12+L12+I12+F12+C12)/8 -> 6.4036375000000003 | AB12: =MINA(X12,U12,R12,O12,L12,I12,F12,C12) -> 5.9401000000000002
A13: GIOVANNI | B13: 7 | C13: 5.5553999999999997 | D13: 28 | E13: 8 | F13: 5.9398999999999997 | G13: 23 | H13: 6 | I13: 5.9404000000000003 | J13: 25 | K13: 4 | L13: 5.7191000000000001 | M13: 14 | Q13: 1 | R13: 5.9234999999999998 | S13: 8 | T13: 3 | U13: 5.4992000000000001 | V13: 25 | W13: 5 | X13: 4.8404999999999996 | Y13: 22.99 | Z13: =+Y13+V13+S13+P13+M13+J13+G13+D13 -> 145.99 | AA13: =+(X13+U13+R13+O13+L13+I13+F13+C13)/7 -> 5.6311428571428568 | AB13: =MINA(X13,U13,R13,O13,L13,I13,F13,C13) -> 4.8404999999999996