A1: R$14,99 mussarela, catupiry, buon gustaio, toscanela, calabresa (preço para retirar no balcão) | C1: R$14,99 mussarela, catupiry, buon gustaio, toscanela, calabresa (preço para retirar no balcão)

A1: Piloto | B1: Pi | C1: Tempo | D1: Voltas | E1: Pi | F1: Tempo | G1: Voltas | H1: Pi | I1: Tempo | J1: Voltas | K1: Pi | L1: Tempo | M1: Voltas | N1: Pi | O1: Tempo | P1: Voltas | Q1: Pi | R1: Tempo | S1: Voltas | T1: Pi | U1: Tempo | V1: Voltas | W1: Pi | X1: Tempo | Y1: Voltas | Z1: Total | AA1: Media | AB1: Record
A2: DINHO | B2: 8 | C2: 5.444 | D2: 27 | E2: 6 | F2: 5.335 | G2: 30 | H2: 4 | I2: 5.05 | J2: 32 | K2: 2 | L2: 5.1150000000000002 | M2: 29 | N2: 1 | O2: 5.4930000000000003 | P2: 30 | Q2: 3 | R2: 5.06 | S2: 32 | T2: 5 | U2: 5.444 | V2: 29 | W2: 7 | X2: 5.0049999999999999 | Y2: 30.06 | Z2: =+Y2+V2+S2+P2+M2+J2+G2+D2 -> 239.06 | AA2: =+(X2+U2+R2+O2+L2+I2+F2+C2)/8 -> 5.2432500000000006 | AB2: =MINA(X2,U2,R2,O2,L2,I2,F2,C2) -> 5.0049999999999999
A3: BONGA | B3: 6 | C3: 5.5549999999999997 | D3: 29 | E3: 4 | F3: 5.242 | G3: 30 | H3: 2 | I3: 5.06 | J3: 31 | K3: 1 | L3: 5.609 | M3: 29 | N3: 3 | O3: 5.28 | P3: 31 | Q3: 5 | R3: 5.39 | S3: 27 | T3: 7 | U3: 5.391 | V3: 31 | W3: 8 | X3: 4.9989999999999997 | Y3: 28.89 | Z3: =+Y3+V3+S3+P3+M3+J3+G3+D3 -> 236.89 | AA3: =+(X3+U3+R3+O3+L3+I3+F3+C3)/8 -> 5.3157500000000004 | AB3: =MINA(X3,U3,R3,O3,L3,I3,F3,C3) -> 4.9989999999999997
A4: MORTADELA | B4: 7 | C4: 5.4989999999999997 | D4: 27 | E4: 8 | F4: 5.5190000000000001 | G4: 30 | H4: 6 | I4: 5.3639999999999999 | J4: 30 | K4: 4 | L4: 5.2809999999999997 | M4: 32 | N4: 2 | O4: 5.2249999999999996 | P4: 28 | Q4: 1 | R4: 5.3330000000000002 | S4: 30 | T4: 3 | U4: 5.2249999999999996 | V4: 32 | W4: 5 | X4: 5.0049999999999999 | Y4: 26.65 | Z4: =+Y4+V4+S4+P4+M4+J4+G4+D4 -> 235.65 | AA4: =+(X4+U4+R4+O4+L4+I4+F4+C4)/8 -> 5.3063750000000001 | AB4: =MINA(X4,U4,R4,O4,L4,I4,F4,C4) -> 5.0049999999999999
A5: MARCEL | B5: 4 | C5: 5.3339999999999996 | D5: 31 | E5: 2 | F5: 5.3010000000000002 | G5: 31 | H5: 1 | I5: 5.61 | J5: 27 | K5: 3 | L5: 5.28 | M5: 30 | N5: 5 | O5: 5.5 | P5: 26 | Q5: 7 | R5: 5.391 | S5: 26 | T5: 8 | U5: 5.4379999999999997 | V5: 31 | W5: 6 | X5: 5.17 | Y5: 30.22 | Z5: =+Y5+V5+S5+P5+M5+J5+G5+D5 -> 232.22 | AA5: =+(X5+U5+R5+O5+L5+I5+F5+C5)/8 -> 5.3780000000000001 | AB5: =MINA(X5,U5,R5,O5,L5,I5,F5,C5) -> 5.17
A6: SAPAO | B6: 6 | C6: 5.72 | D6: 30 | E6: 4 | F6: 5.6550000000000002 | G6: 29 | H6: 2 | I6: 5.609 | J6: 26 | K6: 1 | L6: 5.9950000000000001 | M6: 22 | N6: 3 | O6: 5.5 | P6: 31 | Q6: 5 | R6: 5.556 | S6: 29 | T6: 7 | U6: 5.6029999999999998 | V6: 29 | W6: 8 | X6: 5.4989999999999997 | Y6: 30.54 | Z6: =+Y6+V6+S6+P6+M6+J6+G6+D6 -> 226.54 | AA6: =+(X6+U6+R6+O6+L6+I6+F6+C6)/8 -> 5.6421250000000001 | AB6: =MINA(X6,U6,R6,O6,L6,I6,F6,C6) -> 5.4989999999999997
A7: MICHEL | B7: 3 | C7: 5.2240000000000002 | D7: 32 | E7: 5 | F7: 5.61 | G7: 24 | H7: 7 | I7: 5.0049999999999999 | J7: 32 | K7: 8 | L7: 5.444 | M7: 31 | N7: 6 | O7: 5.2249999999999996 | P7: 25 | Q7: 4 | R7: 5.39 | S7: 21 | T7: 2 | U7: 5.17 | V7: 29 | W7: 1 | X7: 4.8949999999999996 | Y7: 30.06 | Z7: =+Y7+V7+S7+P7+M7+J7+G7+D7 -> 224.06 | AA7: =+(X7+U7+R7+O7+L7+I7+F7+C7)/8 -> 5.2453749999999992 | AB7: =MINA(X7,U7,R7,O7,L7,I7,F7,C7) -> 4.8949999999999996
A8: MARQUINHO | B8: 5 | C8: 5.774 | D8: 29 | E8: 7 | F8: 5.7750000000000004 | G8: 29 | H8: 8 | I8: 6.05 | J8: 28 | K8: 6 | L8: 5.94 | M8: 24 | N8: 4 | O8: 5.665 | P8: 25 | Q8: 2 | R8: 5.7409999999999997 | S8: 29 | T8: 1 | U8: 5.9329999999999998 | V8: 27 | W8: 3 | X8: 5.5650000000000004 | Y8: 30.39 | Z8: =+Y8+V8+S8+P8+M8+J8+G8+D8 -> 221.39 | AA8: =+(X8+U8+R8+O8+L8+I8+F8+C8)/8 -> 5.8053749999999997 | AB8: =MINA(X8,U8,R8,O8,L8,I8,F8,C8) -> 5.5650000000000004
A9: MANE | B9: 5 | C9: 5.6079999999999997 | D9: 21 | E9: 7 | F9: 5.5549999999999997 | G9: 29 | H9: 8 | I9: 5.335 | J9: 28 | K9: 6 | L9: 5.39 | M9: 27 | N9: 4 | O9: 5.2530000000000001 | P9: 27 | Q9: 2 | R9: 5.39 | S9: 29 | T9: 1 | U9: 5.5549999999999997 | V9: 28 | W9: 3 | X9: 4.6749999999999998 | Y9: 29.65 | Z9: =+Y9+V9+S9+P9+M9+J9+G9+D9 -> 218.65 | AA9: =+(X9+U9+R9+O9+L9+I9+F9+C9)/8 -> 5.3451250000000003 | AB9: =MINA(X9,U9,R9,O9,L9,I9,F9,C9) -> 4.6749999999999998
A10: JERA | B10: 1 | C10: 5.4189999999999996 | D10: 26 | E10: 3 | F10: 5.28 | G10: 31 | H10: 5 | I10: 5.72 | J10: 23 | K10: 7 | L10: 5.39 | M10: 20 | N10: 8 | O10: 5.2839999999999998 | P10: 30 | Q10: 6 | R10: 5.335 | S10: 30 | T10: 4 | U10: 5.1130000000000004 | V10: 30 | W10: 2 | X10: 5.1210000000000004 | Y10: 26.28 | Z10: =+Y10+V10+S10+P10+M10+J10+G10+D10 -> 216.28 | AA10: =+(X10+U10+R10+O10+L10+I10+F10+C10)/8 -> 5.3327499999999999 | AB10: =MINA(X10,U10,R10,O10,L10,I10,F10,C10) -> 5.1130000000000004
A11: RUBAO | B11: 4 | C11: 5.7759999999999998 | D11: 26 | E11: 2 | F11: 6.16 | G11: 26 | H11: 1 | I11: 6.27 | J11: 24 | K11: 3 | L11: 6.1040000000000001 | M11: 28 | N11: 5 | O11: 6.05 | P11: 26 | Q11: 7 | R11: 5.9429999999999996 | S11: 25 | T11: 8 | U11: 5.9880000000000004 | V11: 25 | W11: 6 | X11: 5.8250000000000002 | Y11: 26.52 | Z11: =+Y11+V11+S11+P11+M11+J11+G11+D11 -> 206.52 | AA11: =+(X11+U11+R11+O11+L11+I11+F11+C11)/8 -> 6.0145 | AB11: =MINA(X11,U11,R11,O11,L11,I11,F11,C11) -> 5.7759999999999998
A12: RUDSON | B12: 2 | C12: 6.157 | D12: 27 | E12: 1 | F12: 6.2709999999999999 | G12: 26 | H12: 3 | I12: 6.1029999999999998 | J12: 25 | K12: 5 | L12: 5.859 | M12: 25 | N12: 7 | O12: 6.2149999999999999 | P12: 24 | Q12: 8 | R12: 6.5439999999999996 | S12: 24 | T12: 6 | U12: 6.3239999999999998 | V12: 25 | W12: 4 | X12: 6.1059999999999999 | Y12: 28.26 | Z12: =+Y12+V12+S12+P12+M12+J12+G12+D12 -> 204.26 | AA12: =+(X12+U12+R12+O12+L12+I12+F12+C12)/8 -> 6.197375000000001 | AB12: =MINA(X12,U12,R12,O12,L12,I12,F12,C12) -> 5.859
A13: CHORAO | B13: 7 | C13: 6.27 | D13: 24 | E13: 8 | F13: 6.5990000000000002 | G13: 24 | H13: 6 | I13: 6.27 | J13: 25 | K13: 4 | L13: 6.49 | M13: 23 | N13: 2 | O13: 6.6 | P13: 24 | Q13: 1 | R13: 6.4610000000000003 | S13: 25 | T13: 3 | U13: 6.49 | V13: 24 | W13: 5 | X13: 6.5549999999999997 | Y13: 21.67 | Z13: =+Y13+V13+S13+P13+M13+J13+G13+D13 -> 190.67 | AA13: =+(X13+U13+R13+O13+L13+I13+F13+C13)/8 -> 6.4668749999999999 | AB13: =MINA(X13,U13,R13,O13,L13,I13,F13,C13) -> 6.27
A14: CAMELO | B14: 1 | C14: 6.1589999999999998 | D14: 26 | E14: 3 | F14: 6.0049999999999999 | G14: 27 | H14: 5 | I14: 6.27 | J14: 8 | K14: 7 | L14: 6.0490000000000004 | M14: 25 | N14: 8 | O14: 6.758 | P14: 22 | Q14: 6 | R14: 6.6559999999999997 | S14: 23 | T14: 4 | U14: 6.6470000000000002 | V14: 20 | W14: 2 | X14: 6.4459999999999997 | Y14: 23.28 | Z14: =+Y14+V14+S14+P14+M14+J14+G14+D14 -> 174.28 | AA14: =+(X14+U14+R14+O14+L14+I14+F14+C14)/8 -> 6.3737500000000002 | AB14: =MINA(X14,U14,R14,O14,L14,I14,F14,C14) -> 6.0049999999999999
A15: JOVINO | B15: 3 | C15: 7.92 | D15: 18 | E15: 5 | F15: 7.92 | G15: 19 | H15: 7 | I15: 7.875 | J15: 16 | K15: 8 | L15: 7.4809999999999999 | M15: 6 | N15: 6 | O15: 7.48 | P15: 16 | Q15: 4 | R15: 9.9580000000000002 | S15: 13 | T15: 2 | U15: 9.13 | V15: 11 | W15: 1 | X15: 9.9 | Y15: 1 | Z15: =+Y15+V15+S15+P15+M15+J15+G15+D15 -> 100 | AA15: =+(X15+U15+R15+O15+L15+I15+F15+C15)/8 -> 8.4580000000000002 | AB15: =MINA(X15,U15,R15,O15,L15,I15,F15,C15) -> 7.48